source,url,description,country,company,title
fin_news_nlp/yahoo_cad_tickers_news,https://ca.finance.yahoo.com/news/palo-alto-panw-red-canary-124112638.html,"Palo Alto Networks (PANW) to offer Cortex XDR platform to the MDR solution provider, Red Canary, further strengthening their existing partnership.",CAD,CLS.TO,Zacks - Palo Alto (PANW) & Red Canary Tie Strengthens on Cortex XDR
fin_news_nlp/yahoo_cad_tickers_news,https://ca.finance.yahoo.com/news/ceridian-named-best-place-computerworld-130000831.html,"TORONTO, Dec. 13, 2022 (GLOBE NEWSWIRE) -- Ceridian (NYSE: CDAY; TSX: CDAY), a global leader in human capital management (HCM) technology, has been recognized by Foundry’s Computerworld as a 2023 Best Places to Work in IT. Now in its 29th year, this awards program showcases the IT departments that offer workers great benefits and compensation, along with a stimulating work environment. “At Ceridian, we are inspired to encourage and cultivate diversity of thought in our most critical roles, parti",CAD,CDAY.TO,GlobeNewswire - Ceridian Named a Best Place to Work in IT by Computerworld
fin_news_nlp/yahoo_cad_tickers_news,https://ca.finance.yahoo.com/news/enbridge-partners-celebrate-inauguration-nations-163500447.html,"NORTHAMPTON, MA / ACCESSWIRE / December 13, 2022 / Enbridge Known for its blustery winds, choppy seas and notorious storms, the Bay of Biscay in western France may seem like an unusual place for warm smiles and sunny celebrations-especially in late ...",CAD,ENB.TO,ACCESSWIRE - Enbridge and Partners Celebrate Inauguration of Nation's First Offshore Wind Farm
fin_news_nlp/yahoo_cad_tickers_news,https://ca.finance.yahoo.com/news/trending-stock-energy-fuels-inc-140002042.html,"Zacks.com users have recently been watching Energy Fuels (UUUU) quite a bit. Thus, it is worth knowing the facts that could determine the stock's prospects.",CAD,EFR.TO,Zacks - Is Trending Stock Energy Fuels Inc (UUUU) a Buy Now?
fin_news_nlp/yahoo_cad_tickers_news,https://ca.finance.yahoo.com/news/chibougamau-independent-mines-announces-financings-154800171.html,"ROUYN-NORANDA, Quebec, Dec. 13, 2022 (GLOBE NEWSWIRE) -- Chibougamau Independent Mines Inc. (CBG-TSX-V in Canada, CLL1-Frankfurt, Stuttgart, Berlin and Lang & Schwarz Stock Exchanges in Germany, CMAUF-OTC in the US) announces that it will effect a private placement of a maximum of 2,758,620 “flow-through” common shares at a price of $0.145 per share for maximum gross proceeds to Chibougamau of $400,000. Chibougamau will use the proceeds from the “flow-through” private placement for exploration o",CAD,GMX.TO,GlobeNewswire - Chibougamau Independent Mines Announces Financings
fin_news_nlp/yahoo_cad_tickers_news,https://ca.finance.yahoo.com/news/horizonte-minerals-plc-announces-notice-154500731.html,"announces that CEO, Jeremy Martin and CFO, Simon Retter, will provide a project update to investors via the Investor Meet Company platform on 15 December 2022 at 10:00am GMT.",CAD,HZM.TO,ACCESSWIRE - Horizonte Minerals PLC Announces Notice of Investor Presentation
fin_news_nlp/yahoo_cad_tickers_news,https://ca.finance.yahoo.com/news/laramide-initiates-mexico-drill-program-141400473.html,"Laramide Resources Ltd. (""Laramide"") is pleased to announce the commencement of a diamond drill program at its NRC licensed Crownpoint Uranium Project, near Gallup, New Mexico, USA (""Crownpoint""). The work programs are being managed and executed by NuFuels, Inc., a subsidiary of Laramide Resources Ltd. Crownpoint consists of two discrete ISR-amenable deposits Crownpoint and Churchrock covered by a single NRC licence (sua-1580).",CAD,LAM.TO,CNW Group - Laramide Initiates New Mexico Drill Program
fin_news_nlp/yahoo_cad_tickers_news,https://ca.finance.yahoo.com/news/keystone-oil-pipeline-spill-cleanup-163737052.html,"Cleanup of the biggest U.S. oil spill in nearly a decade will take at least weeks more, local officials in Kansas said on Tuesday, citing a recent meeting with Keystone pipeline owner TC Energy Corp.  TC closed the pipeline after the spill of roughly 14,000 barrels of crude was discovered in a creek on Wednesday in Washington County in Kansas.  ""They told us they expected to be here for several more weeks,"" said Randy Hubbard, Washington County's emergency management coordinator.",CAD,TRP.TO,Reuters - Keystone oil pipeline spill cleanup expected to last weeks -officials
fin_news_nlp/yahoo_cad_tickers_news,https://ca.finance.yahoo.com/news/five-returns-torex-gold-resources-155641717.html,"If you want to compound wealth in the stock market, you can do so by buying an index fund. But in our experience...",CAD,TXG.TO,"Simply Wall St. - The five-year returns for Torex Gold Resources' (TSE:TXG) shareholders have been , yet its earnings growth was even better"
fin_news_nlp/yahoo_cad_tickers_news,https://ca.finance.yahoo.com/news/implied-volatility-surging-yamana-auy-133901619.html,Investors need to pay close attention to Yamana (AUY) stock based on the movements in the options market lately.,CAD,YRI.TO,Zacks - Implied Volatility Surging for Yamana (AUY) Stock Options
fin_news_nlp/yahoo_cad_tickers_news,https://ca.finance.yahoo.com/news/abcourt-announces-mineral-sleeping-giant-145400580.html,"ROUYN-NORANDA, Quebec, Dec. 13, 2022 (GLOBE NEWSWIRE) -- Abcourt Mines Inc. (“Abcourt” or the “Corporation”) (TSX Venture: ABI) is pleased to announce an updated Mineral Resource Estimate (“MRE”) for the Sleeping Giant Mine, a 100% owned high-grade gold deposit located in the Abitibi Greenstone Belt, 80 km north of the city of Amos, Quebec. This MRE reflects the results of approximately 1.19 million meters of drilling, of which 9,281 meters were carried out by Abcourt from 2016 until May 2022, a",CAD,ABI.V, - Abcourt Announces Mineral Resource Update at the Sleeping Giant Mine
fin_news_nlp/yahoo_cad_tickers_news,https://ca.finance.yahoo.com/news/argentum-announces-agm-results-option-153600351.html,"Toronto, Ontario--(Newsfile Corp. - December 13, 2022) - Argentum Silver Corp. (TSXV: ASL) (""Argentum"" or the ""Company"") is pleased to announce voting results for its Annual General and Special Meeting of Shareholders that was held on December 8, 2022 in Toronto.A total of 33,376,505 common shares representing 64.68% of the Company's issued and outstanding shares were voted for the meeting. Shareholders approved all items of business before the AGM including the election of ...",CAD,ASL.V,Newsfile - Argentum Announces AGM Results and Option Grant
fin_news_nlp/yahoo_cad_tickers_news,https://ca.finance.yahoo.com/news/top-rankings-bmo-capital-markets-175800328.html,"BMO Capital Markets' Fixed Income, Currency and Commodities Macro Strategy group has claimed top honours in the Institutional Investor 2022 Global Fixed Income Research Team survey.",CAD,BMO.TO,CNW Group - Top Rankings for BMO Capital Markets' FICC Macro Strategy Group in Institutional Investor Client Survey
fin_news_nlp/yahoo_cad_tickers_news,https://ca.finance.yahoo.com/news/12-return-equity-canacol-energy-181851939.html,"While some investors are already well versed in financial metrics (hat tip), this article is for those who would like...",CAD,CNE.TO,"Simply Wall St. - With A 12% Return On Equity, Is Canacol Energy Ltd (TSE:CNE) A Quality Stock?"
fin_news_nlp/yahoo_cad_tickers_news,https://ca.finance.yahoo.com/news/buy-2-growth-stocks-dip-150000770.html,Shopify (TSX:SHOP) and Constellation Software (TSX:CSU) are two great TSX growth stocks to consider in 2023. The post Buy These 2 Growth Stocks on the Dip appeared first on The Motley Fool Canada.,CAD,CSU.TO,The Motley Fool - Buy These 2 Growth Stocks on the Dip
fin_news_nlp/yahoo_cad_tickers_news,https://ca.finance.yahoo.com/news/top-value-stock-buy-now-163000256.html,"Canadian value investors can consider buying shares of FirstService, which will also provide them exposure to the residential market in North America. The post Here’s My Top Value Stock to Buy Right Now appeared first on The Motley Fool Canada.",CAD,FSV.TO,The Motley Fool - Here’s My Top Value Stock to Buy Right Now
fin_news_nlp/yahoo_cad_tickers_news,https://ca.finance.yahoo.com/news/ig-wealth-management-selects-nesto-130000190.html,"IG Wealth Management (""IG""), part of the IGM Financial Inc. (IGM) (TSX: IGM) family of companies, and nesto today announced that they have entered into a strategic agreement to have nesto provide next generation white label mortgage services to IG clients across Canada through its Mortgage Cloud solution.",CAD,IGM.TO,CNW Group - IG Wealth Management Selects nesto to Help Grow Its Mortgage Business
fin_news_nlp/yahoo_cad_tickers_news,https://ca.finance.yahoo.com/news/stocks-play-laramide-resources-ltd-172700818.html,"Announces the commencement of a diamond drill program at its NRC licensed Crownpoint Uranium Project, ...",CAD,LAM.TO, - Stocks in play: Laramide Resources Ltd
fin_news_nlp/yahoo_cad_tickers_news,https://ca.finance.yahoo.com/news/laramide-initiates-mexico-drill-program-141400675.html,"Laramide Resources Ltd. (""Laramide"") is pleased to announce the commencement of a diamond drill program at its NRC licensed Crownpoint Uranium Project, near Gallup, New Mexico, USA (""Crownpoint""). The work programs are being managed and executed by NuFuels, Inc., a subsidiary of Laramide Resources Ltd. Crownpoint consists of two discrete ISR-amenable deposits Crownpoint and Churchrock covered by a single NRC licence (sua-1580).",CAD,LAM.TO,CNW Group - Laramide Initiates New Mexico Drill Program
fin_news_nlp/yahoo_cad_tickers_news,https://ca.finance.yahoo.com/m/c0c8f770-0b50-354a-81d0-796bb6bffed9/why-nvidia%2C-shopify%2C-and-the.html,"A broad cross-section of stocks roared higher on Tuesday, as market watchers focused on the Federal Reserve Bank's ongoing battle to cool red-hot inflation.  The latest U.S. government data showed that inflation cooled somewhat last month, which could convince the Fed to alter the pace and tenor of its campaign of interest rate hikes, which are designed to battle inflation.  With that as a backdrop, shares of Nvidia (NASDAQ: NVDA) climbed 1.5%, Shopify (NYSE: SHOP) rose 1.2%, and The Trade Desk (NASDAQ: TTD) jumped 3.8%, as of 12:49 p.m. ET.",CAD,SHOP.TO,"Motley Fool - Why Nvidia, Shopify, and The Trade Desk Stocks All Rallied on Tuesday"
fin_news_nlp/yahoo_cad_tickers_news,https://ca.finance.yahoo.com/news/zacks-analyst-blog-highlights-jpmorgan-163204262.html,"JPMorgan Chase, Intel, Advanced Micro Devices, Target and Suncor Energy are included in this Analyst Blog.",CAD,SU.TO,"Zacks - The Zacks Analyst Blog Highlights JPMorgan Chase, Intel, Advanced Micro Devices, Target and Suncor Energy"
fin_news_nlp/yahoo_cad_tickers_news,https://ca.finance.yahoo.com/news/3-top-tsx-tech-stocks-180000802.html,Long-term investors can indeed find value in some TSX tech stocks today. The post 3 Top TSX Tech Stocks That Could Make You Rich by Retirement appeared first on The Motley Fool Canada.,CAD,CSU.TO,The Motley Fool - 3 Top TSX Tech Stocks That Could Make You Rich by Retirement
fin_news_nlp/yahoo_cad_tickers_news,https://ca.finance.yahoo.com/news/2-high-yielding-tsx-stocks-170000418.html,Extendicare stock and NorthWest Healthcare Properties REIT can be excellent high-yielding investments to add to your portfolio today. The post 2 High-Yielding TSX Stocks to Scoop Up Before They Recover appeared first on The Motley Fool Canada.,CAD,EXE.TO,The Motley Fool - 2 High-Yielding TSX Stocks to Scoop Up Before They Recover
fin_news_nlp/yahoo_cad_tickers_news,https://ca.finance.yahoo.com/news/norzinc-announces-closing-plan-arrangement-202100064.html,"NorZinc Ltd. (TSX: NZC) (OTCQB: NORZF) (the ""Company"" or ""NorZinc"") is pleased to announce that NorZinc and RCF VI CAD LLC (""RCF"") have completed the previously announced acquisition by RCF of NorZinc by way of plan of arrangement under Division 5 of Part 9 of the Business Corporations Act (British Columbia) (the ""Arrangement"") effective at 12:01 a.m. (Vancouver time) on December 13, 2022.",CAD,NZC.TO,CNW Group - NorZinc Announces Closing of Plan of Arrangement
fin_news_nlp/yahoo_cad_tickers_news,https://ca.finance.yahoo.com/news/want-1-000-passive-income-173000490.html,"Here’s one of the best TSX dividend stocks that could help you earn $1,000 in monthly passive income. The post Want $1,000 in Passive Income Each Month? Buy 9,284 Shares of This TSX Stock appeared first on The Motley Fool Canada.",CAD,PEY.TO,"The Motley Fool - Want $1,000 in Passive Income Each Month? Buy 9,284 Shares of This TSX Stock"
fin_news_nlp/yahoo_cad_tickers_news,https://ca.finance.yahoo.com/news/2-canadian-small-cap-stocks-183000760.html,"Given their growth potential, here are two small-cap stocks aiming to deliver multi-fold returns over the next 10 years. The post These 2 Canadian Small Cap Stocks Are Rising Stars appeared first on The Motley Fool Canada.",CAD,WELL.TO,The Motley Fool - These 2 Canadian Small Cap Stocks Are Rising Stars
fin_news_nlp/yahoo_cad_tickers_news,https://ca.finance.yahoo.com/news/most-actively-traded-companies-toronto-221251726.html,"TORONTO — Some of the most active companies traded Tuesday on the Toronto Stock Exchange: Toronto Stock Exchange (20,023.46, up 3.76): Barrick Gold Corp. (TSX:ABX). Materials. Up 89 cents, or 3.91 per cent, to $23.66 on 12.4 million shares. Suncor Energy Inc. (TSX:SU). Energy. Up 81 cents, or 1.96 per cent, to $42.16 on 10.5 million shares. Canadian Imperial Bank of Commerce (TSX:CM). Financials. Down $1.15, or two per cent, to $56.45 on 10.1 million shares. Canadian Natural Resources Ltd. (TSX:",CAD,ARX.TO, - Most actively traded companies on the Toronto Stock Exchange
fin_news_nlp/yahoo_cad_tickers_news,https://ca.finance.yahoo.com/news/better-buy-passive-income-bns-213000100.html,These two stocks appear oversold today for investors seeking passive income. The post Better Buy for Passive Income: BNS Stock or TC Energy? appeared first on The Motley Fool Canada.,CAD,BNS.TO,The Motley Fool - Better Buy for Passive Income: BNS Stock or TC Energy?
fin_news_nlp/yahoo_cad_tickers_news,https://ca.finance.yahoo.com/news/brp-further-strengthens-balance-sheet-220000428.html,"BRP (TSX: DOO) (NASDAQ: DOOO) announced today that it obtained an incremental US$500 million term loan from certain new and existing lenders under its term loan credit agreement, which proceeds allowed the full repayment of the existing US$100 million term loan B-2 due 2024 and are also expected to be used to repay the drawn balance under BRP's revolving credit facility, and to pay fees and expenses related to the financing.",CAD,DOO.TO,CNW Group - BRP FURTHER STRENGTHENS ITS BALANCE SHEET FLEXIBILITY WITH AN INCREMENTAL US$500 MILLION TERM LOAN
fin_news_nlp/yahoo_cad_tickers_news,https://ca.finance.yahoo.com/news/1-leading-passive-income-stock-233000970.html,The TSX market saw a correction in December as Canadian energy stocks plunged. Now is the time to buy this undervalued passive income stock. The post 1 Leading Passive Income Stock I’m Buying Hand-Over-Fist Right Now appeared first on The Motley Fool Canada.,CAD,ENB.TO,The Motley Fool - 1 Leading Passive Income Stock I’m Buying Hand-Over-Fist Right Now
fin_news_nlp/yahoo_cad_tickers_news,https://ca.finance.yahoo.com/news/1-oversold-dividend-stock-d-190000828.html,Here are some key reasons why I find this Canadian dividend stock a very attractive buy before the New Year. The post 1 Oversold Dividend Stock I’d Buy Before 2023 appeared first on The Motley Fool Canada.,CAD,GSY.TO,The Motley Fool - 1 Oversold Dividend Stock I’d Buy Before 2023
fin_news_nlp/yahoo_cad_tickers_news,https://ca.finance.yahoo.com/news/liberty-gold-completes-2022-drilling-230000425.html,"0.60 g/t Au over 80.8 m including 1.47 g/t Au over 13.7 m in LBP750 Future process water and access for mine infrastructure secured VANCOUVER, British Columbia, Dec. 13, 2022 (GLOBE NEWSWIRE) -- Liberty Gold Corp. (TSX: LGD; OTCQX: LGDTF) (“Liberty Gold” or the “Company”) is pleased to report new exploration drill results from its Black Pine oxide gold project in southeastern Idaho, together with a summary of 2022 activities. These results form part of a 324 hole, 67,000 metre (“m”) 2022 reverse",CAD,LGD.TO,"GlobeNewswire - Liberty Gold Completes the 2022 Drilling Season with Positive Results and Further De-risking Activities at the Black Pine Oxide Gold Deposit, Idaho"
fin_news_nlp/yahoo_cad_tickers_news,https://ca.finance.yahoo.com/news/maxar-built-galaxy-35-galaxy-223700689.html,"WESTMINSTER, Colo., December 13, 2022--Maxar-built Galaxy 35 and Galaxy 36, developed for Intelsat, have deployed their solar arrays and are receiving and sending signals after launch.",CAD,MAXR.TO,Business Wire - Maxar-built Galaxy 35 and Galaxy 36 Satellites for Intelsat Begin Commissioning Activities On Orbit After Launch
fin_news_nlp/yahoo_cad_tickers_news,https://ca.finance.yahoo.com/news/maxim-power-corp-provides-updates-021000870.html,"CALGARY, Alberta, Dec. 13, 2022 (GLOBE NEWSWIRE) -- Maxim Power Corp. (""MAXIM"" or the ""Corporation"") (TSX: MXG) provides an update regarding the return to service of the Milner 2 (“M2”) facility following the non-injury fire incident (the “Incident”) that occurred on September 30, 2022, a project update on the Combined Cycle Gas Turbine (“CCGT”) expansion of M2, and an update on insurance information related to the Incident. M2 RETURN TO SERVICE UPDATE Following the Incident, MAXIM is continuing",CAD,MXG.TO,"GlobeNewswire - Maxim Power Corp. Provides Updates on the M2 Return to Service, CCGT Expansion Project and Insurance Information"
fin_news_nlp/yahoo_cad_tickers_news,https://ca.finance.yahoo.com/news/why-d-still-buy-nutrien-230000447.html,"Despite showing plenty of volatility this year, Nutrien stock can still be a worthwhile addition to investment portfolios. The post Why I’d Still Buy Nutrien Stock Even Though It’s Down By Almost 30% appeared first on The Motley Fool Canada.",CAD,NTR.TO,The Motley Fool - Why I’d Still Buy Nutrien Stock Even Though It’s Down By Almost 30%
fin_news_nlp/yahoo_cad_tickers_news,https://ca.finance.yahoo.com/news/parkland-corporation-announces-fourth-quarter-220700473.html,"Parkland Corporation (""Parkland"") (TSX: PKI) announces that a dividend of $0.3250 per share will be paid on January 13, 2023, to shareholders of record on December 22, 2022. The dividend will be an 'eligible dividend' for Canadian income tax purposes. The ex-dividend date is December 21, 2022.",CAD,PKI.TO,CNW Group - Parkland Corporation Announces Fourth Quarter 2022 Dividend
fin_news_nlp/yahoo_cad_tickers_news,https://ca.finance.yahoo.com/news/sangoma-technologies-corporation-announces-voting-222400580.html,"TORONTO, Dec. 13, 2022 (GLOBE NEWSWIRE) -- Sangoma Technologies Corporation (TSX: STC; NASDAQ: SANG) (“Sangoma” or the “Company”) announced today the results of voting at its annual general and special meeting of shareholders held on December 13, 2022 (the “Meeting”). Each of the five nominees listed in the Company’s management information circular dated November 1, 2022 provided in connection with the Meeting were elected as directors of the Company. Sangoma received proxies and virtual votes a",CAD,STC.TO,GlobeNewswire - Sangoma Technologies Corporation Announces Voting Results from its Annual General and Special Meeting of Shareholders
fin_news_nlp/yahoo_cad_tickers_news,https://ca.finance.yahoo.com/news/storagevault-announces-150-million-financing-215400608.html,"NOT FOR DISTRIBUTION TO UNITED STATES NEWSWIRE SERVICES OR FOR DISSEMINATION IN THE UNITED STATES TORONTO, Dec. 13, 2022 (GLOBE NEWSWIRE) -- STORAGEVAULT CANADA INC. (“StorageVault”) (SVI-TSX) is pleased to announce that it has entered into an agreement with a syndicate of underwriters (the “Underwriters”) led by Scotiabank, under which the Underwriters have agreed to purchase $100 million aggregate principal amount of convertible senior unsecured debentures due March 31, 2028 (the “Debentures”)",CAD,SVI.TO,GlobeNewswire - StorageVault Announces $150 Million Financing of 5.00% Convertible Senior Unsecured Debentures
fin_news_nlp/yahoo_cad_tickers_news,https://ca.finance.yahoo.com/news/oil-steadies-two-day-rally-001215160.html,"(Bloomberg) -- Oil edged lower ahead of a decision on monetary policy from the Federal Reserve after rallying 6% over the previous two sessions.Most Read from BloombergMusk Loses World’s Richest Title to Arnault With Tesla UnwindingApple to Allow Outside App Stores in Overhaul Spurred by EU LawsElon Musk Is Ruining Trump’s Presidential CampaignUS Core Inflation Slows, Giving Fed Some Breathing Room on RatesTesla Stock Has Never Been This Cheap — And It Could Still Drop FurtherUS consumer prices",CAD,TRP.TO,Bloomberg - Oil Steadies After Two-Day Rally Ahead of Fed Rate Decision
fin_news_nlp/yahoo_cad_tickers_news,https://ca.finance.yahoo.com/news/valens-company-granted-additional-180-233000808.html,"The Valens Company Inc. (TSX: VLNS) (Nasdaq: VLNS) (the ""Company"", ""The Valens Company"" or ""Valens""), a leading manufacturer of cannabis products, announced today it received an extension of 180 calendar days from the Nasdaq Stock Market LLC (""Nasdaq"") to regain compliance with the Nasdaq's minimum $1.00 bid price requirement set forth in Nasdaq Listing Rule 5550(a)(2) for continued listing on the Nasdaq Capital Market (the ""Bid Price Requirement""), following the expiration of the initial 180 ca",CAD,VLNS.TO,CNW Group - The Valens Company Granted Additional 180 Calendar Day Grace Period by Nasdaq to Regain Compliance with Minimum Bid Price Rule
fin_news_nlp/yahoo_cad_tickers_news,https://ca.finance.yahoo.com/news/better-buy-td-stock-telus-193000424.html,Bank stocks and telecom stocks appear oversold. Should TD stock or Telus stock be on your buy list? The post Better Buy: TD Stock or Telus? appeared first on The Motley Fool Canada.,CAD,TD.TO,The Motley Fool - Better Buy: TD Stock or Telus?
fin_news_nlp/yahoo_cad_tickers_news,https://ca.finance.yahoo.com/news/3-dividend-stocks-buy-now-230000919.html,The market is full of great dividend stocks to buy and hold. Here are three dividend stocks to buy now under $50 for your portfolio. The post 3 Dividend Stocks to Buy Now Under $50 appeared first on The Motley Fool Canada.,CAD,RNW.TO,The Motley Fool - 3 Dividend Stocks to Buy Now Under $50
fin_news_nlp/yahoo_cad_tickers_news,https://ca.finance.yahoo.com/news/triple-flag-signs-definitive-agreements-223000867.html,"TORONTO, December 13, 2022--Triple Flag Precious Metals Corp. (with its subsidiaries, ""Triple Flag"" or the ""Company"") (TSX: TFPM, NYSE: TFPM) announced today that its wholly owned subsidiaries have entered into definitive agreements for the acquisition of the previously announced A$10 million gross revenue return (""GRR"") and US$80 million gold and silver stream (""Stream"") on the Prieska Copper-Zinc Mine with Orion Minerals Ltd. (""Orion""). Closing of the GRR is subject to obtaining exchange contr",CAD,TFPM.TO, - Triple Flag Signs Definitive Agreements for Acquisition of Gross Revenue Return and Stream on Prieska
fin_news_nlp/yahoo_cad_tickers_news,https://ca.finance.yahoo.com/news/buy-tsx-stock-deal-everyone-000000951.html,This TSX stock consistently grows its sales and has an average analyst target price more than 200% higher than where it trades today. The post Buy This TSX Stock Deal (Before Everyone Else Does) appeared first on The Motley Fool Canada.,CAD,WELL.TO,The Motley Fool - Buy This TSX Stock Deal (Before Everyone Else Does)
fin_news_nlp/yahoo_cad_tickers_news,https://ca.finance.yahoo.com/news/valens-company-granted-additional-180-233000820.html,"The Valens Company Inc. (TSX: VLNS) (Nasdaq: VLNS) (the ""Company"", ""The Valens Company"" or ""Valens""), a leading manufacturer of cannabis products, announced today it received an extension of 180 calendar days from the Nasdaq Stock Market LLC (""Nasdaq"") to regain compliance with the Nasdaq's minimum $1.00 bid price requirement set forth in Nasdaq Listing Rule 5550(a)(2) for continued listing on the Nasdaq Capital Market (the ""Bid Price Requirement""), following the expiration of the initial 180 ca",CAD,VLNS.TO,CNW Group - The Valens Company Granted Additional 180 Calendar Day Grace Period by Nasdaq to Regain Compliance with Minimum Bid Price Rule
fin_news_nlp/yahoo_cad_tickers_news,https://ca.finance.yahoo.com/news/genesis-land-development-corp-announces-100000162.html,"Genesis Land Development Corp. (the ""Company"" or ""Genesis"") (TSX: GDC) is pleased to announce that the Toronto Stock Exchange (TSX) has accepted a notice filed by Genesis to initiate a Normal Course Issuer Bid (""Bid"") for a one year period. The Bid will commence on December 16, 2022 and will terminate on the earlier of: (i) December 15, 2023; and (ii) the date on which the maximum number of Genesis common shares (""Common Shares"") that may be purchased pursuant to the Bid have been purchased. Pur",CAD,GDC.TO,CNW Group - Genesis Land Development Corp. Announces Normal Course Issuer Bid
fin_news_nlp/yahoo_cad_tickers_news,https://ca.finance.yahoo.com/news/adf-group-wins-major-contracts-120000394.html,"The management of ADF GROUP INC. (""ADF"" or the ""Corporation"") (TSX: DRX), a North American leader in the fabrication of steel superstructures, is proud to announce the signing of new major contracts in the industrial, transportation and public infrastructure sectors worth a total of $228 million.",CAD,DRX.TO,CNW Group - ADF GROUP WINS MAJOR NEW CONTRACTS WITH A TOTAL VALUE OF $228 MILLION
