source,url,description,country,company,title
fin_news_nlp/yahoo_cad_tickers_news,https://ca.finance.yahoo.com/news/waterberg-joint-venture-establishes-pre-100000746.html,"Infill Drilling Program and Definitive Feasibility Study Update Planned Vancouver, British Columbia and Johannesburg, South Africa--(Newsfile Corp. - October 20, 2022) - Platinum Group Metals Ltd. (TSX: PTM) (NYSE American: PLG) (""Platinum Group"", ""PTM"" or the ""Company"") reports that Waterberg JV Resources (Pty) Ltd. (""Waterberg JV Co."") has approved in principle a Rand 380 million (approx. US $21.0 million) pre-construction work program (the ""Work Program"") for the Waterberg Project, focused on",CAD,PTM.TO,Newsfile - Waterberg Joint Venture Establishes a Pre-Construction Readiness Program for Waterberg PGM Project
fin_news_nlp/yahoo_cad_tickers_news,https://ca.finance.yahoo.com/news/acuityads-announces-date-third-quarter-120000124.html,"TORONTO and NEW YORK, Oct. 20, 2022 (GLOBE NEWSWIRE) -- AcuityAds Holdings Inc. (TSX:AT, Nasdaq: ATY) (“AcuityAds” or “Company”), a technology leader that provides targeted digital media solutions enabling advertisers to connect intelligently with audiences across advertising channels, is pleased to announce that it will report its third quarter 2022 financial results before market open on Thursday, November 10th, 2022. The Company will host a live video webcast to discuss the results on Thursda",CAD,AT.TO,GlobeNewswire - AcuityAds Announces Date for Third Quarter 2022 Financial Results Video Conference Call
fin_news_nlp/yahoo_cad_tickers_news,https://ca.finance.yahoo.com/news/aritzia-host-investor-day-october-130000146.html,"Aritzia Inc. (TSX: ATZ) will host an Investor Day on Thursday, October 27, 2022 in Vancouver. At the event, CEO Jennifer Wong and other members of Aritzia's senior leadership team will provide an overview of the Company's strategic growth plan, key initiatives and long-term financial outlook.",CAD,ATZ.TO,"CNW Group - Aritzia to Host Investor Day on October 27, 2022"
fin_news_nlp/yahoo_cad_tickers_news,https://ca.finance.yahoo.com/news/aura-begins-trading-otcqx-united-112500068.html,"ROAD TOWN, British Virgin Islands, Oct. 20, 2022 (GLOBE NEWSWIRE) -- Aura Minerals Inc. (TSX: ORA) (B3: AURA33) (OTCQX: ORAAF) (“Aura” or the “Company”) is pleased to announce that OTC Markets Group Inc., operator of regulated markets for trading 12,000 U.S. and international securities, has qualified Aura to trade on the OTCQX® Best Market. Aura has been upgraded to the OTCQX from the Pink® market and begins trading under the new symbol “ORAAF”. Rodrigo Barbosa, President and CEO of Aura, comme",CAD,ORA.TO,GlobeNewswire - Aura Begins Trading on the OTCQX in the United States
fin_news_nlp/yahoo_cad_tickers_news,https://ca.finance.yahoo.com/news/otc-markets-group-welcomes-aura-110000309.html,"NEW YORK, Oct. 20, 2022 (GLOBE NEWSWIRE) -- OTC Markets Group Inc. (OTCQX: OTCM), operator of regulated markets for trading 12,000 U.S. and international securities, today announced Aura Minerals Inc. (TSX: ORA; OTCQX: ORAAF), a mid-tier gold and copper production company, has qualified to trade on the OTCQX® Best Market. Aura Minerals Inc. upgraded to OTCQX from the Pink® market. Aura Minerals Inc. begins trading today on OTCQX under the symbol “ORAAF.” U.S. investors can find current financial",CAD,ORA.TO,GlobeNewswire - OTC Markets Group Welcomes Aura Minerals Inc. to OTCQX
fin_news_nlp/yahoo_cad_tickers_news,https://ca.finance.yahoo.com/news/bmos-banking-main-street-businesses-130000994.html,"Despite the Canadian economy slowing, and a possible downturn into 2023, many of Canada's businesses have put the worst of the COVID-19 pandemic period behind them and have an opportunity to bring innovation to the fore to continue their success, according to this year's Banking on Main Street from BMO Economics and BMO Business Banking.",CAD,BMO.TO,CNW Group - BMO's Banking on Main Street: Businesses Who Innovate Are Best Positioned to Navigate Economic Uncertainty
fin_news_nlp/yahoo_cad_tickers_news,https://ca.finance.yahoo.com/news/bmo-global-asset-management-announces-123000883.html,"BMO Global Asset Management today announced the October 2022 cash distributions for BMO Exchange Traded Funds (BMO ETFs) and ETF Series units of the BMO Mutual Funds (ETF Series) that distribute monthly. Unitholders of record of the BMO ETFs and ETF Series at the close of business on October 28, 2022 may receive cash distributions payable on November 2, 2022.",CAD,BMO.TO,CNW Group - BMO Global Asset Management Announces Cash Distributions for Certain BMO Exchange Traded Funds and ETF Series
fin_news_nlp/yahoo_cad_tickers_news,https://ca.finance.yahoo.com/news/canadian-banc-corp-monthly-dividend-130000165.html,"TORONTO, Oct. 20, 2022 (GLOBE NEWSWIRE) -- Canadian Banc Corp. (The ""Company"") declares its monthly distribution of $0.16088 for each Class A share and $0.05792 for each Preferred share. Distributions are payable November 10, 2022 to shareholders on record as at October 31, 2022. Under the distribution policy announced in November 2021, the monthly dividend payable on the Class A shares is determined by applying a 15% annualized rate on the volume weighted average market price (VWAP) of the Clas",CAD,BK.TO,GlobeNewswire - CANADIAN BANC CORP. Monthly Dividend Declaration for Class A & Preferred Share
fin_news_nlp/yahoo_cad_tickers_news,https://ca.finance.yahoo.com/news/canadian-life-companies-split-corp-130000994.html,"TORONTO, Oct. 20, 2022 (GLOBE NEWSWIRE) -- Canadian Life Companies Split Corp. (The ""Company"") declares its monthly distribution of $0.06208 for each Preferred share ($0.745 annually). Distributions are payable November 10, 2022 to shareholders on record as at October 31, 2022. There will not be a distribution paid to the Class A Shares for October 31, 2022 as per the Prospectus which states no regular monthly dividends will be paid on the Class A shares in any month as long as the net asset val",CAD,LFE.TO,GlobeNewswire - Canadian Life Companies Split Corp. Preferred Dividend Declared
fin_news_nlp/yahoo_cad_tickers_news,https://ca.finance.yahoo.com/news/canagold-announces-results-special-general-113000201.html,"Canagold Resources Ltd. (TSX:CCM)(OTCQB:CRCUF)(Frankfurt:CANA) (""Canagold"" or the ""Company"") wishes to announce that at its Special General Meeting (""SGM"") of shareholders held on October 17, 2022, the resolution to create a new control person (20% holder) of the Company (the ""Resolution"") was approved by disinterested shareholders.",CAD,CCM.TO,"ACCESSWIRE - Canagold Announces Results of Special General Meeting of Shareholders, Closing of $1.5M in Charity Flow Through Financing"
fin_news_nlp/yahoo_cad_tickers_news,https://ca.finance.yahoo.com/news/commerce-split-monthly-dividend-declared-130000889.html,"TORONTO, Oct. 20, 2022 (GLOBE NEWSWIRE) -- New Commerce Split (The ""Company"") declares its monthly distribution of $0.02500 per share ($0.30 annually), for Class I Preferred shareholders (YCM.PR.A), and $0.03125 per share ($0.375 annually) for Class II Preferred shareholders (YCM.PR.B). The Class I Preferred share dividends are paid at an annual rate of 6.00% based on the $5 repayment amount. Class II Preferred share dividends are paid at an annual rate of 7.50% based on their $5 repayment amoun",CAD,YCM.TO,GlobeNewswire - COMMERCE SPLIT Monthly Dividend Declared for Class I and Class II Preferred Shares
fin_news_nlp/yahoo_cad_tickers_news,https://ca.finance.yahoo.com/news/coveos-2022-holiday-report-reveals-110000953.html,"55% U.S. and U.K. respondents cite poor fit as top reason for returns, followed by unmet product expectations and bad quality 2022 Holiday Shopping Report: Habits, Trends and Motivators 2022 Holiday Shopping Report: Habits, Trends and Motivators MONTREAL and LONDON and SAN FRANCISCO, Oct. 20, 2022 (GLOBE NEWSWIRE) -- Coveo (TSX:CVO), a leader in retail AI that helps to transform search, recommendations, and personalization within digital experiences, today announced a new report which provides i",CAD,CVO.TO,"GlobeNewswire - Coveo's 2022 Holiday Report Reveals Consumers Still Planning to Shop Online, with 50% Choosing Fashion as the Top Retail Category"
fin_news_nlp/yahoo_cad_tickers_news,https://ca.finance.yahoo.com/news/dividend-15-split-corp-monthly-130000753.html,"TORONTO, Oct. 20, 2022 (GLOBE NEWSWIRE) -- Dividend 15 Split Corp. declares its monthly distribution of $0.10000 for each Class A share ($1.20 annualized) and $0.04583 for each Preferred share ($0.550 annually). Distributions are payable November 10, 2022 to shareholders on record as at October 31, 2022. Since inception Class A shareholders have received a total of $25.40 per share and Preferred shareholders have received a total of $9.85 per share inclusive of this distribution, for a combined",CAD,DFN.TO,GlobeNewswire - Dividend 15 Split Corp. Monthly Dividend Declaration for Class A & Preferred Share
fin_news_nlp/yahoo_cad_tickers_news,https://ca.finance.yahoo.com/news/dividend-15-split-corp-ii-130000151.html,"TORONTO, Oct. 20, 2022 (GLOBE NEWSWIRE) -- Dividend 15 Split Corp. II (""Dividend 15 II"") declares its regular monthly distribution of $0.04792 for each Preferred share. Distributions are payable November 10, 2022 to shareholders on record as at October 31, 2022. There will not be a distribution paid to the Class A Shares for October 31, 2022 as per the Prospectus which states no regular monthly dividends will be paid on the Class A shares in any month as long as the net asset value per unit is e",CAD,DF.TO,GlobeNewswire - Dividend 15 Split Corp. II Regular Monthly Dividend Declaration for Preferred Share
fin_news_nlp/yahoo_cad_tickers_news,https://ca.finance.yahoo.com/news/dividend-select-15-corp-declares-130000387.html,"TORONTO, Oct. 20, 2022 (GLOBE NEWSWIRE) -- Dividend Select 15 Corp. (The ""Company"") declares its monthly distribution of $0.06717 per Equity share. The distribution is payable November 10, 2022 to shareholders on record as of October 31, 2022. Under the distribution policy announced in September 2014, the monthly dividend payable on the Equity shares is determined by applying a 10.00% annualized rate on the volume weighted average market price (VWAP) of the Equity shares over the last 3 trading",CAD,DS.TO,GlobeNewswire - Dividend Select 15 Corp. Declares Monthly Dividend
fin_news_nlp/yahoo_cad_tickers_news,https://ca.finance.yahoo.com/news/financial-15-split-corp-monthly-130000615.html,"TORONTO, Oct. 20, 2022 (GLOBE NEWSWIRE) -- Financial 15 Split Corp. (""Financial 15"") declares its regular monthly distribution of $0.12570 for each Class A share ($1.51 annualized) and $0.05625 for each Preferred share ($0.675 annually). Distributions are payable November 10, 2022 to shareholders on record as at October 31, 2022. Since inception Class A shareholders have received a total of $23.30 per share and Preferred shareholders have received a total of $10.32 per share inclusive of this di",CAD,FTN.TO,GlobeNewswire - Financial 15 Split Corp. Monthly Dividend Declaration for Class A & Preferred Share
fin_news_nlp/yahoo_cad_tickers_news,https://ca.finance.yahoo.com/news/fission-uranium-present-2022-td-160700617.html,"FISSION URANIUM CORP. (""Fission"" or ""the Company"") is pleased to announce that Ross McElroy, President and CEO of Fission Uranium, will be presenting at the upcoming 2022 TD Securities Virtual Uranium Roundtable (the 'Roundtable"") on Wednesday, October 12, 2022, at 3:10pm EST.",CAD,FCU.TO,CNW Group - Fission Uranium to present at the 2022 TD Securities Virtual Uranium Roundtable
fin_news_nlp/yahoo_cad_tickers_news,https://ca.finance.yahoo.com/news/flo-teams-imperial-support-canada-115500602.html,"CALGARY, Alberta, October 20, 2022--FLO and Imperial announced a unique collaboration that will support Canada’s net zero greenhouse gas emissions goals.",CAD,IMO.TO,Business Wire - FLO teams with Imperial to support Canada’s emissions reduction goals
fin_news_nlp/yahoo_cad_tickers_news,https://ca.finance.yahoo.com/news/intelgenx-announces-issuance-u-patent-123000695.html,"SAINT LAURENT, Quebec, Oct. 20, 2022 (GLOBE NEWSWIRE) -- IntelGenx Corp. (TSX:IGX) (OTCQB:IGXT) (the ""Company"" or ""IntelGenx""), a leader in pharmaceutical films, today announced that the United States Patent and Trademark Office (USPTO) issued U.S. Patent No. 11,471,406 to IntelGenx, with claims for modulating drug absorption in oral film dosage form designed for sublingual administration of various pharmaceuticals, including some cannabinoids. This, the latest in a series of patents recently gr",CAD,IGX.TO,GlobeNewswire - IntelGenx Announces Issuance of New U.S. Patent Covering VersaFilm® Technology
fin_news_nlp/yahoo_cad_tickers_news,https://ca.finance.yahoo.com/news/supply-chain-conference-focuses-real-110000872.html,"OTTAWA, Ontario, October 20, 2022--Kinaxis® Inc. (TSX: KXS), the authority in driving agility for fast, confident decision-making in an unpredictable world, will host its Big Ideas in Supply Chain Summit 2022, Oct. 26, 2022. The event is free and will feature an impressive lineup of industry speakers who will take the stage for a virtual event streamed live from Kinaxis’ HQ in Ottawa, Ontario.",CAD,KXS.TO,Business Wire - Supply Chain Conference Focuses on Real-World Best Practice Case Studies to Build Agility and Resilience Through Better Planning
fin_news_nlp/yahoo_cad_tickers_news,https://ca.finance.yahoo.com/news/loblaw-bolsters-employee-mental-health-110000222.html,"LifeSpeak (TSX: LSPK), an integrated, whole-person- wellbeing platform for employers, health plans, and insurance companies, announced today that it has been selected by Loblaw Companies Limited (TSX: L) (""Loblaw"") to provide bilingual, expert-led digital mental health and wellbeing education to its workforce of more than 200,000 colleagues and their families. This new support initiative gives users unlimited and confidential access to the LifeSpeak solution.",CAD,LSPK.TO,CNW Group - Loblaw Bolsters Employee Mental Health Support and Wellbeing Education Program with LifeSpeak
fin_news_nlp/yahoo_cad_tickers_news,https://ca.finance.yahoo.com/news/manulife-shoppers-drug-mart-collaborate-130000826.html,"Today, Manulife enhanced its industry-leading Specialty Drug Care program by announcing the addition of a new collaboration with Shoppers Drug Mart, Canada's leading pharmacy retailer.",CAD,MFC.TO,CNW Group - Manulife and Shoppers Drug Mart collaborate to help manage serious medical conditions
fin_news_nlp/yahoo_cad_tickers_news,https://ca.finance.yahoo.com/news/media-advisory-mda-hold-third-121500128.html,"MDA Ltd. (TSX: MDA), a leading provider of advanced technology and services to the rapidly-expanding global space industry, today announced that it will release its third quarter 2022 financial results before markets open on Friday, November 11, 2022. MDA's management team will host a conference call and webcast to discuss these results at 8:30 a.m. ET on Friday, November 11, 2022.",CAD,MDA.TO,"CNW Group - MEDIA ADVISORY - MDA TO HOLD ITS THIRD QUARTER 2022 EARNINGS CONFERENCE CALL ON NOVEMBER 11, 2022"
fin_news_nlp/yahoo_cad_tickers_news,https://ca.finance.yahoo.com/news/mullen-group-reports-38m-third-110205908.html,"OKOTOKS, Alta. — Mullen Group Ltd. reported its third-quarter profit more than doubled compared with a year ago as its revenue rose nearly 20 per cent. The trucking and logistics company says it earned net income of $38.0 million or 39 cents per diluted share for the quarter ended Sept. 30. The result was up from a profit of $17.5 million or 18 cents per diluted share in the same quarter last year. Revenue for the three-month period totalled $518.4 million, up from $432.5 million a year earlier.",CAD,MTL.TO,"The Canadian Press - Mullen Group reports $38M third-quarter profit, up from $17.5M a year ago"
fin_news_nlp/yahoo_cad_tickers_news,https://ca.finance.yahoo.com/news/north-american-financial-15-split-130000742.html,"TORONTO, Oct. 20, 2022 (GLOBE NEWSWIRE) -- North American Financial 15 Split Corp. (The ""Company"") declares its regular monthly distribution of $0.05625 for each Preferred share ($0.675 annually). Distributions are payable November 10, 2022 to shareholders on record as at October 31, 2022. There will not be a distribution paid to the Class A Shares for October 31, 2022 as per the Prospectus which states no regular monthly dividends will be paid on the Class A shares in any month as long as the n",CAD,FFN.TO,GlobeNewswire - North American Financial 15 Split Corp. Regular Monthly Dividend Declaration for Preferred Share
fin_news_nlp/yahoo_cad_tickers_news,https://ca.finance.yahoo.com/news/prime-dividend-corp-monthly-dividend-130000898.html,"TORONTO, Oct. 20, 2022 (GLOBE NEWSWIRE) -- Prime Dividend Corp. (The ""Company"") declares its monthly distribution of $0.06500 for each Preferred share. Distributions are payable November 10, 2022 to shareholders on record as at October 31, 2022. There will not be a distribution paid to the Class A Shares for October 31, 2022 as per the Prospectus which states no regular monthly dividends will be paid on the Class A shares in any month as long as the net asset value per unit is equal to or less t",CAD,PDV.TO,GlobeNewswire - Prime Dividend Corp. Monthly Dividend Declaration for Preferred Share
fin_news_nlp/yahoo_cad_tickers_news,https://ca.finance.yahoo.com/news/rbc-ishares-expands-line-fixed-120500442.html,"Today, RBC iShares expanded its exchange traded fund (""ETF"") lineup with the launch of two new RBC Target Maturity Corporate Bond ETFs. The new fixed income ETFs, managed by RBC Global Asset Management Inc. (""RBC GAM Inc.""), will begin trading on the Toronto Stock Exchange today.",CAD,RY.TO,CNW Group - RBC iShares expands line-up of fixed income ETFs
fin_news_nlp/yahoo_cad_tickers_news,https://ca.finance.yahoo.com/news/savaria-declares-monthly-dividend-114500725.html,"LAVAL, Quebec, Oct. 20, 2022 (GLOBE NEWSWIRE) -- Savaria Corporation (“Savaria”) (TSX: SIS) a global leader in the accessibility industry, declared today a dividend of 4.33 cents ($0.0433) per common share, in accordance with its monthly dividend policy, payable on November 10, 2022, to shareholders of record of the Corporation at the close of business on October 31, 2022. This is an eligible dividend within the meaning of the Income Tax Act. About Savaria Corporation Savaria Corporation (savari",CAD,SIS.TO,GlobeNewswire - Savaria Declares Monthly Dividend
fin_news_nlp/yahoo_cad_tickers_news,https://ca.finance.yahoo.com/news/snc-lavalin-contributes-strengthening-quebecs-114500377.html,"SNC-Lavalin (TSX: SNC), a fully integrated professional services and project management company with offices around the world, today announces it has been awarded a series of three contracts with the Société Québécoise des infrastructures (Quebec Infrastructure Corporation), to strengthen hospital infrastructure at sites across Quebec. Major expansion and redevelopment work will take place at the Hospital of Chicoutimi, Sept-Îles Hospital, and the Charles Le Moyne Hospital. A central focus of th",CAD,SNC.TO,"CNW Group - SNC-Lavalin Contributes to Strengthening Quebec's Hospital Infrastructure, Securing a Series of Contracts"
fin_news_nlp/yahoo_cad_tickers_news,https://ca.finance.yahoo.com/news/tc-energy-trp-develop-rng-112811357.html,The $29.3 million investment in the Jack Daniel facility is TC Energy's (TRP) first in the production of renewable natural gas.,CAD,TRP.TO,Zacks - TC Energy (TRP) to Develop RNG Plant at Jack Daniel Distillery
fin_news_nlp/yahoo_cad_tickers_news,https://ca.finance.yahoo.com/news/tdb-split-corp-regular-monthly-130000105.html,"TORONTO, Oct. 20, 2022 (GLOBE NEWSWIRE) -- TDb Split Corp. (""TDb Split"") declares its regular monthly distribution of $0.05000 for each Class A share ($0.60 annualized) and $0.04375 for each Preferred share ($0.525 annually). Distributions are payable November 10, 2022 to shareholders on record as at October 31, 2022. Since inception, Class A shareholders have received a total of $7.50 per share and Preferred shareholders have received a total of $8.00 per share inclusive of this distribution, f",CAD,XTD.TO,GlobeNewswire - TDb Split Corp. Regular Monthly Dividend Declaration for Class A & Preferred Share
fin_news_nlp/yahoo_cad_tickers_news,https://ca.finance.yahoo.com/news/tree-island-steel-issue-third-120000353.html,"VANCOUVER, British Columbia, Oct. 20, 2022 (GLOBE NEWSWIRE) -- Tree Island Steel Ltd. (""Tree Island"" or the ""Company"") (TSX: TSL) is pleased to announce that it will report its third quarter financial results for the period ended September 30, 2022, after market hours on Thursday, November 10, 2022. About Tree Island SteelTree Island Steel, headquartered in Richmond, British Columbia, since 1964, through its four operating facilities in Canada and the United States, produces wire products for a",CAD,TSL.TO,"GlobeNewswire - Tree Island Steel to Issue Third Quarter 2022 Financial Results on November 10, 2022"
fin_news_nlp/yahoo_cad_tickers_news,https://ca.finance.yahoo.com/news/tucows-announces-timing-q3-2022-113000535.html,"Tucows Inc. (NASDAQ: TCX) (TSX: TC) today announced that it will report its third quarter 2022 financial results via news release on Thursday, November 3, 2022 at 5:05 p.m. ET.",CAD,TC.TO,"CNW Group - Tucows Announces Timing for Q3 2022 Financial Results News Release and Management Commentary: Thursday, November 3, 2022 at 5:05 p.m. ET"
fin_news_nlp/yahoo_cad_tickers_news,https://ca.finance.yahoo.com/news/uni-select-inc-details-2022-110000448.html,"Uni-Select Inc. (TSX: UNS) will release results for its third quarter of fiscal year 2022, ended September 30, 2022, on Friday, November 4, 2022 before the markets open. Management will host a conference call to discuss results and answer questions at 8:00 AM Eastern Time.",CAD,UNS.TO,CNW Group - Uni-Select Inc. - Details for 2022 Third Quarter Results Conference Webcast
fin_news_nlp/yahoo_cad_tickers_news,https://ca.finance.yahoo.com/news/us-financial-15-split-corp-130000585.html,"TORONTO, Oct. 20, 2022 (GLOBE NEWSWIRE) -- US Financial 15 Split Corp. (""US Financial 15"") declares its monthly distribution of $0.05200 for each Preferred share, or 10.00% annually based on the previous month end net asset value. Distributions are payable November 10, 2022 to shareholders on record as at October 31, 2022. US Financial 15 invests in a portfolio consisting of 15 U.S. financial services companies as follows: American Express, Bank of America, Bank of New York Mellon Corp., Citigro",CAD,FTU.TO,GlobeNewswire - US Financial 15 Split Corp. Preferred Dividend Declared
fin_news_nlp/yahoo_cad_tickers_news,https://ca.finance.yahoo.com/news/well-health-technologies-present-ld-110000343.html,"Vancouver, British Columbia--(Newsfile Corp. - October 20, 2022) - WELL Health Technologies Corp. (TSX: WELL) (OTCQX: WHTCF), a practitioner focused digital health company that is positively impacting health outcomes by leveraging technology to empower healthcare practitioners and their patients globally, is pleased to announce that Hamed Shahbazi, Chairman and CEO of WELL, will be presenting and participating at the 15th annual LD Micro Main Event The LD Micro Invitational XII will take place a",CAD,WELL.TO, - WELL Health Technologies to Present at the LD Micro Main Event
fin_news_nlp/yahoo_cad_tickers_news,https://ca.finance.yahoo.com/news/adamera-drills-sulfide-zones-first-130634772.html,"Vancouver, B.C. - TheNewswire - October 20, 2022 - Adamera Minerals Corp. (TSXV:ADZ); (OTC:DDNFF) announces the intersection of sulfide zones in three separate targets on the Buckhorn 2.0 gold pro...",CAD,ADZ.V, - Adamera Drills Sulfide Zones on First Three Buckhorn 2.0 Gold Targets Tested
fin_news_nlp/yahoo_cad_tickers_news,https://ca.finance.yahoo.com/news/scotiabank-announces-2022-net-zero-130000468.html,"Scotiabank is proud to announce the 10 winners of its global 2022 Net-Zero Research Fund. The Fund was established in 2021 as part of Scotiabank's commitment to becoming a net-zero bank by 2050, including achieving net-zero operations by 2030; mobilizing $350 billion in capital for climate-related finance by 2030; and committing $25 million over 10 years in community investments to support non-profit and charitable partnerships that enable systems change and decarbonization.",CAD,BNS.TO,CNW Group - Scotiabank Announces 2022 Net-Zero Research Fund Winners to Advance Low-Carbon Transition
fin_news_nlp/yahoo_cad_tickers_news,https://ca.finance.yahoo.com/news/crescent-point-cpg-report-q3-115611982.html,Crescent Point Energy's (CPG) lower production and upward cost trajectory is likely to have dented its third-quarter results.,CAD,CPG.TO,Zacks - Crescent Point (CPG) to Report Q3 Results: What's in Store?
fin_news_nlp/yahoo_cad_tickers_news,https://ca.finance.yahoo.com/news/first-quantum-minerals-ltd-tse-132648280.html,First Quantum Minerals (TSE:FM) has had a great run on the share market with its stock up by a significant 16% over the...,CAD,FM.TO,Simply Wall St. - First Quantum Minerals Ltd.'s (TSE:FM) Stock's On An Uptrend: Are Strong Financials Guiding The Market?
fin_news_nlp/yahoo_cad_tickers_news,https://ca.finance.yahoo.com/news/heres-why-imperial-oil-imo-134001921.html,The Zacks Style Scores offers investors a way to easily find top-rated stocks based on their investing style. Here's why you should take advantage.,CAD,IMO.TO,Zacks - Here's Why Imperial Oil (IMO) is a Strong Value Stock
