source,url,description,country,company,title
fin_news_nlp/yahoo_cad_tickers_news,https://ca.finance.yahoo.com/news/tfsa-passive-income-2-oversold-201500283.html,Top TSX dividend stocks are on sale for retirees seeking TFSA passive income. The post TFSA Passive Income: 2 Oversold TSX Dividend Stocks for Retirees to Buy Now appeared first on The Motley Fool Canada.,CAD,BCE.TO,The Motley Fool - TFSA Passive Income: 2 Oversold TSX Dividend Stocks for Retirees to Buy Now
fin_news_nlp/yahoo_cad_tickers_news,https://ca.finance.yahoo.com/news/beginners-3-top-canadian-stocks-194846100.html,"Given their growth prospects and stable cash flows, these three companies are ideal investments for beginners. The post Beginners: Here are 3 Top Canadian Stocks to Buy Right Now appeared first on The Motley Fool Canada.",CAD,BCE.TO,The Motley Fool - Beginners: Here are 3 Top Canadian Stocks to Buy Right Now
fin_news_nlp/yahoo_cad_tickers_news,https://ca.finance.yahoo.com/news/canacol-energy-ltd-announces-dividend-224500469.html,"CALGARY, Alberta, Sept. 19, 2022 (GLOBE NEWSWIRE) -- Canacol Energy Ltd. (""Canacol"" or the ""Corporation"") (TSX:CNE) (OTCQX:CNNEF) (BVC:CNEC) announced that it has declared a dividend of CAD$.052 per share, payable on October 17, 2022, to shareholders of record at the close of business on September 30, 2022. This dividend qualifies as an 'eligible dividend' for Canadian income tax purposes. The declaration, timing, amount and payment of future dividends remain at the discretion of the Board of Di",CAD,CNE.TO,GlobeNewswire - Canacol Energy Ltd. Announces Dividend
fin_news_nlp/yahoo_cad_tickers_news,https://ca.finance.yahoo.com/news/most-actively-traded-companies-toronto-213341168.html,"Some of the most active companies traded Monday on the Toronto Stock Exchange: Toronto Stock Exchange (19,562.38, up 176.50 points) Barrick Gold Corp. (TSX:ABX). Materials. Up 22 cents, or 1.08 per cent, to $20.55 on 17.2 million shares. Manulife Financial Corp. (TSX:MFC). Financials. Up 36 cents, or 1.58 per cent, to $23.10 on 15 million shares. Suncor Energy Inc. (TSX:SU). Energy. Up 58 cents, or 1.42 per cent, to $41.37 on 14.4 million shares. Canadian Natural Resources Ltd. (TSX:CNQ). Energy",CAD,CM.TO, - Most actively traded companies on the Toronto Stock Exchange
fin_news_nlp/yahoo_cad_tickers_news,https://ca.finance.yahoo.com/news/cogeco-communications-participate-21st-annual-203900648.html,"Cogeco Communications Inc. (TSX: CCA) announced today that it will be participating in the 21st Annual CIBC Eastern Institutional Investor Conference being held in Montréal, Québec. As part of this conference Mr. Patrice Ouimet, Cogeco Communications Inc.'s Senior Vice President and Chief Financial Officer, will participate in an interactive discussion on Wednesday, September 21, 2022 at 1:30 p.m. (Eastern Daylight Time).",CAD,CCA.TO,CNW Group - Cogeco Communications to participate in the 21st Annual CIBC Eastern Institutional Investor Conference
fin_news_nlp/yahoo_cad_tickers_news,https://ca.finance.yahoo.com/news/2-tsx-stocks-could-grow-190000871.html,Here are two of the best stocks on the TSX that can help drive the growth of your portfolio for years to come. The post 2 TSX Stocks That Could Grow Your Portfolio Over the Next Decade appeared first on The Motley Fool Canada.,CAD,FRU.TO,The Motley Fool - 2 TSX Stocks That Could Grow Your Portfolio Over the Next Decade
fin_news_nlp/yahoo_cad_tickers_news,https://ca.finance.yahoo.com/news/media-advisory-intact-financial-corporation-210100548.html,"Intact Financial Corporation (""Intact"" or the ""Company"") (TSX: IFC) will host an Investor Day event in Toronto on Thursday, September 22, 2022 with formal presentations by senior executives beginning at 9:00 a.m. ET. The event is expected to conclude by approximately 12:30 p.m. ET.",CAD,IFC.TO,CNW Group - Media Advisory - Intact Financial Corporation to host Investor Day on September 22
fin_news_nlp/yahoo_cad_tickers_news,https://ca.finance.yahoo.com/news/rebound-rockets-4-tsx-tech-200000265.html,Top TSX tech stocks like Kinaxis Inc. (TSX:KXS) and others are a good bet to bounce back in a big way after this rough market correction. The post Rebound Rockets: 4 TSX Tech Stocks to Buy Before They Soar appeared first on The Motley Fool Canada.,CAD,KXS.TO,The Motley Fool - Rebound Rockets: 4 TSX Tech Stocks to Buy Before They Soar
fin_news_nlp/yahoo_cad_tickers_news,https://ca.finance.yahoo.com/news/pembina-pipeline-corporation-announces-conversion-222700882.html,"Pembina Pipeline Corporation (""Pembina"") (TSX: PPL) (NYSE: PBA) announced today that none of Pembina's Cumulative Redeemable Rate Reset Class A Preferred Shares, Series 15 (""Series 15 Shares"") (TSX: PPL.PR.O) will be converted into Cumulative Redeemable Floating Rate Class A Preferred Shares, Series 16 of Pembina (""Series 16 Shares"") on October 3, 2022.",CAD,PPL.TO,CNW Group - Pembina Pipeline Corporation Announces Conversion Results for Series 15 Preferred Shares
fin_news_nlp/yahoo_cad_tickers_news,https://ca.finance.yahoo.com/news/perpetua-resources-awarded-department-defense-220000021.html,"Perpetua Resources Corp. (NASDAQ: PPTA) (TSX: PPTA) (""Perpetua Resources"" or ""Perpetua"" or the ""Company"") announced today the Company was awarded two funding grants from the U.S. Department of Defense (""DOD"") Defense Logistics Agency (""DLA"") to study the domestic production of military-grade antimony trisulfide, an essential component in ammunition and dozens of other defense materials. Perpetua will receive $200,000 in total to evaluate whether antimony from the Stibnite Gold Project (""Project""",CAD,PPTA.TO,CNW Group - Perpetua Resources Awarded Department of Defense Funding to Study Antimony from Stibnite Gold Project
fin_news_nlp/yahoo_cad_tickers_news,https://ca.finance.yahoo.com/news/tfsa-investors-1-top-stock-190000212.html,"Pet Valu Holdings (TSX:PET) stock looks way too cheap to ignore, given its recession resilience. The post TFSA Investors: 1 Top Stock Pick to Buy for a Comeback appeared first on The Motley Fool Canada.",CAD,PET.TO,The Motley Fool - TFSA Investors: 1 Top Stock Pick to Buy for a Comeback
fin_news_nlp/yahoo_cad_tickers_news,https://ca.finance.yahoo.com/news/petrus-resources-announces-increased-2022-210000357.html,"CALGARY, Alberta, Sept. 19, 2022 (GLOBE NEWSWIRE) -- Petrus Resources Ltd. (""Petrus"" or the ""Company"") (TSX: PRQ) is pleased to announce the acceleration and expansion of its capital program, resulting in increased 2022 budget guidance and an updated operational outlook. UPDATED 2022 BUDGET GUIDANCE Market conditions have improved materially since the release of Petrus' initial 2022 budget in December of last year. During the first six months of 2022, due to a combination of increased production",CAD,PRQ.TO,GlobeNewswire - Petrus Resources Announces Increased 2022 Budget Guidance and Operational Update
fin_news_nlp/yahoo_cad_tickers_news,https://ca.finance.yahoo.com/news/retirement-investing-2-top-tsx-204500131.html,These TSX leaders look cheap to buy today for a TFSA investor focused on passive income or a self-directed RRSP investor seeking total returns. The post Retirement Investing: 2 Top TSX Dividend Stocks to Buy Now for a TFSA or RRSP appeared first on The Motley Fool Canada.,CAD,RY.TO,The Motley Fool - Retirement Investing: 2 Top TSX Dividend Stocks to Buy Now for a TFSA or RRSP
fin_news_nlp/yahoo_cad_tickers_news,https://ca.finance.yahoo.com/news/3-top-growing-stocks-earth-194500215.html,The ideal strategy to build a portfolio in the present environment is to own the fastest-growing stocks on Earth for the long term. The post 3 of the Top-Growing Stocks on Earth appeared first on The Motley Fool Canada.,CAD,TFII.TO,The Motley Fool - 3 of the Top-Growing Stocks on Earth
fin_news_nlp/yahoo_cad_tickers_news,https://ca.finance.yahoo.com/news/passive-income-2-8-yielding-192508769.html,Investing in real estate is an excellent strategy for generating passive income. Here are two real estate stocks that can pay you generous distribution yields every month. The post Passive Income: 2 (>8% Yielding) Real Estate Stocks That Pay Cash Each Month appeared first on The Motley Fool Canada.,CAD,TF.TO,The Motley Fool - Passive Income: 2 (>8% Yielding) Real Estate Stocks That Pay Cash Each Month
fin_news_nlp/yahoo_cad_tickers_news,https://ca.finance.yahoo.com/news/vermilion-energy-vet-stock-sinks-215009766.html,"Vermilion Energy (VET) closed at $22.88 in the latest trading session, marking a -1.08% move from the prior day.",CAD,VET.TO,Zacks - Vermilion Energy (VET) Stock Sinks As Market Gains: What You Should Know
fin_news_nlp/yahoo_cad_tickers_news,https://ca.finance.yahoo.com/news/gold-miners-look-beyond-fed-234853596.html,"(Bloomberg) -- Not even the most hawkish Federal Reserve in decades can beat down the exuberance of gold enthusiasts at the industry’s biggest annual gathering.Most Read from BloombergSouthwest Mexico Struck by 7.5 Magnitude Earthquake, Buildings Sway in CapitalHome-Flipper Opendoor Hit With Losses in Echo of Zillow CollapseMark Zuckerberg’s $71 Billion Wealth Wipeout Puts Focus on Meta’s WoesGrand Theft Auto VI Leak Is a Shock to Video Game Studio RockstarFrustrated and Snubbed, Putin Is Runnin",CAD,WPM.TO,"Bloomberg - Gold Miners Look Beyond Fed Hikes to Predict $1,800 Comeback"
fin_news_nlp/yahoo_cad_tickers_news,https://ca.finance.yahoo.com/news/finlay-minerals-commences-drilling-expands-235800254.html,"Finlay Minerals Ltd. (TSXV: FYL) (OTCQB: FYMNF) (""Finlay"" or the ""Company"") is pleased to announce that drilling has commenced on its Silver Hope Property, in central B.C.",CAD,FYL.V,CNW Group - Finlay Minerals commences drilling on and expands the Silver Hope Property
fin_news_nlp/yahoo_cad_tickers_news,https://ca.finance.yahoo.com/news/golden-dawn-minerals-inc-announces-234500384.html,"Golden Dawn Minerals Inc., (TSX-V:GOM)(FRANKFURT:3G8C)(OTC PINK:GDMRF), (""Golden Dawn"" or the ""Company""), is pleased to announce that pursuant to its press release of August 16, 2022, it has received final approval from the TSX-Venture Exchange for its name and symbol change.",CAD,GOM.V,ACCESSWIRE - Golden Dawn Minerals Inc. Announces Corporate Name Change to CanXGold Mining Corp and Symbol Change to TSX-V:CXG
fin_news_nlp/yahoo_cad_tickers_news,https://ca.finance.yahoo.com/news/kenorland-minerals-closes-7-49-213800571.html,"Vancouver, British Columbia--(Newsfile Corp. - September 19, 2022) - Kenorland Minerals Ltd. (TSXV: KLD) (OTCQX: NWRCF) (FSE: 3WQ0) (""Kenorland"" or ""the Company"") is pleased to announce that it has closed the fully subscribed non-brokered million private placement (the ""Placement"") of common shares previously announced on September 9, 2022.A total of $7,492,515 was raised through the sale of 10,703,593 common shares, which included the purchase by Sumitomo Metal Mining Canada Ltd. (""Sumitomo"") o",CAD,KLD.V, - Kenorland Minerals Closes $7.49 M Non-Brokered Private Placement
fin_news_nlp/yahoo_cad_tickers_news,https://ca.finance.yahoo.com/news/miniluxe-announces-normal-course-issuer-001900163.html,"TORONTO, Sept. 19, 2022 (GLOBE NEWSWIRE) -- MiniLuxe Holding Corp. (TSXV: MNLX; OTCQX: MNLXF) (“MiniLuxe” or the ""Company"") announces today that it has received TSX Venture Exchange (""TSXV"") approval to commence a normal course issuer bid through the facilities of the TSXV permitting the Company to repurchase, for cancellation, up to 2,800,000 subordinate voting shares of the Company, representing approximately 4.99% of the Company’s presently issued and outstanding subordinate voting shares (th",CAD,MNLX.V,GlobeNewswire - MINILUXE ANNOUNCES NORMAL COURSE ISSUER BID FOR SUBORDINATE VOTING SHARES
fin_news_nlp/yahoo_cad_tickers_news,https://ca.finance.yahoo.com/news/correction-naturally-splendid-announces-completion-220000039.html,"Naturally Splendid Enterprises Ltd.(""Naturally Splendid"" or ""NSE"" or the ""Company"") (FRANKFURT:50N)(TSX-V:NSP)(OTC PINK:NSPDF) is reporting that it has received TSX-V approval of the share consolidation and the consolidation of its issued and outstanding common shares at a ratio of fifteen (15) pre-consolidation shares to one (1) post-consolidation share (the ""Consolidation"") will take effect on opening business on September 22, 2022.",CAD,NSP.V,ACCESSWIRE - CORRECTION; Naturally Splendid Announces Completion of Share Consolidation
fin_news_nlp/yahoo_cad_tickers_news,https://ca.finance.yahoo.com/news/naturally-splendid-announces-completion-share-211500111.html,"Naturally Splendid Enterprises Ltd.(""Naturally Splendid"" or ""NSE"" or the ""Company"") (FRANKFURT:50N)(TSX-V:NSP) (OTC PINK:NSPDF) is reporting that it has received TSX-V approval of the share consolidation and the consolidation of its issued and outstanding common shares at a ratio of fifteen (15) pre-consolidation shares to one (1) post-consolidation share (the ""Consolidation"") will take effect on opening business on September 21, 2022.",CAD,NSP.V,ACCESSWIRE - Naturally Splendid Announces Completion of Share Consolidation
fin_news_nlp/yahoo_cad_tickers_news,https://ca.finance.yahoo.com/news/petrotal-announces-results-shareholders-meeting-060000104.html,"Calgary, Alberta and Houston, Texas--(Newsfile Corp. - September 20, 2022) - PetroTal Corp. (TSXV: TAL) (AIM: PTAL) (OTCQX: PTALF) (""PetroTal"" or the ""Company"") is pleased to announce that all matters presented for approval at the annual special meeting of shareholders held on September 15, 2022 have been fully authorized and approved. Annual General and Special Meeting on September 15, 2022The Company welcomes two new directors (Messrs. Carranza and Harris), and thanks retiring directors (Messr",CAD,TAL.V,"Newsfile - PetroTal Announces Results of Shareholders' Meeting, Director Dealing, TVR and Other Corporate Items"
fin_news_nlp/yahoo_cad_tickers_news,https://ca.finance.yahoo.com/news/christina-lake-affirms-mark-aiken-024600570.html,"VANCOUVER, British Columbia, Sept. 19, 2022 (GLOBE NEWSWIRE) -- Christina Lake Cannabis Corp. (the “Company” or “CLC” or “Christina Lake Cannabis”) (CSE: CLC) (OTCQB: CLCFF) (FRANKFURT: CLB) is pleased to announce that further to the news release dated August 4, 2022, Health Canada has cleared Mark Aiken’s mandatory Security Clearance and he has been officially been appointed as Chief Executive Officer (“CEO”) of the Company, effective September 16, 2022. Following Mr. Aiken’s appointment as CEO",CAD,CLC.CN,GlobeNewswire - Christina Lake Affirms Mark Aiken’s Appointment as CEO
fin_news_nlp/yahoo_cad_tickers_news,https://ca.finance.yahoo.com/news/e3-lithium-acquires-existing-well-070500375.html,"E3 LITHIUM LTD. (TSXV: ETL) (FSE: OW3) (OTCQX: EEMMF), Alberta's leading lithium developer and Direct Lithium Extraction (DLE) technology innovator is excited to announce it has acquired a third-party well in its Clearwater Project Area within the Bashaw District.",CAD,ETL.V,"CNW Group - E3 Lithium Acquires Existing Well, Repurposing Infrastructure and Reducing Environmental Impact"
fin_news_nlp/yahoo_cad_tickers_news,https://ca.finance.yahoo.com/news/basin-uranium-commences-phase-two-070500120.html,"Vancouver, British Columbia--(Newsfile Corp. - September 20, 2022) - BASIN URANIUM CORP. (CSE: NCLR) (OTC Pink: BURCF) (FSE: 6NP0) (""Basin Uranium"" or the ""Company"") is pleased to announce the commencement of a Phase two diamond drilling program at its Mann Lake project located 25 km southwest of the McArthur River Mine and 15 km to the northeast along strike of Cameco's Millennium uranium deposit. HighlightsPhase two drilling is designed to follow-up on exciting ...",CAD,NCLR.CN,Newsfile - Basin Uranium Commences Phase Two Diamond Drilling Program at Mann Lake
fin_news_nlp/yahoo_cad_tickers_news,https://ca.finance.yahoo.com/news/biovaxys-closes-final-tranche-non-031700092.html,"BioVaxys Technology Corp. (CSE: BIOV, FRA: 5LB, OTCQB: BVAXF) (""BioVaxys"" or the ""Company"") is pleased to announce that it has closed the final tranche (""Final Tranche"") of its previously announced non-brokered private placement (the ""Private Placement""). Pursuant to the Final Tranche of the Private Placement, the Company has issued 1,350,000 units (""Units"") at a price of $0.10 per Unit for gross proceeds of $135,000. Including the first tranche of the Private Placement which completed on August",CAD,BIOV.CN,CNW Group - BIOVAXYS CLOSES FINAL TRANCHE OF NON-BROKERED PRIVATE PLACEMENT
fin_news_nlp/yahoo_cad_tickers_news,https://ca.finance.yahoo.com/news/b2gold-completes-acquisition-oklo-resources-073000644.html,"B2Gold Corp. (TSX: BTO) (NYSE-American: BTG) (NSX: B2G) (""B2Gold"") is pleased to announce that it has completed the acquisition of Oklo Resources Limited (ASX: OKU) (""Oklo""). B2Gold has acquired 100% of the fully paid ordinary shares of Oklo (the ""Oklo Shares"") in consideration for 0.0206 of a common share of B2Gold (each whole share, a ""B2Gold Share"") and A$0.0525 in cash for each Oklo Share held. On closing, B2Gold issued 10,742,814 B2Gold Shares to Oklo shareholders, representing approximatel",CAD,BTO.TO,CNW Group - B2Gold Completes Acquisition of Oklo Resources Limited and its Extensive Land Package near the Fekola Mine
fin_news_nlp/yahoo_cad_tickers_news,https://ca.finance.yahoo.com/news/recyclico-battery-materials-demonstration-plant-083000351.html,"American Manganese Inc (TSXV:AMY)(OTCQB:AMYZF)(FSE:2AM) (""Company""), doing business as RecycLiCo Battery Materials, a pioneer in advanced lithium-ion battery recycling and upcycling, and its R&D partner Kemetco Research Inc. (""Kemetco""), are pleased to announce that the leach section of its technology defining demonstration plant project has achieved over 99% extraction of lithium, nickel, cobalt, and manganese from lithium-ion battery production",CAD,AMY.V,"ACCESSWIRE - RecycLiCo Battery Materials Demonstration Plant Testing Achieves Over 99% Leach Extraction of Lithium, Nickel, Cobalt, and Manganese from Lithium-ion Battery Production Scrap"
fin_news_nlp/yahoo_cad_tickers_news,https://ca.finance.yahoo.com/news/canada-silver-cobalt-begins-produce-083000012.html,"The resulting concentrates will then be converted with the Company's Re-2Ox process into EV battery metals. Coquitlam, British Columbia--(Newsfile Corp. - September 20, 2022) - Canada Silver Cobalt Works Inc. (TSXV: CCW) (OTCQB: CCWOF) (FSE: 4T9B) (the ""Company"" or ""Canada Silver Cobalt"") is pleased to announce that two tonnes of high-grade mineralized material recovered during voluntary surface site rehabilitation at the past-producing Castle and Beaver Mines, in addition to high-grade silver t",CAD,CCW.V,Newsfile - Canada Silver Cobalt Begins to Produce Metal Concentrates for EV Client Evaluation
fin_news_nlp/yahoo_cad_tickers_news,https://ca.finance.yahoo.com/news/dynacert-invited-present-international-investment-090000313.html,"TORONTO, September 20, 2022--dynaCERT Inc. (TSX: DYA) (OTCQX: DYFSF) (FRA: DMJ) (""dynaCERT"" or the ""Company"") is pleased to announce that dynaCERT will be presenting at the fourth International Investment Forum (""IIF"") on September 27th, 2022.",CAD,DYA.TO,Business Wire - dynaCERT Invited to Present at the International Investment Forum (IIF)
fin_news_nlp/yahoo_cad_tickers_news,https://ca.finance.yahoo.com/news/maxar-awarded-g-egd-contract-100000951.html,"WESTMINSTER, Colo., September 20, 2022--Maxar Technologies (NYSE:MAXR) (TSX:MAXR), provider of comprehensive space solutions and secure, precise, geospatial intelligence, today announced it has been awarded an Option Year 3 contract renewal by the U.S. National Geospatial-Intelligence Agency (NGA) for the Global Enhanced GEOINT Delivery (G-EGD) program. The contract, which began September 1, 2022, is valued at $44 million. This is the third of three option years for the contract, which has a tot",CAD,MAXR.TO,Business Wire - Maxar Awarded G-EGD Contract Renewal to Provide Mission-Ready Satellite Imagery for U.S. Government
fin_news_nlp/yahoo_cad_tickers_news,https://ca.finance.yahoo.com/news/savaria-tse-sis-paying-larger-102838419.html,The board of Savaria Corporation ( TSE:SIS ) has announced that it will be paying its dividend of CA$0.0433 on the 7th...,CAD,SIS.TO,Simply Wall St. - Savaria (TSE:SIS) Is Paying Out A Larger Dividend Than Last Year
fin_news_nlp/yahoo_cad_tickers_news,https://ca.finance.yahoo.com/m/481ef70e-bd55-34c0-a09b-7c01dc9eda64/this-ultra-high-yield.html,This passive-income powerhouse offers a nearly 15% yield and is slated to split its shares in less than a week.,CAD,SHOP.TO,Motley Fool - This Ultra-High-Yield Stock-Split Stock Is a Smarter Buy Than Tesla or Shopify
fin_news_nlp/yahoo_cad_tickers_news,https://ca.finance.yahoo.com/news/stantec-awarded-us-16-million-104500319.html,"The project will supply up to 25% of US copper needs, helping to secure a clean energy futureEDMONTON, Alberta and NEW YORK, Sept. 20, 2022 (GLOBE NEWSWIRE) -- TSX, NYSE:STN Stantec, a global leader in sustainable design and engineering, has been selected by Resolution Copper Mining LLC (Resolution Copper) to deliver a US$16 million feasibility study providing engineering and technical services for the Resolution Copper mine in Superior, Arizona. The proposed underground mine has the potential t",CAD,STN.TO,GlobeNewswire - Stantec awarded US$16 million feasibility study for Resolution Copper
fin_news_nlp/yahoo_cad_tickers_news,https://ca.finance.yahoo.com/news/baselode-intersects-best-drill-hole-100000249.html,"Baselode Energy Corp. (TSXV: FIND) (OTCQB: BSENF) (""Baselode"" or the ""Company"") is pleased to announce the geochemical assay results from drill hole AK22-069 of 0.90% U3O8 over 31.0 m starting at 69.3 m true vertical depth which includes 1.86% U3O8 over 12.5 m at 79.7 m true vertical depth. AK22-069 is the latest and best hole to date from the now-complete 22,500 metre diamond drill program (the ""Program"") on the ACKIO high-grade uranium discovery (""ACKIO""), Hook project, Athabasca Basin area (t",CAD,FIND.V,CNW Group - Baselode Intersects Best Drill Hole To Date With 0.90% U3O8 Over 31.0 Metres Starting at 69.3 m True Vertical Depth
fin_news_nlp/yahoo_cad_tickers_news,https://ca.finance.yahoo.com/news/eloro-resources-intersects-150-47-100000043.html,"Figure 1 Geological Plan Map showing Drilling in Santa Barbara Area with Holes referred to in this release highlighted. Figure 2 Longitudinal Section of Santa Barbara Feeder Zone looking NE showing 90 g Ag eq/ grade shell, conductivity anomalies and magnetic susceptibility anomaly across the Iska Iska Caldera. Figure 3 View Looking South from Santa Barbara Hill across the Iska Iska Caldera Valley to the Porco Area showing Locations of Drill Collars. Figure 4 Conductivity Model in same view as Fi",CAD,ELO.V,"GlobeNewswire - Eloro Resources Intersects 150.47 g Ag eq/t (9.45 g Ag/t, 1.53% Zn, 0.88% Pb and 0.07% Sn) over 441.21m in High-Grade Feeder Zone in Santa Barbara Target Area at the Iska Iska Silver-Tin Polymetallic Project, Potosi Department, Bolivia"
fin_news_nlp/yahoo_cad_tickers_news,https://ca.finance.yahoo.com/news/fpx-nickel-prepare-updated-mineral-110000000.html,"FPX Nickel Corp. (TSXV: FPX) (OTCQB: FPOCF) (""FPX"" or the ""Company"") is pleased to report that it is has engaged Next Mine Consulting Ltd. to prepare an updated mineral resource estimate for the Baptiste Project (""Baptiste"" or the ""Project"") at the Decar Nickel District (""Decar"") in central British Columbia, incorporating results from 2021's successful in-fill drilling program. The mineral resource estimate, which is expected to be completed in the fourth quarter of 2022, will be based on an imp",CAD,FPX.V,"CNW Group - FPX Nickel to Prepare Updated Mineral Resource Estimate for Baptiste Nickel Project with Inclusion of Total Nickel, Cobalt and Iron Grades"
fin_news_nlp/yahoo_cad_tickers_news,https://ca.finance.yahoo.com/news/graphite-one-announces-extension-closing-110000317.html,"Graphite One Inc. (TSXV: GPH) (OTCQX: GPHOF) (""Graphite One"" or the ""Company"") announces that further to the news releases disseminated on August 8, 2022 and August 29, 2022, the Company has extended the closing of the final tranche of a previously announced non-brokered private placement from September 22, 2022 to or before October 21, 2022.",CAD,GPH.V,CNW Group - Graphite One Announces Extension to Closing of Final Tranche of Equity Financing
fin_news_nlp/yahoo_cad_tickers_news,https://ca.finance.yahoo.com/news/northern-superior-corrects-error-regarding-103000996.html,"Northern Superior Resources (""Northern Superior"" or the ""Company"") (TSXV:SUP)(OCTQB:NSUPF) wishes advise those stakeholders who intend to attend its 2022 Annual General Meeting, which is being held by telephone conference call on Friday, September 23, 2022 at 4:15PM Eastern Time / 1:15PM Pacific Time (the ""Meeting""), that the Notice of Meeting dated August 17, 2022 which was mailed to shareholders and filed on SEDAR, contained incorrect dial-in instructions",CAD,SUP.V,ACCESSWIRE - Northern Superior Corrects Error Regarding Dial-In Information For Its 2022 Annual General Meeting
fin_news_nlp/yahoo_cad_tickers_news,https://ca.finance.yahoo.com/news/purepoint-uranium-prepares-drill-program-103000840.html,"Toronto, Ontario--(Newsfile Corp. - September 20, 2022) - Purepoint Uranium Group Inc. (TSXV: PTU) (OTCQB: PTUUF) (""Purepoint"" or the ""Company"") announced today the commencement of mobilization efforts at the 100%-owned Red Willow project within the eastern uranium mine district of the Athabasca Basin, Saskatchewan Canada. This past winter's drilling intersected uranium mineralization along 1.2 kilometres of strike length associated with the northern area of the Osprey Zone electromagnetic (EM)",CAD,PTU.V,Newsfile - Purepoint Uranium Prepares for Follow-Up Drill Program at Red Willow Project
