source,url,description,country,company,title
fin_news_nlp/yahoo_cad_tickers_news,https://ca.finance.yahoo.com/news/plurilocks-aurora-announces-closing-asset-173000527.html,"Atrion Communications, Inc. is a leading U.S. provider of consulting, IT and cybersecurity solutions that recently generated roughly US$14.0 million in annual revenue and EBITDA of over US$0.5 millionPurchase price is primarily financed by Aurora's increased line of credit, Plurilock common shares and performance-driven earnout payments This transaction marks Plurilock's fourth acquisition, enabling Plurilock to increase its annualized revenue run-rate to approximately CAD$50 million and grow it",CAD,PLUR.V,"Newsfile - Plurilock's Aurora Announces Closing of Asset Purchase Agreement with Atrion Communications, Inc."
fin_news_nlp/yahoo_cad_tickers_news,https://ca.finance.yahoo.com/news/power-play-market-herald-releases-184000852.html,The Power Play by The Market Herald has announced the release of new interviews with Silver Bullet Mines and Tantalex Lithium Resources discussing their latest news.,CAD,SBMI.V,ACCESSWIRE - The Power Play by The Market Herald Releases New Interviews with Silver Bullet Mines and Tantalex Lithium Resources Discussing Their Latest News
fin_news_nlp/yahoo_cad_tickers_news,https://ca.finance.yahoo.com/news/4-cheap-canadian-stocks-still-171234870.html,"While economic growth is expected to slow significantly in 2023, these four Canadian stocks are cheap and have significant growth potential. The post 4 Cheap Canadian Stocks That Can Still Grow Their Earnings Next Year appeared first on The Motley Fool Canada.",CAD,ATZ.TO,The Motley Fool - 4 Cheap Canadian Stocks That Can Still Grow Their Earnings Next Year
fin_news_nlp/yahoo_cad_tickers_news,https://ca.finance.yahoo.com/news/dye-durham-reports-fourth-quarter-201500025.html,"Dye & Durham Limited (""Dye & Durham"" or the ""Company"") (TSX: DND), a leading provider of cloud-based, efficient workflow software for legal and business professionals, today announced its audited financial results for the three months and twelve months ended June 30, 2022.",CAD,DND.TO,CNW Group - Dye & Durham Reports Fourth Quarter and Fiscal Year 2022 Financial Results
fin_news_nlp/yahoo_cad_tickers_news,https://ca.finance.yahoo.com/news/rebound-rockets-2-tsx-tech-183000557.html,Beaten-down TSX stocks such as Lightspeed and Shopify should be on the top of your shopping list given they remain top long-term bets. The post Rebound Rockets: 2 TSX Tech Stocks to Buy Before They Soar appeared first on The Motley Fool Canada.,CAD,SHOP.TO,The Motley Fool - Rebound Rockets: 2 TSX Tech Stocks to Buy Before They Soar
fin_news_nlp/yahoo_cad_tickers_news,https://ca.finance.yahoo.com/news/3-tsx-tech-stocks-could-174500846.html,"The tech sector is still heavily discounted, though the scale of discount and recovery potential may vary significantly from stock to stock. The post 3 TSX Tech Stocks That Could Soar appeared first on The Motley Fool Canada.",CAD,SHOP.TO,The Motley Fool - 3 TSX Tech Stocks That Could Soar
fin_news_nlp/yahoo_cad_tickers_news,https://ca.finance.yahoo.com/news/2-oversold-tsx-stocks-tfsa-170000391.html,These top TSX dividend stocks look oversold. The post 2 Oversold TSX Stocks for TFSA and RRSP Investors to Buy Now appeared first on The Motley Fool Canada.,CAD,TRP.TO,The Motley Fool - 2 Oversold TSX Stocks for TFSA and RRSP Investors to Buy Now
fin_news_nlp/yahoo_cad_tickers_news,https://ca.finance.yahoo.com/news/cmc-seeks-approval-first-tranche-204000423.html,"CMC Metals Ltd. (TSXV:CMB)(Frankfurt:ZM5P)(CMCXF:OTCQB) (""CMC"" or the ""Company"")has filed for approval to close the first tranche of the financing for aggregate gross proceeds of $726,659.98, subject to TSX Venture Exchange approval.",CAD,CMB.V,"ACCESSWIRE - CMC Seeks Approval of First Tranche - $726,659.98 Raised"
fin_news_nlp/yahoo_cad_tickers_news,https://ca.finance.yahoo.com/news/edgewater-wireless-announces-first-quarter-200300263.html,"OTTAWA, September 26, 2022--Edgewater Wireless Systems Inc. (TSXV: YFI) (OTC: KPIFF), the industry leader in Wi-Fi Spectrum Slicing technology for residential and enterprise markets, is pleased to announce its financial and operational results for the First Quarter ending July 31, 2022, which are available on SEDAR (www.SEDAR.com).",CAD,YFI.V, - Edgewater Wireless Announces First Quarter 2023 Financial Results
fin_news_nlp/yahoo_cad_tickers_news,https://ca.finance.yahoo.com/news/gratomic-announces-addition-four-licenses-195500989.html,"Gratomic Inc. (""Gratomic"", ""GRAT,"" or the ""Company"") (TSXV:GRAT)(OTCQX:CBULF)(FSE:CB82) announces that it has been granted four additional Prospecting Licenses (PLs) for graphite exploration by Brazil's National Mining Agency (ANM) in new promising areas near its existing Capim Grosso Graphite project. The Company views this as an opportunity to develop Capim Grosso from a local to a district-scale project.",CAD,GRAT.V,ACCESSWIRE - Gratomic Announces Addition of Four New Licenses to Its Capim Grosso Project
fin_news_nlp/yahoo_cad_tickers_news,https://ca.finance.yahoo.com/news/marvel-biosciences-announces-stock-option-203800390.html,"Calgary, Alberta--(Newsfile Corp. - September 26, 2022) - Marvel Biosciences Corp. (TSXV: MRVL) and its wholly owned subsidiary, Marvel Biotechnology Inc. (collectively the ""Company"" or ""Marvel""), today announced that its board of directors has approved the grant of incentive stock options (the ""Options"") to certain directors and officers to acquire an aggregate of 1,425,000 common shares in the capital of the Company at an exercise price of $0.10, which is above the closing price ...",CAD,MRVL.V,Newsfile - Marvel Biosciences Announces Stock Option Grants
fin_news_nlp/yahoo_cad_tickers_news,https://ca.finance.yahoo.com/news/extension-expiry-date-warrants-210000948.html,"Tarku Resources Ltd (TSXV:TKU)(FRA:7TK)(OTCQB:TRKUF) (the ""Company"" or ""Tarku"") announces that, subject to required approvals from regulatory authorities, more specifically the TSX Venture Exchange (the ""TSXV""), Tarku will extend until May 1, 2024, the expiry date of 12,500,000 common share purchase warrants (the ""Warrants"") issued in connection with a private placement closed on October 30, 2020 (the ""Private Placement"").",CAD,TKU.V,ACCESSWIRE - Extension of Expiry Date of Warrants
fin_news_nlp/yahoo_cad_tickers_news,https://ca.finance.yahoo.com/news/aion-therapeutic-provides-default-status-210000367.html,"Toronto, Ontario--(Newsfile Corp. - September 26, 2022) - Aion Therapeutic Inc. (CSE: AION) (""Aion Therapeutic"" or the ""Company"") announces that further to its press release of September 13, 2022, it is providing a default status report in accordance with the alternative information guidelines set out in National Policy 12-203 - Cease Trade Orders for Continuous Disclosure Defaults (""NP 12-203"").On August 30, 2022, the Company announced (the ""Default Announcement"") that it had not filed its ...",CAD,AION.CN,Newsfile - Aion Therapeutic Provides Default Status Update
fin_news_nlp/yahoo_cad_tickers_news,https://ca.finance.yahoo.com/news/jushi-holdings-inc-files-june-210800775.html,"BOCA RATON, Fla., Sept. 26, 2022 (GLOBE NEWSWIRE) -- Jushi Holdings Inc. (“Jushi” or the “Company”) (CSE: JUSH) (OTCQX: JUSHF), a vertically integrated, multi-state cannabis operator, today filed its Quarterly Report on Form 10-Q for the second quarter ended June 30, 2022, with the U.S. Securities and Exchange Commission (the “SEC”). The Company has also filed reviewed and amended Q2 2022 Interim Financial Statements (collectively, the “Amended Statements”) in Canada on the System for Electronic",CAD,JUSH.CN,"GlobeNewswire - Jushi Holdings Inc. Files June 30, 2022 Quarterly Reports"
fin_news_nlp/yahoo_cad_tickers_news,https://ca.finance.yahoo.com/news/meryllion-resources-corp-announces-grant-210000222.html,"Vancouver, British Columbia--(Newsfile Corp. - September 26, 2022) - Meryllion Resources Corporation (CSE: MYR) (""Meryllion"" or the ""Corporation"") wishes to announce that it has granted an aggregate of 950,000 incentive stock options to certain officers and directors. 450,000 of the stock options have an exercise price of $0.105, while 500,000 of the stock options have an exercise price of $0.115. All of the stock options shall vest immediately, are exercisable for a period ...",CAD,MYR.CN,Newsfile - Meryllion Resources Corp. Announces Grant of Stock Options
fin_news_nlp/yahoo_cad_tickers_news,https://ca.finance.yahoo.com/news/orchid-ventures-provides-announces-resignation-210000385.html,"/ ORCHID VENTURES, INC. (CSE:ORCD)(OTC PINK:ORVRF) (the ""Company"" or ""Orchid"") announces the resignation of its President, CFO and director, Richard Brown, and its independent director and Chair of the Audit Committee, Wayne Johnson.",CAD,ORCD.CN,ACCESSWIRE - Orchid Ventures Provides an Update and Announces Resignation of Directors and Officer
fin_news_nlp/yahoo_cad_tickers_news,https://ca.finance.yahoo.com/news/most-actively-traded-companies-toronto-213556985.html,"TORONTO — Some of the most active companies traded Monday on the Toronto Stock Exchange: Toronto Stock Exchange (18,327.04, down 153.94 points) Suncor Energy Inc. (TSX:ABX). Energy. Down 36 cents, or 0.97 per cent, to $36.59 on 25.4 million shares. TC Energy Corp. (TSX:TRP). Energy. Down $1.15, or 1.94 per cent, to $58.06 on 23 million shares. Barrick Gold Corp. (TSX:ABX). Materials. Down 18 cents, or 0.92 per cent, to $19.48 on 20.4 million shares. Canadian Natural Resources Ltd. (TSX:CNQ). Ene",CAD,BNS.TO, - Most actively traded companies on the Toronto Stock Exchange
fin_news_nlp/yahoo_cad_tickers_news,https://ca.finance.yahoo.com/news/canada-stocks-tsx-hits-18-210923134.html,"Canada's main stock index fell on Monday to its lowest level in 18 months, including declines for resource shares and for shares of one of the country's major banks, as investors worried about the economic impact of aggressive central bank tightening.  The Toronto Stock Exchange's S&P/TSX composite index ended down 153.94 points, or 0.8%, at 18,327.04.  ""The final week of the month and the quarter has picked up where last week left off, with stock markets in retreat, Treasury yields soaring and currency markets in turmoil,"" Colin Cieszynski, chief market strategist at SIA Wealth Management, said in a note.",CAD,BNS.TO, - CANADA STOCKS-TSX hits 18-month low as energy shares slide
fin_news_nlp/yahoo_cad_tickers_news,https://ca.finance.yahoo.com/news/brp-executive-appointments-creation-low-210000406.html,"BRP Inc. (TSX: DOO) (NASDAQ: DOOO) confirms two new roles as part of the executive leadership team. In May, the Company stated that is was actively looking for a seasoned leader to head its information technologies. Today, the Company announces the appointment of Stéphane Bilodeau as Chief Information Officer effective October 11th.",CAD,DOO.TO,CNW Group - BRP EXECUTIVE APPOINTMENTS AND CREATION OF NEW LOW VOLTAGE & HUMAN ASSISTED GROUP
fin_news_nlp/yahoo_cad_tickers_news,https://ca.finance.yahoo.com/video/dont-worry-darling-tops-u-205442775.html,"Yahoo Finance entertainment reporter Allie Canal details the box office performances for films 'Don't Worry Darling', 'Avatar', and 'The Woman King' and what the box office projections are for Q4.",CAD,CGX.TO,Yahoo Finance Video - 'Don't Worry Darling' tops U.S. box office forecasts and 'Avatar' re-release
fin_news_nlp/yahoo_cad_tickers_news,https://ca.finance.yahoo.com/news/e-l-financial-corporation-limited-024700959.html,"E-L Financial Corporation Limited (TSX: ELF) (TSX: ELF.PR.F) (TSX: ELF.PR.G) (TSX: ELF.PR.H) (the ""Company"") announced today the preliminary results of its ""modified Dutch auction"" substantial issuer bid (the ""Offer""). Pursuant to the Offer, the Company offered to purchase for cancellation up to $100,000,000 in value of its outstanding common shares (the ""Shares"") from holders of Shares (the ""Shareholders"") for cash. The Offer expired at 5:00 p.m. (Toronto time) on September 26, 2022.",CAD,ELF.TO,CNW Group - E-L FINANCIAL CORPORATION LIMITED ANNOUNCES PRELIMINARY RESULTS OF ITS SUBSTANTIAL ISSUER BID
fin_news_nlp/yahoo_cad_tickers_news,https://ca.finance.yahoo.com/news/exchange-income-corporation-celebrates-successful-204000710.html,"WINNIPEG, Manitoba, September 26, 2022--Inaugural Atik Mason Indigenous Pilot Pathway graduating class",CAD,EIF.TO,Business Wire - Exchange Income Corporation Celebrates a Successful First Season of the Atik Mason Indigenous Pilot Pathway
fin_news_nlp/yahoo_cad_tickers_news,https://ca.finance.yahoo.com/news/3-tsx-stocks-high-dividend-193000006.html,"As markets continue to sell off, here are three of the best TSX dividend stocks you can buy to earn attractive passive income. The post 3 TSX Stocks With High Dividend Yields appeared first on The Motley Fool Canada.",CAD,FRU.TO,The Motley Fool - 3 TSX Stocks With High Dividend Yields
fin_news_nlp/yahoo_cad_tickers_news,https://ca.finance.yahoo.com/news/intact-financial-corporation-donates-150-223000222.html,"Intact Financial Corporation (TSX: IFC), and its affiliated brands including belairdirect, Intact Insurance, Johnson Insurance and Anthony Insurance, is announcing support for the communities affected by hurricane Fiona in the Atlantic provinces and eastern Québec with a $150,000 donation to the Canadian Red Cross.",CAD,IFC.TO,"CNW Group - Intact Financial Corporation donates $150,000 to the Canadian Red Cross to help with relief efforts following Hurricane Fiona"
fin_news_nlp/yahoo_cad_tickers_news,https://ca.finance.yahoo.com/news/3-tsx-stocks-actually-beating-191500740.html,Dependable TSX stocks like Hydro One Ltd. (TSX:H) and Loblaw Companies Ltd. (TSX:L) have beaten the TSX in a harsh 2022. The post 3 TSX Stocks That Are Actually Beating the Market appeared first on The Motley Fool Canada.,CAD,L.TO,The Motley Fool - 3 TSX Stocks That Are Actually Beating the Market
fin_news_nlp/yahoo_cad_tickers_news,https://ca.finance.yahoo.com/news/3-top-growing-stocks-earth-194500302.html,Canadian investors may want to branch out and target top-growing stocks like Exxon Mobil Corp. (NYSE:XOM) in the early fall. The post 3 of the Top-Growing Stocks on Earth appeared first on The Motley Fool Canada.,CAD,MEG.TO,The Motley Fool - 3 of the Top-Growing Stocks on Earth
fin_news_nlp/yahoo_cad_tickers_news,https://ca.finance.yahoo.com/news/nevada-copper-provides-restart-activities-010500774.html,"YERINGTON, Nev., Sept. 26, 2022 (GLOBE NEWSWIRE) -- Nevada Copper (TSX: NCU) (OTC: NEVDF) (FSE: ZYTA) (“Nevada Copper” or the “Company”) is pleased to provide an update on planned restart activities at its Pumpkin Hollow underground copper mine (the “Underground Mine”) and developments with respect to the proposed financing package that was previously announced in the Company’s news release dated August 25, 2022 (the “Prior Announcement”). The financing is expected to provide up to US$93 million",CAD,NCU.TO,GlobeNewswire - Nevada Copper Provides Update on Restart Activities at Pumpkin Hollow and the Proposed Restart Financing Package
fin_news_nlp/yahoo_cad_tickers_news,https://ca.finance.yahoo.com/news/sangoma-announces-fourth-quarter-fiscal-212000737.html,"Annual Revenue grows 71% year-over-year and Adjusted EBITDA1 Exceeds $42 million MARKHAM, Ontario, Sept. 26, 2022 (GLOBE NEWSWIRE) -- Sangoma Technologies Corporation (TSX: STC; Nasdaq: SANG) (“Sangoma” or the “Company”), a trusted leader in delivering cloud-based Communications as a Service solutions for companies of all sizes, today announced its fourth quarter financial results and audited consolidated financial statements for the fiscal year 2022 ended June 30, 2022. As a reminder, Sangoma c",CAD,STC.TO,GlobeNewswire - Sangoma Announces Fourth Quarter Fiscal 2022 Results
fin_news_nlp/yahoo_cad_tickers_news,https://ca.finance.yahoo.com/news/storagevault-appoints-andrew-brown-president-204000756.html,"TORONTO, Sept. 26, 2022 (GLOBE NEWSWIRE) -- STORAGEVAULT CANADA INC. (“StorageVault”) (SVI-TSX) is pleased to announce the appointment of Andrew Brown to the position of President - RecordXpress. Andrew will oversee StorageVault’s records and information management business as we continue to introduce integrated Records Management, Data Management, Digital Services, Shredding, Warehousing, and Fulfillment solutions for our customers across Canada. “Andrew brings strong leadership experience to o",CAD,SVI.TO,GlobeNewswire - StorageVault Appoints Andrew Brown as President of RecordXpress
fin_news_nlp/yahoo_cad_tickers_news,https://ca.finance.yahoo.com/news/sun-life-announces-intention-redeem-210100836.html,"Sun Life Financial Inc. (TSX: SLF) (NYSE: SLF) today announced its intention to redeem all of the outstanding $400 million principal amount of Series 2017-1 Subordinated Unsecured 2.75% Fixed/Floating Debentures (the ""Debentures"") in accordance with the redemption terms attached to the Debentures. The redemption will be funded from existing cash and liquid assets.",CAD,SLF.TO,CNW Group - Sun Life announces intention to redeem Series 2017-1 Subordinated Unsecured 2.75% Fixed/Floating Debentures
fin_news_nlp/yahoo_cad_tickers_news,https://ca.finance.yahoo.com/news/tilray-brands-inc-tlry-stock-220010652.html,"Tilray Brands, Inc. (TLRY) closed the most recent trading day at $2.70, moving -0.74% from the previous trading session.",CAD,TLRY.TO,"Zacks - Tilray Brands, Inc. (TLRY) Stock Moves -0.74%: What You Should Know"
fin_news_nlp/yahoo_cad_tickers_news,https://ca.finance.yahoo.com/news/allied-copper-receives-tsx-v-002700335.html,"Vancouver, British Columbia, Canada, Sept. 26, 2022 (GLOBE NEWSWIRE) -- Allied Copper Corp. (TSX-V: CPR, OTCQB: CPRRF) (the “Company” or “Allied Copper”), is pleased to announce that, further to its press releases of February 10, 2022 and August 25, 2022, the Company received TSX-V approval of the option agreement (the “Agreement”) dated February 9, 2022 (as amended August 5, 2022) for the sole and exclusive right to acquire a 100% undivided legal and beneficial interest (subject to a 2% net sme",CAD,ANZ.V,GlobeNewswire - Allied Copper receives TSX-V approval for Stateline Option Agreement
fin_news_nlp/yahoo_cad_tickers_news,https://ca.finance.yahoo.com/news/cleantek-industries-inc-announces-approval-230100690.html,"Calgary, Alberta--(Newsfile Corp. - September 26, 2022) - Cleantek Industries Inc. (TSXV: CTEK) (""Cleantek"" or the ""Company"") (formerly Raise Production Inc. (""Raise"")) is pleased to announce that shareholders have approved the Company's newly adopted share-based compensation plan (the ""Omnibus Plan"") at Cleantek's Annual and Special Meeting of Shareholders held on August 25, 2022. The Omnibus Plan will replace the Company's stock option plan (the ""Stock Option Plan""). The Omnibus Plan will prov",CAD,CTEK.V,Newsfile - Cleantek Industries Inc. Announces Approval of Omnibus Equity Incentive Plan
fin_news_nlp/yahoo_cad_tickers_news,https://ca.finance.yahoo.com/news/cloud-dx-cbi-health-partnership-213000787.html,"Cloud DX (TSXV:CDX) (OTCQB:CDXFF), a leading remote monitoring company, announces a new partnership with CBI Health, a leading community home care provider, to offer a comprehensive home care service to Canadians.",CAD,CDX.V,ACCESSWIRE - Cloud DX and CBI Health Partnership Alleviates Hospital Occupancy Pressure by Delivering Complex Care at Home
fin_news_nlp/yahoo_cad_tickers_news,https://ca.finance.yahoo.com/news/euro-manganese-signs-mou-statkraft-211500555.html,"VANCOUVER, British Columbia, Sept. 26, 2022 (GLOBE NEWSWIRE) -- Euro Manganese Inc. (TSX-V and ASX: EMN; OTCQX: EUMNF; Frankfurt: E06) (the ""Company"" or ""EMN"") has signed a non-binding Memorandum of Understanding (""MoU"") with Norwegian state-owned company Statkraft for the long-term supply of carbon-free renewable energy for Euro Manganese’s flagship Chvaletice Manganese Project (the ""CMP"" or the ""Project"") in the Czech Republic. Statkraft is Europe’s largest generator of renewable energy. The C",CAD,EMN.V,GlobeNewswire - Euro Manganese Signs MoU with Statkraft to establish a Renewable Energy Supply Agreement for the Chvaletice Manganese Project
fin_news_nlp/yahoo_cad_tickers_news,https://ca.finance.yahoo.com/news/fobi-ai-announces-closing-non-001700763.html,"/NOT FOR DISTRIBUTION TO UNITED STATES NEWSWIRE SERVICES OR FOR DISSEMINATION IN THE UNITED STATES/ VANCOUVER, British Columbia, Sept. 26, 2022 (GLOBE NEWSWIRE) -- FOBI AI Inc. (TSXV: FOBI) (OTCQB: FOBIF) (the ""Company"" or ""FOBI""), a leader in providing real-time data analytics through artificial intelligence to drive customer activation and engagement is pleased to announce that it has completed a non-brokered private placement offering (the ""Offering"") of 3,681,595 units of the Company (""Units",CAD,FOBI.V,"GlobeNewswire - FOBI AI ANNOUNCES CLOSING OF NON-BROKERED PRIVATE PLACEMENT, PARTICIPATION INCLUDES ONE SEVEN-FIGURE STRATEGIC INVESTOR, AS WELL AS DIRECTORS, OFFICERS, AND SENIOR MANAGEMENT"
fin_news_nlp/yahoo_cad_tickers_news,https://ca.finance.yahoo.com/news/beedie-investments-ltd-files-early-023200045.html,"Vancouver, British Columbia--(Newsfile Corp. - September 26, 2022) - Beedie Investments Ltd. (""Beedie Investments"") announces that it has acquired Series D Convertible Debentures (the ""Series D Debentures"") of Oceanic Iron Ore Corp. (the ""Company"") in the aggregate principal amount of $304,000 (the ""Purchased Debentures"") pursuant to a non-brokered private placement. The Series D Debentures have an interest rate of 8.5% per annum and a maturity date that is the fifth anniversary of the closing .",CAD,FEO.V, - Beedie Investments Ltd. Files Early Warning Report
fin_news_nlp/yahoo_cad_tickers_news,https://ca.finance.yahoo.com/news/oceanic-announces-completion-non-brokered-005500407.html,"Oceanic Iron Ore Corp. (TSXV: FEO) (""Oceanic"", or the ""Company"") is pleased to announce the completion of a non-brokered financing in an aggregate amount of $1,220,000 (the ""Financing""), following the original announcement of the Financing on September 8, 2022.",CAD,FEO.V,"CNW Group - OCEANIC ANNOUNCES COMPLETION OF NON-BROKERED CONVERTIBLE DEBENTURE FINANCING, REPLACEMENT OF PREVIOUSLY ISSUED SERIES A CONVERTIBLE DEBENTURES, AMENDMENTS TO PREVIOUSLY ISSUED SERIES B AND C CONVERTIBLE DEBENTURES AND ANNOUNCES THE SETTLEMENT OF INTEREST FOR COMMON SHARES"
fin_news_nlp/yahoo_cad_tickers_news,https://ca.finance.yahoo.com/news/scottie-resources-announces-upsize-private-233600982.html,"Scottie Resources Corp. (TSXV: SCOT) (OTCQB: SCTS) (FSE:SR8) (""Scottie"" or the ""Company"") is pleased to announce that, due to strong investor demand, it has increased its previously announced non-brokered private placement (the ""Offering"") to up to $3,200,000, consisting of 18,823,529 units (the ""Units"") at a price of $0.17 per Unit. Each Unit will consist of one common share of the Company and one common share purchase warrant (a ""Warrant""). Each Warrant will entitle the holder to purchase one",CAD,SCOT.V,CNW Group - Scottie Resources Announces Upsize of Private Placement to $3.2 Million
fin_news_nlp/yahoo_cad_tickers_news,https://ca.finance.yahoo.com/news/criterium-energy-ltd-previously-softrock-001200470.html,"Criterium Energy Ltd. (""Criterium"" or the ""Company"") (TSXV: SFT) is pleased to announce the closing of its previously announced non-brokered private placement (the ""Private Placement""), the appointment of a new management team (the ""New Management Team""), the reconstitution of the board of directors of the Company (the ""Board"") (collectively, the ""Recapitalization Transactions"") and the change of the Company's name from Softrock Minerals Ltd. to Criterium Energy Ltd (the ""Name Change"").",CAD,SFT.V,CNW Group - Criterium Energy Ltd. (Previously Softrock Minerals Ltd.) Announces Closing of Previously Announced Recapitalization Transactions
fin_news_nlp/yahoo_cad_tickers_news,https://ca.finance.yahoo.com/news/retransmission-extension-expiry-date-warrants-001500287.html,"Tarku Resources Ltd (TSXV:TKU)(FRA:7TK)(OTCQB:TRKUF) (the ""Company"" or ""Tarku"") announces that, subject to required approvals from regulatory authorities, more specifically the TSX Venture Exchange (the ""TSXV""), Tarku will extend until May 1, 2024, the expiry date of 12,500,000 common share purchase warrants (the ""Warrants"") issued in connection with a private placement closed on October 30, 2020 (the ""Private Placement"").",CAD,TKU.V,ACCESSWIRE - RETRANSMISSION; Extension of Expiry Date of Warrants
fin_news_nlp/yahoo_cad_tickers_news,https://ca.finance.yahoo.com/news/zedcor-places-162-globe-mails-233000181.html,"Calgary, Alberta--(Newsfile Corp. - September 26, 2022) - Zedcor Inc. (TSXV: ZDC) (the ""Company"" or ""Zedcor"") is pleased to announce it placed 162, which is in the top half of the 2022 Globe and Mail Report on Business ranking of Canada's Top Growing Companies. Canada's Top Growing Companies ranks Canadian companies on three-year revenue growth and the Company earned its spot with three-year growth of 278%.""I am extremely proud of our entire team ...",CAD,ZDC.V,Newsfile - Zedcor Places 162 on The Globe and Mail's Fourth-Annual Ranking of Canada's Top Growing Companies
fin_news_nlp/yahoo_cad_tickers_news,https://ca.finance.yahoo.com/news/ammpower-corp-announces-closing-first-221500046.html,"(CSE:AMMP)(OTCQB:AMMPF)(FSE:601A) AmmPower Corp. (the ""Company"" or ""AmmPower"") is pleased to announce, further to its news release dated September 15, 2022, that it has closed the first tranche of its non-brokered private placement (the ""Offering""), having issued 4,769,739 units (each a ""Unit"") at a price of $0.23 per Unit, for gross proceeds of $1,097,039.97.",CAD,AMMP.CN,ACCESSWIRE - AmmPower Corp. Announces Closing of The First Tranche of its Previously Announced Private Placement
