source,url,description,country,company,title
fin_news_nlp/yahoo_cad_tickers_news,https://ca.finance.yahoo.com/news/brp-breaks-ground-am-electric-130000726.html,"BRP Inc. (TSX: DOO) (NASDAQ: DOOO) confirms the start of construction of its first EV manufacturing plant and a major milestone in the Company's electric journey. Yesterday marked the ground-breaking ceremony of the Can-Am electric two-wheel motorcycle production facility in Querétaro, Mexico, which will be adjacent to the current BRP campus in the city. Production of the Can-Am Origin and Can-Am Pulse, the Company's first two electric motorcycle models unveiled at the recent Club BRP, is set to",CAD,DOO.TO,CNW Group - BRP BREAKS GROUND ON NEW CAN-AM ELECTRIC MOTORCYCLES PLANT IN QUERÉTARO
fin_news_nlp/yahoo_cad_tickers_news,https://ca.finance.yahoo.com/news/breezeline-puts-focus-cyber-bullying-130000755.html,"QUINCY, Mass., October 04, 2022--Breezeline, the nation’s eighth-largest cable operator, has distributed cyberbullying prevention resources to more than 2,200 educators this week in support of National Bullying Prevention Month, which is observed in October.",CAD,CCA.TO,"Business Wire - Breezeline Puts Focus on Cyber Bullying Prevention With Resources for Schools, Students and Parents"
fin_news_nlp/yahoo_cad_tickers_news,https://ca.finance.yahoo.com/news/real-estate-split-corp-announces-133400435.html,"Not for distribution to U.S. Newswire Services or for dissemination in the United States. TORONTO, Oct. 04, 2022 (GLOBE NEWSWIRE) -- Middlefield Group, on behalf of Real Estate Split Corp. (TSX: RS and RS.PR.A) (the “Company”), is pleased to announce a successful overnight treasury offering of class A and preferred shares (the “Class A Shares” and “Preferred Shares”, respectively). Gross proceeds of the offering are expected to be approximately $11.8 million. The offering is expected to close on",CAD,RS.TO,GlobeNewswire - Real Estate Split Corp. Announces Successful Overnight Offering
fin_news_nlp/yahoo_cad_tickers_news,https://ca.finance.yahoo.com/news/rbc-acquires-medical-billing-firm-133604502.html,"TORONTO — Royal Bank of Canada says it has acquired MDBilling.ca, a cloud-based platform that automates medical billing for Canadian physicians. Financial terms of the deal were not disclosed. RBC says the company joins Dr.Bill, another medical billing company acquired by the bank in 2020. MDBilling.ca services physicians in Ontario and British Columbia. The Toronto-based company was founded in 2008 and is used by close to 9,000 physicians. Jaime Wong, co-founder and CEO of MDBilling.ca, says th",CAD,RY.TO,"The Canadian Press - RBC acquires medical billing firm MDBilling.ca, financial terms not disclosed"
fin_news_nlp/yahoo_cad_tickers_news,https://ca.finance.yahoo.com/news/sandstorm-gold-royalties-announces-closing-130600250.html,"Sandstorm Gold Ltd. (""Sandstorm Gold Royalties"" or the ""Company"") (NYSE: SAND) (TSX: SSL) has closed its previously announced bought deal financing, including the exercise in full of the underwriters' over-allotment option, for a total of 18,055,000 common shares (the ""Common Shares"") sold at a price of US$5.10 per Common Share for aggregate gross proceeds to the Company of approximately US$92 million (the ""Offering"").",CAD,SSL.TO,CNW Group - Sandstorm Gold Royalties Announces Closing of Bought Deal Financing
fin_news_nlp/yahoo_cad_tickers_news,https://ca.finance.yahoo.com/news/spectral-medical-provides-tigris-clinical-132100476.html,"Robust recruitment activities experienced in closing weeks of September44 patients now enrolled TORONTO, Oct. 04, 2022 (GLOBE NEWSWIRE) -- Spectral Medical Inc. (“Spectral” or the “Company”) (TSX: EDT), a late stage theranostic company advancing therapeutic options for sepsis and septic shock, as well as commercializing a new proprietary platform targeting the renal replacement therapy market through its wholly-owned subsidiary Dialco Medical Inc. (“Dialco”), today provided a clinical trial upda",CAD,EDT.TO,GlobeNewswire - Spectral Medical Provides Update on Tigris Clinical Trial
fin_news_nlp/yahoo_cad_tickers_news,https://ca.finance.yahoo.com/news/yamana-gold-provides-notice-third-125400692.html,"TORONTO, Oct. 04, 2022 (GLOBE NEWSWIRE) -- YAMANA GOLD INC. (TSX:YRI; NYSE:AUY; LSE:AUY) (“Yamana” or “the Company”) announces that it will release its operational and financial results for the third quarter of this year after the market closes on Thursday, October 27, 2022. The Company will host a conference call and webcast to review the results on Friday, October 28, 2022 at 9:00 a.m. Eastern Daylight Time. Yamana further announces that it has filed the required notice setting a record and me",CAD,YRI.TO,GlobeNewswire - Yamana Gold Provides Notice of Third Quarter 2022 Results and Notice of Meeting and Record Date for the Proposed Transaction With Gold Fields
fin_news_nlp/yahoo_cad_tickers_news,https://ca.finance.yahoo.com/news/american-creek-reports-consistent-results-140100529.html,"Cardston, Alberta--(Newsfile Corp. - October 4, 2022) - American Creek Resources Ltd. (TSXV: AMK) (""the Corporation"" or ""American Creek"") is pleased to present the seventh set of drill results for the 2022 exploration program (the ""Program"") from operator Tudor Gold at their flagship property, Treaty Creek, located in the heart of the Golden Triangle of Northwestern British Columbia.Ken Konkin, Tudor Gold President and CEO, comments: ""We are very pleased to confirm that our step-out ...",CAD,AMK.V,Newsfile - American Creek Reports Consistent Results from Continued Step-Out Drilling at Treaty Creek Joint Venture Including 2.00 g/t AuEq over 66.0 m with 5.0 m of 8.22 g/t AuEq (GS-22-145-W1) and 4.38 g/t AuEq over 57 m (GS-22-154)
fin_news_nlp/yahoo_cad_tickers_news,https://ca.finance.yahoo.com/news/2-top-tsx-bank-stocks-144105684.html,"In a volatile market environment, Big Six bank stocks can be ideal investments. Here are two on the TSX that are worth considering, for vastly different reasons. The post 2 Top TSX Bank Stocks to Buy in October appeared first on The Motley Fool Canada.",CAD,BNS.TO,The Motley Fool - 2 Top TSX Bank Stocks to Buy in October
fin_news_nlp/yahoo_cad_tickers_news,https://ca.finance.yahoo.com/news/2-tsx-stocks-safety-recession-140000304.html,Fortis (TSX:FTS)(NYSE:FTS) and Restaurant Brands International (TSX:QSR)(NYSE:QSR) can help you make big money in a down year. The post 2 TSX Stocks With Safety in a Recession appeared first on The Motley Fool Canada.,CAD,FTS.TO,The Motley Fool - 2 TSX Stocks With Safety in a Recession
fin_news_nlp/yahoo_cad_tickers_news,https://ca.finance.yahoo.com/news/2-canadian-energy-stocks-monthly-143000761.html,Fundamentally strong energy stocks such as Pembina Pipeline and Keyera pay investors monthly dividends. The post 2 Canadian Energy Stocks (With Monthly Dividends) I’d Buy and Hold Forever appeared first on The Motley Fool Canada.,CAD,KEY.TO,The Motley Fool - 2 Canadian Energy Stocks (With Monthly Dividends) I’d Buy and Hold Forever
fin_news_nlp/yahoo_cad_tickers_news,https://ca.finance.yahoo.com/news/passive-income-120-per-month-140106800.html,Canadian investors can earn $120 per month in passive income from a high-yield TSX stock in the energy sector. The post Get Passive Income of $120 per Month With This TSX Stock appeared first on The Motley Fool Canada.,CAD,PPL.TO,The Motley Fool - Get Passive Income of $120 per Month With This TSX Stock
fin_news_nlp/yahoo_cad_tickers_news,https://ca.finance.yahoo.com/news/restaurant-brands-qsr-benefits-comps-150503385.html,"Restaurant Brands (QSR) gains from robust comparable sales, unit growth, solid performance of Tim Hortons and focus on its loyalty program.",CAD,QSR.TO,Zacks - Restaurant Brands (QSR) Benefits from Comps & Unit Growth
fin_news_nlp/yahoo_cad_tickers_news,https://ca.finance.yahoo.com/news/buy-td-bank-royal-bank-150000601.html,"Investors who missed the big rally in financial stocks are wondering if this is a good time to add TD (TSX:TD) or Royal Bank (TSX:RY) to their TFSA and RRSP portfolios, The post Should You Buy TD Bank or Royal Bank Stock Now? appeared first on The Motley Fool Canada.",CAD,RY.TO,The Motley Fool - Should You Buy TD Bank or Royal Bank Stock Now?
fin_news_nlp/yahoo_cad_tickers_news,https://ca.finance.yahoo.com/m/46e084aa-1522-303d-b589-3002e4e23890/why-shares-of-shopify%2C.html,"Shares of some growth stocks were spiking today as the broader market indices jumped.  As a result, investors returned to some technology stocks today, helping to lift Shopify (NYSE: SHOP) by 13.5%, PayPal Holdings (NASDAQ: PYPL) by 5.2%, and Appian (NASDAQ: APPN) by 7.3% as of 10:30 a.m. ET.",CAD,SHOP.TO,"Motley Fool - Why Shares of Shopify, PayPal, and Appian Are Surging Higher Today"
fin_news_nlp/yahoo_cad_tickers_news,https://ca.finance.yahoo.com/news/algonquin-power-utilities-corp-announces-110000631.html,"Algonquin Power & Utilities Corp. (TSX: AQN) (NYSE: AQN) (""AQN"" or the ""Company"") today announced it has entered into an agreement to sell ownership interests in a portfolio of operating wind projects in the United States and Canada to InfraRed Capital Partners, an international infrastructure investment manager that is part of SLC Management, the institutional alternatives and traditional asset management business of Sun Life Financial Inc. (""InfraRed"").",CAD,AQN.TO,CNW Group - Algonquin Power & Utilities Corp. Announces Inaugural Asset Recycling Transaction
fin_news_nlp/yahoo_cad_tickers_news,https://ca.finance.yahoo.com/news/smartest-dividend-aristocrats-buy-500-153000860.html,Here are two of the best Canadian Dividend Aristocrats investors can buy now to minimize their risk exposure amid ongoing market uncertainties. The post The Smartest Dividend Aristocrats to Buy With $500 Right Now appeared first on The Motley Fool Canada.,CAD,ENB.TO,The Motley Fool - The Smartest Dividend Aristocrats to Buy With $500 Right Now
fin_news_nlp/yahoo_cad_tickers_news,https://ca.finance.yahoo.com/news/equinox-gold-announces-commercial-production-170000942.html,"Equinox Gold Corp. (TSX: EQX) (NYSE American: EQX) (""Equinox Gold"" or the ""Company"") is pleased to announce that commercial production has been achieved at the Company's Santa Luz Gold Mine in Brazil effective October 1, 2022.",CAD,EQX.TO,CNW Group - Equinox Gold Announces Commercial Production at the Santa Luz Gold Mine
fin_news_nlp/yahoo_cad_tickers_news,https://ca.finance.yahoo.com/news/horizonte-minerals-plc-proposed-equity-183000342.html,"Horizonte Minerals Plc (AIM:HZM, TSX:HZM) announces its intention to conduct a proposed fundraising (the ""Fundraise"") to raise gross proceeds of approximately £61.7 million (approximately US$70 million) at a price of 90.5 pence per Placing Share (the ""Placing Price"").",CAD,HZM.TO,ACCESSWIRE - Horizonte Minerals PLC - Proposed Equity Fundraise of Approx £61.7 Million
fin_news_nlp/yahoo_cad_tickers_news,https://ca.finance.yahoo.com/news/horizonte-minerals-plc-araguaia-nickel-170500556.html,"Horizonte Minerals Plc (AIM:HZM)(TSX:HZM) a nickel company developing two Tier 1 assets in Brazil, is pleased to provide a progress update for its flagship 100% owned Araguaia Nickel Project (""Araguaia"" or the ""Project"").",CAD,HZM.TO,ACCESSWIRE - Horizonte Minerals PLC - Araguaia Nickel Project Construction on Schedule
fin_news_nlp/yahoo_cad_tickers_news,https://ca.finance.yahoo.com/news/ottawa-senators-partner-kinaxis-three-170500650.html,"OTTAWA, Ontario, October 04, 2022--The Ottawa Senators announce that the team has partnered with Kinaxis, a global technology leader of supply chain management software.",CAD,KXS.TO,Business Wire - Ottawa Senators Partner With Kinaxis on a Three-year Agreement as Road Helmet Sponsor
fin_news_nlp/yahoo_cad_tickers_news,https://ca.finance.yahoo.com/news/niocorp-ceo-automotive-industry-not-181700042.html,"Automotive and other manufacturers should not count on sufficient supplies of rare earths and other critical minerals coming from China, because China is increasingly consuming its own production for electric vehicles and other technologies that use permanent rare earth magnets, Mark A. Smith, CEO and Executive Chairman of NioCorp Developments Ltd. (""NioCorp"" or the ""Company"") (TSX: NB; OTCQX: NIOBF) said during an appearance Monday on Fox Business News.",CAD,NB.TO,CNW Group - NioCorp CEO: Automotive Industry Should Not Count on Sufficient Rare Earth Minerals Coming From China
fin_news_nlp/yahoo_cad_tickers_news,https://ca.finance.yahoo.com/news/snc-lavalin-hold-third-quarter-180000382.html,"SNC-Lavalin Group Inc. (TSX: SNC), a fully integrated professional services and project management company with offices around the world, will hold a conference call and audio webcast to discuss and present its third quarter financial results. The public is invited to listen to the conference call or the webcast on Friday, November 4, 2022, at 8:30 a.m. (Eastern Time). Participants will be Ian L. Edwards, President and Chief Executive Officer and Jeff Bell, Executive Vice-President and Chief Fin",CAD,SNC.TO,"CNW Group - SNC-Lavalin to hold its third quarter earnings conference call and webcast on November 4, 2022"
fin_news_nlp/yahoo_cad_tickers_news,https://ca.finance.yahoo.com/news/suncor-energy-su-beat-estimates-161004536.html,Suncor Energy (SU) has an impressive earnings surprise history and currently possesses the right combination of the two key ingredients for a likely beat in its next quarterly report.,CAD,SU.TO,Zacks - Will Suncor Energy (SU) Beat Estimates Again in Its Next Earnings Report?
fin_news_nlp/yahoo_cad_tickers_news,https://ca.finance.yahoo.com/news/velan-inc-announcement-171800201.html,"MONTRÉAL, Oct. 04, 2022 (GLOBE NEWSWIRE) -- Velan Inc. (TSX: VLN) announced today that, on Friday, October 14, 2022, it will release its financial results for the second quarter ended August 31, 2022. The company will hold an analyst call on Friday, October 14, 2022, at 4:00 P.M. (Eastern Daylight Time) to discuss the results. The call may be accessed by dialing 1-800-908-1236 and quoting the reservation number 22020915. Live content to support the discussion will be presented to participants at",CAD,VLN.TO,GlobeNewswire - Velan Inc.: Announcement
fin_news_nlp/yahoo_cad_tickers_news,https://ca.finance.yahoo.com/news/power-play-market-herald-releases-181500385.html,The Power Play by The Market Herald has announced the release of new interviews with Resouro Gold and Argentina Lithium & Energy Corp discussing their latest news.,CAD,LIT.V,ACCESSWIRE - The Power Play by The Market Herald Releases New Interviews with Resouro Gold and Argentina Lithium & Energy Corp Discussing Their Latest News
fin_news_nlp/yahoo_cad_tickers_news,https://ca.finance.yahoo.com/news/why-bce-tsx-bce-fell-170000555.html,BCE Inc. (TSX:BCE) is sliding lower because of rising interest rates. The post Why BCE (TSX:BCE) Fell 13% in September appeared first on The Motley Fool Canada.,CAD,BCE.TO,The Motley Fool - Why BCE (TSX:BCE) Fell 13% in September
fin_news_nlp/yahoo_cad_tickers_news,https://ca.finance.yahoo.com/news/why-did-cenovus-tsx-cve-183000307.html,Cenovus (TSX:CVE)(NYSE:CVE) stock fell 15% as oil prices weakened in September. Is this Canadian energy major a value buy? The post Why Did Cenovus (TSX:CVE) Drop 15.7% in September? appeared first on The Motley Fool Canada.,CAD,CVE.TO,The Motley Fool - Why Did Cenovus (TSX:CVE) Drop 15.7% in September?
fin_news_nlp/yahoo_cad_tickers_news,https://ca.finance.yahoo.com/news/electrovaya-build-first-u-gigafactory-200100024.html,Benzinga - Kenneth Adams,CAD,EFL.TO,"News Direct - Electrovaya To Build Its First U.S. Gigafactory in New York State, To Open In Phases Starting In Late 2023"
fin_news_nlp/yahoo_cad_tickers_news,https://ca.finance.yahoo.com/news/k92-mining-announces-2022-third-201500190.html,"VANCOUVER, British Columbia, Oct. 04, 2022 (GLOBE NEWSWIRE) -- K92 Mining Inc. (“K92” or the “Company”) (TSX: KNT; OTCQX: KNTNF) announces that it will release its 2022 third quarter financial results before the North American trading markets open on Monday, November 14, 2022. Conference Call and Webcast to Present Results K92 will host a conference call and webcast to present the 2022 third quarter financial results at 8:30 am (EST) on Monday, November 14, 2022. Listeners may access the confere",CAD,KNT.TO,GlobeNewswire - K92 Mining Announces 2022 Third Quarter Financial Results Conference Call Details
fin_news_nlp/yahoo_cad_tickers_news,https://ca.finance.yahoo.com/news/niocorp-ceo-automotive-industry-not-181700216.html,"Automotive and other manufacturers should not count on sufficient supplies of rare earths and other critical minerals coming from China, because China is increasingly consuming its own production for electric vehicles and other technologies that use permanent rare earth magnets, Mark A. Smith, CEO and Executive Chairman of NioCorp Developments Ltd. (""NioCorp"" or the ""Company"") (TSX: NB; OTCQX: NIOBF) said during an appearance Monday on Fox Business News.",CAD,NB.TO,CNW Group - NioCorp CEO: Automotive Industry Should Not Count on Sufficient Rare Earth Minerals Coming From China
fin_news_nlp/yahoo_cad_tickers_news,https://ca.finance.yahoo.com/news/why-park-lawn-tsx-plc-173000016.html,Park Lawn Corporation (TSX:PLC) stock has been hit by broader volatility and a slowdown in its recent earnings. The post Why Park Lawn (TSX:PLC) Stock Fell 14% in September appeared first on The Motley Fool Canada.,CAD,PLC.TO,The Motley Fool - Why Park Lawn (TSX:PLC) Stock Fell 14% in September
fin_news_nlp/yahoo_cad_tickers_news,https://ca.finance.yahoo.com/news/why-shopify-tsx-shop-dropped-181645812.html,Shopify stock dipped even further in September. Here's what you can expect to happen next. The post Why Shopify (TSX:SHOP) Dropped 9.8% in September appeared first on The Motley Fool Canada.,CAD,SHOP.TO,The Motley Fool - Why Shopify (TSX:SHOP) Dropped 9.8% in September
fin_news_nlp/yahoo_cad_tickers_news,https://ca.finance.yahoo.com/news/most-actively-traded-companies-toronto-205044182.html,"TORONTO — Some of the most active companies traded Tuesday on the Toronto Stock Exchange: Toronto Stock Exchange (19,370.99, up 489.80 points.) Toronto-Dominion Bank. (TSX:TD). Financials. Up $1.62, or 1.88 per cent, to $87.99 on 15.7 million shares. Bank of Nova Scotia. (TSX:BNS). Financials. Up $1.53, or 2.3 per cent, to $67.11 on 12.5 million shares. Baytex Energy Corp. (TSX:BTE). Energy. Up 42 cents, or 6.66 per cent, to $6.73 on 7.6 million shares. Cenovus Energy Inc. (TSX:CVE). Energy. Up",CAD,SU.TO, - Most actively traded companies on the Toronto Stock Exchange
fin_news_nlp/yahoo_cad_tickers_news,https://ca.finance.yahoo.com/news/suncor-energy-announces-pricing-tender-200900669.html,"Calgary, Alberta--(Newsfile Corp. - October 4, 2022) - Suncor Energy Inc. (TSX: SU) (NYSE: SU) (""Suncor"") today announced the pricing of the offers to purchase for cash any and all of the ten series of outstanding notes described below (""Notes""), up to a maximum C$1,750,000,000 aggregate amount of Total Consideration (as defined below), on the terms and conditions set forth in the Offer to Purchase, dated September 26, 2022 (the ""Offer to Purchase""). The ...",CAD,SU.TO,Newsfile - Suncor Energy Announces Pricing of Tender Offers for Ten Series of Notes
fin_news_nlp/yahoo_cad_tickers_news,https://ca.finance.yahoo.com/news/165-per-month-passive-income-184927677.html,These two monthly passive income stocks are offering ultra-high dividends for investors right now. The post How to Make $165 per Month in Passive Income Right Now appeared first on The Motley Fool Canada.,CAD,RNW.TO,The Motley Fool - How to Make $165 per Month in Passive Income Right Now
fin_news_nlp/yahoo_cad_tickers_news,https://ca.finance.yahoo.com/news/trisura-group-announce-third-quarter-203300712.html,"TORONTO, Oct. 04, 2022 (GLOBE NEWSWIRE) -- Trisura Group Ltd. (“Trisura” or “Trisura Group”) (TSX: TSU), a leading specialty insurance provider, will release its third quarter 2022 results after the market closes on Thursday, November 3rd, 2022. The company will host a conference call for analysts and investors on Friday, November 4th, 2022 at 9:00 a.m. ET. Conference call participants will be David Clare, President and Chief Executive Officer and David Scotland, Chief Financial Officer. To list",CAD,TSU.TO,"GlobeNewswire - Trisura Group to Announce Third Quarter Results On November 3rd, 2022 and Host Earnings Conference Call the Following Day"
fin_news_nlp/yahoo_cad_tickers_news,https://ca.finance.yahoo.com/news/got-5-000-2-growth-231500857.html,"Have money to invest for the long term? Beat the market averages with these two growth stocks. The post Got $5,000? These 2 Growth Stocks Are Smart Buys appeared first on The Motley Fool Canada.",CAD,ATZ.TO,"The Motley Fool - Got $5,000? These 2 Growth Stocks Are Smart Buys"
fin_news_nlp/yahoo_cad_tickers_news,https://ca.finance.yahoo.com/news/bmo-closes-market-210900154.html,"Representatives from the BMO ETF team with Bank of Montreal (TSX: BMO) joined Graham Mackenzie, Head of Exchange Traded Products, Toronto Stock Exchange (TSX), to celebrate the BMO ETF Forum in Vancouver and to close the market.",CAD,BMO.TO,CNW Group - BMO Closes the Market
fin_news_nlp/yahoo_cad_tickers_news,https://ca.finance.yahoo.com/news/boyd-group-services-inc-provides-225000864.html,"Boyd Group Services Inc. (TSX: BYD.TO) (""the Boyd Group"", ""Boyd"" or ""the Company"") announced that nearly all Gerber Collision & Glass (""Gerber"") locations that were temporarily closed in the states of Florida and South Carolina have now re-opened. In total, 62 collision locations were ultimately impacted by temporary closures as well as the Florida Glass America business. As of today, four collision locations in Southwest Florida remain closed, and may remain closed for several weeks. Where prac",CAD,BYD.TO,CNW Group - Boyd Group Services Inc. Provides Hurricane Ian Update
fin_news_nlp/yahoo_cad_tickers_news,https://ca.finance.yahoo.com/news/capstone-copper-release-2022-third-210000943.html,"VANCOUVER, British Columbia, October 04, 2022--Capstone Copper Corp. (""Capstone"" or the ""Company"") (TSX:CS) will release its 2022 third quarter (""Q3 2022"") results on Monday, October 31, 2022 prior to market open. The announcement will be followed by an investor conference call the same day at 11:00 am Eastern Time / 8:00 am Pacific Time.",CAD,CS.TO,"Business Wire - Capstone Copper to Release 2022 Third Quarter Results on October 31, 2022"
fin_news_nlp/yahoo_cad_tickers_news,https://ca.finance.yahoo.com/news/5-things-know-cineplex-stock-224500235.html,"While Cineplex stock does face some uncertainty, there are several reasons to be bullish on the entertainment stock today. The post 5 Things to Know About Cineplex Stock appeared first on The Motley Fool Canada.",CAD,CGX.TO,The Motley Fool - 5 Things to Know About Cineplex Stock
fin_news_nlp/yahoo_cad_tickers_news,https://ca.finance.yahoo.com/news/diversified-royalty-corp-announces-october-210000419.html,"VANCOUVER, British Columbia, Oct. 04, 2022 (GLOBE NEWSWIRE) -- Diversified Royalty Corp. (TSX: DIV; DIV.DB and DIV.DB.A) (the “Corporation” or “DIV”) is pleased to announce that its board of directors has approved a cash dividend of $0.01958 per common share for the period of October 1, 2022 to October 31, 2022, which is equal to $0.235 per common share on an annualized basis. The dividend will be paid on October 31, 2022 to shareholders of record as of the close of business on October 14, 2022.",CAD,DIV.TO,GlobeNewswire - Diversified Royalty Corp. Announces October 2022 Cash Dividend
fin_news_nlp/yahoo_cad_tickers_news,https://ca.finance.yahoo.com/news/ecn-capital-announces-completion-sale-210100270.html,"TORONTO, Oct. 04, 2022 (GLOBE NEWSWIRE) -- ECN Capital Corp. (TSX: ECN) (“ECN Capital” or the “Company”) is pleased to announce that it has closed its previously announced sale to funds managed by Stone Point Capital LLC (“Stone Point”) of all of the issued and outstanding equity interests in ECN Kessler Holdco LLC (the “Kessler Group”), a wholly-owned, indirect subsidiary of the Company through which ECN Capital operated the Kessler Group business (the “Transaction”). ECN Capital expects to use",CAD,ECN.TO,GlobeNewswire - ECN Capital Announces Completion of the Sale of its Kessler Group Business To Stone Point Capital
fin_news_nlp/yahoo_cad_tickers_news,https://ca.finance.yahoo.com/news/equinox-gold-announces-commercial-production-170000167.html,"Equinox Gold Corp. (TSX: EQX) (NYSE American: EQX) (""Equinox Gold"" or the ""Company"") is pleased to announce that commercial production has been achieved at the Company's Santa Luz Gold Mine in Brazil effective October 1, 2022.",CAD,EQX.TO,CNW Group - Equinox Gold Announces Commercial Production at the Santa Luz Gold Mine
fin_news_nlp/yahoo_cad_tickers_news,https://ca.finance.yahoo.com/news/why-goeasy-tsx-gsy-stock-214500029.html,"Despite a challenging environment, I am bullish on goeasy due to its solid track record, healthy long-term growth prospects, and attractive valuation. The post Why goeasy (TSX:GSY) Stock Fell 9.5% in September appeared first on The Motley Fool Canada.",CAD,GSY.TO,The Motley Fool - Why goeasy (TSX:GSY) Stock Fell 9.5% in September
