source,url,description,country,company,title
fin_news_nlp/yahoo_cad_tickers_news,https://ca.finance.yahoo.com/news/one-orvana-minerals-corp-tse-175425004.html,"Viewing insider transactions for Orvana Minerals Corp.'s ( TSE:ORV ) over the last year, we see that insiders were net...",CAD,ORV.TO,Simply Wall St. - One Orvana Minerals Corp. (TSE:ORV) insider upped their stake by 49% in the previous year
fin_news_nlp/yahoo_cad_tickers_news,https://ca.finance.yahoo.com/news/3-spring-loaded-stocks-ll-163000879.html,Growth stocks trading on the TSX such as Shopify are well poised to deliver game-changing returns to investors in the next 12 months. The post 3 Spring-Loaded Stocks You’ll Want to Own When They Snap Back appeared first on The Motley Fool Canada.,CAD,SHOP.TO,The Motley Fool - 3 Spring-Loaded Stocks You’ll Want to Own When They Snap Back
fin_news_nlp/yahoo_cad_tickers_news,https://ca.finance.yahoo.com/news/keystone-leaked-more-oil-other-180334117.html,(Bloomberg) -- Last week’s oil spill in Kansas means that TC Energy Corp.’s Keystone pipeline has now leaked more crude oil than any other conduit on US land in the past 12 years. Most Read from BloombergChina’s Rapid Covid Reversal Sparks Whiplash as Cases SurgeUS Says Scientists Make Breakthrough in Nuclear Fusion EnergyFed’s Message That Rates Will Stay on Hold for ‘Some Time’ Clashes With 2023 Rate-Cut BetsElon Musk Steps Up Attacks on Twitter’s Former Safety HeadChina’s Top Medical Adviser,CAD,TRP.TO,Bloomberg - Keystone Has Leaked More Oil Than Any Other Pipeline in US Since 2010
fin_news_nlp/yahoo_cad_tickers_news,https://ca.finance.yahoo.com/news/keystone-pipeline-leaks-becoming-more-172542303.html,"CALGARY — U.S. government data shows spills from TC Energy Corp.'s Keystone pipeline have increased in severity in recent years. The Calgary-based company has more than 250 people on the ground in Washington County, Kan., cleaning up the approximately 14,000 barrels of oil that leaked into a creek last week. The spill is the largest in the history of the 4,324-km Keystone pipeline. A report last year from the U.S. Government Accountability Office said pipelines are considered to be much safer th",CAD,TRP.TO,"The Canadian Press - Keystone pipeline leaks becoming more severe in recent years, U.S. data shows"
fin_news_nlp/yahoo_cad_tickers_news,https://ca.finance.yahoo.com/news/rio-tinto-rio-gets-turquoise-160704958.html,"Rio Tinto (RIO) receives shareholder approval for buying 49% interest in Turquoise Hill Resources, that will lead to full ownership in the latter.",CAD,TRQ.TO,Zacks - Rio Tinto (RIO) Gets Turquoise Hill Shareholder Nod For Buyout
fin_news_nlp/yahoo_cad_tickers_news,https://ca.finance.yahoo.com/news/bausch-lombs-one-one-biotrue-120000191.html,"Bausch + Lomb Corporation (NYSE/TSX: BLCO) (""Bausch + Lomb""), a leading global eye health company dedicated to helping people see better to live better, today announced its first-of-its-kind ONE by ONE and Biotrue Eye Care Recycling programs have been named a gold winner in the Most Environmentally Friendly Service of the Year category by the 2022 Best in Biz Awards.",CAD,BLCO.TO,CNW Group - Bausch + Lomb's ONE by ONE and Biotrue® Eye Care Recycling Programs Win Gold for Most Environmentally Friendly Service of the Year from Best in Biz Awards
fin_news_nlp/yahoo_cad_tickers_news,https://ca.finance.yahoo.com/news/brp-rotax-celebrates-100-two-183900030.html,"Last Friday, BRP Inc. (TSX: DOO) (NASDAQ: DOOO) proudly marked the 102nd anniversary of BRP-Rotax during an exclusive and unforgettable gala at the Wels Exhibition Center in Austria. Together with about 2,000 employees, partners and guests of honor, the Upper Austrian company commemorated historical milestones and successes in addition to celebrating the present and the future with promising projects that lie ahead.",CAD,DOO.TO,CNW Group - BRP-Rotax celebrates 100 and two years of success with a grand gala to mark its centennial anniversary
fin_news_nlp/yahoo_cad_tickers_news,https://ca.finance.yahoo.com/news/constellation-buy-u-broadcasting-software-192112078.html,"TORONTO — Constellation Software Inc. says it will buy U.S. tech company WideOrbit Inc., merge the firm with its subsidiary Lumine Group and then spin them off into a separate business. The Toronto software company says the purchase will involve an undisclosed cash payment, as well as the issuance of a 14 per cent stake in the Lumine Group to WideOrbit shareholders. San Francisco, Calif.-based WideOrbit develops sales, traffic, billing and broadcast automation software for media companies and ha",CAD,CSU.TO," - Constellation to buy U.S. broadcasting software firm WideOrbit, create spinoff"
fin_news_nlp/yahoo_cad_tickers_news,https://ca.finance.yahoo.com/news/why-growth-investors-buy-descartes-174505315.html,Descartes Systems (DSGX) could produce exceptional returns because of its solid growth attributes.,CAD,DSG.TO,Zacks - Here is Why Growth Investors Should Buy Descartes Systems (DSGX) Now
fin_news_nlp/yahoo_cad_tickers_news,https://ca.finance.yahoo.com/news/nearing-retirement-3-best-tsx-170000056.html,Here are three TSX stocks to take care of you in your sunset years. The post Nearing Retirement? The 3 Best TSX Dividend Stocks to Buy Now appeared first on The Motley Fool Canada.,CAD,FTS.TO,The Motley Fool - Nearing Retirement? The 3 Best TSX Dividend Stocks to Buy Now
fin_news_nlp/yahoo_cad_tickers_news,https://ca.finance.yahoo.com/news/hudbay-announces-climate-change-initiatives-200000267.html,"TORONTO, Dec. 12, 2022 (GLOBE NEWSWIRE) -- Hudbay Minerals Inc. (“Hudbay” or the “company”) (TSX, NYSE: HBM) is pleased to announce its commitment to achieve net zero greenhouse gas (“GHG”) emissions by 2050 and the adoption of interim 2030 GHG reduction targets to support this commitment. In 2021, Hudbay initiated a roadmap to further identify and manage risks associated with climate change, and opportunities to reduce GHG emissions in alignment with global decarbonization goals. While Hudbay’s",CAD,HBM.TO,"GlobeNewswire - Hudbay Announces Climate Change Initiatives, 2030 Greenhouse Gas Reduction Targets and Net Zero Commitment"
fin_news_nlp/yahoo_cad_tickers_news,https://ca.finance.yahoo.com/news/2-top-energy-stocks-getting-180000596.html,Two TSX energy stocks with a head start look to have a clear competitive advantage in the anticipated EV boom. The post 2 Top Energy Stocks Getting into the EV Boom appeared first on The Motley Fool Canada.,CAD,IMO.TO,The Motley Fool - 2 Top Energy Stocks Getting into the EV Boom
fin_news_nlp/yahoo_cad_tickers_news,https://ca.finance.yahoo.com/news/tfsa-buy-2-stocks-6-173000761.html,"Canadians who want to utilize the $6,500 TFSA room limit in 2023 should look to promising stocks like Savaria (TSX:SIS). The post TFSA: Buy These 2 Stocks With the New $6,500 Room Limit in 2023 appeared first on The Motley Fool Canada.",CAD,SIS.TO,"The Motley Fool - TFSA: Buy These 2 Stocks With the New $6,500 Room Limit in 2023"
fin_news_nlp/yahoo_cad_tickers_news,https://ca.finance.yahoo.com/news/almadex-intersects-1-3-metres-190500968.html,"San Pedro Property Location Map San Pedro Property Drill Plan Map San Pedro Property Section SP-22-004 VANCOUVER, British Columbia, Dec. 12, 2022 (GLOBE NEWSWIRE) -- Almadex Minerals Ltd. (""Almadex"" or the ""Company"") (TSX-V: “DEX) is pleased to announce that it has received results from the second hole (SP-22-004) drilled in 2022 on its wholly owned San Pedro Project located in Jalisco, Mexico (Figure 1). This hole was drilled from the same pad as hole SP-22-003 which intersected 4.51 metres of",CAD,DEX.V,"GlobeNewswire - Almadex intersects 1.3 metres of 846.0 g/t Silver at the San Pedro Silver-Gold Project, Mexico"
fin_news_nlp/yahoo_cad_tickers_news,https://ca.finance.yahoo.com/news/2-tsx-utilities-d-buy-190000923.html,"Algonquin Power stock has a huge 9.8% dividend, but investors need to be cautious. Here are two top TSX utilities I'd prefer to buy today instead. The post 2 TSX Utilities I’d Buy Over Algonquin Stock Right Now appeared first on The Motley Fool Canada.",CAD,AQN.TO,The Motley Fool - 2 TSX Utilities I’d Buy Over Algonquin Stock Right Now
fin_news_nlp/yahoo_cad_tickers_news,https://ca.finance.yahoo.com/news/bank-montreal-drops-2-3-223444277.html,"(Bloomberg) -- Bank of Montreal, which is working to close the largest acquisition in its history, is selling C$3.15 billion ($2.31 billion) in equity to make sure it can meet Canadian regulators’ recently-increased capital requirements.Most Read from BloombergElon Musk Is Ruining Trump’s Presidential CampaignChina’s Rapid Covid Reversal Sparks Whiplash as Cases SurgeUS Says Scientists Make Breakthrough in Nuclear Fusion EnergySam Bankman-Fried Arrested in Bahamas as US Files FTX ChargesGoldman",CAD,BMO.TO,Bloomberg - Bank of Montreal Drops on $2.3 Billion Stock Sale to Hit Capital Hurdle
fin_news_nlp/yahoo_cad_tickers_news,https://ca.finance.yahoo.com/news/bank-montreal-announces-offering-common-212200785.html,"Bank of Montreal (TSX: BMO)(NYSE: BMO) (the ""Bank"", ""we"" or ""us"") today announced the issue and sale of common shares pursuant to a public offering and a concurrent private placement for gross proceeds totaling approximately C$3.15 billion. This follows the announcement by the Office of the Superintendent for Financial Institutions (""OSFI"") of its intention to increase the domestic stability buffer (""DSB"") for Domestic Systemically Important Banks (""D-SIBs"").",CAD,BMO.TO,CNW Group - Bank of Montreal Announces Offering of Common Shares for Gross Proceeds of C$3.15 Billion following the increase to the Domestic Stability Buffer
fin_news_nlp/yahoo_cad_tickers_news,https://ca.finance.yahoo.com/news/most-actively-traded-companies-toronto-222159012.html,"TORONTO — Some of the most active companies traded Monday on the Toronto Stock Exchange: Toronto Stock Exchange (20,019.70, up 72.63): Suncor Energy Inc. (TSX:SU). Energy. Up 97 cents, or 2.40 per cent, to $41.35 on 16 million shares. Canadian Natural Resources Ltd. (TSX:CNQ). Energy. Up 44 cents, or 0.59 per cent, to $75.09 on 15.2 million shares. Enbridge Inc. (TSX:ENB). Energy. Up 22 cents, or 0.41 per cent, to $53.61 on 12.8 million shares. Manulife Financial Corp. (TSX:MFC). Financials. Up",CAD,BNS.TO, - Most actively traded companies on the Toronto Stock Exchange
fin_news_nlp/yahoo_cad_tickers_news,https://ca.finance.yahoo.com/news/2-bank-stocks-load-recession-210000585.html,These Canadian bank stocks appear undervalued today. The post 2 Bank Stocks to Load Up on in a Recession appeared first on The Motley Fool Canada.,CAD,BNS.TO,The Motley Fool - 2 Bank Stocks to Load Up on in a Recession
fin_news_nlp/yahoo_cad_tickers_news,https://ca.finance.yahoo.com/news/earn-passive-income-years-dividend-220000988.html,"A dividend aristocrat keeps your investment relatively stable, and a regular and growing dividend keeps passive income coming for years. The post Earn Passive Income for Years With This Dividend Aristocrat appeared first on The Motley Fool Canada.",CAD,BCE.TO,The Motley Fool - Earn Passive Income for Years With This Dividend Aristocrat
fin_news_nlp/yahoo_cad_tickers_news,https://ca.finance.yahoo.com/news/smartest-dividend-stocks-buy-400-210000952.html,Looking for some of the smartest dividend stocks to buy? Here’s a stock duo you can start investing in today with just $400. The post The Smartest Dividend Stocks to Buy With $400 Right Now appeared first on The Motley Fool Canada.,CAD,BCE.TO,The Motley Fool - The Smartest Dividend Stocks to Buy With $400 Right Now
fin_news_nlp/yahoo_cad_tickers_news,https://ca.finance.yahoo.com/news/cardinal-energy-ltd-announces-monthly-220000049.html,"CALGARY, Alberta, Dec. 12, 2022 (GLOBE NEWSWIRE) -- Cardinal Energy Ltd. (""Cardinal"" or the ""Company"") (TSX: CJ) confirms that our December dividend of $0.06 per common share will be paid on January 16, 2023 to shareholders of record on December 30, 2022. The Board of Directors of Cardinal has declared the dividend payable in cash. This dividend has been designated as an ""eligible dividend"" for Canadian income tax purposes. About Cardinal Energy Ltd. Cardinal works to continually improve its Env",CAD,CJ.TO,GlobeNewswire - Cardinal Energy Ltd. Announces Monthly Dividend for December
fin_news_nlp/yahoo_cad_tickers_news,https://ca.finance.yahoo.com/news/supply-chain-stock-d-buy-213000136.html,Descartes Systems Group Inc. (TSX:DSG) is a supply chain stock that is on track for strong growth and offers solid value right now. The post A Supply Chain Stock I’d Buy Tons of Today appeared first on The Motley Fool Canada.,CAD,DSG.TO,The Motley Fool - A Supply Chain Stock I’d Buy Tons of Today
fin_news_nlp/yahoo_cad_tickers_news,https://ca.finance.yahoo.com/news/hardly-anyone-knows-stock-whose-200000990.html,"One obscure industrial stock that raised dividends by 29% recently wants to keep returning a significant portion of its resilient cash flows to shareholders. The post Hardly Anyone Knows About This Stock, Whose Dividend Just Jumped 29% appeared first on The Motley Fool Canada.",CAD,EFN.TO,"The Motley Fool - Hardly Anyone Knows About This Stock, Whose Dividend Just Jumped 29%"
fin_news_nlp/yahoo_cad_tickers_news,https://ca.finance.yahoo.com/news/better-buy-enbridge-vs-pembina-190000050.html,Performance is improving among midstream energy companies. Let’s look at whether Enbridge or Pembina Pipeline would be a better buy right now. The post Better Buy: Enbridge vs. Pembina Pipeline Stock appeared first on The Motley Fool Canada.,CAD,ENB.TO,The Motley Fool - Better Buy: Enbridge vs. Pembina Pipeline Stock
fin_news_nlp/yahoo_cad_tickers_news,https://ca.finance.yahoo.com/news/dividend-stock-safe-bet-regardless-210000672.html,"Fortis is a TSX dividend stock that has increased its payouts for 49 consecutive years, making FTS attractive to passive income investors. The post This Dividend Stock Is a Safe Bet Regardless of Market Conditions appeared first on The Motley Fool Canada.",CAD,FTS.TO,The Motley Fool - This Dividend Stock Is a Safe Bet Regardless of Market Conditions
fin_news_nlp/yahoo_cad_tickers_news,https://ca.finance.yahoo.com/news/hut-8-appoints-chief-financial-222100260.html,"Hut 8 Mining Corp. (Nasdaq: HUT) (TSX: HUT), (""Hut 8"" or the ""Company"") one of North America's largest, innovation-focused digital asset mining pioneers and high performance computing infrastructure provider, is pleased to announce the appointment of Shenif Visram, CPA, CMA as the company's Chief Financial Officer (CFO), effective immediately. With more than 20 years of financial management experience in the infrastructure and technology businesses, Shenif brings a wealth of leadership expertise",CAD,HUT.TO,CNW Group - Hut 8 Appoints New Chief Financial Officer
fin_news_nlp/yahoo_cad_tickers_news,https://ca.finance.yahoo.com/news/keyera-announces-december-2022-dividend-220000603.html,"Keyera Corp. (TSX: KEY) (""Keyera"") announced today a cash dividend for December 2022 of 16.00 cents per common share. The dividend will be payable on January 16, 2023, to shareholders of record on December 22, 2022. The ex-dividend date is December 21, 2022. This dividend is an eligible dividend for the purposes of the Income Tax Act (Canada). For non-resident shareholders, Keyera's dividends are subject to Canadian withholding tax.",CAD,KEY.TO,CNW Group - Keyera Announces December 2022 Dividend
fin_news_nlp/yahoo_cad_tickers_news,https://ca.finance.yahoo.com/news/lion-electric-announces-launch-overnight-212100198.html,"This news release constitutes a ""designated news release"" for the purposes of the Company’s prospectus supplement dated June 17, 2022 to its short form base shelf prospectus dated June 17, 2022. MONTREAL, Dec. 12, 2022 (GLOBE NEWSWIRE) -- The Lion Electric Company (NYSE: LEV) (TSX: LEV) (""Lion"" or the ""Company""), a leading manufacturer of all-electric medium and heavy-duty urban vehicles, today announced the launch of a marketed public offering of units (the ""Units"") in the United States and Can",CAD,LEV.TO,GlobeNewswire - Lion Electric Announces Launch of Overnight Marketed Public Offering of Units
fin_news_nlp/yahoo_cad_tickers_news,https://ca.finance.yahoo.com/news/mullen-group-ltd-announces-divestiture-203800081.html,"(TSX: MTL) Mullen Group Ltd. (""Mullen Group"", ""We"", ""Our"" and/or the ""Corporation"") announced today the closing of an asset purchase agreement (the ""Transaction"") with Environmental 360 Solutions Ltd. (""E360S""), which included E360S purchasing the hydrovac assets and business operating out of Sherwood Park, Alberta, under the former operating entity Canadian Hydrovac Ltd. and the hydrovac assets and business operating out of Hardisty, Alberta, under the former operating entity Recon Utility Sear",CAD,MTL.TO,CNW Group - Mullen Group Ltd. Announces the Divestiture of Non-Core Assets
fin_news_nlp/yahoo_cad_tickers_news,https://ca.finance.yahoo.com/news/numinus-participate-kcsa-mental-health-211000137.html,"Numinus Wellness Inc. (""Numinus"" or the ""Company"") (TSX: NUMI) (OTCQX: NUMIF), a mental health care company advancing innovative treatments and safe, evidence-based psychedelic-assisted therapies, today announced that Payton Nyquvest, Founder and CEO of Numinus, will present at the KCSA Mental Health Investor Conference to be held at VirtualInvestorConferences.com on Thursday, December 15, 2022 at 12:30 p.m. ET / 9:30 a.m. PT.",CAD,NUMI.TO,"CNW Group - Numinus to Participate in the KCSA Mental Health Virtual Investor Conference on December 15, 2022"
fin_news_nlp/yahoo_cad_tickers_news,https://ca.finance.yahoo.com/news/park-lawn-completes-jacoby-acquisition-220000732.html,"Park Lawn Corporation (TSX:PLC, PLC.U) (""PLC"" or ""Park Lawn"") has completed the previously announced acquisition of substantially all the assets of Schrader, Aragon & Jacoby Funeral Home, Mountain View Memorial Park and Bustard & Jacoby Funerals, Cremation, Monuments and Receptions (collectively ""Jacoby""), a group of businesses consisting of two stand-alone funeral homes and one stand-alone cemetery located in Cheyenne and Casper, Wyoming.",CAD,PLC.TO,ACCESSWIRE - Park Lawn Completes Jacoby Acquisition
fin_news_nlp/yahoo_cad_tickers_news,https://ca.finance.yahoo.com/news/rogers-sugar-must-own-consumer-200000385.html,Risk-averse investors expecting a recession in 2023 have a safety net and passive income in TSX's top consumer staples stock. The post Rogers Sugar: A Must-Own Consumer Staples Stock in 2023 appeared first on The Motley Fool Canada.,CAD,RSI.TO,The Motley Fool - Rogers Sugar: A Must-Own Consumer Staples Stock in 2023
fin_news_nlp/yahoo_cad_tickers_news,https://ca.finance.yahoo.com/news/savaria-president-ceo-intends-distribute-001500987.html,"LAVAL, Québec, Dec. 12, 2022 (GLOBE NEWSWIRE) -- Savaria Corporation (“Savaria”) (TSX: SIS) a global leader in the accessibility industry, announces today that Mr. Marcel Bourassa, President and CEO of Savaria, has filed a notice of intention to distribute securities in connection with his proposed sale of up to 1,700,000 common shares of Savaria (representing up to 2.64% of the issued and outstanding common shares). The common shares are expected to be sold through the facilities of the Toronto",CAD,SIS.TO,GlobeNewswire - Savaria President and CEO Intends to Distribute Securities
fin_news_nlp/yahoo_cad_tickers_news,https://ca.finance.yahoo.com/news/ssr-mining-announces-positive-exploration-213000300.html,"DENVER, December 12, 2022--SSR Mining Inc. (NASDAQ/TSX: SSRM, ASX: SSR) (""SSR Mining"" or the ""Company"") is pleased to announce results from 377 diamond drill holes completed at the Seabee property in Saskatchewan, Canada, for the September, 2021 to November, 2022 exploration period (the ""Exploration Period""). These results build upon, and are subsequent to, the Seabee 2021 Technical Report Summary (the ""2021 Seabee TRS""), which highlighted a six-year Mineral Reserve life averaging approximately",CAD,SSRM.TO,Business Wire - SSR Mining Announces Positive Exploration Results at Seabee
fin_news_nlp/yahoo_cad_tickers_news,https://ca.finance.yahoo.com/news/top-stock-reports-jpmorgan-intel-215009497.html,"Today's Research Daily features new research reports on 16 major stocks, including JPMorgan Chase & Co. (JPM), Intel Corporation (INTC) and Advanced Micro Devices, Inc. (AMD).",CAD,SU.TO,"Zacks - Top Stock Reports for JPMorgan, Intel & Advanced Micro Devices"
fin_news_nlp/yahoo_cad_tickers_news,https://ca.finance.yahoo.com/news/oil-rises-u-supply-concerns-022637876.html,"Oil prices rose for a second day on Tuesday as a key pipeline supplying the United States, the world's biggest crude consumer, remained shut and on expectations loosening COVID restrictions in China, the second-biggest user globally, will boost demand.  Brent crude futures rose 64 cents, or 0.8%, to $78.63 per barrel by 0202 GMT, while U.S. West Texas Intermediate (WTI) crude futures gained 64 cents, or 0.9%, to $73.81.  The closure of TC Energy Corp's Keystone Pipeline, which ships about 620,000 barrels-per-day of Canadian crude from Alberta to the United States, has tightened supplies and raised the prospect that inventories at the Cushing, Oklahoma, storage hub will decline.",CAD,TRP.TO,"Reuters - Oil rises on U.S. supply concerns, hopes for returning China demand"
fin_news_nlp/yahoo_cad_tickers_news,https://ca.finance.yahoo.com/news/tilray-brands-inc-tlry-outpaces-231511858.html,"Tilray Brands, Inc. (TLRY) closed at $3.54 in the latest trading session, marking a +1.72% move from the prior day.",CAD,TLRY.TO,"Zacks - Tilray Brands, Inc. (TLRY) Outpaces Stock Market Gains: What You Should Know"
fin_news_nlp/yahoo_cad_tickers_news,https://ca.finance.yahoo.com/news/td-bank-group-ranked-among-230100727.html,"TD Bank Group (TD) is proud to be listed in the DJSI World Index for the ninth consecutive year. The DJSI World Index benchmarks the sustainability performance of the top ten per cent of the largest 2,500 companies in the S&P Global Broad Market Index based on long-term economic, environmental and social criteria. From a global pool of 240 eligible companies in its industry, TD is included in the shortlist of 25. As of December 9, 2022, TD is the only North American-based bank included in the Wo",CAD,TD.TO,CNW Group - TD Bank Group ranked among top sustainability companies in the World by the Dow Jones Sustainability Index
fin_news_nlp/yahoo_cad_tickers_news,https://ca.finance.yahoo.com/news/transalta-declares-dividends-232500014.html,"The Board of Directors of TransAlta Corporation (TSX: TA) (NYSE: TAC) declared a quarterly dividend of $0.055 per common share payable on April 1, 2023 to shareholders of record at the close of business on March 1, 2023.",CAD,TA.TO,CNW Group - TransAlta Declares Dividends
fin_news_nlp/yahoo_cad_tickers_news,https://ca.finance.yahoo.com/news/p-dow-jones-indices-announces-221500097.html,"The shareholders of Turquoise Hill Resources Ltd. (TSX: TRQ) have agreed to the terms of a Plan of Arrangement resulting in the acquisition by Rio Tinto International Holdings Limited. Each share of Turquoise Hill Resources will receive C$43.00 cash consideration. Turquoise Hill Resources shares will be removed from the S&P/TSX Composite Index prior to the open of trading on Friday, December 16, 2022.",CAD,TRQ.TO,CNW Group - S&P Dow Jones Indices Announces Changes to the S&P/TSX Composite Index
fin_news_nlp/yahoo_cad_tickers_news,https://ca.finance.yahoo.com/news/vecima-announces-voting-results-annual-022300397.html,"VICTORIA, British Columbia, December 13, 2022--Vecima Networks announces the voting results of its AGM held virtually today. All the shareholders’ resolutions were approved at the AGM.",CAD,VCM.TO,Business Wire - Vecima Announces Voting Results from Annual General Meeting
fin_news_nlp/yahoo_cad_tickers_news,https://ca.finance.yahoo.com/news/arcpacific-announces-share-consolidation-213000499.html,"Vancouver, British Columbia--(Newsfile Corp. - December 12, 2022) - ArcPacific Resources Corp. (TSXV: ACP) (FSE: P21P) (OTC Pink: ACPRF) (""ArcPacific'' or the ""Company"") announces that it will be consolidating all of the issued and outstanding common shares (""Common Shares"") of the Company on the basis of one (1) post-consolidation Common Share for each ten (10) pre-consolidation Common Shares (the ""Consolidation""). The effective date and trading of the Common Shares on a post-Consolidation basi",CAD,ACP.V,Newsfile - ArcPacific Announces Share Consolidation
fin_news_nlp/yahoo_cad_tickers_news,https://ca.finance.yahoo.com/news/gold-fields-ceo-griffith-steps-053514815.html,(Bloomberg) -- Gold Fields Ltd. said Chief Executive Officer Chris Griffith is stepping down after the South African company’s failed attempt to take over Canadian miner Yamana Gold Inc.Most Read from BloombergElon Musk Is Ruining Trump’s Presidential CampaignChina’s Rapid Covid Reversal Sparks Whiplash as Cases SurgeSam Bankman-Fried Arrested in Bahamas as US Files FTX ChargesUS Says Scientists Make Breakthrough in Nuclear Fusion EnergyKeystone Has Leaked More Oil Than Any Other Pipeline in US,CAD,YRI.TO,Bloomberg - Gold Fields CEO Griffith Steps Down After Failed Yamana Bid
fin_news_nlp/yahoo_cad_tickers_news,https://ca.finance.yahoo.com/news/1-gold-fields-ceo-griffith-052452775.html,"South Africa's Gold Fields said on Tuesday that its Chief Executive Officer Chris Griffith would step down from his role effective Dec. 31.  Martin Preece, executive vice president of Gold Fields South Africa has been appointed as interim CEO.  Preece will join the company's board of directors on Jan. 1 and has its full support, Gold Fields said in a statement.",CAD,YRI.TO, - UPDATE 1-Gold Fields CEO Griffith to step down
