source,url,description,country,company,title
fin_news_nlp/yahoo_cad_tickers_news,https://ca.finance.yahoo.com/news/xybion-digital-inc-awarded-multimillion-212000810.html,"Xybion Digital Inc. (TSXV:XYBN) (""Xybion"" or the ""Company""), a global, low-code SaaS company that enables digital transformation in highly regulated industries like Life Sciences, announced today that it has been awarded a multi-year, multi-million US dollar contract by a top five global pharmaceutical and healthcare products company headquartered in the USA whose products are sold in over 175 countries.",CAD,XYBN.V,"ACCESSWIRE - Xybion Digital Inc. is Awarded a Multimillion US Dollar, Multi-Year Contract for its R&D Software Solutions by a Top 5 US-Based Leading Global Pharmaceutical and Healthcare Products Company"
fin_news_nlp/yahoo_cad_tickers_news,https://ca.finance.yahoo.com/news/adamant-announces-24-percent-growth-050000799.html,"Vancouver, British Columbia--(Newsfile Corp. - September 28, 2022) - Adamant Global Holdings. (CSE: ADMT) (OTC Pink: UCCPF) (FSE: U060) (""ADAMANT"") has announced an upward revenue of the company's second quarter 2022 ending June 30, from the previously announced $318,511 to $416,681. All audited statements can be access on the SEDAR website.The revenue growth registered during the second quarter in 2022 was 24 percent. This increase was driven by activities in ADAMANT'S wholesale telecommunicati",CAD,ADMT.CN,Newsfile - ADAMANT Announces 24 Percent Growth Revenue in Its Financial Statements
fin_news_nlp/yahoo_cad_tickers_news,https://ca.finance.yahoo.com/news/american-future-fuel-acquires-prospective-002700849.html,"VANCOUVER, British Columbia, Sept. 27, 2022 (GLOBE NEWSWIRE) -- American Future Fuel Corporation (CSE: AMPS, Frankfurt: K14, WKN: A3DQFB, OTCQB: AFFCF) (the “Company”, or “American Future Fuel”) is pleased to announce that it has acquired (the “Acquisition”) the Red Basin Uranium Project (the “Project” or “Red Basin”) located in the Red Basin – Pie Town Mining District of Catron and McKinley counties of New Mexico. The Acquisition was completed pursuant to a definitive share purchase agreement (",CAD,AMPS.CN,GlobeNewswire - American Future Fuel Acquires Prospective Red Basin Uranium Project
fin_news_nlp/yahoo_cad_tickers_news,https://ca.finance.yahoo.com/news/canopy-growth-sell-tweed-tokyo-204500477.html,"Canopy Growth Corp. is getting out of the cannabis retail business with two deals to divest its Tweed and Tokyo Smoke stores. The Smiths Falls, Ont. cannabis company announced Tuesday that it sold all of its stores outside Alberta, as well as the intellectual property for Tokyo Smoke, to OEG Retail Cannabis (OEGRC). OEGRC is run by the Katz Group, which owns the Edmonton Oilers hockey team and previously had a licensee deal to own and operate all of Canopy's franchised Tokyo Smoke stores in Onta",CAD,WEED.TO,"The Canadian Press - Canopy Growth to sell Tweed, Tokyo Smoke stores to OEGRC and Four20 owner"
fin_news_nlp/yahoo_cad_tickers_news,https://ca.finance.yahoo.com/news/falcon-completes-airborne-magnetic-survey-070500762.html,"FALCON GOLD CORP. (FG:TSX-V)(3FA:GR)(FGLDF:OTCQB); (""Falcon"" or the ""Company"") is pleased to announce the completion of a fixed wing airborne magnetic survey over the Gaspard gold project (the ""Property"").",CAD,FG.V,"ACCESSWIRE - Falcon Completes Airborne Magnetic Survey Over Gaspard, Spences Bridge District"
fin_news_nlp/yahoo_cad_tickers_news,https://ca.finance.yahoo.com/news/inventus-mining-provides-pardo-bulk-211300723.html,"TORONTO, Sept. 27, 2022 (GLOBE NEWSWIRE) -- Inventus Mining Corp. (TSX VENTURE: IVS) (“Inventus” or the “Company”) is pleased to announce the results from its bulk sampling program at its 100%-owned Pardo Project near Sudbury, Ontario. The 5,000-tonne bulk sample from the 007 Zone returned an average head grade of 3.4 g/t gold (Au) with excellent gravity recoverable gold. The bulk sampling program was successful in reconciling the gold mineralization in the predictive block model that was genera",CAD,IVS.V,GlobeNewswire - Inventus Mining Provides Pardo Bulk Sample Results
fin_news_nlp/yahoo_cad_tickers_news,https://ca.finance.yahoo.com/news/imetal-options-expands-advanced-kerrs-090000304.html,"iMetal Resources, Inc. (TSXV:IMR)(OTC PINK:ADTFF)(FRANKFURT:A7V)(""iMetal"" or the ""Company"") is pleased to announce it has expanded its existing option agreement with Gravel Ridge Resources Ltd. and 1544230 Ontario Inc. (collectively, the ""Vendors"") to expand the scope of the Kerrs Gold Deposit by an additional 137 hectares.",CAD,IMR.V,ACCESSWIRE - iMetal Options Expands the Advanced Kerrs Gold Deposit in Ontario’s Prolific Abitibi Greenstone Gold Belt
fin_news_nlp/yahoo_cad_tickers_news,https://ca.finance.yahoo.com/news/max-reports-geophysical-results-assays-080000199.html,"Vancouver, British Columbia--(Newsfile Corp. - September 28, 2022) - MAX RESOURCE CORP. (TSXV: MAX) (OTC Pink: MXROF) (FSE: M1D2) (""Max"" or the ""Company"") is pleased to report its ground-based IP and TMI anomalies correlated well with surface geochemical targets and successfully defined new drill targets at URU Central (URU-C and URU-CE). Mobilization of the drill rig is fully underway and continuous channel sampling at URU-CE returned 19.4m @ 1.3% copper + 2.5 g/t silver ...",CAD,MAX.V,"Newsfile - Max Resource Reports Geophysical Results, New Assays and Mobilization of the Diamond Drill Rig to URU, CESAR Copper-Silver Project in NE Colombia"
fin_news_nlp/yahoo_cad_tickers_news,https://ca.finance.yahoo.com/news/arizona-sonoran-doubles-global-leachable-103000693.html,"CASA GRANDE, Ariz. & TORONTO, September 28, 2022--ASCU declares maiden Inferred mineral resources of 143.6 million tons at 1.015% Cu at Parks/Salyer for 1.46 million tons of contained copper.",CAD,ASCU.TO,Business Wire - Arizona Sonoran Doubles Global Leachable Resource Inventory and Declares Maiden Mineral Resources at Parks/Salyer of 2.92 Billion Pounds at 1.015% Cu
fin_news_nlp/yahoo_cad_tickers_news,https://ca.finance.yahoo.com/news/calfrac-well-services-ltd-third-100000065.html,"Calfrac Well Services Ltd. (""Calfrac"") (TSX: CFW) intends to release its Third Quarter 2022 results before markets open on Wednesday, November 2, 2022, and has scheduled a conference call and webcast to begin at 10:00 A.M. MT (12:00 P.M. ET) on the same day. If you wish to participate in the conference call, please call (888) 664-6383 or (416) 764-8650 prior to the start of the call and ask for the Calfrac Well Services Ltd. conference call. Calfrac's management team will be available to answer",CAD,CFW.TO,CNW Group - Calfrac Well Services Ltd. Third Quarter 2022 Earnings Release and Conference Call
fin_news_nlp/yahoo_cad_tickers_news,https://ca.finance.yahoo.com/news/1-cineplex-approaches-cineworld-lenders-101117424.html,"Canadian cinema chain operator Cineplex has reached out to the lenders of Cineworld to revive a potential merger with the bankrupt rival's Regal Entertainment, the Wall Street Journal reported on Wednesday, citing people familiar with the matter.  Cineworld declined to comment on the WSJ report, while Cineplex did not immediately respond to a Reuters request for confirmation.  Shares in Cineworld rose 10.6% to 2.987 pence after the report.",CAD,CGX.TO, - UPDATE 1-Cineplex approaches Cineworld lenders over merger with Regal unit - WSJ
fin_news_nlp/yahoo_cad_tickers_news,https://ca.finance.yahoo.com/news/fortis-inc-hold-teleconference-october-100000879.html,"ST. JOHN'S, Newfoundland and Labrador, Sept. 28, 2022 (GLOBE NEWSWIRE) -- Fortis Inc. (""Fortis"" or the ""Corporation"") (TSX/NYSE: FTS) will release its third quarter 2022 financial results and new five-year capital outlook for the period 2023-2027 on Friday, October 28, 2022. A teleconference and webcast will be held the same day at 8:30 a.m. (Eastern). David Hutchens, President and Chief Executive Officer and Jocelyn Perry, Executive Vice President and Chief Financial Officer will discuss the Co",CAD,FTS.TO,GlobeNewswire - Fortis Inc. to Hold Teleconference on October 28 to Discuss Third Quarter 2022 Results and Five-Year Capital Outlook
fin_news_nlp/yahoo_cad_tickers_news,https://ca.finance.yahoo.com/news/platinum-group-metals-ltd-announces-100000913.html,"Vancouver, British Columbia and Johannesburg, South Africa--(Newsfile Corp. - September 28, 2022) - Platinum Group Metals Ltd. (TSX: PTM) (NYSE American: PLG) (""Platinum Group"" ""PTM"" or the ""Company"") announces that Greg Blair has been appointed to the position of Chief Financial Officer (""CFO"") effective September 27, 2022, following his serving as Interim CFO since July 2021. Mr. Blair will be based in Vancouver and will oversee the Company's global financial reporting obligations and ...",CAD,PTM.TO,Newsfile - Platinum Group Metals Ltd. Announces CFO Appointment
fin_news_nlp/yahoo_cad_tickers_news,https://ca.finance.yahoo.com/news/sierra-metals-announces-measured-progressive-105000259.html,"TORONTO, September 28, 2022--Sierra Metals Inc. (TSX: SMT) (BVL or Bolsa de Valores de Lima: SMT) (NYSE AMERICAN: SMTS) (""Sierra Metals"" or ""the Company"") reports that an agreement has been reached with residents from the town of Alis following the blockade of the main access road to the Yauricocha Mine, operated by the Company’s subsidiary, Sociedad Minera Corona.",CAD,SMT.TO,Business Wire - Sierra Metals Announces a Measured and Progressive Restart to Operations at Its Yauricocha Mine
fin_news_nlp/yahoo_cad_tickers_news,https://ca.finance.yahoo.com/news/stantec-selected-u-navy-naval-104500220.html,"Firm to support NAVFAC with focus on encroachment management implementation and mission readiness EDMONTON, Alberta and NEW YORK, Sept. 28, 2022 (GLOBE NEWSWIRE) -- TSX, NYSE:STN Stantec, a global leader in sustainable design and engineering, has been selected by Naval Facilities Engineering Systems Command (NAVFAC) Southwest to lead multidiscipline architect-engineer and consulting services as part of a five-year, US$30 million indefinite delivery/indefinite quantity (IDIQ) single award task or",CAD,STN.TO,GlobeNewswire - Stantec selected by U.S. Navy’s Naval Facilities Engineering Systems Command Southwest for critical IDIQ contract
fin_news_nlp/yahoo_cad_tickers_news,https://ca.finance.yahoo.com/news/sun-life-billionaire-cheng-eye-094143520.html,"(Bloomberg) -- Canadian insurers Sun Life Financial Inc. and Manulife Financial Corp. are among companies considering bids for an insurance partnership with Hong Kong banking group Dah Sing Financial Holdings Ltd., according to people familiar with the matter.Other firms weighing an offer include closely-held FTLife Insurance Co., the people said, asking not to be identified because the matter is private. The insurer is owned by an arm of Hong Kong’s New World Development Co., the billionaire Ch",CAD,SLF.TO,"Bloomberg - Sun Life, Billionaire Cheng Eye Insurance Deal With Hong Kong’s Dah Sing, Sources Say"
fin_news_nlp/yahoo_cad_tickers_news,https://ca.finance.yahoo.com/news/clean-air-metals-files-interim-100000727.html,"Clean Air Metals Inc. (""Clean Air Metals"" or the ""Company"") (TSXV: AIR) (FRA: CKU) (OTCQB: CLRMF) announces that it has filed its unaudited consolidated interim financial statements and management's discussion and analysis for the six month period ended July 31, 2022, available for viewing on www.sedar.com.",CAD,AIR.V,"CNW Group - Clean Air Metals Files Interim Financial Statements as at July 31, 2022"
fin_news_nlp/yahoo_cad_tickers_news,https://ca.finance.yahoo.com/news/discovery-continues-demonstrate-expansion-potential-103000947.html,"TORONTO, Sept. 28, 2022 (GLOBE NEWSWIRE) -- Discovery Silver Corp. (TSX-V: DSV, OTCQX: DSVSF) (“Discovery” or the “Company”) is pleased to announce results of the final 26 drill holes from its Phase 2 drill program on its flagship Cordero silver project (“Cordero” or “the Project”) located in Chihuahua State, Mexico. These holes consisted of upgrade and expansion drilling of the PEA pit and expansion drilling of the 2021 resource pit. Drilling will be used to support a Pre-Feasibility Study (“PF",CAD,DSV.V,GlobeNewswire - Discovery Continues to Demonstrate Expansion Potential in Final Phase 2 Drill Holes at Cordero
fin_news_nlp/yahoo_cad_tickers_news,https://ca.finance.yahoo.com/news/drone-delivery-canada-provides-successful-110000855.html,"Drone Delivery Canada Corp. (TSXV: FLT) (OTC: TAKOF) (Frankfurt: A2AMGZ) or (Frankfurt: ABB.F) (the ""Company"" or ""DDC"") is pleased to provide an update on the successful parachute testing and development of the innovative Canary drone.",CAD,FLT.V,CNW Group - DRONE DELIVERY CANADA PROVIDES UPDATE ON SUCCESSFUL CANARY DRONE PARACHUTE TESTING
fin_news_nlp/yahoo_cad_tickers_news,https://ca.finance.yahoo.com/news/otc-markets-group-welcomes-global-110000170.html,"NEW YORK, Sept. 28, 2022 (GLOBE NEWSWIRE) -- OTC Markets Group Inc. (OTCQX: OTCM), operator of regulated markets for trading 12,000 U.S. and international securities, today announced Global Food and Ingredients Ltd. (TSX-V: PEAS; OTCQX: PEASF), a Canadian plant-based food and ingredients company, has qualified to trade on the OTCQX® Best Market. Global Food and Ingredients Ltd. (“GFI”) upgraded to OTCQX from the Pink® market. GFI begins trading today on OTCQX under the symbol “PEASF.” U.S. inves",CAD,PEAS.V,GlobeNewswire - OTC Markets Group Welcomes Global Food and Ingredients Ltd. to OTCQX
fin_news_nlp/yahoo_cad_tickers_news,https://ca.finance.yahoo.com/news/good-gamer-announces-launch-playcash-113000447.html,"Good Gamer Entertainment Inc. (TSXV: GOOD) (OTCQB: GGAMF) (""Good Gamer"" or the ""Company""), a multi-faceted play-to-earn mobile games and platform developer, is pleased to announce that its wholly-owned subsidiary Good Gamer Corp. has announced the official launch of the Playcash play-to-earn game discovery platform in the Google Play Store.",CAD,GOOD.V,CNW Group - Good Gamer Announces Launch of Playcash Play-To-Earn Game Discovery Platform
fin_news_nlp/yahoo_cad_tickers_news,https://ca.finance.yahoo.com/news/hemlo-explorers-announces-project-idaho-110000431.html,"TORONTO, Sept. 28, 2022 (GLOBE NEWSWIRE) -- Hemlo Explorers Inc. (the “Company”) (TSXV: HMLO) is pleased to announce that it has received its exploration permit for Project Idaho from the Ministry of Mines, Natural Resources and Forestry. The Company also confirms that it has executed an Exploration Agreement (the “Agreement”) with Biigtigong Nishnaabeg (“Biigtigong”) which covers exploration on Project Idaho and the Pic Project, which was optioned to a subsidiary of Barrick Gold Corporation in",CAD,HMLO.V,GlobeNewswire - Hemlo Explorers Announces Project Idaho Exploration Permit and Exploration Agreement with Biigtigong Nishnaabeg First Nation
fin_news_nlp/yahoo_cad_tickers_news,https://ca.finance.yahoo.com/news/highgold-mining-intersects-14-3-103000534.html,"VANCOUVER, British Columbia, September 28, 2022--HighGold Mining Inc. (TSX-V:HIGH, OTCQX:HGGOF) (""HighGold"" or the ""Company"") is pleased to announce assay results from six (6) additional drill holes testing the new Ellis Zone at the Difficult Creek Prospect (""DC""), located four (4) km northeast of the Company’s 1.05 Moz indicated at 9.4 g/t gold equivalent (""AuEq"") JT Deposit (3.0 g/t AuEq cut-off grade). Difficult Creek is one of several district-scale prospects being explored by HighGold on th",CAD,HIGH.V,"Business Wire - HighGold Mining Intersects 14.3 g/t Gold Equivalent over 14.8 Meters in Step-Out Drilling at Ellis Zone, Johnson Tract Project, Alaska"
fin_news_nlp/yahoo_cad_tickers_news,https://ca.finance.yahoo.com/news/kraken-demonstrates-katfish-high-speed-100000564.html,"Figure 1 Kraken KATFISH High Speed Towed SAS in Campbeltown, Scotland Figure 2 Area of Operations off Campbeltown, Scotland Figure 3 SAS Image – Mooring Line at 95 m range. Total length: 17.5 m, Diameter: 15 cm, Width of eye: 38 cm, Length of eye: 90 cm ST. JOHN’S, Newfoundland, Sept. 28, 2022 (GLOBE NEWSWIRE) -- Kraken Robotics Inc. (TSX-V: PNG, OTCQB: KRKNF), Canada’s Ocean Company™, recently participated in the Royal Navy’s (RN) WILTON Industry Show and Experiment (WISEX) on the ranges in Kil",CAD,PNG.V,GlobeNewswire - Kraken Demonstrates KATFISH High Speed Towed SAS in Royal Navy WISEX Demonstration
fin_news_nlp/yahoo_cad_tickers_news,https://ca.finance.yahoo.com/news/nmg-strengthens-management-team-addition-110000085.html,"MONTRÉAL, September 28, 2022--Nouveau Monde Graphite Inc. (""NMG"" or the ""Company"") (NYSE: NMG, TSXV: NOU) bolsters its leadership, depth, and execution capabilities with the nomination on its management team of Anoop Singh, P.Eng., as Vice President, Mining Projects, Josée Gagnon, LL.B, MBA, as Vice President, Legal Affairs & Corporate Secretary, and Kelly LeBlanc as Manager, Indigenous Relations. These nominations coincide with NMG’s preparation for the transition towards its Phase 2 integrated",CAD,NOU.V,"Business Wire - NMG Strengthens its Management Team with the Addition of Mining Construction, Legal, and Indigenous Relations Expertise as the Company Prepares for its Next Growth Phase"
fin_news_nlp/yahoo_cad_tickers_news,https://ca.finance.yahoo.com/news/regency-silver-corp-options-el-100000363.html,"Regency Silver Corp. (""Regency Silver"" or the ""Company"") (TSXV: RSMX) (OTCQB: RSMXF) is pleased to announce that it has entered into an option agreement dated September 22, 2022 (the ""Option Agreement"") to option a 100% undivided interest in the El Tablon Claims located in the State of Durango, Mexico.",CAD,RSMX.V,"CNW Group - Regency Silver Corp. Options El Tablon Claims in Durango State, Mexico"
fin_news_nlp/yahoo_cad_tickers_news,https://ca.finance.yahoo.com/news/silver-valley-metals-announces-500-110000523.html,"Silver Valley Metals Corp. (TSXV: SILV) (OTCQB: SVMFF) (""Silver Valley"" or the ""Company""), a brownfields exploration Company with projects that comprise deposit(s) of lithium - potassium (sulphate of potash) located in Zacatecas and San Luis Potosi, Mexico and silver-zinc-lead located in Idaho, USA respectively, announces a $500,000 unit financing.",CAD,SILV.V,"CNW Group - Silver Valley Metals Announces $500,000 Unit Financing"
fin_news_nlp/yahoo_cad_tickers_news,https://ca.finance.yahoo.com/news/seb-contract-wins-fy2022-exceed-095000834.html,"MISSISSAUGA, Ontario, Sept. 28, 2022 (GLOBE NEWSWIRE) -- Smart Employee Benefits Inc., (“SEB” or “the Company”) (TSXV:SEB, OTCQB:SEBFF), announces 3 new contract wins for fiscal year 2022 in Canada and USA. Collectively, the IT budgets for these entities are hundreds of millions of dollars annually, and SEB has vendor status to bid on the delivery of IT solutions and services. The software/solution wins have a minimum value in excess of $5.7 million. The Professional Services wins are over $70.8",CAD,SEB.V,GlobeNewswire - SEB Contract Wins for FY2022 Exceed $76.5 Million
fin_news_nlp/yahoo_cad_tickers_news,https://ca.finance.yahoo.com/news/western-metallica-resources-corp-announces-104500708.html,"Figure 1 Map of Penedela Project Planned Drill Targets TORONTO, Sept. 28, 2022 (GLOBE NEWSWIRE) -- Western Metallica Resources Corp. (TSXV: WMS) (“Western Metallica” or the “Company”) is pleased to report the re-start of the Penedela Project drill program, following the announcement of the Vice President of Exploration appointment, which led to the reprioritization of drill targets and advanced program planning. The current phase of the 2,000-metre diamond drilling program, initially announced i",CAD,WMS.V,GlobeNewswire - Western Metallica Resources Corp. Announces Update to Penedela Drill Program
fin_news_nlp/yahoo_cad_tickers_news,https://ca.finance.yahoo.com/news/cult-food-science-portfolio-company-110000945.html,"CULT Food Science Corp. (""CULT"" or the ""Company"") (CSE: CULT) (OTC: CULTF) (FRA: LN0), an innovative investment platform with an exclusive focus on cellular agriculture that is advancing the development of novel technologies to provide a sustainable, environmental, and ethical solution to the global factory farming and aquaculture crises, announces that its portfolio company, De Novo Dairy (""De Novo""), has secured funding from UM6P Ventures (the ""Funding""). The Funding is expected to enable De N",CAD,CULT.CN,CNW Group - CULT Food Science Portfolio Company De Novo Dairy Receives Venture Funding
fin_news_nlp/yahoo_cad_tickers_news,https://ca.finance.yahoo.com/news/graycliff-exploration-intersects-9-metres-110000043.html,"Toronto, Ontario--(Newsfile Corp. - September 28, 2022) - Graycliff Exploration Limited (CSE: GRAY) (OTCQB: GRYCF) (FSE: GE0) (the ""Company"" or ""Graycliff"") is pleased to release first assay results from Phase Four drilling program at its Shakespeare Gold Project located on the Canadian Shield near Sudbury, Ontario. Phase Four drilling focused on testing the boundaries of the mineralized zone, both along strike and at depth.Drill Hole J-48 intersected 10.93 grams per tonne of gold ...",CAD,GRAY.CN,"Newsfile - Graycliff Exploration Intersects 9 Metres of Gold Mineralization Grading 10.93 g/t in Phase 4 Drilling at Shakespeare Project, Ontario"
fin_news_nlp/yahoo_cad_tickers_news,https://ca.finance.yahoo.com/news/green-thumb-industries-hold-third-110000161.html,"CHICAGO and VANCOUVER, British Columbia, Sept. 28, 2022 (GLOBE NEWSWIRE) -- Green Thumb Industries Inc. (Green Thumb) (CSE: GTII) (OTCQX: GTBIF), a leading national cannabis consumer packaged goods company and owner of RISE Dispensaries, today announced it will release third quarter financial results after the market closes on Wednesday, November 2, 2022. A conference call and audio webcast will also be held on Wednesday, November 2, 2022, at 5:00 p.m. Eastern Time/4:00 p.m. Central Time to disc",CAD,GTII.CN,"GlobeNewswire - Green Thumb Industries to Hold Third Quarter 2022 Earnings Conference Call on November 2, 2022"
fin_news_nlp/yahoo_cad_tickers_news,https://ca.finance.yahoo.com/news/tiidal-gaming-issues-shareholder-letter-110000728.html,"Toronto, Ontario--(Newsfile Corp. - September 28, 2022) - Tiidal Gaming Group Corp. (CSE: TIDL) (OTCQB: TIIDF) (""Tiidal Gaming"" or the ""Company""), a leading esports and gaming platform company, is pleased to provide the following shareholder letter from Tiidal Gaming CEO Tom Hearne.Dear Tiidal Shareholders,As we exit the summer and our 3rd quarter, I wanted to give you an update on the progress that we have been making over the year and the amazing potential ...",CAD,TIDL.CN,Newsfile - Tiidal Gaming Issues Shareholder Letter
fin_news_nlp/yahoo_cad_tickers_news,https://ca.finance.yahoo.com/m/92366390-c461-3c63-a938-21979d44a95a/should-you-buy-cannabis.html,"As bad as the stock market has been doing of late, cannabis stocks have been even much worse buys.  As of Sept. 26, the Horizons Marijuana Life Sciences ETF's price is down 61% over the trailing 12 months, versus the S&P 500's more modest decline of 18%.  Buying on the dip is a tricky prospect for cannabis investors because pot stocks have continually gone in one direction: down.",CAD,ACB.TO,Motley Fool - Should You Buy Cannabis Stocks Today or Wait for U.S. Legalization?
fin_news_nlp/yahoo_cad_tickers_news,https://ca.finance.yahoo.com/news/81-per-cent-canadians-concerned-110000878.html,"This quarter's BMO Real Financial Progress Index results found that Canadians are growing increasingly concerned about a recession, inflation, and rising consumer costs. 81 per cent of Canadians said they are concerned about a recession occurring by the end of the year, and over the past three months three quarters (75 per cent) said their concerns about inflation have increased. More than 75 per cent of Canadians feel their financial momentum is threatened by higher grocery bills (81 per cent)",CAD,BMO.TO,CNW Group - 81 per cent of Canadians concerned about recession occurring in the next three months: BMO Real Financial Progress Index
fin_news_nlp/yahoo_cad_tickers_news,https://ca.finance.yahoo.com/news/bausch-health-announces-final-results-120900426.html,"Bausch Health Companies Inc. (NYSE/TSX: BHC) (the ""Company"") announced today the final results and expiration of its previously announced offers (the ""Exchange Offers"") to exchange the existing senior notes set forth in the table below (the ""Existing Senior Notes"") for up to an aggregate principal amount of $4.0 billion (the ""Maximum New Secured Notes Amount"") of New Secured Notes (as defined below) and the related solicitations of consents (the ""Consent Solicitations"" and, together with the Exc",CAD,BHC.TO,CNW Group - Bausch Health Announces Final Results and Expiration of Exchange Offers and Consent Solicitations
fin_news_nlp/yahoo_cad_tickers_news,https://ca.finance.yahoo.com/news/cardiol-therapeutics-announces-poster-presentation-122000636.html,"Oakville, Ontario--(Newsfile Corp. - September 28, 2022) - Cardiol Therapeutics Inc. (NASDAQ: CRDL) (TSX: CRDL) (""Cardiol"" or the ""Company""), a clinical-stage life sciences company focused on the research and clinical development of anti-inflammatory and anti-fibrotic therapies for the treatment of cardiovascular diseases (""CVD""), announced today that an abstract submitted by its international research collaborators from Houston Methodist DeBakey Heart & Vascular Center was accepted for poster p",CAD,CRDL.TO,Newsfile - Cardiol Therapeutics Announces Poster Presentation at The Annual Scientific Meeting of the Heart Failure Society of America
