source,url,description,country,company,title
fin_news_nlp/yahoo_cad_tickers_news,https://ca.finance.yahoo.com/news/fertilizer-maker-cf-still-bullish-174615440.html,"(Bloomberg) -- Nutrien Ltd. fell the most ever Thursday while CF Industries Holdings Inc. recovered from an early slide, after both posted disappointing quarterly earnings driven by farmers’ reluctance to purchase high-priced fertilizer. The difference: The outlook for nitrogen demand is better than for potash, another crop nutrient. Most Read from BloombergMusk Plans to Eliminate Half of Twitter Jobs to Cut CostsHow a Mysterious China Screenshot Spurred $450 Billion RallyPowell Sees Higher Peak",CAD,NTR.TO,Bloomberg - Fertilizer Maker CF Still Bullish as Price Rally Takes a Breather
fin_news_nlp/yahoo_cad_tickers_news,https://ca.finance.yahoo.com/news/canadian-natural-resources-cnq-q3-175505126.html,"Canadian Natural Resources (CNQ) delivered earnings and revenue surprises of 13.40% and 0.50%, respectively, for the quarter ended September 2022. Do the numbers hold clues to what lies ahead for the stock?",CAD,OVV.TO,Zacks - Canadian Natural Resources (CNQ) Q3 Earnings and Revenues Surpass Estimates
fin_news_nlp/yahoo_cad_tickers_news,https://ca.finance.yahoo.com/news/paramount-resources-ltd-announces-record-110000576.html,"Paramount Resources Ltd. (""Paramount"" or the ""Company"") (TSX: POU) is pleased to announce third quarter 2022 financial and operating results highlighted by record production, funds flow and free cash flow and a 2023 capital expenditure budget that is forecast to generate approximately $650 million in free cash flow on production of between 105,000 Boe/d and 110,000 Boe/d (46% liquids).(1)(2) Paramount is also pleased to announce that it is increasing its regular monthly dividend by 25% from $0.1",CAD,POU.TO,"CNW Group - Paramount Resources Ltd. Announces Record Third Quarter 2022 Results, 25% Dividend Increase, 2023 Budget and Five-Year Outlook"
fin_news_nlp/yahoo_cad_tickers_news,https://ca.finance.yahoo.com/news/power-corporation-canadas-tse-pow-185131259.html,Power Corporation of Canada's (TSE:POW) stock is up by a considerable 5.2% over the past month. Given that stock prices...,CAD,POW.TO,Simply Wall St. - Power Corporation of Canada's (TSE:POW) Stock On An Uptrend: Could Fundamentals Be Driving The Momentum?
fin_news_nlp/yahoo_cad_tickers_news,https://ca.finance.yahoo.com/news/2-tsx-growth-stocks-d-180000356.html,Shopify (TSX:SHOP) and Docebo (TSX:DCBO) are misunderstood growth stocks that could soar in 2023. The post 2 TSX Growth Stocks I’d Buy and Hold Forever appeared first on The Motley Fool Canada.,CAD,SHOP.TO,The Motley Fool - 2 TSX Growth Stocks I’d Buy and Hold Forever
fin_news_nlp/yahoo_cad_tickers_news,https://ca.finance.yahoo.com/news/spin-master-lowers-guidance-toy-195644456.html,"TORONTO — Toymaker Spin Master Corp.'s revenue and profit slipped in its latest quarter as price sensitive consumers pulled back on spending. The Toronto-based children's entertainment company says it earned US$141.4 million in its third quarter, compared with $135.3 million a year earlier, as its overall revenue dropped 12.7 per cent. Toy revenue was $552.4 million, down from $607.8 million a year earlier. Max Rangel, Spin Master's global president and CEO, says the toy category has historicall",CAD,TOY.TO,"The Canadian Press - Spin Master lowers guidance as toy sales soften, consumers pull back on spending"
fin_news_nlp/yahoo_cad_tickers_news,https://ca.finance.yahoo.com/news/sprott-inc-declares-third-quarter-190700583.html,"TORONTO, Nov. 03, 2022 (GLOBE NEWSWIRE) -- Sprott Inc. (“Sprott” or the “Company”) (NYSE/TSX: SII) announced today that its Board of Directors has declared a third quarter 2022 dividend of US$0.25 per common share, payable on November 29, 2022 to shareholders of record at the close of business on November 14, 2022. Registered shareholders who are residents of Canada as reflected in the Company’s shareholders register, as well as beneficial holders (i.e., shareholders who hold their common shares",CAD,SII.TO,GlobeNewswire - Sprott Inc. Declares Third Quarter 2022 Dividend
fin_news_nlp/yahoo_cad_tickers_news,https://ca.finance.yahoo.com/news/trisura-group-reports-third-quarter-200500052.html,"TORONTO, Nov. 03, 2022 (GLOBE NEWSWIRE) -- Trisura Group Ltd. (“Trisura” or “Trisura Group”) (TSX: TSU), a leading specialty insurance provider, today announced financial results for the third quarter of 2022. David Clare, President and CEO of Trisura, stated, “Trisura extended its track record of performance, reporting income of $23.7 million, a new quarterly record. Growth in premium and profitable underwriting supported by increased investment income generated a 19.9% return on equity(1) desp",CAD,TSU.TO,GlobeNewswire - Trisura Group Reports Third Quarter 2022 Results
fin_news_nlp/yahoo_cad_tickers_news,https://ca.finance.yahoo.com/news/tfsa-investors-45-000-3-203000926.html,"Dividend-paying TSX stocks such as TC Energy can help you create a passive income stream and benefit from capital gains as well. The post TFSA Investors: $45,000 in These 3 TSX Stocks Can Help You Earn $2,500/Year in Tax-Free Dividends appeared first on The Motley Fool Canada.",CAD,AQN.TO,"The Motley Fool - TFSA Investors: $45,000 in These 3 TSX Stocks Can Help You Earn $2,500/Year in Tax-Free Dividends"
fin_news_nlp/yahoo_cad_tickers_news,https://ca.finance.yahoo.com/news/argonaut-gold-announces-third-quarter-022100851.html,"Argonaut Gold Inc. (TSX: AR) (the ""Company"", ""Argonaut Gold"" or ""Argonaut"") is pleased to announce today its operating and financial results for the third quarter ended September 30, 2022. For the third quarter 2022, the Company reports production of 45,939 gold equivalent ounces (""GEO"" or ""GEOs""2), revenue of $75.3 million, cash flow from operating activities before changes in non-cash working capital and other items of $13.6 million, net loss of $1.3 million or loss per share of $0.00, and adj",CAD,AR.TO,"CNW Group - Argonaut Gold Announces Third Quarter 2022 Financial Results - Production of 45,939 Gold Equivalent Ounces and Cash Flow1 of $13.6 Million"
fin_news_nlp/yahoo_cad_tickers_news,https://ca.finance.yahoo.com/news/atrium-mortgage-investment-corporation-announces-210000208.html,"Toronto, Ontario--(Newsfile Corp. - November 3, 2022) - Atrium Mortgage Investment Corporation (TSX: AI) is pleased to announce that its board of directors has declared a dividend for the month of November 2022 of $0.075 per common share, to be paid December 13, 2022 to shareholders of record November 30, 2022. Atrium pays monthly dividends currently at an annual rate of $0.90 per share, plus a special dividend to shareholders of record at year-end ...",CAD,AI.TO,Newsfile - Atrium Mortgage Investment Corporation Announces November 2022 Dividend and Q3 2022 Investor Conference Call Details
fin_news_nlp/yahoo_cad_tickers_news,https://ca.finance.yahoo.com/news/badger-infrastructure-solutions-ltd-announces-215000630.html,"CALGARY, Alberta, Nov. 03, 2022 (GLOBE NEWSWIRE) -- Badger Infrastructure Solutions Ltd. (“Badger”, the “Company”, “we”, “our” or “us”) (TSX:BDGI) reported third quarter 2022 results today. All results are presented in U.S. dollars unless otherwise stated. 2022 Third Quarter and Operational Highlights Badger experienced strong year over year growth and operating improvements across all of its regions during the third quarter.Revenue in the third quarter was $163.5 million, up 20.0% from $136.2 m",CAD,BDGI.TO,GlobeNewswire - Badger Infrastructure Solutions Ltd. Announces 2022 Third Quarter Results
fin_news_nlp/yahoo_cad_tickers_news,https://ca.finance.yahoo.com/news/retirees-3-top-tsx-dividend-183000739.html,These top TSX dividend stocks look good to buy for retirees seeking passive income. The post Retirees: 3 Top TSX Dividend Stocks to Buy for Passive Income appeared first on The Motley Fool Canada.,CAD,BNS.TO,The Motley Fool - Retirees: 3 Top TSX Dividend Stocks to Buy for Passive Income
fin_news_nlp/yahoo_cad_tickers_news,https://ca.finance.yahoo.com/news/most-actively-traded-companies-toronto-211917278.html,"TORONTO — Some of the most active companies traded Thursday on the Toronto Stock Exchange: Toronto Stock Exchange (19,241.22, down 35.79 points): Barrick Gold Corp. (TSX:ABX). Materials. Down $1.62, or 8.27 per cent, to $17.98 on 19.1 million shares. Enbridge Inc. (TSX:ENB). Energy. Up 59 cents, or 1.11 per cent, to $53.62 on 12.4 million shares. Suncor Energy Inc. (TSX:SU). Energy. Up $1.81, or 3.88 per cent, to $48.47 on 7.4 million shares. Brookfield Infrastructure Partners LP (TSX:BIP.UN). U",CAD,BTE.TO, - Most actively traded companies on the Toronto Stock Exchange
fin_news_nlp/yahoo_cad_tickers_news,https://ca.finance.yahoo.com/news/baytex-announces-third-quarter-2022-210000082.html,"Calgary, Alberta--(Newsfile Corp. - November 3, 2022) - Baytex Energy Corp. (TSX: BTE) (""Baytex"") reports its operating and financial results for the three and nine months ended September 30, 2022 (all amounts are in Canadian dollars unless otherwise noted).""We continue to deliver on our commitments with a much-improved balance sheet (0.9x net debt to trailing 12 month EBITDA ratio), substantial free cash flow generation ($478 million through nine months) and a shareholder return framework that",CAD,BTE.TO,Newsfile - Baytex Announces Third Quarter 2022 Results and Continued Strong Clearwater Drilling Results
fin_news_nlp/yahoo_cad_tickers_news,https://ca.finance.yahoo.com/news/bird-construction-inc-notice-proceed-214900028.html,"Bird Construction Inc. (TSX: BDT) announced today that it has received a limited notice to proceed with early work (pre-mobilization) for a strategically important multi-year task order under the previously announced Port Hope Area Initiative (""PHAI"") Master Construction Contract (""MCC"") by Canadian Nuclear Laboratories (""CNL"") for an undisclosed amount.",CAD,BDT.TO,CNW Group - Bird Construction Inc. Notice To Proceed On Multi-Year Task Order By Canadian Nuclear Laboratories
fin_news_nlp/yahoo_cad_tickers_news,https://ca.finance.yahoo.com/news/constellation-software-inc-topicus-com-210100915.html,"TORONTO, Nov. 03, 2022 (GLOBE NEWSWIRE) -- Topicus.com Inc. (TSXV:TOI) in a joint release with Constellation Software Inc. (TSX:CSU) today announced financial results for Topicus.com Inc. (“Topicus” or the “Company”) for the third quarter ended September 30, 2022. Please note that all amounts referred to in this press release are in Euros unless otherwise stated. The following press release should be read in conjunction with the Company’s Unaudited Condensed Consolidated Interim Financial Statem",CAD,CSU.TO,"GlobeNewswire - Constellation Software Inc. and Topicus.com Inc. Announce Results for Topicus.com Inc. for the Third Quarter Ended September 30, 2022"
fin_news_nlp/yahoo_cad_tickers_news,https://ca.finance.yahoo.com/news/crew-energy-announces-q3-2022-210000296.html,"CALGARY, Alberta, Nov. 03, 2022 (GLOBE NEWSWIRE) -- Crew Energy Inc. (TSX: CR; OTCQB: CWEGF) (""Crew"" or the ""Company""), a growth-oriented natural gas weighted producer operating in the world-class Montney play in northeast British Columbia (“NE BC”), is pleased to announce our operating and financial results for the three and nine month periods ended September 30, 2022. Crew’s Financial Statements and Notes, as well as Management’s Discussion and Analysis (“MD&A”) are available on Crew’s website",CAD,CR.TO,GlobeNewswire - Crew Energy Announces Q3 2022 and Record Nine Month Operating and Financial Results Highlighted by Accelerated Deleveraging
fin_news_nlp/yahoo_cad_tickers_news,https://ca.finance.yahoo.com/news/denison-reports-financial-operational-results-211500071.html,"Denison Mines Corp. ('Denison' or the 'Company') (TSX: DML) (NYSE American: DNN) today filed its Condensed Consolidated Financial Statements and Management's Discussion & Analysis ('MD&A') for the quarter ended September 30, 2022. Both documents will be available on the Company's website at www.denisonmines.com, SEDAR (at www.sedar.com) and EDGAR (at www.sec.gov/edgar.shtml). The highlights provided below are derived from these documents and should be read in conjunction with them. All amounts i",CAD,DML.TO,"CNW Group - Denison Reports Financial and Operational Results for Q3 2022, Including Significant De-Risking and Regulatory Milestones"
fin_news_nlp/yahoo_cad_tickers_news,https://ca.finance.yahoo.com/news/diversified-royalty-corp-announces-november-210300032.html,"VANCOUVER, British Columbia, Nov. 03, 2022 (GLOBE NEWSWIRE) -- Diversified Royalty Corp. (TSX: DIV; DIV.DB and DIV.DB.A) (the “Corporation” or “DIV”) is pleased to announce that its board of directors has approved a cash dividend of $0.01958 per common share for the period of November 1, 2022 to November 30, 2022, which is equal to $0.235 per common share on an annualized basis. The dividend will be paid on November 30, 2022 to shareholders of record as of the close of business on November 15, 2",CAD,DIV.TO,GlobeNewswire - Diversified Royalty Corp. Announces November 2022 Cash Dividend and Q3 2022 Earnings Release Date
fin_news_nlp/yahoo_cad_tickers_news,https://ca.finance.yahoo.com/news/fairfax-records-net-loss-75-215505104.html,"TORONTO — Fairfax Financial Holdings Ltd. says it recorded a net loss of US$75.1 million in the third quarter, down from earnings of $462.4 million in the third quarter of last year. The Toronto-based holding company, which reports in U.S. dollars, says its earnings resulted in a loss of $3.65 per diluted share compared to $16.22 in earnings per diluted share the year before. Fairfax says it saw net losses on investments total $519.1 million on bonds as interest rates rose, as well as stocks and",CAD,FFH.TO," - Fairfax records net loss of $75 million in Q3, while revenues rise"
fin_news_nlp/yahoo_cad_tickers_news,https://ca.finance.yahoo.com/news/fairfax-financial-holdings-limited-financial-210200706.html,"TORONTO, Nov. 03, 2022 (GLOBE NEWSWIRE) -- (Note: All dollar amounts in this news release are expressed in U.S. dollars except as otherwise noted. The financial results are derived from financial statements prepared using the recognition and measurement requirements of International Financial Reporting Standards as issued by the International Accounting Standards Board (""IFRS""), except as otherwise noted, and are unaudited. This news release contains certain non-GAAP and other financial measures",CAD,FFH.TO,GlobeNewswire - Fairfax Financial Holdings Limited: Financial Results for the Third Quarter
fin_news_nlp/yahoo_cad_tickers_news,https://ca.finance.yahoo.com/news/headwater-exploration-inc-announces-dividend-210000437.html,"Headwater Exploration Inc. (the ""Company"" or ""Headwater"") (TSX: HWX) is pleased to announce its inaugural quarterly cash dividend in conjunction with its operating and financial results for the three and nine months ended September 30, 2022 and its 2023 budget.",CAD,HWX.TO,"CNW Group - HEADWATER EXPLORATION INC. ANNOUNCES DIVIDEND POLICY, 2023 BUDGET, OPERATIONS UPDATE AND THIRD QUARTER RESULTS"
fin_news_nlp/yahoo_cad_tickers_news,https://ca.finance.yahoo.com/news/igm-financial-reports-third-quarter-210000630.html,IGM Financial Inc. (IGM or the Company) (TSX: IGM) today announced earnings results for the third quarter of 2022.,CAD,IGM.TO,CNW Group - IGM FINANCIAL REPORTS THIRD QUARTER EARNINGS
fin_news_nlp/yahoo_cad_tickers_news,https://ca.finance.yahoo.com/news/information-services-group-iii-q3-232511180.html,"ISG (III) delivered earnings and revenue surprises of 40% and 4.38%, respectively, for the quarter ended September 2022. Do the numbers hold clues to what lies ahead for the stock?",CAD,ISV.TO,Zacks - Information Services Group (III) Q3 Earnings Top Estimates
fin_news_nlp/yahoo_cad_tickers_news,https://ca.finance.yahoo.com/news/intelgenx-report-third-quarter-2022-203000509.html,"SAINT LAURENT, Quebec, Nov. 03, 2022 (GLOBE NEWSWIRE) -- IntelGenx Technologies Corp. (TSX:IGX) (OTCQB:IGXT) (“IntelGenx”), a leader in pharmaceutical films, today announced that it will release its third quarter 2022 financial results after market close on Thursday, November 10, 2022. An accompanying conference call will be hosted by Dr. Horst G. Zerbe, Chief Executive Officer, and Mr. Andre Godin, President and Chief Financial Officer, to discuss the results and provide a business update. Deta",CAD,IGX.TO,"GlobeNewswire - IntelGenx to Report Third Quarter 2022 Financial Results on November 10, 2022 – Conference Call to Follow"
fin_news_nlp/yahoo_cad_tickers_news,https://ca.finance.yahoo.com/news/3-dividend-stocks-could-pay-190000707.html,These three Canadian dividend stocks can help you grow your wealth fast in the long run if you act in time. The post 3 Dividend Stocks That Could Pay You the Rest of Your Life appeared first on The Motley Fool Canada.,CAD,MG.TO,The Motley Fool - 3 Dividend Stocks That Could Pay You the Rest of Your Life
fin_news_nlp/yahoo_cad_tickers_news,https://ca.finance.yahoo.com/news/maxar-technologies-maxr-misses-q3-231511772.html,"Maxar (MAXR) delivered earnings and revenue surprises of -45.16% and 4.84%, respectively, for the quarter ended September 2022. Do the numbers hold clues to what lies ahead for the stock?",CAD,MAXR.TO,Zacks - Maxar Technologies (MAXR) Misses Q3 Earnings and Revenue Estimates
fin_news_nlp/yahoo_cad_tickers_news,https://ca.finance.yahoo.com/news/brigham-minerals-mnrl-surpasses-q3-231511207.html,"Brigham Minerals (MNRL) delivered earnings and revenue surprises of 23.88% and 18.98%, respectively, for the quarter ended September 2022. Do the numbers hold clues to what lies ahead for the stock?",CAD,MUX.TO,Zacks - Brigham Minerals (MNRL) Surpasses Q3 Earnings and Revenue Estimates
fin_news_nlp/yahoo_cad_tickers_news,https://ca.finance.yahoo.com/news/mogo-schedules-q3-2022-earnings-211400285.html,"VANCOUVER, British Columbia, November 03, 2022--Mogo Inc. (TSX:MOGO) (NASDAQ:MOGO) (""Mogo"" or the ""Company""), a digital payments and financial technology company, today announced it will hold a conference call and webcast to discuss its Q3 2022 financial results on Thursday, November 10, 2022 at 3:00 p.m. ET. The call will be hosted by David Feller, Mogo’s Founder & CEO, and Greg Feller, President & CFO. The live webcast will include a slide presentation. The Company will issue its financial res",CAD,MOGO.TO, - Mogo Schedules Q3 2022 Earnings Conference Call
fin_news_nlp/yahoo_cad_tickers_news,https://ca.finance.yahoo.com/news/nanoxplore-inc-release-first-quarter-203000990.html,"MONTREAL, Nov. 03, 2022 (GLOBE NEWSWIRE) -- NanoXplore Inc. (“NanoXplore” or the “Company”) (TSX: GRA and OTCQX: NNXPF) is pleased to hold a webcast to discuss the results of its first quarter ended September 30, 2022, on Tuesday, November 15, 2022, at 8:30 a.m. Eastern Time. The financial results and the 5-year strategic plan will be released on Monday November 14, 2022, after the market close. Details of the Q1 Webcast When: November 15, 2022, at 8:30 a.m. Eastern Time Webcast: To listen to th",CAD,GRA.TO,"GlobeNewswire - NanoXplore Inc. to Release First Quarter Results and 5-Year Strategic Plan on November 14, 2022, After Market Close"
fin_news_nlp/yahoo_cad_tickers_news,https://ca.finance.yahoo.com/news/norzinc-announces-mailing-meeting-materials-012400967.html,"NorZinc Ltd. (TSX: NZC) (OTCQB: NORZF) (the ""Company"" or ""NorZinc"") is pleased to announce the mailing of its management information circular (the ""Circular"") and related proxy materials for the special meeting (the ""Meeting"") of NorZinc securityholders (the ""NZC Securityholders"") in connection with the previously announced plan of arrangement (the ""Arrangement"") under Division 5 of Part 9 of the Business Corporations Act (British Columbia) (the ""BCBCA"") whereby RCF VI CAD LLC (""RCF""), will acqu",CAD,NZC.TO,CNW Group - NorZinc Announces Mailing of Meeting Materials Regarding Proposed Acquisition by RCF
fin_news_nlp/yahoo_cad_tickers_news,https://ca.finance.yahoo.com/m/2197b96f-ab8b-3baf-8625-9d0c1f3bfd9d/why-nutrien-stock-lost-14%25.html,"Shares of Nutrien (NYSE: NTR) took a dive today after the fertilizer company posted weak results on the top and bottom lines and got hit by a slowdown in potash demand.  Overall results were strong as the company continued to benefit from higher overall fertilizer prices, but the potash issues weighed on the stock.  A reduction in potash purchasing in North America and Brazil led to the weaker-than-expected results as high prices and higher inventory levels from a weather-shortened spring planting season seemed to impact demand for the crop nutrient.",CAD,NTR.TO,Motley Fool - Why Nutrien Stock Lost 14% Today
fin_news_nlp/yahoo_cad_tickers_news,https://ca.finance.yahoo.com/news/parex-resources-announces-third-quarter-214500432.html,"CALGARY, Alberta, Nov. 03, 2022 (GLOBE NEWSWIRE) -- Parex Resources Inc. (“Parex” or the “Company”) (TSX: PXT) is pleased to announce its financial and operating results for the three-month period ended September 30, 2022, as well as the declaration of its Q4 2022 regular dividend of C$0.25 per share. All amounts herein are in United States Dollars (“USD”) unless otherwise stated. Key Highlights Q3 2022 net income of $65.6 million.Q3 2022 funds flow provided by operations (“FFO”)(1) of $206.4 mi",CAD,PXT.TO,GlobeNewswire - Parex Resources Announces Third Quarter Results and Declaration of Q4 2022 Dividend
fin_news_nlp/yahoo_cad_tickers_news,https://ca.finance.yahoo.com/news/pembina-pipeline-corporation-declares-november-210300721.html,"Pembina Pipeline Corporation (""Pembina"" or the ""Company"") (TSX: PPL) (NYSE: PBA) announced today that its Board of Directors has declared a common share cash dividend for November 2022 of $0.2175 per share to be paid, subject to applicable law, on December 15, 2022, to shareholders of record on November 25, 2022. The common share dividends are designated ""eligible dividends"" for Canadian income tax purposes. For non-resident shareholders, Pembina's common share dividends should be considered ""qu",CAD,PPL.TO,CNW Group - Pembina Pipeline Corporation Declares November 2022 Common Share Dividend
fin_news_nlp/yahoo_cad_tickers_news,https://ca.finance.yahoo.com/news/pembina-pipeline-corporation-reports-strong-210100462.html,"Pembina Pipeline Corporation (""Pembina"" or the ""Company"") (TSX: PPL) (NYSE: PBA) announced today its financial and operating results for the third quarter 2022.",CAD,PPL.TO,CNW Group - Pembina Pipeline Corporation Reports Strong Results for the Third Quarter 2022 and Raises Guidance
fin_news_nlp/yahoo_cad_tickers_news,https://ca.finance.yahoo.com/news/tsx-stock-just-hit-52-193000791.html,"Pet Valu Holdings Ltd. (TSX:PET) is a TSX stock that is soaring and has room to run, as it thrives in the fast-growing pet product market. The post This TSX Stock Just Hit a 52-Week High, and I’m Buying More appeared first on The Motley Fool Canada.",CAD,PET.TO,"The Motley Fool - This TSX Stock Just Hit a 52-Week High, and I’m Buying More"
fin_news_nlp/yahoo_cad_tickers_news,https://ca.finance.yahoo.com/news/profound-medical-announces-third-quarter-200500801.html,"TORONTO, Nov. 03, 2022 (GLOBE NEWSWIRE) -- Profound Medical Corp. (NASDAQ:PROF; TSX:PRN) (“Profound” or the “Company”), a commercial-stage medical device company that develops and markets customizable, incision-free therapies for the ablation of diseased tissue, today reported financial results for the third quarter ended September 30, 2022. Unless specified otherwise, all amounts in this press release are expressed in U.S. dollars and are presented in accordance with International Financial Rep",CAD,PRN.TO,GlobeNewswire - Profound Medical Announces Third Quarter 2022 Financial Results
fin_news_nlp/yahoo_cad_tickers_news,https://ca.finance.yahoo.com/news/resolute-reports-third-quarter-2022-211500769.html,"Resolute Forest Products Inc. (NYSE: RFP) (TSX: RFP) today reported net income of $87 million, or $1.11 per diluted share, for the quarter ended September 30, compared to net income of $80 million, or $0.99 per diluted share, in the same period in 2021. Sales were $974 million in the quarter, an increase of $157 million from the year-ago period. Excluding special items, the company reported net income of $85 million, or $1.08 per diluted share, compared to net income of $67 million, or $0.84 per",CAD,RFP.TO,CNW Group - Resolute Reports Third Quarter 2022 Results
fin_news_nlp/yahoo_cad_tickers_news,https://ca.finance.yahoo.com/news/2-top-canadian-stocks-buy-200000166.html,Beaten down TSX tech stocks such as Shopify and Magnet Forensics are top bets for long-term investors when the market recovers. The post 2 Top Canadian Stocks to Buy Before the Market Recovers appeared first on The Motley Fool Canada.,CAD,SHOP.TO,The Motley Fool - 2 Top Canadian Stocks to Buy Before the Market Recovers
fin_news_nlp/yahoo_cad_tickers_news,https://ca.finance.yahoo.com/news/silvercorp-svm-meets-q2-earnings-233511026.html,"Silvercorp (SVM) delivered earnings and revenue surprises of 0% and 2.25%, respectively, for the quarter ended September 2022. Do the numbers hold clues to what lies ahead for the stock?",CAD,SVM.TO,Zacks - Silvercorp (SVM) Meets Q2 Earnings Estimates
