source,url,description,country,company,title
fin_news_nlp/yahoo_cad_tickers_news,https://ca.finance.yahoo.com/news/aurora-cannabis-announces-mailing-management-210200572.html,"Aurora Cannabis Inc. (the ""Company"" or ""Aurora"") (NASDAQ: ACB) (TSX: ACB), the Canadian company defining the future of cannabinoids worldwide, is pleased to announce that the Company recently filed its management information circular (the ""Circular"") and related proxy materials (together with the Circular the ""Meeting Materials"") in advance of its annual and special meeting of shareholders (the ""Meeting"") scheduled for November 14, 2022.",CAD,ACB.TO,CNW Group - Aurora Cannabis Announces Mailing of Management Information Circular for the Annual and Special Meeting of Shareholders
fin_news_nlp/yahoo_cad_tickers_news,https://ca.finance.yahoo.com/news/purpose-investments-inc-announces-october-230000224.html,"TORONTO, Oct. 18, 2022 (GLOBE NEWSWIRE) -- Purpose Investments Inc. (“Purpose”) is pleased to announce distributions for the month of October 2022 for its open-end exchange traded funds and closed-end funds (“the Funds”). The ex-distribution date for all ETFs is October 26, 2022, with the exception of Purpose Bitcoin Yield ETF and Purpose Ether Yield ETF, which will have an ex-distribution date of October 27, 2022, as well as Purpose High Interest Savings ETF and Purpose US Cash Fund, which have",CAD,BNK.TO,GlobeNewswire - Purpose Investments Inc. Announces October 2022 Distributions
fin_news_nlp/yahoo_cad_tickers_news,https://ca.finance.yahoo.com/news/celestica-ethernet-switch-help-propel-214000880.html,"Celestica contributes the complete design specification and all design files for the new DS1000 Ethernet switch at 2022 OCP Global SummitTORONTO, Oct. 18, 2022 (GLOBE NEWSWIRE) -- Celestica Inc. (TSX: CLS) (NYSE: CLS), a leader in design, manufacturing, and supply chain solutions for the world’s most innovative companies, today launched its DS1000 high-performance Gigabit Ethernet Layer 3 switch, a compact, resilient, cost-effective, open network switch. The company also announced it will releas",CAD,CLS.TO,GlobeNewswire - Celestica’s New Ethernet Switch Will Help Propel Open Networking
fin_news_nlp/yahoo_cad_tickers_news,https://ca.finance.yahoo.com/news/cenovus-energy-cve-gains-lags-215009472.html,"Cenovus Energy (CVE) closed at $17.08 in the latest trading session, marking a +0.77% move from the prior day.",CAD,CVE.TO,Zacks - Cenovus Energy (CVE) Gains But Lags Market: What You Should Know
fin_news_nlp/yahoo_cad_tickers_news,https://ca.finance.yahoo.com/news/most-actively-traded-companies-toronto-213407100.html,"TORONTO — Some of the most active companies traded Tuesday on the Toronto Stock Exchange: Toronto Stock Exchange (18,798.18, up 177.16 points): Royal Bank of Canada (TSX:RY). Financials. Up 62 cents, or 0.5 per cent, to $124.20 on 7.8 million shares. Toronto-Dominion Bank (TSX:TD). Financials. Up $1.30, or 1.52 per cent, to $86.68 on 5.4 million shares. Suncor Energy Inc. (TSX:SU). Energy. Down 37 cents, or 0.86 per cent, to $42.76 on 5.4 million shares. Cenovus Energy Inc. (TSX:CVE). Energy. Up",CAD,CVE.TO, - Most actively traded companies on the Toronto Stock Exchange
fin_news_nlp/yahoo_cad_tickers_news,https://ca.finance.yahoo.com/news/crescent-point-energy-cpg-stock-221510256.html,"Crescent Point Energy (CPG) closed at $6.92 in the latest trading session, marking a -0.57% move from the prior day.",CAD,CPG.TO,Zacks - Crescent Point Energy (CPG) Stock Sinks As Market Gains: What You Should Know
fin_news_nlp/yahoo_cad_tickers_news,https://ca.finance.yahoo.com/news/element-fleet-management-schedules-q3-210100495.html,"Call Date: November 9, 2022; Call Time: 8:30 a.m. (Eastern Time)TORONTO, Oct. 18, 2022 (GLOBE NEWSWIRE) -- Element Fleet Management Corp. (TSX: EFN) (“Element” or the “Company”), the largest pure-play automotive fleet manager in the world, will hold its Q3 2022 results conference call and webcast for investors and analysts on Wednesday, November 9, 2022 at 8:30 a.m. Eastern Time. Element’s financial and operating results for the period will be issued after market close on Tuesday, November 8, 20",CAD,EFN.TO,GlobeNewswire - Element Fleet Management Schedules Q3 2022 Results and Conference Call
fin_news_nlp/yahoo_cad_tickers_news,https://ca.finance.yahoo.com/news/fortis-tsx-fts-stock-buy-034500787.html,"Despite declining over the last few weeks, Fortis (TSX:FTS) stock has the kind of track record to make it a loyal asset to own forever. The post Fortis (TSX:FTS) Stock: Buy and Hold This Canadian Dividend Aristocrat Forever appeared first on The Motley Fool Canada.",CAD,FTS.TO,The Motley Fool - Fortis (TSX:FTS) Stock: Buy and Hold This Canadian Dividend Aristocrat Forever
fin_news_nlp/yahoo_cad_tickers_news,https://ca.finance.yahoo.com/news/k92-mining-announces-latest-high-210000915.html,"Figure 1 K1 Long Section Figure 2 K2 Long Section Figure 3 J1 Long Section Figure 4 Kora-Kora South-Irumafimpa Long Section Figure 5 Judd-Judd South Long Section Figure 6 KMDD0495 Core Photograph, 295.42m to 299.40m Figure 7 JDD0079 Core Photograph, 202.98m to 207.60m Kora South underground drill hole KMDD0495 intersects potential dilatant zone, recording multiple intersections including 30.55 m at 12.82 g/t gold equivalent (“AuEq”)(1) or 4.15 g/t Au, 78 g/t Ag and 4.79% Cu from the K2 Vein. The",CAD,KNT.TO,"GlobeNewswire - K92 Mining Announces Latest High-Grade Underground and Surface Drill Results at Kora-Kora South, Judd-Judd South and Kora Northern Deeps"
fin_news_nlp/yahoo_cad_tickers_news,https://ca.finance.yahoo.com/news/lithium-americas-corp-lac-gains-220010908.html,"Lithium Americas Corp. (LAC) closed the most recent trading day at $23.42, moving +0.21% from the previous trading session.",CAD,LAC.TO,Zacks - Lithium Americas Corp. (LAC) Gains But Lags Market: What You Should Know
fin_news_nlp/yahoo_cad_tickers_news,https://ca.finance.yahoo.com/news/signal-gold-reports-q3-2022-210000936.html,"Signal Gold Inc. (""Signal Gold"" or the ""Company"")(TSX:SGNL)(OTCQX:SGNLF) is pleased to announce the production results and certain financial information for the three and nine months ended September 30, 2022 (""Q3 2022""). All dollar amounts are in Canadian Dollars.",CAD,SGNL.TO,ACCESSWIRE - Signal Gold Reports Q3 2022 Production Results From the Point Rousse Operation
fin_news_nlp/yahoo_cad_tickers_news,https://ca.finance.yahoo.com/news/canadian-toy-association-announces-iconic-211200411.html,"The Canadian Toy Association (CTA) is pleased to announce the 2022 inductees into the Canadian toy industry Hall of Fame. Monika Merz, Former President (retired) Toys ""R"" Us Canada & CEO of Toys ""R"" Us Asia Pacific as well as Spin Master co-founders, Ronnen Harary, Anton Rabie, and Ben Varadi, will be showcased and awarded for their contributions to the industry on November 17, 2022, at the Hall of Fame Gala Reception and Dinner at the Mississauga Convention Centre.",CAD,TOY.TO,CNW Group - THE CANADIAN TOY ASSOCIATION ANNOUNCES ICONIC 2022 HALL OF FAME INDUCTEES FOR GLOBAL CONTRIBUTION
fin_news_nlp/yahoo_cad_tickers_news,https://ca.finance.yahoo.com/news/superior-plus-announces-date-2022-210000927.html,"TORONTO, October 18, 2022--Superior Plus Corp. (""Superior"") (TSX:SPB) announced today that it expects to announce its 2022 third quarter financial results after the close of North American markets on Wednesday, November 9, 2022.",CAD,SPB.TO,Business Wire - Superior Plus Announces Date of 2022 Third Quarter Results
fin_news_nlp/yahoo_cad_tickers_news,https://ca.finance.yahoo.com/news/tricon-completes-sale-interest-u-210100197.html,"TORONTO, October 18, 2022--Tricon Residential Inc. (""Tricon"" or the ""Company"") (NYSE: TCN, TSX: TCN), an owner and operator of single-family rental homes and multi-family rental apartments in the United States and Canada, confirmed today the closing of the previously announced sale of its 20% equity interest in a portfolio of 23 Sun Belt apartment buildings to a vertically integrated residential real estate investment and property management company, which will assume all asset and property mana",CAD,TCN.TO,Business Wire - Tricon Completes the Sale of its Interest in U.S. Multi-family Portfolio for $315 Million of Proceeds
fin_news_nlp/yahoo_cad_tickers_news,https://ca.finance.yahoo.com/news/2-dividend-paying-tech-stocks-211500935.html,The tech sector is a key industry that should be represented in any portfolio. Vecima is one of two dividend-paying tech stocks to buy now. The post 2 Dividend-Paying Tech Stocks to Buy in October appeared first on The Motley Fool Canada.,CAD,VCM.TO,The Motley Fool - 2 Dividend-Paying Tech Stocks to Buy in October
fin_news_nlp/yahoo_cad_tickers_news,https://ca.finance.yahoo.com/news/resources-options-pocitos-7-9-070000046.html,"Fig 1. Recharge Resources drill rig operating at Pocitos 1. Spey Resources Corp will commence drilling at the beginning of November 2022 at Pocitos 2. VANCOUVER, British Columbia, Oct. 19, 2022 (GLOBE NEWSWIRE) -- A.I.S. Resources Limited (TSX.V: AIS, OTCQB: AISSF) (the “Company” or “AIS”) announces that it has granted a 9 month option to C29 Metals Limited, listed on the Australian Stock Exchange, (“C29”, ASX:C29) to explore the Pocitos 7 and 9 licences for lithium at the Pocitos Salar in Argen",CAD,AIS.V,GlobeNewswire - A.I.S. Resources Options Pocitos 7 and 9 Lithium Licences in Argentina to C29 Metals Limited of the Australian Stock Exchange AIS’ Third Lithium Equity Royalty Stream
fin_news_nlp/yahoo_cad_tickers_news,https://ca.finance.yahoo.com/news/oil-advances-two-week-low-002304284.html,"(Bloomberg) -- Oil extended its volatile run as continued US efforts to curb prices and concerns over a global recession counter signs of tight supply. Most Read from BloombergA Tense Pay Dispute Overshadows Nintendo’s Upcoming Bayonetta 3$200 Diesel Puts Biden in an Ugly CornerTrump Special Master Has ‘No Patience’ for Records SpatsPutin’s War Escalation Is Hastening Demographic Crash for RussiaChinese Economists Tally Cost of Putin’s War, Warn on Deep ScarsWest Texas Intermediate swung between",CAD,RY.TO,Bloomberg - Oil Stays Volatile as Slowdown Risks Rival Signs of Tight Supply
fin_news_nlp/yahoo_cad_tickers_news,https://ca.finance.yahoo.com/news/verde-concludes-repair-road-plant-100000864.html,"SINGAPORE, Oct. 19, 2022 (GLOBE NEWSWIRE) -- Verde AgriTech Ltd (TSX: “NPK”) (""OTCMKTS: ""VNPKF"") (“Verde” or the “Company”) is pleased to announce that it has rectified the water issues encountered during construction of improved road access to Plant 2.1 As part of Plant 2’s logistics corridor, the Company upgraded the road infrastructure, including 22 kms of roads, 14 kms of asphalting, and the construction of a new bridge. “Fortunately, the road issue did not damage human or environmental well",CAD,NPK.TO,GlobeNewswire - Verde concludes repair of road to Plant 2
fin_news_nlp/yahoo_cad_tickers_news,https://ca.finance.yahoo.com/news/planet-microcap-review-magazine-q3-123000200.html,"Planet MicroCap, a global multimedia financial news and publishing company that focuses on delivering news, information, data and analytics for publicly traded microcap companies, today announced that the Q3 2022 Issue of the Planet MicroCap Review Magazine is now available in digital format.",CAD,BRMI.TO,ACCESSWIRE - Planet MicroCap Review Magazine for Q3 2022 Now Online
fin_news_nlp/yahoo_cad_tickers_news,https://ca.finance.yahoo.com/news/bonterra-energy-corp-trido-energy-110000374.html,"Bonterra Energy Corp. (www.bonterraenergy.com) (TSX: BNE) (""Bonterra""), a conventional oil and gas company with assets and operations based in Western Canada, and Trido Energy Services (""Trido""), a Centurion company and leading provider of sustainable and innovative solar-powered production equipment to the energy industries based in Calgary, Canada, are pleased to announce the completion of the first two phases of a joint emission reductions program (the ""Program"") under Trido's carbon credit p",CAD,BNE.TO,CNW Group - Bonterra Energy Corp. and Trido Energy Services Report Ongoing Success with Methane Reduction Programs
fin_news_nlp/yahoo_cad_tickers_news,https://ca.finance.yahoo.com/news/canada-goose-announces-second-quarter-110000964.html,"TORONTO, October 19, 2022--Canada Goose Holdings Inc. (""Canada Goose"" or the ""Company"") (NYSE: GOOS, TSX: GOOS) today announced that the Company plans to issue results for the second quarter of fiscal year 2023, ended October 2, 2022, prior to the market open on Wednesday, November 2, 2022.",CAD,GOOS.TO," - Canada Goose Announces Second Quarter 2023 Earnings Release Date, Conference Call and Webcast"
fin_news_nlp/yahoo_cad_tickers_news,https://ca.finance.yahoo.com/news/centerra-gold-2022-third-quarter-110000287.html,"TORONTO, Oct. 19, 2022 (GLOBE NEWSWIRE) -- Centerra Gold Inc. (“Centerra” or “the Company”) (TSX: CG) (NYSE: CGAU) will host a conference call and webcast to discuss the 2022 third quarter operating and financial results on Monday, November 7, 2022 at 9:00 a.m. Eastern Time. The results are scheduled to be released before the market opens on Monday, November 7, 2022. North American participants should dial the toll-free number +1 (800) 750-9140International participants may access the call at +1",CAD,CG.TO,GlobeNewswire - Centerra Gold 2022 Third Quarter Results Conference Call and Webcast
fin_news_nlp/yahoo_cad_tickers_news,https://ca.finance.yahoo.com/news/dynacor-reports-sales-u-46-113000823.html,"Sales in million US$ - 2021 and 2022 Sales in million US$ - 2021 and 2022 MONTREAL, Oct. 19, 2022 (GLOBE NEWSWIRE) -- Dynacor Group Inc. (TSX-DNG) (Dynacor or the ""Corporation""), an international gold ore industrial corporation servicing ASMs (artisanal and small-scale miners), today announced gold sales of US$46.0 million (unaudited) (C$60.1 million) (1) for the third quarter of 2022, a decrease of US$15.9 million compared to last year. In September, the Corporation recorded sales of US$14.4 mi",CAD,DNG.TO,GlobeNewswire - Dynacor Reports Sales U$46.0 Million (C$60.1 Million) for the Third Quarter of 2022
fin_news_nlp/yahoo_cad_tickers_news,https://ca.finance.yahoo.com/news/equinox-gold-announces-updated-feasibility-110500360.html,"Equinox Gold Corp. (TSX: EQX) (NYSE American: EQX) (""Equinox Gold"" or the ""Company"") is pleased to announce the results of a Feasibility Study for an expansion at the Company's 100%-owned Los Filos Mine Complex (""Los Filos"") located in Mexico. Current Los Filos operations consist of both run-of-mine (""ROM"") and crushed ore heap leach facilities. With continued development of the Bermejal Underground deposit and construction of a 10,000 tonnes per day (""t/d"") carbon-in-leach (""CIL"") processing pl",CAD,EQX.TO,CNW Group - Equinox Gold Announces Updated Feasibility Study for Los Filos Expansion
fin_news_nlp/yahoo_cad_tickers_news,https://ca.finance.yahoo.com/news/gildan-activewear-announces-date-third-120000437.html,"MONTREAL, Oct. 19, 2022 (GLOBE NEWSWIRE) -- Gildan Activewear Inc. (GIL: TSX and NYSE) will report its 2022 third quarter results on Thursday, November 3, 2022. A press release will be issued before markets open, and an audio webcast and conference call are scheduled on that same day at 8:30 AM ET to discuss the Company’s results. The live audio webcast of the conference call may be accessed via the investors section of Gildan’s corporate website at the following link Gildan Q3 2022 audio webcas",CAD,GIL.TO,GlobeNewswire - Gildan Activewear Announces Date for Third Quarter 2022 Earnings Release
fin_news_nlp/yahoo_cad_tickers_news,https://ca.finance.yahoo.com/news/disclosed-globex-nordeau-west-gold-115000745.html,"Figure 1 Chimo Mine Gold System - Longitudinal Composite Section ROUYN-NORANDA, Quebec, Oct. 19, 2022 (GLOBE NEWSWIRE) -- GLOBEX MINING ENTERPRISES INC. (GMX – Toronto Stock Exchange, G1MN – Frankfurt, Stuttgart, Berlin, Munich, Tradegate, Lang & Schwarz, LS Exchange, TTMzero, Düsseldorf and Quotrix Düsseldorf Stock Exchanges and GLBXF – OTCQX International in the US) is pleased to provide with an update on a portion of Globex’s Nordeau gold royalty property located approximately 45 km east of V",CAD,GMX.TO,GlobeNewswire - New Resource Disclosed on Globex’s Nordeau West Gold Royalty Claims
fin_news_nlp/yahoo_cad_tickers_news,https://ca.finance.yahoo.com/news/kinaxis-inc-host-third-quarter-110000597.html,"OTTAWA, Ontario, October 19, 2022--Kinaxis® (TSX:KXS), the authority in driving agility for fast, confident decision-making in an unpredictable world, today announced that it has scheduled its conference call to discuss the financial results for its third quarter ended September 30, 2022. The call will be hosted on Friday, November 4 at 8:30 a.m. Eastern Time by John Sicard, Chief Executive Officer, and Blaine Fitzgerald, Chief Financial Officer, followed by a question and answer period. The Com",CAD,KXS.TO,"Business Wire - Kinaxis Inc. to Host Third Quarter 2022 Financial Results Conference Call on November 4, 2022"
fin_news_nlp/yahoo_cad_tickers_news,https://ca.finance.yahoo.com/news/loblaw-companies-limited-announces-timing-110000025.html,"Loblaw Companies Limited (TSX: L) announced today that it will release its third quarter 2022 results on November 16, 2022, at approximately 6:30 a.m. (EDT). The release will be followed by a conference call at 10:00 a.m. (EDT), as well as an audio webcast.",CAD,L.TO,CNW Group - Loblaw Companies Limited Announces the Timing of the Third Quarter 2022 Earnings Release
fin_news_nlp/yahoo_cad_tickers_news,https://ca.finance.yahoo.com/news/pacific-continues-intersect-near-surface-120000348.html,"New Pacific Metals Corp. (""New Pacific"" or the ""Company"") (TSX: NUAG) (NYSE American: NEWP), together with its local Bolivian partner, reports assay results for 21 drill holes at its Carangas Silver-Gold Project, Oruro Department, Bolivia (the ""Carangas Project"" or the ""Project""). Together with the first five holes released on July 13, 2022, and seven holes released on August 8, 2022, the assay results of the 33 holes from the 2022 drill program continue to intersect a broad, near-surface silver",CAD,NUAG.TO,"CNW Group - New Pacific Continues to Intersect The Near-Surface, High Grade Silver Horizon, Including 163 metres Grading 109 Grams Per Tonne Silver, at the Carangas Project, Bolivia"
fin_news_nlp/yahoo_cad_tickers_news,https://ca.finance.yahoo.com/news/norzinc-announces-receipt-territorial-permitting-110000067.html,"NorZinc Ltd. (TSX: NZC) (OTCQB: NORZF) (the ""Company"" or ""NorZinc"") is pleased to announce it has received approval for all Management Plans (""MPs"") from the territorial governing bodies, the Government of the Northwest Territories (""GNWT"") and the Mackenzie Valley Land and Water Board (""MVLWB""), pertaining to the permit and license to construct the Pioneer Winter Road (""PWR""), which represents Phase 1 of the All-Season Access Road (""ASR"") at the Prairie Creek Project (""Prairie Creek"" or the ""Pr",CAD,NZC.TO,CNW Group - NorZinc Announces Receipt of Territorial Permitting Approvals for Construction of Phase 1 of the All-Season Access Road at Prairie Creek
fin_news_nlp/yahoo_cad_tickers_news,https://ca.finance.yahoo.com/news/simpson-oil-limited-provides-early-122700318.html,"This press release is being issued by Simpson Oil Limited (""Simpson Oil"") pursuant to National Instrument 62-103 – The Early Warning System and Related Take-Over Bid and Insider Reporting Issuers (""NI 62-103"") in connection with the exchange of Simpson Oil's 12.5 million shares in the capital of Sol Investments SEZC for 20 million common shares (the ""Parkland Common Shares"") in the capital of Parkland Corporation (""Parkland"") pursuant to the terms of the share exchange agreement entered into bet",CAD,PKI.TO,CNW Group - Simpson Oil Limited Provides Early Warning Disclosure Regarding Investment in Parkland Corporation
fin_news_nlp/yahoo_cad_tickers_news,https://ca.finance.yahoo.com/m/ac06cad6-4f3e-336c-bdd4-6a8abbb51e3d/is-tilray-brands-planning.html,"Tilray Brands (NASDAQ: TLRY) is eyeing lots of growth in the years ahead in the Canadian, U.S., and European pot markets.  The cannabis producer is the largest one in Canada, but a lack of legalization in other parts of the world is limiting its growth today, with the company's top line struggling in recent quarters to give growth-oriented investors much of a reason to buy its shares.  Earlier this month, Tilray reported its first-quarter numbers for its fiscal 2023 (ended Aug. 31).",CAD,TLRY.TO,Motley Fool - Is Tilray Brands Planning More Acquisitions?
fin_news_nlp/yahoo_cad_tickers_news,https://ca.finance.yahoo.com/news/breckenridge-distillery-announces-ultimate-whiskey-110000049.html,"Two Breckenridge Staples Launch Second Annual Buddy Pass, Limited-Edition Whiskey and Beer Across the U.S. The Second Annual Buddy Pass, Limited-Edition Whiskey and Beer Buddy Pass is a unique collaboration between two iconic Colorado brands that allows you to sip the best of barrel-aged beer and beer-aged whiskey. BRECKENRIDGE, Colo., Oct. 19, 2022 (GLOBE NEWSWIRE) -- Breckenridge Distillery, the ‘World’s Highest Distillery,’ and Breckenridge Brewery return this season for the second ever Buddy",CAD,TLRY.TO,GlobeNewswire - Breckenridge Distillery Announces Ultimate Whiskey and Beer Collaboration With Breckenridge Brewery
fin_news_nlp/yahoo_cad_tickers_news,https://ca.finance.yahoo.com/news/proxy-advisor-glass-lewis-recommends-124200760.html,"MONTREAL, October 19, 2022--Turquoise Hill Resources Ltd. (TSX: TRQ) (NYSE: TRQ) (""Turquoise Hill"" or the ""Company"") today announced that proxy advisor Glass Lewis has recommended that the Company’s shareholders vote ""FOR"" the previously announced proposed plan of arrangement pursuant to which, among other things and subject to the satisfaction or waiver of all applicable conditions precedent, Rio Tinto International Holdings Limited (""Rio Tinto"") would acquire the approximately 49% of the issue",CAD,TRQ.TO,"Business Wire - Proxy Advisor Glass Lewis Recommends that Turquoise Hill Shareholders Vote ""FOR"" the Rio Tinto Go-Private Transaction"
fin_news_nlp/yahoo_cad_tickers_news,https://ca.finance.yahoo.com/news/high-yield-dividend-stock-could-121500224.html,Passive income isn’t the only reason to have this high-yield dividend stock on your watch list today. The post This High-Yield Dividend Stock Could Be One to Hold Forever appeared first on The Motley Fool Canada.,CAD,AQN.TO,The Motley Fool - This High-Yield Dividend Stock Could Be One to Hold Forever
fin_news_nlp/yahoo_cad_tickers_news,https://ca.finance.yahoo.com/news/bmo-recognized-overall-leader-canadian-140000269.html,"BMO has been recognized as the overall leader in The Forrester Digital Experience Review™: Canadian Mobile Banking Apps, Q4 2022. The Forrester recognition adds to BMO's track record of market-recognized digital innovation, including Best Fintech Accelerator and Incubator Award, Finovate Awards (2022), Canada Mobile Banking Emerging Features Benchmark rankings (2022) and BAI Global Innovation Awards (2022).",CAD,BMO.TO,CNW Group - BMO Recognized as Overall Leader in Canadian Mobile Banking Apps Digital Experience Review™
fin_news_nlp/yahoo_cad_tickers_news,https://ca.finance.yahoo.com/news/surprisingly-hot-canada-inflation-6-124051324.html,"(Bloomberg) -- Canada’s inflation rate came in stronger than expected in September despite lower gasoline prices, with stickier underlying pressures likely to keep the Bank of Canada on an aggressive rate-hiking path. Most Read from BloombergA Tense Pay Dispute Overshadows Nintendo’s Upcoming Bayonetta 3$200 Diesel Puts Biden in an Ugly CornerTrump Special Master Has ‘No Patience’ for Records SpatsBlinken Says China Wants to Seize Taiwan on ‘Much Faster Timeline’Putin’s War Escalation Is Hasteni",CAD,BMO.TO,"Bloomberg - Inflation Surprise of 6.9% Shifts Canada Rate Bets, Jolts Yields"
fin_news_nlp/yahoo_cad_tickers_news,https://ca.finance.yahoo.com/news/dentalcorp-announces-release-date-third-140000894.html,"dentalcorp Holdings Ltd. (""dentalcorp"" or the ""Company"") (TSX: DNTL), Canada's largest and one of North America's fastest growing networks of dental practices, announced today that it will release its third quarter 2022 financial results before market open on November 9, 2022.",CAD,DNTL.TO,CNW Group - dentalcorp Announces Release Date for Third Quarter 2022 Results
fin_news_nlp/yahoo_cad_tickers_news,https://ca.finance.yahoo.com/news/pason-systems-inc-tse-psi-141423834.html,Pason Systems' (TSE:PSI) stock is up by 3.9% over the past month. Given that the stock prices usually follow long-term...,CAD,PSI.TO,Simply Wall St. - Pason Systems Inc.'s (TSE:PSI) Has Performed Well But Fundamentals Look Varied: Is There A Clear Direction For The Stock?
fin_news_nlp/yahoo_cad_tickers_news,https://ca.finance.yahoo.com/news/power-corporation-announce-third-quarter-135000357.html,"Power Corporation of Canada (TSX: POW) (""Power Corporation"") will release its third quarter 2022 financial results on Wednesday, November 9, 2022, after markets close.",CAD,POW.TO,"CNW Group - Power Corporation to Announce Third Quarter 2022 Financial Results on November 9, 2022"
