source,url,description,country,company,title
fin_news_nlp/yahoo_cad_tickers_news,https://ca.finance.yahoo.com/news/why-imperial-oil-tsx-imo-123000665.html,Imperial Oil Ltd. (TSX:IMO) stock slipped in September in the face of lower oil prices and rising recession risks. The post Why Imperial Oil (TSX:IMO) Stock Fell 5.5% in September appeared first on The Motley Fool Canada.,CAD,IMO.TO,The Motley Fool - Why Imperial Oil (TSX:IMO) Stock Fell 5.5% in September
fin_news_nlp/yahoo_cad_tickers_news,https://ca.finance.yahoo.com/news/canada-stocks-tsx-off-strong-142919262.html,"Gains in energy shares helped Canada's main stock index kick off the final quarter of the year on a positive note as investors looked to overcome their anxiety about a global recession, triggered by aggressive central bank actions to curb inflation.  At 09:52 a.m. ET (13:52 GMT) on Monday, the Toronto Stock Exchange's S&P/TSX composite index was up 249.71 points, or 1.35%, at 18,693.93.  ""With sentiment remaining at bearish extremes, Q4 could bring in unexpected positive surprise for investors,"" said Brandon Michael, senior analyst at ABC Funds in Toronto.",CAD,SAP.TO, - CANADA STOCKS-TSX off to strong start in final quarter on energy boost
fin_news_nlp/yahoo_cad_tickers_news,https://ca.finance.yahoo.com/news/tmx-group-thanksgiving-holiday-market-133000196.html,"Toronto Stock Exchange, TSX Venture Exchange, TSX Alpha Exchange and Montréal Exchange will be closed on Monday, October 10, 2022 for the Thanksgiving holiday.",CAD,X.TO,CNW Group - TMX Group Thanksgiving Holiday Market Closures
fin_news_nlp/yahoo_cad_tickers_news,https://ca.finance.yahoo.com/news/tfsa-invest-45-000-3-124500787.html,"Here are three of the best Canadian dividend stocks TFSA investors can consider buying right now to earn handsome passive income. The post TFSA: Invest $45,000 in These 3 Stocks and Get $2,392 in Passive Income appeared first on The Motley Fool Canada.",CAD,TOU.TO,"The Motley Fool - TFSA: Invest $45,000 in These 3 Stocks and Get $2,392 in Passive Income"
fin_news_nlp/yahoo_cad_tickers_news,https://ca.finance.yahoo.com/news/arena-minerals-discovers-275-metre-144900152.html,"Figure 1 Sal de La Puna Project - Drill Holes Location TORONTO, Oct. 03, 2022 (GLOBE NEWSWIRE) -- Arena Minerals Inc. (""Arena"" or the ""Company"") (TSX-V: AN | OTCQX: AMRZF) is pleased to announce it has completed the first exploratory drill hole (R-01) on the Fortuna II claim block, which forms part of the Sal de la Puna Project (“SDLP Project”) located in the Pastos Grandes basin within Salta province, Argentina. The rotary exploratory hole is the first to test the eastern sub-basin of Pastos Gr",CAD,AN.V,GlobeNewswire - Arena Minerals Discovers 275 Metre Aquifer Averaging 441 mg/l Lithium at Fortuna II Claim Block and Provides Sal De La Puna Project Drill Update
fin_news_nlp/yahoo_cad_tickers_news,https://ca.finance.yahoo.com/news/why-blackberry-tsx-bb-stock-140733330.html,"BB stock took a serious hit in September, making it more attractive from a valuation standpoint, yet the stock is plagued by the current macro environment. Should you buy BB stock at these levels? The post Why BlackBerry (TSX:BB) Stock Plunged 18% in September appeared first on The Motley Fool Canada.",CAD,BB.TO,The Motley Fool - Why BlackBerry (TSX:BB) Stock Plunged 18% in September
fin_news_nlp/yahoo_cad_tickers_news,https://ca.finance.yahoo.com/news/brp-completes-acquisition-shawinigan-operations-155300181.html,"BRP Inc. (TSX:DOO) (NASDAQ:DOOO) announces that it has completed the previously announced acquisition of substantially all the assets related to the powersports business of Kongsberg Inc. in Shawinigan, Quebec (henceforth referred to as ""KA Shawinigan""), a subsidiary of Kongsberg Automotive ASA.",CAD,DOO.TO,CNW Group - BRP COMPLETES THE ACQUISITION OF THE SHAWINIGAN OPERATIONS OF KONGSBERG INC.
fin_news_nlp/yahoo_cad_tickers_news,https://ca.finance.yahoo.com/news/carerx-expanding-atlantic-canada-110000084.html,"CareRx Corporation (""CareRx"" or the ""Company"") (TSX: CRRX), Canada's leading provider of pharmacy services to seniors living and other congregate care communities, today announced it has signed a multi-year contract to provide pharmacy services to residents in multiple seniors living facilities in Atlantic Canada, initially serving up to 600 residents. CareRx is currently in the process of establishing pharmacy operations in Atlantic Canada and expects to commence servicing homes in the third qu",CAD,CRRX.TO,CNW Group - CareRx Expanding to Atlantic Canada
fin_news_nlp/yahoo_cad_tickers_news,https://ca.finance.yahoo.com/news/d-invested-cineplex-start-2022-133000856.html,"Canadian investors who snatched up Cineplex Inc. (TSX:CGX) stock in early 2022 will have taken a loss in the year-to-date period. The post If I’d Invested in Cineplex at the Start of 2022, Here’s What I’d Have Now appeared first on The Motley Fool Canada.",CAD,CGX.TO,"The Motley Fool - If I’d Invested in Cineplex at the Start of 2022, Here’s What I’d Have Now"
fin_news_nlp/yahoo_cad_tickers_news,https://ca.finance.yahoo.com/news/emera-nova-scotia-power-united-150000706.html,"HALIFAX/KJIPUKTUK, Nova Scotia, October 03, 2022--United Ways in Halifax, Northeastern Nova Scotia and Cape Breton are launching the United Hurricane Relief Fund, powered by a $250,000 investment from Emera Inc. and Nova Scotia Power. The fund will provide immediate relief funding to help community agencies supporting those most in need in the wake of Hurricane Fiona.",CAD,EMA.TO,"Business Wire - Emera, Nova Scotia Power and United Way launch Hurricane Relief Fund"
fin_news_nlp/yahoo_cad_tickers_news,https://ca.finance.yahoo.com/news/2-canadas-enbridge-names-chairman-162058077.html,"Enbridge Inc on Monday named its Chairman Greg Ebel as the new chief executive, replacing Al Monaco who will retire after a decade at the helm of Canada's biggest pipeline operator during which it faced fierce opposition from environmentalists.  Ebel, 57, who has been board chair since 2017, will start his new role on Jan. 1, 2023.  Prior to that, he was CEO of pipeline company Spectra Energy, which Enbridge acquired in a C$37 billion ($27.1 billion) deal.",CAD,ENB.TO," - UPDATE 2-Canada's Enbridge names Chairman Ebel as CEO, replacing Monaco who retires after 10 years"
fin_news_nlp/yahoo_cad_tickers_news,https://ca.finance.yahoo.com/news/dave-busters-play-rides-robust-134001072.html,"Dave & Buster's (PLAY) benefits from robust entertainment offerings, sales-building initiatives and robust digitalization.",CAD,QSR.TO,Zacks - Dave & Buster's (PLAY) Rides on Robust Entertainment Business
fin_news_nlp/yahoo_cad_tickers_news,https://ca.finance.yahoo.com/news/recharge-hits-52-week-high-150000940.html,Recharge Resources Ltd. (C.RR) hit a new 52-week high of 58 cents Monday. Recharge Resources has executed ...,CAD,SCL.TO, - Recharge Hits 52-Week High on News
fin_news_nlp/yahoo_cad_tickers_news,https://ca.finance.yahoo.com/news/d-invest-1-000-october-143728565.html,"You can earn reliable passive income each year by investing $1,000 in this Canadian dividend stock right now. The post How I’d Invest $1,000 in October to Generate Passive Income for Life appeared first on The Motley Fool Canada.",CAD,SIA.TO,"The Motley Fool - How I’d Invest $1,000 in October to Generate Passive Income for Life"
fin_news_nlp/yahoo_cad_tickers_news,https://ca.finance.yahoo.com/news/tmx-group-thanksgiving-holiday-market-133000368.html,"Toronto Stock Exchange, TSX Venture Exchange, TSX Alpha Exchange and Montréal Exchange will be closed on Monday, October 10, 2022 for the Thanksgiving holiday.",CAD,X.TO,CNW Group - TMX Group Thanksgiving Holiday Market Closures
fin_news_nlp/yahoo_cad_tickers_news,https://ca.finance.yahoo.com/news/troilus-announces-completion-non-brokered-152500672.html,"NOT FOR DISTRIBUTION TO UNITED STATES NEWSWIRE SERVICES OR FOR DISSEMINATION IN THE UNITED STATES MONTREAL, Oct. 03, 2022 (GLOBE NEWSWIRE) -- Troilus Gold Corp. (“Troilus” or the “Company”, TSX: TLG; OTCQX: CHXMF) is pleased to announce that the Company has completed a non-brokered private placement with an investor for 10,525,000 Common Shares of Troilus at a price of C$0.49 per share for aggregate gross proceeds to Troilus of $5,157,250. The Company intends to use the net proceeds of the place",CAD,TLG.TO,GlobeNewswire - Troilus Announces Completion of Non-Brokered Private Placement
fin_news_nlp/yahoo_cad_tickers_news,https://ca.finance.yahoo.com/news/converge-technology-solutions-announces-ibm-123000313.html,"Converge Technology Solutions Corp. (""Converge"" or ""the Company"") (TSX: CTS) (FSE: 0ZB) (OTCQX: CTSDF) a software-enabled IT & Cloud Solutions provider, is pleased to announce it is now certified to sell and implement IBM zSystems and LinuxONE in Canada.",CAD,CTS.TO,CNW Group - Converge Technology Solutions Announces IBM zSystems and LinuxONE Certification in Canada
fin_news_nlp/yahoo_cad_tickers_news,https://ca.finance.yahoo.com/news/electrovaya-establish-lithium-ion-gigafactory-174200456.html,"Electrovaya Inc. (""Electrovaya"" or the ""Company"") (TSX:EFL)(OTCQB:EFLVF), a leading lithium-ion battery technology and manufacturing company, is pleased to announce that it has selected New York State as the location for its first U.S.",CAD,EFL.TO,ACCESSWIRE - Electrovaya to Establish Lithium-Ion Gigafactory in New York State
fin_news_nlp/yahoo_cad_tickers_news,https://ca.finance.yahoo.com/news/high-voltage-surge-enbridge-acquires-175000329.html,"NORTHAMPTON, MA / ACCESSWIRE / October 3, 2022 / Enbridge At Enbridge, our growing renewable energy business got a high-voltage surge today with the purchase of leading U.S. renewable project developer Tri Global Energy. Dallas-based Tri Global ...",CAD,ENB.TO,ACCESSWIRE - A High-Voltage Surge: Enbridge Acquires Tri Global Energy
fin_news_nlp/yahoo_cad_tickers_news,https://ca.finance.yahoo.com/news/fansunite-provides-corporate-investor-webinar-174100922.html,"New business deals finalized in U.S. marketsExpansion in the UK through new partnerships with local sportsbooksEarn-out obligations restructured to minimize shareholder dilution and reduce cash expensesStrong balance sheet: $8.8M in working capital and $160.6M in total assets as of June 30, 2022On an annualized basis, over $2.5M in operating costs have been eliminated without disrupting any current revenue streamsCompany to host an investor webinar on Tuesday, October 4th, 2022 at 1:00 PM EST/10",CAD,FANS.TO,Newsfile - FansUnite Provides Corporate Update and Investor Webinar Date
fin_news_nlp/yahoo_cad_tickers_news,https://ca.finance.yahoo.com/news/iii-acn-better-value-stock-154003278.html,III vs. ACN: Which Stock Is the Better Value Option?,CAD,ISV.TO,Zacks - III or ACN: Which Is the Better Value Stock Right Now?
fin_news_nlp/yahoo_cad_tickers_news,https://ca.finance.yahoo.com/m/629a3701-f8ea-36f0-be4b-29e1ccbcad2c/why-shares-of-new-gold%2C.html,"Shares of precious metals stocks, however, are looking especially lustrous in investors' eyes thanks to companies receiving favorable coverage from Wall Street and silver and gold prices rising higher.  As of 11:15 a.m. ET, shares of New Gold (NYSEMKT: NGD) are up 13.4%, while Endeavour Silver (NYSE: EXK) and Coeur Mining (NYSE: CDE) have risen 11.6% and 15.1%, respectively.  Believing that New Gold's stock has room to run, Michael Siperco, an analyst at RBC Capital, raised his price target on the company's stock to $1.25 from $1.",CAD,NGD.TO,"Motley Fool - Why Shares of New Gold, Endeavour Silver, and Coeur Mining Are Soaring Today"
fin_news_nlp/yahoo_cad_tickers_news,https://ca.finance.yahoo.com/news/rf-capital-reports-aua-33-171400515.html,"RF Capital Group Inc. (the Company) (TSX: RCG) today reported preliminary month-end assets under administration (AUA) of $33.6 billion as of September 30, 2022. AUA decreased 3.3% in September 2022 compared with declines in the S&P/TSX Composite and S&P 500 indices of 4.6% and 10.0%, respectively, over the same period. AUA is a key performance indicator and one of the financial measures used by management, investment advisors and the Company's shareholders to assess operating performance.",CAD,RCG.TO,CNW Group - RF CAPITAL REPORTS AUA OF $33.6 BILLION FOR SEPTEMBER 2022
fin_news_nlp/yahoo_cad_tickers_news,https://ca.finance.yahoo.com/news/no-time-invest-easiest-way-154500200.html,Here’s how investors can take advantage of a recent market crash to create a million-dollar TFSA with ease. The post No Time to Invest? The Easiest Way to Create a Million-Dollar TFSA appeared first on The Motley Fool Canada.,CAD,SHOP.TO,The Motley Fool - No Time to Invest? The Easiest Way to Create a Million-Dollar TFSA
fin_news_nlp/yahoo_cad_tickers_news,https://ca.finance.yahoo.com/news/africa-oil-announces-results-share-100000825.html,"(TSX: AOI) (Nasdaq-Stockholm: AOI) – Africa Oil Corp. (""Africa Oil"", or the ""Company"") is pleased to announce that the Company repurchased a total of 1,883,480 Africa Oil common shares during the period of September 27, 2022 to September 30, 2022 under the previously announced share buyback program. View PDF version.",CAD,AOI.TO,CNW Group - AFRICA OIL ANNOUNCES RESULTS OF SHARE BUYBACK PROGRAM AND UPDATED SHARE CAPITAL
fin_news_nlp/yahoo_cad_tickers_news,https://ca.finance.yahoo.com/news/gibson-energy-confirms-2022-third-200000215.html,"Gibson Energy Inc. announced today that it expects to release its 2022 third quarter financial and operating results on Monday, October 31, 2022 after the close of North American markets. The 2022 third quarter management's discussion and analysis and unaudited consolidated financial statements will be available on the Company's website at www.gibsonenergy.com and on SEDAR at www.sedar.com.",CAD,GEI.TO,CNW Group - Gibson Energy Confirms 2022 Third Quarter Earnings Release Date and Provides Conference Call & Webcast Details
fin_news_nlp/yahoo_cad_tickers_news,https://ca.finance.yahoo.com/news/real-estate-split-corp-announces-192200846.html,"Not for distribution to U.S. Newswire Services or for dissemination in the United States. TORONTO, Oct. 03, 2022 (GLOBE NEWSWIRE) -- Middlefield Group, on behalf of Real Estate Split Corp. (TSX: RS and RS.PR.A) (the “Company”), is pleased to announce that the Company is undertaking an overnight treasury offering of class A and preferred shares (the “Class A Shares” and “Preferred Shares”, respectively). The sales period for this overnight offering will end at 9:00 a.m. (ET) on Tuesday, October 4",CAD,RS.TO,GlobeNewswire - REAL ESTATE SPLIT CORP. Announces Overnight Offering
fin_news_nlp/yahoo_cad_tickers_news,https://ca.finance.yahoo.com/news/rf-capital-reports-aua-33-171400136.html,"RF Capital Group Inc. (the Company) (TSX: RCG) today reported preliminary month-end assets under administration (AUA) of $33.6 billion as of September 30, 2022. AUA decreased 3.3% in September 2022 compared with declines in the S&P/TSX Composite and S&P 500 indices of 4.6% and 10.0%, respectively, over the same period. AUA is a key performance indicator and one of the financial measures used by management, investment advisors and the Company's shareholders to assess operating performance.",CAD,RCG.TO,CNW Group - RF CAPITAL REPORTS AUA OF $33.6 BILLION FOR SEPTEMBER 2022
fin_news_nlp/yahoo_cad_tickers_news,https://ca.finance.yahoo.com/m/08fc506f-3512-3265-8174-941abdc21328/why-nvidia%2C-shopify%2C-and-roku.html,"Shares of e-commerce platform provider Shopify (NYSE: SHOP) rose as much as 3.2%, semiconductor specialist Nvidia (NASDAQ: NVDA) jumped as much as 3.7%, and streaming video pioneer Roku (NASDAQ: ROKU) surged as much as 4.3%.  The latest report on manufacturing data provided investors with the excuse they were looking for to buy shares of beaten-down technology stocks.  The Manufacturing Purchasing Managers Index (PMI) came in at 50.9%, down from 52.8% in August.",CAD,SHOP.TO,"Motley Fool - Why Nvidia, Shopify, and Roku Stocks Popped on Monday"
fin_news_nlp/yahoo_cad_tickers_news,https://ca.finance.yahoo.com/news/theratechnologies-trogarzo-approved-fda-30-190900216.html,"Reduces maintenance dose from a 15-minute IV infusion to a 30-second, undiluted IV push every two weeksSafety profile of Trogarzo® IV push similar to that of IV infusionNew method of administration designed to make maintenance dosing easier for patients and health care providers and allow more clinics to administer treatment MONTREAL, Oct. 03, 2022 (GLOBE NEWSWIRE) -- Theratechnologies Inc. (“Theratechnologies” or the “Company”) (TSX: TH) (NASDAQ: THTX), a biopharmaceutical company focused on th",CAD,TH.TO,"GlobeNewswire - Theratechnologies’ Trogarzo® Approved by FDA for 30-Second Intravenous (IV) Push, Simplifying HIV Treatment for Heavily Treatment-Experienced Population"
fin_news_nlp/yahoo_cad_tickers_news,https://ca.finance.yahoo.com/news/most-actively-traded-companies-toronto-214914276.html,"TORONTO — Some of the most active companies traded Monday on the Toronto Stock Exchange: Toronto Stock Exchange (18,881.19, up 436.97 points) Toronto-Dominion Bank. (TSX:TD). Financials. Up $1.65, or 1.95 per cent, to $86.37 on 9.8 million shares. Suncor Energy Inc. (TSX:SU). Energy. Up $2.86, or 7.35 per cent, to $41.76 on 8.6 million shares. TC Energy Corporation. (TSX:TRP). Energy. Up $2.20, or 3.95 per cent, to $57.84 on 8 million shares. Bank of Nova Scotia. (TSX:BNS). Financials. Down 12 c",CAD,AQN.TO, - Most actively traded companies on the Toronto Stock Exchange
fin_news_nlp/yahoo_cad_tickers_news,https://ca.finance.yahoo.com/news/ats-acquires-asia-pacific-based-210000611.html,"ATS Automation Tooling Systems Inc. (TSX: ATA) (""ATS"" or the ""Company"") today announced that it has entered into a definitive agreement to acquire ZI-ARGUS (""ZIA""), a subsidiary of Zuellig Group. ZIA is a leading independent automation Systems Integrator in the ASEAN region and Australia, with a strong focus on process control, factory floor automation, data center and Industry 4.0 digitization solutions. The financial terms of the transaction were not disclosed.",CAD,ATA.TO,CNW Group - ATS Acquires Asia-Pacific Based System Integrator ZI-ARGUS
fin_news_nlp/yahoo_cad_tickers_news,https://ca.finance.yahoo.com/news/caldwell-acquires-counsel-network-231500624.html,"Retained executive search firm Caldwell (TSX:CWL); (OTCQX:CWLPF) today announced the acquisition of 100% of the shares of The Counsel Network Inc. (""The Counsel Network""), a Canada-based executive search firm specializing in the Canadian legal market.",CAD,CWL.TO,ACCESSWIRE - Caldwell Acquires The Counsel Network
fin_news_nlp/yahoo_cad_tickers_news,https://ca.finance.yahoo.com/news/calian-selected-2022-canada-partner-204500222.html,"Calian® Group Ltd. (TSX:CGY), a diverse products and services company providing innovative healthcare, communications, learning and cybersecurity solutions, announces they have been selected by CrowdStrike, a leader in cloud-delivered protection of endpoints, cloud workloads, identity and data, as its 2022 Canada Partner of the Year.",CAD,CGY.TO,ACCESSWIRE - Calian Selected as 2022 Canada Partner of the Year by CrowdStrike
fin_news_nlp/yahoo_cad_tickers_news,https://ca.finance.yahoo.com/news/york-city-office-leasing-surges-220208201.html,"New York City's office market rebounded in the third quarter from a year earlier, though leasing remained below levels seen before the rise of remote work during the COVID-19 pandemic, and higher interest rates and a strong dollar dampened new investment in the sector.  Office leasing volume rose 27.6% to 9.23 million square feet, the strongest quarterly gain since the end of 2019 – a gangbuster year for leasing in New York, according to Colliers International Group Inc.  ""We're still hearing of large pending deals,"" said Frank Wallach, executive managing director of New York research at Colliers, adding that leases in the works for months typically close by year's end.",CAD,CIGI.TO,Reuters - New York City office leasing surges; still below pre-pandemic levels
fin_news_nlp/yahoo_cad_tickers_news,https://ca.finance.yahoo.com/news/eldorado-gold-provides-exploration-highlighting-210000655.html,"Figure 1 Geological map of the Ormaque deposit area, showing surface projection of mineralized zones (pink shaded area), collar locations and surface traces of new drillholes presented in this news release. Figure 2 Geological map showing outline of the Lamaque / Bourlamaque and Bruell license areas and locations of projects reported in this news release. Figure 3 Geology map showing the Efemcukuru West Vein system and gold assay results (grams/tonne) from surface outcrop and trench samples. Fig",CAD,ELD.TO,"GlobeNewswire - Eldorado Gold Provides Exploration Update Highlighting Resource Expansion Upside at Lamaque, Efemcukuru, and Olympias"
fin_news_nlp/yahoo_cad_tickers_news,https://ca.finance.yahoo.com/news/helix-biopharma-corp-appoints-dr-210125616.html,"October 3, 2022 – TheNewswire - Toronto, Ontario – Helix BioPharma Corp. (TSX:HBP) (OTC:HBPCF) (“Helix” or the “Company”), a clinical-stage biopharmaceutical company that is developing unique thera...",CAD,HBP.TO, - Helix BioPharma Corp. Appoints Dr. Frank Gary Renshaw as Chief Medical Officer
fin_news_nlp/yahoo_cad_tickers_news,https://ca.finance.yahoo.com/news/sangoma-announces-several-executive-appointments-231000691.html,"MARKHAM, Ontario, Oct. 03, 2022 (GLOBE NEWSWIRE) -- Sangoma Technologies Corporation (TSX: STC; Nasdaq: SANG) (“Sangoma” or the “Company”), a trusted leader in delivering cloud-based Communications as a Service solutions for companies of all sizes, today announced several executive appointments to help position the company for ongoing growth. Mr. Larry Stock, the Company’s former Chief Corporate Officer, has been appointed Chief Financial Officer effective October 3, 2022. He succeeds Mr. David",CAD,STC.TO,GlobeNewswire - Sangoma Announces Several Executive Appointments Including Chief Financial Officer Transition
fin_news_nlp/yahoo_cad_tickers_news,https://ca.finance.yahoo.com/news/why-suncor-energy-stock-fell-193000411.html,"Energy stocks are top gainers on the TSX in 2022, but still cheap. Suncor Energy stock seems ripe for a massive rally. The post Why Suncor Energy Stock Fell 10% in September appeared first on The Motley Fool Canada.",CAD,SU.TO,The Motley Fool - Why Suncor Energy Stock Fell 10% in September
fin_news_nlp/yahoo_cad_tickers_news,https://ca.finance.yahoo.com/news/invest-canadian-energy-stocks-now-221500551.html,"Canadian energy stocks are insanely cheap, but are they a good investment right now? The post Should You Invest in Canadian Energy Stocks Right Now? appeared first on The Motley Fool Canada.",CAD,TVE.TO,The Motley Fool - Should You Invest in Canadian Energy Stocks Right Now?
fin_news_nlp/yahoo_cad_tickers_news,https://ca.finance.yahoo.com/news/torex-gold-receives-key-environmental-220000356.html,"MIA Integral will allow for integrated operations at both ELG and Media Luna(All amounts expressed in U.S. Dollars unless otherwise stated) TORONTO, Oct. 03, 2022 (GLOBE NEWSWIRE) -- Torex Gold Resources Inc. (the “Company” or “Torex”) (TSX: TXG) announces the Company has received approval from Mexico’s Secretariat of Environmental and Natural Resources (“SEMARNAT”) on the key, culminating environmental permit for the Media Luna Project. The approval (“MIA Integral”) allows for operations to beg",CAD,TXG.TO,GlobeNewswire - Torex Gold Receives Key Environmental Permit for Media Luna
fin_news_nlp/yahoo_cad_tickers_news,https://ca.finance.yahoo.com/news/waste-connections-announces-dates-third-200500503.html,"Waste Connections, Inc. (TSX/NYSE: WCN) (""Waste Connections"" or the ""Company"") today announced that it will report financial results for the third quarter of 2022 after the close of the stock market on November 2, 2022. The Company will be hosting an investor conference call related to this release on November 3rd at 8:30 A.M. Eastern Time.",CAD,WCN.TO,CNW Group - WASTE CONNECTIONS ANNOUNCES DATES FOR THIRD QUARTER 2022 EARNINGS RELEASE AND UPCOMING MANAGEMENT PRESENTATION
fin_news_nlp/yahoo_cad_tickers_news,https://ca.finance.yahoo.com/news/angel-wing-metals-announces-appointment-210100252.html,"Angel Wing Metals Inc. (TSXV: AWM) (""Angel Wing Metals"" or the ""Company"") is pleased to announce the appointment of Mr. Remantra Sheopaul as Chief Financial Officer (""CFO"") of the Company, replacing the current interim CFO Mr. Sameer Uplenchwar, effective immediately. The Company thanks Mr. Uplenchwar for his tenure as Chief Financial Officer through January 2021 and for continuing in a consulting capacity, on accounting and financial matters, through November 2022.",CAD,AWM.V,CNW Group - Angel Wing Metals Announces Appointment of Chief Financial Officer
fin_news_nlp/yahoo_cad_tickers_news,https://ca.finance.yahoo.com/news/ats-acquires-asia-pacific-based-210000140.html,"ATS Automation Tooling Systems Inc. (TSX: ATA) (""ATS"" or the ""Company"") today announced that it has entered into a definitive agreement to acquire ZI-ARGUS (""ZIA""), a subsidiary of Zuellig Group. ZIA is a leading independent automation Systems Integrator in the ASEAN region and Australia, with a strong focus on process control, factory floor automation, data center and Industry 4.0 digitization solutions. The financial terms of the transaction were not disclosed.",CAD,ATA.TO,CNW Group - ATS Acquires Asia-Pacific Based System Integrator ZI-ARGUS
