source,url,description,country,company,title
fin_news_nlp/yahoo_cad_tickers_news,https://ca.finance.yahoo.com/news/consumer-digital-goods-services-virtual-140900212.html,"NEW YORK, Nov. 04, 2022 (GLOBE NEWSWIRE) -- Virtual Investor Conferences, the leading proprietary investor conference series, today announced that the presentations from the November Consumer | Digital Goods & Ser Virtual Investor Conference are now available for on-demand viewing. REGISTER NOW OR LOGIN AT: https://bit.ly/3h2oHx0 The company presentations will be available 24/7 for 90 days. Investors, advisors, and analysts may download investor materials from the company’s resource section. Com",CAD,FLOW.TO,GlobeNewswire - Consumer | Digital Goods & Services Virtual Investor Conference: Presentations Now Available for On-Demand Viewing
fin_news_nlp/yahoo_cad_tickers_news,https://ca.finance.yahoo.com/news/ontario-auto-parts-maker-magna-140355086.html,"AURORA, ONTARIO — Magna International Inc. says it earned US$289 million in its third quarter, up from US$11 million in the same quarter last year. The auto parts maker, which keeps its books in U.S. dollars, says the profit amounted to $1 per diluted share for the quarter ended Sept. 30, compared with four cents per diluted share last year. Sales increased to US$9.27 billion compared with US$7.92 billion in 2021. On an adjusted basis, Magna says it earned US$1.07 per diluted share, up from 56 c",CAD,MG.TO,"The Canadian Press - Ontario auto parts maker Magna International reports higher Q3 profit, sales"
fin_news_nlp/yahoo_cad_tickers_news,https://ca.finance.yahoo.com/news/maxar-technologies-participate-upcoming-investor-130000706.html,"WESTMINSTER, Colo., November 04, 2022--Maxar Technologies (NYSE:MAXR) (TSX:MAXR), provider of comprehensive space solutions and secure, precise, geospatial intelligence, today announced that members of senior management will participate in the following upcoming investor conference:",CAD,MAXR.TO, - Maxar Technologies to Participate in Upcoming Investor Conference
fin_news_nlp/yahoo_cad_tickers_news,https://ca.finance.yahoo.com/news/oncolytics-biotech-host-conference-call-110000846.html,"Oncolytics Biotech® Inc. (NASDAQ: ONCY) (TSX: ONC) today announced that it will host a conference call and webcast on Monday, November 7, 2022, at 8:30 a.m. ET to discuss a corporate update and financial results for the third quarter of 2022.",CAD,ONC.TO,CNW Group - Oncolytics Biotech® to Host Conference Call to Discuss Third Quarter Financial Results and Recent Operational Highlights
fin_news_nlp/yahoo_cad_tickers_news,https://ca.finance.yahoo.com/news/1-gold-fields-target-yamana-141108614.html,"Canada's Yamana Gold said on Friday it has received an unsolicited offer from Agnico Eagle Mines Ltd and Pan American Silver Corp to acquire the company in a near $5 billion cash-and-stock deal.  Under the terms of the offer, Yamana shareholders would receive $1.0406 in cash, 0.0376 of an Agnico Share and 0.1598 of a Pan American Share for each share held.  South Africa's Gold Fields had agreed to take over Yamana for $6.7 billion in an all-stock deal in May, and a shareholder vote was set to take place on Nov. 22.",CAD,PAAS.TO," - UPDATE 1-Gold Fields target Yamana gets buyout offer from Agnico, Pan American"
fin_news_nlp/yahoo_cad_tickers_news,https://ca.finance.yahoo.com/news/yamana-bidding-war-erupts-pan-134533262.html,"(Bloomberg) -- A bidding war has erupted for Yamana Gold Inc., with Pan American Silver Corp. and Agnico Eagle Mines Ltd. making an offer to buy the Canadian miner weeks as it pursues a combination with South Africa’s Gold Fields Ltd.Most Read from BloombergTwitter Sued for Mass Layoffs by Musk Without Enough NoticeMusk Plans to Eliminate Half of Twitter Jobs to Cut CostsMusk Eliminates ‘Days of Rest’ From Twitter Employee CalendarsBlackstone’s $70 Billion Real Estate Fund for Retail Investors I",CAD,PAAS.TO,"Bloomberg - Yamana Bidding War Erupts as Pan American, Agnico Make Offer"
fin_news_nlp/yahoo_cad_tickers_news,https://ca.finance.yahoo.com/m/913337bd-38e8-3ccd-98fa-a06efa46cbeb/shopify-stock%3A-bull-vs.-bear.html,"Shopify (NYSE: SHOP) stock has taken investors on a tumultuous ride over the last couple of years.  Shopify stock has lost roughly three-quarters of its value so far in 2022 and is down 80% from the all-time high that it hit last November.  Should investors treat the big valuation pullback as a buying opportunity, or is there still too much downside risk to make the stock a smart buy at current prices?",CAD,SHOP.TO,Motley Fool - Shopify Stock: Bull vs. Bear
fin_news_nlp/yahoo_cad_tickers_news,https://ca.finance.yahoo.com/m/71ac281f-dc70-32d2-8413-0c5f96a25a3c/why-shopify-surged-27.1%25-in.html,"Shares of Shopify (NYSE: SHOP) surged 27.1% in October, according to data provided by S&P Global Market Intelligence.  During the month, Shopify delivered another pleasing set of earnings for its fiscal 2022 third quarter.  Shopify's revenue came in better than analysts' expectations of $1.33 billion, which was probably the reason for the stock's surge.",CAD,SHOP.TO,Motley Fool - Why Shopify Surged 27.1% in October
fin_news_nlp/yahoo_cad_tickers_news,https://ca.finance.yahoo.com/news/best-tsx-stocks-invest-1-130000504.html,"Two companies with strong earnings growth and attractive dividend yields are the best TSX stocks to buys today if you only have $1,000 to invest. The post The Best TSX Stocks to Invest $1,000 in Right Now appeared first on The Motley Fool Canada.",CAD,ADN.TO,"The Motley Fool - The Best TSX Stocks to Invest $1,000 in Right Now"
fin_news_nlp/yahoo_cad_tickers_news,https://ca.finance.yahoo.com/news/2-safe-dividend-stocks-beat-143000538.html,These are two Canadian dividend stocks that you can count on while inflation is spiking. The post 2 Safe Dividend Stocks to Beat Inflation appeared first on The Motley Fool Canada.,CAD,AQN.TO,The Motley Fool - 2 Safe Dividend Stocks to Beat Inflation
fin_news_nlp/yahoo_cad_tickers_news,https://ca.finance.yahoo.com/news/algonquin-power-utilities-aqn-earnings-140002029.html,Algonquin Power & Utilities (AQN) doesn't possess the right combination of the two key ingredients for a likely earnings beat in its upcoming report. Get prepared with the key expectations.,CAD,AQN.TO,Zacks - Algonquin Power & Utilities (AQN) Earnings Expected to Grow: What to Know Ahead of Next Week's Release
fin_news_nlp/yahoo_cad_tickers_news,https://ca.finance.yahoo.com/news/kolibri-hits-52-week-high-144600994.html,Kolibri Global Energy Inc. (T.KEI) hit a new 52-week high of $3.50 Friday. Kolibri announces third-quarter ...,CAD,ATD.TO, - Kolibri Hits 52-Week High on Earnings News
fin_news_nlp/yahoo_cad_tickers_news,https://ca.finance.yahoo.com/news/bce-q3-earnings-revenues-surpass-140302756.html,BCE's third-quarter performance is boosted by strong service and product revenue growth.,CAD,BCE.TO,"Zacks - BCE Q3 Earnings & Revenues Surpass Estimates, Rise Y/Y"
fin_news_nlp/yahoo_cad_tickers_news,https://ca.finance.yahoo.com/m/a9b362e2-5787-355d-b1aa-1337a9709782/why-canada-goose-stock-was.html,"Week to date, shares of Canada Goose Holdings (NYSE: GOOS) were down 12% through Thursday's close, according to data provided by S&P Global Market Intelligence.  Another quarter of growth wasn't enough to turn the stock around this time.  Year to date, Canada Goose shares are down 56%, but as disruptions in China continue, it's unclear how soon the stock might recover.",CAD,GOOS.TO,Motley Fool - Why Canada Goose Stock Was Falling This Week
fin_news_nlp/yahoo_cad_tickers_news,https://ca.finance.yahoo.com/news/cargojet-inc-tse-cjt-stock-143756599.html,"It is hard to get excited after looking at Cargojet's (TSE:CJT) recent performance, when its stock has declined 14...",CAD,CJT.TO,Simply Wall St. - Cargojet Inc.'s (TSE:CJT) Stock Has Been Sliding But Fundamentals Look Strong: Is The Market Wrong?
fin_news_nlp/yahoo_cad_tickers_news,https://ca.finance.yahoo.com/news/paylocity-pcty-beats-q1-earnings-142202280.html,Paylocity's (PCTY) Q1 results reflect the benefits of better sales execution and sustained investments in technological upgrades and product innovation.,CAD,CLS.TO,Zacks - Paylocity (PCTY) Beats on Q1 Earnings & Revenue Estimates
fin_news_nlp/yahoo_cad_tickers_news,https://ca.finance.yahoo.com/news/arrow-electronics-arw-q3-earnings-133201533.html,"Arrow Electronics' (ARW) third-quarter 2022 results reflect increased demand for electronic components and software, cloud, and security solutions.",CAD,CLS.TO,"Zacks - Arrow Electronics (ARW) Q3 Earnings & Revenues Beat, Rise Y/Y"
fin_news_nlp/yahoo_cad_tickers_news,https://ca.finance.yahoo.com/news/cenovus-energy-inc-tse-cve-152250776.html,Every investor in Cenovus Energy Inc. ( TSE:CVE ) should be aware of the most powerful shareholder groups. We can see...,CAD,CVE.TO,"Simply Wall St. - Cenovus Energy Inc.'s (TSE:CVE) large institutional owners must be happy as stock continues to impress, up 5.3% over the past week"
fin_news_nlp/yahoo_cad_tickers_news,https://ca.finance.yahoo.com/news/dye-durham-host-first-quarter-153000667.html,"Dye & Durham Limited (TSX: DND) (""Dye & Durham"" or the ""Company""), a leading provider of cloud-based, efficient workflow software for legal and business professionals, today announced that it will hold a conference call to discuss its first quarter fiscal 2023 results on Thursday, November 10, 2022, at 4:30 p.m. ET. The call will be hosted by Matt Proud, Chief Executive Officer, and Frank Di Liso, Chief Financial Officer, followed by a question-and-answer period. Dye & Durham will report its fin",CAD,DND.TO,CNW Group - Dye & Durham to Host First Quarter Fiscal 2023 Conference Call
fin_news_nlp/yahoo_cad_tickers_news,https://ca.finance.yahoo.com/news/enbridge-greenlights-c-3-6-152354083.html,Canadian energy infrastructure firm Enbridge Inc on Friday announced a C$3.6 billion ($2.65 billion) expansion of the southern segment of its British Columbia (B.C.) gas pipeline system after strong demand from customers.  Gas production in Western Canada this year neared record levels of 18 billion cubic feet a day.  Enbridge Chief Executive Officer Al Monaco said that supply growth coupled with future demand from planned liquefied natural gas (LNG) export projects was underpinning the expansions.,CAD,ENB.TO,Reuters - Enbridge greenlights C$3.6 billion gas pipeline expansion in Canada
fin_news_nlp/yahoo_cad_tickers_news,https://ca.finance.yahoo.com/news/enbridge-ceo-says-federal-incentives-145259765.html,"CALGARY — The new incentives for clean energy development in the federal government's fall fiscal update will make a real difference in helping to attract investment capital to Canada, the chief executive of Enbridge Inc. said Friday. On a conference call to discuss the pipeline giant's third quarter financial results, CEO Al Monaco said the Calgary-based company is encouraged by measures announced by Finance Minister Chrystia Freeland on Thursday. In an effort to encourage the growth of low-car",CAD,ENB.TO,The Canadian Press - Enbridge CEO says federal incentives for clean tech will spur investment in Canada
fin_news_nlp/yahoo_cad_tickers_news,https://ca.finance.yahoo.com/news/horizonte-minerals-plc-announces-result-163000386.html,"Horizonte Minerals Plc (AIM:HZM)(TSX:HZM) announces that, further to the announcement made on 4 October 2022 (RNS Number: 7742B) (the ""Fundraise Announcement"") and subsequent announcement on 12 October 2022 (RNS Number: 7083C), all resolutions proposed at its General Meeting, held earlier today, were duly passed.",CAD,HZM.TO,ACCESSWIRE - Horizonte Minerals PLC Announces Result of General Meeting
fin_news_nlp/yahoo_cad_tickers_news,https://ca.finance.yahoo.com/news/prediction-2-tsx-stocks-keep-133218813.html,Loblaw and Alimentation Couche-Tard are two great defensives that could rally high in 2023. The post Prediction: These 2 TSX Stocks Will Keep on Rising in 2023 appeared first on The Motley Fool Canada.,CAD,L.TO,The Motley Fool - Prediction: These 2 TSX Stocks Will Keep on Rising in 2023
fin_news_nlp/yahoo_cad_tickers_news,https://ca.finance.yahoo.com/news/maxar-maxr-incurs-loss-q3-150003411.html,Maxar's (MAXR) Q3 top line is affected by softness in the Earth Intelligence segment.,CAD,MAXR.TO,"Zacks - Maxar (MAXR) Incurs Loss in Q3, Revenues Miss Estimates"
fin_news_nlp/yahoo_cad_tickers_news,https://ca.finance.yahoo.com/news/nfi-group-stock-fell-27-133000338.html,"NFI Group Inc. (TSX:NFI) stock fell sharply in October due to supplier issues, but you should be intrigued by the stock’s potential. The post NFI Group Stock Fell 27% in October: Is it Time to Buy? appeared first on The Motley Fool Canada.",CAD,NFI.TO,The Motley Fool - NFI Group Stock Fell 27% in October: Is it Time to Buy?
fin_news_nlp/yahoo_cad_tickers_news,https://ca.finance.yahoo.com/news/yamana-bidding-war-looms-rival-153004510.html,"(Bloomberg) -- A bidding war may be brewing for Yamana Gold Inc., with Pan American Silver Corp. and Agnico Eagle Mines Ltd. making a $4.8 billion offer to buy the Canadian miner weeks before investors were set to vote on a merger with South Africa’s Gold Fields Ltd.Most Read from BloombergTwitter Sued for Mass Layoffs by Musk Without Enough NoticeMusk Plans to Eliminate Half of Twitter Jobs to Cut CostsMusk Eliminates ‘Days of Rest’ From Twitter Employee CalendarsBlackstone’s $70 Billion Real E",CAD,PAAS.TO,Bloomberg - Yamana Bidding War Looms After Rival $4.8 Billion Offer
fin_news_nlp/yahoo_cad_tickers_news,https://ca.finance.yahoo.com/news/cambium-cmbm-beats-q3-earnings-145002978.html,Record demand for Enterprise products and higher Point-to-Point revenues help Cambium (CMBM) to beat third-quarter 2022 earnings estimates.,CAD,SW.TO,Zacks - Cambium (CMBM) Beats Q3 Earnings Estimates on Top-Line Growth
fin_news_nlp/yahoo_cad_tickers_news,https://ca.finance.yahoo.com/news/commscope-comm-q3-earnings-top-144502889.html,Higher revenues across most operating segments help CommScope (COMM) to beat third-quarter 2022 earnings estimates.,CAD,SW.TO,Zacks - CommScope (COMM) Q3 Earnings Top Estimates on Solid Revenues
fin_news_nlp/yahoo_cad_tickers_news,https://ca.finance.yahoo.com/news/solution-financial-initiates-quarterly-dividend-160000380.html,"Vancouver, British Columbia--(Newsfile Corp. - November 4, 2022) - Solution Financial Inc. (TSX: SFI) (OTCQX: SLNFF) (the ""Company"" or ""Solution"") a leading provider of luxury automotive and yacht leasing in British Columbia, is pleased to announce that the Company's Board of Directors has authorized the payment of a quarterly dividend of $0.001. The quarterly dividend is payable on December 15, 2022 to common shareholders of record as of the close of business on November ...",CAD,SFI.TO,Newsfile - Solution Financial Initiates Quarterly Dividend
fin_news_nlp/yahoo_cad_tickers_news,https://ca.finance.yahoo.com/news/reason-surge-energy-inc-tse-152518532.html,"When close to half the companies in Canada have price-to-earnings ratios (or ""P/E's"") above 10x, you may consider Surge...",CAD,SGY.TO,Simply Wall St. - There Is A Reason Surge Energy Inc.'s (TSE:SGY) Price Is Undemanding
fin_news_nlp/yahoo_cad_tickers_news,https://ca.finance.yahoo.com/news/institutional-investors-may-adopt-severe-151258060.html,"If you want to know who really controls Wheaton Precious Metals Corp. ( TSE:WPM ), then you'll have to look at the...",CAD,WPM.TO,Simply Wall St. - Institutional investors may adopt severe steps after Wheaton Precious Metals Corp.'s (TSE:WPM) latest 7.8% drop adds to a year losses
fin_news_nlp/yahoo_cad_tickers_news,https://ca.finance.yahoo.com/news/3-dividend-stocks-safely-hold-153000806.html,Top TSX dividend stocks are on sale for a buy-and-hold TFSA or RRSP portfolio. The post 3 Dividend Stocks You Can Safely Hold for Decades appeared first on The Motley Fool Canada.,CAD,BMO.TO,The Motley Fool - 3 Dividend Stocks You Can Safely Hold for Decades
fin_news_nlp/yahoo_cad_tickers_news,https://ca.finance.yahoo.com/news/bausch-lomb-lumifyeyedance-challenge-wins-131500419.html,"Bausch + Lomb Corporation (NYSE/TSX: BLCO) (""Bausch + Lomb""), a leading global eye health company dedicated to helping people see better to live better, today announced the #LUMIFYEyeDance Challenge on TikTok has received Business Intelligence Group's (BIG) 2022 Public Relations and Marketing Excellence Award for External Campaign of the Year.",CAD,BLCO.TO,CNW Group - Bausch + Lomb #LUMIFYEyeDance Challenge Wins 2022 Public Relations and Marketing Excellence Award for External Campaign of the Year from Business Intelligence Group
fin_news_nlp/yahoo_cad_tickers_news,https://ca.finance.yahoo.com/news/yamana-takeover-battle-brews-rivals-172300818.html,(Bloomberg) -- Yamana Gold Inc. is at the center of a takeover battle after two Canadian mining companies teamed up on an unsolicited $4.8 billion offer to break up an earlier merger agreement with South Africa’s Gold Fields Ltd.Most Read from BloombergLawyer Suing Twitter Over Layoffs Says Musk Now Trying to ComplyMusk Plans to Eliminate Half of Twitter Jobs to Cut CostsMusk Eliminates ‘Days of Rest’ From Twitter Employee CalendarsTwitter Latest: Civil Rights Groups to Boost Advertiser Pressure,CAD,PAAS.TO,Bloomberg - Yamana Takeover Battle Brews as Rivals Make $4.8 Billion Bid
fin_news_nlp/yahoo_cad_tickers_news,https://ca.finance.yahoo.com/news/restaurant-brands-qsr-q3-earnings-162404993.html,Restaurant Brands' (QSR) third-quarter performance benefits from solid sales growth at Tim Hortons Canada and Burger King International businesses.,CAD,QSR.TO,"Zacks - Restaurant Brands' (QSR) Q3 Earnings Beat Estimates, Rise Y/Y"
fin_news_nlp/yahoo_cad_tickers_news,https://ca.finance.yahoo.com/news/notification-holdings-180000437.html,"/ Amaroq Minerals Ltd. (AIM, TSXV, NASDAQ First North: AMRQ - formerly AEX Gold Inc.), an independent mine development company with a substantial land package of gold and strategic mineral assets covering an area of 7,866.85 km 2 in Southern Greenland, has received the following three TR-1 notifications as a result of its recent fundraising:",CAD,AMRQ.V,ACCESSWIRE - Notification of Holdings
fin_news_nlp/yahoo_cad_tickers_news,https://ca.finance.yahoo.com/news/bausch-bhc-q3-earnings-sales-163804871.html,Bausch (BHC) Q3 earnings and sales decline year over year due to the unfavorable impact of foreign exchange rates. The company also lowers its annual guidance.,CAD,BHC.TO,"Zacks - Bausch (BHC) Q3 Earnings & Sales Miss, Guidance Lowered"
fin_news_nlp/yahoo_cad_tickers_news,https://ca.finance.yahoo.com/news/bbtv-holdings-inc-host-third-110000965.html,"BBTV Holdings Inc. (TSX: BBTV) (OTCQX: BBTVF) (Frankfurt: 64V) (""BBTV"" or the ""Company""), the leading creator monetization company with a mission to help creators become more successful, today announced that it will release its financial results for the third quarter 2022 after market close on Monday, November 14th, 2022. The Company will subsequently hold a conference call on Monday, November 14th, 2022 at 2:15pm PT/5:15pm ET hosted by Ms. Shahrzad Rafati, Chairperson and CEO, and Mr. Ben Groot",CAD,BBTV.TO,CNW Group - BBTV Holdings Inc to Host Third Quarter 2022 Conference Call
fin_news_nlp/yahoo_cad_tickers_news,https://ca.finance.yahoo.com/news/better-buy-royal-bank-stock-180000963.html,Industry leaders with wide competitive moats and strong balance sheets should be good stocks to buy in an uncertain economic environment. The post Better Buy: Royal Bank Stock or BCE Stock? appeared first on The Motley Fool Canada.,CAD,BCE.TO,The Motley Fool - Better Buy: Royal Bank Stock or BCE Stock?
fin_news_nlp/yahoo_cad_tickers_news,https://ca.finance.yahoo.com/news/2-top-tsx-retail-stocks-162703247.html,Looking for growth or income from a retail stock? Some of the top TSX retail stocks to buy right now may surprise you. The post 2 Top TSX Retail Stocks to Buy in November 2022 appeared first on The Motley Fool Canada.,CAD,CTC.TO,The Motley Fool - 2 Top TSX Retail Stocks to Buy in November 2022
fin_news_nlp/yahoo_cad_tickers_news,https://ca.finance.yahoo.com/news/cathedral-energy-services-tse-cet-185427158.html,"Generally speaking, investors are inspired to be stock pickers by the potential to find the big winners. You won't get...",CAD,CET.TO,"Simply Wall St. - Cathedral Energy Services (TSE:CET) delivers shareholders massive 64% CAGR over 3 years, surging 24% in the last week alone"
fin_news_nlp/yahoo_cad_tickers_news,https://ca.finance.yahoo.com/news/yelps-q3-earnings-surpass-estimates-162904391.html,YELP's Q3 results reflect benefits from increased advertising spending by customers in the post-pandemic scenario when most of the social-distancing measures are relaxed.,CAD,CLS.TO,"Zacks - YELP's Q3 Earnings Surpass Estimates, Revenues Increase Y/Y"
fin_news_nlp/yahoo_cad_tickers_news,https://ca.finance.yahoo.com/news/atlassians-team-q1-earnings-miss-160404075.html,Atlassian's (TEAM) fiscal first-quarter results reflect the benefits from new customer wins and the high-margin subscription revenue business.,CAD,CLS.TO,"Zacks - Atlassian's (TEAM) Q1 Earnings Miss, Revenues Beat Estimates"
fin_news_nlp/yahoo_cad_tickers_news,https://ca.finance.yahoo.com/news/energy-fuels-announces-q3-2022-202800364.html,"Energy Fuels Inc. (NYSE American: UUUU) (TSX: EFR) (""Energy Fuels"" or the ""Company"") today reported its financial results for the quarter ended September 30, 2022. The Company's quarterly report on Form 10-Q has been filed with the U.S. Securities and Exchange Commission (""SEC"") and may be viewed on the Electronic Document Gathering and Retrieval System (""EDGAR"") at www.sec.gov/edgar.shtml, on the System for Electronic Document Analysis and Retrieval (""SEDAR"") at www.sedar.com, and on the Compan",CAD,EFR.TO,"CNW Group - Energy Fuels Announces Q3-2022 Results, Including Continued Robust Balance Sheet and Market-Leading U.S. Uranium & Rare Earth Positions"
fin_news_nlp/yahoo_cad_tickers_news,https://ca.finance.yahoo.com/news/could-investing-shopify-stock-help-173000450.html,Are you interested in Shopify stock? Find out if I think it could make you a millionaire! The post Could Investing in Shopify Stock Help Make You a Millionaire? appeared first on The Motley Fool Canada.,CAD,SHOP.TO,The Motley Fool - Could Investing in Shopify Stock Help Make You a Millionaire?
fin_news_nlp/yahoo_cad_tickers_news,https://ca.finance.yahoo.com/news/snc-lavalin-reports-q3-profit-142048365.html,"MONTREAL — SNC-Lavalin Inc. reported increased profits in its latest quarter despite feeling the negative effects of currency fluctuations and cost overruns from its fixed-price projects. ""Recent performance highlights our ability to capture market share in our core geographies, which continue to demonstrate resilient growth,"" Ian Edwards, chief executive officer of SNC, said in a statement on the company's third-quarter results on Friday. Under his stewardship, SNC-Lavalin has shifted its focus",CAD,SNC.TO,The Canadian Press - SNC-Lavalin reports Q3 profit up compared with a year ago
fin_news_nlp/yahoo_cad_tickers_news,https://ca.finance.yahoo.com/news/most-actively-traded-companies-toronto-204140559.html,"TORONTO — Some of the most active companies traded Friday on the Toronto Stock Exchange: Toronto Stock Exchange (19,449.81, up 208.59 points): Enbridge Inc. (TSX:ENB). Energy. Up 55 cents, or 1.03 per cent, to $54.17 on 16.4 million shares. Barrick Gold Corp. (TSX:ABX). Materials. Up $1.15, or 6.40 per cent, to $19.13 on 14.1 million shares. Baytex Energy Corp. (TSX:BTE). Energy. Down 20 cents, or 2.58 per cent, to $7.55 on 10.2 million shares. Yamana Gold Inc. (TSX:YRI). Materials. Up $1.01, or",CAD,SU.TO, - Most actively traded companies on the Toronto Stock Exchange
fin_news_nlp/yahoo_cad_tickers_news,https://ca.finance.yahoo.com/news/titanium-transportation-expands-location-montreal-203900065.html,"BOLTON, Ontario, Nov. 04, 2022 (GLOBE NEWSWIRE) -- Titanium Transportation Group Inc. (Titanium"" or the ""Company"") (TSX:TTNM) a leading provider of transportation and logistics services throughout North America, is pleased to announce it is opening a new asset light location in Montreal, QC. Combined with Titanium’s existing seven offices across Canada and US, this marks the Company’s eighth freight brokerage office. “With the opening of our Montreal location, we are strengthening Titanium’s exi",CAD,TTNM.TO,"GlobeNewswire - Titanium Transportation Expands with New Location in Montreal, QC"
fin_news_nlp/yahoo_cad_tickers_news,https://ca.finance.yahoo.com/news/4-stocks-mix-match-dividends-141500412.html,"When holding a stock long term, the intelligent thing to do is to look for a good mix of both dividends and growth potential. The post 4 Stocks to Mix and Match for Dividends and Growth appeared first on The Motley Fool Canada.",CAD,AQN.TO,The Motley Fool - 4 Stocks to Mix and Match for Dividends and Growth
fin_news_nlp/yahoo_cad_tickers_news,https://ca.finance.yahoo.com/news/analysts-just-cut-argonaut-gold-122501133.html,"Today is shaping up negative for Argonaut Gold Inc. ( TSE:AR ) shareholders, with the analysts delivering a substantial...",CAD,AR.TO,Simply Wall St. - Analysts Have Just Cut Their Argonaut Gold Inc. (TSE:AR) Revenue Estimates By 8.3%
fin_news_nlp/yahoo_cad_tickers_news,https://ca.finance.yahoo.com/news/aya-gold-silver-inc-files-220700377.html,"Aya Gold & Silver Inc. (TSX: AYA) (OTCQX: AYASF) (""Aya"" or the ""Corporation"") is pleased to announce that it has filed a preliminary short form base shelf prospectus (the ""Preliminary Shelf Prospectus"") with the securities regulatory authorities in all the provinces of Canada (except the territories).",CAD,AYA.TO,CNW Group - Aya Gold & Silver Inc. Files Preliminary Short Form Base Shelf Prospectus
