source,url,description,country,company,title
fin_news_nlp/yahoo_cad_tickers_news,https://ca.finance.yahoo.com/news/3-stable-stocks-add-tfsa-193000707.html,TFSA or RRSP investors can consider adding blue-chip stocks such as Fortis and Canadian National Railway to their portfolios in 2022. The post 3 Stable Stocks to Add to Your TFSA or RRSP in November 2022 appeared first on The Motley Fool Canada.,CAD,FTS.TO, - 3 Stable Stocks to Add to Your TFSA or RRSP in November 2022
fin_news_nlp/yahoo_cad_tickers_news,https://ca.finance.yahoo.com/news/genesis-land-development-corp-appoints-000000757.html,"Genesis Land Development Corp. (TSX: GDC) (""Genesis"") is pleased to announce the promotions of PS Sidhu as Senior Vice President, Homebuilding, along with his role as President, Genesis Builders Group Inc. (""GBG"") and Brian Whitwell as Senior Vice President, Asset Management, both effective November 2, 2022.",CAD,GDC.TO,CNW Group - Genesis Land Development Corp. Appoints Senior Vice Presidents
fin_news_nlp/yahoo_cad_tickers_news,https://ca.finance.yahoo.com/news/genesis-reports-2022-third-quarter-215300508.html,"Genesis Land Development Corp. (TSX: GDC) (the ""Corporation"" or ""Genesis"") reported its financial and operating results for the three months (""Q3"") and nine months ended September 30, 2022 (""YTD""). Genesis is an integrated land developer and residential home builder with a strategy to grow its portfolio of well-located, entitled and unentitled primarily residential lands and serviced lots throughout the Calgary Metropolitan Area.",CAD,GDC.TO,CNW Group - Genesis Reports 2022 Third Quarter Results and Declares a Special Dividend of $0.075
fin_news_nlp/yahoo_cad_tickers_news,https://ca.finance.yahoo.com/news/gfl-environmental-inc-gfl-q3-000512960.html,"GFL Environmental Inc. (GFL) delivered earnings and revenue surprises of 0% and 11.15%, respectively, for the quarter ended September 2022. Do the numbers hold clues to what lies ahead for the stock?",CAD,GFL.TO,Zacks - GFL Environmental Inc. (GFL) Q3 Earnings Meet Estimates
fin_news_nlp/yahoo_cad_tickers_news,https://ca.finance.yahoo.com/news/hudbay-provides-exploration-announces-initial-232300235.html,"Figure 1: General Location of the Llaguen Project The Llaguen project is located in the La Libertad region in northwestern Peru. It is accessible by road and is in close proximity to the Salaverry port and the Trujillo Nueva electric substation. Figure 2: Isometric View of the Llaguen Mineral Resource Estimate Shell The high-grade (0.30% copper grade) shell is displayed below, inside the 0.33 revenue-factor pit shell used to estimate mineral resources. Figure 3: Sectional View of the Llaguen Dep",CAD,HBM.TO,GlobeNewswire - Hudbay Provides Exploration Update and Announces Initial Mineral Resource Estimate at Llaguen
fin_news_nlp/yahoo_cad_tickers_news,https://ca.finance.yahoo.com/news/isc-declares-quarterly-dividend-005100676.html,"REGINA, Saskatchewan, Nov. 02, 2022 (GLOBE NEWSWIRE) -- The Board of Directors (the “Board”) of Information Services Corporation (TSX:ISV) (“ISC” or the “Company”) today declared a quarterly dividend of $0.23 per Class A Limited Voting Share (""Class A Share""). The dividend will be paid on or before January 15, 2023 to shareholders of record as of December 31, 2022. The dividend has been designated as an eligible dividend pursuant to the Income Tax Act. An eligible dividend paid to a Canadian res",CAD,ISV.TO,GlobeNewswire - ISC Declares Quarterly Dividend
fin_news_nlp/yahoo_cad_tickers_news,https://ca.finance.yahoo.com/news/isc-reports-2022-third-quarter-005000466.html,"REGINA, Saskatchewan, Nov. 02, 2022 (GLOBE NEWSWIRE) -- Information Services Corporation (TSX:ISV) (“ISC” or the “Company”) today reported on the Company’s financial results for the third quarter ended September 30, 2022. 2022 Third Quarter Highlights Revenue was $48.8 million for the quarter, an increase of 18 per cent compared to the third quarter of 2021. This was due to continued transaction and customer growth in Services, specifically in the Corporate Solutions division, along with $1.6 mi",CAD,ISV.TO,GlobeNewswire - ISC Reports 2022 Third Quarter Financial Results
fin_news_nlp/yahoo_cad_tickers_news,https://ca.finance.yahoo.com/news/loop-energy-q3-results-executing-210000362.html,"VANCOUVER, British Columbia, November 02, 2022--Loop Energy announces its consolidated financial results for the third quarter of 2022.",CAD,LPEN.TO,Business Wire - Loop Energy Q3 Results: Executing to Plan with Record Revenues Combined with Unit Cost Reduction
fin_news_nlp/yahoo_cad_tickers_news,https://ca.finance.yahoo.com/news/top-tsx-energy-stocks-buy-203000552.html,"Energy stocks have been a great investment this year, but oil and gas is about to drop, whereas these options are clean energy growth stories. The post Top TSX Energy Stocks to Buy in November 2022 appeared first on The Motley Fool Canada.",CAD,NPI.TO,The Motley Fool - Top TSX Energy Stocks to Buy in November 2022
fin_news_nlp/yahoo_cad_tickers_news,https://ca.finance.yahoo.com/news/nutrien-ntr-q3-earnings-revenues-225510484.html,"Nutrien (NTR) delivered earnings and revenue surprises of -35.97% and 9.18%, respectively, for the quarter ended September 2022. Do the numbers hold clues to what lies ahead for the stock?",CAD,NTR.TO,Zacks - Nutrien (NTR) Q3 Earnings and Revenues Miss Estimates
fin_news_nlp/yahoo_cad_tickers_news,https://ca.finance.yahoo.com/news/parkland-announces-2022-third-quarter-221800024.html,"Parkland Corporation (""Parkland"", ""we"", the ""Company"", or ""our"") (TSX: PKI), today announced its financial and operating results for the three and nine months ended September 30, 2022.",CAD,PKI.TO,CNW Group - Parkland Announces 2022 Third Quarter Results
fin_news_nlp/yahoo_cad_tickers_news,https://ca.finance.yahoo.com/news/pason-reports-third-quarter-2022-203000806.html,"Pason Systems Inc. (""Pason"" or the ""Company"") (TSX: PSI) announced today its 2022 third quarter results and the declaration of an increased quarterly dividend. The following news release should be read in conjunction with the Company's Management Discussion and Analysis (""MD&A""), the unaudited Interim Condensed Consolidated Financial Statements and related notes for the three and nine months ended September 30, 2022, as well as the Annual Information Form for the year ended December 31, 2021. Al",CAD,PSI.TO,CNW Group - Pason Reports Third Quarter 2022 Results and Declares Increased Quarterly Dividend
fin_news_nlp/yahoo_cad_tickers_news,https://ca.finance.yahoo.com/news/savaria-surpasses-200m-quarterly-revenue-210500746.html,"LAVAL, Québec, Nov. 02, 2022 (GLOBE NEWSWIRE) -- Savaria Corporation (“Savaria”) (TSX: SIS), a global leader in the accessibility industry, is pleased to announce its results for the third quarter of fiscal 2022. Highlights – Q3 2022 compared to Q3 2021 Revenue was $201.4M, up $20.6M or 11.4%, due to organic growth of 15.7% coming from all segments partially offset by a negative foreign exchange impact of 4.3%. Gross profit was $64.0M, up $5.5M or 9.3%, representing 31.8% of revenue compared to",CAD,SIS.TO,GlobeNewswire - Savaria Surpasses $200M in Quarterly Revenue For the First Time
fin_news_nlp/yahoo_cad_tickers_news,https://ca.finance.yahoo.com/news/top-research-reports-abbott-laboratories-210209416.html,"Today's Research Daily features new research reports on 16 major stocks, including Abbott Laboratories (ABT), ServiceNow, Inc. (NOW) and Schlumberger Limited (SLB).",CAD,SHOP.TO,"Zacks - Top Research Reports for Abbott Laboratories, ServiceNow & Schlumberger"
fin_news_nlp/yahoo_cad_tickers_news,https://ca.finance.yahoo.com/news/shawcor-announces-conference-call-webcast-210100113.html,"TORONTO, Nov. 02, 2022 (GLOBE NEWSWIRE) -- Shawcor Ltd. (TSX: SCL) announced today that it expects to report its financial results for the period ended September 30th, 2022 on Monday, November 14th, 2022 before the market opens for trading on the TSX. A conference call/webcast to discuss these results will be held on Monday, November 14th, 2022 at 9:00am ET. Shawcor will use a presentation to accompany its conference call. The presentation can be found on the Company’s website in advance of the",CAD,SCL.TO,"GlobeNewswire - Shawcor Announces Conference Call/Webcast to Discuss Third Quarter 2022 Results Monday, November 14th, 2022 at 9:00am ET"
fin_news_nlp/yahoo_cad_tickers_news,https://ca.finance.yahoo.com/news/southgobi-announce-third-quarter-results-223500866.html,"SouthGobi Resources Ltd. (TSX:SGQ)(HK:1878) (""SouthGobi"" or the ""Company"") announces that the board of directors will approve the financial results of the Company and its subsidiaries for the third quarter of 2022 on Monday, November 14, 2022.",CAD,SGQ.TO,"ACCESSWIRE - SouthGobi to Announce Third Quarter Results of 2022 on November 14, 2022"
fin_news_nlp/yahoo_cad_tickers_news,https://ca.finance.yahoo.com/news/franklin-covey-fc-surpasses-q4-225510063.html,"Franklin Covey (FC) delivered earnings and revenue surprises of 44.44% and 6.71%, respectively, for the quarter ended August 2022. Do the numbers hold clues to what lies ahead for the stock?",CAD,STN.TO,Zacks - Franklin Covey (FC) Surpasses Q4 Earnings and Revenue Estimates
fin_news_nlp/yahoo_cad_tickers_news,https://ca.finance.yahoo.com/news/step-energy-services-ltd-reports-231500712.html,"CALGARY, Alberta, Nov. 02, 2022 (GLOBE NEWSWIRE) -- STEP Energy Services Ltd. (the “Company” or “STEP”) is pleased to announce its financial and operating results for the three and nine months ended September 30, 2022. The following press release should be read in conjunction with the management’s discussion and analysis (“MD&A”) and unaudited condensed consolidated interim financial statements and notes thereto as at September 30, 2022 (the “Financial Statements”). Readers should also refer to",CAD,STEP.TO,GlobeNewswire - STEP Energy Services Ltd. Reports Third Quarter 2022 Results
fin_news_nlp/yahoo_cad_tickers_news,https://ca.finance.yahoo.com/news/sun-life-reports-q3-net-220332693.html,"TORONTO — Sun Life Financial Inc. says its profit was down 54 per cent in the third quarter compared with a year earlier due to general market declines, and also recorded a $170 million charge related to its sale of Sun Life UK. The insurance giant says it had a net income of $466 million in the quarter ending Sept. 30, down from $1.02 billion in the same quarter last year. Adjusted income, or what Sun Life calls underlying net income, came in at $949 million, up five per cent from $902 million",CAD,SLF.TO,"The Canadian Press - Sun Life reports Q3 net income of $466 million, down 54 per cent from last year"
fin_news_nlp/yahoo_cad_tickers_news,https://ca.finance.yahoo.com/news/sun-life-increases-common-share-210200882.html,"The Board of Directors (the ""Board"") of Sun Life Financial Inc. (the ""Company"") (TSX: SLF) (NYSE: SLF) today announced that a dividend of $0.72 per share on the common shares of the Company has been declared, payable December 30, 2022 to shareholders of record at the close of business on November 23, 2022. This represents a 3 cent increase to the amount paid in the previous quarter.",CAD,SLF.TO,CNW Group - Sun Life increases Common Share dividend and declares dividends on Preferred Shares
fin_news_nlp/yahoo_cad_tickers_news,https://ca.finance.yahoo.com/news/suncor-reports-net-loss-third-005653259.html,"CALGARY — Suncor Inc. says it recorded a net loss of $609 million in the third quarter as it took a writedown of $3.4 billion against its share of the Fort Hills oilsands mine. The net loss, which works out to 45 cents per common share, is in contrast to an $877 million profit, or 59 cents per common share, in the prior year's quarter. Suncor announced last week it will buy out Teck Resources Ltd.'s 21.3 per cent stake in the Fort Hills oilsands project for approximately $1 billion. The agreed-u",CAD,SU.TO,The Canadian Press - Suncor reports net loss in third quarter as it takes writedown on Fort Hills
fin_news_nlp/yahoo_cad_tickers_news,https://ca.finance.yahoo.com/news/suncor-energy-reports-third-quarter-000600309.html,"Unless otherwise noted, all financial figures are unaudited, presented in Canadian dollars (Cdn$), and have been prepared in accordance with International Financial Reporting Standards (IFRS), specifically International Accounting Standard (IAS) 34 Interim Financial Reporting as issued by the International Accounting Standards Board. Production volumes are presented on a working-interest basis, before royalties, except for production values from the company's Libya operations, which are presente",CAD,SU.TO,Newsfile - Suncor Energy Reports Third Quarter 2022 Results
fin_news_nlp/yahoo_cad_tickers_news,https://ca.finance.yahoo.com/news/valens-secures-sales-licence-greater-210000014.html,"The Valens Company Inc. (TSX: VLNS) (NASDAQ: VLNS) (the ""Company"" or ""Valens"") (the ""Company,"" ""The Valens Company"" or ""Valens""), a leading manufacturer of cannabis products, announced it has received a sales licence amendment from Health Canada for its Pommies manufacturing facility located in the Greater Toronto Area (the ""GTA Facility"") to sell micro processed cannabis products directly to provincial distributors. Prior to this announcement, Valens leveraged its British Columbia sales licence",CAD,VLNS.TO,CNW Group - Valens Secures Sales Licence for Greater Toronto Area Beverage Facility
fin_news_nlp/yahoo_cad_tickers_news,https://ca.finance.yahoo.com/news/tourmaline-delivers-strong-cash-flow-210000700.html,"Tourmaline Oil Corp. (TSX: TOU) (""Tourmaline"" or the ""Company"") is pleased to release financial and operating results for the third quarter (""Q3"") of 2022, increase the quarterly base dividend and declare a special dividend.",CAD,TOU.TO,"CNW Group - TOURMALINE DELIVERS STRONG CASH FLOW AND FREE CASH FLOW IN Q3 2022, ANNOUNCES INCREASED BASE DIVIDEND AND DECLARES SPECIAL DIVIDEND"
fin_news_nlp/yahoo_cad_tickers_news,https://ca.finance.yahoo.com/news/vermilion-energy-vet-stock-moves-214509614.html,"Vermilion Energy (VET) closed the most recent trading day at $23.38, moving -1.89% from the previous trading session.",CAD,VET.TO,Zacks - Vermilion Energy (VET) Stock Moves -1.89%: What You Should Know
fin_news_nlp/yahoo_cad_tickers_news,https://ca.finance.yahoo.com/news/waste-connections-wcn-q3-earnings-215509049.html,"Waste Connections (WCN) delivered earnings and revenue surprises of 8.91% and 0.27%, respectively, for the quarter ended September 2022. Do the numbers hold clues to what lies ahead for the stock?",CAD,WCN.TO,Zacks - Waste Connections (WCN) Q3 Earnings and Revenues Top Estimates
fin_news_nlp/yahoo_cad_tickers_news,https://ca.finance.yahoo.com/news/blockchain-foundry-obtains-final-order-235800415.html,"TORONTO, Nov. 02, 2022 (GLOBE NEWSWIRE) -- Blockchain Foundry Inc. (“BCF” or the “Company”) (CSE: BCFN), a leading North American blockchain development firm, is pleased to announce that the Company has obtained a final order of the Supreme Court of British Columbia approving the previously announced plan of arrangement under the Business Corporations Act (British Columbia) (the “Arrangement”), pursuant to which WonderFi Technologies Inc. (TSX:WNDR) (“WonderFi”) will acquire all of the issued an",CAD,WNDR.TO,GlobeNewswire - Blockchain Foundry Obtains Final Order Approving Arrangement with WonderFi
fin_news_nlp/yahoo_cad_tickers_news,https://ca.finance.yahoo.com/news/a2z-smart-technologies-closes-previously-210500336.html,"A2Z Smart Technologies Corp. (""A2Z"" or the ""Company"") (TSXV:AZ)(NASDAQ:AZ), today announced that further to its press release of October 24, 2022 and November 1, 2022, that it has closed, in escrow, the issuance of 2,978,337 units (""Units"") at a price per Unit of US$1.35 (CAD$1.86),for gross proceeds of US$4,020,750. Each Unit consists of one common share and one half of one common share purchase warrant (each whole such warrant a ""Warrant"").",CAD,AZ.V,"ACCESSWIRE - A2Z Smart Technologies Closes Previously Announced Private Placement in the Amount of US$4,020,750"
fin_news_nlp/yahoo_cad_tickers_news,https://ca.finance.yahoo.com/news/american-lithium-announces-financial-operating-222200679.html,"VANCOUVER, British Columbia, Nov. 02, 2022 (GLOBE NEWSWIRE) -- American Lithium Corp. (“American Lithium” or the “Company”) (TSX-V:LI | OTCQB:LIACF | Frankfurt:5LA1) is pleased to report its operating and financial results for the three month period ending August 31, 2022. Unless otherwise stated, all amounts presented are in Canadian dollars. “We made good progress across all projects during the quarter,” stated Simon Clarke, CEO of American Lithium. “In Peru we were pleased to be able to comme",CAD,LI.V,"GlobeNewswire - American Lithium Announces Financial and Operating Results for the Period Ended August 31, 2022"
fin_news_nlp/yahoo_cad_tickers_news,https://ca.finance.yahoo.com/news/andean-precious-metals-changes-executive-002100751.html,"Alberto Morales to assume Chief Executive Officer positionJuan Carlos Sandoval named as Chief Financial OfficerToronto, Ontario--(Newsfile Corp. - November 2, 2022) - Andean Precious Metals Corp. (TSXV: APM) (OTCQX: ANPMF) (""Andean"" or the ""Company""), a silver producer with the only large-scale commercial oxide plant in Bolivia, announced it is moving its main corporate functions to Monterrey, Mexico from Toronto, Canada. Monterrey is the business capital of Mexico and home to many large multina",CAD,APM.V,"Newsfile - Andean Precious Metals Changes Executive Team and Consolidates Main Corporate Functions in Monterrey; Appoints First Lead Independent Director, Grant Angwin"
fin_news_nlp/yahoo_cad_tickers_news,https://ca.finance.yahoo.com/news/angel-wing-metals-announces-refiling-000400462.html,"Angel Wing Metals Inc. (TSXV: AWM) (""Angel Wing Metals"" or the ""Company"") announces the filing of its restated unaudited condensed interim financial statements for the periods ending March 31, 2022 and June 30, 2022 (the ""Restated Financial Statements""), to account for the change in accounting for the acquisition of Lago de Oro Resources S.A. de C.V. (""LOM"") and its El Grande Project (""El Grande"" or ""the Project"") announced on March 30, 2022. The Restated Financial Statements were prepared follo",CAD,AWM.V,CNW Group - Angel Wing Metals Announces Refiling of its Restated Q1 and Q2 2022 Financial Statements
fin_news_nlp/yahoo_cad_tickers_news,https://ca.finance.yahoo.com/news/receipt-statement-claim-234200277.html,"Buhler Industries Inc. (TSX: BUI) (""Buhler Industries"" or the Company"") announces today that its subsidiary, Buhler Versatile Inc. (""Buhler Versatile""), has received a Statement of Claim filed in the Manitoba Court of Kings's Bench from PFG Australia PTY Ltd. (""PFG""). In the Statement of Claim, PFG alleges that Buhler Versatile has failed to comply with certain contractual obligations to deliver certain manufactured equipment to PFG. PFG is claiming damages in the amount of $41 million in Austra",CAD,BUI.TO,CNW Group - RECEIPT OF STATEMENT OF CLAIM
fin_news_nlp/yahoo_cad_tickers_news,https://ca.finance.yahoo.com/news/valens-secures-sales-licence-greater-210000827.html,"The Valens Company Inc. (TSX: VLNS) (NASDAQ: VLNS) (the ""Company"" or ""Valens"") (the ""Company,"" ""The Valens Company"" or ""Valens""), a leading manufacturer of cannabis products, announced it has received a sales licence amendment from Health Canada for its Pommies manufacturing facility located in the Greater Toronto Area (the ""GTA Facility"") to sell micro processed cannabis products directly to provincial distributors. Prior to this announcement, Valens leveraged its British Columbia sales licence",CAD,VLNS.TO,CNW Group - Valens Secures Sales Licence for Greater Toronto Area Beverage Facility
fin_news_nlp/yahoo_cad_tickers_news,https://ca.finance.yahoo.com/news/horizonte-minerals-plc-announces-electro-070000850.html,"Horizonte Minerals Plc (AIM:HZM)(TSX:HZM), a nickel company developing two Tier 1 assets in Brazil, is pleased to announce that it has selected MIP Engenharia & Milplan Engenharia (""MIP/Milpan"") to provide the Electro-Mechanical installation services at Horizonte's 100%-owned Araguaia Nickel Project (""Araguaia"" or ""the Project"").",CAD,HZM.TO,ACCESSWIRE - Horizonte Minerals PLC Announces Electro-Mechanical Contract Awarded for Araguaia
fin_news_nlp/yahoo_cad_tickers_news,https://ca.finance.yahoo.com/news/global-water-resources-nasdaq-gwrs-101700827.html,"The board of Global Water Resources, Inc. ( NASDAQ:GWRS ) has announced that it will pay a dividend of $0.0246 per...",CAD,GWR.TO,Simply Wall St. - Global Water Resources (NASDAQ:GWRS) Has Announced A Dividend Of $0.0246
fin_news_nlp/yahoo_cad_tickers_news,https://ca.finance.yahoo.com/news/lithium-americas-announces-intention-separate-103000947.html,"VANCOUVER, British Columbia, Nov. 03, 2022 (GLOBE NEWSWIRE) -- Lithium Americas Corp. (TSX: LAC) (NYSE: LAC) (""Lithium Americas"" or the ""Company"") is pleased to announce that, after months of review by the Company, along with its advisors and the Board of Directors, it intends to advance a reorganization that will result in the separation of its North American and Argentine business units into two independent public companies (the “Separation”). The Separation will establish two separate compani",CAD,LAC.TO,GlobeNewswire - Lithium Americas Announces Intention to Separate into Two Leading Lithium Companies
fin_news_nlp/yahoo_cad_tickers_news,https://ca.finance.yahoo.com/news/nexgen-releases-2021-sustainability-report-103000305.html,"NexGen Energy Ltd. (""NexGen"" or the ""Company"") (TSX: NXE) (NYSE: NXE) (ASX: NXG) is pleased to announce the release of its 2021 Sustainability Report (""the Report""), available online on the Company's website www.nexgenenergy.ca in the ""Responsible Development"" section. The Report highlights specific programs, initiatives, and organizational frameworks that NexGen has created or expanded upon to deliver as much positivity as possible for as many people as possible.",CAD,NXE.TO,CNW Group - NexGen Releases 2021 Sustainability Report
fin_news_nlp/yahoo_cad_tickers_news,https://ca.finance.yahoo.com/news/waste-connections-announces-10-9-200500494.html,"Waste Connections, Inc. (TSX/NYSE: WCN) (""Waste Connections"" or the ""Company"") today announced that its Board of Directors has declared a regular quarterly cash dividend on the Company's common shares and approved a 10.9% increase in the dividend. The regular quarterly cash dividend, which increases to $0.255 U.S. per common share of the Company from $0.23 U.S. per common share of the Company, will be paid on December 1, 2022 to shareholders of record on the close of business on November 16, 202",CAD,WCN.TO,CNW Group - WASTE CONNECTIONS ANNOUNCES 10.9% INCREASE IN QUARTERLY DIVIDEND
fin_news_nlp/yahoo_cad_tickers_news,https://ca.finance.yahoo.com/news/aeterna-zentaris-reports-third-quarter-120500041.html,"– Company ended the quarter with $53.8 million in cash – Driving continued progress across diversified pre-clinical and clinical development pipeline TORONTO, ONTARIO, Nov. 03, 2022 (GLOBE NEWSWIRE) -- Aeterna Zentaris Inc. (Nasdaq: AEZS) (TSX: AEZS) (“Aeterna” or the “Company”), a specialty biopharmaceutical company developing and commercializing a diversified portfolio of pharmaceutical and diagnostic products, today reported its financial and operating results for the third quarter ended Sept",CAD,AEZS.TO,GlobeNewswire - Aeterna Zentaris Reports Third Quarter 2022 Financial Results
fin_news_nlp/yahoo_cad_tickers_news,https://ca.finance.yahoo.com/news/akumin-host-third-quarter-2022-110000093.html,"Akumin Inc. (NASDAQ: AKU) (TSX: AKU) (""Akumin"" or the ""Company"") will host a conference call at 8:30 a.m. Eastern Time, November 10, 2022, to discuss its third quarter 2022 financial results. The financial results are expected to be available on Wednesday, November 9, 2022.",CAD,AKU.TO,"CNW Group - Akumin to Host Third Quarter 2022 Financial Results Call on November 10, 2022"
fin_news_nlp/yahoo_cad_tickers_news,https://ca.finance.yahoo.com/news/bausch-health-announces-third-quarter-110000416.html,"Bausch Health Companies Inc. (NYSE:BHC)(TSX:BHC) (""Bausch Health"" or the ""Company"" or ""we"" or ""our"") today announced its third-quarter 2022 financial results.",CAD,BHC.TO,ACCESSWIRE - Bausch Health Announces Third-Quarter 2022 Results
fin_news_nlp/yahoo_cad_tickers_news,https://ca.finance.yahoo.com/news/bce-announces-renewal-normal-course-110500066.html,"BCE Inc. (BCE) today announced that the Toronto Stock Exchange (the ""TSX"") has accepted a notice filed by BCE of its intention to renew its normal course issuer bid (""NCIB"") to purchase up to 10% of the public float of each series of BCE's outstanding First Preferred Shares that are listed on the TSX (the ""Preferred Shares""). The period of the NCIB will extend from November 9, 2022 to November 8, 2023, or an earlier date should BCE complete its purchases under the NCIB. BCE will pay the prevaili",CAD,BCE.TO,CNW Group - BCE announces renewal of Normal Course Issuer Bid for Preferred Shares
