source,url,description,country,company,title
fin_news_nlp/yahoo_cad_tickers_news,https://ca.finance.yahoo.com/news/algoma-central-corporation-announces-special-120000277.html,"ST. CATHARINES, Ontario, December 14, 2022--Algoma Central Corporation (""Algoma"" or ""the Company"") (TSX: ALC), a leading provider of marine transportation services, today announced that the Company’s Board of Directors authorized payment of a Special Dividend to shareholders of $1.35 per common share.",CAD,ALC.TO,Business Wire - Algoma Central Corporation Announces Special Dividend of $1.35 Per Share
fin_news_nlp/yahoo_cad_tickers_news,https://ca.finance.yahoo.com/news/alithya-partners-zscaler-bolster-network-123000667.html,"Alithya Group inc. (TSX: ALYA) (NASDAQ: ALYA) (""Alithya"") is pleased to announce its partnership with Zscaler, leveraging the world's largest cloud-native cyber security platform to assist its clients in being more agile, efficient, resilient, and secure as they accelerate their digital transformation projects. This partnership enhances Alithya's integrated cyber security offer that covers the entire IT value chain.",CAD,ALYA.TO,CNW Group - Alithya partners with Zscaler to bolster its network protection offering
fin_news_nlp/yahoo_cad_tickers_news,https://ca.finance.yahoo.com/news/ascendant-resources-makes-us-2-110000972.html,"80% ownership to be achieved upon completion of Feasibility Study in Q1 2023 TORONTO, Dec. 14, 2022 (GLOBE NEWSWIRE) -- Ascendant Resources Inc. (TSX: ASND; OTCQB: ASDRF; FRA: 2D9) (""Ascendant"" or the ""Company”) is pleased to announce that it has satisfied all financial conditions required to increase its effective ownership interest from 50% to 80% in the Lagoa Salgada VMS project (the “Project”) in Portugal. Ascendant has made the final US$2.5 million payment to the optionor, Mineral & Financi",CAD,ASND.TO,"GlobeNewswire - Ascendant Resources Makes US$2.5 Million Final Payment Under Earn-In Agreement for Lagoa Salgada VMS Project, Portugal"
fin_news_nlp/yahoo_cad_tickers_news,https://ca.finance.yahoo.com/news/avicanna-sant-cannabis-initiate-real-123300057.html,"The real-world evidence study will be conducted in Montreal, Quebec, with Santé Cannabis and will evaluate the efficacy of the product on patients with musculoskeletal pain and inflammation Sante Cannabis Sante Cannabis / Avicanna TORONTO, Dec. 14, 2022 (GLOBE NEWSWIRE) -- Avicanna Inc. (“Avicanna” or the “Company”) (TSX: AVCN) (OTCQX: AVCNF) (FSE: 0NN), a commercial stage, international biopharmaceutical company focused on the commercialization of evidence-based, cannabinoid-based products, is",CAD,AVCN.TO,GlobeNewswire - Avicanna and Santé Cannabis Initiate Real-World Evidence Study on Musculoskeletal Pain and Inflammation with the RHO Phyto™ CBG Transdermal Gel Topical Product
fin_news_nlp/yahoo_cad_tickers_news,https://ca.finance.yahoo.com/news/bitfarms-receives-nasdaq-notification-regarding-120000862.html,"This news release constitutes a “designated news release” for purposes of the Company’s prospectus supplement dated August 16, 2021, to its short form base shelf prospectus dated August 12, 2021. TORONTO and BROSSARD, QUÉBEC, Dec. 14, 2022 (GLOBE NEWSWIRE) -- Bitfarms Ltd. (NASDAQ: BITF // TSX: BITF), a global Bitcoin self-mining company, today announced that on December 13, 2022 it received a written notification (the “Notification Letter”) from the Nasdaq Stock Market LLC (“Nasdaq”) indicating",CAD,BITF.TO,GlobeNewswire - Bitfarms Receives NASDAQ Notification Regarding Minimum Bid Price Deficiency
fin_news_nlp/yahoo_cad_tickers_news,https://ca.finance.yahoo.com/news/bumbling-burglars-family-chaos-extra-120000316.html,"(TSX: CGX) – As the cold weather rolls in across the country, Canadians are cozying up and getting into the festive spirit – including the time-honoured tradition of watching holiday movies. According to a new surveyi by Cineplex, Canada's leading entertainment and media company and experts in movie-going trends and habits, over two-thirds of Canadians (67 per cent) watch movies as part of their holiday traditions. The survey also found that 72 per cent of Canadians have enjoyed a movie at the t",CAD,CGX.TO,"CNW Group - Bumbling Burglars, Family Chaos and Extra-Tall Elves: Canadians' Must-Watch Holiday Movies are Home Alone, National Lampoon's Christmas Vacation and Elf"
fin_news_nlp/yahoo_cad_tickers_news,https://ca.finance.yahoo.com/news/bw-retail-scales-ecommerce-fulfillment-114500070.html,"ATLANTA, Dec. 14, 2022 (GLOBE NEWSWIRE) -- Descartes Systems Group (Nasdaq: DSGX) (TSX:DSG), the global leader in uniting logistics-intensive businesses in commerce, announced that Michigan-based BW Retail, a leading ecommerce marketing, fulfillment and data analytics service provider, replaced manual pick, pack and ship practices with Descartes’ integrated ecommerce warehouse management and shipping solution to efficiently scale fulfillment operations and improve customer satisfaction. “BW Reta",CAD,DSG.TO,GlobeNewswire - BW Retail Scales Ecommerce Fulfillment with Descartes’ Ecommerce Warehouse and Shipping Solution
fin_news_nlp/yahoo_cad_tickers_news,https://ca.finance.yahoo.com/news/dynacor-raises-monthly-dividend-20-123000620.html,"MONTREAL, December 14, 2022--Dynacor Group Inc. (TSX: DNG) (Dynacor or the Corporation) today announced its board of directors approved a 20% increase to the Corporation’s monthly dividend. The monthly dividend will increase to Canadian 1.00 cent from 0.83 of a cent and on an annual basis to 12 cents from 10 cents per common share starting in January 2023. This marks Dynacor’s 4th dividend increase since the Corporation paid its first dividend to shareholders in October 2018.",CAD,DNG.TO,Business Wire - Dynacor Raises Monthly Dividend By 20%
fin_news_nlp/yahoo_cad_tickers_news,https://ca.finance.yahoo.com/news/givex-exceeds-100-location-mark-110000687.html,"Givex Corp. (TSX: GIVX) (OTCQX: GIVXF) announced today that it has exceeded the 100-location mark with its Certified Partner Program reseller distribution channel in Canada and the United States, including multi-unit restaurants, sports stadiums and more. The reseller channel is just one prong of the Givex growth strategy; in just the last 12 months, the Toronto-based global fintech company went public in Canada, and added Counter Solutions Holdings Limited, Loyalty Lane, Inc. and Kalex Equipmen",CAD,GIVX.TO,"CNW Group - Givex Exceeds 100-Location Mark with Reseller Distribution Channel, Sets Sights on the United States"
fin_news_nlp/yahoo_cad_tickers_news,https://ca.finance.yahoo.com/news/gogold-announces-strong-drilling-results-113000604.html,"GoGold Resources Inc. (TSX: GGD) (OTCQX: GLGDF) (""GoGold"", ""the Company"") is pleased to release the results of 9 drill holes from the El Favor East deposit within Los Ricos North property. Hole LRGF-22-140 intersected 0.7m of 2,529 g/t silver equivalent (""AgEq"") contained within 13.9m of 294 g/t AgEq, and hole LRGF-22-137 intersected 61.5m of 165 g/t AgEq containing 24.3m of 350 g/t AgEq.",CAD,GGD.TO,CNW Group - GoGold Announces Strong Drilling Results at El Favor
fin_news_nlp/yahoo_cad_tickers_news,https://ca.finance.yahoo.com/news/guardian-capital-announces-december-2022-120000184.html,"TORONTO, Dec. 14, 2022 (GLOBE NEWSWIRE) -- Guardian Capital LP announces the following regular cash distributions for the period ending December 31, 2022, in respect of the ETF series of the Guardian Capital funds listed below (the “Guardian Capital ETFs”). In each case, the distribution will be paid on December 30, 2022 to unitholders of record on December 22, 2022. The ex-dividend date in each case is December 21, 2022. Guardian Capital ETFsSeries of ETF UnitsDistributionFrequencyTSX TradingSy",CAD,GDEP.TO,GlobeNewswire - Guardian Capital Announces December 2022 Distributions for Guardian Capital ETFs
fin_news_nlp/yahoo_cad_tickers_news,https://ca.finance.yahoo.com/news/imperial-announces-completion-1-5-125500071.html,"CALGARY, Alberta, December 14, 2022--Imperial Oil Limited (TSE: IMO, NYSE American: IMO) announced today that it has taken up and paid for 20,689,655 common shares (""Shares"") at a price of $72.50 per Share (the ""Purchase Price"") under Imperial’s offer (the ""Offer"") to purchase for cancellation up to $1.5 billion of its Shares. All amounts are in Canadian dollars.",CAD,IMO.TO,Business Wire - Imperial announces completion of its $1.5 billion substantial issuer bid
fin_news_nlp/yahoo_cad_tickers_news,https://ca.finance.yahoo.com/news/maple-leaf-foods-announces-changes-123000788.html,"Maple Leaf Foods Inc. (TSX: MFI), an iconic Canadian branded food company, announced today changes to its Senior Leadership Team as it embarks on its next chapter of value creation. The changes come as part of the leadership transition plan announced earlier this year as Curtis Frank, currently President and Chief Operating Officer, prepares to step into the role of President and Chief Executive Officer by the spring of 2023, and Michael McCain begins to step back from his CEO role to focus on h",CAD,MFI.TO,CNW Group - Maple Leaf Foods Announces Changes to Senior Leadership and New Growth-Oriented Center of Excellence called Accelerate
fin_news_nlp/yahoo_cad_tickers_news,https://ca.finance.yahoo.com/news/mawson-subsidiary-sxg-reports-continued-111500490.html,"Mawson Gold Limited(""Mawson"" or the ""Company"") (TSX:MAW)(Frankfurt:MXR)(OTC PINK:MWSNF) announces further high-grade gold mineralization from new assays reported from the lower third of drill hole SDDSC050 from 651 m to 923.7 m at the 100%-owned Sunday Creek Project in Victoria (Figure 2).",CAD,MAW.TO,"ACCESSWIRE - Mawson’s Subsidiary SXG Reports Continued High Grade Zones to 840 meters at Sunday Creek, Victoria, Australia"
fin_news_nlp/yahoo_cad_tickers_news,https://ca.finance.yahoo.com/news/eps-growth-more-sandstorm-gold-110555317.html,"Investors are often guided by the idea of discovering 'the next big thing', even if that means buying 'story stocks...",CAD,SSL.TO,"Simply Wall St. - With EPS Growth And More, Sandstorm Gold (TSE:SSL) Makes An Interesting Case"
fin_news_nlp/yahoo_cad_tickers_news,https://ca.finance.yahoo.com/m/188c977e-846c-3a6e-921f-0a5783e2beb2/invest-like-buffett%3A-3-ways.html,"Warren Buffett has done it again.  With just three weeks left in 2022, Buffett's Berkshire Hathaway (NYSE: BRK.A) (NYSE: BRK.B) is set to beat the S&P 500 by a wide margin.  As you can see from the chart below, Buffett's conglomerate is in positive territory for the year, while the S&P is down nearly 20%.",CAD,SHOP.TO,Motley Fool - Invest Like Buffett: 3 Ways to Do It in 2023
fin_news_nlp/yahoo_cad_tickers_news,https://ca.finance.yahoo.com/news/stantec-joins-cloud-partner-program-114500743.html,"Microsoft customers can access planning and risk-mitigation products to support their communitiesEDMONTON, Alberta, Dec. 14, 2022 (GLOBE NEWSWIRE) -- TSX, NYSE:STN Stantec, a global leader in sustainable design and engineering, announced the availability of four critical digital products in the Microsoft Azure Marketplace, an online store providing applications and services. Customers of these digital solutions can now take advantage of the productive and trusted Azure cloud platform with stream",CAD,STN.TO,GlobeNewswire - Stantec joins Cloud Partner Program with four products available in the Microsoft Azure Marketplace
fin_news_nlp/yahoo_cad_tickers_news,https://ca.finance.yahoo.com/news/introducing-space-telus-international-114500285.html,"VANCOUVER, British Columbia, December 14, 2022--TELUS International, a digital customer experience (CX) innovator that designs, builds and delivers next-generation solutions for global and disruptive brands, including AI and content moderation, today announced the launch of SPACE by TELUS International (SPACE) – a new virtual recruitment platform that provides job seekers with a fully immersive experience in a fun and interactive digital environment.",CAD,TIXT.TO,Business Wire - Introducing SPACE by TELUS International
fin_news_nlp/yahoo_cad_tickers_news,https://ca.finance.yahoo.com/news/ur-energy-announces-additional-multi-114500873.html,"Ur-Energy Inc. (NYSE American:URG)(TSX:URE) (the ""Company"" or ""Ur-Energy"") is pleased to announce that it has signed a second multi-year uranium sales agreement with a leading nuclear fuel company.",CAD,URE.TO,ACCESSWIRE - Ur-Energy Announces Additional Multi-Year Uranium Sales Agreement
fin_news_nlp/yahoo_cad_tickers_news,https://ca.finance.yahoo.com/news/willow-provides-corporate-updates-business-120000413.html,"Willow Biosciences Inc. (""Willow"" or the ""Company"") (TSX: WLLW) (OTCQB: CANSF), a leading biotechnology company focused on revolutionizing industrial manufacturing of pure, consistent and sustainable functional ingredients announced today a recap of key milestones the Company has successfully achieved in 2022, as well as its business outlook and key targeted milestones anticipated for 2023 to expand growth.",CAD,WLLW.TO,"CNW Group - WILLOW PROVIDES CORPORATE UPDATES, BUSINESS OUTLOOK AND KEY TARGETED MILESTONES ANTICIPATED FOR 2023 TO EXPAND GROWTH"
fin_news_nlp/yahoo_cad_tickers_news,https://ca.finance.yahoo.com/news/01-communique-announces-closing-non-130000233.html,"01 Communique Laboratory Inc. (TSX-V:ONE)(OTCQB:OONEF) (the ""Company"") announced today that it has closed a non-brokered private placement (the ""Private Placement"") of 562,500 common shares at a price of $0.12 per Unit for gross proceeds of $67,500.",CAD,ONE.V,ACCESSWIRE - 01 Communique Announces Closing of Non-Brokered Private Placement
fin_news_nlp/yahoo_cad_tickers_news,https://ca.finance.yahoo.com/news/amphy-e-learning-website-relaunches-130000324.html,"Adcore Inc. (the ""Company"" or ""Adcore"") (TSX:ADCO)(OTCQX:ADCOF)(FSE:ADQ)(TSX:ADCO-WT), a leading e-commerce advertising management and automation platform to leverage digital marketing in an effortless and accessible way (""Effortless Marketing""), today announced the relaunch of its Amphy e-learning website with redesigned user experience and enhanced features.",CAD,ADCO.TO,ACCESSWIRE - Amphy E-Learning Website Relaunches with Redesigned User Experience and Enhanced Features
fin_news_nlp/yahoo_cad_tickers_news,https://ca.finance.yahoo.com/m/6de57512-4afa-37c5-be21-86a38f3a5123/canada-goose-stock%3A-time-to.html,"Shares of Canada Goose (NYSE: GOOS) are down 55% from their 52-week high due to a combination of rising inflation worldwide (which reduces consumers' spending power) and the stop-and-go economic reopening approach taken by China -- a key market for the luxury winter wear maker.  With winter in the air, it's time to take a fresh look at Canada Goose.  Unlike many stocks that investors have sold off this year, Canada Goose is profitable, and its shares look too cheap to ignore at just 10 times forward earnings.",CAD,GOOS.TO,Motley Fool - Canada Goose Stock: Time to Buy on the Dip?
fin_news_nlp/yahoo_cad_tickers_news,https://ca.finance.yahoo.com/news/5-valuable-price-book-stocks-112411457.html,"The P/B ratio helps to identify low-priced stocks that have high growth prospects. Celestica (CLS), Signet Jewelers (SIG), Unum Group (UNM), Aercap (AER) and Sterling Infrastructure (STRL) are some such stocks.",CAD,CLS.TO,Zacks - 5 Valuable Price-to-Book Stocks to Buy in December
fin_news_nlp/yahoo_cad_tickers_news,https://ca.finance.yahoo.com/news/additional-drill-results-optioned-globex-140000563.html,"Figure 1 Geologic plan view map depicting Eagle drill plan, Eagle-Telbel deposits Figure 2 Cross section highlighting new assay results ROUYN-NORANDA, Quebec, Dec. 14, 2022 (GLOBE NEWSWIRE) -- GLOBEX MINING ENTERPRISES INC. (GMX – Toronto Stock Exchange, G1MN – Frankfurt, Stuttgart, Berlin, Munich, Tradegate, Lang & Schwarz, LS Exchange, TTMzero, Düsseldorf and Quotrix Düsseldorf Stock Exchanges and GLBXF – OTCQX International in the US) is pleased to provide a short update on drilling by Maple",CAD,GMX.TO,GlobeNewswire - Additional Drill Results on Optioned Globex  Eagle Gold Mine Property
fin_news_nlp/yahoo_cad_tickers_news,https://ca.finance.yahoo.com/news/norzinc-announces-closing-plan-arrangement-202100082.html,"NorZinc Ltd. (TSX: NZC) (OTCQB: NORZF) (the ""Company"" or ""NorZinc"") is pleased to announce that NorZinc and RCF VI CAD LLC (""RCF"") have completed the previously announced acquisition by RCF of NorZinc by way of plan of arrangement under Division 5 of Part 9 of the Business Corporations Act (British Columbia) (the ""Arrangement"") effective at 12:01 a.m. (Vancouver time) on December 13, 2022.",CAD,NZC.TO,CNW Group - NorZinc Announces Closing of Plan of Arrangement
fin_news_nlp/yahoo_cad_tickers_news,https://ca.finance.yahoo.com/news/hsbc-cuts-canadian-unit-out-of-climate-pledge-ahead-of-rbc-deal-141135755.html,"The British lender says its decision does not apply to HSBC Canada and its subsidiaries, the only unit of the bank to be exempted.",CAD,RY.TO,Yahoo Finance Canada - HSBC cuts Canadian unit out of climate pledge ahead of RBC deal
fin_news_nlp/yahoo_cad_tickers_news,https://ca.finance.yahoo.com/news/vecima-networks-announces-closing-common-142600585.html,"NOT FOR DISSEMINATION IN THE UNITED STATESOR THROUGH U.S. NEWSWIRE SERVICES VICTORIA, British Columbia, Dec. 14, 2022 (GLOBE NEWSWIRE) -- Vecima Networks Inc. (“Vecima” or the “Company”) (TSX:VCM) is pleased to announce that it has closed the Company’s offering for sale of 563,380 common shares in the capital of the Company (the “Common Shares”) as announced in a press releasedated December 7, 2022 (the “LIFE Offering”), and concurrently, has closed the Company’s brokered private placement of 39",CAD,VCM.TO,GlobeNewswire - Vecima Networks Announces Closing of Common Share Financings
fin_news_nlp/yahoo_cad_tickers_news,https://ca.finance.yahoo.com/news/abcourt-recovered-1-662-ounces-133000442.html,"ROUYN-NORANDA, Quebec, Dec. 14, 2022 (GLOBE NEWSWIRE) -- Abcourt Mines Inc. (“Abcourt” or the “Corporation”) (TSX Venture: ABI) is pleased to announce that cleaning its Sleeping Giant Mill continues with the recovery of 1,662 ounces of gold since October 1, 2022. Indeed, Abcourt mandated a firm specializing in gold mill cleanup in August 2022. This firm started cleaning the mill in September and continues the gold recovery process. Abcourt plans to continue cleaning for another several weeks unt",CAD,ABI.V," - Abcourt recovered 1,662 ounces of gold since October 1, 2022 during the Sleeping Giant Mill Clean Up"
fin_news_nlp/yahoo_cad_tickers_news,https://ca.finance.yahoo.com/news/alphamin-announces-changes-board-operating-140000493.html,"GRAND BAIE, MAURITIUS, Dec. 14, 2022 (GLOBE NEWSWIRE) -- Alphamin Resources Corp. (AFM:TSXV, APH:JSE AltX)( “Alphamin” or the “Company”) announced today changes to its board of directors and to the board of the Company’s major operating subsidiary, Alphamin Bisie Mining (ABM). Mr. Jan Trouw (69), the on-mine Managing Director of the Company’s 84% subsidiary, ABM, has elected to retire from full time employment effective 31 December 2022. Mr Trouw will continue with ABM in a part-time consulting",CAD,AFM.V,GlobeNewswire - ALPHAMIN ANNOUNCES CHANGES TO ITS BOARD AND AT ITS OPERATING SUBSIDIARY
fin_news_nlp/yahoo_cad_tickers_news,https://ca.finance.yahoo.com/news/altiplano-reports-establishing-344-m-140000157.html,"Edmonton, Alberta--(Newsfile Corp. - December 14, 2022) - Altiplano Metals Inc. (TSXV: APN) (WKN: A2JNFG) (""Altiplano"" or the ""Company"") is pleased to report the intersection of the 344 m mining level as part of the ongoing underground development of the Hugo Decline at the Farellon copper gold mine located near La Serena, Chile. Cross cuts on the 344 m mining level have intersected the Farellon Iron Oxide Copper Gold vein structure with production headings ...",CAD,APN.V,Newsfile - Altiplano Reports on Establishing New 344 m Mining Level at Farellon
fin_news_nlp/yahoo_cad_tickers_news,https://ca.finance.yahoo.com/news/adf-hits-52-week-high-161100913.html,ADF Group Inc. (T.DRX) hit a new 52-week high of $2.28 Wednesday. ADF announced Wednesday the signing ...,CAD,DRX.TO, - ADF Hits 52-Week High on Contract
fin_news_nlp/yahoo_cad_tickers_news,https://ca.finance.yahoo.com/news/scotiabank-among-top-global-financial-154500071.html,"Scotiabank is pleased to announce it has been named to the Dow Jones™ Sustainability North America Index (DJSI) for the fifth consecutive year. The DJSI is considered the industry standard for measuring corporate environmental, social and governance (ESG) practices.",CAD,BNS.TO,CNW Group - Scotiabank among top global financial institutions named to the Dow Jones Sustainability North America Index
fin_news_nlp/yahoo_cad_tickers_news,https://ca.finance.yahoo.com/news/missed-canadian-energy-stocks-best-143000745.html,"BCE (TSX:BCE) stock won't make dividend investors rich in 2023, but it can help batten down the hatches ahead of a recession. The post Missed Out on Canadian Energy Stocks? My Best Dividend Stock to Buy and Hold appeared first on The Motley Fool Canada.",CAD,BCE.TO,The Motley Fool - Missed Out on Canadian Energy Stocks? My Best Dividend Stock to Buy and Hold
fin_news_nlp/yahoo_cad_tickers_news,https://ca.finance.yahoo.com/news/major-drilling-group-international-second-143706053.html,Major Drilling Group International ( TSE:MDI ) Second Quarter 2023 Results Key Financial Results Revenue: CA$201.7m (up...,CAD,MDI.TO,Simply Wall St. - Major Drilling Group International Second Quarter 2023 Earnings: Beats Expectations
fin_news_nlp/yahoo_cad_tickers_news,https://ca.finance.yahoo.com/news/declining-stock-solid-fundamentals-market-154610064.html,"It is hard to get excited after looking at MEG Energy's (TSE:MEG) recent performance, when its stock has declined 12...",CAD,MEG.TO,Simply Wall St. - Declining Stock and Solid Fundamentals: Is The Market Wrong About MEG Energy Corp. (TSE:MEG)?
fin_news_nlp/yahoo_cad_tickers_news,https://ca.finance.yahoo.com/news/3-top-value-stocks-screaming-140000657.html,Are you looking for cheap stocks that could make a fortune? Here are three Canadian value stocks that could have years of upside ahead. The post 3 Top Value Stocks That Are Screaming Buys Right Now appeared first on The Motley Fool Canada.,CAD,NPI.TO,The Motley Fool - 3 Top Value Stocks That Are Screaming Buys Right Now
fin_news_nlp/yahoo_cad_tickers_news,https://ca.finance.yahoo.com/news/buy-5-tech-stocks-lost-143402794.html,"Here's a sneak peek into five tech companies, Shopify (SHOP), Datadog (DDOG), Zscaler (ZS), Cloudflare (NET) and Twilio (TWLO), which hold strong fundamentals to grow in the near term.",CAD,SHOP.TO,Zacks - Buy These 5 Tech Stocks That Have Lost Half Their Value
fin_news_nlp/yahoo_cad_tickers_news,https://ca.finance.yahoo.com/news/52-ownership-sun-life-financial-155332030.html,Every investor in Sun Life Financial Inc. ( TSE:SLF ) should be aware of the most powerful shareholder groups. And the...,CAD,SLF.TO,"Simply Wall St. - With 52% ownership, Sun Life Financial Inc. (TSE:SLF) boasts of strong institutional backing"
fin_news_nlp/yahoo_cad_tickers_news,https://ca.finance.yahoo.com/news/3-top-mining-stocks-canada-153000359.html,Three mining stocks are top picks this December for growth investors searching for potential winners and multi-baggers in 2023. The post 3 Top Mining Stocks in Canada to Buy in December 2022 appeared first on The Motley Fool Canada.,CAD,ORA.TO,The Motley Fool - 3 Top Mining Stocks in Canada to Buy in December 2022
fin_news_nlp/yahoo_cad_tickers_news,https://ca.finance.yahoo.com/news/bmos-plans-fund-bank-west-162431635.html,Leaves the Big Six bank with little choice but to raise more capital,CAD,BMO.TO,Financial Post - BMO's plans to fund Bank of the West deal shaken by surprise OSFI capital-buffer changes
fin_news_nlp/yahoo_cad_tickers_news,https://ca.finance.yahoo.com/news/palo-alto-panw-unveils-cortex-165004507.html,Palo Alto Networks (PANW) brings Cortex Xpanse Active Attack Surface Management platform to help organizations detect and fix unknown risks in all connected systems and exposed services.,CAD,CLS.TO,Zacks - Palo Alto (PANW) Unveils Cortex Xpanse Active ASM Solution
fin_news_nlp/yahoo_cad_tickers_news,https://ca.finance.yahoo.com/news/td-synnex-snx-brand-biokey-164004770.html,"TD SYNNEX (SNX) brand, TD SYNNEX Public Sector, partners with BIOkey International to introduce BIOkey PortalGuard platform, featuring IBB to government level organizations and agencies in the U.S.",CAD,CLS.TO,Zacks - TD SYNNEX (SNX) New Brand and BIOkey International Team Up
fin_news_nlp/yahoo_cad_tickers_news,https://ca.finance.yahoo.com/news/3-tsx-dividend-stocks-passive-150000468.html,Are you looking for stocks that can provide passive income for decades? Here are three top picks! The post 3 TSX Dividend Stocks That Can Provide Passive Income for Decades appeared first on The Motley Fool Canada.,CAD,FTS.TO,The Motley Fool - 3 TSX Dividend Stocks That Can Provide Passive Income for Decades
fin_news_nlp/yahoo_cad_tickers_news,https://ca.finance.yahoo.com/news/au-vs-fnv-stock-value-164004169.html,AU vs. FNV: Which Stock Is the Better Value Option?,CAD,FNV.TO,Zacks - AU vs. FNV: Which Stock Should Value Investors Buy Now?
fin_news_nlp/yahoo_cad_tickers_news,https://ca.finance.yahoo.com/news/maxar-maxr-intelsat-continue-develop-154103994.html,Maxar's (MAXR) Galaxy 35 and Galaxy 36 satellites for Intelsat are performing per expectations after launch.,CAD,MAXR.TO,Zacks - Maxar (MAXR) & Intelsat Continue to Develop Galaxy Satellites
