source,url,description,country,company,title
fin_news_nlp/yahoo_cad_tickers_news,https://ca.finance.yahoo.com/news/3-undervalued-dividend-stocks-buy-124500150.html,Canadian investors battling volatility should look to undervalued dividend stocks like BCE Inc. (TSX:BCE)(NYSE:BCE) and others today. The post 3 Undervalued Dividend Stocks to Buy in This Volatile Market appeared first on The Motley Fool Canada.,CAD,BOS.TO,The Motley Fool - 3 Undervalued Dividend Stocks to Buy in This Volatile Market
fin_news_nlp/yahoo_cad_tickers_news,https://ca.finance.yahoo.com/news/heres-why-cenovus-cve-attractive-151903345.html,The positive trajectory in oil prices is a boon for Cenovus' (CVE) upstream operations.,CAD,CVE.TO,Zacks - Here's Why Cenovus (CVE) is an Attractive Investment Bet
fin_news_nlp/yahoo_cad_tickers_news,https://ca.finance.yahoo.com/news/2-value-stocks-buy-now-140000738.html,Suncor Energy stock and Cineplex stock are two of the most undervalued and underappreciated names on the TSX today. The post 2 Value Stocks to Buy Now appeared first on The Motley Fool Canada.,CAD,CGX.TO,The Motley Fool - 2 Value Stocks to Buy Now
fin_news_nlp/yahoo_cad_tickers_news,https://ca.finance.yahoo.com/news/ecn-capital-recognized-toronto-stock-162300167.html,"ECN among the 30 Top Performing Stocks on the TSX over the last three yearsTORONTO, Sept. 15, 2022 (GLOBE NEWSWIRE) -- ECN Capital Corp. (TSX: ECN) (“ECN Capital” or the “Company”) today announced that the Toronto Stock Exchange (the “TSX”) for the second year in a row has recognized the Company as part of its 2022 TSX30 Program. The TSX30 Program showcases the 30 top performing stocks on the TSX over the last three years based on dividend adjusted total share price appreciation. According to th",CAD,ECN.TO,GlobeNewswire - ECN Capital Recognized by the Toronto Stock Exchange’s TSX30 Program
fin_news_nlp/yahoo_cad_tickers_news,https://ca.finance.yahoo.com/news/gamehost-announces-regular-monthly-dividend-151500317.html,"Gamehost Inc. (‘Gamehost', the ‘Company') (TSX:GH)",CAD,GH.TO,ACCESSWIRE - Gamehost Announces Regular Monthly Dividend for September
fin_news_nlp/yahoo_cad_tickers_news,https://ca.finance.yahoo.com/news/mediavalet-accelerates-customer-value-professional-160000020.html,"Vancouver, British Columbia--(Newsfile Corp. - September 15, 2022) - MediaValet Inc. (TSX: MVP) (the Company), a leading provider of enterprise digital asset management, video content management and creative operations software, is pleased to announce the formal launch of their Professional Services program providing advanced guidance in the areas of taxonomy, keywording, workflow, governance, accessibility and many more; helping MediaValet's customers expand their DAM strategy across their orga",CAD,MVP.TO,"Newsfile - MediaValet Accelerates Customer Value with New Professional Services Program, Advanced Reporting Module and Enhanced User Interface"
fin_news_nlp/yahoo_cad_tickers_news,https://ca.finance.yahoo.com/news/amazon-hands-shipping-software-merchants-165930061.html,"The company is ending monthly fees of Veeqo, a shipping software firm it recently bought, for sellers including when they fulfill orders via rival platforms like Shopify Inc, eBay Inc or Etsy Inc.  D.A. Davidson analyst Tom Forte said of Veeqo, ""The acquisition should improve Amazon's ability to compete against Shopify,"" which helps merchants set up online stores and sell elsewhere.",CAD,SHOP.TO,"Reuters - Amazon hands out shipping software to merchants, including on rival sites"
fin_news_nlp/yahoo_cad_tickers_news,https://ca.finance.yahoo.com/news/24h-tremblant-announces-major-partnership-163700604.html,"The 24h Tremblant announced today that it has signed a three-year agreement with Sun Life, making the insurance giant the event's exclusive presenting sponsor.",CAD,SLF.TO,CNW Group - 24h Tremblant Announces Major Partnership with Sun Life
fin_news_nlp/yahoo_cad_tickers_news,https://ca.finance.yahoo.com/news/retire-early-turn-50-000-133000162.html,"Turning a $50,000 TFSA into $500,000 in the hope of retiring early is doable but a very arduous task. The post Retire Early: How to Turn Your $50,000 TFSA Into $500,000 appeared first on The Motley Fool Canada.",CAD,TF.TO,"The Motley Fool - Retire Early: How to Turn Your $50,000 TFSA Into $500,000"
fin_news_nlp/yahoo_cad_tickers_news,https://ca.finance.yahoo.com/news/toronto-stock-exchange-announces-2022-110000625.html,"Toronto Stock Exchange (TSX) today announced the 2022 TSX30®; an annual ranking of the 30 top-performing stocks over a three-year period, based on dividend-adjusted share price performance. The flagship TSX30 program, established in 2019, recognizes the successes of our listed companies, highlights the overall strength of Canada's diverse and ever-evolving public markets, and the efficacy of this powerful ecosystem in driving growth for issuers, investors and the overall economy.",CAD,X.TO,"CNW Group - Toronto Stock Exchange Announces the 2022 TSX30®, Celebrating the Exchange's 3-Year Performance Leaders"
fin_news_nlp/yahoo_cad_tickers_news,https://ca.finance.yahoo.com/news/toronto-dominion-bank-tsx-td-132000315.html,The Toronto-Dominion Bank has a 4% yield and an excellent dividend growth track record. Is it worth a buy in the current market environment? The post Toronto-Dominion Bank (TSX:TD) – Should You Buy the 4% Yield? appeared first on The Motley Fool Canada.,CAD,TD.TO,The Motley Fool - Toronto-Dominion Bank (TSX:TD) – Should You Buy the 4% Yield?
fin_news_nlp/yahoo_cad_tickers_news,https://ca.finance.yahoo.com/news/twc-enterprises-limited-announces-renewal-161500194.html,"KING CITY, Ontario, Sept. 15, 2022 (GLOBE NEWSWIRE) -- TWC Enterprises Limited (“TWC”) today announced that the Toronto Stock Exchange (the “TSX”) has accepted a notice filed by TWC of its intention to make a normal course issuer bid through the facilities of the TSX or alternative Canadian trading systems. The notice provides that TWC may, during the twelve-month period commencing September 20, 2022 and ending September 19, 2023 purchase up to 1,224,786 common shares (“Common Shares”) in total,",CAD,TWC.TO, - TWC Enterprises Limited Announces Renewal of Normal Course Issuer Bid
fin_news_nlp/yahoo_cad_tickers_news,https://ca.finance.yahoo.com/news/2-top-canadian-stocks-hold-131500542.html,Don't worry about this bear market. Just buy these two great Canadian stocks and hold them for decades to come. The post 2 Top Canadian Stocks to Hold for the Next 2 Decades appeared first on The Motley Fool Canada.,CAD,WSP.TO,The Motley Fool - 2 Top Canadian Stocks to Hold for the Next 2 Decades
fin_news_nlp/yahoo_cad_tickers_news,https://ca.finance.yahoo.com/news/hemostemix-announces-appointment-dr-johannes-151400840.html,"Calgary, Alberta--(Newsfile Corp. - September 15, 2022) - Hemostemix Inc. (TSXV: HEM) (OTCQB: HMTXF) (""Hemostemix"" or the ""Company"") is pleased to announce the appointment of Dr. Johannes Grillari to its Scientific Advisory Board.Since 2019, Dr. Johannes Grillari is the director of the Ludwig Boltzmann Institute for Traumatology (LBI Trauma) - the Research Center in cooperation with AUVA, Vienna, Austria which is the central research unit of seven trauma centers and four rehabilitation centers w",CAD,HEM.V,Newsfile - Hemostemix Announces the Appointment of Dr. Johannes Grillari to its Scientific Advisory Board
fin_news_nlp/yahoo_cad_tickers_news,https://ca.finance.yahoo.com/news/minerals-dispose-minerals-usa-bv-170800075.html,"Vancouver, British Columbia--(Newsfile Corp. - September 15, 2022) - I-Minerals Inc. (TSXV: IMA) (OTC Pink: IMAHF) (""the Company"") is pleased to announce that it has entered into a Stock Purchase Agreement dated September 14, 2022 with BV Lending, LLC, an Idaho limited liability company (""BV Lending"") and the Company's subsidiary, i-minerals USA, Inc. (""i-minerals USA""), an Idaho company that owns the leases that comprise the Helmer-Bovill Property, (the ""Stock Purchase Agreement""), pursuant to",CAD,IMA.V, - I-Minerals to Dispose i-minerals USA to BV Lending
fin_news_nlp/yahoo_cad_tickers_news,https://ca.finance.yahoo.com/news/street-tv-announces-385th-episode-171500105.html,"New to The Street TV Announces its 385th Episode with Four Featured Guest Interviews, Airing on Bloomberg TV as a Sponsored Program, Tonight, September 15, 2022, at 9:30 PM PT New to The Street’s show will feature the following four (4) corporate interviews: 1). Cryptocurrency- Fantom Foundation (CRYPTO: FTM) ($FTM) 2). Mikra Cellular Sciences (a division of Lifeist Wellness, Inc.) (TSXV: LFST) (FRANKFURT: M5B) (OTCMKTS: NXTTF) 3). Cryptocurrency – Pawtocol (CRYPTO: UPI) ($UPI) 4). Sekur Private",CAD,LFST.V,"GlobeNewswire - New to The Street TV Announces its 385th Episode with Four Featured Guest Interviews, Airing on Bloomberg TV as a Sponsored Program, Tonight, September 15, 2022, at 9:30 PM PT"
fin_news_nlp/yahoo_cad_tickers_news,https://ca.finance.yahoo.com/news/patriot-battery-metals-announces-20m-154400998.html,"NOT FOR DISTRIBUTION TO U.S. NEWS WIRE SERVICES OR FOR DISSEMINATION IN THE U.S VANCOUVER, British Columbia, Sept. 15, 2022 (GLOBE NEWSWIRE) -- Highlights C$20 million raised to continue drilling at the Corvette Property, James Bay Region, QuebecFinancing conducted at a price of C$13.27 representing a 109% premium to PMET’s last traded share price as of Wednesday, 14 September (C$6.35)The Company will utilize these funds for a winter drill program to commence in late January 2023 Patriot Battery",CAD,PMET.V,GlobeNewswire - Patriot Battery Metals Announces $20M Flow-Through Financing
fin_news_nlp/yahoo_cad_tickers_news,https://ca.finance.yahoo.com/news/portofino-reports-airborne-survey-results-153000171.html,"Vancouver, British Columbia--(Newsfile Corp. - September 15, 2022) - PORTOFINO RESOURCES INC. (TSXV: POR) (OTCQB: PFFOF) (FSE: POTA) (""Portofino"" or the ""Company"") is pleased to announce that it has received results from a property wide high-resolution helicopter-borne magnetometer (""mag"") geophysical survey completed by Prospectair Geosurveys, on the Allison Lake North property (the ""Property""). The survey comprised 406 line-kilometers of high-resolution mag with GPS controlled 50-meter line se",CAD,POR.V,Newsfile - Portofino Reports Airborne Survey Results- Allison Lake North Lithium Project
fin_news_nlp/yahoo_cad_tickers_news,https://ca.finance.yahoo.com/news/avila-energy-receives-court-approval-160000704.html,"Avila Energy Corporation (""Avila"" or the ""Company""), trading symbol ""CSE:VIK.CN"", is pleased to announce the granting by the Court of Kings Bench of Alberta for the Approval of its application to close the Acquisition in West Central Alberta, as previously announced on June 27, 2022, (the ""Acquisition"") and the application for closing being granted on by the Courts on September 13th, 2022.",CAD,VIK.CN,ACCESSWIRE - Avila Energy Receives Court Approval and Closing of Acquisition
fin_news_nlp/yahoo_cad_tickers_news,https://ca.finance.yahoo.com/news/leanlife-health-inc-announces-organizational-171700429.html,"-New Executive Leadership and CFIA Certification Are Among the Latest Developments- Vancouver, British Columbia--(Newsfile Corp. - September 15, 2022) - LeanLife Health Inc. (CSE: LLP) (OTCQB: LNLHF) (FSE: LL1) today announced several developments for the company behind Iron Energy Drinks and Shelf Stable Omega-3 Flaxseed Oil. As the company enters its next stage of growth, it is undergoing significant changes, which include executive leadership, recent certification by the Canadian Food Inspect",CAD,LLP.CN,Newsfile - LeanLife Health Inc. Announces Organizational Changes and North America Expansion
fin_news_nlp/yahoo_cad_tickers_news,https://ca.finance.yahoo.com/news/2-best-value-stocks-buy-160000218.html,"These two high-quality stocks offer tonnes of value but also growth potential, making them some of the best to buy now. The post 2 of the Best Value Stocks to Buy and Hold Until 2030 appeared first on The Motley Fool Canada.",CAD,ATZ.TO,The Motley Fool - 2 of the Best Value Stocks to Buy and Hold Until 2030
fin_news_nlp/yahoo_cad_tickers_news,https://ca.finance.yahoo.com/news/earnings-alert-brp-stock-screaming-150000723.html,Here are the key reasons I find DOO stock highly undervalued after its Q2 earnings event. The post Earnings Alert! BRP Stock Is a Screaming Buy After its Q2 Earnings Event appeared first on The Motley Fool Canada.,CAD,DOO.TO,The Motley Fool - Earnings Alert! BRP Stock Is a Screaming Buy After its Q2 Earnings Event
fin_news_nlp/yahoo_cad_tickers_news,https://ca.finance.yahoo.com/news/cogeco-cogeco-communications-schedule-release-180400962.html,"Cogeco Inc. (TSX: CGO) and Cogeco Communications Inc. (TSX: CCA) plan to release their financial results for the fourth quarter ended August 31, 2022 on Thursday, October 27, 2022, after market closing.",CAD,CGO.TO,CNW Group - Cogeco and Cogeco Communications Schedule the Release of their Financial Results for the Fourth Quarter of Fiscal 2022 and Related Conference Call
fin_news_nlp/yahoo_cad_tickers_news,https://ca.finance.yahoo.com/news/power-play-market-herald-releases-180000608.html,The Power Play by The Market Herald has announced the release of a new interview with Westhaven Gold discussing their latest news.,CAD,FNV.TO,ACCESSWIRE - The Power Play by The Market Herald Releases a New Interview with Westhaven Gold Discussing Their Latest News
fin_news_nlp/yahoo_cad_tickers_news,https://ca.finance.yahoo.com/news/rrsp-investors-2-oversold-canadian-154500101.html,RRSP investors can now find top TSX dividend stocks to buy at cheap prices for portfolios focused on total returns. The post RRSP Investors: 2 Oversold Canadian Dividend Stocks to Buy Now and Own for 25 Years appeared first on The Motley Fool Canada.,CAD,TD.TO,The Motley Fool - RRSP Investors: 2 Oversold Canadian Dividend Stocks to Buy Now and Own for 25 Years
fin_news_nlp/yahoo_cad_tickers_news,https://ca.finance.yahoo.com/news/strong-financial-prospects-force-driving-181717987.html,Whitecap Resources' (TSE:WCP) stock is up by a considerable 9.0% over the past week. Since the market usually pay for a...,CAD,WCP.TO,Simply Wall St. - Are Strong Financial Prospects The Force That Is Driving The Momentum In Whitecap Resources Inc.'s TSE:WCP) Stock?
fin_news_nlp/yahoo_cad_tickers_news,https://ca.finance.yahoo.com/news/anfield-energy-announces-listing-warrants-171300926.html,"NOT FOR DISTRIBUTION TO U.S. NEWSWIRE SERVICES OR FOR RELEASE, PUBLICATION, DISTRIBUTION OR DISSEMINATION DIRECTLY OR INDIRECTLY, IN WHOLE OR IN PART, IN OR INTO THE UNITED STATES VANCOUVER, British Columbia, Sept. 15, 2022 (GLOBE NEWSWIRE) -- Anfield Energy Inc. (TSX.V: AEC; OTCQB: ANLDF; FRANKFURT: 0AD) (“Anfield” or the “Company”) is pleased to announce that the TSX Venture Exchange has accepted for listing 125,000,000 common share purchase warrants (the “Warrants”) of the Company. The Warran",CAD,AEC.V,GlobeNewswire - Anfield Energy Announces Listing of Warrants
fin_news_nlp/yahoo_cad_tickers_news,https://ca.finance.yahoo.com/news/exgen-empire-mine-project-moving-174700643.html,"NOT FOR DISTRIBUTION TO UNITED STATES NEWSWIRE SERVICES OR FOR DISSEMINATION IN THE UNITED STATES VANCOUVER, British Columbia, Sept. 15, 2022 (GLOBE NEWSWIRE) -- ExGen Resources Inc. (TSX.V: EXG; OTC: BXXRF) (“ExGen”, the “Company”) is pleased to provide an update in respect of Phoenix Copper Ltd.’s (“Phoenix”) exploration and development activities at the Empire Mine Project in Custer County, Idaho, USA. Further to previous ExGen news releases, ExGen owns 20% and Phoenix owns 80% of Konnex Reso",CAD,EXG.V,GlobeNewswire - ExGen: Empire Mine Project Moving Closer to Production
fin_news_nlp/yahoo_cad_tickers_news,https://ca.finance.yahoo.com/news/falcon-announces-initial-surface-sampling-182000750.html,"FALCON GOLD CORP. (TSXV:FG)(GR:3FA)(OTCQB:FGLDF); (""Falcon"" or the ""Company"") is pleased to announce that exploration has commenced at the Company's 100% owned Gander North Property, with initial results now available from its reconnaissance exploration program. The project commenced in late June, with initial prospecting and till sampling. Preliminary efforts have identified numerous evidence for quartz veins, including subcrop and float.",CAD,FG.V,ACCESSWIRE - Falcon Announces Initial Surface Sampling Results at Gander North and Filing of Drill Permit
fin_news_nlp/yahoo_cad_tickers_news,https://ca.finance.yahoo.com/news/oculus-visiontech-reports-2022-annual-185200850.html,"Vancouver, British Columbia--(Newsfile Corp. - September 15, 2022) - Oculus VisionTech Inc. (TSXV: OVT) (OTCQB: OVTZ) (FSE: USF1) is pleased to announce the results of its 2022 Annual General Meeting (""AGM""). The AGM was held on September 15, 2022 in Vancouver, British Columbia. All resolutions put forward at the meeting were approved by shareholders. A total of 60,059,026 common shares (65.69% of the 91,422,569 issued and outstanding shares of the Company entitled ...",CAD,OVT.V,Newsfile - Oculus VisionTech Reports 2022 Annual General Meeting Results
fin_news_nlp/yahoo_cad_tickers_news,https://ca.finance.yahoo.com/news/rivalry-host-virtual-investor-day-190000483.html,"TORONTO, Sept. 15, 2022 (GLOBE NEWSWIRE) -- Rivalry Corp. (the “Company” or “Rivalry”) (TSXV: RVLY) (OTCQX: RVLCF) (FSE: 9VK), an internationally regulated sports betting and media company, today announced that it plans to host a Virtual Investor Day on Thursday, October 6, 2022, beginning at 10:00 am EDT. Held one year after Rivalry’s public listing, the Company’s inaugural Investor Day will include presentations and commentary from a cross-section of the leadership team. The sessions will prov",CAD,RVLY.V,"GlobeNewswire - Rivalry to Host Virtual Investor Day on October 6, 2022"
fin_news_nlp/yahoo_cad_tickers_news,https://ca.finance.yahoo.com/news/appia-announces-dr-john-belhumeur-172700436.html,"Toronto, Ontario--(Newsfile Corp. - September 15, 2022) - Appia Rare Earths & Uranium Corp. (CSE: API) (OTCQX: APAAF) (FSE: A0I.F) (FSE: A0I.MU) (FSE: A0I.BE) (the ""Company"" or ""Appia"") is pleased to announce that Dr. John Belhumeur has been appointed Senior Advisor regarding First Nations, Métis, and Government relations, effective September 15, 2022, as the Company advances its exploration program on its 100%-owned Alces Lake high-grade rare earth elements and gallium property, Athabasca Basin",CAD,API.CN,"Newsfile - Appia Announces That Dr. John Belhumeur, Ph.D. Has Been Appointed as Senior Advisor to the Company Regarding First Nations, Métis, and Government Relations"
fin_news_nlp/yahoo_cad_tickers_news,https://www.yahoo.com/news/fox-reporter-refuses-translate-migrant-173718652.html,"Fox NewsA Fox News correspondent covering the buses of migrants that arrived outside the Vice President’s home on Thursday decided to try and communicate with some in Spanish—that is, until he couldn’t bother trying anymore.Griff Jenkins began approaching some of the migrants sent to the Naval Observatory early Thursday morning, using his minimal Spanish to try to speak to some of them. In standard Fox News fashion, Jenkins got one to contradict a purported claim by Vice President Kamala Harris",CAD,?err=404&err_url=https%3A%2F%2Fca.finance.yahoo.com%2Fquote%2FGLDS.CN,U.S. - 
fin_news_nlp/yahoo_cad_tickers_news,https://ca.finance.yahoo.com/news/5-low-risk-yield-lap-174500432.html,Earn reliable dividend yield of over 5% with this low-risk TSX stocks. The post 5% Low-Risk Yield! Lap Up These 3 Dividend-Paying TSX Stocks Now appeared first on The Motley Fool Canada.,CAD,AQN.TO,The Motley Fool - 5% Low-Risk Yield! Lap Up These 3 Dividend-Paying TSX Stocks Now
fin_news_nlp/yahoo_cad_tickers_news,https://ca.finance.yahoo.com/news/2-oversold-canadian-dividend-stocks-170000976.html,TFSA and RRSP investors can buy top high-yield TSX stocks at cheap prices right now for portfolios focused on passive income and total returns. The post 2 Oversold Canadian Dividend Stocks Yielding 6% to Buy Now for a TFSA or RRSP appeared first on The Motley Fool Canada.,CAD,BCE.TO,The Motley Fool - 2 Oversold Canadian Dividend Stocks Yielding 6% to Buy Now for a TFSA or RRSP
fin_news_nlp/yahoo_cad_tickers_news,https://ca.finance.yahoo.com/news/tfi-international-declares-quarterly-dividend-200500726.html,"MONTREAL, Sept. 15, 2022 (GLOBE NEWSWIRE) -- The Board of Directors of TFI International Inc. (NYSE and TSX: TFII), a North American leader in the transportation and logistics industry, declared a quarterly dividend of US $0.27 per outstanding common share of its capital payable on October 17, 2022 to shareholders of record at the close of business on September 30, 2022. ABOUT TFI INTERNATIONALTFI International Inc. is a North American leader in the transportation and logistics industry, operati",CAD,TFII.TO,GlobeNewswire - TFI International Declares Quarterly Dividend
fin_news_nlp/yahoo_cad_tickers_news,https://ca.finance.yahoo.com/news/david-eckert-continue-ceo-yellow-203000481.html,"Yellow Pages Limited (TSX: Y) (the ""Company""), a leading Canadian digital media and marketing company, announced today an agreement to extend the tenure of its President and CEO, David A. Eckert, to mid-2025. The Company's Board of Directors approved the arrangement at a meeting today.",CAD,Y.TO,CNW Group - David A. Eckert to Continue as CEO of Yellow Pages Limited to mid-2025
fin_news_nlp/yahoo_cad_tickers_news,https://ca.finance.yahoo.com/news/alvopetro-confirms-us-0-08-204300391.html,"Alvopetro Energy Ltd. (TSXV: ALV) (OTCQX: ALVOF) announces that our Board of Directors has declared a quarterly dividend of US$0.08 per common share, payable in cash on October 14, 2022, to shareholders of record at the close of business on September 29, 2022. This dividend is designated as an ""eligible dividend"" for Canadian income tax purposes.",CAD,ALV.V,CNW Group - Alvopetro Confirms US$0.08 Per Share Q3 2022 Dividend
fin_news_nlp/yahoo_cad_tickers_news,https://ca.finance.yahoo.com/news/commander-partner-fjordland-concludes-exploration-201500963.html,"Vancouver, British Columbia--(Newsfile Corp. - September 15, 2022) - Commander Resources Ltd. (TSXV: CMD) (""Commander"") has been notified that project partner Fjordland Exploration Inc. (TSXV: FEX) (""Fjordland"") has concluded the drilling program at the South Voisey's Bay (""SVB"") nickel copper cobalt project in Labrador. The program operated out of the community of Hopedale Labrador. Initially the plan was to complete up to 2,500m of diamond core drilling by the fall; however, operational and sa",CAD,CMD.V,"Newsfile - Commander Partner Fjordland Concludes Exploration Program at South Voisey's Bay, Labrador"
fin_news_nlp/yahoo_cad_tickers_news,https://ca.finance.yahoo.com/news/fjordland-concludes-exploration-program-south-204500481.html,"Vancouver, British Columbia--(Newsfile Corp. - September 15, 2022) - Fjordland Exploration Inc. (TSXV: FEX) (the ""Company"") announces that in conjunction with Ivanhoe Electric Inc., and Commander Resources Ltd, the Company's drill program on the South Voisey's Bay nickel project located in Labrador has been concluded for 2022. The program operated out of the community of Hopedale Labrador. Initially the plan was to complete up to 2,500m of diamond core drilling by the fall; however, ...",CAD,FEX.V,Newsfile - Fjordland Concludes Exploration Program at South Voisey's Bay
fin_news_nlp/yahoo_cad_tickers_news,https://ca.finance.yahoo.com/news/gold-line-closes-private-placement-200000629.html,"Gold Line Resources Ltd. (TSXV: GLDL) (Frankfurt: 4UZ) (WKN: A2QGWC) (OTCQB: TLLZF) (""Gold Line"" or the ""Company"") is pleased to announce that, further to its news release of August 16, 2022, the Company has closed its non-brokered private placement for gross proceeds of $1,500,000 (the ""Private Placement"").",CAD,GLDL.V,"CNW Group - Gold Line closes Private Placement raising $1,500,000"
fin_news_nlp/yahoo_cad_tickers_news,https://ca.finance.yahoo.com/news/amendment-cape-spencer-option-agreement-200000343.html,"/ Magna Terra Minerals Inc. (the ""Company"" or ""Magna Terra"") (TSX-V:MTT) announces that it has entered into an Amendment Agreement (the ""Agreement"") regarding its Cape Spencer Project in southern New Brunswick.",CAD,MTT.V,ACCESSWIRE - Amendment of Cape Spencer Option Agreement
fin_news_nlp/yahoo_cad_tickers_news,https://ca.finance.yahoo.com/news/mcloud-provides-interest-payment-related-210000010.html,"mCloud Technologies Corp. (Nasdaq: MCLD) (TSXV: MCLD), (""mCloud"" or the ""Company"") a leading provider of AI-powered asset management and Environmental, Social, and Governance (""ESG"") solutions today provided an update on an interest payment related to its outstanding unsecured convertible debentures (the ""Debentures"").",CAD,MCLD.V,CNW Group - mCloud Provides Update on Interest Payment Related to Outstanding Unsecured Convertible Debentures
fin_news_nlp/yahoo_cad_tickers_news,https://ca.finance.yahoo.com/news/torq-closes-c-15-million-203000007.html,"Torq Resources Inc. (TSXV:TORQ)(OTCQX:TRBMF) (""Torq"" or the ""Company"")is pleased to announce that it has closed the C$15 million non-brokered private placement with a wholly owned affiliate of NYSE listed international gold mining company, Gold Fields Limited (""Gold Fields"") that was previously announced on September 6, 2022.",CAD,TORQ.V,ACCESSWIRE - Torq Closes C$15 Million Strategic Investment from Gold Fields
