source,url,description,country,company,title
fin_news_nlp/yahoo_cad_tickers_news,https://ca.finance.yahoo.com/news/royal-canadian-mint-central-bank-140000209.html,"The Royal Canadian Mint is delighted to be recognized alongside the Central Bank of Barbados for the Barbados $1 Glow-in-the-Dark Flying Fish circulation coin, which was crowned Best New Commemorative or Test Circulating Coin under the International Association of Currency Affairs' (IACA) 2022 Excellence in Currency Awards. Issued in honour of Bajan front-line workers who helped the nation overcome the COVID-19 pandemic, this pad-printed colour circulation coin was enhanced with the Mint's propr",CAD,MNT.TO,CNW Group - ROYAL CANADIAN MINT AND CENTRAL BANK OF BARBADOS WIN THE INTERNATIONAL  ASSOCIATION OF CURRENCY AFFAIRS' 2022 EXCELLENCE IN CURRENCY AWARD IN THE BEST NEW COMMEMORATIVE OR TEST CIRCULATING COIN CATEGORY
fin_news_nlp/yahoo_cad_tickers_news,https://ca.finance.yahoo.com/m/6054cf41-021f-3f3c-b1ac-932454705c97/worried-about-rising-interest.html,"Interest rates have been on the rise this year, and inflation still remains a big problem for the federal government.  Exelixis (NASDAQ: EXEL) and Shopify (NYSE: SHOP) are two stocks that don't have debt problems and possess plenty of upside, making them not just safe buys but also potentially bargain investments as well.  Exelixis is a healthcare company that develops treatments targeting multiple types of cancers.",CAD,SHOP.TO,Motley Fool - Worried About Rising Interest Rates? These 2 Growth Stocks Could Offer a Solution
fin_news_nlp/yahoo_cad_tickers_news,https://ca.finance.yahoo.com/news/2-tsx-dividend-stocks-double-143000924.html,Top TSX dividend stocks now offering high yields for TFSA and RRSP investors. The post 2 TSX Dividend Stocks to Double up on Right Now appeared first on The Motley Fool Canada.,CAD,BNS.TO,The Motley Fool - 2 TSX Dividend Stocks to Double up on Right Now
fin_news_nlp/yahoo_cad_tickers_news,https://ca.finance.yahoo.com/news/canaccord-genuity-group-inc-access-143000358.html,"Canaccord Genuity Group Inc. (TSX: CF) is scheduled to release its second quarter fiscal 2023 results and supplementary financial information after Canadian markets close on Wednesday, November 2, 2022. Interested investors, the media and other stakeholders may review the earnings release and supplementary financial information at www.cgf.com/investor-relations/investor-resources/financial-reports/",CAD,CF.TO,CNW Group - CANACCORD GENUITY GROUP INC. ACCESS TO SECOND QUARTER FISCAL 2023 RESULTS INFORMATION
fin_news_nlp/yahoo_cad_tickers_news,https://ca.finance.yahoo.com/news/stock-delivered-gain-1-874-124500907.html,"It's rare for this top tech stock to correct. Interested investors should seize the opportunity to build a long-term position on weakness. The post This Stock Has Delivered a Gain of 1,874% Over 10 Years: Can You Still Buy? appeared first on The Motley Fool Canada.",CAD,CSU.TO,"The Motley Fool - This Stock Has Delivered a Gain of 1,874% Over 10 Years: Can You Still Buy?"
fin_news_nlp/yahoo_cad_tickers_news,https://ca.finance.yahoo.com/news/crescent-point-announces-q3-2022-160000218.html,"Crescent Point Energy Corp. (""Crescent Point"" or the ""Company"") (TSX: CPG) and (NYSE: CPG) plans to report its third quarter 2022 financial and operating results via press release prior to the opening of markets on Wednesday, October 26, 2022. Crescent Point's management will hold a conference call at 10:00 a.m. MT (12:00 p.m. ET) the same day to discuss the Company's results and outlook.",CAD,CPG.TO,CNW Group - Crescent Point Announces Q3 2022 Conference Call
fin_news_nlp/yahoo_cad_tickers_news,https://ca.finance.yahoo.com/news/dentalcorp-announces-release-date-third-140000158.html,"dentalcorp Holdings Ltd. (""dentalcorp"" or the ""Company"") (TSX: DNTL), Canada's largest and one of North America's fastest growing networks of dental practices, announced today that it will release its third quarter 2022 financial results before market open on November 9, 2022.",CAD,DNTL.TO,CNW Group - dentalcorp Announces Release Date for Third Quarter 2022 Results
fin_news_nlp/yahoo_cad_tickers_news,https://ca.finance.yahoo.com/news/equinox-gold-announces-updated-feasibility-110500751.html,"Equinox Gold Corp. (TSX: EQX) (NYSE American: EQX) (""Equinox Gold"" or the ""Company"") is pleased to announce the results of a Feasibility Study for an expansion at the Company's 100%-owned Los Filos Mine Complex (""Los Filos"") located in Mexico. Current Los Filos operations consist of both run-of-mine (""ROM"") and crushed ore heap leach facilities. With continued development of the Bermejal Underground deposit and construction of a 10,000 tonnes per day (""t/d"") carbon-in-leach (""CIL"") processing pl",CAD,EQX.TO,CNW Group - Equinox Gold Announces Updated Feasibility Study for Los Filos Expansion
fin_news_nlp/yahoo_cad_tickers_news,https://ca.finance.yahoo.com/news/rbc-celebrates-four-inspirational-leaders-162800606.html,"RBC is proud to recognize four exceptional leaders — Natalie Marchesan, Senior Vice-President and Global Head, Procurement and Chief Administration Office Shared Services; Erica Nielsen, Senior Vice-President, Personal Savings and Investments; Carmela Trombetta, Vice-President Commercial Financial Services and Caroline Tutakiewicz, Senior Director, Fraud and Security Risk — have been honoured among Canada's Top 100 Most Powerful Women by the Women's Executive Network.",CAD,RY.TO,CNW Group - RBC celebrates four inspirational leaders named among WXN's Top 100 Most Powerful Women
fin_news_nlp/yahoo_cad_tickers_news,https://ca.finance.yahoo.com/news/sagicor-financial-company-ltd-cautions-163600287.html,"Sagicor Financial Company Ltd. (TSX: SFC) (""Sagicor"" or ""Company"") has been notified of an unsolicited mini-tender offer by New York Stock and Bond LLC to purchase 10,000 common shares1 in the capital of the Company from Sagicor's shareholders at a price of US$4.00 per common share. The unsolicited offer represents a discount of approximately 12% to the closing price of the common shares on the TSX on September 20, 20222, the last trading day before the offer was commenced, and a discount of app",CAD,SFC.TO,CNW Group - Sagicor Financial Company Ltd. cautions investors regarding New York Stock and Bond LLC mini-tender offer
fin_news_nlp/yahoo_cad_tickers_news,https://ca.finance.yahoo.com/news/top-energy-stock-buy-hold-131500981.html,Canadians on the hunt for a top energy stock to add in October can depend on Suncor Energy Inc. (TSX:SU) for the long haul. The post My Top Energy Stock to Buy and Hold Forever appeared first on The Motley Fool Canada.,CAD,SU.TO,The Motley Fool - My Top Energy Stock to Buy and Hold Forever
fin_news_nlp/yahoo_cad_tickers_news,https://ca.finance.yahoo.com/news/talon-metals-battery-minerals-processing-153300043.html,"Facility will process nickel and other battery minerals in North Dakota, moving processing and tailings management away from the Minnesota mine site Tamarack, Minnesota--(Newsfile Corp. - October 19, 2022) - Talon Metals Corp. (TSX: TLO) (OTC Pink: TLOFF) (""Talon"" or the ""Company"") has been informed that its wholly-owned subsidiary, Talon Nickel (USA) LLC, has been selected as a recipient of the first set of projects funded by President Biden's Bipartisan Infrastructure Law to expand domestic ..",CAD,TLO.TO, - Talon Metals Battery Minerals Processing Facility Selected by US Department of Energy for $114 Million in Bipartisan Infrastructure Law Funding
fin_news_nlp/yahoo_cad_tickers_news,https://ca.finance.yahoo.com/news/rio-tinto-proposed-deal-giant-151748372.html,(Bloomberg) -- Shareholder advisory firm Glass Lewis & Co. is urging Turquoise Hill Resources Ltd. investors to support a proposed takeover by Rio Tinto Group -- dismissing criticisms of a top shareholder critical of the mining giant’s efforts to gain control of one of the world’s largest copper mines.Most Read from BloombergA Tense Pay Dispute Overshadows Nintendo’s Upcoming Bayonetta 3$200 Diesel Puts Biden in an Ugly CornerTrump Special Master Has ‘No Patience’ for Records SpatsBlinken Says C,CAD,TRQ.TO,Bloomberg - Rio Tinto’s Proposed Deal for Giant Copper Mine Endorsed by Glass Lewis
fin_news_nlp/yahoo_cad_tickers_news,https://ca.finance.yahoo.com/news/canadian-regulator-asks-telcos-share-171026963.html,"For years, Canadian consumers have complained about high cellular bills, which rank among the steepest in the world, and Prime Minister Justin Trudeau's Liberal government has threatened to take action if the providers failed to cut bills by 25%.  The Canadian Radio-television and Telecommunications Commission (CRTC) has since been under pressure to increase competition and lower prices where three companies - BCE Inc's Bell unit, Telus Corp and Rogers Communications control over 80% of the mobile subscriber market.",CAD,BCE.TO,"Reuters - Canadian regulator asks telcos to share network with smaller cos, agree to wholesale rates"
fin_news_nlp/yahoo_cad_tickers_news,https://ca.finance.yahoo.com/news/equinox-gold-announce-third-quarter-181000504.html,"Equinox Gold Corp. (TSX: EQX) (NYSE American: EQX) will announce its unaudited financial and operating results for the three and six months ended September 30, 2022 on Wednesday, November 2, 2022, after market close. Equinox Gold will host a conference call and webcast to discuss the results the following morning on Thursday, November 3, 2022, commencing at 7:30 am PT (10:30 am ET).",CAD,EQX.TO,"CNW Group - Equinox Gold to Announce Third Quarter Financial Results on November 2, 2022"
fin_news_nlp/yahoo_cad_tickers_news,https://ca.finance.yahoo.com/news/1-000-today-returns-buy-161623162.html,"TSX stock Nutrien has a solid chance of seeing 52-week highs once again, while bringing in stable passive income. The post Need $1,000 Today? Take Returns and Buy This Top TSX Stock appeared first on The Motley Fool Canada.",CAD,NTR.TO,"The Motley Fool - Need $1,000 Today? Take Returns and Buy This Top TSX Stock"
fin_news_nlp/yahoo_cad_tickers_news,https://ca.finance.yahoo.com/news/2-cheap-dividend-stocks-power-161500925.html,"Restaurant Brands International (TSX:QSR)(NYSE:QSR) and Sleep Country Canada (TSX:ZZZ) may not make you rich, but their dividends are hot. The post 2 Cheap Dividend Stocks to Power Your Income Fund appeared first on The Motley Fool Canada.",CAD,QSR.TO,The Motley Fool - 2 Cheap Dividend Stocks to Power Your Income Fund
fin_news_nlp/yahoo_cad_tickers_news,https://ca.finance.yahoo.com/news/buy-td-stock-suncor-stock-170000862.html,Top Canadian dividend stock now trade at undervalued prices. The post Should You Buy TD Stock or Suncor Stock for Passive Income? appeared first on The Motley Fool Canada.,CAD,SU.TO,The Motley Fool - Should You Buy TD Stock or Suncor Stock for Passive Income?
fin_news_nlp/yahoo_cad_tickers_news,https://ca.finance.yahoo.com/news/smartest-tsx-dividend-stocks-buy-181500757.html,"If you're willing to part with $100, then these are the three top dividend stocks I would choose on the TSX today. The post The Smartest TSX Dividend Stocks to Buy With $100 Right Now appeared first on The Motley Fool Canada.",CAD,BCE.TO,The Motley Fool - The Smartest TSX Dividend Stocks to Buy With $100 Right Now
fin_news_nlp/yahoo_cad_tickers_news,https://ca.finance.yahoo.com/news/3-canadian-dividend-stocks-ll-173000288.html,Investors will regret not buying top Canadian dividend stocks like Fortis Inc. (TSX:FTS) and others on the dip in October. The post 3 Canadian Dividend Stocks You’ll Regret Not Buying on the Dip appeared first on The Motley Fool Canada.,CAD,CU.TO,The Motley Fool - 3 Canadian Dividend Stocks You’ll Regret Not Buying on the Dip
fin_news_nlp/yahoo_cad_tickers_news,https://ca.finance.yahoo.com/news/gear-energy-ltd-announces-september-200100138.html,"Calgary, Alberta--(Newsfile Corp. - October 19, 2022) - Gear Energy Ltd. (TSX: GXE) (OTCQX: GENGF) (""Gear"" or the ""Company"") is pleased to announce that the new September 2022 monthly update to shareholders can be accessed via the following link https://gearenergy.com/updates.FOR FURTHER INFORMATION PLEASE CONTACT:Ingram Gillmore President & CEO403-538-8463David HwangVice President Finance & CFO403-538-8437Email: info@gearenergy.comWebsite: www.gearenergy.comTo view the source version of this pr",CAD,GXE.TO,Newsfile - Gear Energy Ltd. Announces September Monthly Update to Shareholders
fin_news_nlp/yahoo_cad_tickers_news,https://ca.finance.yahoo.com/news/orvana-achieves-fy2022-guidance-57-110000118.html,"Orvana Minerals Corp. (TSX: ORV) (the ""Company"" or ""Orvana"") is pleased to report production results and drilling updates from Orovalle, Orvana's unit in Spain, for the fourth quarter of fiscal year 2022 ended September 30, 2022 (""Q4 FY2022"").",CAD,ORV.TO,"CNW Group - ORVANA ACHIEVES FY2022 GUIDANCE WITH 57,658 GOLD EQUIVALENT OUNCES PRODUCED"
fin_news_nlp/yahoo_cad_tickers_news,https://ca.finance.yahoo.com/news/hall-findlay-suncor-energys-first-192013895.html,"CALGARY — Suncor Energy Inc. says Martha Hall Findlay will retire from her role as the company's first chief climate officer at the end of November. Hall Findlay joined Suncor in 2020 as the company's chief sustainability officer. Her appointment as chief climate officer in February of this year was the first of its kind in Canada's energy sector. Suncor did not provide a reason for Hall Findlay's departure after less than a year in the role. However, the Globe and Mail reported Wednesday that p",CAD,SU.TO,"The Canadian Press - Hall Findlay, Suncor Energy's first 'chief climate officer,' to retire from role"
fin_news_nlp/yahoo_cad_tickers_news,https://ca.finance.yahoo.com/news/wesdome-announces-details-2022-third-203000288.html,"TORONTO, Oct. 19, 2022 (GLOBE NEWSWIRE) -- Wesdome Gold Mines Ltd. (TSX: WDO) (“Wesdome” or the “Company”) today announces that the Company intends to release its 2022 third quarter financial results after market close on November 9, 2022. The financial statements and management discussion and analysis will be available on the Company’s website at www.wesdome.com and on SEDAR at www.sedar.com. A conference call to discuss these results will be held on November 10, 2022 at 10:00 am ET. Participan",CAD,WDO.TO,GlobeNewswire - Wesdome Announces Details of 2022 Third Quarter Financial Results Conference Call
fin_news_nlp/yahoo_cad_tickers_news,https://ca.finance.yahoo.com/news/buy-algonquin-power-stock-emera-190000220.html,These utility stocks look oversold and offer attractive and growing dividends. The post Should You Buy Algonquin Power Stock or Emera Stock Now? appeared first on The Motley Fool Canada.,CAD,AQN.TO,The Motley Fool - Should You Buy Algonquin Power Stock or Emera Stock Now?
fin_news_nlp/yahoo_cad_tickers_news,https://ca.finance.yahoo.com/news/ats-participate-scotiabank-transportation-industrials-210100876.html,"ATS Automation Tooling Systems Inc. (TSX: ATA) (""ATS"" or the ""Company"") today announced that Andrew Hider, Chief Executive Officer and Ryan McLeod, Chief Financial Officer will participate in the Scotiabank Transportation & Industrials Conference in Toronto on November 15, 2022.",CAD,ATA.TO,CNW Group - ATS to Participate in the Scotiabank Transportation & Industrials Conference
fin_news_nlp/yahoo_cad_tickers_news,https://ca.finance.yahoo.com/news/ats-participate-baird-2022-global-210000082.html,"ATS Automation Tooling Systems Inc. (TSX: ATA) (""ATS"" or the ""Company"") today announced that Ryan McLeod, Chief Financial Officer will participate in the Baird 2022 Global Industrial Conference in Chicago on November 10, 2022.",CAD,ATA.TO,CNW Group - ATS to Participate in the Baird 2022 Global Industrial Conference
fin_news_nlp/yahoo_cad_tickers_news,https://ca.finance.yahoo.com/news/most-actively-traded-companies-toronto-212604303.html,"TORONTO — Some of the most active companies traded Wednesday on the Toronto Stock Exchange: Toronto Stock Exchange (18,674.40, down 123.78 points): Enbridge Inc. (TSX:ENB). Energy. Up five cents, or 0.1 per cent, to $51.35 on 11.1 million shares. Bank of Nova Scotia (TSX:BNS). Financials. Down $1.65, or 2.48 per cent, to $64.89 on 5.9 million shares. Suncor Energy Inc. (TSX:SU). Energy. Up 74 cents, or 1.73 per cent, to $43.50 on five million shares. Athabasca Oil Corp. (TSX:ATH). Energy. Up 10",CAD,BNS.TO, - Most actively traded companies on the Toronto Stock Exchange
fin_news_nlp/yahoo_cad_tickers_news,https://ca.finance.yahoo.com/news/retirees-2-top-high-yield-200000113.html,Retirees can get great yields right now for a portfolio focused on passive income. The post Retirees: 2 Top High-Yield TSX Stocks to Buy for a TFSA appeared first on The Motley Fool Canada.,CAD,BCE.TO,The Motley Fool - Retirees: 2 Top High-Yield TSX Stocks to Buy for a TFSA
fin_news_nlp/yahoo_cad_tickers_news,https://ca.finance.yahoo.com/news/galaxy-schedules-webcast-investor-call-210000941.html,"Galaxy Digital Holdings Ltd. (TSX: GLXY) (""Galaxy Digital"", ""GDH Ltd."" or the ""Company"") is pleased to announce that it will report third quarter 2022 financial results before the opening of the Toronto Stock Exchange on Wednesday, November 9, 2022.",CAD,GLXY.TO,"CNW Group - Galaxy Schedules Webcast and Investor Call to Review Third Quarter 2022 Results on November 9, 2022"
fin_news_nlp/yahoo_cad_tickers_news,https://ca.finance.yahoo.com/news/nutrien-ntr-stock-moves-0-215009553.html,"Nutrien (NTR) closed the most recent trading day at $81.70, moving -0.24% from the previous trading session.",CAD,NTR.TO,Zacks - Nutrien (NTR) Stock Moves -0.24%: What You Should Know
fin_news_nlp/yahoo_cad_tickers_news,https://ca.finance.yahoo.com/news/pyrogenesis-announces-closing-small-non-210000044.html,"MONTREAL, Oct. 19, 2022 (GLOBE NEWSWIRE) -- PyroGenesis Canada Inc. (http://pyrogenesis.com) (TSX: PYR) (NASDAQ: PYR) (FRA: 8PY), a high-tech company (hereinafter referred to as the “Company” or “PyroGenesis”), that designs, develops, manufactures and commercializes advanced plasma processes and sustainable solutions which are geared to reduce greenhouse gases (GHG), announces today that it has completed a non-brokered private placement consisting of the issuance and sale of 1,014,600 units of t",CAD,PYR.TO,GlobeNewswire - PyroGenesis Announces Closing of a Small Non-Brokered Private Placement
fin_news_nlp/yahoo_cad_tickers_news,https://ca.finance.yahoo.com/news/hall-findlay-suncor-energys-first-192013902.html,"CALGARY — Suncor Energy Inc.'s first-ever chief climate officer is departing her role at the end of November, but Martha Hall Findlay says she feels ""far more optimistic"" than she once did that Canada's oil and gas sector can be part of the climate change solution. Hall Findlay joined Suncor in 2020 as chief sustainability officer, and was named the company's chief climate officer — the first appointment of its kind by a Canadian energy company — in February of this year. While at the company, H",CAD,SU.TO,"The Canadian Press - Hall Findlay, Suncor Energy's first 'chief climate officer,' to retire from role"
fin_news_nlp/yahoo_cad_tickers_news,https://ca.finance.yahoo.com/news/us-battery-supply-chain-talon-211200329.html,"Talon Doubles Indicated Resource Tonnage, including 570% Increase in High-Grade Nickel This news release constitutes a ""designated news release"" for the purposes of the Company's prospectus supplement dated December 16, 2021 to its short form base shelf prospectus dated December 7, 2021Tamarack, Minnesota--(Newsfile Corp. - October 19, 2022) - Talon Metals Corp. (TSX: TLO) (OTC Pink: TLOFF) (""Talon"" or the ""Company"") has updated its mineral resource estimate for the Tamarack Nickel Project locat",CAD,TLO.TO,Newsfile - US Battery Supply Chain: Talon Metals Announces Significant Increase to Mineral Resource Estimate at Tamarack Nickel Project
fin_news_nlp/yahoo_cad_tickers_news,https://ca.finance.yahoo.com/news/tc-energy-issue-third-quarter-210000539.html,"CALGARY, Alberta, Oct. 19, 2022 (GLOBE NEWSWIRE) -- News Release – TC Energy Corporation (TSX, NYSE: TRP) (TC Energy or the Company) will hold a teleconference and webcast on Wednesday, Nov. 9, 2022, to discuss its third quarter financial results, which will be released pre-market. François Poirier, TC Energy President and Chief Executive Officer; Joel Hunter, Executive Vice-President and Chief Financial Officer; and other members of the executive leadership team will discuss the financial resul",CAD,TRP.TO,GlobeNewswire - TC Energy to issue third quarter 2022 results on Nov. 9
fin_news_nlp/yahoo_cad_tickers_news,https://ca.finance.yahoo.com/news/southern-initiates-fuel-loading-vogtle-133401677.html,Southern (SO) is likely to be the operator of the Vogtle 3 nuclear plant on behalf of the co-owners.,CAD,TA.TO,Zacks - Southern (SO) Initiates Fuel Loading at Vogtle 3 Nuclear Plant
fin_news_nlp/yahoo_cad_tickers_news,https://ca.finance.yahoo.com/news/yamana-gold-auy-stock-outpacing-134001716.html,Here is how Yamana Gold (AUY) and Brigham Minerals (MNRL) have performed compared to their sector so far this year.,CAD,YRI.TO,Zacks - Is Yamana Gold (AUY) Stock Outpacing Its Basic Materials Peers This Year?
fin_news_nlp/yahoo_cad_tickers_news,https://ca.finance.yahoo.com/news/ats-participate-scotiabank-transportation-industrials-210100775.html,"ATS Automation Tooling Systems Inc. (TSX: ATA) (""ATS"" or the ""Company"") today announced that Andrew Hider, Chief Executive Officer and Ryan McLeod, Chief Financial Officer will participate in the Scotiabank Transportation & Industrials Conference in Toronto on November 15, 2022.",CAD,ATA.TO,CNW Group - ATS to Participate in the Scotiabank Transportation & Industrials Conference
fin_news_nlp/yahoo_cad_tickers_news,https://ca.finance.yahoo.com/news/amaroq-minerals-ltd-announces-results-064500546.html,"Amaroq Minerals Ltd. (AIM:AMRQ)(TSX-V:AMRQ), an independent mining company with an unrivalled land package of gold and strategic mineral assets in Greenland, is pleased to announce the successful completion of its proposed Fundraising as announced on 19 October 2022.",CAD,AMRQ.V,ACCESSWIRE - Amaroq Minerals Ltd. Announces Results of Fundraising
fin_news_nlp/yahoo_cad_tickers_news,https://ca.finance.yahoo.com/news/arcpacific-samples-20-g-t-070100328.html,"Vancouver, British Columbia--(Newsfile Corp. - October 20, 2022) - ArcPacific Resources Corp. (TSXV: ACP) (FSE: P21P) (OTC Pink: ACPRF) (""ACP"" or the ""Company"") is pleased to provide an update regarding ongoing work at its 100% owned Lucky Mike Silver Lode Project (the ""LMSL Property"") located in the Quesnel Trough, British Columbia's primary copper and gold producing belt. The Company has identified gold-copper mineralization grading up to 20.1 g/t gold (Au), 130 g/t Silver (Ag), ...",CAD,ACP.V,"Newsfile - ArcPacific Samples up to 20 g/t Gold, 3.5% Copper and Identifies Key Structural Controls at LMSL Project"
fin_news_nlp/yahoo_cad_tickers_news,https://ca.finance.yahoo.com/news/denison-announces-exploration-agreement-yathi-103000913.html,"Denison Mines Corp. (""Denison"" or the ""Company"") (TSX: DML) (NYSE American: DNN) is pleased to announce that it has entered into an exploration agreement (the ""Exploration Agreement"") with the Ya'thi Néné Lands and Resources Office (""YNLR""), Hatchet Lake Denesułiné First Nation, Black Lake Denesułiné First Nation, Fond du Lac Denesułiné First Nation (collectively, the ""Athabasca Nations"") and the Northern Hamlet of Stony Rapids, the Northern Settlement of Uranium City, the Northern Settlement",CAD,DML.TO,"CNW Group - Denison Announces Exploration Agreement with the Ya'thi Néné Lands and Resources Office, the Athabasca Nations, and Communities of the Nuhenéné"
fin_news_nlp/yahoo_cad_tickers_news,https://ca.finance.yahoo.com/news/dynacert-engages-hdcpa-professional-corporation-090000951.html,"TORONTO, October 20, 2022--dynaCERT Inc. (TSX: DYA) (OTCQX: DYFSF) (FRA: DMJ)(""dynaCERT"" or the ""Company"") is pleased to announce that HDCPA Professional Corporation (""HDCPA"") has been retained by the Company to be its auditor.",CAD,DYA.TO,Business Wire - dynaCERT Engages HDCPA Professional Corporation as Auditor
fin_news_nlp/yahoo_cad_tickers_news,https://ca.finance.yahoo.com/news/mawson-delivers-us-211-million-101500878.html,"Mawson Gold Limited (""Mawson"" or the ""Company"") (TSX:MAW)(Frankfurt:MXR)(OTC PINK:MWSNF) is pleased to announce the results of the maiden preliminary economic assessment (""PEA"") on its 100% owned Rajapalot gold-cobalt project (""Rajapalot"", or the ""Project"") in northern Finland.The PEA considers a target 1.2 million tonnes per annum underground mining operation over a period of 9 years with an on-site processing facility to produce gold doré and cobalt",CAD,MAW.TO,ACCESSWIRE - Mawson Delivers US$211 million NPV5 (post-tax) from Rajapalot PEA
fin_news_nlp/yahoo_cad_tickers_news,https://ca.finance.yahoo.com/news/reports-record-2022-third-quarter-100000714.html,"(TSX: MTL) Mullen Group Ltd. (""Mullen Group"", ""We"", ""Our"" and/or the ""Corporation""), one of North America's largest logistics providers today reported its financial and operating results for the period ended September 30, 2022, with comparisons to the same period last year. Full details of our results may be found within our Third Quarter Interim Report, which is available on the Corporation's issuer profile on SEDAR at www.sedar.com or on our website at www.mullen-group.com.",CAD,MTL.TO,CNW Group - Reports Record 2022 Third Quarter Financial Results
