source,url,description,country,company,title
fin_news_nlp/yahoo_cad_tickers_news,https://ca.finance.yahoo.com/news/kodiak-drills-1-03-cueq-100000576.html,"Vancouver, British Columbia--(Newsfile Corp. - September 29, 2022) - Kodiak Copper Corp. (TSXV: KDK) (OTCQB: KDKCF) (FSE: 5DD1) (the ""Company"" or ""Kodiak"") today reports results for five drill holes from the fully funded 25,000 metre 2022 drill program at the 100% owned MPD copper-gold porphyry project in southern British Columbia.The Company's initial work in 2022 focused on additional drilling at the Gate Zone and testing look-alike geophysical targets nearby. New high-grade copper-gold-silver",CAD,KDK.V,"Newsfile - Kodiak Drills 1.03% CuEq Over 117 m, Within 0.34% CuEq Over 735.4 m at Gate Zone, and Discovers New Trend at Prime Zone"
fin_news_nlp/yahoo_cad_tickers_news,https://ca.finance.yahoo.com/news/nugen-m-d-file-patent-110000503.html,"NuGen Medical Devices Inc. (TSXV:NGMD) (OTCQB:NGMDF) (""NuGen'' or the ""Company""), a leader in needle-free drug delivery, is pleased to announce that it intends to file for a new patent in the United States, Europe and China.",CAD,NGMD.V,"ACCESSWIRE - NuGen M.D. to File for Patent Protection in the United States, Europe and China"
fin_news_nlp/yahoo_cad_tickers_news,https://ca.finance.yahoo.com/news/o3-mining-hosts-marban-engineering-100000974.html,"O3 Mining Inc. (TSXV: OIII) (OTC-QX: OIIIF) (""O3 Mining"" or the ""Corporation"") continues to fulfill the host community's request to have a transparent and constructive dialogue, by informing citizens about the advancements at Marban Engineering. Close to 100 citizens attended the meeting held this Wednesday, September 28th, at the Maison du Citoyen in Dubuisson. O3 Mining reiterated its commitments to the community made last May during the specific consultation sessions, and presented the result",CAD,OIII.V,CNW Group - O3 Mining Hosts Marban Engineering Community Meeting
fin_news_nlp/yahoo_cad_tickers_news,https://ca.finance.yahoo.com/news/petrolympic-announces-favourable-geological-context-110000985.html,"TORONTO, Sept. 29, 2022 (GLOBE NEWSWIRE) -- Petrolympic Ltd. (TSX.V:PCQ) (OTC:PCQRF) (the “Company”) is pleased to announce the presence of several white pegmatite dykes on the Basserode Property in the Decelles Reservoir Area. The Property is located approximately 30 kilometers southeast of the town of Rouyn-Noranda and south of national highway 117. The two claim blocks consist of 109 and 14 mining claims each, covering respectively 15,533.6 acres (6,286.24 hectares) and 1,993.1 acres (806.59",CAD,PCQ.V,"GlobeNewswire - Petrolympic Announces Favourable Geological Context for Lithium-Rich Spodumene Crystals in the Decelles Reservoir Area, Abitibi, Québec"
fin_news_nlp/yahoo_cad_tickers_news,https://ca.finance.yahoo.com/news/puma-exploration-hits-multiple-high-100000567.html,"FIGURE 1: High-grade gold drilling intersections and surface grab samples at the Lynx Gold Zone High-grade gold drilling intersections and surface grab samples at the Lynx Gold Zone (latest assay results in yellow) FIGURE 2: Lynx Gold Zone supergene gold enrichment 3D model Lynx Gold Zone supergene gold enrichment 3D model FIGURE 3: The Williams Brook Gold Project main zones The Williams Brook Gold Project main zones RIMOUSKI, Quebec, Sept. 29, 2022 (GLOBE NEWSWIRE) -- Puma Exploration Inc. (TSX",CAD,PUMA.V,GlobeNewswire - Puma Exploration Hits Multiple High-Grade Gold Intercepts at Williams Brook
fin_news_nlp/yahoo_cad_tickers_news,https://ca.finance.yahoo.com/news/extensive-soil-survey-underway-riley-103000628.html,"Figure 1 Soil Survey Area Figure 2 Target Area Ellipse over Gravity survey features. VANCOUVER, British Columbia, Sept. 29, 2022 (GLOBE NEWSWIRE) -- Riley Gold Corp. (TSX.V: RLYG) (OTCQB: RLYGF) (“Riley Gold” or the “Company”) is pleased to announce that a 1,000-sample soil survey program, covering approximately 3.8 square kilometres (“sqkm”), is underway at its Pipeline West/Clipper Gold Project (“PWC”) located in Lander County, Nevada. Riley Gold’s land package consists of approximately 24.7 s",CAD,RLYG.V,GlobeNewswire - Extensive Soil Survey Underway at Riley Gold’s Pipeline West/Clipper Gold Project Adjacent to Cortez Complex
fin_news_nlp/yahoo_cad_tickers_news,https://ca.finance.yahoo.com/news/skylight-health-participate-medicaid-value-110000987.html,"Over 20K+ Medicaid members to Begin Participation in Colorado in 2023TORONTO, Sept. 29, 2022 (GLOBE NEWSWIRE) -- Skylight Health Group Inc. (TSXV:SLHG) (“Skylight Health” or the “Company”), a healthcare platform combining technology, and analytics focused on transitioning patients into value-based care to drive better health outcomes and experiences in the United States, today provides an update on the addendum to its current Medicaid contract into Colorado’s new Alternative Payment Model 2 (APM",CAD,SLHG.V,GlobeNewswire - Skylight Health to Participate in Medicaid Value-Based Care Model in Colorado
fin_news_nlp/yahoo_cad_tickers_news,https://ca.finance.yahoo.com/news/zacapa-announces-private-placement-3-110000789.html,"Zacapa Resources Ltd. (TSXV: ZACA) (OTCQB: ZACAF) (DE: BH0) (""Zacapa"") is pleased to announce a non-brokered private placement (the ""Offering"") for the sale of up to 20,000,000 units (the ""Units"") at a price of C$0.15 per Unit for gross proceeds of up to C$3,000,000. Each Unit will be comprised of one common share (each, a ""Unit Share"") and one common share purchase warrant (each, a ""Warrant""). Each Warrant will entitle the holder thereof to purchase one common share (each, a ""Warrant Share"") at",CAD,ZACA.V,CNW Group - ZACAPA ANNOUNCES PRIVATE PLACEMENT OF UP TO $3 MILLION
fin_news_nlp/yahoo_cad_tickers_news,https://ca.finance.yahoo.com/news/1933-industries-announces-surplus-real-110000896.html,"1933 Industries Inc. (the ""Company"" or ""1933 Industries"") (CSE:TGIF)(OTCQB:TGIFF), a Nevada-focused cannabis consumer packaged goods company, is pleased to announce that it has completed the sale of a vacant property located in Las Vegas, Nevada, for total gross proceeds of US$2.65 million, prior to customary closing adjustments.",CAD,TGIF.CN,ACCESSWIRE - 1933 Industries Announces Surplus Real Estate Asset Sale
fin_news_nlp/yahoo_cad_tickers_news,https://ca.finance.yahoo.com/news/eyefi-launch-world-first-geo-110000359.html,"EYEfi Group Technologies Inc. (CSE:EGTI)(OTC PINK:EGTTF)(""EYEfi"") is pleased to announce the public launch date of its SpatialEye App, powered by EYEfi's SPARC technology, which will be made available in a ""consumer"" beta version on the Apple App Store on November 1, 2022.",CAD,EGTI.CN,ACCESSWIRE - EYEfi to Launch World-First Geo-Pointing App - EYEfi SpatialEye
fin_news_nlp/yahoo_cad_tickers_news,https://ca.finance.yahoo.com/news/psyence-group-completes-export-psilocybin-110000127.html,"TORONTO, Sept. 29, 2022 (GLOBE NEWSWIRE) -- Psyence Group Inc. (CSE: PSYG | OTCQB: PSYGF) (“Psyence” or the “Company”) is pleased to announce that it has successfully exported medical grade psilocybin mushrooms to Psilo Pharma Inc. (“Psilo Pharma”), from its federally licensed ISO22000 certified production facility in Southern Africa, through its research partner in Portugal (the “Research Partner”). In February 2022, Psyence received an import permit from the Portuguese regulators for the Resea",CAD,PSYG.CN,GlobeNewswire - Psyence Group Completes Export of Psilocybin Mushrooms to Portugal
fin_news_nlp/yahoo_cad_tickers_news,https://ca.finance.yahoo.com/news/rapid-dose-therapeutics-participate-venture-110200962.html,"BURLINGTON, Ontario, September 29, 2022--Rapid Dose Therapeutics Corp. (""RDT"" or the ""Company"") (CSE: DOSE), a Canadian biotechnology company revolutionizing drug delivery through innovation, is one of five Canadian companies accepted into this year’s Venture Mentoring Services program offered by the Maryland Tech Council (MTC) in partnership with the Canadian Trade Commissioner Service in Washington, DC.",CAD,DOSE.CN,Business Wire - Rapid Dose Therapeutics to Participate in the Venture Mentoring Services Program in Partnership with Maryland Tech Council and Canada’s Trade Commissioner Service
fin_news_nlp/yahoo_cad_tickers_news,https://ca.finance.yahoo.com/news/5n-plus-secures-historic-multi-110000461.html,"5N Plus Inc. (TSX: VNP) (""5N Plus"" or the ""Company""), a leading global producer of specialty semiconductors and performance materials, is pleased to announce that it has successfully renewed and increased its multi-year agreement with First Solar, Inc. (""First Solar"") (NASDAQ: FSLR) for the supply of semiconductor materials associated with the manufacturing of thin-film photovoltaic (PV) modules.",CAD,VNP.TO,CNW Group - 5N Plus Secures Historic Multi-Year Supply Agreement with Renewable Energy Leader First Solar
fin_news_nlp/yahoo_cad_tickers_news,https://ca.finance.yahoo.com/news/aleafia-health-announces-results-annual-124200111.html,"TORONTO, Sept. 29, 2022 (GLOBE NEWSWIRE) -- Aleafia Health Inc. (TSX: AH, OTCQX: ALEAF) (“Aleafia Health” or the “Company”) is pleased to announce the results of the vote on the election of directors at its annual meeting of shareholders held on September 27, 2022 (the “Meeting”). All six nominees set out in the management information circular of the Company dated August 19, 2022 were elected to the board of directors (the “Board”) of the Company. NomineeForAgainstWithheldNon VoteForAgainstWithh",CAD,AH.TO,GlobeNewswire - Aleafia Health Announces Results of Annual General Meeting
fin_news_nlp/yahoo_cad_tickers_news,https://ca.finance.yahoo.com/news/bmo-recognized-best-fintech-accelerator-110000714.html,BMO's Innov8 program has ranked first in the Best Fintech Accelerator and Incubator Award category at the recent 2022 Finovate Awards. The recognition reflects BMO's commitment to deliver leading digital experiences for customers that help them make real financial progress.,CAD,BMO.TO,CNW Group - BMO Recognized for Best Fintech Accelerator and Incubator at 2022 Finovate Awards
fin_news_nlp/yahoo_cad_tickers_news,https://ca.finance.yahoo.com/news/blackberry-tsx-bb-stock-best-181500925.html,"BlackBerry stock is still falling after its quarterly result, despite a 28% revenue increase in its Internet of Things segment. The post BlackBerry (TSX:BB) Stock: The Best Buy for Your RRSP appeared first on The Motley Fool Canada.",CAD,BB.TO,The Motley Fool - BlackBerry (TSX:BB) Stock: The Best Buy for Your RRSP
fin_news_nlp/yahoo_cad_tickers_news,https://ca.finance.yahoo.com/news/caldwell-enhances-life-sciences-healthcare-130000029.html,Retained executive search firm Caldwell (TSX:CWL; OTCQX:CWLPF) today announced a major enhancement to its life sciences and healthcare recruiting capabilities with the addition of Steven Price as a partner in the firm's Life Sciences & Healthcare Practice and based in Dallas.,CAD,CWL.TO,ACCESSWIRE - Caldwell Enhances Life Sciences and Healthcare Recruiting Capabilities with the Addition of Steven Price to Dallas Office
fin_news_nlp/yahoo_cad_tickers_news,https://ca.finance.yahoo.com/news/cenovus-help-advance-sustainable-energy-123000491.html,"ESG energy leader joins First Nations Major Projects Coalition’s Sustaining Partners ProgramCOAST SALISH TERRITORY, Sept. 29, 2022 (GLOBE NEWSWIRE) -- The First Nations Major Projects Coalition (FNMPC) is pleased to announce Cenovus Energy Inc. (Cenovus) as a new member of its Sustaining Partners Program. The program furthers FNMPC’s ability to advance relationships between its members and the private sector on issues of mutual interest. Cenovus, along with existing program members CIBC, Collier",CAD,CVE.TO,GlobeNewswire - Cenovus to help advance sustainable energy opportunities for First Nations
fin_news_nlp/yahoo_cad_tickers_news,https://ca.finance.yahoo.com/news/strategic-modern-facilities-colabor-group-113000781.html,"BOUCHERVILLE, Quebec, Sept. 29, 2022 (GLOBE NEWSWIRE) -- Colabor Group Inc. (TSX : GCL) (“Colabor” or the “Company”), a leading distributor of food and related products serving the Quebec and Atlantic Canada markets, announces today that, by the end of 2023, it will be moving its Boucherville head office and warehouse to new facilities in the Saint-Bruno-de-Montarville Industrial Ecopark, near its current location. The new industrial premises will be more modern, better located for operations, a",CAD,GCL.TO,GlobeNewswire - New Strategic and Modern Facilities for Colabor Group
fin_news_nlp/yahoo_cad_tickers_news,https://ca.finance.yahoo.com/news/dialogue-launches-wellness-canadas-first-113000429.html,"Dialogue Health Technologies Inc. (TSX: CARE) (""Dialogue"" or the ""Company""), Canada's premier virtual care and wellness platform, is launching Wellness, a new program that promotes healthier living through preventive healthy habits. The program targets primarily the 70% of Canadians who do not achieve the recommended 150 minutes of physical activity per week, helping them build healthier habits and prevent illness.",CAD,CARE.TO,"CNW Group - Dialogue launches Wellness, Canada's first-ever integrated virtual preventative health program that promotes healthier living"
fin_news_nlp/yahoo_cad_tickers_news,https://ca.finance.yahoo.com/news/enthusiast-gaming-continues-strengthen-balance-110000231.html,"Sale Proceeds Represent ~4.5x Multiple to Associated RevenueLOS ANGELES, Sept. 29, 2022 (GLOBE NEWSWIRE) -- Enthusiast Gaming Holdings Inc. (“Enthusiast Gaming” or the “Company”) (NASDAQ:EGLX; TSX:EGLX), an integrated gaming entertainment company, today announced the sale of certain video game editorial websites (the “Website Assets”) for a purchase price of approximately C$6.8 million, representing a multiple of approximately 4.5x associated revenue. Between the sale and the Company’s expanded",CAD,EGLX.TO,GlobeNewswire - Enthusiast Gaming Continues to Strengthen Balance Sheet Through C$6.8 Million Sale of Select Legacy Assets
fin_news_nlp/yahoo_cad_tickers_news,https://ca.finance.yahoo.com/news/federal-finance-minister-approves-equitable-121747134.html,"TORONTO — Equitable Bank says the federal finance minister has approved the company's deal to buy digital rival Concentra Bank. The Toronto-based bank says no further regulatory or shareholder approvals are required in the acquisition. Equitable announced a deal in February to buy Concentra for $470 million. It says the deal will make it Canada's seventh-largest bank. The acquisition is expected to be completed in the fourth quarter, as early as Nov. 1, subject to the satisfaction or waiver of t",CAD,EQB.TO,The Canadian Press - Federal finance minister approves Equitable Bank deal to buy Concentra
fin_news_nlp/yahoo_cad_tickers_news,https://ca.finance.yahoo.com/news/ero-copper-announces-discovery-nickel-110100282.html,Figure 1(a) Drill core from the deepest intercept to date in the VB Zone (hole VB-25 at ~319 meters) highlighting loop textured pentlandite in (a) and high-grade massive sulphide intervals within the zone (b). Figure 1(b) Drill core from the deepest intercept to date in the VB Zone (hole VB-25 at ~319 meters) highlighting loop textured pentlandite in (a) and high-grade massive sulphide intervals within the zone (b). Figure 2(a) Patchy net-textured sulphides shown in detail for hole LZ-03 (~107 m,CAD,ERO.TO,"GlobeNewswire - Ero Copper announces discovery of nickel sulphide system in the Curaçá Valley; intercepts 16.5 meters grading 1.22% nickel, including 3.8 meters grading 3.60% nickel"
fin_news_nlp/yahoo_cad_tickers_news,https://ca.finance.yahoo.com/news/spark-perks-launches-circle-k-113200724.html,"Fire & Flower Holdings Corp. (""Fire & Flower"" or the ""Company"") (TSX: FAF) (OTCQX: FFLWF), a leading cannabis consumer retail and technology platform announced today that in collaboration with its strategic partner, Alimentation Couche-Tard Inc. (""ACT""), that Spark Perks™ members can now experience a new fast and convenient way of shopping for cannabis in the Greater Toronto Area through Circle K's new co-located store in the Brampton market.",CAD,FAF.TO,CNW Group - Spark Perks Launches in Circle K Co-Located Store in Greater Toronto Area
fin_news_nlp/yahoo_cad_tickers_news,https://ca.finance.yahoo.com/news/designated-news-release-goldmining-intersects-105500741.html,"GoldMining Inc. (the ""Company"" or ""GoldMining"") (TSX: GOLD) (NYSE American: GLDG) is pleased to announce assay results from the final hole of its recently completed five hole 3,485 metre drilling program on the La Garrucha target, located less than one kilometre to the east of existing mineral resources on the Company's 100% owned La Mina Project (""La Mina"") in the Middle Cauca Porphyry Belt, Antioquia, Colombia.",CAD,GOLD.TO,"CNW Group - DESIGNATED NEWS RELEASE - GOLDMINING INTERSECTS 118 M GRADING 1.01 g/t AUEQ AT ITS LA GARRUCHA TARGET, LA MINA PROJECT, COLOMBIA"
fin_news_nlp/yahoo_cad_tickers_news,https://ca.finance.yahoo.com/news/home-capital-report-third-quarter-110000731.html,"TORONTO, September 29, 2022--Home Capital Group Inc. (TSX: HCG) (""Home Capital"" or ""the Company"") will report financial results for the three months and nine months ended September 30, 2022 on Tuesday, November 8, 2022 before markets open.",CAD,HCG.TO,Business Wire - Home Capital to Report Third Quarter 2022 Financial Results
fin_news_nlp/yahoo_cad_tickers_news,https://ca.finance.yahoo.com/news/kinaxis-publishes-2022-global-impact-110000219.html,"OTTAWA, Ontario, September 29, 2022--Kinaxis® Inc. (TSX:KXS), the authority in driving agility for fast, confident decision-making in an unpredictable world, published its 2022 Global Impact Report, outlining milestones achieved across its core Environmental, Social, and Corporate Governance (ESG) commitments; protecting our planet, taking care of people, giving back and building trust through integrity.",CAD,KXS.TO,Business Wire - Kinaxis Publishes Its 2022 Global Impact Report
fin_news_nlp/yahoo_cad_tickers_news,https://ca.finance.yahoo.com/news/leading-japanese-chemical-product-distributor-110000192.html,"BOSTON, September 29, 2022--MPO today announced a new customer agreement to become the strategic supply chain execution platform for the North American subsidiary, headquartered in White Plains in New York, of a Japanese distributor of chemical products. As the Distributor embarks on a systems enhancement program for operational visibility and financial control across the entire supply chain, MPO is excited to support this transformative journey through automation and advanced optimization.",CAD,KXS.TO,Business Wire - A leading Japanese Chemical Product Distributor Selects MPO’s Strategic Supply Chain Execution Platform
fin_news_nlp/yahoo_cad_tickers_news,https://ca.finance.yahoo.com/news/mccoy-global-announces-formation-strategy-110000087.html,"McCoy Global Inc. (""McCoy"" or ""the Corporation"") (TSX: MCB) today announced that McCoy has formed a Strategy and Capital Allocation Committee of independent members of the Board of Directors of the Corporation (""the Committee""), comprising Mr. Alex Ryzhikov (Chair of the Committee), Ms. Katherine Demuth, Mr. Cory Janssen and Mr. John Walker. The mandate of the Committee is to, among other things, assist the Corporation in executing on its Board approved strategic plan that aims to further improv",CAD,MCB.TO,CNW Group - McCOY GLOBAL ANNOUNCES FORMATION OF STRATEGY AND CAPITAL ALLOCATION COMMITTEE
fin_news_nlp/yahoo_cad_tickers_news,https://ca.finance.yahoo.com/news/pet-valu-remove-single-plastic-110000095.html,"Pet Valu, the leading Canadian specialty retailer of pet food and pet-related supplies, today announced plans to cease sale and distribution of single-use plastic shopping bags at all corporate and franchised locations across Canada, outside of Quebec, effective November 1, 2022. Customers are encouraged to bring their own reusable shopping bags, and will also have the option to purchase recyclable paper bags at checkout.",CAD,PET.TO,"CNW Group - Pet Valu to remove all single-use plastic shopping bags by November 1, 2022"
fin_news_nlp/yahoo_cad_tickers_news,https://ca.finance.yahoo.com/news/sandstorm-gold-royalties-declares-2022-123000074.html,"Sandstorm Gold Ltd. (""Sandstorm Gold Royalties"", ""Sandstorm"" or the ""Company"") (NYSE: SAND) (TSX: SSL) is pleased to announce that its Board of Directors has declared the Company's fourth quarterly cash dividend for 2022 in the amount of C$0.02 per common share to shareholders of record as of the close of business on October 18, 2022. The dividend will be paid on October 28, 2022. The dividend qualifies as an ""eligible dividend"" as defined in the Income Tax Act (Canada).",CAD,SSL.TO,CNW Group - Sandstorm Gold Royalties Declares 2022 Fourth Quarterly Dividend
fin_news_nlp/yahoo_cad_tickers_news,https://ca.finance.yahoo.com/m/db025613-f8ee-321d-9b55-f2fd0650e5f9/is-shopify-a-buy-now%3F.html,"Shopify (NYSE: SHOP), a leading e-commerce solutions provider, has seen its share price plunge by more than 80% from its peak of $176.  The stock price correction will attract bargain hunters, but is Shopify stock a buy now?  Shopify has had a phenomenal run.",CAD,SHOP.TO,Motley Fool - Is Shopify a Buy Now?
fin_news_nlp/yahoo_cad_tickers_news,https://ca.finance.yahoo.com/news/vitalhub-announces-multi-contract-stevenson-113000440.html,"TORONTO, Sept. 29, 2022 (GLOBE NEWSWIRE) -- VitalHub Corp. (the “Company” or “VitalHub”) (TSXV: VHI) (OTCQX:VHIBF) is pleased to announce two new licensing agreements of it’s prEDict solution to Stevenson Memorial Hospital (“SMH”) and Georgian Bay General Hospital (“GBGH”), both in Ontario. Stevenson Memorial Hospital (Alliston) has signed a 5-year term and Georgian Bay General Hospital (Midland) has signed a 3-year term, with two optional 1-year extension periods. prEDict is an emergency depart",CAD,VHI.TO,GlobeNewswire - VitalHub Announces Multi Year Contract With Stevenson Memorial Hospital and Georgian Bay General Hospital
fin_news_nlp/yahoo_cad_tickers_news,https://ca.finance.yahoo.com/news/bitbuy-launch-stock-trading-110000396.html,"Expected to Go Live in Q1 2023 through Integration with Alpaca Toronto, Ontario--(Newsfile Corp. - September 29, 2022) - WonderFi Technologies Inc. (TSX: WNDR) (OTCQB: WONDF) (WKN: A3C166) (FTX: WNDR) (the ""Company"" or ""WonderFi"") subsidiary Bitbuy Technologies Inc. (""Bitbuy"") today announced its partnership with AlpacaDB, Inc. (""Alpaca""), which will enable Bitbuy to offer its users fractional trading and investing in thousands of US stocks and exchange traded funds (ETFs), in an integrated expe",CAD,WNDR.TO,Newsfile - Bitbuy to Launch Stock Trading
fin_news_nlp/yahoo_cad_tickers_news,https://ca.finance.yahoo.com/news/acasti-announces-voting-results-2022-130000015.html,"LAVAL, Québec, Sept. 29, 2022 (GLOBE NEWSWIRE) -- Acasti Pharma Inc. (“Acasti” or the “Company”) (NASDAQ: ACST and TSX-V: ACST), a late-stage, specialty pharma company advancing three clinical stage drug candidates addressing rare and orphan diseases, announced today the voting results from its Annual General and Special Meeting of Shareholders (the “Meeting”) which was held virtually on Wednesday September 28, 2022. Election of Directors All five (5) nominees listed in the proxy statement dated",CAD,ACST.V,GlobeNewswire - Acasti Announces Voting Results from 2022 Annual and Special Meeting of Shareholders
fin_news_nlp/yahoo_cad_tickers_news,https://ca.finance.yahoo.com/news/antler-gold-appoints-christopher-drysdale-131800087.html,"Halifax, Nova Scotia--(Newsfile Corp. - September 29, 2022) - Antler Gold Inc. (TSXV: ANTL) (""Antler"" or the ""Company"") is pleased to announce that it has appointed Christopher Drysdale as Chief Executive Officer (""CEO"") effective immediately. Mr. Drysdale replaces Daniel Whittaker, who will assume the position of Executive Chairman.This appointment will allow Antler to continue building and expanding on its business. In March 2022, Antler announced that it had entered into an agreement with She",CAD,ANTL.V,Newsfile - Antler Gold Appoints Christopher Drysdale as Chief Executive Officer
fin_news_nlp/yahoo_cad_tickers_news,https://ca.finance.yahoo.com/news/artemis-announces-commencement-blackwater-plant-110000913.html,"Artemis Gold Inc. (TSXV: ARTG) (""Artemis"" or the ""Company"") is pleased to announce that the Company has fulfilled all EA conditions required to commence site preparation work at the plant site for the Blackwater project (""Blackwater"" or the ""Project""). With the satisfaction of all EA conditions, Artemis has now commenced early works including site clearing, bulk earthworks and sediment/erosion control works to prepare the Blackwater plant site for the start of major works construction activities",CAD,ARTG.V,CNW Group - ARTEMIS ANNOUNCES COMMENCEMENT OF BLACKWATER PLANT SITE EARTHWORKS
fin_news_nlp/yahoo_cad_tickers_news,https://ca.finance.yahoo.com/news/canada-nickel-provides-project-announces-110000623.html,"Canada Nickel Company Inc. (""Canada Nickel"" or ""The Company"") (TSXV: CNC) (OTCQB: CNIKF) is pleased to provide an update on the Crawford project and its financing activities.",CAD,CNC.V,CNW Group - Canada Nickel Provides Project Update and Announces US$10 Million Loan Facility
