source,url,description,country,company,title
fin_news_nlp/yahoo_cad_tickers_news,https://ca.finance.yahoo.com/news/africa-oil-share-capital-voting-213000929.html,"(TSX: AOI) (Nasdaq-Stockholm: AOI) – Africa Oil Corp. (""Africa Oil"", or the ""Company"") reports the following share capital and voting rights update in accordance with the Swedish Financial Instruments Trading Act. View PDF version.",CAD,AOI.TO,CNW Group - AFRICA OIL SHARE CAPITAL AND VOTING RIGHTS UPDATE
fin_news_nlp/yahoo_cad_tickers_news,https://ca.finance.yahoo.com/news/d-invest-1-000-november-211500875.html,"AQN stock (TSX:AQN)(NYSE:AQN) is an attractive TSX dividend stock to buy in November. Here's why. The post How I’d Invest $1,000 in November to Make Easy Passive Income appeared first on The Motley Fool Canada.",CAD,AQN.TO,"The Motley Fool - How I’d Invest $1,000 in November to Make Easy Passive Income"
fin_news_nlp/yahoo_cad_tickers_news,https://ca.finance.yahoo.com/m/9e86d0fa-47e7-385f-96fe-2a2ce9987779/why-marijuana-stocks-like.html,"Many of them tumbled during the trading session, including but certainly not limited to Canopy Growth (NASDAQ: CGC), Tilray Brands (NASDAQ: TLRY), and Aurora Cannabis (NASDAQ: ACB), all of which suffered declines at around the 6% mark.  Tuesday morning, industry website MJBizDaily.com published the somewhat discouraging results of a poll.  All told, five states are conducting a public vote on the matter on Election Day next Tuesday, Nov. 8: Maryland, Arkansas, Missouri, North Dakota, and South Dakota.",CAD,ACB.TO,Motley Fool - Why Marijuana Stocks Like Canopy Growth Fell Sharply Today
fin_news_nlp/yahoo_cad_tickers_news,https://ca.finance.yahoo.com/news/b2gold-reports-q3-2022-results-213000018.html,"B2Gold Corp. (TSX: BTO) (NYSE AMERICAN: BTG) (NSX: B2G) (""B2Gold"" or the ""Company"") announces its operational and financial results for the third quarter of 2022. The Company previously released its gold production and gold revenue results for the third quarter of 2022. All dollar figures are in United States dollars unless otherwise indicated.",CAD,BTO.TO,CNW Group - B2Gold Reports Q3 2022 Results; Full-Year 2022 Total Consolidated Gold Production and Cost Guidance Remains Unchanged; Year-to-Date Operating Costs and All-In Sustaining Costs In Line with Budget despite Lower than Expected Gold Production
fin_news_nlp/yahoo_cad_tickers_news,https://ca.finance.yahoo.com/news/most-actively-traded-companies-toronto-210110313.html,"TORONTO — Some of the most active companies traded Tuesday on the Toronto Stock Exchange: Toronto Stock Exchange (19,517.71, up 91.57 points): Enbridge Inc. (TSX:ENB). Energy. Down five cents, or 0.09 per cent, to $53.03 on 7.5 million shares. Suncor Energy Inc. (TSX:SU). Energy. Up 87 cents, or 1.86 per cent, to $47.73 on 7.5 million shares. Barrick Gold Corp. (TSX:ABX). Materials. Up nine cents, or 0.44 per cent, to $20.58 on 5.7 million shares. Bank of Montreal (TSX:BMO). Financials. Down 22",CAD,BMO.TO, - Most actively traded companies on the Toronto Stock Exchange
fin_news_nlp/yahoo_cad_tickers_news,https://ca.finance.yahoo.com/news/bird-construction-inc-signed-strategic-200500610.html,Bird Construction Inc. (TSX: BDT) announced today that it has signed two strategic delivery partnership agreements with Canadian Nuclear Laboratories (CNL). Bird Construction Inc. and the Bird-Chandos CDP Joint Venture have formalized partnership agreements to provide construction capabilities and capacity to support the delivery of CNL's corporate strategy.,CAD,BDT.TO,CNW Group - Bird Construction Inc. Signed On As Strategic Delivery Partner For Canadian Nuclear Laboratories
fin_news_nlp/yahoo_cad_tickers_news,https://ca.finance.yahoo.com/news/blackberry-bb-flat-market-sinks-221510683.html,"BlackBerry (BB) closed at $4.66 in the latest trading session, marking no change from the prior day.",CAD,BB.TO,Zacks - BlackBerry (BB) Flat As Market Sinks: What You Should Know
fin_news_nlp/yahoo_cad_tickers_news,https://ca.finance.yahoo.com/news/factors-know-ahead-prestige-consumer-202408354.html,"Prestige Consumer's (PBH) second-quarter fiscal 2023 earnings results might reflect the impacts of a tough operating landscape, including supply-chain headwinds and higher costs.",CAD,GIL.TO,Zacks - Factors to Know Ahead of Prestige Consumer (PBH) Q2 Earnings
fin_news_nlp/yahoo_cad_tickers_news,https://ca.finance.yahoo.com/news/gildan-activewear-gil-placed-ahead-201408402.html,"Gildan Activewear's (GIL) third-quarter 2022 results might show the ongoing benefits from its back-to-basics initiative, innovation and solid execution of its strategies.",CAD,GIL.TO,Zacks - How Gildan Activewear (GIL) is Placed Ahead of Q3 Earnings
fin_news_nlp/yahoo_cad_tickers_news,https://ca.finance.yahoo.com/news/gran-tierra-energy-inc-announces-230700501.html,"Third Quarter 2022 Average Production of 30,391 BOPD, Up 5% from One Year Ago Fourth Quarter-To-Date 2022 Average Production(1) of 32,291 BOPD Net Income of $39 Million, $168 Million Over The Last 12 Months Adjusted EBITDA(2) of $121 Million, Up 48% Year-on-Year, $462 Million Over Last 12 Months Net Cash Provided by Operating Activities of $109 Million, Up 82% Year-on-Year Funds Flow from Operations(2) of $94 Million, Up 36% Year-on-Year, $350 Million Over Last 12 Months Free Cash Flow(2)of $37",CAD,GTE.TO,GlobeNewswire - Gran Tierra Energy Inc. Announces Third Quarter 2022 Results
fin_news_nlp/yahoo_cad_tickers_news,https://ca.finance.yahoo.com/news/hexo-issues-correction-press-release-225200802.html,"This news release constitutes a “designated news release” for the purposes of the Company’s prospectus supplement dated May 2, 2022 to its short form base shelf prospectus dated May 7, 2021 and amended and restated on May 25, 2021. GATINEAU, Québec, Nov. 01, 2022 (GLOBE NEWSWIRE) -- HEXO Corp. (TSX: HEXO; NASDAQ: HEXO) (""HEXO"" or the “Company""), today announced a correction to its press release issued on October 31, 2022 announcing the Company’s financial results for the fiscal year ended July 3",CAD,HEXO.TO,GlobeNewswire - HEXO Issues Correction to Press Release Announcing Q4’22 and FY22 Financial Results
fin_news_nlp/yahoo_cad_tickers_news,https://ca.finance.yahoo.com/news/voya-financial-voya-q3-earnings-000512048.html,"Voya (VOYA) delivered earnings and revenue surprises of 84% and 53.51%, respectively, for the quarter ended September 2022. Do the numbers hold clues to what lies ahead for the stock?",CAD,MFC.TO,Zacks - Voya Financial (VOYA) Q3 Earnings and Revenues Top Estimates
fin_news_nlp/yahoo_cad_tickers_news,https://ca.finance.yahoo.com/news/martinrea-international-inc-reports-record-210100503.html,"TORONTO, Nov. 01, 2022 (GLOBE NEWSWIRE) -- Martinrea International Inc. (TSX : MRE), a diversified and global automotive supplier engaged in the design, development and manufacturing of highly engineered, value-added Lightweight Structures and Propulsion Systems, today announced the release of its financial results for the third quarter ended September 30, 2022 and that it has declared a quarterly cash dividend of $0.05 per share. THIRD QUARTER HIGHLIGHTS Total sales of $1,194.1 million, up 40.7",CAD,MRE.TO,GlobeNewswire - Martinrea International Inc. Reports Record Third-Quarter Revenues and Declares Dividend
fin_news_nlp/yahoo_cad_tickers_news,https://ca.finance.yahoo.com/news/norzinc-announces-receipt-final-permits-230400295.html,"NorZinc Ltd. (TSX: NZC) (OTCQB: NORZF) (the ""Company"" or ""NorZinc"") is pleased to announce it has completed and received final approvals for all Management Plans (""MPs"") from Parks Canada (""Parks""), acting in its capacity as regulator of Nahanni National Park Reserve, pertaining to the permit and license to construct the Pioneer Winter Road (""PWR""), which represents Phase 1 of the All-Season Access Road (""ASR"") at the Prairie Creek Project (""Prairie Creek"" or the ""Project""). This approval combin",CAD,NZC.TO,CNW Group - NorZinc Announces Receipt of Final Permits from Parks Canada for Construction of Phase 1 of the All-Season Access Road at Prairie Creek
fin_news_nlp/yahoo_cad_tickers_news,https://ca.finance.yahoo.com/news/pan-american-silver-extends-high-211000080.html,"Pan American Silver Corp. (NASDAQ: PAAS) (TSX: PAAS) (""Pan American"" or the ""Company"") today released results for 45 new infill and exploration drill holes totaling 34,239 metres at the Company's 100% owned La Colorada Skarn project in Zacatecas, Mexico. The results include five new drill holes that further define a zone of high-grade mineralisation around drill hole 96-03-22 that was first disclosed by the Company in a news release dated July 21, 2022. With the inclusion of these new drill hole",CAD,PAAS.TO,CNW Group - Pan American Silver extends high-grade silver zone at the La Colorada Skarn project
fin_news_nlp/yahoo_cad_tickers_news,https://ca.finance.yahoo.com/news/titanium-transportation-expands-freight-brokerage-203100923.html,"BOLTON, Ontario, Nov. 01, 2022 (GLOBE NEWSWIRE) -- Titanium Transportation Group Inc. (""Titanium"" or the ""Company"") (TSX:TTNM) a leading provider of transportation and logistics services throughout North America, is pleased to announce it has expanded its North American freight brokerage operations with the opening of its second office in the Windsor-Detroit Gateway. “Building on our existing footprint in Windsor, ON, the opening of our second office at the largest gateway for Canada-US trade re",CAD,TTNM.TO,GlobeNewswire - Titanium Transportation Expands Freight Brokerage Operations at Strategic Windsor-Detroit Gateway
fin_news_nlp/yahoo_cad_tickers_news,https://ca.finance.yahoo.com/news/1-two-turquoise-hill-investors-220911690.html,"Rio Tinto on Wednesday said two key investors in Turquoise Hill Resources agreed to withhold their votes at a meeting to decide on the global miner's $3.3 billion offer for the Canadian firm.  Pentwater, Turquoise's second-largest shareholder, and SailingStone Capital Partners will also exercise their dissent rights, and Rio will increase the dissent condition under its proposal to 17.5% of issued Turquoise Hill shares from 12.5%.  The parties agreed that dissent proceedings and some other claims would be conducted by arbitration, and the investors would be paid C$34.40 per share after deal close and the remaining consideration after the arbitration ends, Rio said.",CAD,TRQ.TO, - UPDATE 1-Two Turquoise Hill investors to withhold votes on Rio Tinto's $3.3 bln bid
fin_news_nlp/yahoo_cad_tickers_news,https://ca.finance.yahoo.com/news/viemed-healthcare-announces-third-quarter-203000102.html,"LAFAYETTE, La., Nov. 01, 2022 (GLOBE NEWSWIRE) -- Viemed Healthcare, Inc. (the “Company” or “Viemed”) (NASDAQ:VMD and TSX:VMD.TO), a national leader in respiratory care and technology-enabled home medical equipment services, announced today that it has reported its financial results for the three and nine months ended September 30, 2022. Operational highlights (all dollar amounts are USD): Net revenues attributable to the Company's core business for the quarter ended September 30, 2022 were $35.",CAD,VMD.TO,GlobeNewswire - Viemed Healthcare Announces Third Quarter 2022 Financial Results
fin_news_nlp/yahoo_cad_tickers_news,https://ca.finance.yahoo.com/news/viq-solutions-report-third-quarter-210000287.html,"PHOENIX, Ariz., November 01, 2022--VIQ Solutions Inc. (""VIQ"" or the ""Company"") (TSX:VQS and NASDAQ:VQS), a global provider of secure, AI-driven, digital voice and video capture technology and transcription services, will release its financial results for the third quarter and first nine months ended September 30, 2022, after market close on Wednesday, November 9, 2022. VIQ management will host a conference call to discuss these results on Thursday, November 10 at 11:00 AM Eastern Time.",CAD,VQS.TO,"Business Wire - VIQ Solutions to Report Third Quarter 2022 Financial Results on Wednesday, November 9, 2022"
fin_news_nlp/yahoo_cad_tickers_news,https://ca.finance.yahoo.com/news/a2z-smart-technologies-amends-warrant-213500644.html,"A2Z Smart Technologies Corp. (""A2Z"" or the ""Company"") (TSXV:AZ)(NASDAQ:AZ), today announced that further to its most recent press release (October 24, 2022), it has amended the terms of the warrant exercise price of the private placement (the ""Offering"") of up to US$5 million (the ""Gross Proceeds"") consisting of an aggregate issuance of up to 3,703,704 units (the ""Units"") at a price of US$1.35 (CAD$1.86) per Unit.",CAD,AZ.V,ACCESSWIRE - A2Z Smart Technologies Amends Warrant Terms of Previously Announced Private Placement of up to US$5 Million
fin_news_nlp/yahoo_cad_tickers_news,https://ca.finance.yahoo.com/news/manulife-investment-management-announces-cash-113000852.html,"Manulife Investment Management today announced the June 2022 cash distributions for Manulife Exchange Traded Funds (ETFs) that distribute monthly, quarterly and semi-annually. Unitholders of record of the Manulife ETFs at the close of business on June 30, 2022 will receive cash distributions payable on July 13, 2022.",CAD,UDEF.TO,CNW Group - Manulife Investment Management Announces Cash Distributions for Manulife Exchange Traded Funds
fin_news_nlp/yahoo_cad_tickers_news,https://ca.finance.yahoo.com/news/cenovus-announces-2022-third-quarter-100000359.html,"CALGARY, Alberta, Nov. 02, 2022 (GLOBE NEWSWIRE) -- Cenovus Energy Inc. (TSX: CVE) (NYSE: CVE) generated more than $4.0 billion in cash from operating activities, approximately $3.0 billion in adjusted funds flow and nearly $2.1 billion in free funds flow in the third quarter of 2022, driven by continued strong operations. Total upstream production was approximately 778,000 barrels of oil equivalent per day (BOE/d)1 and downstream throughput averaged 533,500 barrels per day (bbls/d). As part of",CAD,CVE.TO,GlobeNewswire - Cenovus announces 2022 third-quarter financial and operating results
fin_news_nlp/yahoo_cad_tickers_news,https://ca.finance.yahoo.com/news/fortuna-reports-construction-gu-la-090000315.html,"Photo 1 Project construction overview Photo 2 Photo 2 Photo 3 Photo 3 Photo 4 HV substation construction work overview Graphic 1 Project commitments as of October 31, 2022 Figure 2 Construction at Séguéla is tracking on schedule with the project’s next major milestones below VANCOUVER, British Columbia, Nov. 02, 2022 (GLOBE NEWSWIRE) -- Fortuna Silver Mines Inc. (NYSE: FSM) (TSX: FVI) is pleased to provide an update on construction activities at its Séguéla gold Project located in Côte d’Ivoire.",CAD,FVI.TO,GlobeNewswire - Fortuna reports that construction at its Séguéla gold Project is 83 percent complete
fin_news_nlp/yahoo_cad_tickers_news,https://ca.finance.yahoo.com/news/lion-electric-announces-production-first-103000383.html,"The Lion Electric Company (NYSE: LEV) (TSX: LEV) (""Lion"" or the ""Company""), a leading manufacturer of all-electric medium and heavy-duty vehicles, today announced that the company has produced its first zero-emission LionC school bus in its U.S. factory located in Joliet, Ill.",CAD,LEV.TO,CNW Group - Lion Electric Announces the Production of its First Made in America School Bus in its Joliet Illinois Factory
fin_news_nlp/yahoo_cad_tickers_news,https://ca.finance.yahoo.com/news/suncor-fort-hills-deal-hints-100628692.html,"Suncor Energy's acquisition of a larger stake in the Fort Hills oil sands project is a sign that Canada's second-largest oil company is looking for alternatives to extending the life of its biggest mine, which has run into political obstacles, industry observers said.  The purchase indicates Suncor is looking to acquire new bitumen supply to replace production from its Base Mine instead of, or in addition to, developing its own oil sands leases, energy consultancy Wood Mackenzie said, raising expectations of more deals.  Suncor's Base Mine is a key part of the company's operations in northern Alberta, producing around 200,000 barrels per day (bpd) of bitumen used to feed upgraders at its oil sands base plant that produce higher-value synthetic crude.",CAD,SU.TO,Reuters - Suncor Fort Hills deal hints at new strategy for Canada oil sands mine replacement
fin_news_nlp/yahoo_cad_tickers_news,https://ca.finance.yahoo.com/news/surge-energy-inc-announces-third-100000353.html,"Surge Energy Inc. (""Surge"" or the ""Company"") (TSX: SGY) is pleased to announce the Company's financial and operating results for the quarter ended September 30, 2022, and an update on Surge's latest drilling results.",CAD,SGY.TO,CNW Group - SURGE ENERGY INC. ANNOUNCES THIRD QUARTER FINANCIAL & OPERATING RESULTS; AND AN OPERATIONS UPDATE ON STRONG DRILLING RESULTS IN SE SASKATCHEWAN / SPARKY CORE AREAS
fin_news_nlp/yahoo_cad_tickers_news,https://ca.finance.yahoo.com/news/axis-announces-expansion-funding-facilities-120000653.html,"TORONTO, November 02, 2022--Axis Auto Finance Inc. (""Axis"" or the ""Company""), (TSX: AXIS) a fintech lender servicing the alternative auto finance market and commercial equipment finance market, announced today that it has renewed its $120 million senior secured credit facility that supports its auto finance business, while also expanding its funding facilities used in its commercial equipment business segment, operated through its wholly owned subsidiary Pivotal Capital Corp. (""Pivotal""). With t",CAD,AXIS.TO,Business Wire - Axis Announces Expansion of its Funding Facilities
fin_news_nlp/yahoo_cad_tickers_news,https://ca.finance.yahoo.com/news/bausch-lomb-announces-third-quarter-105900266.html,"Bausch + Lomb Corporation, (NYSE/TSX: BLCO) (""Bausch + Lomb"" or the ""Company"", ""we"" or ""our""), a leading global eye health company dedicated to helping people see better to live better, today announced its third-quarter 2022 financial results.",CAD,BLCO.TO,CNW Group - Bausch + Lomb Announces Third-Quarter 2022 Results
fin_news_nlp/yahoo_cad_tickers_news,https://ca.finance.yahoo.com/news/calfrac-reports-91-million-adjusted-100000593.html,"Calfrac Well Services Ltd. (""Calfrac"" or ""the Company"") (TSX: CFW) announces its financial and operating results for the three and nine months ended September 30, 2022. The following press release should be read in conjunction with the management's discussion and analysis and unaudited consolidated interim financial statements and notes thereto as at September 30, 2022. Readers should also refer to the ""Forward-looking statements"" legal advisory and the section regarding ""Non-GAAP Measures"" at t",CAD,CFW.TO,CNW Group - Calfrac Reports $91 Million of Adjusted EBITDA With Best Margin Percentage Since 2012
fin_news_nlp/yahoo_cad_tickers_news,https://ca.finance.yahoo.com/news/calibre-reports-third-quarter-date-110000694.html,"VANCOUVER, British Columbia, Nov. 02, 2022 (GLOBE NEWSWIRE) -- Calibre Mining Corp. (TSX: CXB; OTCQX: CXBMF) (“Calibre” or the “Company”) announces financial and operating results for the three and nine months ended September 30, 2022 (“Q3 2022”). Consolidated financial statements and management discussion and analysis can be found at www.sedar.com and the Company’s website, www.calibremining.com. All figures are expressed in U.S. dollars. Year-to-Date (“YTD”) 2022 Highlights Gold sales of 161,5",CAD,CXB.TO,"GlobeNewswire - Calibre Reports Third Quarter and Year-To-Date Financial Results, Increased Growth Capital Spend to Accelerate Future Production Growth, on Track to Meet Full Year Cost and Production Guidance"
fin_news_nlp/yahoo_cad_tickers_news,https://ca.finance.yahoo.com/news/canada-goose-reports-3-3m-115307595.html,"TORONTO — Canada Goose Holdings Inc. reported its quarterly profit fell compared with a year ago and lowered its full-year financial guidance due to COVID-19 restrictions in China that are weighing on the company and worries about the global economy. The luxury parka maker says it now expects total revenue for its current financial year to be between $1.2 billion and $1.3 billion, down from earlier expectations for between $1.3 billion and $1.4 billion. The company also reduced its guidance for",CAD,GOOS.TO,"The Canadian Press - Canada Goose reports $3.3M Q2 profit, cuts guidance for full year"
fin_news_nlp/yahoo_cad_tickers_news,https://ca.finance.yahoo.com/news/canada-goose-tumbles-cutting-outlook-112102462.html,"(Bloomberg) -- Canada Goose Holdings Inc. lowered its outlook for the year, saying coronavirus restrictions in China and “significant uncertainty” in the global economy will hurt sales and margins. The shares fell 8% in premarket trading in New York. Most Read from BloombergChief Justice Temporarily Stops Release of Trump Tax ReturnsLottery Winner Keeps $30 Million Jackpot Secret From Wife and ChildEven More Dry Shampoos Found to Have Cancer-Causing AgentNorth Korea Fires Off Biggest-Ever Daily",CAD,GOOS.TO,"Bloomberg - Canada Goose Tumbles After Cutting Outlook on China, Economy"
fin_news_nlp/yahoo_cad_tickers_news,https://ca.finance.yahoo.com/news/pick-5-bargain-stocks-alluring-113211458.html,"We have screened bargain stocks CVLG, TA, CLS, YPF and PEBO based on the EV-to-EBITDA ratio, which offers a clearer picture of valuation and earnings potential.",CAD,CLS.TO,Zacks - Pick These 5 Bargain Stocks With Alluring EV-to-EBITDA Ratios
fin_news_nlp/yahoo_cad_tickers_news,https://ca.finance.yahoo.com/news/cenovus-reports-1-61b-q3-111445892.html,"CALGARY — Cenovus Energy Inc. reported its third-quarter profit almost tripled compared with a year ago, helped by higher commodity prices. The company also declared a variable dividend payment of 11.4 cents per share in addition to its base dividend of 10.5 cents per share. Cenovus says it earned $1.61 billion or 81 cents per diluted share for the quarter ended Sept. 30, up from $551 million or 27 cents per diluted share a year earlier. Revenue for the quarter was $17.47 billion, up from $12.70",CAD,CVE.TO,"The Canadian Press - Cenovus reports $1.61B Q3 profit, up from $551M a year ago"
fin_news_nlp/yahoo_cad_tickers_news,https://ca.finance.yahoo.com/news/canada-stocks-tsx-futures-steady-110949612.html,"Futures tracking Canada's main stock index held steady on Wednesday as investors stayed away from big bets ahead of the U.S. Federal Reserve's interest rate decision later in the day.  The Toronto Stock Exchange's S&P/TSX composite index closed at a more than six-week high on Tuesday as hopes that China could ease its COVID-19 curbs lifted resource shares.  Meanwhile, the Bank of Canada has not ruled out another oversized rate hike to fight sky-high inflation, Governor Tiff Macklem said on Tuesday.",CAD,CVE.TO, - CANADA STOCKS-TSX futures steady ahead of Fed decision
fin_news_nlp/yahoo_cad_tickers_news,https://ca.finance.yahoo.com/news/ero-copper-host-operational-project-120000730.html,"VANCOUVER, British Columbia, Nov. 02, 2022 (GLOBE NEWSWIRE) -- Ero Copper Corp. (TSX: ERO, NYSE: ERO) (""Ero"" or the “Company”) is pleased to announce plans to host a virtual Operational, Project and Exploration Update on November 8, 2022, during which Chief Executive Officer, David Strang, and members of Ero's senior management team will discuss the Company's operating outlook, key growth projects and ongoing exploration programs. At the event, the Ero management team will also be joined by Mans",CAD,ERO.TO,"GlobeNewswire - Ero Copper to Host Operational, Project and Exploration Update"
fin_news_nlp/yahoo_cad_tickers_news,https://ca.finance.yahoo.com/news/fansunite-announces-customer-acquisition-partnership-120000964.html,"As part of FansUnite's operational optimization strategy, Thimba Media will oversee all marketing and customer acquisition operations for Vamosgg.com, starting in December 2022 Vancouver, British Columbia--(Newsfile Corp. - November 2, 2022) - FansUnite Entertainment Inc. (TSX: FANS) (OTCQX: FUNFF) (""FansUnite"" or the ""Company"") is pleased to announce that the Company has entered into a partnership with Thimba Media Limited (""Thimba Media""), a leading acquisition marketing and business process s",CAD,FANS.TO,Newsfile - FansUnite Announces Customer Acquisition Partnership with Thimba Media Limited
fin_news_nlp/yahoo_cad_tickers_news,https://ca.finance.yahoo.com/news/intelgenx-files-provisional-u-patent-120000479.html,"SAINT LAURENT, Quebec, Nov. 02, 2022 (GLOBE NEWSWIRE) -- IntelGenx Corp. (TSX:IGX) (OTCQB:IGXT) (the ""Company"" or ""IntelGenx”), a leader in pharmaceutical films, today announced it has filed a new provisional patent application with the United States Patent and Trademark Office (“USPTO”) entitled “Advanced Oral Film Formulations” (the ""Patent Application""). The Patent Application contains new inventive claims with respect to administering cannabinoids for quicker onset of action, and further dem",CAD,IGX.TO,GlobeNewswire - IntelGenx Files Provisional U.S. Patent Application for Advanced Oral Film Formulation Improving Cannabinoid Onset of Action
fin_news_nlp/yahoo_cad_tickers_news,https://ca.finance.yahoo.com/news/karora-resources-announces-conference-call-113000654.html,"Karora Resources Inc. (TSX: KRR) (""Karora"" or the ""Corporation"") is pleased to announce senior management will host a conference call / webcast on November 7, 2022 at 10:00 a.m. (Eastern Time) to discuss the Corporation's third quarter 2022 results. The access information is provided below.",CAD,KRR.TO,CNW Group - Karora Resources Announces Conference Call / Webcast Details for Third Quarter 2022 Results
fin_news_nlp/yahoo_cad_tickers_news,https://ca.finance.yahoo.com/news/61-ownership-shares-major-drilling-115247780.html,"If you want to know who really controls Major Drilling Group International Inc. ( TSE:MDI ), then you'll have to look...",CAD,MDI.TO,"Simply Wall St. - With 61% ownership of the shares, Major Drilling Group International Inc. (TSE:MDI) is heavily dominated by institutional owners"
