source,url,description,country,company,title
fin_news_nlp/yahoo_cad_tickers_news,https://ca.finance.yahoo.com/news/co2-gro-receives-500-000-135500882.html,"CO2 GRO Inc. (TSXV:GROW)(OTCQB:BLONF, Forum), a leader in innovative CO2 Delivery Solutions™ for the global protected agricultural sector, announces a meaningful sales order. In response to many growers' cost of borrowing doubling, CO2 GRO now provides a multi-year Pay for Use contract option that will help more greenhouse owners access our technology.",CAD,GROW.V,"ACCESSWIRE - CO2 GRO Receives ~$500,000 CAD Sales Order from a Major Canadian Vegetable Greenhouse Grower"
fin_news_nlp/yahoo_cad_tickers_news,https://ca.finance.yahoo.com/news/dynasty-gold-begins-2023-thundercloud-140000228.html,"Vancouver, British Columbia--(Newsfile Corp. - May 24, 2023) - Dynasty Gold Corp. (TSXV: DYG) (FSE: D5G1) (OTC Pink: DGDCF) (""Dynasty"" or the ""Company"") is pleased to announce that preparation for this year's drill program on the Thundercloud property has begun. The property is situated 47 kilometers southeast of Dryden in northwest Ontario. Thundercloud is an orogenic gold system in a greenstone belt of Archean age. The upcoming drilling will follow up on ...",CAD,DYG.V,Newsfile - Dynasty Gold Begins 2023 Thundercloud Exploration
fin_news_nlp/yahoo_cad_tickers_news,https://ca.finance.yahoo.com/news/first-helium-enters-long-term-130000347.html,"First Helium Inc. (""First Helium"" or the ""Company"") (TSXV: HELI) (OTCQX: FHELF) (FRA: 2MC), is pleased to announce that it has entered into a long-term ""take-or-pay"" helium supply agreement (the ""Agreement"") with a major global industrial gas supplier (the ""Purchaser"") to sell helium gas production from its Worsley Property. The Company has agreed to sell to the Purchaser 80% (with an ability to potentially sell up to 100%) of its produced helium volumes, subject to maximum monthly and annual vo",CAD,HELI.V,CNW Group - First Helium Enters into Long-Term Helium Supply Agreement with Major Global Industrial Gas Company
fin_news_nlp/yahoo_cad_tickers_news,https://ca.finance.yahoo.com/news/fremont-stakes-additional-lithium-targets-132900065.html,"Vancouver, British Columbia--(Newsfile Corp. - May 24, 2023) - Fremont Gold Ltd. (TSXV: FRE) (OTCQB: FRERF) (FSE: FR20) (""Fremont"" or the ""Company"") is pleased to announce that it has staked 600 lode claims for lithium-bearing clays and an additional 105 brine claims over two hydrologically enclosed caldera basins in central Nevada: the northern Diamond Valley and Tub project in the Crescent Valley.As described in the Company's news release of May 9, 2023, ...",CAD,FRE.V,Newsfile - Fremont Stakes Additional Lithium Targets in Nevada
fin_news_nlp/yahoo_cad_tickers_news,https://ca.finance.yahoo.com/news/bmo-reports-q2-profit-down-105031112.html,"TORONTO — A combination of pressures including slowing economic growth and rising costs weighed on Canadian banks as they began to report second quarter results Wednesday. Both BMO Financial Group and Bank of Nova Scotia reported higher expenses, more money set aside for bad loans, and thinner margins on interest that led both to earn less than they did a year ago and fall short of analysts' expectations. BMO chief executive Darryl White characterized it as a ""shifting environment"" that is putti",CAD,BMO.TO,"The Canadian Press - BMO and Scotiabank report slowing growth, credit provisions put pressure on earnings"
fin_news_nlp/yahoo_cad_tickers_news,https://ca.finance.yahoo.com/news/computer-technology-stocks-lagging-blackberry-134009518.html,Here is how BlackBerry (BB) and Fastly (FSLY) have performed compared to their sector so far this year.,CAD,BB.TO,Zacks - Are Computer and Technology Stocks Lagging  BlackBerry (BB) This Year?
fin_news_nlp/yahoo_cad_tickers_news,https://ca.finance.yahoo.com/news/1-under-18-dividend-stock-133000779.html,Dividend stock or distribution stock: which is a better option for monthly passive income? Let's try to find an answer in this article. The post 1 Under-$18 Dividend Stock to Buy for Monthly Passive Income appeared first on The Motley Fool Canada.,CAD,CTC.TO,The Motley Fool - 1 Under-$18 Dividend Stock to Buy for Monthly Passive Income
fin_news_nlp/yahoo_cad_tickers_news,https://ca.finance.yahoo.com/news/declining-stock-decent-financials-market-154456815.html,"With its stock down 3.3% over the past week, it is easy to disregard Computer Modelling Group (TSE:CMG). But if you pay...",CAD,CMG.TO,Simply Wall St. - Declining Stock and Decent Financials: Is The Market Wrong About Computer Modelling Group Ltd. (TSE:CMG)?
fin_news_nlp/yahoo_cad_tickers_news,https://ca.finance.yahoo.com/news/dialogue-announces-annual-general-shareholder-155300296.html,"Dialogue Health Technologies Inc. (TSX: CARE) (""Dialogue"" or the ""Company""), Canada's premier virtual healthcare and wellness platform, announced today that shareholders voted in favour of all items of business put forth by the Company at its annual general meeting of shareholders held on May 23, 2023 (the ""Meeting"").",CAD,CARE.TO,CNW Group - Dialogue Announces Annual General Shareholder Meeting Voting Results
fin_news_nlp/yahoo_cad_tickers_news,https://ca.finance.yahoo.com/news/piedmont-lithium-pll-outperforming-other-134011160.html,Here is how Piedmont Lithium Inc. (PLL) and Energy Fuels (UUUU) have performed compared to their sector so far this year.,CAD,EFR.TO,Zacks - Is Piedmont Lithium (PLL) Outperforming Other Basic Materials Stocks This Year?
fin_news_nlp/yahoo_cad_tickers_news,https://ca.finance.yahoo.com/news/horizonte-minerals-plc-announces-result-161000252.html,"Horizonte Minerals Plc (AIM:HZM)(TSX:HZM) (""Horizonte"" or the ""Company"")is pleased to announce that at the Company's Annual General Meeting held today at Rex House, 4-12 Regent Street, London, SW1Y 4RG, all resolutions were voted on by way of a poll and were duly passed.",CAD,HZM.TO,ACCESSWIRE - Horizonte Minerals PLC Announces Result of AGM
fin_news_nlp/yahoo_cad_tickers_news,https://ca.finance.yahoo.com/news/boost-long-term-wealth-green-140000377.html,Investing in clean energy leaders such as Brookfield Renewable Partners can help TSX investors build long-term wealth. The post Boost Your Long-Term Wealth With These Green Energy Stocks appeared first on The Motley Fool Canada.,CAD,INE.TO,The Motley Fool - Boost Your Long-Term Wealth With These Green Energy Stocks
fin_news_nlp/yahoo_cad_tickers_news,https://ca.finance.yahoo.com/news/international-tower-hill-mines-announces-162500329.html,"International Tower Hill Mines Ltd. (the ""Company"") - (TSX: ITH) (NYSE American: THM) announces the results from its 2023 Annual General Meeting of shareholders held in Vancouver, B.C. on Tuesday, May 23, 2023 (""Meeting"").",CAD,ITH.TO,CNW Group - International Tower Hill Mines Announces Results from 2023 Annual General Meeting of Shareholders
fin_news_nlp/yahoo_cad_tickers_news,https://ca.finance.yahoo.com/news/lightspeed-customers-dominate-2023-canada-150000981.html,"Lightspeed customers make up more than 15% of the 2023 restaurant list, with Montreal darling ‘Mon Lapin’ taking the top spot as the best restaurant in Canada Lightspeed Commerce Inc. Notable Lightspeed customers on Canada's 100 Best Restaurants list MONTREAL, May 24, 2023 (GLOBE NEWSWIRE) -- Lightspeed Commerce Inc. (NYSE | TSX: LSPD) is proud to partner with 18 incredible hospitality businesses which have been named to the 2023 Canada's 100 Best Restaurants and 50 Best Bars lists — including t",CAD,LSPD.TO,GlobeNewswire - Lightspeed Customers Dominate 2023 Canada’s 100 Best Restaurant Lists
fin_news_nlp/yahoo_cad_tickers_news,https://ca.finance.yahoo.com/news/blue-sky-uranium-provides-activities-110000110.html,"Blue Sky Uranium Corp. (TSXV: BSK) (FSE: MAL2) (OTC: BKUCF), ""Blue Sky"" or the ""Company"") is pleased to provide an update on exploration and development work carried out at its wholly owned Amarillo Grande Uranium-Vanadium Project in Rio Negro Province, Argentina (""AGP""), which includes the Ivana uranium-vanadium deposit.",CAD,BSK.V,"CNW Group - Blue Sky Uranium Provides an Update on Activities at its Amarillo Grande Uranium Project, Argentina"
fin_news_nlp/yahoo_cad_tickers_news,https://ca.finance.yahoo.com/news/canada-nickel-announces-discovery-mann-110000757.html,"Canada Nickel Company Inc. (""Canada Nickel"" or the ""Company"") (TSXV: CNC) (OTCQX: CNIKF) today released assay results from its 100% owned Sothman Property located 70 kilometres south of Timmins, Ontario, its optioned Midlothian Property and initial drilling results from the first 4 holes at its optioned Mann Northwest property.",CAD,CNC.V,"CNW Group - Canada Nickel Announces New Discovery at Mann Northwest Property, Provides Update on Regional Drilling at Midlothian and Sothman"
fin_news_nlp/yahoo_cad_tickers_news,https://ca.finance.yahoo.com/news/magna-mining-reports-assay-results-103100908.html,"Sudbury, Ontario--(Newsfile Corp. - May 18, 2023) - Magna Mining Inc. (TSXV: NICU) (""Magna"" or the ""Company"") is pleased to announce additional assays results from the ongoing diamond drilling program at Crean Hill. Results include assays from five drillholes completed on the G1 Zone, a narrow embayment structure at the Sudbury Igneous Complex (""SIC"") contact, approximately 1000 metres east of the Crean Hill Main Zone (See news release dated February 23, 2023), and one ...",CAD,NICU.V,Newsfile - Magna Mining Reports New Assay Results from Crean Hill
fin_news_nlp/yahoo_cad_tickers_news,https://ca.finance.yahoo.com/news/bmo-reports-q2-profit-down-105031311.html,"TORONTO — A combination of pressures including slowing economic growth and rising costs weighed on Canadian banks as they began to report second quarter results Wednesday. Both BMO Financial Group and Bank of Nova Scotia reported higher expenses, more money set aside for bad loans, and thinner margins on interest that led both to earn less than they did a year ago and fall short of analysts' expectations. BMO chief executive Darryl White characterized it as a ""shifting environment"" that is putti",CAD,BMO.TO,"The Canadian Press - BMO and Scotiabank report slowing growth, credit provisions put pressure on earnings"
fin_news_nlp/yahoo_cad_tickers_news,https://ca.finance.yahoo.com/news/hsbc-scotiabank-bns-win-silver-171300073.html,The lawsuit by investors against HSBC and Scotiabank (BNS) over silver-price-fixing has been dismissed by a U.S. judge in Manhattan.,CAD,BNS.TO,"Zacks - HSBC, Scotiabank (BNS) Win Silver-Price-Fixing Lawsuit Dismissal"
fin_news_nlp/yahoo_cad_tickers_news,https://ca.finance.yahoo.com/news/cae-endeavor-air-celebrate-major-170000981.html,"(NYSE: CAE) (TSX: CAE) – CAE and Endeavor Air today inaugurated their expanded training centre in Minneapolis-St. Paul, Minnesota. The training centre recently underwent a 50,000 square-foot expansion to make space for Endeavor's Flight Operations and Inflight Training departments and three additional CRJ full-flight simulators (FFS) that will allow Endeavor Air to consolidate all its pilot and cabin crew training, which previously took place in multiple locations, at the state-of-the-art centre",CAD,CAE.TO,CNW Group - CAE and Endeavor Air celebrate major expansion to Minneapolis-St. Paul training centre
fin_news_nlp/yahoo_cad_tickers_news,https://ca.finance.yahoo.com/news/cixxf-bx-better-value-stock-154014764.html,CIXXF vs. BX: Which Stock Is the Better Value Option?,CAD,CIX.TO,Zacks - CIXXF or BX: Which Is the Better Value Stock Right Now?
fin_news_nlp/yahoo_cad_tickers_news,https://ca.finance.yahoo.com/news/think-buying-gildan-activewear-inc-155206468.html,"Gildan Activewear Inc. ( TSE:GIL ), is not the largest company out there, but it saw significant share price movement...",CAD,GIL.TO,Simply Wall St. - Should You Think About Buying Gildan Activewear Inc. (TSE:GIL) Now?
fin_news_nlp/yahoo_cad_tickers_news,https://ca.finance.yahoo.com/news/money-magna-stock-163000089.html,"Magna International stock is a good company. However, the dividend stock is not for everyone because of its volatile nature. The post Can You Make Money in Magna Stock? appeared first on The Motley Fool Canada.",CAD,MG.TO,The Motley Fool - Can You Make Money in Magna Stock?
fin_news_nlp/yahoo_cad_tickers_news,https://ca.finance.yahoo.com/news/signal-gold-announces-results-annual-172500486.html,"Signal Gold Inc. (""Signal Gold"" or the ""Company"") (TSX:SGNL)(OTCQX:SGNLF) is pleased to announce that all resolutions proposed to shareholders at the annual and special meeting held today were duly passed.",CAD,SGNL.TO,ACCESSWIRE - Signal Gold Announces Results from Annual and Special  Meeting of Shareholders
fin_news_nlp/yahoo_cad_tickers_news,https://ca.finance.yahoo.com/news/heres-why-retain-westport-wprt-154200755.html,"Westport's (WPRT) HPDI fuel system technology, along with established distribution channels, is set to boost prospects. However, growing expenses are likely to dent margins.",CAD,WPRT.TO,Zacks - Here's Why You Should Retain Westport (WPRT) Stock for Now
fin_news_nlp/yahoo_cad_tickers_news,https://ca.finance.yahoo.com/news/growgeneration-grwg-buys-stores-alaska-172000685.html,"GrowGeneration (GRWG) acquires two stores in Alaska, increasing the number of states it operates in to 18.",CAD,AGI.TO,Zacks - GrowGeneration (GRWG) Buys Stores in Alaska to Boost Portfolio
fin_news_nlp/yahoo_cad_tickers_news,https://ca.finance.yahoo.com/news/bmo-reports-q2-profit-down-105031083.html,"TORONTO — Weakening economic conditions weighed on Canadian banks as they began to report second quarter results Wednesday. Both BMO Financial Group and Bank of Nova Scotia reported higher expenses, more money set aside for bad loans, and slowing loan growth in Canada that led both to earn less than they did a year ago and fall short of analysts' expectations. BMO chief executive Darryl White characterized it as a ""shifting environment"" that is putting pressure on revenue growth. ""The impact of",CAD,BMO.TO,"The Canadian Press - BMO and Scotiabank report slowing growth, credit provisions put pressure on earnings"
fin_news_nlp/yahoo_cad_tickers_news,https://ca.finance.yahoo.com/m/cb2213a9-c180-326f-b0f4-73d4ec6f3e89/why-shares-of.html,"Shares of the large Canadian lender Toronto-Dominion Bank (NYSE: TD) traded roughly 2.4% lower today in the final hour of trading as the bank gears up to report its earnings results for its second fiscal quarter of 2023 tomorrow morning.  TD has also recently been sued over its failed acquisition of First Horizon (NYSE: FHN).  Canadian banks are currently in their earnings season, and both Bank of Montreal and Bank of Nova Scotia reported earnings results today that came in weaker than expected.",CAD,BNS.TO,Motley Fool - Why Shares of Toronto-Dominion Bank Are Down Today
fin_news_nlp/yahoo_cad_tickers_news,https://ca.finance.yahoo.com/news/better-buy-rogers-communications-bce-173000763.html,"With a potential merger on the way for Rogers stock, should investors throw out their BCE stock in favour of the merger? The post Better Buy: Rogers Communications or BCE Stock? appeared first on The Motley Fool Canada.",CAD,BCE.TO,The Motley Fool - Better Buy: Rogers Communications or BCE Stock?
fin_news_nlp/yahoo_cad_tickers_news,https://ca.finance.yahoo.com/news/brompton-funds-declare-distributions-190900008.html,"TORONTO, May 24, 2023 (GLOBE NEWSWIRE) -- (TSX: DGS, DGS.PR.A, GDV, LBS, LCS, PWI, SBC) – Brompton Funds announces distributions payable on June 14, 2023 to class A shareholders of record at the close of business on May 31, 2023 for each of the following funds: Fund NameTickerAmount Per ShareGlobal Dividend Growth Split Corp. (“GDV”)GDV$0.10Life & Banc Split Corp. (“LBS”)LBS$0.10Brompton Lifeco Split Corp. (“LCS”)LCS$0.075Sustainable Power & Infrastructure Split Corp. (“PWI”)PWI$0.06667Brompton",CAD,LCS.TO,GlobeNewswire - Brompton Funds Declare Distributions
fin_news_nlp/yahoo_cad_tickers_news,https://ca.finance.yahoo.com/news/cae-endeavor-air-celebrate-major-170000057.html,"(NYSE: CAE) (TSX: CAE) – CAE and Endeavor Air today inaugurated their expanded training centre in Minneapolis-St. Paul, Minnesota. The training centre recently underwent a 50,000 square-foot expansion to make space for Endeavor's Flight Operations and Inflight Training departments and three additional CRJ full-flight simulators (FFS) that will allow Endeavor Air to consolidate all its pilot and cabin crew training, which previously took place in multiple locations, at the state-of-the-art centre",CAD,CAE.TO,CNW Group - CAE and Endeavor Air celebrate major expansion to Minneapolis-St. Paul training centre
fin_news_nlp/yahoo_cad_tickers_news,https://ca.finance.yahoo.com/news/want-1-million-retirement-invest-180000213.html,"Investing in quality growth stocks such as Nuvei can help investors turn a $50,000 investment into $1 million within a decade. The post Want $1 Million for Retirement? Invest $50,000 in These 2 Stocks and Wait a Decade appeared first on The Motley Fool Canada.",CAD,NVEI.TO,"The Motley Fool - Want $1 Million for Retirement? Invest $50,000 in These 2 Stocks and Wait a Decade"
fin_news_nlp/yahoo_cad_tickers_news,https://ca.finance.yahoo.com/news/quarterhill-announces-cfo-departure-202900184.html,"Quarterhill Inc. (""Quarterhill"") (TSX: QTRH) (OTCQX: QTRHF) announces that John Karnes, Chief Financial Officer (""CFO""), is departing the Company and Kyle Chriest, VP Corporate Finance, has been appointed Interim CFO. These changes are effective immediately.",CAD,QTRH.TO,CNW Group - Quarterhill Announces CFO Departure
fin_news_nlp/yahoo_cad_tickers_news,https://ca.finance.yahoo.com/news/real-brokerage-commences-normal-course-203000753.html,"TORONTO & NEW YORK, May 24, 2023--The Real Brokerage Inc. (the ""Company"" or ""Real"") (TSX: REAX) (NASDAQ: REAX), the fastest growing publicly traded real estate brokerage, today announced that the Toronto Stock Exchange (""TSX"") has approved the Company’s normal course issuer bid (the ""NCIB"").",CAD,REAX.TO,Business Wire - The Real Brokerage Commences Normal Course Issuer Bid
fin_news_nlp/yahoo_cad_tickers_news,https://ca.finance.yahoo.com/news/bqe-water-completes-performance-test-130000491.html,"BQE Water Inc. (TSXV: BQE), a leader in the treatment and management of mine impacted waters, has successfully completed the performance test of the first industrial scale water treatment plant combining nanofiltration with electroreduction to simultaneously remove sulphate and selenium from mine contact water at a mine in the US.",CAD,BQE.V,CNW Group - BQE Water Completes Performance Test for Plant that Simultaneously Removes Sulphate and Selenium at a US Mine
fin_news_nlp/yahoo_cad_tickers_news,https://ca.finance.yahoo.com/news/power-play-market-herald-releases-191000430.html,"The Power Play by The Market Herald has announced the release of new interviews with Solar Alliance, Cleantek Industries, Voyageur Pharmaceuticals and Homerun Resources discussing their latest news.",CAD,CTEK.V,"ACCESSWIRE - The Power Play by The Market Herald Releases New Interviews with Solar Alliance, Cleantek Industries, Voyageur Pharmaceuticals and Homerun Resources Discussing Their Latest News"
fin_news_nlp/yahoo_cad_tickers_news,https://ca.finance.yahoo.com/news/luca-mining-corp-announces-tahuehueto-203000841.html,"Luca Mining Corp. (the “Company” or “Luca,” formerly Altaley Mining Corp.) is pleased to provide an update on construction progress at the Company’s flagship asset, the Tahuehueto Gold Project.",CAD,LUCA.V,"News Direct - Luca Mining Corp. announces Tahuehueto Construction on Schedule 
and Digital Marketing Agreements"
fin_news_nlp/yahoo_cad_tickers_news,https://ca.finance.yahoo.com/news/alamos-gold-announces-closing-manitou-211000401.html,"TORONTO, May 24, 2023 (GLOBE NEWSWIRE) -- Alamos Gold Inc. (TSX:AGI; NYSE:AGI) (“Alamos” or the “Company”) today reported the completion of the previously announced acquisition (the “Transaction”) of all the issued and outstanding common shares of Manitou Gold Inc. (TSXV:MTU) (“Manitou”). A Final Order was granted by the Ontario Superior Court of Justice on May 19, 2023 approving the Plan of Arrangement pursuant to which the Transaction was implemented. “We are very pleased to announce the closi",CAD,AGI.TO,GlobeNewswire - Alamos Gold Announces Closing of Manitou Gold Acquisition
fin_news_nlp/yahoo_cad_tickers_news,https://ca.finance.yahoo.com/news/alithya-honoured-prestigious-mercuriades-award-222300134.html,"Alithya Group inc. (TSX: ALYA) (NASDAQ: ALYA) (""Alithya"") is proud to announce that it has won a prestigious Mercuriades award in the Training and Workforce Development category for the Alithya Leadership Academy, an initiative launched in May 2018 in partnership with McGill University's Faculty of Management. The award was presented to Alithya during the Mercuriades Gala ceremony held on May 23rd, 2023, at the Palais des Congrès de Montréal.",CAD,ALYA.TO,CNW Group - Alithya honoured with prestigious Mercuriades award for its leadership development program
fin_news_nlp/yahoo_cad_tickers_news,https://ca.finance.yahoo.com/news/avalon-announces-ceo-retirement-110000033.html,"Toronto, Ontario--(Newsfile Corp. - May 19, 2023) - Avalon Advanced Materials Inc. (TSX: AVL) (OTCQB: AVLNF) (""Avalon"" or the ""Company""), a lithium-focused mineral development company advancing critical mineral projects to support the North American battery supply chain, today announces the retirement of its long-standing CEO, Don Bubar. Don will continue to serve on Avalon's Board of Directors. Scott Monteith, who was appointed to Avalon's Board of Directors in May 2023, will assume the ...",CAD,AVL.TO,Newsfile - Avalon Announces CEO Retirement
fin_news_nlp/yahoo_cad_tickers_news,https://ca.finance.yahoo.com/news/3-top-tsx-dividend-stocks-210000763.html,Dividend stocks are trading at bargain prices. Here are 3 to buy on the dip for your RRSP. The post 3 Top TSX Dividend Stocks to Start a Self-Directed RRSP appeared first on The Motley Fool Canada.,CAD,BMO.TO,The Motley Fool - 3 Top TSX Dividend Stocks to Start a Self-Directed RRSP
fin_news_nlp/yahoo_cad_tickers_news,https://ca.finance.yahoo.com/news/most-actively-traded-companies-toronto-204607165.html,"TORONTO — Some of the most active companies traded Wednesday on the Toronto Stock Exchange: Toronto Stock Exchange (19,927.69, down 218.32): Manulife Financial Corp. (TSX:MFC). Finance. Down 57 cents, or 2.23 per cent, to $25.02 on 12.9 million shares. Suncor Energy Inc. (TSX:SU). Energy. Down three cents, or 0.08 per cent, to $39.32 on 10.9 million shares. Great-West Lifeco Inc. (TSX:GWO). Finance. Down 37 cents, or 0.94 per cent, to $38.95 on 10.9 million shares. Shopify Inc. (TSX:SHOP). Techn",CAD,BNS.TO, - Most actively traded companies on the Toronto Stock Exchange
fin_news_nlp/yahoo_cad_tickers_news,https://ca.finance.yahoo.com/news/tfsa-passive-income-2-high-184500264.html,Top TSX dividend stocks now look cheap for TFSA investors seeking passive income. The post TFSA Passive Income: 2 High-Yield Canadian Stocks With Great Dividend Growth appeared first on The Motley Fool Canada.,CAD,BCE.TO,The Motley Fool - TFSA Passive Income: 2 High-Yield Canadian Stocks With Great Dividend Growth
fin_news_nlp/yahoo_cad_tickers_news,https://ca.finance.yahoo.com/news/bitfarms-announces-results-annual-general-212200576.html,"This news release constitutes a “designated news release” for purposes of the Company’s prospectus supplement dated August 16, 2021, to its short form base shelf prospectus dated August 12, 2021. TORONTO, Ontario and BROSSARD, Québec, May 24, 2023 (GLOBE NEWSWIRE) -- Bitfarms Ltd. (“Bitfarms” or the “Company”) (NASDAQ: BITF//TSX: BITF), a global vertically integrated Bitcoin mining company, today announces the results of its annual general and special meeting of shareholders (the “Meeting”), hel",CAD,BITF.TO,GlobeNewswire - Bitfarms Announces Results of Annual General and Special Meeting of Shareholders
fin_news_nlp/yahoo_cad_tickers_news,https://ca.finance.yahoo.com/news/bonterra-energy-corp-announces-approval-210000608.html,"Bonterra Energy Corp. (www.bonterraenergy.com) (TSX: BNE) (""Bonterra"" or the ""Company"") announced that at its annual and special meeting of shareholders held on May 18, 2023, a total of 15,687,804 shares, representing 42.19% of common shares outstanding, were represented in person or by proxy. Shareholders approved all resolutions listed in the management information circular dated April 3, 2023, including the election of each of the six nominees proposed as directors. The detailed results of th",CAD,BNE.TO,CNW Group - Bonterra Energy Corp. Announces Approval of All Resolutions at Annual & Special Meeting of Shareholders and Voting Results
fin_news_nlp/yahoo_cad_tickers_news,https://ca.finance.yahoo.com/news/briacell-closes-4-million-strategic-153800299.html,"PHILADELPHIA and VANCOUVER, British Columbia, May 19, 2023 (GLOBE NEWSWIRE) -- BriaCell Therapeutics Corp. (Nasdaq: BCTX, BCTXW) (TSX: BCT) (“BriaCell” or the “Company”), a clinical-stage biotechnology company specializing in targeted immunotherapies for cancer, is pleased to announce that the Company has completed the previously-announced strategic investment by Prevail Partners, LLC (“Prevail Partners”) in the Company (the “Investment”), in accordance with a stock purchase agreement (the “Agre",CAD,BCT.TO,"GlobeNewswire - BriaCell Closes $4 Million Strategic Investment by Prevail Partners, LLC at US$8.63 per Share"
