source,url,description,country,company,title
fin_news_nlp/yahoo_cad_tickers_news,https://ca.finance.yahoo.com/news/nfi-completes-amendments-credit-facilities-194800077.html,"All amounts shown in this press release are in U.S. dollars unless otherwise indicated. WINNIPEG, Manitoba, Dec. 29, 2022 (GLOBE NEWSWIRE) -- December 29, 2022: (TSX: NFI, OTC: NFYEF, TSX: NFI.DB) NFI Group Inc. (“NFI” or the “Company”), a leading independent bus and coach manufacturer and a leader in electric mass mobility solutions, today announced that it has completed the amendments to the Company’s existing senior revolving credit facility (the “Revolver”) and its revolving UK credit facili",CAD,NFI.TO,GlobeNewswire - NFI completes amendments to its credit facilities
fin_news_nlp/yahoo_cad_tickers_news,https://ca.finance.yahoo.com/news/tecsys-inc-tse-tcs-recent-182016894.html,"With its stock down 14% over the past three months, it is easy to disregard Tecsys (TSE:TCS). We, however decided to...",CAD,TCS.TO,Simply Wall St. - Is Tecsys Inc.'s (TSE:TCS) Recent Price Movement Underpinned By Its Weak Fundamentals?
fin_news_nlp/yahoo_cad_tickers_news,https://ca.finance.yahoo.com/news/agi-announces-plan-agi-digital-220000442.html,"WINNIPEG, Manitoba, December 29, 2022--After a comprehensive review, Ag Growth International Inc. (""AGI"", the ""Company"", ""we"", or ""our"") (TSX: AFN) today announced a revised strategic plan to reorganize and reposition the AGI Digital business segment for operational excellence and future profitability.",CAD,AFN.TO,Business Wire - AGI Announces Plan for AGI Digital Reorganization
fin_news_nlp/yahoo_cad_tickers_news,https://ca.finance.yahoo.com/news/b2gold-reports-two-fatalities-off-221700515.html,"B2Gold Corp. (TSX: BTO) (NYSE AMERICAN: BTG) (NSX: B2G) (""B2Gold"" or the ""Company"") deeply regrets to report that two B2Gold employees have passed away as a result of injuries sustained in an off-site robbery incident in Mali earlier today. All reports have identified this tragic event as the result of a robbery incident and not related to any terrorist activity.",CAD,BTO.TO,CNW Group - B2Gold Reports Two Fatalities from Off-Site Incident in Mali
fin_news_nlp/yahoo_cad_tickers_news,https://ca.finance.yahoo.com/news/most-actively-traded-companies-toronto-214539619.html,"TORONTO — Some of the most active companies traded Thursday on the Toronto Stock Exchange: Toronto Stock Exchange (19,485.89, up 201.79): TC Energy Corp. (TSX:TRP). Energy. Down 74 cents, or 1.36 per cent, to $53.70 on 14.1 million shares. Bank of Nova Scotia. (TSX:BNS). Financials. Up $1.19, or 1.82 per cent, to $66.63 on 9.3 million shares. Toronto-Dominion Bank. (TSX:TD). Financials. Up 98 cents, or 1.12 per cent, to $88.54 on 8.5 million shares. Barrick Gold Corp. (TSX:ABX). Basic Materials.",CAD,BNS.TO, - Most actively traded companies on the Toronto Stock Exchange
fin_news_nlp/yahoo_cad_tickers_news,https://ca.finance.yahoo.com/news/3-undervalued-tsx-stocks-buy-190000314.html,Top TSX dividend stocks to buy for passive income are now on sale. The post 3 Undervalued TSX Stocks You Can Buy at a Screaming Discount for Passive Income in 2023 appeared first on The Motley Fool Canada.,CAD,BNS.TO,The Motley Fool - 3 Undervalued TSX Stocks You Can Buy at a Screaming Discount for Passive Income in 2023
fin_news_nlp/yahoo_cad_tickers_news,https://ca.finance.yahoo.com/news/oil-set-yearly-gain-investors-001416667.html,(Bloomberg) -- Oil is set to end a volatile year modestly higher as investors look ahead to an expected rebound in Chinese demand next year and brace for the possibility that less Russian crude will make it to buyers.Most Read from BloombergMilan Reports 50% of Passengers on China Flights Have CovidBritain’s Youngest Workers Are Too Sick to WorkOne of World’s Most Crowded Cities Gets First Mass-Transit RailWall Street’s Top Stars Got Blindsided by 2022 Market CollapseItaly Says Covid Cases on Ch,CAD,CM.TO,Bloomberg - Oil Set for Yearly Gain as Investors Look Ahead to China Rebound
fin_news_nlp/yahoo_cad_tickers_news,https://ca.finance.yahoo.com/news/chorus-aviation-closes-redemption-6-221500518.html,"Chorus Aviation Inc. (""Chorus"") (TSX: CHR) today announced that it has closed the redemption of $115,000,000 principal amount of Chorus' 6.00% Senior Debentures due December 31, 2024 (the ""Debentures""), representing all of the Debentures that were outstanding immediately prior to the redemption. Chorus previously announced its intention to redeem the Debentures on December 14, 2022.",CAD,CHR.TO,CNW Group - Chorus Aviation closes redemption of its 6.00% Senior Debentures
fin_news_nlp/yahoo_cad_tickers_news,https://ca.finance.yahoo.com/news/fire-flower-announces-special-meeting-213500315.html,"Fire & Flower Holdings Corp. (""Fire & Flower"" or the ""Company"") (TSX: FAF) (OTCWX: FFLWF), today announced the voting results from its special meeting of the Company's shareholders (the ""Shareholders""), held earlier today (the ""Meeting"") to consider the previously announced: (a) private placement of 3,034,017 common shares of the Company (""Common Shares"") to 2707031 Ontario Inc., an indirect wholly-owned subsidiary of Alimentation Couche-Tard Inc. ""ACT"") at a price of $1.64798 per Common Share,",CAD,FAF.TO,CNW Group - Fire & Flower Announces Special Meeting Voting Results
fin_news_nlp/yahoo_cad_tickers_news,https://ca.finance.yahoo.com/news/3-top-canadian-stocks-buy-210000602.html,"Even though quarterly dividend payouts are the norm, a monthly payout frequency can be more manageable for passive income earners. The post 3 Top Canadian Stocks to Buy for Monthly Passive Income appeared first on The Motley Fool Canada.",CAD,FN.TO,The Motley Fool - 3 Top Canadian Stocks to Buy for Monthly Passive Income
fin_news_nlp/yahoo_cad_tickers_news,https://ca.finance.yahoo.com/news/nevada-copper-receives-us-20-230000077.html,"YERINGTON, Nev., Dec. 29, 2022 (GLOBE NEWSWIRE) -- Nevada Copper (TSX: NCU) (OTC: NEVDF) (FSE: ZYTA) (“Nevada Copper” or the “Company”) is pleased to announce that the second tranche of funding of an aggregate of US$20 million provided by Mercuria Energy (“Mercuria”) and Triple Flag Precious Metals Corp. (“Triple Flag”) has been released from escrow to Nevada Copper as part of the Company’s restart financing package (the “Restart Financing Package”), the first tranche of which closed on October",CAD,NCU.TO,GlobeNewswire - Nevada Copper Receives US$20 Million from Closing of Second Tranche of Restart Financing Package and Provides Update
fin_news_nlp/yahoo_cad_tickers_news,https://ca.finance.yahoo.com/news/b2gold-reports-two-fatalities-off-221700247.html,"B2Gold Corp. (TSX: BTO) (NYSE AMERICAN: BTG) (NSX: B2G) (""B2Gold"" or the ""Company"") deeply regrets to report that two B2Gold employees have passed away as a result of injuries sustained in an off-site robbery incident in Mali earlier today. All reports have identified this tragic event as the result of a robbery incident and not related to any terrorist activity.",CAD,BTO.TO,CNW Group - B2Gold Reports Two Fatalities from Off-Site Incident in Mali
fin_news_nlp/yahoo_cad_tickers_news,https://ca.finance.yahoo.com/news/ci-financial-tse-cix-announced-102537704.html,CI Financial Corp. ( TSE:CIX ) has announced that it will pay a dividend of CA$0.18 per share on the 14th of April...,CAD,CIX.TO,Simply Wall St. - CI Financial (TSE:CIX) Has Announced A Dividend Of CA$0.18
fin_news_nlp/yahoo_cad_tickers_news,https://ca.finance.yahoo.com/news/now-opportune-moment-examine-colabor-102822151.html,"Colabor Group Inc. ( TSE:GCL ), is not the largest company out there, but it received a lot of attention from a...",CAD,GCL.TO,Simply Wall St. - Is Now An Opportune Moment To Examine Colabor Group Inc. (TSE:GCL)?
fin_news_nlp/yahoo_cad_tickers_news,https://ca.finance.yahoo.com/news/avicanna-announces-organizational-change-avicanna-123000426.html,"NOT FOR DISTRIBUTION TO UNITED STATES NEWSWIRE SERVICES OR FOR DISSEMINATION IN THE UNITED STATES. ANY FAILURE TO COMPLY WITH THIS RESTRICTION MAY CONSTITUTE A VIOLATION OF UNITED STATES SECURITIES LAWS TORONTO, Dec. 30, 2022 (GLOBE NEWSWIRE) -- Avicanna Inc. (“Avicanna” or the “Company”) (TSX: AVCN) (OTCQX: AVCNF) (FSE: 0NN), a commercial stage, international biopharmaceutical company focused on the development advancement, and commercialization of evidence-based, cannabinoid-based products, an",CAD,AVCN.TO,GlobeNewswire - Avicanna Announces Organizational Change in Avicanna LATAM S.A.S
fin_news_nlp/yahoo_cad_tickers_news,https://ca.finance.yahoo.com/news/canadian-imperial-bank-commerce-tse-122349150.html,It's easy to match the overall market return by buying an index fund. While individual stocks can be big winners...,CAD,CM.TO,Simply Wall St. - Canadian Imperial Bank of Commerce (TSE:CM) investors are sitting on a loss of 21% if they invested a year ago
fin_news_nlp/yahoo_cad_tickers_news,https://ca.finance.yahoo.com/news/following-previously-announced-confidential-submission-120000606.html,"TORONTO & MIAMI, December 30, 2022--CI Financial has submitted notice to the NYSE of its decision to voluntarily delist its common shares from NYSE. CI shares remain listed on the TSX.",CAD,CIX.TO,"Business Wire - Following Previously Announced Confidential Submission of Draft Registration Statement for its U.S. Business, CI Financial Confirms Intent to Voluntarily Delist from the NYSE and Deregister with the U.S. Securities and Exchange Commission"
fin_news_nlp/yahoo_cad_tickers_news,https://ca.finance.yahoo.com/news/ci-global-asset-management-announces-120000157.html,"TORONTO, December 30, 2022--CI Global Asset Management announces the confirmed annual reinvested capital gains distributions for the 2022 tax year for the CI ETFs.",CAD,CIX.TO,Business Wire - CI Global Asset Management Announces Confirmed Annual Reinvested Capital Gains Distributions for CI ETFs
fin_news_nlp/yahoo_cad_tickers_news,https://ca.finance.yahoo.com/news/guardian-capital-confirms-annual-2022-120000805.html,"TORONTO, Dec. 30, 2022 (GLOBE NEWSWIRE) -- Guardian Capital LP (""Guardian Capital"") announces the confirmed amounts of the annual special year-end distributions (the ""Special Distributions"") for the 2022 tax year for the ETF series of the Guardian Capital funds listed below (the “Guardian Capital ETFs”). Guardian Capital ETFsSeries of ETF UnitsTSX Trading SymbolConfirmed Special Distribution Amount (per ETF Unit) Guardian i3 Global Quality Growth ETFHedged ETF UnitsGIQG$0.0088Guardian i3 Global",CAD,GDEP.TO,GlobeNewswire - Guardian Capital Confirms Annual 2022 Special Distributions for Guardian Capital ETFs
fin_news_nlp/yahoo_cad_tickers_news,https://ca.finance.yahoo.com/news/loblaw-companies-limited-enters-automatic-123000771.html,"Loblaw Companies Limited (TSX: L) (""Loblaw"") announced today that it has entered into an automatic share purchase plan (""ASPP"") with a broker in order to facilitate repurchases of Loblaw's common shares (""Common Shares"") under its previously announced normal course issuer bid (""NCIB"").",CAD,L.TO,CNW Group - Loblaw Companies Limited Enters into Automatic Share Purchase Plan
fin_news_nlp/yahoo_cad_tickers_news,https://ca.finance.yahoo.com/news/manulife-investment-management-announces-final-123000328.html,Manulife Investment Management today announced the final 2022 annual reinvested distributions for Manulife Exchange Traded Funds (ETFs). These annual reinvested distributions generally represent realized capital gains within the ETFs.,CAD,MFC.TO,CNW Group - Manulife Investment Management announces final reinvested capital gains distributions for Manulife Exchange Traded Funds
fin_news_nlp/yahoo_cad_tickers_news,https://ca.finance.yahoo.com/news/manulife-investment-management-announces-final-123000058.html,"Manulife Investment Management today announced the final December 2022 cash distributions for Manulife Exchange Traded Funds (ETFs). Unitholders of record of the Manulife ETFs at the close of business on December 30, 2022 will receive cash distributions payable on January 13, 2023.",CAD,MFC.TO,CNW Group - Manulife Investment Management announces final 2022 cash distributions for Manulife Exchange Traded Funds
fin_news_nlp/yahoo_cad_tickers_news,https://ca.finance.yahoo.com/news/parex-resources-announces-approval-normal-120000104.html,"CALGARY, Alberta, Dec. 30, 2022 (GLOBE NEWSWIRE) -- Parex Resources Inc. (“Parex” or the “Company”) (TSX: PXT) is pleased to announce that the Toronto Stock Exchange (""TSX"") has approved the Company commencing a normal course issuer bid (""Bid""). Pursuant to the Bid, Parex will purchase for cancellation, from time to time, as it considers advisable, up to a maximum of 10,675,555 common shares of the Company (""Common Shares""). The Bid will commence on January 4, 2023 and will terminate on January",CAD,PXT.TO,GlobeNewswire - Parex Resources Announces Approval of Normal Course Issuer Bid and Automatic Share Purchase Plan
fin_news_nlp/yahoo_cad_tickers_news,https://ca.finance.yahoo.com/news/parex-resources-inc-tse-pxt-104405433.html,Today we will run through one way of estimating the intrinsic value of Parex Resources Inc. ( TSE:PXT ) by estimating...,CAD,PXT.TO,Simply Wall St. - Is Parex Resources Inc. (TSE:PXT) Trading At A 44% Discount?
fin_news_nlp/yahoo_cad_tickers_news,https://ca.finance.yahoo.com/m/16cc5b90-9b33-30fc-bb84-31104572021f/1-growth-stock-that-could.html,"Once an investor favorite, e-commerce specialist Shopify (NYSE: SHOP) hasn't been in the best shape over the past 12 months, even by comparison with the struggling stock market.  Shopify was up against a combination of headwinds this year.  In fact, I believe the company has what it takes to triple by 2030 -- which would amount to a compound annual growth rate (CAGR) of about 17%.",CAD,SHOP.TO,Motley Fool - 1 Growth Stock That Could Triple By 2030
fin_news_nlp/yahoo_cad_tickers_news,https://ca.finance.yahoo.com/news/zacks-analyst-blog-highlights-servicenow-095109873.html,"ServiceNow, Schlumberger, MetLife, Marriott International and Shopify are included in this Analyst Blog.",CAD,SHOP.TO,"Zacks - The Zacks Analyst Blog Highlights ServiceNow, Schlumberger, MetLife, Marriott International and Shopify"
fin_news_nlp/yahoo_cad_tickers_news,https://ca.finance.yahoo.com/news/listing-application-canada-124000697.html,"SouthGobi Resources Ltd. (TSX:SGQ)(HK:1878) (""SouthGobi"" or the ""Company"") announces that reference is made to the Company's announcements dated April 21, 2022, July 29, 2022, September 15, 2022 and November 23, 2022 (Hong Kong time) (""Announcements"").",CAD,SGQ.TO,ACCESSWIRE - Update On Listing Application in Canada
fin_news_nlp/yahoo_cad_tickers_news,https://ca.finance.yahoo.com/news/zacks-investment-ideas-feature-highlights-100010321.html,"Wheaton Precious Metals, iShares U.S. Aerospace & Defense ETF and Boeing have been highlighted in this Investment Ideas article.",CAD,WPM.TO,"Zacks - Zacks Investment Ideas feature highlights: Wheaton Precious Metals, iShares U.S. Aerospace & Defense ETF and Boeing"
fin_news_nlp/yahoo_cad_tickers_news,https://ca.finance.yahoo.com/news/think-aptose-biosciences-tse-aps-130215476.html,"Just because a business does not make any money, does not mean that the stock will go down. For example, although...",CAD,APS.TO,Simply Wall St. - We Think Aptose Biosciences (TSE:APS) Needs To Drive Business Growth Carefully
fin_news_nlp/yahoo_cad_tickers_news,https://ca.finance.yahoo.com/news/rogers-14-8-billion-shaw-121941496.html,"(Bloomberg) -- Canada’s merger court ruled in favor of Rogers Communications Inc. and Shaw Communications Inc. in a key antitrust case, clearing one of the final hurdles to the union of two of the nation’s largest telecommunications firms. Most Read from BloombergMilan Reports 50% of Passengers on China Flights Have CovidOne of World’s Most Crowded Cities Gets First Mass-Transit RailUS Weighs Sending Bradley Fighting Vehicles to Bolster UkraineBritain’s Youngest Workers Are Too Sick to WorkWall",CAD,BCE.TO,Bloomberg - Rogers’ $14.8 Billion Shaw Deal Wins Canada Court Approval
fin_news_nlp/yahoo_cad_tickers_news,https://ca.finance.yahoo.com/news/exro-announces-closing-previously-announced-133800426.html,"NOT FOR DISTRIBUTION TO UNITED STATES NEWSWIRE SERVICES OR FOR DISSEMINATION IN THE UNITED STATES CALGARY, Alberta, Dec. 30, 2022 (GLOBE NEWSWIRE) -- Exro Technologies Inc. (TSX: EXRO, OTCQB: EXROF) (the ""Company"" or ""Exro""), a leading clean technology company that has developed industry disruptive next generation power electronics that expands the capabilities of electric motors and batteries, announced today that it has closed its previously announced brokered private placement offering (the """,CAD,EXRO.TO,GlobeNewswire - Exro Announces Closing of Previously Announced Bought Deal Convertible Debenture Financing for Gross Proceeds of $15 Million
fin_news_nlp/yahoo_cad_tickers_news,https://ca.finance.yahoo.com/news/lightspeed-announces-merline-saintil-stepping-130000112.html,"Lightspeed Commerce Inc. (NYSE: LSPD) (TSX: LSPD), the one-stop commerce platform for merchants around the world to simplify, scale, and create exceptional customer experiences, today announced that Merline Saintil is stepping down from its Board of Directors, effective December 31, 2022.",CAD,LSPD.TO,CNW Group - Lightspeed Announces Merline Saintil is Stepping Down from its Board of Directors
fin_news_nlp/yahoo_cad_tickers_news,https://ca.finance.yahoo.com/news/national-bank-investments-announces-revised-133000228.html,"National Bank Investments Inc. (‟NBI"") announced today revised annual reinvested capital gains and/or net income distribution amounts (the ""reinvested distributions"") to be paid for 2022 to unitholders of NBI exchange-traded funds (the ""NBI ETFs""). Please be advised that the reinvested distributions announced in this press release replace those stated in the December 20, 2022, press release, unless otherwise noted. The ex-dividend, record, and payable dates for the distributions remain unchanged",CAD,NUSA.TO,CNW Group - National Bank Investments Announces Revised Annual Reinvested Distribution Amounts for Its Exchange-Traded Funds
fin_news_nlp/yahoo_cad_tickers_news,https://ca.finance.yahoo.com/news/investors-phx-energy-services-tse-141604670.html,When you buy a stock there is always a possibility that it could drop 100%. But when you pick a company that is really...,CAD,PHX.TO,Simply Wall St. - Investors in PHX Energy Services (TSE:PHX) have made a splendid return of 277% over the past five years
fin_news_nlp/yahoo_cad_tickers_news,https://ca.finance.yahoo.com/news/polymet-mining-releases-updated-ni-130200831.html,"Report reaffirms economic and technical viability of NorthMet Project St. Paul, Minnesota--(Newsfile Corp. - December 30, 2022) - PolyMet Mining Corp. (TSX: POM) (NYSE American: PLM) (""PolyMet"" or the ""company"") - today announced the filing of an updated technical report (the ""Study"" or this ""report"") prepared in accordance with National Instrument 43-101 - Standards of Disclosure for Mineral Projects (""NI 43-101"") on the NorthMet Project. This report reaffirms the economic and technical viabili",CAD,POM.TO,Newsfile - PolyMet Mining releases updated NI 43-101 Technical Report on NorthMet copper-nickel-PGM deposit
fin_news_nlp/yahoo_cad_tickers_news,https://ca.finance.yahoo.com/m/84bfb677-6db2-3695-85d3-bd7f293f67d2/3-top-stocks-worth-buying-for.html,"With that in mind, here are my top three stocks worth buying for the long term in 2023.  Ermenegildo Zegna N.V. (NYSE: ZGN) certainly fits this bill -- the Italian luxury house has been around for 112 years, and it has earned a reputation for quality and craftsmanship in that time.  True luxury brands have some of the best moats out there -- and it takes a long time for a new company to achieve such recognition.",CAD,QSR.TO,Motley Fool - 3 Top Stocks Worth Buying for the Long Term in 2023
fin_news_nlp/yahoo_cad_tickers_news,https://ca.finance.yahoo.com/news/silver-elephant-announces-change-financial-135300569.html,"Vancouver, British Columbia--(Newsfile Corp. - December 30, 2022) - Silver Elephant Mining Corp. (TSX: ELEF) (OTCQX: SILEF) (FSE: 1P2) (""Silver Elephant"" or the ""Company"") announces that it is changing its financial year end from December 31 to March 31. As a result, the Company will file an additional interim report as at December 31, 2022 and will report audited financial results for a 15-month transition year from January 1, 2022 to March 31, 2023 (with a ...",CAD,ELEF.TO, - Silver Elephant Announces Change in Financial Year End
fin_news_nlp/yahoo_cad_tickers_news,https://ca.finance.yahoo.com/news/unisync-reports-fiscal-2022-financial-130000876.html,"TORONTO, Dec. 30, 2022 (GLOBE NEWSWIRE) -- Unisync Corp. (“Unisync"") (TSX:""UNI"") (OTCQX:“USYNF”) announces its audited financial results for the fourth quarter and fiscal year ended September 30, 2022. Unisync operates through two business units: Unisync Group Limited (“UGL”) with operations throughout Canada and the USA and 90% owned Peerless Garments LP (“Peerless”), a domestic manufacturing operation based in Winnipeg, Manitoba. UGL is a leading customer-focused provider of corporate apparel,",CAD,UNI.TO,GlobeNewswire - UNISYNC Reports Fiscal 2022 Financial Results
fin_news_nlp/yahoo_cad_tickers_news,https://ca.finance.yahoo.com/news/dirt-cheap-dividend-stock-boasts-152000013.html,Algonquin Power & Utilities (TSX:AQN)(NYSE:AQN) is an Oakville-based company that owns and operates ...,CAD,AQN.TO, - This Dirt-Cheap Dividend Stock Boasts a 10% Yield
fin_news_nlp/yahoo_cad_tickers_news,https://ca.finance.yahoo.com/news/passive-income-1-unstoppable-canadian-143000580.html,This dividend stock is unstoppable for passive income that could grow at an above-average pace. Find out more about its business here. The post Passive Income: 1 Unstoppable Canadian Dividend Stock to Own Forever appeared first on The Motley Fool Canada.,CAD,GSY.TO,The Motley Fool - Passive Income: 1 Unstoppable Canadian Dividend Stock to Own Forever
fin_news_nlp/yahoo_cad_tickers_news,https://ca.finance.yahoo.com/news/investors-sandstorm-gold-tse-ssl-161952487.html,"For many investors, the main point of stock picking is to generate higher returns than the overall market. But the risk...",CAD,SSL.TO,Simply Wall St. - Investors in Sandstorm Gold (TSE:SSL) have unfortunately lost 25% over the last three years
fin_news_nlp/yahoo_cad_tickers_news,https://ca.finance.yahoo.com/news/4-stocks-watch-dividend-hikes-131101546.html,"Lamb Weston Holdings, Inc. (LW), Sandstorm Gold Ltd. (SAND), Graco Inc. (GGG) and The Mosaic Company (MOS) recently hiked dividends.",CAD,SSL.TO,Zacks - 4 Stocks to Watch on Dividend Hikes at the Turn of the Year
fin_news_nlp/yahoo_cad_tickers_news,https://ca.finance.yahoo.com/video/stocks-snap-shopify-stitch-fix-144827722.html,Yahoo Finance Live’s Brian Sozzi breaks down the stat of the day.,CAD,SHOP.TO,"Yahoo Finance Video - Stocks: Snap, Shopify, Stitch Fix, Roku down big in 2022"
fin_news_nlp/yahoo_cad_tickers_news,https://ca.finance.yahoo.com/news/cibc-announces-dividend-rates-nvcc-172700991.html,"CIBC (TSX: CM) (NYSE: CM) today announced the dividend rates applicable to its Non-cumulative Rate Reset Class A Preferred Shares Series 47 (Non-Viability Contingent Capital (NVCC)) (the ""Series 47 Shares"") and Non-cumulative Floating Rate Class A Preferred Shares Series 48 (Non-Viability Contingent Capital (NVCC)) (the ""Series 48 Shares"").",CAD,CM.TO,CNW Group - CIBC Announces Dividend Rates for NVCC Preferred Shares Series 47 and NVCC Preferred Shares Series 48
fin_news_nlp/yahoo_cad_tickers_news,https://ca.finance.yahoo.com/news/celestica-inc-cls-attracting-investor-140002142.html,"Zacks.com users have recently been watching Celestica (CLS) quite a bit. Thus, it is worth knowing the facts that could determine the stock's prospects.",CAD,CLS.TO,"Zacks - Celestica, Inc. (CLS) is Attracting Investor Attention: Here is What You Should Know"
fin_news_nlp/yahoo_cad_tickers_news,https://www.yahoo.com/gma/idaho-murders-police-hold-news-155911722.html,"A 28-year-old man, Bryan Kohberger, was arrested Friday morning in Pennsylvania's Pocono Mountains in connection with the murders of four University of Idaho students, law enforcement sources told ABC News.  Kohberger appeared before a judge Friday morning.",CAD,?err=404&err_url=https%3A%2F%2Fca.finance.yahoo.com%2Fquote%2FCGIN.TO,U.S. - 
fin_news_nlp/yahoo_cad_tickers_news,https://ca.finance.yahoo.com/news/tfsa-investors-3-best-dividend-160000715.html,"When you are thinking about dividend stocks you can keep virtually forever, it might be a good idea to think about more than just the dividends. The post TFSA Investors: The 3 Best Dividend Stocks for Retirement appeared first on The Motley Fool Canada.",CAD,ENB.TO,The Motley Fool - TFSA Investors: The 3 Best Dividend Stocks for Retirement
fin_news_nlp/yahoo_cad_tickers_news,https://ca.finance.yahoo.com/news/tfsa-passive-income-invest-enbridge-150000706.html,Enbridge stock offers a high dividend yield with a strong track record of payout growth. The post TFSA Passive Income: Should You Invest in Enbridge Stock Right Now? appeared first on The Motley Fool Canada.,CAD,ENB.TO,The Motley Fool - TFSA Passive Income: Should You Invest in Enbridge Stock Right Now?
