source,url,description,country,company,title
fin_news_nlp/yahoo_cad_tickers_news,https://ca.finance.yahoo.com/news/2-canadian-dividend-stocks-ll-153000692.html,These high-yield dividend stocks will add to your income amid tough times. The post The 2 Canadian Dividend Stocks You’ll Want to Own in Tough Times appeared first on The Motley Fool Canada.,CAD,BNS.TO,The Motley Fool - The 2 Canadian Dividend Stocks You’ll Want to Own in Tough Times
fin_news_nlp/yahoo_cad_tickers_news,https://ca.finance.yahoo.com/news/58-ownership-dundee-precious-metals-175104971.html,"Key Insights Given the large stake in the stock by institutions, Dundee Precious Metals' stock price might be...",CAD,DPM.TO,"Simply Wall St. - With 58% ownership, Dundee Precious Metals Inc. (TSE:DPM) boasts of strong institutional backing"
fin_news_nlp/yahoo_cad_tickers_news,https://ca.finance.yahoo.com/news/fiera-capital-expands-us-footprint-123000618.html,"Fiera Capital Corporation (""Fiera Capital"" or the ""Company"") (TSX: FSZ), a leading independent asset management firm today announced it has entered into a new strategic distribution partnership with New York Life Investments through its affiliates Fiera Capital Inc. (""FCI""), Fiera Comox Partners Inc. (""Fiera Comox"") and Fiera Capital (UK) Ltd. (""Fiera UK"").",CAD,FSZ.TO,CNW Group - Fiera Capital Expands US Footprint Through New Strategic Distribution Partnership With New York Life Investments
fin_news_nlp/yahoo_cad_tickers_news,https://ca.finance.yahoo.com/news/passive-income-canada-easily-earn-160000647.html,Earning $10/day in passive income might be easier than you think. Here's one way you could get there by buying top Canadian dividend stocks. The post Passive Income in Canada: How to Easily Earn $10/Day appeared first on The Motley Fool Canada.,CAD,PPL.TO,The Motley Fool - Passive Income in Canada: How to Easily Earn $10/Day
fin_news_nlp/yahoo_cad_tickers_news,https://ca.finance.yahoo.com/news/passive-income-earn-nearly-500-150000813.html,"Investors looking for passive income can earn $6,250 in their TFSA this year by purchasing these three quality stocks. The post Passive Income: How to Earn Nearly $500 Per Month in Your TFSA Portfolio appeared first on The Motley Fool Canada.",CAD,PPL.TO,The Motley Fool - Passive Income: How to Earn Nearly $500 Per Month in Your TFSA Portfolio
fin_news_nlp/yahoo_cad_tickers_news,https://ca.finance.yahoo.com/news/1-oversold-dividend-stock-3-160000214.html,Sleep Country Canada stock is down 40% from all-time highs and offers investors a tasty dividend yield of 3.5% right now. The post 1 Oversold Dividend Stock (With a 3.5% Yield) to Buy in March 2023 appeared first on The Motley Fool Canada.,CAD,ZZZ.TO,The Motley Fool - 1 Oversold Dividend Stock (With a 3.5% Yield) to Buy in March 2023
fin_news_nlp/yahoo_cad_tickers_news,https://ca.finance.yahoo.com/news/power-play-market-herald-releases-180000690.html,The Power Play by The Market Herald has announced the release of a new interview with RevoluGROUP discussing their latest news.,CAD,REVO.V,ACCESSWIRE - The Power Play by The Market Herald Releases a New Interview with RevoluGROUP Discussing Their Latest News
fin_news_nlp/yahoo_cad_tickers_news,https://ca.finance.yahoo.com/news/jks-resources-inc-announces-dtc-182800443.html,"Vancouver, British Columbia--(Newsfile Corp. - March 13, 2023) - JKS RESOURCES INC. (CSE: JKS) (OTC Pink: JKSRF) (""JKS"" or the ""Company"") is pleased to announce that its common shares are now eligible for electronic clearing and settlement through the Depository Trust Company (""DTC"") in the United States.DTC is a subsidiary of the Depository Trust & Clearing Corporation, a U.S. company that manages the electronic clearing and settlement of publicly traded companies. Securities that are eligible",CAD,JKS.CN, - JKS Resources Inc. Announces DTC Eligibility
fin_news_nlp/yahoo_cad_tickers_news,https://ca.finance.yahoo.com/news/airboss-files-annual-financial-statements-193300581.html,"NEWMARKET, Ontario, March 13, 2023 (GLOBE NEWSWIRE) -- AirBoss of America Corp. (TSX: BOS) (OTCQX:ABSSF) (the “Company” or “AirBoss”) today announced the filing with securities regulators in Canada and the U.S. of its 2022 audited annual consolidated financial statements, notes thereto, and management’s discussion and analysis in respect of the annual financial statements. As well as being available on the website of the Canadian Securities Administrators at www.sedar.com and the website of the",CAD,BOS.TO,GlobeNewswire - AirBoss Files Annual Financial Statements
fin_news_nlp/yahoo_cad_tickers_news,https://ca.finance.yahoo.com/news/1-canadian-stock-bay-street-180000818.html,Analysts expect shares of Ballard Power Systems to more than double in the next 12 months. But is BLDP stock a buy right now? The post 1 Canadian Stock Bay Street Bets Will Double in 2023 appeared first on The Motley Fool Canada.,CAD,BLDP.TO,The Motley Fool - 1 Canadian Stock Bay Street Bets Will Double in 2023
fin_news_nlp/yahoo_cad_tickers_news,https://ca.finance.yahoo.com/news/silicon-valley-bank-collapse-why-170456478.html,Here are key reasons why Scotiabank investors shouldn’t worry about concerns emerging from Silicon Valley Bank’s recent collapse. The post Silicon Valley Bank Collapse: Why Scotiabank Stock Investors Shouldn’t Worry About it appeared first on The Motley Fool Canada.,CAD,BNS.TO,The Motley Fool - Silicon Valley Bank Collapse: Why Scotiabank Stock Investors Shouldn’t Worry About it
fin_news_nlp/yahoo_cad_tickers_news,https://ca.finance.yahoo.com/news/cineplex-reports-february-2023-box-203000532.html,"(TSX: CGX) – Today, Cineplex Inc. (""Cineplex"" or the ""Company"") reported February box office revenues of $37 million, which amounts to 88 per cent of box office revenues generated during the same month in 2019. Leading film performances in February included Ant-Man and the Wasp: Quantumania, which delivered 40 percent more domestic box office revenues in its opening weekend than the previous film in the Marvel series in 2018 and delivered 32 percent of Cineplex's box office for the month. Other",CAD,CGX.TO,CNW Group - Cineplex Reports February 2023 Box Office Results
fin_news_nlp/yahoo_cad_tickers_news,https://ca.finance.yahoo.com/news/3-reasons-cineplex-could-best-180000333.html,"Cineplex is trading dirt cheap, and with its operations on the verge of recovery, it looks like one of the best Canadian stocks to buy now. The post 3 Reasons Cineplex Could Be the Best Canadian Stock to Buy in 2023 appeared first on The Motley Fool Canada.",CAD,CGX.TO,The Motley Fool - 3 Reasons Cineplex Could Be the Best Canadian Stock to Buy in 2023
fin_news_nlp/yahoo_cad_tickers_news,https://ca.finance.yahoo.com/m/1fe18f27-3f9e-3e02-9020-dd8567b303e9/why-gold-fields%2C-first.html,Shares of precious metals companies jumped on Monday as the prices of gold and silver rose sharply.  The startling collapse of SVB Financial Group's Silicon Valley Bank and other recent bank failures have sparked fears of an imminent banking crisis.,CAD,FR.TO,"Motley Fool - Why Gold Fields, First Majestic Silver, and Other Gold and Silver Stocks Surged Today"
fin_news_nlp/yahoo_cad_tickers_news,https://ca.finance.yahoo.com/news/2-artificial-intelligence-powered-growth-183000227.html,Foolish readers should look to snatch up artificial intelligence-powered growth stocks like Kinaxis Inc. (TSX:KXS) and others today. The post 2 Artificial Intelligence-Powered Growth Stocks to Buy Right Now appeared first on The Motley Fool Canada.,CAD,KXS.TO,The Motley Fool - 2 Artificial Intelligence-Powered Growth Stocks to Buy Right Now
fin_news_nlp/yahoo_cad_tickers_news,https://ca.finance.yahoo.com/news/next-nuvista-energy-stock-earnings-173000674.html,"NuVista Energy stock has returned 18% in the last 12 months and a massive 1,800% since the pandemic. The post What’s Next for NuVista Energy Stock After Earnings? appeared first on The Motley Fool Canada.",CAD,NVA.TO,The Motley Fool - What’s Next for NuVista Energy Stock After Earnings?
fin_news_nlp/yahoo_cad_tickers_news,https://ca.finance.yahoo.com/news/prairiesky-royalty-declares-quarterly-dividend-200100345.html,"CALGARY, Alberta, March 13, 2023 (GLOBE NEWSWIRE) -- PrairieSky Royalty Ltd. (“PrairieSky”) (TSX:PSK) announced today that its Board of Directors has declared a quarterly dividend of CDN $0.24 per common share, payable in cash on April 14, 2023 to shareholders of record on March 31, 2023. This dividend is designated as an “eligible dividend” for Canadian income tax purposes. About PrairieSky Royalty Ltd. PrairieSky is a royalty-focused company, generating royalty revenues as petroleum and natura",CAD,PSK.TO,GlobeNewswire - PrairieSky Royalty Declares Quarterly Dividend
fin_news_nlp/yahoo_cad_tickers_news,https://ca.finance.yahoo.com/news/steppe-gold-files-technical-report-191500663.html,"ULAANBAATAR, Mongolia, March 13, 2023 (GLOBE NEWSWIRE) -- Steppe Gold Ltd. (TSX: STGO) (OTCQX: STPGF) (FSE: 2J9) (“Steppe Gold” or the “Company”) today announces the filing of a technical report (the “Technical Report”) regarding its 100% owned Altan Tsagaan Ovoo Project located in Mongolia. The Technical Report titled “Altan Tsagaan Ovoo Project (ATO) 2022 Mineral Resources & Reserves Report (NI 43-101)” has been prepared by Xenith Consulting Pty Ltd and GeoRes. The Technical Report is availabl",CAD,STGO.TO, - Steppe Gold Files Technical Report for ATO Gold Project
fin_news_nlp/yahoo_cad_tickers_news,https://ca.finance.yahoo.com/news/vanguard-announces-cash-distributions-vanguard-201700578.html,"(VDU, VEF, and VEE)TORONTO, March 13, 2023 (GLOBE NEWSWIRE) -- Vanguard Investments Canada Inc. today announced the final March 2023 cash distributions for certain Vanguard ETFs, listed below, that trade on Toronto Stock Exchange (TSX). Unitholders of record on March 21, 2023 will receive cash distributions payable on March 28, 2023. Details of the “per unit” distribution amounts are as follows: Vanguard ETF®TSX Ticker SymbolDistribution per Unit ($)CUSIPISINPayment FrequencyVanguard FTSE Develo",CAD,VDU.TO,GlobeNewswire - Vanguard Announces Cash Distributions for the Vanguard ETFs
fin_news_nlp/yahoo_cad_tickers_news,https://ca.finance.yahoo.com/news/khiron-life-sciences-announces-overnight-200000634.html,"Khiron Life Sciences Corp. (""Khiron"" or the ""Company"") (TSXV: KHRN) (OTCQX: KHRNF) is pleased to announce that it has launched an overnight marketed public offering (the ""Offering"") of the Company's units (each, a ""Unit""). Each Unit will consist of one common share of the Company (each, a ""Unit Share"") and one common share purchase warrant of the Company (each, a ""Unit Warrant""), with each Unit Warrant being exercisable to acquire one Common Share (each, a ""Warrant Share"") for a period of 24 mon",CAD,KHRN.V,CNW Group - KHIRON LIFE SCIENCES ANNOUNCES OVERNIGHT MARKETED OFFERING
fin_news_nlp/yahoo_cad_tickers_news,https://ca.finance.yahoo.com/news/mclaren-expands-size-mccool-gold-200000025.html,"Toronto, Ontario--(Newsfile Corp. - March 13, 2023) - McLaren Resources Inc. (CSE: MCL) (FSE: 3ML) (""McLaren"" or the ""Company"") announces that it has added an additional 18 mineral exploration claims, covering approximately 380 hectares (""ha""), to its prospective McCool gold property. McLaren recently announced it had intersected high grade gold mineralization, including 16.5 grams per tonne gold (""g/t Au"") over 6.0 metres (""m""), including 21.1 g/t Au over 4.5 m; 10.8 g/t Au over ...",CAD,MCL.CN,Newsfile - McLaren Expands the Size of Its McCool Gold Property
fin_news_nlp/yahoo_cad_tickers_news,https://ca.finance.yahoo.com/news/3iq-announces-firm-no-exposure-221500887.html,"Given the closures of several U.S. banks that prompted government intervention over the weekend, we are sharing that 3iQ Digital Asset Management (3iQ) does not have exposure to any of the U.S. banks that closed over the past week.",CAD,BTCQ.TO,CNW Group - 3iQ Announces Firm Has No Exposure to Closed US Banks
fin_news_nlp/yahoo_cad_tickers_news,https://ca.finance.yahoo.com/news/3-growth-stocks-bought-ready-190000401.html,"These three Canadian growth stocks have tonnes of potential and trade dirt-cheap, making them some of the best to buy before a bull market. The post 3 Growth Stocks I Bought to Get Ready for the Coming Bull Market appeared first on The Motley Fool Canada.",CAD,AT.TO,The Motley Fool - 3 Growth Stocks I Bought to Get Ready for the Coming Bull Market
fin_news_nlp/yahoo_cad_tickers_news,https://ca.finance.yahoo.com/news/adcore-announces-engagement-bristol-capital-203500710.html,"Adcore Inc. (the ""Company"" or ""Adcore"") (TSX:ADCO)(OTCQX:ADCOF), a leading e-commerce advertising management and automation platform to leverage digital marketing in an effortless and accessible way (""Effortless Marketing""), today announced that it has retained Bristol Capital Ltd. (""Bristol"") and Dr. Reuter Investor Relations (""Dr. Reuter"") for investor relations services in North America and Europe, respectively.",CAD,ADCO.TO,ACCESSWIRE - Adcore Announces the Engagement of Bristol Capital and Dr. Reuter for Investor Relations Services
fin_news_nlp/yahoo_cad_tickers_news,https://ca.finance.yahoo.com/news/canada-revenue-agency-4-common-190000472.html,"Lets look at some of the tax credits provided by the Canada Revenue Agency, which should help lower your tax bill in 2023. The post Canada Revenue Agency: 4 Common Tax Credits to Boost Your Wealth Building appeared first on The Motley Fool Canada.",CAD,AFN.TO,The Motley Fool - Canada Revenue Agency: 4 Common Tax Credits to Boost Your Wealth Building
fin_news_nlp/yahoo_cad_tickers_news,https://ca.finance.yahoo.com/news/algoma-steel-appoints-ellisdon-construction-213000155.html,"SAULT STE. MARIE, Ontario, March 13, 2023 (GLOBE NEWSWIRE) -- Algoma Steel Group Inc. (NASDAQ: ASTL; TSX: ASTL) (“Algoma” or the “Corporation”), a leading Canadian producer of hot and cold rolled steel sheet and plate products, today announced the appointment of EllisDon as Construction Manager for completion of its transformative Electric Arc Furnace (EAF) project. EllisDon brings over 70 years of industrial and civil construction management expertise and experience to the project bolstering Al",CAD,ASTL.TO,GlobeNewswire - Algoma Steel Appoints EllisDon as Construction Manager for Electric Arc Furnace Project
fin_news_nlp/yahoo_cad_tickers_news,https://ca.finance.yahoo.com/news/now-time-buy-bank-montreal-213000852.html,"Canada’s big banks are some of the best long-term options on the market, but is it really the right time to buy a bank stock right now? The post Is Now the Right Time to Buy Bank of Montreal Stock? appeared first on The Motley Fool Canada.",CAD,BMO.TO,The Motley Fool - Is Now the Right Time to Buy Bank of Montreal Stock?
fin_news_nlp/yahoo_cad_tickers_news,https://ca.finance.yahoo.com/news/better-buy-td-stock-bank-223000785.html,The question of whether Toronto-Dominion Bank (TSX:TD) stock or Bank of Nova Scotia (TSX:BNS) stock is a better buy is an intriguing one. The post Better Buy: TD Stock or Bank of Nova Scotia? appeared first on The Motley Fool Canada.,CAD,BNS.TO,The Motley Fool - Better Buy: TD Stock or Bank of Nova Scotia?
fin_news_nlp/yahoo_cad_tickers_news,https://ca.finance.yahoo.com/news/next-blackberry-stock-weak-preliminary-200000398.html,"After timid fiscal 2023 preliminary results, BlackBerry has lost over 9% of its stock value. So, let’s assess the buying opportunities after the recent correction. The post What’s Next for BlackBerry Stock After Weak Preliminary Results? appeared first on The Motley Fool Canada.",CAD,BB.TO,The Motley Fool - What’s Next for BlackBerry Stock After Weak Preliminary Results?
fin_news_nlp/yahoo_cad_tickers_news,https://ca.finance.yahoo.com/news/3-tsx-stocks-create-perfect-193000946.html,"If you need TSX stocks to go back to again and again, these are three perfect options I would consider as a solid base for your portfolio. The post 3 TSX Stocks to Create a Perfect Investing Base appeared first on The Motley Fool Canada.",CAD,CU.TO,The Motley Fool - 3 TSX Stocks to Create a Perfect Investing Base
fin_news_nlp/yahoo_cad_tickers_news,https://ca.finance.yahoo.com/news/cardinal-energy-ltd-announces-fourth-231400344.html,"CALGARY, Alberta, March 13, 2023 (GLOBE NEWSWIRE) -- Cardinal Energy Ltd. (""Cardinal"" or the ""Company"") (TSX: CJ) is pleased to announce its operating and financial results for the fourth quarter and year ended December 31, 2022. HIGHLIGHTS FROM THE FOURTH QUARTER AND FULL YEAR OF 2022 Reduced net debt(1) by $115.5 million in 2022, a 65% reduction over year-end 2021 which reduces corporate risk and increases Cardinal's sustainability;Reinstated our monthly dividend in 2022 and subsequently incre",CAD,CJ.TO,GlobeNewswire - Cardinal Energy Ltd. Announces Fourth Quarter 2022 and Year-End Financial Results
fin_news_nlp/yahoo_cad_tickers_news,https://ca.finance.yahoo.com/news/celestica-files-form-20-f-235800120.html,"TORONTO, March 13, 2023 (GLOBE NEWSWIRE) -- Celestica Inc. (NYSE, TSX: CLS), a leader in design, manufacturing and supply chain solutions for the world's most innovative companies, today announced that its annual report on Form 20-F for the year ended December 31, 2022 has been filed with the United States Securities and Exchange Commission. The annual report on Form 20-F can be accessed on the company's website at www.celestica.com in the Investor Relations section. The Form 20-F can also be vi",CAD,CLS.TO,GlobeNewswire - Celestica Files Form 20-F
fin_news_nlp/yahoo_cad_tickers_news,https://ca.finance.yahoo.com/news/constellation-software-inc-announces-release-005300231.html,"TORONTO, March 13, 2023 (GLOBE NEWSWIRE) -- Constellation Software Inc. (TSX:CSU) announced today it intends to release its results for the fourth quarter and year ended December 31, 2022 on March 29, 2023. The Company’s quarterly results will be disseminated via press release and made available on the Company’s website (www.csisoftware.com) and SEDAR, after markets close on Wednesday, March 29, 2023. As outlined in Constellation’s press release on February 23, 2018, Constellation has ceased hol",CAD,CSU.TO,"GlobeNewswire - Constellation Software Inc. Announces Release Date of its Results for the Fourth Quarter and Year Ended December 31, 2022"
fin_news_nlp/yahoo_cad_tickers_news,https://ca.finance.yahoo.com/news/most-actively-traded-companies-toronto-211900598.html,"TORONTO — Some of the most active companies traded Monday on the Toronto Stock Exchange: Toronto Stock Exchange (19,588.90, down 186.02): Toronto-Dominion Bank (TSX:TD). Financials. Down $2.87, or 3.43 per cent, to $80.90 on 14.4 million shares. Suncor Energy Inc. (TSX:SU). Energy. Down $2.44, or 5.27 per cent, to $43.83 on 14 million shares. Canadian Natural Resources Ltd. (TSX:CNQ). Energy. Down $3.25, or 4.17 per cent, to $74.74 on 12.8 million shares. Barrick Gold Corp. (TSX:ABX). Materials.",CAD,ENB.TO, - Most actively traded companies on the Toronto Stock Exchange
fin_news_nlp/yahoo_cad_tickers_news,https://ca.finance.yahoo.com/news/filo-mining-announces-appointments-board-210000265.html,"Filo Mining Corp. (TSX: FIL) (Nasdaq First North Growth Market: FIL) (OTCQX: FLMMF) (""Filo Mining"", or the ""Company"") is pleased to announce the appointment of Ms. Joyce Ngo and Mr. Peter J O'Callaghan to its Board of Directors. Concurrently, Mr. Alessandro Bitelli is retiring, and is stepping off the Board of Directors. As a result of the changes, Filo Mining's Board of Directors now has a total of nine members. PDF Version",CAD,FIL.TO,CNW Group - Filo Mining Announces Appointments to its Board of Directors
fin_news_nlp/yahoo_cad_tickers_news,https://ca.finance.yahoo.com/news/panama-gives-canadas-first-quantum-152455405.html,"Panama's Maritime Authority has lifted a suspension on First Quantum Minerals' operations at the port of Punta Rincon, which the Canadian company uses to export copper concentrate from its key Cobre Panama mine, company sources said late on Friday.  Two spokespersons for Minera Panama, First Quantum's Panama unit, told Reuters the suspension dated Jan. 26 had been ended, which was confirmed by a source at the Maritime Authority.  The company, which spent weeks at loggerheads with Panama over Cobre Panama, had said that once the suspension ended, it would be able to resume activity at the port quickly.",CAD,FM.TO, - CORRECTED-Panama gives Canada's First Quantum go-ahead to operate port terminal
fin_news_nlp/yahoo_cad_tickers_news,https://ca.finance.yahoo.com/news/invesque-announces-fourth-quarter-end-223000295.html,"Invesque Inc. (the ""Company"") (TSX: IVQ.U) and (TSX: IVQ) will release its fourth quarter and year-end 2022 results on Wednesday, March 15, 2023, after markets close. A conference call to discuss those results will be held on Thursday, March 16, 2023, at 10:00 a.m. Eastern Time.",CAD,IVQ.TO,CNW Group - Invesque Announces Fourth Quarter and Year-End 2022 Earnings Release Date and Conference Call
fin_news_nlp/yahoo_cad_tickers_news,https://ca.finance.yahoo.com/news/3-top-artificial-intelligence-stocks-220000067.html,"The top AI stocks to buy today include Kinaxis, a fast-growing automation leader, and an ETF that diversifies risks in 2023. The post 3 Top Artificial Intelligence Stocks to Buy Right Now appeared first on The Motley Fool Canada.",CAD,KXS.TO,The Motley Fool - 3 Top Artificial Intelligence Stocks to Buy Right Now
fin_news_nlp/yahoo_cad_tickers_news,https://ca.finance.yahoo.com/news/lion-announces-upcoming-participation-investor-210000499.html,"The Lion Electric Company (NYSE: LEV) (TSX: LEV) (""Lion"" or the ""Company""), a leading manufacturer of all-electric medium and heavy-duty urban vehicles, announced today that the Company will be presenting at the following investor conferences:",CAD,LEV.TO,CNW Group - LION ANNOUNCES UPCOMING PARTICIPATION AT INVESTOR CONFERENCES
fin_news_nlp/yahoo_cad_tickers_news,https://ca.finance.yahoo.com/news/mountain-province-diamonds-provides-further-220000338.html,"Mountain Province Diamonds Inc. (""Mountain Province"" or the ""Company"") (TSX: MPVD) and (OTC: MPVDF) today wishes to provide further information regarding its voluntarily termination of SEC reporting obligations, as well as providing historical context to the decision.",CAD,MPVD.TO,CNW Group - Mountain Province Diamonds Provides Further Information Regarding Voluntarily Termination of SEC Reporting Obligations
fin_news_nlp/yahoo_cad_tickers_news,https://ca.finance.yahoo.com/news/park-lawn-expands-iowa-nebraska-210000090.html,"Park Lawn Corporation (TSX:PLC)(PLC.U) (""Park Lawn"" or ""PLC"") is pleased to announce that it has completed the acquisition of substantially all the assets of Meyer Brothers Funeral Homes, a business consisting of five stand-alone funeral homes located in Sioux City, Iowa, South Sioux City, Nebraska and Ponca, Nebraska (collectively ""Meyer"").",CAD,PLC.TO,ACCESSWIRE - Park Lawn Expands into Iowa and Nebraska
fin_news_nlp/yahoo_cad_tickers_news,https://ca.finance.yahoo.com/news/parkland-corporation-announces-first-quarter-213000735.html,"Parkland Corporation (""Parkland"") (TSX: PKI) announces that a dividend of $0.34 per share will be paid on April 14, 2023 to shareholders of record on March 22, 2023. The dividend will be an 'eligible dividend' for Canadian income tax purposes. The ex-dividend date is March 21, 2023.",CAD,PKI.TO,CNW Group - Parkland Corporation Announces First Quarter 2023 Dividend
fin_news_nlp/yahoo_cad_tickers_news,https://ca.finance.yahoo.com/news/reunion-neuroscience-files-lawsuit-against-225200493.html,"TORONTO, March 13, 2023 (GLOBE NEWSWIRE) -- Reunion Neuroscience Inc. (NASDAQ: REUN, TSX: REUN) (“Reunion” or “the Company”), a clinical-stage biopharmaceutical company committed to developing innovative and patented therapeutic solutions for underserved mental health conditions, has filed a lawsuit today against Mindset Pharma Inc. (“Mindset”) in the United States District Court for the District of New Jersey, alleging that Mindset knowingly copied Reunion’s RE104 compound and misleadingly pres",CAD,REUN.TO,GlobeNewswire - Reunion Neuroscience Files Lawsuit Against Mindset Pharma
fin_news_nlp/yahoo_cad_tickers_news,https://ca.finance.yahoo.com/news/rubellite-energy-inc-announces-non-211900453.html,"(TSX: RBY) – Rubellite Energy Inc. (""Rubellite"", or the ""Corporation"") is pleased to announce an insider led non-brokered private placement offering of common shares to be issued on a ""flow through"" basis pursuant to the Income Tax Act (Canada) (the ""Tax Act"") with respect to Canadian development expense (the ""Flow-Through Shares""). The Corporation intends to issue up to 7.0 million Flow-Through Shares at an issue price of $2.85 per Flow-Through Share, for gross proceeds of up to approximately $",CAD,RBY.TO,CNW Group - RUBELLITE ENERGY INC. ANNOUNCES NON-BROKERED PRIVATE PLACEMENT OFFERING OF FLOW-THROUGH COMMON SHARES
fin_news_nlp/yahoo_cad_tickers_news,https://ca.finance.yahoo.com/news/silver-bull-announces-board-changes-034100750.html,"VANCOUVER, British Columbia, March 13, 2023 (GLOBE NEWSWIRE) -- Silver Bull Resources, Inc. (OTCQB: SVBL, TSX: SVB) (“Silver Bull”) wishes to announce changes to its Board of Directors. Effective March 2, 2023, Daniel Kunz has resigned from the Board of Directors, as he was not standing for re-election at the Company’s upcoming Annual General Meeting. Mr. Kunz has been a member of the Board since 2011. To replace Mr. Kunz, Mr. William Matlack has been appointed to the Board. Brian Edgar, Chairma",CAD,SVB.TO,GlobeNewswire - Silver Bull Announces Board Changes
