source,url,description,country,company,title
fin_news_nlp/yahoo_cad_tickers_news,https://ca.finance.yahoo.com/news/bridgemarq-real-estate-services-announces-212000822.html,"Bridgemarq Real Estate Services Inc. (""Bridgemarq"" or the ""Company"") (TSX: BRE) today announced the voting results for the directors elected at the Company's annual meeting of shareholders held virtually on May 11, 2023.",CAD,BRE.TO,CNW Group - Bridgemarq Real Estate Services Announces Voting Results from Annual Meeting of Shareholders
fin_news_nlp/yahoo_cad_tickers_news,https://ca.finance.yahoo.com/news/brompton-funds-declare-distributions-201500390.html,"TORONTO, April 21, 2023 (GLOBE NEWSWIRE) -- (TSX: BDIV, BEPR, BEPR.U, BFIN, BFIN.U, BLOV, BMAX, BPRF, BPRF.U, BREA, EDGF, HIG, HIG.U, TLF, TLF.U) – Brompton Funds announces monthly distributions for record dates from April to June 2023 for each of the following exchange-traded funds (“ETFs”): TickerAmount Per UnitBrompton Global Dividend Growth ETFBDIVCdn$ 0.11000Brompton Flaherty & Crumrine Enhanced Investment Grade Preferred ETFBEPRCdn$ 0.07000 BEPR.UUS$ 0.06750Brompton North American Financia",CAD,BEPR.TO,GlobeNewswire - Brompton Funds Declare Distributions
fin_news_nlp/yahoo_cad_tickers_news,https://ca.finance.yahoo.com/news/brompton-funds-declare-distributions-190900008.html,"TORONTO, May 24, 2023 (GLOBE NEWSWIRE) -- (TSX: DGS, DGS.PR.A, GDV, LBS, LCS, PWI, SBC) – Brompton Funds announces distributions payable on June 14, 2023 to class A shareholders of record at the close of business on May 31, 2023 for each of the following funds: Fund NameTickerAmount Per ShareGlobal Dividend Growth Split Corp. (“GDV”)GDV$0.10Life & Banc Split Corp. (“LBS”)LBS$0.10Brompton Lifeco Split Corp. (“LCS”)LCS$0.075Sustainable Power & Infrastructure Split Corp. (“PWI”)PWI$0.06667Brompton",CAD,LCS.TO,GlobeNewswire - Brompton Funds Declare Distributions
fin_news_nlp/yahoo_cad_tickers_news,https://ca.finance.yahoo.com/news/4-big-deal-reports-week-074518333.html,"Here is your Pro Recap of 4 head-turning deal dispatches you may have missed this week: TriNet considers a sale, merger deals at Network International/Brookfield, Circor/KKR, and Optum’s unsolicited offer to Amedisys.  Trinet (NYSE:TNET) shares jumped more than 9% on Friday after Reuters reported that the online payroll services provider is considering selling the company, citing sources familiar with the matter.  According to the report, the company is in discussions with potential buyers, in collaboration with investment bank Morgan Stanley.",CAD,BAM.TO, - 4 big deal reports: TriNet stock soars on word of potential sale
fin_news_nlp/yahoo_cad_tickers_news,https://ca.finance.yahoo.com/news/brookfield-reinsurance-announces-first-quarter-105500614.html,"BROOKFIELD, NEWS, May 11, 2023 (GLOBE NEWSWIRE) -- Brookfield Reinsurance (NYSE, TSX: BNRE) today announced financial results for the quarter ended March 31, 2023. Sachin Shah, CEO of Brookfield Reinsurance, stated, “Our results for the quarter were strong and reflect the significant growth of our business and investment portfolio redeployment activities over the past year. We continue to prioritize sourcing high value investment opportunities, whilst scaling the overall business. Our high level",CAD,BNRE.TO,GlobeNewswire - Brookfield Reinsurance Announces First Quarter Results and Declares Regular Quarterly Distribution
fin_news_nlp/yahoo_cad_tickers_news,https://ca.finance.yahoo.com/news/buhler-industries-inc-tse-bui-154627941.html,"Buhler Industries Inc.'s ( TSE:BUI ) price-to-earnings (or ""P/E"") ratio of 19.9x might make it look like a strong sell...",CAD,BUI.TO,Simply Wall St. - What Buhler Industries Inc.'s (TSE:BUI) P/E Is Not Telling You
fin_news_nlp/yahoo_cad_tickers_news,https://ca.finance.yahoo.com/news/caldwell-reports-second-quarter-results-215500534.html,"Talent acquisition firm The Caldwell Partners International Inc. (TSX:CWL)(OTCQX:CWLPF) today issued its financial results for the fiscal 2023 second quarter ended February 28, 2023.",CAD,CWL.TO,ACCESSWIRE - Caldwell Reports Second Quarter Results
fin_news_nlp/yahoo_cad_tickers_news,https://ca.finance.yahoo.com/news/private-companies-account-35-calfrac-145001859.html,Key Insights Calfrac Well Services' significant private companies ownership suggests that the key decisions are...,CAD,CFW.TO,"Simply Wall St. - Private companies account for 35% of Calfrac Well Services Ltd.'s (TSE:CFW) ownership, while individual investors account for 31%"
fin_news_nlp/yahoo_cad_tickers_news,https://ca.finance.yahoo.com/news/calian-reports-record-revenue-second-203100519.html,"Calian® Group Ltd. (TSX:CGY), a diverse products and services company providing innovative healthcare, communications, learning and cybersecurity solutions, today released its results for the second quarter ended March 31, 2023.",CAD,CGY.TO,ACCESSWIRE - Calian Reports Record Revenue for the Second Quarter
fin_news_nlp/yahoo_cad_tickers_news,https://ca.finance.yahoo.com/news/calibre-announces-publication-2022-sustainability-100000511.html,"VANCOUVER, British Columbia, June 06, 2023 (GLOBE NEWSWIRE) -- Calibre Mining Corp. (TSX: CXB; OTCQX: CXBMF) (“Calibre” or the “Company”) is pleased to announce the publication of its 2022 Sustainability Report (“the Report”). The Report outlines Calibre’s 2022 progress and achievements, provides guidance for the Company’s Environmental, Social and Governance (“ESG”) performance, and underscores Calibre’s unwavering commitment to transparency, accountability and responsible business practices. C",CAD,CXB.TO,"GlobeNewswire - Calibre Announces the Publication of its 2022 Sustainability Report, Demonstrating Commitment to Transparency and Responsible Practices"
fin_news_nlp/yahoo_cad_tickers_news,https://ca.finance.yahoo.com/news/canaccords-board-rejects-management-led-215220529.html,"But regulatory scrutiny has torpedoed some high-profile deals, including Toronto-Dominion Bank's proposed $13.4 billion acquisition of First Horizon Corp.  Before reaching its decision, Canaccord's board consulted with a special committee of independent directors, which in February had recommended valuing the company between C$1.3 billion and C$1.6 billion, the company said.  Canaccord offers a slew of financial services including wealth management, investment banking and research.",CAD,CF.TO, - Canaccord's board rejects management-led group's $840 million buyout offer
fin_news_nlp/yahoo_cad_tickers_news,https://ca.finance.yahoo.com/news/canadian-banc-corp-announces-tsx-113000427.html,"TORONTO, May 25, 2023 (GLOBE NEWSWIRE) -- Canadian Banc Corp. (the “Company”) announced today that the Toronto Stock Exchange (the “TSX”) has accepted its notice of intention to make a Normal Course Issuer Bid (the “NCIB”) to purchase its Preferred Shares and Class A Shares through the facilities of the TSX and/or alternative Canadian trading systems. The NCIB will commence on May 29, 2023 and terminate on May 28, 2024. Pursuant to the NCIB, the Company proposes to purchase, from time to time, i",CAD,BK.TO,GlobeNewswire - Canadian Banc Corp. Announces TSX Acceptance of Normal Course Issuer Bid
fin_news_nlp/yahoo_cad_tickers_news,https://ca.finance.yahoo.com/news/canadian-general-investments-investment-unaudited-182300145.html,"TORONTO, Canada, June 05, 2023 (GLOBE NEWSWIRE) -- Canadian General Investments, Limited (TSX: CGI, CGI.PR.D) (LSE: CGI) (CGI) reports on an unaudited basis that its net asset value per share (NAV) at May 31, 2023 was $52.23, resulting in year-to-date and 12-month NAV returns, with dividends reinvested, of 9.3% and 3.7%, respectively. These compare with the 2.3% and -2.5% returns of the benchmark S&P/TSX Composite Index on a total return basis for the same periods. The Company employs a leveragi",CAD,CGI.TO,GlobeNewswire - Canadian General Investments: Investment Update - Unaudited
fin_news_nlp/yahoo_cad_tickers_news,https://ca.finance.yahoo.com/news/build-ultimate-passive-income-portfolio-134500334.html,"Canadian investors should always have diversified options, but if you put a small stake and reinvest dividends, this can bring on riches. The post Build the Ultimate Passive-Income Portfolio With Just $5,000 appeared first on The Motley Fool Canada.",CAD,CM.TO,"The Motley Fool - Build the Ultimate Passive-Income Portfolio With Just $5,000"
fin_news_nlp/yahoo_cad_tickers_news,https://ca.finance.yahoo.com/news/canadian-life-companies-split-corp-113000640.html,"TORONTO, May 25, 2023 (GLOBE NEWSWIRE) -- Canadian Life Companies Split Corp. (the “Company”) announced today that the Toronto Stock Exchange (the “TSX”) has accepted its notice of intention to make a Normal Course Issuer Bid (the “NCIB”) to purchase its Preferred Shares and Class A Shares through the facilities of the TSX and/or alternative Canadian trading systems. The NCIB will commence on May 29, 2023 and terminate on May 28, 2024. Pursuant to the NCIB, the Company proposes to purchase, from",CAD,LFE.TO,GlobeNewswire - Canadian Life Companies Split Corp. Announces TSX Acceptance of Normal Course Issuer Bid
fin_news_nlp/yahoo_cad_tickers_news,https://ca.finance.yahoo.com/news/3-top-canadian-growth-stocks-180000507.html,"These growth stocks might be up in 2023, but each provides a strong opportunity both for recovery in 2023, and growth far beyond. The post 3 Top Canadian Growth Stocks for June 2023 appeared first on The Motley Fool Canada.",CAD,CTC.TO,The Motley Fool - 3 Top Canadian Growth Stocks for June 2023
fin_news_nlp/yahoo_cad_tickers_news,https://ca.finance.yahoo.com/news/canagold-appoints-vice-president-sustainability-202600094.html,"VANCOUVER, British Columbia, May 31, 2023--Canagold Resources Ltd. (TSX: CCM, OTC-QB: CRCUF, Frankfurt: CANA) (""Canagold"" or the ""Company"") is pleased to announce the company has appointed Mr. Tim Caldwell as the Company’s Vice President, Sustainability.",CAD,CCM.TO,"Business Wire - Canagold Appoints Vice President, Sustainability"
fin_news_nlp/yahoo_cad_tickers_news,https://ca.finance.yahoo.com/news/canfor-canfor-pulp-jointly-release-213000474.html,"Canfor Corporation (TSX: CFP) and Canfor Pulp Products Inc. (TSX: CFX) jointly announce the release of the 2022 Sustainability Report, which outlines performance on topics such as climate change, sustainable forestry and energy management, and social issues such as inclusion and diversity, and Indigenous relations.",CAD,CFX.TO,CNW Group - Canfor and Canfor Pulp Jointly Release 2022 Sustainability Report
fin_news_nlp/yahoo_cad_tickers_news,https://ca.finance.yahoo.com/news/canlan-ice-sports-evaluate-alternatives-100000267.html,"Burnaby, British Columbia--(Newsfile Corp. - May 25, 2023) - Canlan Ice Sports Corp. (TSX: ICE) (""Canlan"" or ""the Company"") announced today that its Board of Directors (""Board"") has initiated a process to evaluate potential alternatives with respect to its portfolio of owned real estate assets. In connection with this process, the Company has retained Scotiabank as its financial advisor to assist with the review of potential alternatives to unlock the value of its real ...",CAD,ICE.TO,Newsfile - Canlan Ice Sports to Evaluate Alternatives for Its Real Estate Portfolio to Enhance Shareholder Value
fin_news_nlp/yahoo_cad_tickers_news,https://ca.finance.yahoo.com/news/boost-long-term-wealth-green-150000989.html,"The strong demand and policy support will drive renewable energy stocks higher, making them attractive long-term investments. The post Boost Your Long-Term Wealth With These Green Energy Stocks appeared first on The Motley Fool Canada.",CAD,CPX.TO,The Motley Fool - Boost Your Long-Term Wealth With These Green Energy Stocks
fin_news_nlp/yahoo_cad_tickers_news,https://ca.finance.yahoo.com/news/capstone-copper-corp-tse-cs-113125103.html,Capstone Copper's (TSE:CS) stock is up by a considerable 11% over the past month. Given that stock prices are usually...,CAD,CS.TO,Simply Wall St. - Capstone Copper Corp.'s (TSE:CS) Stock On An Uptrend: Could Fundamentals Be Driving The Momentum?
fin_news_nlp/yahoo_cad_tickers_news,https://ca.finance.yahoo.com/news/cascades-tse-cas-announced-dividend-100606625.html,Cascades Inc. ( TSE:CAS ) has announced that it will pay a dividend of CA$0.12 per share on the 8th of June. This means...,CAD,CAS.TO,Simply Wall St. - Cascades (TSE:CAS) Has Announced A Dividend Of CA$0.12
fin_news_nlp/yahoo_cad_tickers_news,https://ca.finance.yahoo.com/news/cathedral-energy-services-announces-final-090000679.html,"Cathedral Energy Services Ltd. (TSX: CET) (""Cathedral"" or the ""Company"" or ""CET"") is pleased to announce that all matters presented at the Company's Annual Meeting of Shareholders on May 11, 2023, were approved by a majority of votes cast, including the election of all seven director nominees proposed by management. A total of 153,104,186 common shares were voted in connection with the meeting, which represents 68.09% of the issued and outstanding as of the record date. The vote disposition is a",CAD,CET.TO,CNW Group - CATHEDRAL ENERGY SERVICES ANNOUNCES FINAL 2023 ANNUAL MEETING DIRECTOR ELECTION RESULTS
fin_news_nlp/yahoo_cad_tickers_news,https://ca.finance.yahoo.com/news/celestica-inc-tse-cls-shares-130618076.html,Key Insights Celestica's estimated fair value is CA$30.63 based on 2 Stage Free Cash Flow to Equity Celestica's...,CAD,CLS.TO,Simply Wall St. - Celestica Inc. (TSE:CLS) Shares Could Be 43% Below Their Intrinsic Value Estimate
fin_news_nlp/yahoo_cad_tickers_news,https://ca.finance.yahoo.com/news/centamin-plc-announces-director-pdmr-154000341.html,"Centamin plc (""Centamin"" or ""the Company"") (LSE:CEY)(TSX:CEE) Centamin announces that the 2020 share awards under the Company's shareholder approved Remuneration Policy and Performance Share Plan (""PSP"") have partially (63.1%) vested. The share awards are for ordinary shares of nil par value in the Company. As per the PSP, awards carried the right to dividend equivalents on the shares that vested.",CAD,CEE.TO,ACCESSWIRE - Centamin PLC Announces Director/PDMR Shareholding
fin_news_nlp/yahoo_cad_tickers_news,https://ca.finance.yahoo.com/news/ceres-global-ag-corp-reports-110000933.html,"Ceres Global Ag Corp. (TSX: CRP) (""Ceres"" or the ""Corporation"") today announced its financial and operating results for the three and nine-month periods ended March 31, 2023. All amounts are in U.S. dollars unless otherwise noted.",CAD,CRP.TO,CNW Group - CERES GLOBAL AG CORP. REPORTS THIRD QUARTER RESULTS FOR FISCAL YEAR 2023
fin_news_nlp/yahoo_cad_tickers_news,https://ca.finance.yahoo.com/news/ces-energy-solutions-tse-ceu-105519402.html,The board of CES Energy Solutions Corp. ( TSE:CEU ) has announced that it will be paying its dividend of CA$0.025 on...,CAD,CEU.TO,Simply Wall St. - CES Energy Solutions (TSE:CEU) Is Increasing Its Dividend To CA$0.025
fin_news_nlp/yahoo_cad_tickers_news,https://ca.finance.yahoo.com/news/charlottes-reports-2023-first-quarter-110500871.html,"(TSX: CWEB) (OTCQX: CWBHF), Charlotte's Web Holdings, Inc. (""Charlotte's Web"" or the ""Company""), the market leader in full spectrum hemp extract wellness products, today reported financial results for the first quarter ended March 31, 2023.",CAD,CWEB.TO,CNW Group - Charlotte's Web Reports 2023 First Quarter Financial Results
fin_news_nlp/yahoo_cad_tickers_news,https://ca.finance.yahoo.com/news/air-canada-chorus-aviation-air-113000983.html,"Air Canada (TSX: AC) and Chorus Aviation Inc. (TSX: CHR) (""Chorus""), parent company of Jazz Aviation LP (""Jazz""), are providing comment on Air Canada's arrangement for additional flying capacity with another airline for up to six De Havilland Canada DHC-8 aircraft.",CAD,CHR.TO,CNW Group - Air Canada and Chorus Aviation Comment on Air Canada's Bridging Agreement for Additional Regional Capacity
fin_news_nlp/yahoo_cad_tickers_news,https://ca.finance.yahoo.com/news/ci-financial-corp-announces-completion-221700521.html,"TORONTO, May 24, 2023--CI Financial announces completion of debt tender offers and minority investment in its U.S. wealth management business",CAD,CIX.TO,Business Wire - CI Financial Corp. Announces Completion of Debt Tender Offers and Pre-IPO Minority Investment in Its U.S. Wealth Management Business
fin_news_nlp/yahoo_cad_tickers_news,https://ca.finance.yahoo.com/news/cipher-pharmaceuticals-reports-first-quarter-210000292.html,"Cipher Pharmaceuticals Inc. (TSX: CPH) (""Cipher"" or ""the Company"") today announced its financial and operating results for the three month period ended March 31, 2023.",CAD,CPH.TO,"CNW Group - Cipher Pharmaceuticals Reports First Quarter Results, Highlighted by Record Cash Per Share and Strong Financial Flexibility"
fin_news_nlp/yahoo_cad_tickers_news,https://ca.finance.yahoo.com/news/clairvest-partner-ecl-entertainment-build-221100059.html,"TORONTO, May 01, 2023 (GLOBE NEWSWIRE) -- Clairvest Group Inc. (TSX: CVG) (“CVG”) today announced that it, together with Clairvest Equity Partners VI (“CEP VI”, collectively “Clairvest”) and ECL Entertainment, LLC (“ECL”) have acquired licensed gaming operations that will enable them to build the leading gaming operation in Southern New Hampshire. ECL is an experienced gaming operator, which owns and operates multiple historical horse racing (“HHR”) facilities in Kentucky including the Mint at K",CAD,CVG.TO,GlobeNewswire - Clairvest to Partner with ECL Entertainment to Build and Operate A Historical Horse Racing Facility in New Hampshire
fin_news_nlp/yahoo_cad_tickers_news,https://ca.finance.yahoo.com/news/clarke-inc-reports-2023-first-191800869.html,"Clarke Inc. (""Clarke"" or the ""Company"") (TSX: CKI) (TSX: CKI.DB) today announced its results for the three months ended March 31, 2023.",CAD,CKI.TO,CNW Group - Clarke Inc. Reports 2023 First Quarter Results and Election of Directors
fin_news_nlp/yahoo_cad_tickers_news,https://ca.finance.yahoo.com/news/commerce-split-monthly-dividend-declared-130000903.html,"TORONTO, May 18, 2023 (GLOBE NEWSWIRE) -- New Commerce Split (The ""Company"") declares its monthly distribution of $0.02500 per share ($0.30 annually), for Class I Preferred shareholders (YCM.PR.A), and $0.03125 per share ($0.375 annually) for Class II Preferred shareholders (YCM.PR.B). The Class I Preferred share dividends are paid at an annual rate of 6.00% based on the $5 repayment amount. Class II Preferred share dividends are paid at an annual rate of 7.50% based on their $5 repayment amount",CAD,YCM.TO,GlobeNewswire - COMMERCE SPLIT Monthly Dividend Declared for Class I and Class II Preferred Shares
fin_news_nlp/yahoo_cad_tickers_news,https://ca.finance.yahoo.com/news/condor-signs-heads-agreement-government-110000758.html,"CALGARY, Alberta, May 23, 2023 (GLOBE NEWSWIRE) -- Condor Energies Inc. (“Condor” or the “Company”) (TSX: CDR), a Canadian based energy transition company is pleased to announce that it has signed a Heads of Agreement (“HoA”) with the Ministry of Energy, the Ministry of Mining Industry and Geology and the national hydrocarbon energy company JSC Uzbekneftegaz (“UNG”) of the Republic of Uzbekistan. The HoA establishes the detailed framework for the final negotiations and approval of the definitive",CAD,CDR.TO,GlobeNewswire - Condor Signs a Heads of Agreement With the Government and National Energy Company of the Republic of Uzbekistan to Enhance Gas Production on Eight Gas Fields
fin_news_nlp/yahoo_cad_tickers_news,https://ca.finance.yahoo.com/news/conifex-taking-unscheduled-downtime-mackenzie-120000036.html,"VANCOUVER, British Columbia, May 19, 2023 (GLOBE NEWSWIRE) -- Conifex Timber Inc. (“Conifex”) (TSX: CFF) announced today that it has made the difficult decision to take unscheduled downtime for four weeks at its Mackenzie, British Columbia sawmill commencing June 5, 2023. It is anticipated that the unscheduled downtime will impact production capacity by approximately 16 million board feet. The downtime is necessitated by the low water levels forecasted in the Williston Reservoir negatively impac",CAD,CFF.TO,GlobeNewswire - Conifex Taking Unscheduled Downtime at Mackenzie Lumber Production Facility
fin_news_nlp/yahoo_cad_tickers_news,https://ca.finance.yahoo.com/news/want-1-million-retirement-invest-183000944.html,"Hyper-growth stocks like Constellation Software could turn $50,000 into a million by 2033. The post Want $1 Million in Retirement? Invest $50,000 in These 3 Stocks and Wait a Decade appeared first on The Motley Fool Canada.",CAD,CSU.TO,"The Motley Fool - Want $1 Million in Retirement? Invest $50,000 in These 3 Stocks and Wait a Decade"
fin_news_nlp/yahoo_cad_tickers_news,https://ca.finance.yahoo.com/news/san-diego-gas-electric-expands-210000289.html,"Copperleaf® Technologies Inc. (TSX:CPLF) (""Copperleaf"" or the ""Company"") announces the expansion of its decision analytics solution by San Diego Gas & Electric (""SDG&E""), a regulated electrical and natural gas utility that provides clean, safe, and reliable energy to better the lives of the people it serves in San Diego and South Orange counties.",CAD,CPLF.TO,CNW Group - San Diego Gas & Electric Expands Copperleaf to Entire Enterprise
fin_news_nlp/yahoo_cad_tickers_news,https://ca.finance.yahoo.com/news/cronos-group-inc-tse-cron-104021946.html,Key Insights Cronos Group's estimated fair value is CA$1.68 based on 2 Stage Free Cash Flow to Equity Cronos Group is...,CAD,CRON.TO,Simply Wall St. - Is Cronos Group Inc. (TSE:CRON) Expensive For A Reason? A Look At Its Intrinsic Value
fin_news_nlp/yahoo_cad_tickers_news,https://ca.finance.yahoo.com/news/crown-capital-reports-voting-results-154300236.html,"In accordance with Toronto Stock Exchange requirements, Crown Capital Partners Inc. (""Crown"" or the ""Corporation"") (TSX: CRWN), a capital partner to entrepreneurs and growth businesses, announced the voting results from its Annual Meeting of Shareholders held on May 11, 2023.",CAD,CRWN.TO,CNW Group - Crown Capital Reports Voting Results from Annual and Special Meeting of Shareholders
fin_news_nlp/yahoo_cad_tickers_news,https://ca.finance.yahoo.com/news/definity-financial-corporation-supports-local-210000962.html,"Today, Definity Financial Corporation (TSX: DFY) is proud to announce its partnership with Green Communities Canada, including a $500,000 contribution in support of the Living Cities Canada Fund.",CAD,DFY.TO,CNW Group - DEFINITY FINANCIAL CORPORATION SUPPORTS LOCAL CLIMATE RESILIENCE THROUGH PARTNERSHIP WITH GREEN COMMUNITIES CANADA IN SUPPORT OF THE LIVING CITIES CANADA FUND
fin_news_nlp/yahoo_cad_tickers_news,https://ca.finance.yahoo.com/news/delta-9-applauds-manitoba-government-001100058.html,"WINNIPEG, Manitoba, May 17, 2023 (GLOBE NEWSWIRE) -- DELTA 9 CANNABIS INC. (TSX: DN) (OTCQB: DLTNF) (“Delta 9” or the “Company”), is pleased to support Bill 10 proposed by the Manitoba Conservative Government which would repeal the 6% Social Responsibility Fee (the “SRF”) on gross retail cannabis revenues. The Bill, if passed, would eliminate SRF owing from retailers retroactive to January 1, 2022. During the public consultations on Bill 10, cannabis retailers, including Delta 9, have encouraged",CAD,DN.TO,GlobeNewswire - Delta 9 Applauds Manitoba Government on Bill 10 Amendment to Repeal 6% Social Responsibility Fee
fin_news_nlp/yahoo_cad_tickers_news,https://ca.finance.yahoo.com/news/denison-mine-dnn-upgraded-buy-160004759.html,"Denison Mine (DNN) might move higher on growing optimism about its earnings prospects, which is reflected by its upgrade to a Zacks Rank #2 (Buy).",CAD,DML.TO,Zacks - Denison Mine (DNN) Upgraded to Buy: What Does It Mean for the Stock?
fin_news_nlp/yahoo_cad_tickers_news,https://ca.finance.yahoo.com/news/1-underpriced-tsx-stock-m-164500045.html,An underpriced but potentially high-growth stock is a screaming buy for its impressive revenue and net earnings to start 2023. The post 1 Underpriced TSX Stock I’m Snatching Up Fast appeared first on The Motley Fool Canada.,CAD,DXT.TO,The Motley Fool - 1 Underpriced TSX Stock I’m Snatching Up Fast
fin_news_nlp/yahoo_cad_tickers_news,https://ca.finance.yahoo.com/news/dialogue-announces-annual-general-shareholder-155300296.html,"Dialogue Health Technologies Inc. (TSX: CARE) (""Dialogue"" or the ""Company""), Canada's premier virtual healthcare and wellness platform, announced today that shareholders voted in favour of all items of business put forth by the Company at its annual general meeting of shareholders held on May 23, 2023 (the ""Meeting"").",CAD,CARE.TO,CNW Group - Dialogue Announces Annual General Shareholder Meeting Voting Results
fin_news_nlp/yahoo_cad_tickers_news,https://ca.finance.yahoo.com/news/discovery-intercepts-197-g-t-110000847.html,"TORONTO, May 24, 2023 (GLOBE NEWSWIRE) -- Discovery Silver Corp. (TSX: DSV, OTCQX: DSVSF) (“Discovery” or the “Company”) is pleased to announce results from Feasibility Study drill holes on its flagship Cordero silver project (“Cordero” or “the Project”) located in Chihuahua State, Mexico. These holes consist of reserve expansion drilling and will be incorporated in a Feasibility Study in conjunction with a resource update planned for the first half of 2024. Highlight intercepts from this curren",CAD,DSV.TO,GlobeNewswire - Discovery Intercepts 197 g/t AgEq over 41 m in Feasibility Study Drilling at Cordero
