source,url,description,country,company,title
fin_news_nlp/yahoo_cad_tickers_news,https://ca.finance.yahoo.com/news/haivision-rejects-revised-non-binding-000000825.html,"Haivision Systems Inc. (""Haivision"" or the ""Company"") (TSX: HAI) announces that its board of directors (the ""Board"") has unanimously determined that the unsolicited, revised non-binding expression of interest received from Evertz Technologies Limited on April 14, 2023 is not in the best interests of Haivision and its stakeholders, and that Haivision should remain focused on executing its business plan and growth strategy.",CAD,HAI.TO,CNW Group - Haivision Rejects Revised Non-Binding Expression of Interest
fin_news_nlp/yahoo_cad_tickers_news,https://ca.finance.yahoo.com/news/hammerhead-energy-inc-announces-amendments-211400192.html,"CALGARY, Alberta, May 19, 2023 (GLOBE NEWSWIRE) -- Hammerhead Energy Inc. (""Hammerhead"" or ""HEI"") (TSX: HHRS, HHRS.WT ; NASDAQ: HHRS, HHRSW) announced today that that it has effected certain amendments to its previously announced substantial issuer bid (the ""Offer"") to purchase for cancellation up to 20,000,000 of its warrants to purchase Class A common shares of Hammerhead (the ""Warrants"") at a purchase price of US$1.00 per Warrant. On May 19, 2023, Hammerhead filed with the United States Secur",CAD,HHRS.TO,GlobeNewswire - Hammerhead Energy Inc. announces amendments to its substantial issuer bid
fin_news_nlp/yahoo_cad_tickers_news,https://ca.finance.yahoo.com/news/hls-therapeutics-announces-q1-fiscal-103000984.html,"HLS Therapeutics Inc. (""HLS"" or the ""Company"") (TSX: HLS), a pharmaceutical company focusing on central nervous system (""CNS"") and cardiovascular markets, announces its financial results for the three-month period ended March 31, 2023. All amounts are in thousands of United States (""U.S."") dollars unless otherwise stated.",CAD,HLS.TO,CNW Group - HLS Therapeutics Announces Q1 Fiscal 2023 Financial Results
fin_news_nlp/yahoo_cad_tickers_news,https://ca.finance.yahoo.com/news/home-trust-releases-2022-public-223100564.html,"TORONTO, May 15, 2023--Home Capital Group Inc. (""Home Capital"" or ""the Company"") (TSX:HCG) reported that the Public Accountability Statement for Home Trust Company, a subsidiary of Home Capital, is now available online at www.hometrust.ca/about/public-accountability. The Public Accountability Statement highlights activities that Home Trust has undertaken to support its commitment to corporate social responsibility.",CAD,HCG.TO,Business Wire - Home Trust Releases 2022 Public Accountability Statement
fin_news_nlp/yahoo_cad_tickers_news,https://ca.finance.yahoo.com/news/ia-financial-group-announces-annual-175100256.html,"Jacques Martin, Chair of the Board of iA Financial Group, is pleased to announce that the nominees listed in the proxy solicitation circular dated March 14, 2023 (""Circular""), were elected as directors of iA Financial Corporation Inc. (""iA Financial Corporation"") and the nominees listed in the Information Document for Participating Policyholders dated March 14, 2023 (""Information Document"") were elected as directors of Industrial Alliance Insurance and Financial Services Inc. (""iA Insurance"").",CAD,IAG.TO,CNW Group - iA Financial Group announces annual meeting voting results
fin_news_nlp/yahoo_cad_tickers_news,https://ca.finance.yahoo.com/news/imv-receives-nasdaq-delisting-notice-203000189.html,"DARTMOUTH, Nova Scotia & CAMBRIDGE, Mass., May 08, 2023--IMV Inc. (the ""Company"" or ""IMV"") (Nasdaq: IMV; TSX: IMV), a clinical-stage biopharmaceutical company developing a portfolio of immune-educating therapies based on its novel DPX® platform to treat solid and hematologic cancers, today announced that it was notified by the Listing Qualifications Department of The Nasdaq Stock Market LLC (""Nasdaq"") that Nasdaq, in accordance with Nasdaq Listing Rules 5101, 5110(b) and IM-5101-1, has in exerci",CAD,IMV.TO,Business Wire - IMV Receives NASDAQ Delisting Notice
fin_news_nlp/yahoo_cad_tickers_news,https://ca.finance.yahoo.com/news/intelgenx-receives-amended-del-license-120000310.html,"- Provides opportunity to address market gap, catering to growing industry demand for reliable and efficient testing services - SAINT LAURENT, Quebec, May 17, 2023 (GLOBE NEWSWIRE) -- IntelGenx Corp. (TSX:IGX) (OTCQB:IGXT) (the ""Company"" or ""IntelGenx"") a leading drug delivery company, is pleased to announce that it has received an amended Drug Establishment License (“DEL”) from Health Canada, allowing the Company to conduct third-party testing. Analytical testing of finished products and interm",CAD,IGX.TO,GlobeNewswire - IntelGenx Receives Amended DEL License to Conduct Third-Party Testing
fin_news_nlp/yahoo_cad_tickers_news,https://ca.finance.yahoo.com/news/international-petroleum-corporation-announces-results-090000514.html,"TORONTO, May 22, 2023 (GLOBE NEWSWIRE) -- International Petroleum Corporation (IPC or the Corporation) (TSX, Nasdaq Stockholm: IPCO) is pleased to announce that IPC repurchased a total of 137,000 IPC common shares (ISIN: CA46016U1084) during the period of May 15 to 19, 2023 under IPC’s normal course issuer bid / share repurchase program (NCIB). IPC’s NCIB, announced on December 1, 2022, is being implemented in accordance with the Market Abuse Regulation (EU) No 596/2014 (MAR) and Commission Dele",CAD,IPCO.TO,GlobeNewswire - International Petroleum Corporation Announces Results of Normal Course Issuer Bid
fin_news_nlp/yahoo_cad_tickers_news,https://ca.finance.yahoo.com/news/invesco-canada-announces-cash-distributions-200000144.html,"Invesco Canada Ltd. (""Invesco"") today announced the May 2023 distributions for its exchange-traded funds (ETFs). Unitholders of record on May 30, 2023, will receive cash distributions payable on June 7, 2023.",CAD,IIAE.TO,CNW Group - Invesco Canada announces cash distributions for its ETFs
fin_news_nlp/yahoo_cad_tickers_news,https://ca.finance.yahoo.com/news/insider-spends-us-108k-buying-121745186.html,"Even if it's not a huge purchase, we think it was good to see that William Kennedy, the Independent Chairman of Jaguar...",CAD,JAG.TO,Simply Wall St. - Insider Spends US$108k Buying More Shares In Jaguar Mining \
fin_news_nlp/yahoo_cad_tickers_news,https://ca.finance.yahoo.com/news/karnalyte-resources-inc-announces-2023-200900519.html,"Karnalyte Resources Inc. (""Karnalyte"" or the ""Company"") (TSX: KRN) today announced its financial results and corporate highlights for the first quarter ended March 31, 2023.",CAD,KRN.TO,CNW Group - KARNALYTE RESOURCES INC. ANNOUNCES 2023 FIRST QUARTER RESULTS
fin_news_nlp/yahoo_cad_tickers_news,https://ca.finance.yahoo.com/news/karora-resources-reports-record-production-111500152.html,"Karora Resources Inc. (TSX: KRR) (""Karora"" or the ""Company"") today announced financial and operating results for the first quarter of 2023 (""Q1 2023""). The Company's full unaudited condensed interim financial statements and management discussion & analysis (""MD&A) are available on SEDAR at www.sedar.com and on the Company's website at www.karoraresources.com. All dollar amounts are in Canadian dollars, unless otherwise noted.",CAD,KRR.TO,"CNW Group - KARORA RESOURCES REPORTS RECORD PRODUCTION, IMPROVED OPERATING EARNINGS AND CASH FLOW IN FIRST QUARTER 2023"
fin_news_nlp/yahoo_cad_tickers_news,https://ca.finance.yahoo.com/news/kelso-technologies-inc-financial-results-130000667.html,"VANCOUVER, British Columbia and BONHAM, Texas, May 11, 2023 (GLOBE NEWSWIRE) -- Kelso Technologies Inc. (“Kelso” or the “Company”), (TSX: KLS), (NYSE American: KIQ) reports that it has released its unaudited consolidated interim financial statements and Management Discussion and Analysis for the three months ended March 31, 2023. The unaudited consolidated interim financial statements were prepared in accordance with International Financial Reporting Standards (“IFRS”) as issued by the Internati",CAD,KLS.TO,"GlobeNewswire - Kelso Technologies Inc. Financial Results for the Three Months Ended March 31, 2023"
fin_news_nlp/yahoo_cad_tickers_news,https://ca.finance.yahoo.com/news/industry-leading-speakers-bring-melody-110000178.html,"OTTAWA, Ontario, May 23, 2023--New York Times best seller and popular podcast host Mel Robbins and supply chain thought leader and co-founder of Zero100 Kevin O’Marah will take the main stage during Kinexions ‘23, the conference for supply chain planners and innovators hosted by Kinaxis®, Inc. (TSX:KXS). Held in Nashville on June 19-21, registration is now open for the in person and virtual event at www.kinexions.com.",CAD,KXS.TO,Business Wire - Industry-Leading Speakers Will Bring Melody to ‘Music City’ at Kinexions ‘23
fin_news_nlp/yahoo_cad_tickers_news,https://ca.finance.yahoo.com/news/kits-eyecare-present-2023-rbc-120000807.html,"Kits Eyecare Ltd. (TSX: KITS) (""KITS"" or the ""Company""), a leading vertically integrated eyecare provider, will be presenting at the 2023 RBC Capital Markets Consumer Day being held on June 8, 2023, at the Lotte New York Palace Hotel in New York, NY.",CAD,KITS.TO,"CNW Group - KITS Eyecare to Present at the 2023 RBC Capital Markets Consumer Investor Day on June 8, 2023"
fin_news_nlp/yahoo_cad_tickers_news,https://ca.finance.yahoo.com/news/kp-tissue-tse-kpt-pay-100949898.html,"The board of KP Tissue Inc. ( TSE:KPT ) has announced that it will pay a dividend on the 17th of July, with investors...",CAD,KPT.TO,Simply Wall St. - KP Tissue (TSE:KPT) Will Pay A Dividend Of CA$0.18
fin_news_nlp/yahoo_cad_tickers_news,https://ca.finance.yahoo.com/news/laramide-resources-ltd-long-pocket-113000224.html,"Laramide Resources Ltd. (""Laramide"" or the ""Company"") (TSX: LAM; ASX: LAM; OTCQX: LMRXF) is pleased to announce results from the Long Pocket and Amphitheatre drill programs at its Westmoreland Uranium Project in Queensland, Australia (""Westmoreland"").",CAD,LAM.TO,"CNW Group - Laramide Resources Ltd. Long Pocket and Amphitheatre Drilling Results Outline Growth Potential of Westmoreland Uranium Project, Queensland, Australia; Plans Further Drilling in 2023"
fin_news_nlp/yahoo_cad_tickers_news,https://ca.finance.yahoo.com/news/lifespeak-inc-announces-first-quarter-110000616.html,"LifeSpeak Inc. (""LifeSpeak"" or the ""Company"") (TSX: LSPK), the leading whole-person wellbeing solution for employers, health plans and other organizations, announced today its financial and operational results for the three months ended March 31, 2023. All references to dollar values in this press release are in Canadian dollars, unless otherwise indicated.",CAD,LSPK.TO,CNW Group - LifeSpeak Inc. Announces First Quarter 2023 Results
fin_news_nlp/yahoo_cad_tickers_news,https://ca.finance.yahoo.com/news/loncor-gold-closes-private-placement-234000655.html,"Loncor Gold Inc. (""Loncor"" or the ""Company"") (TSX: LN) (OTCQX: LONCF) (FSE: LO51) is pleased to announce that, further to its May 4, 2023 and April 5, 2023 press releases, it has closed the balance of its Cdn$2,160,000 non-brokered private placement financing (the ""Financing""), such balance involving the issue of 3,465,000 units of the Company (the ""Units"") at a price of Cdn$0.40 per Unit for gross proceeds of Cdn$1,386,000. Each Unit consists of one common share of the Company and one common sh",CAD,LN.TO,CNW Group - Loncor Gold Closes Private Placement Financing
fin_news_nlp/yahoo_cad_tickers_news,https://ca.finance.yahoo.com/news/madison-pacific-properties-inc-announces-233000870.html,"VANCOUVER, British Columbia, April 13, 2023 (GLOBE NEWSWIRE) -- Madison Pacific Properties Inc. (the Company) (TSX: MPC and MPC.C), a Vancouver-based real estate company announces the results of operations for the six months ended February 28, 2023. The results reported are pursuant to International Financial Reporting Standards (IFRS) for public companies. For the six months ended February 28, 2023, the Company is reporting net income of $23.0 million (2022: $20.3 million); cash flows from oper",CAD,MPC.TO," - Madison Pacific Properties Inc. announces the results for the six months ended February 28, 2023"
fin_news_nlp/yahoo_cad_tickers_news,https://ca.finance.yahoo.com/news/mag-silver-mag-q1-earnings-153403400.html,"MAG Silver (MAG) first-quarter earnings miss estimates, net income improves y/y.",CAD,MAG.TO,"Zacks - MAG Silver (MAG) Q1 Earnings Miss Estimates, Up Y/Y"
fin_news_nlp/yahoo_cad_tickers_news,https://ca.finance.yahoo.com/news/magna-international-driving-future-electric-140000374.html,Here's why Magna International (TSX:MG) is a top way long-term investors can play the surge in electric vehicles over the long term. The post Magna International: Driving the Future of Electric Vehicles? appeared first on The Motley Fool Canada.,CAD,MG.TO,The Motley Fool - Magna International: Driving the Future of Electric Vehicles?
fin_news_nlp/yahoo_cad_tickers_news,https://ca.finance.yahoo.com/news/mainstreet-equity-corp-reports-16-105700966.html,"CALGARY, May 09, 2023--In Q2 2023, Mainstreet Equity Corp. (""Mainstreet"", TSX:MEQ) once again achieved double-digit, year-over-year growth across all key operating metrics for the sixth consecutive quarter, extending a period of high performance from Q1 as we continue to exhibit solid results despite economic volatility. Funds from operations (""FFO"") grew 25% in Q2, net operating income (""NOI"") increased 18%, and revenues rose 16% (on a per-share basis, FFO grew 26% from $1.21 to $1.52 in Q2 202",CAD,MEQ.TO,Business Wire - Mainstreet Equity Corp Reports 16% Growth in Revenues
fin_news_nlp/yahoo_cad_tickers_news,https://ca.finance.yahoo.com/news/could-market-wrong-major-drilling-151650313.html,"Major Drilling Group International (TSE:MDI) has had a rough month with its share price down 8.3%. However, stock...",CAD,MDI.TO,Simply Wall St. - Could The Market Be Wrong About Major Drilling Group International Inc. (TSE:MDI) Given Its Attractive Financial Prospects?
fin_news_nlp/yahoo_cad_tickers_news,https://ca.finance.yahoo.com/news/manulife-investment-management-launches-two-120000285.html,Manulife Investment Management announced today two new actively managed Manulife Smart Exchange Traded Funds (ETFs) have closed their initial offering of units and will begin trading today on the NEO Exchange. The firm's Multi-Asset Solutions Team will manage the Manulife Smart Global Dividend ETF Portfolio (GDIV) and the Manulife Smart Global Bond ETF (GBND) offering market participants more options for generating income within their investment portfolios.,CAD,MINT.TO,CNW Group - Manulife Investment Management launches two Smart Global ETFs giving investors additional income solutions
fin_news_nlp/yahoo_cad_tickers_news,https://ca.finance.yahoo.com/news/4-best-stocks-invest-2-201500701.html,"Canadian investors with some cash to spend in May 2023 should look to promising stocks like Celestica Inc. (TSX:CLS) and others right now. The post 4 of the Best Stocks to Invest $2,000 in Right Now appeared first on The Motley Fool Canada.",CAD,MFI.TO,"The Motley Fool - 4 of the Best Stocks to Invest $2,000 in Right Now"
fin_news_nlp/yahoo_cad_tickers_news,https://ca.finance.yahoo.com/news/2-cheap-excellent-dividend-stocks-191500097.html,Discover two affordable dividend stocks with great potential for your TFSA. Secure steady income and build your wealth wisely. The post 2 Cheap But Excellent Dividend Stocks to Buy for Your TFSA appeared first on The Motley Fool Canada.,CAD,MRE.TO,The Motley Fool - 2 Cheap But Excellent Dividend Stocks to Buy for Your TFSA
fin_news_nlp/yahoo_cad_tickers_news,https://ca.finance.yahoo.com/news/mawson-subsidiary-sxg-intersects-1-201500957.html,"Mawson Gold Limited (""Mawson"" or the ""Company"") (TSX:MAW)(Frankfurt:MXR)(OTC PINK: MWSNF) announces results from drillhole SDDSC064 ( 1.2 m @ 121.8 g/t Au from 889.6 m ) from the deepest mineralization (830 m vertically below surface) and one of the two highest grade intersections to date, and a 115 m down-dip extension from SDDSC061 (12.0 m @ 7.4 g/t AuEq incl 0.3 m @ 249.5 g/t AuEq) at the Sunday Creek Project in Victoria, Australia (Figure 1).",CAD,MAW.TO,"ACCESSWIRE - Mawson’s Subsidiary SXG Intersects 1.2 m @ 121.8 g/t Au in Deepest Hole with Visible Gold Increasing with Depth at Sunday Creek, Victoria, Australia"
fin_news_nlp/yahoo_cad_tickers_news,https://ca.finance.yahoo.com/news/maxim-power-corp-announces-2023-223100231.html,"CALGARY, Alberta, May 09, 2023 (GLOBE NEWSWIRE) -- Maxim Power Corp. (""MAXIM"" or the ""Corporation"") (TSX: MXG) announced today the release of financial and operating results for the first quarter ended March 31, 2023. The unaudited condensed consolidated interim financial statements, accompanying notes and Management’s Discussion and Analysis (“MD&A”) will be available on SEDAR and on MAXIM's website on May 9, 2023. All figures reported herein are Canadian dollars unless otherwise stated. FINANC",CAD,MXG.TO,GlobeNewswire - Maxim Power Corp. Announces 2023 First Quarter Financial and Operating Results
fin_news_nlp/yahoo_cad_tickers_news,https://ca.finance.yahoo.com/news/mcan-mortgage-tse-mkp-paying-120655000.html,MCAN Mortgage Corporation ( TSE:MKP ) will pay a dividend of CA$0.36 on the 30th of June. This makes the dividend yield...,CAD,MKP.TO,Simply Wall St. - MCAN Mortgage (TSE:MKP) Is Paying Out A Dividend Of CA$0.36
fin_news_nlp/yahoo_cad_tickers_news,https://ca.finance.yahoo.com/news/mccoy-global-first-quarter-2023-121654610.html,McCoy Global ( TSE:MCB ) First Quarter 2023 Results Key Financial Results Revenue: CA$16.9m (up 90% from 1Q 2022). Net...,CAD,MCB.TO,Simply Wall St. - McCoy Global First Quarter 2023 Earnings: EPS: CA$0.02 (vs CA$0.01 in 1Q 2022)
fin_news_nlp/yahoo_cad_tickers_news,https://ca.finance.yahoo.com/news/mcewen-mining-reduces-debt-39-194000442.html,"TORONTO, May 23, 2023 (GLOBE NEWSWIRE) -- McEwen Mining Inc. (NYSE: MUX) (TSX: MUX) (“McEwen Mining” or the “Company”) today reported that it has repaid $25 million of its senior secured debt payable to Sprott Resource Lending (“Sprott”) and Sprott is no longer a lender. Prior to the repayment, the Company had $50 million in senior secured debt and a $15 million unsecured promissory note, for a total debt of $65 million. Concurrent with the repayment to Sprott, the senior secured debt was amende",CAD,MUX.TO,GlobeNewswire - McEwen Mining Reduces Debt by 39%
fin_news_nlp/yahoo_cad_tickers_news,https://ca.finance.yahoo.com/news/mdf-commerce-board-directors-enhanced-203000972.html,"Mr. Vincent has more than 30 years of strategic repositioning and business development experienceMONTREAL, May 15, 2023 (GLOBE NEWSWIRE) -- mdf commerce Inc. (TSX:MDF), a SaaS leader in digital commerce technologies, announced today that Martial Vincent, CPA, an experienced corporate director with extensive experience in the electrical and electronic manufacturing industry, will be joining its team as a member of its Board of Directors. Mr. Vincent will serve on the Human Resources and Governanc",CAD,MDF.TO,GlobeNewswire - mdf commerce’s Board of Directors is enhanced by the appointment of Martial Vincent
fin_news_nlp/yahoo_cad_tickers_news,https://ca.finance.yahoo.com/news/medexus-announces-normal-course-issuer-213000300.html,"NCIB will commence on May 15, 2023 and is expected to continue through the debentures' October 2023 maturity dateNCIB purchases will deleverage Medexus's balance sheet and lead to lower overall debt levels and reduced future debt service obligations in preparation for the debentures' October 2023 maturity dateToronto, Ontario and Chicago, Illinois--(Newsfile Corp. - May 10, 2023) - Medexus Pharmaceuticals (TSX: MDP) (TSX: MDP.DB) (OTCQX: MEDXF) is pleased to announce that the Toronto Stock Excha",CAD,MDP.TO,"Newsfile - Medexus Announces Normal Course Issuer Bid, or NCIB, for Its Convertible Debentures"
fin_news_nlp/yahoo_cad_tickers_news,https://ca.finance.yahoo.com/news/mediavalet-selected-global-leader-audio-114500868.html,"Vancouver, British Columbia--(Newsfile Corp. - May 23, 2023) - MediaValet Inc. (TSX: MVP) (the Company), a leading provider of enterprise digital asset management, video content management and creative operations software (""DAM""), is pleased to announce it was selected by a world leader in audio product design, development, and manufacturing (the ""Customer""). Commencing in May 2023, with first-year billings of $190,000, the auto-renewing subscription includes MediaValet's enterprise digital asse",CAD,MVP.TO,Newsfile - MediaValet Selected by a Global Leader in Audio Experience
fin_news_nlp/yahoo_cad_tickers_news,https://ca.finance.yahoo.com/news/medicenna-granted-180-day-extension-110000064.html,"TORONTO and HOUSTON, April 27, 2023 (GLOBE NEWSWIRE) -- Medicenna Therapeutics Corp. (""Medicenna"" or “the Company"") (NASDAQ: MDNA TSX: MDNA), a clinical stage immuno-oncology company, today announced that on April 25, 2023 it received a notice (the “Extension Notice”) from the Nasdaq Stock Market LLC (“Nasdaq”) granting the Company’s request for a 180-day extension to regain compliance with the minimum bid price requirement (""Minimum Bid Requirement"") of US$1.00 per share under the Nasdaq Listin",CAD,MDNA.TO,GlobeNewswire - Medicenna Granted 180-Day Extension to Meet Nasdaq Minimum Bid Price Requirement
fin_news_nlp/yahoo_cad_tickers_news,https://ca.finance.yahoo.com/news/melcor-developments-announces-first-quarter-213000231.html,"EDMONTON, Alberta, May 10, 2023 (GLOBE NEWSWIRE) -- Melcor Developments Ltd. (TSX: MRD), an Alberta-based real estate development and asset management company, today reported results for the quarter ended March 31, 2023. Revenue was down $36.08 million or 32% compared to Q1-2022. Revenue from Income Properties was stable; however, Community Development revenue was down significantly. Due to the seasonal nature of Community Development, first quarter results can vary significantly from year to ye",CAD,MRD.TO,"GlobeNewswire - Melcor Developments announces first quarter results, declares quarterly dividend of $0.16 per share"
fin_news_nlp/yahoo_cad_tickers_news,https://ca.finance.yahoo.com/news/middlefield-u-equity-dividend-etf-134500917.html,"TORONTO, April 20, 2023 (GLOBE NEWSWIRE) -- Middlefield U.S. Equity Dividend ETF (TSX: MUSA) (the “Fund”) is pleased to announce that distributions for the second quarter of 2023 will be payable to unitholders of Middlefield U.S. Equity Dividend ETF as follows: Record DatePayable DateDistribution PerTrust UnitApril 30, 2023May 15, 2023$0.04583May 31, 2023June 15, 2023$0.04583June 30, 2023July 14, 2023$0.04583 The trust units trade on the Toronto Stock Exchange under the symbol MUSA. The Fund off",CAD,MUSA.TO, - Middlefield U.S. Equity Dividend ETF Distributions
fin_news_nlp/yahoo_cad_tickers_news,https://ca.finance.yahoo.com/news/mineros-reports-first-quarter-2023-113600516.html,"Mineros S.A. (TSX: MSA) (CB: MINEROS) (""Mineros"" or the ""Company"") today reported its financial and operational results for the three months ended March 31, 2023. For further information, please see the Company's unaudited condensed consolidated interim financial statements and management's discussion and analysis (""MD&A"") filed under its profile on www.sedar.com.",CAD,MSA.TO,CNW Group - Mineros Reports First Quarter 2023 Financial and Operational Results
fin_news_nlp/yahoo_cad_tickers_news,https://ca.finance.yahoo.com/news/mogo-reports-results-q1-2023-114700892.html,"VANCOUVER, British Columbia, May 11, 2023--Mogo Inc. (NASDAQ:MOGO) (TSX:MOGO) (""Mogo"" or the ""Company""), one of Canada’s leading financial technology companies, today announced its financial and operational results for the first quarter ended March 31, 2023.",CAD,MOGO.TO, - Mogo Reports Results for Q1 2023
fin_news_nlp/yahoo_cad_tickers_news,https://ca.finance.yahoo.com/news/moneta-announces-closing-26-million-181500053.html,"Toronto, Ontario--(Newsfile Corp. - May 17, 2023) - Moneta Gold Inc. (TSX: ME) (OTCQX: MEAUF) (FSE: MOPA) (""Moneta"" or the ""Company"") is pleased to announce that it has closed its previously announced (see April 19, 2023 press release) bought deal private placement of 13,868,400 charity flow-through common shares of the Company that qualify as ""flow-through shares"" (within the meaning of subsection 66(15) of the Income Tax Act (Canada)) and ""Ontario focused flow-through shares"" as ...",CAD,ME.TO,"Newsfile - Moneta Announces Closing of $26 Million Bought Deal Private Placement, Including Full Exercise of Over-Allotment Option"
fin_news_nlp/yahoo_cad_tickers_news,https://ca.finance.yahoo.com/news/mountain-province-diamonds-announces-first-003000224.html,"Mountain Province Diamonds Inc. (""Mountain Province"", the ""Company"") (TSX: MPVD) (OTC: MPVD) today announces financial results for the first quarter ended March 31, 2023 (""the Quarter"" or ""Q1 2023"") from the Gahcho Kué Diamond Mine (""GK Mine""). All figures are expressed in Canadian dollars unless otherwise noted.",CAD,MPVD.TO,CNW Group - Mountain Province Diamonds Announces First Quarter Financial Results for 2023
fin_news_nlp/yahoo_cad_tickers_news,https://ca.finance.yahoo.com/news/better-buy-restaurant-brands-stock-150000705.html,I’m looking at Restaurant Brands International Inc. (TSX:QSR) and MTY Food Group Inc. (TSX:MTY) stocks after recent earnings. The post Better Buy: Restaurant Brands Stock or MTY Food Group? appeared first on The Motley Fool Canada.,CAD,MTY.TO,The Motley Fool - Better Buy: Restaurant Brands Stock or MTY Food Group?
