source,url,description,country,company,title
fin_news_nlp/yahoo_cad_tickers_news,https://ca.finance.yahoo.com/news/walker-river-announces-addtional-drill-140000499.html,"Vancouver, B.C., Feb. 01, 2023 (GLOBE NEWSWIRE) -- Walker River Resources Corp. (“Walker” or the “Company”) (TSX-V: “WRR”) is pleased to announce drill results from the late 2022 reverse circulation (“RC”) drill program at the 100% owned Lapon Gold Project located approximately 60 kilometres southeast of Yerington, Nevada. Drilling continues to confirm mineralization at Lapon Canyon and extend the Hotspot zone. At total of ten (10) holes were drilled here, including seven (7) at the new Hotspot",CAD,WRR.V,GlobeNewswire - WALKER RIVER ANNOUNCES ADDTIONAL DRILL RESULTS FROM THE LAPON GOLD PROJECT
fin_news_nlp/yahoo_cad_tickers_news,https://ca.finance.yahoo.com/news/westbridge-renewable-announces-origination-295mwdc-120000735.html,"Westbridge Renewable Energy Corporation (TSXV: WEB) (OTCQX: WEGYF) (FRA: PUQ) (""Westbridge"", ""Westbridge Renewable"" or the ""Company"") is pleased to announce the addition of the Red Willow Project (""Red Willow""), located in Stettler County No. 6, in central Alberta, Canada, to the Company's continuously growing portfolio. The Red Willow Project target capacity is 295 MWp solar photovoltaic and 100MW/200MWh of Battery Energy Storage System (""BESS"") with a two-hour battery duration.",CAD,WEB.V,CNW Group - Westbridge Renewable Announces the Origination of 295MWdc Red Willow Solar PV Plus 100MW/200MWh Battery Energy Storage System in Alberta
fin_news_nlp/yahoo_cad_tickers_news,https://ca.finance.yahoo.com/news/centr-brands-recent-launch-centr-135900885.html,"The beverage is a NEXTY award finalist at Natural Products Expo West Vancouver, British Columbia--(Newsfile Corp. - February 1, 2023) - CENTR Brands Corp. (CSE: CNTR) (FSE: 303) (OTCQB: CNTRF) (""CENTR"" or the ""Company""), one of the fastest-growing premium functional wellness drink brands in North America, and Kyowa Hakko USA are excited to announce that CENTR Enhanced sparkling water, a functional beverage with a blend of nootropic and adaptogenic ingredients that includes its Cognizin® citicoli",CAD,CNTR.CN,Newsfile - CENTR Brands Recent Launch of CENTR Enhanced Functional Sparkling Water featuring Cognizin Citicoline Received Acclaim as NEXTY Award Finalist
fin_news_nlp/yahoo_cad_tickers_news,https://ca.finance.yahoo.com/news/etruscus-discovers-significant-ip-anomaly-140000832.html,"Etruscus Resources Corp. (CSE: ETR) (OTC: ETRUF) (FSE: ERR) (the ""Company"" or ""Etruscus"") is pleased to announce initial results from it's 2022 exploration program (the ""Program"") at the Company's 100% owned Rock & Roll Property (or ""Property"") located in the prolific Golden Triangle in northwestern British Columbia, Canada. Results from an expanded 10.5 line-km induced-polarization survey (""IP"" or ""IP Survey"") at the Discovery Showing have confirmed a significant chargeability anomaly (""Zappa"")",CAD,ETR.CN,CNW Group - ETRUSCUS DISCOVERS SIGNIFICANT IP ANOMALY AT ROCK & ROLL PROPERTY
fin_news_nlp/yahoo_cad_tickers_news,https://ca.finance.yahoo.com/news/cadmium-telluride-solar-advantages-part-133000478.html,"New consortium pushes to accelerate the development of domestically manufactured, cheaper, more efficient CdTe solar cells.Vancouver, BC, Feb. 01, 2023 (GLOBE NEWSWIRE) -- First Tellurium Corp. (CSE: FTEL, OTC FSTTF) (the “Company” or “First Tellurium”), reports that a recent article in Solar Power World highlights the increasing importance of cadmium telluride (CdTe) solar cells for generating solar energy and domestic security. The article also notes that demand for American-made CdTe solar is",CAD,FTEL.CN,GlobeNewswire - Cadmium Telluride Solar Advantages Part of Strategic Adoption in United States
fin_news_nlp/yahoo_cad_tickers_news,https://ca.finance.yahoo.com/news/liquid-avatar-technologies-powers-aftermath-135000603.html,"Company's successful 100+ day early-stage launch creates new commercial opportunities for expansion of verifiable credentials, digital goods and services and the Metaverse. Toronto, Ontario and Bridgetown, Barbados--(Newsfile Corp. - February 1, 2023) - Liquid Avatar Technologies Inc. (CSE: LQID) (OTCQB: LQAVF) (FSE: 4T5) (""Liquid Avatar"" or the ""Company"") is pleased to announce the continued expansion of use of the Liquid Avatar Mobile App and Meta Park Pass™, providing Proof of Humanity, allow",CAD,LQID.CN,Newsfile - Liquid Avatar Technologies Powers Aftermath Islands' Proof of Humanity Engaging Users to Collect 1 Billion+ Platform Resources Creating 1.2 Million+ NFTs for its Metaverse
fin_news_nlp/yahoo_cad_tickers_news,https://ca.finance.yahoo.com/news/large-brazilian-banks-may-set-142013957.html,"Brazilian banks may start setting aside provisions for losses with retailer Americanas already in the fourth quarter of 2022, analysts say.  Banks such as BTG Pactual, Bradesco,Santander Brasil, Itaú Unibanco Holding and Banco do Brasil have around 15 billion reais in loans with Americanas, according to analyst reports.  Analysts estimate the banks may provision around 30% of their loans in the fourth quarter, which would be equivalent to  4.5 billion reais ($890 million), even with bankruptcy protection taking place in January, as a precautionary measure allowed by the Brazilian central bank.",CAD,ST.CN,Reuters - Large Brazilian banks may set aside around $890 million for Americanas losses in Q4
fin_news_nlp/yahoo_cad_tickers_news,https://ca.finance.yahoo.com/m/59974aea-7a6b-381b-93e7-1ea773506f07/amazon-makes-renewable-energy.html,"Amazon (NASDAQ: AMZN) grew its renewable energy portfolio by 8.3 gigawatts (GW) in 2022.  With those purchases, Amazon remains the largest corporate buyer of renewable energy, a title it has held since 2020.  The company continues to make new investments, positioning it to achieve its renewable energy goal well ahead of schedule.",CAD,BAM.TO,Motley Fool - Amazon Makes Renewable Energy History. Here's Why Investors Should Love the News.
fin_news_nlp/yahoo_cad_tickers_news,https://ca.finance.yahoo.com/news/just-starting-invest-3-smart-130000634.html,"If you're looking for smart beginner stocks to buy, you could look into asset management companies like Brookfield Asset Management (TSX:BAM). The post Just Starting to Invest? 3 Smart Stocks to Buy in February 2023 appeared first on The Motley Fool Canada.",CAD,BAM.TO,The Motley Fool - Just Starting to Invest? 3 Smart Stocks to Buy in February 2023
fin_news_nlp/yahoo_cad_tickers_news,https://ca.finance.yahoo.com/news/stocks-play-docebo-inc-143400101.html,"Announced today that Fosway Group, Europe’s number-one HR Industry Analyst, named Docebo as a Core Leader ...",CAD,DCBO.TO, - Stocks in play: Docebo Inc.
fin_news_nlp/yahoo_cad_tickers_news,https://ca.finance.yahoo.com/news/why-investors-advantage-2-oils-140002047.html,Why investors should use the Zacks Earnings ESP tool to help find stocks that are poised to top quarterly earnings estimates.,CAD,IMO.TO,Zacks - Why Investors Need to Take Advantage of These 2 Oils-Energy Stocks Now
fin_news_nlp/yahoo_cad_tickers_news,https://ca.finance.yahoo.com/news/tc-energy-pipe-lng-sees-150744265.html,"(Bloomberg) -- The price tag for TC Energy Corp.’s Coastal GasLink project has jumped to C$14.5 billion ($10.9 billion) — more than double the original estimate — as labor woes plague a pipeline that will supply Canada’s first major liquefied natural gas export plant.Most Read from Bloomberg8,000 Layoffs Don’t Exactly Scream Family ValuesNational Archives Releases Records Tied to Trump Classified DocumentsIntel Slashing CEO, Managers’ Pay in a Bid to Preserve CashPutin’s War in Ukraine Pushes Ex",CAD,TRP.TO,Bloomberg - TC Energy Pipe to LNG Site Sees Costs Soar to $10.9 Billion
fin_news_nlp/yahoo_cad_tickers_news,https://ca.finance.yahoo.com/news/thinkific-announces-timing-fourth-quarter-150700397.html,"Thinkific Labs Inc. (""Thinkific"" or ""the Company"") (TSX: THNC), a leading cloud-based software platform that enables entrepreneurs and established businesses of all sizes to create, market, and sell online learning products, will report its financial results for the fourth quarter and full year ended December 31, 2022 after market close on Thursday, February 23, 2023.",CAD,THNC.TO,CNW Group - Thinkific Announces Timing of Fourth Quarter and Year End 2022 Results Conference Call and Webcast
fin_news_nlp/yahoo_cad_tickers_news,https://ca.finance.yahoo.com/news/does-wsp-global-inc-tse-153012586.html,WSP Global Inc. ( TSE:WSP ) saw a decent share price growth in the teens level on the TSX over the last few months...,CAD,WSP.TO,Simply Wall St. - What Does WSP Global Inc.'s (TSE:WSP) Share Price Indicate?
fin_news_nlp/yahoo_cad_tickers_news,https://ca.finance.yahoo.com/news/focus-graphite-reports-92-42-142500703.html,"Focus Graphite Inc.(TSX.V:FMS)(OTCQX:FCSMF)(FRANKFURT:FKC) (""Focus"" or the ""Company"") is pleased to report the results for the first five (5) holes from the Company's 2022 exploration and definition drilling program at its 100%-owned Lac Tétépisca graphite project, located southwest of the Manicouagan Reservoir in the Côte-Nord administrative region of Québec, on the Nitassinan of the Pessamit Innu.",CAD,FMS.V,"ACCESSWIRE - Focus Graphite Reports 92.42 m grading 14.28% Graphitic Carbon (Cg) in hole LT-22-131; 86.66 m grading 15.00% Cg in hole LT-22-130; and 91.83 m grading 13.84% Cg in hole LT-22-132 from the 2022 Definition Drilling Program at Lac Tetepisca, Quebec"
fin_news_nlp/yahoo_cad_tickers_news,https://ca.finance.yahoo.com/news/mcloud-showcases-hyperscale-solution-google-170700115.html,"mCloud Technologies Corp. (Nasdaq: MCLD) (TSXV: MCLD), (""mCloud"" or the ""Company"") a provider of cloud technology solutions optimizing the performance, reliability, and sustainability of energy-intensive assets today announced it will join Google Cloud alongside other Google Cloud partners as a sponsor at the Informa LEAP 2023 tech conference at the Riyadh Front Expo Centre in Saudi Arabia, 6-9 February 2023.",CAD,MCLD.V,CNW Group - mCloud Showcases Hyperscale Solution on Google Cloud to Eliminate Methane Emissions at LEAP 2023 in Saudi Arabia
fin_news_nlp/yahoo_cad_tickers_news,https://ca.finance.yahoo.com/news/portofino-provides-projects-updates-2023-155500654.html,"Vancouver, British Columbia--(Newsfile Corp. - February 1, 2023) - PORTOFINO RESOURCES INC. (TSXV: POR) (OTCQB: PFFOF) (FSE: POTA) (""Portofino"" or the ""Company"") announces summary updates of its key projects and 2023 plans and objectives.Arizaro lithium Project, Salta (Argentina): Portofino management and the state-owned mining company of the Province of Salta (""REMSA""), continue to work together within the framework of the previously executed MOU agreement. Management has prepared and filed a """,CAD,POR.V, - Portofino Provides Projects Updates; 2023 Plans and Objectives
fin_news_nlp/yahoo_cad_tickers_news,https://ca.finance.yahoo.com/news/power-nickel-agrees-partnership-australian-155248945.html,"Power Nickel Inc CEO Terry Lynch joined Steve Darling from Proactive to share news the junior explorer has agreed to a partnership with Australia-based Fleet Space Technologies, which develops and ...",CAD,PNPN.V, - Power Nickel agrees to partnership with Australian-based Fleet Space Technologies
fin_news_nlp/yahoo_cad_tickers_news,https://ca.finance.yahoo.com/news/spectra7-showcase-200-400gbps-connectivity-120000818.html,"(TSXV: SEV) (OTCQB: SPVNF) Spectra7 Microsystems Inc. (""Spectra7"" or the ""Company""), a leading provider of high-performance analog semiconductor products for broadband connectivity markets, announced that it will be showcasing server and switch connectivity at this year's annual DesignCon Conference Exhibition being held in Santa Clara, California from February 1-2, 2023. Spectra7 will be showing Active Copper Cables with the Company's GaugeChanger™ chips from cable partners Molex, Amphenol and",CAD,SEV.V,CNW Group - Spectra7 to Showcase 200 and 400Gbps Connectivity using Active Copper Cables at DesignCon
fin_news_nlp/yahoo_cad_tickers_news,https://ca.finance.yahoo.com/news/sylla-gold-provides-private-placement-165400469.html,"Bedford, Nova Scotia--(Newsfile Corp. - February 1, 2023) - Sylla Gold Corp. (TSXV: SYG) (the ""Company"") announces that the Company has applied to the TSX Venture Exchange for an extension of its price protection for an additional 30 days in order to complete an additional tranche of the previously announced non-brokered private placement of up to 10,000,000 units at a price of $0.10 per unit for aggregate gross proceeds of up to $1,000,000 (the ...",CAD,SYG.V,Newsfile - Sylla Gold Provides Update on Private Placement of Units
fin_news_nlp/yahoo_cad_tickers_news,https://ca.finance.yahoo.com/news/argo-focus-near-term-oil-165900447.html,"Toronto, Ontario--(Newsfile Corp. - February 1, 2023) - Argo Gold Inc. (CSE: ARQ) (OTCQB: ARBTF) (XFRA, XSTU, XBER: A2ASDS) (""Argo"") announces that the company is going to focus on near-term oil production opportunities and not acquire the long lead-time Clearwater acreage and will not close the purchase and sale agreement to acquire 7,600 contiguous hectares of Clearwater oil land in the Nipisi area of Alberta for $725,000.Argo also announces that the company has entered into a second participa",CAD,ARQ.CN,Newsfile - Argo to Focus on Near-Term Oil Production Opportunities
fin_news_nlp/yahoo_cad_tickers_news,https://ca.finance.yahoo.com/news/diagnamed-holdings-incorporates-openai-chatgpt-152300356.html,"Brain Health Digital Platform to be available in May 2023TORONTO, Feb. 01, 2023 (GLOBE NEWSWIRE) -- DiagnaMed Holdings Corp. (“DiagnaMed” or the “Company”) (CSE: DMED), an artificial intelligence-driven digital health company focusing on improving brain health, today announces that it will incorporate OpenAI’s technology, ChatGPT, in its BRAIN AGE™ Artificial Intelligence (“AI”) Product Suite, which already includes a variety of API interfaces to build AI and machine learning functions, to furth",CAD,DMED.CN, - DiagnaMed Holdings Incorporates OpenAI’s ChatGPT into BRAIN AGE™ AI Product Suite
fin_news_nlp/yahoo_cad_tickers_news,https://ca.finance.yahoo.com/news/pharmather-holdings-submits-fda-meeting-162500346.html,"TORONTO, Feb. 01, 2023 (GLOBE NEWSWIRE) -- PharmaTher Holdings Ltd. (the “Company” or “PharmaTher”) (OTCQB: PHRRF) (CSE: PHRM), a leader in advancing specialty ketamine pharmaceuticals, today submitted its meeting package with the U.S. Food and Drug Administration (“FDA”) to discuss advancing KETARX™ (racemic ketamine) into Phase 3 development as a treatment for levodopa-induced dyskinesia in Parkinson’s disease (“LID-PD”). This Type C meeting allows the Company to discuss with the FDA its plans",CAD,PHRM.CN,GlobeNewswire - PharmaTher Holdings Submits FDA Meeting Package to Discuss Phase 3 Program and Fast Track Designation for KETARX™ (Ketamine) in Parkinson’s Disease
fin_news_nlp/yahoo_cad_tickers_news,https://ca.finance.yahoo.com/news/bmo-completes-acquisition-bank-west-170000347.html,"BMO Financial Group (TSX: BMO) (NYSE: BMO), and its subsidiaries BMO Financial Corp. and BMO Harris Bank N.A. (together, ""BMO""), announced today it has completed the acquisition of Bank of the West from BNP Paribas (XPAR: BNP).",CAD,BMO.TO,CNW Group - BMO Completes Acquisition of Bank of the West
fin_news_nlp/yahoo_cad_tickers_news,https://ca.finance.yahoo.com/news/calian-hold-conference-call-following-174000629.html,"Calian® Group Ltd. (TSX:CGY), a diverse products and services company providing innovative healthcare, communications, learning and cybersecurity solutions, will hold a conference call at 8:00 a.m. Eastern Time on Wednesday, February 15, 2023, to discuss results for the three-month period ended December 31, 2022.",CAD,CGY.TO,ACCESSWIRE - Calian to Hold Conference Call Following Announcement of First Quarter FY 2023 Results
fin_news_nlp/yahoo_cad_tickers_news,https://ca.finance.yahoo.com/news/stocks-play-e-automotive-inc-170800079.html,"Announced the acquisition of Houston Auto Auction, Inc., a Houston-based independent auction marketplace ...",CAD,EINC.TO, - Stocks in play: E Automotive Inc
fin_news_nlp/yahoo_cad_tickers_news,https://ca.finance.yahoo.com/news/3-tsx-stocks-25-years-123000666.html,TSX stocks like Enbridge (TSX:ENB) should be on your Dividend Aristocrats watchlist. The post 3 TSX Stocks With 25 Years of Consecutive Dividend Growth appeared first on The Motley Fool Canada.,CAD,ENB.TO,The Motley Fool - 3 TSX Stocks With 25 Years of Consecutive Dividend Growth
fin_news_nlp/yahoo_cad_tickers_news,https://ca.finance.yahoo.com/news/canadas-first-quantum-hold-board-181055929.html,"Directors of First Quantum Minerals will meet in Panama this week for a board meeting, a source close to the Canadian company said on Wednesday, in the midst of a longstanding dispute over its contract with the government to operate a major copper mine.  Panama's government and First Quantum are negotiating a contract for the operations of the Cobre Panama mine, with taxes and royalties at the forefront of discussions.  The board meeting had been previously scheduled, and there are no plans at this time for executives to meet with the government, the source said.",CAD,FM.TO, - Canada's First Quantum to hold board meeting in Panama - source
fin_news_nlp/yahoo_cad_tickers_news,https://ca.finance.yahoo.com/news/play-2023-ev-boom-140000862.html,Here's why Magna International may be the best way for Canadian investors to ride the EV boom. The post Your Play to Get in on the 2023 EV Boom appeared first on The Motley Fool Canada.,CAD,MG.TO,The Motley Fool - Your Play to Get in on the 2023 EV Boom
fin_news_nlp/yahoo_cad_tickers_news,https://ca.finance.yahoo.com/news/sienna-senior-living-tse-sia-170433920.html,Sienna Senior Living Inc. ( TSE:SIA ) shareholders should be happy to see the share price up 12% in the last month. But...,CAD,SIA.TO,Simply Wall St. - Sienna Senior Living (TSE:SIA) investors are sitting on a loss of 22% if they invested three years ago
fin_news_nlp/yahoo_cad_tickers_news,https://ca.finance.yahoo.com/news/valeo-pharmas-4q-fiscal-2022-171152938.html,"Valeo Pharma CEO Steve Saviuk joined Steve Darling from Proactive to share news the company has released its financial results for the fourth quarter and year-ended October 31, 2022.",CAD,VPH.TO, - Valeo Pharma's 4Q and fiscal 2022 financials reveal record revenue
fin_news_nlp/yahoo_cad_tickers_news,https://ca.finance.yahoo.com/news/bmo-closes-us-16-3-194716502.html,"TORONTO — BMO Financial Group says it has closed its US$16.3 billion acquisition of Bank of the West more than 13 months after initially announcing the deal. The bank says the closing of the deal adds nearly 1.8 million customers and 500 branches to BMO that, along with its current presence in the U.S., gives it a footprint in 32 states. North American personal and business banking group head Erminia (Ernie) Johannson says the deal gives the bank the needed scale to compete and grow. She says th",CAD,BMO.TO,The Canadian Press - BMO closes US$16.3 billion Bank of the West deal
fin_news_nlp/yahoo_cad_tickers_news,https://ca.finance.yahoo.com/news/better-buy-suncor-stock-enbridge-160000070.html,"Amid the favourable environment, would you be better off investing in ENB or SU energy stock right now? The post Better Buy: Suncor Stock or Enbridge? appeared first on The Motley Fool Canada.",CAD,ENB.TO,The Motley Fool - Better Buy: Suncor Stock or Enbridge?
fin_news_nlp/yahoo_cad_tickers_news,https://ca.finance.yahoo.com/news/pizza-pizza-royalty-corp-adds-200000235.html,"Pizza Pizza Royalty Corp. (the ""Company"") (TSX: PZA) and Pizza Pizza Limited (""PPL"") today announced that effective January 1, 2023, the number of restaurants on which royalties are paid to the Company by PPL (the ""Royalty Pool"") has been adjusted to include 45 new restaurants opened during the prior year vend-in period, offset by 29 restaurants which were closed during the period.",CAD,PZA.TO,CNW Group - Pizza Pizza Royalty Corp. Adds 45 Restaurants to the Royalty Pool
fin_news_nlp/yahoo_cad_tickers_news,https://ca.finance.yahoo.com/news/real-matters-announces-election-directors-192400587.html,"TORONTO, February 01, 2023--Real Matters Inc. (""Real Matters""), a leading network management services platform for the mortgage and insurance industries, today announced that all of the nominees listed in Real Matters’ management information circular dated December 13, 2022, were elected as directors of Real Matters. The detailed results of the vote for the election of directors held at Real Matters’ Annual Meeting of Shareholders are set out below:",CAD,REAL.TO,Business Wire - Real Matters Announces Election of Directors
fin_news_nlp/yahoo_cad_tickers_news,https://ca.finance.yahoo.com/news/sangoma-announces-date-second-quarter-190700483.html,"MARKHAM, Ontario, Feb. 01, 2023 (GLOBE NEWSWIRE) -- Sangoma Technologies Corporation (TSX: STC; Nasdaq: SANG) (“Sangoma” or the “Company”), a trusted leader in delivering cloud-based Communications as a Service solutions for companies of all sizes, today announced that it expects to release its second quarter fiscal year 2023 results after markets close on Thursday, February 9, 2023. In addition, the Company will host a conference call on Friday, February 10, 2023 at 8:00 am Eastern Time to disc",CAD,STC.TO,GlobeNewswire - Sangoma Announces Date of Second Quarter Fiscal Year 2023 Financial Results and Conference Call
fin_news_nlp/yahoo_cad_tickers_news,https://ca.finance.yahoo.com/news/dlp-resources-announces-upsizing-private-193400993.html,"Cranbrook, British Columbia--(Newsfile Corp. - February 1, 2023) - DLP Resources Inc. (TSXV: DLP) (OTCQB: DLPRF) (the ""Company"") is pleased to announce that it intends to increase the size of its previously announced non-brokered private placement (the ""Private Placement"") to up to 5,203,814 units (each, a ""Unit"") at a price of $0.27 per Unit for gross proceeds of up to $1,405,030.Each Unit consists of one common share in the capital of the Company (a ""Share"") and one ...",CAD,DLP.V,Newsfile - DLP Resources Announces Upsizing of Private Placement
fin_news_nlp/yahoo_cad_tickers_news,https://ca.finance.yahoo.com/news/flying-nickel-announces-intention-amend-185000644.html,"Vancouver, British Columbia--(Newsfile Corp. - February 1, 2023) - Flying Nickel Mining Corp. (TSXV: FLYN) (OTCQB: FLYNF) (""Flying Nickel"" or the ""Company"") announces that it proposes to reprice: (i) an aggregate of 5,047,016 outstanding common share purchase warrants of the Company (the ""Warrants"") issued pursuant to a warrant indenture dated November 29, 2021 between the Company and Computershare Trust Company of Canada, as warrant agent (the ""Warrant Indenture"") (the ""Warrant Repricing""); and",CAD,FLYN.V,Newsfile - Flying Nickel Announces Intention to Amend Warrant and Option Terms
fin_news_nlp/yahoo_cad_tickers_news,https://ca.finance.yahoo.com/news/power-play-market-herald-releases-193500163.html,"The Power Play by The Market Herald has announced the release of new interviews with Fokus Mining, Ridgeline Minerals and Datametrex AI discussing their latest news.",CAD,RDG.V,"ACCESSWIRE - The Power Play by The Market Herald Releases New Interviews with Fokus Mining, Ridgeline Minerals and Datametrex AI Discussing Their Latest News"
fin_news_nlp/yahoo_cad_tickers_news,https://ca.finance.yahoo.com/news/myriad-uranium-announces-participation-121-210000615.html,"Vancouver, British Columbia--(Newsfile Corp. - February 1, 2023) - MYRIAD URANIUM CORP. (CSE: M) (""Myriad"" or the ""Company""), a new uranium explorer with over 1,800 km2 on-structure and near several of Africa's (and the world's) most significant uranium deposits, is pleased to announce its participation at two important investment conferences next week in Cape Town, South Africa.The conferences are 121 Mining Investment - Cape Town and Mining Indaba 2023. Additional details below. ...",CAD,M.CN,"Newsfile - Myriad Uranium Announces Participation at the 121 Mining Investment and the Mining Indaba Conferences in Cape Town, South Africa"
fin_news_nlp/yahoo_cad_tickers_news,https://ca.finance.yahoo.com/news/algoma-steel-announce-fiscal-2023-223000993.html,"SAULT STE. MARIE, Ontario, Feb. 01, 2023 (GLOBE NEWSWIRE) -- Algoma Steel Group Inc. (NASDAQ: ASTL; TSX: ASTL) (“Algoma”), a leading Canadian producer of hot and cold rolled steel sheet and plate products, announced today that the Company will release its fiscal 2023 third quarter financial results after the market closes on Monday, February 13, 2023. A webcast and conference call will be held on Tuesday, February 14, 2023, at 11:00 a.m. Eastern Time to review the Company’s results, discuss rece",CAD,ASTL.TO,"GlobeNewswire - Algoma Steel to Announce Fiscal 2023 Third Quarter Results February 13, 2023"
fin_news_nlp/yahoo_cad_tickers_news,https://ca.finance.yahoo.com/news/argonaut-appoints-chief-operating-officer-210000176.html,"Argonaut Gold Inc. (TSX: AR) (the ""Company"", ""Argonaut Gold"" or ""Argonaut"") announced today that Marc Leduc, P.Eng. has been appointed Chief Operating Officer of the Company.",CAD,AR.TO,CNW Group - Argonaut Appoints New Chief Operating Officer to Lead Pivotal Phase
