source,url,description,country,company,title
fin_news_nlp/yahoo_cad_tickers_news,https://ca.finance.yahoo.com/news/high-arctic-declares-monthly-dividend-121500924.html,"NOT FOR DISTRIBUTION TO U.S. NEWSWIRE SERVICES OR FOR DISSEMINATION IN THE UNITED STATES. ANY FAILURE TO COMPLY WITH THIS RESTRICTION MAY CONSTITUTE A VIOLATION OF U.S. SECURITIES LAW CALGARY, Alberta, March 24, 2023 (GLOBE NEWSWIRE) -- High Arctic Energy Services Inc. (TSX: HWO) ""High Arctic"" or the ""Corporation” is pleased to announce that its Board of Directors has approved a monthly dividend payment of $0.005 per share to holders of common shares. The dividend is payable on April 14, 2023 to",CAD,HWO.TO,GlobeNewswire - High Arctic Declares Monthly Dividend and Provides PNG Update
fin_news_nlp/yahoo_cad_tickers_news,https://ca.finance.yahoo.com/news/laramide-resources-ltd-announces-results-113000171.html,"Laramide Resources Ltd. (""Laramide"" or the ""Company"") (TSX: LAM) (ASX: LAM) (OTCQX: LMRXF) is pleased to announce completion of the initial diamond drilling phase of the project ramp-up at its 100% owned NRC licensed Crownpoint-Churchrock Uranium Project, near Gallup, New Mexico, USA (""Crownpoint""). The diamond drill program, having a total drilled length of 6,030 feet (1,838 meters) was comprised of seven drill holes located in areas of uranium mineralization within Section 17, Township 16 Nort",CAD,LAM.TO,"CNW Group - Laramide Resources Ltd. Announces Results from the Diamond Drilling Program at its Crownpoint-Churchrock Uranium Project, New Mexico, U.S.A."
fin_news_nlp/yahoo_cad_tickers_news,https://ca.finance.yahoo.com/news/loblaw-companies-limited-enters-automatic-113000795.html,"Loblaw Companies Limited (TSX: L) (""Loblaw"") announced today that it has entered into an automatic share purchase plan (""ASPP"") with a broker in order to facilitate repurchases of Loblaw's common shares (""Common Shares"") under its previously announced normal course issuer bid (""NCIB"").",CAD,L.TO,CNW Group - Loblaw Companies Limited Enters into Automatic Share Purchase Plan
fin_news_nlp/yahoo_cad_tickers_news,https://ca.finance.yahoo.com/news/manulife-investment-management-announces-cash-113000951.html,"Manulife Investment Management today announced the March 2023 cash distributions for Manulife Exchange Traded Funds (ETFs) that distribute monthly and quarterly. Unitholders of record of the Manulife ETFs at the close of business on March 31, 2023 will receive cash distributions payable on April 13, 2023.",CAD,MFC.TO,CNW Group - Manulife Investment Management announces cash distributions for Manulife Exchange Traded Funds
fin_news_nlp/yahoo_cad_tickers_news,https://ca.finance.yahoo.com/news/savaria-declares-monthly-dividend-114500787.html,"LAVAL, Québec, March 24, 2023 (GLOBE NEWSWIRE) -- Savaria Corporation (“Savaria”) (TSX: SIS) a global leader in the accessibility industry, declared today a dividend of 4.33 cents ($0.0433) per common share, in accordance with its monthly dividend policy, payable on April 10, 2023, to shareholders of record of the Corporation at the close of business on March 31, 2023. This is an eligible dividend within the meaning of the Income Tax Act. About Savaria Corporation Savaria Corporation (savaria.co",CAD,SIS.TO,GlobeNewswire - Savaria Declares Monthly Dividend
fin_news_nlp/yahoo_cad_tickers_news,https://ca.finance.yahoo.com/news/spectral-medical-announces-fourth-quarter-120000553.html,"Reports significant enhancements to accelerate Tigris patient enrollment including appointment of new Contract Research Organization Management to host Investor Day on April 6, 2023 TORONTO, March 24, 2023 (GLOBE NEWSWIRE) -- Spectral Medical Inc. (“Spectral” or the “Company”) (TSX: EDT), a late-stage theranostic company advancing therapeutic options for sepsis and septic shock, today announced its financial results for the fourth quarter and for the year ended December 31, 2022 and provided a c",CAD,EDT.TO,GlobeNewswire - Spectral Medical Announces Fourth Quarter and Fiscal 2022 Results and Provides Corporate Update
fin_news_nlp/yahoo_cad_tickers_news,https://ca.finance.yahoo.com/news/stella-jones-inc-tse-sj-112455457.html,Key Insights Stella-Jones' estimated fair value is CA$63.52 based on 2 Stage Free Cash Flow to Equity Stella-Jones...,CAD,SJ.TO,Simply Wall St. - Stella-Jones Inc. (TSE:SJ) Shares Could Be 20% Below Their Intrinsic Value Estimate
fin_news_nlp/yahoo_cad_tickers_news,https://ca.finance.yahoo.com/news/suncor-energy-announces-daniel-romasko-104500643.html,"Calgary, Alberta--(Newsfile Corp. - March 24, 2023) - Suncor Energy (TSX: SU) (NYSE: SU) today announced the appointment of Daniel (Dan) Romasko to the company's Board of Directors. Mr. Romasko's appointment is pursuant to the cooperation agreement with Elliott Investment Management dated July 16, 2022 as amended, and is effective March 23, 2023.""I'm pleased to welcome Dan to the Suncor board,"" said Board Chair Michael Wilson. ""He brings with him significant energy and refining ...",CAD,SU.TO,Newsfile - Suncor Energy Announces Daniel Romasko to Join Board of Directors
fin_news_nlp/yahoo_cad_tickers_news,https://ca.finance.yahoo.com/news/mexican-federal-economic-competition-commission-110500418.html,"Pan American Declares Dividend with Respect to the First Quarter of 2023VANCOUVER, British Columbia, March 24, 2023 (GLOBE NEWSWIRE) -- Pan American Silver Corp. (NASDAQ: PAAS) (TSX: PAAS) (""Pan American"") and Yamana Gold Inc. (TSX: YRI; NYSE: AUY; LSE: AUY) (""Yamana"") are pleased to provide an update on the status of Pan American's proposed acquisition of all of the issued and outstanding common shares of Yamana, following the sale by Yamana of its Canadian assets, including certain subsidiarie",CAD,YRI.TO,GlobeNewswire - Mexican Federal Economic Competition Commission Approves Pan American Silver’s Arrangement with Yamana and Agnico Eagle
fin_news_nlp/yahoo_cad_tickers_news,https://ca.finance.yahoo.com/news/resources-provides-pocitos-properties-salta-120000927.html,"VANCOUVER, British Columbia, March 24, 2023 (GLOBE NEWSWIRE) -- A.I.S. Resources Limited (TSX.V: AIS, OTCQB: AISSF) (the “Company” or “AIS”) announces that Recharge Resources has exercised its option to acquire Pocitos 1 from Spey Resources (Spey). In accordance with AIS’ option agreement with Spey and AIS’ underlying option agreement with Ekeko S.A., AIS will receive net proceeds as follows: POCITOS 1Cash (80%)Value of Shares (20%)Total ConsiderationReceive from Spey$800,000$200,000$1,000,000Pa",CAD,AIS.V,"GlobeNewswire - A.I.S. Resources Provides Update on Pocitos Properties in Salta, Argentina"
fin_news_nlp/yahoo_cad_tickers_news,https://ca.finance.yahoo.com/news/grande-portage-announces-warrant-extension-123000678.html,"Vancouver, British Columbia--(Newsfile Corp. - March 24, 2023) - Grande Portage Resources Ltd. (TSXV: GPG) (OTCQB: GPTRF) (FSE: GPB) (""Grande Portage"" or ""the Company"") announces that the Company intends to extend the exercise period of 553,358 share purchase warrants exercisable at a price of $0.45 per common share and 3,906,537 share purchase warrants exercisable at a price of $0.72 per common share.The Warrants were issued pursuant to a private placement which closed on April ...",CAD,GPG.V,Newsfile - Grande Portage Announces Warrant Extension
fin_news_nlp/yahoo_cad_tickers_news,https://ca.finance.yahoo.com/news/khiron-life-sciences-announces-pricing-120900839.html,"Khiron Life Sciences Corp. (""Khiron"" or the ""Company"") (TSXV: KHRN) (OTCQX: KHRNF) is pleased to announce the pricing of its previously announced marketed public offering (the ""Offering""). Pursuant to the Offering, the Company will issue units of the Company (each, a ""Unit"") at a price of C$0.05 per Unit (the ""Offering Price""). Each Unit will consist of one common share of the Company (each, a ""Unit Share"") and one common share purchase warrant of the Company (each, a ""Unit Warrant""), with each",CAD,KHRN.V,CNW Group - KHIRON LIFE SCIENCES ANNOUNCES PRICING OF MARKETED OFFERING OF UNITS
fin_news_nlp/yahoo_cad_tickers_news,https://ca.finance.yahoo.com/news/g7-capital-police-force-first-123000502.html,"An advanced new system for real-time video feed to incident commanders as events unfold, direct from observation scopes, drones and aircraft. Ottawa, Ontario--(Newsfile Corp. - March 24, 2023) - KWESST Micro Systems Inc. (NASDAQ: KWE) (NASDAQ: KWESW) (TSXV: KWE) (FSE: 62UA) (“the Company” or “KWESST”), a developer of next-generation tactical systems for military, security, and personal defence markets, today announced that a G7 capital police force has adopted the Company’s new Overwatch Command",CAD,KWE.V,Newsfile - G7 Capital Police Force First To Acquire KWESST's New Overwatch Commander System For Critical Incident Management
fin_news_nlp/yahoo_cad_tickers_news,https://ca.finance.yahoo.com/news/mineral-hill-announces-death-directors-181200844.html,"Mineral Hill Industries Ltd. (the ""Company"" or ""Mineral Hill"") announces with deep sadness the passing of two directors in a very short time, Mr. Andrew von Kursell, a director and the CFO of the Company, on January 17, 2023 and Mr. Filgas last month. Mr. von Kursell has served as a director of the Company since May 2005 and assumed subsequently also the position of chair of the audit and corporate governance committee as well as CFO whereas Mr. Filgas has served as director of the Company since",CAD,MHI.V,CNW Group - MINERAL HILL ANNOUNCES DEATH OF DIRECTORS ANDREW VON KURSELL AND MILO FILGAS
fin_news_nlp/yahoo_cad_tickers_news,https://ca.finance.yahoo.com/news/quisitive-ranks-globe-mail-women-123000073.html,"TORONTO, March 24, 2023 (GLOBE NEWSWIRE) -- Quisitive Technology Solutions, Inc. (“Quisitive” or the “Company”) (TSXV: QUIS, OTCQX: QUISF), a premier Microsoft solutions provider and payments solutions provider, is pleased to announce it has been included on The Globe and Mail’s 2023 Report on Business magazine’s Women Lead Here list. This annual editorial benchmark identifies top-notch Canadian businesses with the highest executive gender diversity. This benchmark was established in 2020 by Rep",CAD,QUIS.V,GlobeNewswire - Quisitive Ranks on The Globe and Mail’s Women Lead Here Benchmark of Executive Gender Diversity for Second Year
fin_news_nlp/yahoo_cad_tickers_news,https://ca.finance.yahoo.com/news/searchlight-resources-receives-tsxv-approval-113000229.html,"Searchlight Resources Inc. (""Searchlight"" or the ""Company"") (TSXV:SCLT)(OTCQB:SCLTF) is pleased to announce that the Company has received approval from the TSX Venture Exchange (the ""Exchange"") to issue common shares as consideration for the purchase by Searchlight of the 25% interest plus 1.0% NSR in the Bootleg Lake Gold property from New Moon Minerals Corp. (""New Moon"")",CAD,SCLT.V,ACCESSWIRE - Searchlight Resources Receives TSXV Approval for Purchase of the Bootleg Gold Property
fin_news_nlp/yahoo_cad_tickers_news,https://ca.finance.yahoo.com/news/sqi-diagnostics-announces-proposed-insider-122100329.html,"SQI Diagnostics Inc. (the ""Company"" or ""SQI"") (TSXV: SQD) (OTCQB: SQIDF), a leader in the science of lung health that develops and manufactures respiratory health and precision medicine tests, announces that certain insiders of the Company, who are also control persons of the Company and collectively own, or exercise control or direction over, an aggregate of 75% of the issued and outstanding common shares (""Shares"") in the capital of the Company (the ""Majority Shareholders""), have informed the",CAD,SQD.V,CNW Group - SQI DIAGNOSTICS ANNOUNCES PROPOSED INSIDER SALES AND WARRANT EXERCISES TO FUND COMPANY
fin_news_nlp/yahoo_cad_tickers_news,https://ca.finance.yahoo.com/news/steer-announces-execution-definitive-agreements-122000418.html,"TORONTO, March 24, 2023--STEER Technologies Inc. (""STEER"" or the ""Company"") (TSXV: STER) (OTCQX: STEEF), an integrated ESG technology platform, is pleased to announce that further to its press releases dated January 23, 2023 and March 7, 2023, it has obtained conditional approval from the TSX Venture Exchange (the ""TSXV"") and entered into binding definitive agreements to complete the sale (the ""Proposed Transaction"") of approximately 37.5% of the Company’s digital restaurant supply business (the",CAD,STER.V,Business Wire - STEER Announces Execution of Definitive Agreements and Conditional Approval of TSXV for an $18 Million Direct Investment Involving its Digital Restaurant Supply Business (B2B Marketplace)
fin_news_nlp/yahoo_cad_tickers_news,https://ca.finance.yahoo.com/news/superbuzz-completes-private-placement-offering-130000229.html,"Toronto, Ontario--(Newsfile Corp. - March 24, 2023) - SuperBuzz Inc. (TSXV: SPZ) (""SuperBuzz"" or the ""Company""), one of a select few GPT-oriented companies currently listed on the TSX Venture Exchange, has completed its previously announced non-brokered private placement for gross proceeds of $436,740 through the issuance of 3,639,500 units (a ""Unit"") at a price of $0.12 per Unit (the ""Offering"").Each Unit consists of one common share (a ""Common Share"") of the Company and one ...",CAD,SPZ.V,"Newsfile - SuperBuzz Completes Private Placement Offering of $436,740"
fin_news_nlp/yahoo_cad_tickers_news,https://ca.finance.yahoo.com/news/helium-company-enters-joint-venture-131500117.html,"By David Willey, Benzinga",CAD,TOH.V,"News Direct - Helium Company Enters Joint Venture In Major Arizonan Natural Gas Field, While Markets Are Still Suffering A Shortage"
fin_news_nlp/yahoo_cad_tickers_news,https://ca.finance.yahoo.com/news/trustbix-inc-announces-reseller-program-120000162.html,"Edmonton, Alberta--(Newsfile Corp. - March 24, 2023) - TrustBIX Inc. (TSXV: TBIX) (OTCQB: TBIXF) (""TrustBIX"" or the ""Company"") a leading provider of traceability software and strategic sourcing solutions, today announced the launch of a new reseller program designed to expand the reach of the BIX Platform into new markets with its first reseller, PLNT Industries Inc. of Edmonton, Alberta.""The BIX Platform is an important part of how PLNT Industries intends to rebrand and scale ...",CAD,TBIX.V,"Newsfile - TrustBIX Inc. Announces Reseller Program and First Reseller, PLNT Industries Inc."
fin_news_nlp/yahoo_cad_tickers_news,https://ca.finance.yahoo.com/news/ampd-ventures-inc-announces-layoffs-113000006.html,"AMPD Ventures Inc. (CSE:AMPD)(OTCQB:AMPDF)(FRA:2Q0)(""AMPD"" or the ""Company"") announces at it has laid off seven employees at its AMPD Technologies (Canada) Inc. (""Technologies"") subsidiary, effective March 23rd, 2023.",CAD,AMPD.CN,ACCESSWIRE - AMPD Ventures Inc. Announces Layoffs at AMPD Technologies to Reduce Expenses
fin_news_nlp/yahoo_cad_tickers_news,https://ca.finance.yahoo.com/news/curaleaf-provides-2022-fourth-quarter-120000488.html,"Curaleaf Holdings, Inc. (CSE: CURA / OTCQX: CURLF) (""Curaleaf"" or the ""Company""), a leading international provider of consumer cannabis products, today announced that it will delay its fourth quarter and full year earnings release and conference call, which were originally scheduled for March 28, 2023. Due to the complexities of converting three years of financials from IFRS to U.S. GAAP coinciding with year and quarter-end reporting, and the review of the treatment of various accounting matters",CAD,CURA.CN,CNW Group - Curaleaf Provides Update on 2022 Fourth Quarter and Full-Year Earnings Release and Earnings Call
fin_news_nlp/yahoo_cad_tickers_news,https://ca.finance.yahoo.com/news/draganfly-host-2022-end-results-132500702.html,"Los Angeles, CA., March 24, 2023 (GLOBE NEWSWIRE) -- Draganfly Inc. (NASDAQ: DPRO) (CSE: DPRO) (FSE: 3U8) (“Draganfly” or the “Company”), an award-winning, industry-leading drone solutions and systems developer, announced today that it is hosting a shareholder update call on March 27, 2023, at 2:30 PDT / 5:30 p.m. EDT. Draganfly CEO Cameron Chell will facilitate the call and review the Company’s milestones. CFO Paul Sun will review the Company’s financial results for FY 2022 and Q4 2022. Financi",CAD,DPRO.CN,GlobeNewswire - Draganfly to Host 2022 Year End Results and Corporate Shareholder Update Call
fin_news_nlp/yahoo_cad_tickers_news,https://ca.finance.yahoo.com/news/goat-industries-acquires-mining-claims-120000163.html,"VANCOUVER, British Columbia, March 24, 2023 (GLOBE NEWSWIRE) -- Goat Industries Ltd., (the “Company or “GOAT”) (CSE: GOAT) is pleased to announce that further to the Company’s press release dated March 10, 2023, the Company has completed the acquisition of certain claim blocks located in Quebec, Canada (the “Lacana-Doran Property”). The Company now holds a 100% interest in the Lacana-Doran Property which consists of 1,925 hectares of land located west of Aguanish, 100 km east of Havre St. Pierre",CAD,GOAT.CN,GlobeNewswire - Goat Industries Acquires Mining Claims in Quebec
fin_news_nlp/yahoo_cad_tickers_news,https://ca.finance.yahoo.com/news/golden-independence-announces-acquisition-napoleon-130000026.html,"Vancouver, British Columbia--(Newsfile Corp. - March 24, 2023) - Golden Independence Mining Corp. (CSE: IGLD) (OTCQB: GIDMF) (FSE: 6NNA) (the ""Company"" or ""Golden Independence"") is pleased to announce that it has entered into an agreement to acquire the Napoleon Gold project (the ""Property"") located in Kamloops, British Columbia. ""The Napoleon project represents an exciting opportunity to advance generative exploration and add a discovery-potential project to our project portfolio,"" commented Je",CAD,IGLD.CN, - Golden Independence Announces Acquisition of Napoleon Gold Project
fin_news_nlp/yahoo_cad_tickers_news,https://ca.finance.yahoo.com/news/jushi-holdings-inc-report-fourth-115900171.html,"BOCA RATON, Fla., March 24, 2023 (GLOBE NEWSWIRE) -- Jushi Holdings Inc. (“Jushi” or the “Company”) (CSE: JUSH) (OTCQX: JUSHF), a vertically integrated, multi-state cannabis operator, announced that it expects to report its financial results for the fourth quarter and full year ended December 31, 2022, before the market opens on Friday, March 31, 2023. Management will host a conference call and audio webcast on Friday, March 31, 2023, at 8:00 a.m. ET to discuss the Company’s financial results. E",CAD,JUSH.CN,"GlobeNewswire - Jushi Holdings Inc. to Report Fourth Quarter and Full Year 2022 Financial Results on March 31, 2023"
fin_news_nlp/yahoo_cad_tickers_news,https://ca.finance.yahoo.com/news/metallica-metals-uncovers-pgm-lithium-120000551.html,"Vancouver, British Columbia--(Newsfile Corp. - March 24, 2023) - Metallica Metals Corp. (CSE: MM) (OTCQB: MTALF) (FSE: SY7P) (the ""Company"" or ""Metallica Metals"") is pleased to announce that field mapping and prospecting work completed across the Sammy Ridgeline Project (""Sammy Ridgeline"" or the ""Project"") in the Thunder Bay North District of Ontario has uncovered the potential to host both Mid-Continent Rift (MCR) related platinum group metal (PGM) and spodumene (lithium) pegmatite dyke mineral",CAD,MM.CN,"Newsfile - Metallica Metals Uncovers PGM and Lithium Potential at Sammy Ridgeline Project, Thunder Bay North District, Ontario"
fin_news_nlp/yahoo_cad_tickers_news,https://ca.finance.yahoo.com/news/nepra-announces-retail-launch-novel-130000886.html,"Nepra Foods Inc. (the ""Company"" or ""Nepra"") (CSE:NPRA)(FSE:2P6)(OTCQB:NPRFF), creator of nutritious plant-based and allergen-free food, is pleased to announce the retail launch of its industry-leading, dried and shelf-stable ProPasta® noodles.",CAD,NPRA.CN,ACCESSWIRE - Nepra Announces Retail Launch of Novel ProPasta
fin_news_nlp/yahoo_cad_tickers_news,https://ca.finance.yahoo.com/news/sharc-energy-celebrates-mcaa-student-120000313.html,"VANCOUVER, British Columbia, March 24, 2023 (GLOBE NEWSWIRE) -- SHARC International Systems Inc. (CSE: SHRC) (FSE: IWIA) (OTCQB: INTWF) (""SHARC Energy"" or the ""Company"") would like to applaud the twenty-two Mechanical Contractors Association of America (“MCAA”) student chapters that submitted a mock proposal for the installation of the National Western Center Campus Energy project as part of MCAA Annual Student Chapter Competition. SHARC Energy would like to further celebrate the Final Four and",CAD,SHRC.CN,GlobeNewswire - SHARC Energy Celebrates MCAA Student Chapter Competition Showcasing National Western Center
fin_news_nlp/yahoo_cad_tickers_news,https://ca.finance.yahoo.com/news/scotiabank-recognized-executive-gender-diversity-142800753.html,Scotiabank is pleased to announce it has been included on The Globe and Mail's 2023 Report on Business magazine's Women Lead Here list. This annual editorial benchmark identifies top-notch Canadian businesses with the highest executive gender diversity.,CAD,BNS.TO,CNW Group - Scotiabank recognized for executive gender diversity on The Globe and Mail's Women Lead Here list for third consecutive year
fin_news_nlp/yahoo_cad_tickers_news,https://ca.finance.yahoo.com/news/nova-scotia-power-issues-300-132700268.html,"HALIFAX, Nova Scotia, March 24, 2023--Nova Scotia Power Incorporated (""Nova Scotia Power"" or the ""Company"") today announced that it has completed an offering of $300 million aggregate principal amount of Notes due November 15, 2032 (Unsecured), Series 2023-1 (""Series 2023-1 Notes"") and $200 million aggregate principal amount of Notes due March 24, 2053 (Unsecured), Series 2023-2 (""Series 2023-2 Notes"" and, together with the Series 2023-1 Notes, the ""Notes""). The Notes were offered on a private p",CAD,EMA.TO,"Business Wire - Nova Scotia Power Issues $300 Million Aggregate Principal Amount of Notes Due November 15, 2032 (Unsecured) and $200 Million Aggregate Principal Amount of Notes Due March 24, 2053 (Unsecured)"
fin_news_nlp/yahoo_cad_tickers_news,https://ca.finance.yahoo.com/news/hexo-ranks-globe-mail-fourth-131500869.html,"GATINEAU, Québec, March 24, 2023--HEXO Corp. (TSX: HEXO; NASDAQ: HEXO) (""HEXO"" or the ""Company""), is pleased to announce it has been included on The Globe and Mail’s 2023 Report on Business magazine’s Women Lead Here list. This annual editorial benchmark identifies top-notch Canadian businesses with the highest executive gender diversity.",CAD,HEXO.TO,Business Wire - HEXO Ranks on The Globe and Mail’s Fourth-Annual Women Lead Here Benchmark of Executive Gender Diversity
fin_news_nlp/yahoo_cad_tickers_news,https://ca.finance.yahoo.com/news/options-market-predicting-spike-mag-123212912.html,Investors need to pay close attention to MAG Silver (MAG) stock based on the movements in the options market lately.,CAD,MAG.TO,Zacks - Is the Options Market Predicting a Spike in MAG Silver (MAG) Stock?
fin_news_nlp/yahoo_cad_tickers_news,https://ca.finance.yahoo.com/news/q4-inc-ranks-globe-mail-131500487.html,"TORONTO, March 24, 2023--Q4 Inc. (TSX: QFOR) (""Q4"" or ""the Company""), a leading capital markets communications platform provider, is proud to announce it has been included on The Globe and Mail’s 2023 Report on Business magazine’s Women Lead Here list. This annual editorial benchmark identifies top-notch Canadian businesses with the highest executive gender diversity.",CAD,QFOR.TO, - Q4 Inc. Ranks on The Globe and Mail’s Women Lead Here Benchmark of Executive Gender Diversity
fin_news_nlp/yahoo_cad_tickers_news,https://ca.finance.yahoo.com/news/u-steel-x-launch-steel-112711470.html,InduX is being introduced by U.S. Steel (X) for the rapidly growing American electric vehicle market.,CAD,YRI.TO,Zacks - U.S. Steel (X) to Launch New Steel for Electric Vehicles
fin_news_nlp/yahoo_cad_tickers_news,https://ca.finance.yahoo.com/news/allied-copper-announces-option-grant-134500215.html,"Vancouver, British Columbia, Canada, March 24, 2023 (GLOBE NEWSWIRE) -- Allied Copper Corp. (TSX-V: CPR, OTCQB: CPRRF) (“Allied”), announces the grant of an aggregate of 1,015,000 incentive stock options to certain of its directors, officers, consultants, and employees pursuant to Allied’s stock option plan. The options vest immediately and are exercisable for a period of four years at a price of CAD$0.25 per share. About Allied / Volt Allied (TSX-V: CPR, OTCQB: CPRRF) is a growth-oriented, batt",CAD,CPR.V,GlobeNewswire - ALLIED COPPER ANNOUNCES OPTION GRANT
fin_news_nlp/yahoo_cad_tickers_news,https://ca.finance.yahoo.com/news/desert-mountain-energy-closes-public-130100562.html,"DESERT MOUNTAIN ENERGY CORP. (the ""Company"") (TSXV: DME) (OTC: DMEHF) (FSE: QM01) From the President of the Company. The Company is pleased to announce the closing of its previously announced ""best efforts"" public offering of 11,300,000 units of the Company (each, a ""Unit"") at a price of C$1.95 per Unit (the ""Issue Price"") for gross proceeds of C$22,035,000, which includes the partial exercise of the Over-Allotment Option (as defined below) (the ""Offering""). The Company entered into an agency ag",CAD,DME.V,CNW Group - DESERT MOUNTAIN ENERGY CLOSES PUBLIC OFFERING OF UNITS FOR GROSS PROCEEDS OF $22 MILLION
fin_news_nlp/yahoo_cad_tickers_news,https://ca.finance.yahoo.com/news/tudor-gold-announces-upsized-16-134800450.html,"NOT FOR DISTRIBUTION TO UNITED STATES NEWSWIRE SERVICES OR FOR DISSEMINATION IN THE UNITED STATES. VANCOUVER, British Columbia, March 24, 2023 (GLOBE NEWSWIRE) -- Tudor Gold Corp. (TSXV: TUD) (the “Company”) is pleased to announce that, due to strong investor demand, it has entered into an amended agreement with Research Capital Corporation, as the lead underwriter and sole bookrunner (the “Lead Underwriter”), on behalf of a syndicate of underwriters, including Red Cloud Securities Inc. and Roth",CAD,TUD.V,"GlobeNewswire - Tudor Gold Announces Upsized $16 Million Bought-Deal Private Placement Offering, With Participation By Mr. Eric Sprott"
