source,url,description,country,company,title
fin_news_nlp/yahoo_cad_tickers_news,https://ca.finance.yahoo.com/news/6-500-tfsa-limit-buy-160000849.html,"TFSA users can realize the power of compounding in 2023 by using their expanded $6,500 limit to purchase monthly-dividend stocks. The post Use Your $6,500 TFSA Limit to Buy 2 Monthly Dividend-Payers appeared first on The Motley Fool Canada.",CAD,EIF.TO,"The Motley Fool - Use Your $6,500 TFSA Limit to Buy 2 Monthly Dividend-Payers"
fin_news_nlp/yahoo_cad_tickers_news,https://ca.finance.yahoo.com/news/2-stocks-d-buy-6-193000047.html,"A recession could mean bad news for the economy, but good news for investors seeking a deal for their TFSA. The post 2 Stocks I’d Buy With a $6,500 TFSA Contribution appeared first on The Motley Fool Canada.",CAD,FSZ.TO,"The Motley Fool - 2 Stocks I’d Buy With a $6,500 TFSA Contribution"
fin_news_nlp/yahoo_cad_tickers_news,https://ca.finance.yahoo.com/news/filo-mining-announces-proposed-name-220000318.html,"Filo Mining Corp. (TSX: FIL) (Nasdaq First North Growth Market: FIL) (OTCQX: FLMMF) (""Filo Mining"" or the ""Company"") is pleased to announce that the Board of Directors have recommended and authorized a change of the Company's name to ""Filo Corp."" to better align with the Company's strategic direction. View PDF version.",CAD,FIL.TO,CNW Group - Filo Mining Announces Proposed Name Change to Filo
fin_news_nlp/yahoo_cad_tickers_news,https://ca.finance.yahoo.com/news/freshii-files-management-information-circular-002400101.html,"TORONTO, Jan. 17, 2023 (GLOBE NEWSWIRE) -- Freshii Inc. (TSX: FRII) (“Freshii” or the “Company”) today announced that it has filed and is in the process of mailing the Management Information Circular and related materials for the special meeting of Freshii’s shareholders, which will be held virtually at 9:00 a.m. (Toronto time) on February 8, 2023 via live audio webcast as more particularly set out in the meeting materials. At the meeting, shareholders will be asked to consider the previously an",CAD,FRII.TO,GlobeNewswire - Freshii Files Management Information Circular for Special Meeting of Shareholders
fin_news_nlp/yahoo_cad_tickers_news,https://ca.finance.yahoo.com/news/gear-energy-ltd-announces-december-211400851.html,"Calgary, Alberta--(Newsfile Corp. - January 17, 2023) - Gear Energy Ltd. (TSX: GXE) (OTCQX: GENGF) (""Gear"" or the ""Company"") is pleased to announce that the new December 2022 monthly update to shareholders can be accessed via the following link https://gearenergy.com/updates.FOR FURTHER INFORMATION PLEASE CONTACT:Ingram Gillmore President & CEO 403-538-8463David HwangVice President Finance & CFO403-538-8437Email: info@gearenergy.comWebsite: www.gearenergy.comTo view the source version of this pr",CAD,GXE.TO,Newsfile - Gear Energy Ltd. Announces December Monthly Update to Shareholders
fin_news_nlp/yahoo_cad_tickers_news,https://ca.finance.yahoo.com/news/maverix-receives-court-approval-arrangement-030500950.html,"Maverix Metals Inc. (""Maverix"" or the ""Company"") (NYSE American; MMX) (TSX: MMX) is pleased to announce that the Ontario Superior Court of Justice (Commercial List) has granted a final order approving the previously announced acquisition of Maverix by Triple Flag Precious Metals Corp. (""Triple Flag"") by way of plan of arrangement in accordance with the Canada Business Corporations Act (the ""Arrangement""). Pursuant to the terms of the Arrangement, Triple Flag will acquire all of the issued and ou",CAD,MMX.TO,CNW Group - MAVERIX RECEIVES COURT APPROVAL FOR ARRANGEMENT WITH TRIPLE FLAG PRECIOUS METALS CORP.
fin_news_nlp/yahoo_cad_tickers_news,https://ca.finance.yahoo.com/news/pan-american-silver-announces-preliminary-220800922.html,"Pan American Silver Corp. (NASDAQ: PAAS) (TSX: PAAS) (""Pan American"") is pleased to announce its preliminary production results for the fourth quarter (""Q4 2022"") and full year 2022 (""FY 2022""), with FY 2022 results in line with annual guidance.",CAD,PAAS.TO,CNW Group - Pan American Silver announces preliminary 2022 production results
fin_news_nlp/yahoo_cad_tickers_news,https://ca.finance.yahoo.com/news/rbc-global-asset-management-inc-210500859.html,"RBC Global Asset Management Inc. (""RBC GAM Inc."") today announced January 2023 cash distributions for unitholders of RBC ETFs, as follows:",CAD,RID.TO,CNW Group - RBC Global Asset Management Inc. announces RBC ETF cash distributions for January 2023
fin_news_nlp/yahoo_cad_tickers_news,https://ca.finance.yahoo.com/news/wall-street-horizon-tmx-group-220000203.html,"Barry L. Star, Chief Executive Officer, Wall Street Horizon, a TMX Company, and his team joined Michelle Tran, President, TMX Datalinx to close the market and celebrate the acquisition of Wall Street Horizon by TMX on November 7, 2022.",CAD,X.TO,"CNW Group - Wall Street Horizon, a TMX Group Company, Closes the Market"
fin_news_nlp/yahoo_cad_tickers_news,https://ca.finance.yahoo.com/news/wesdome-announces-fourth-quarter-full-220000534.html,"TORONTO, Jan. 17, 2023 (GLOBE NEWSWIRE) -- Wesdome Gold Mines Ltd. (TSX: WDO) (“Wesdome” or the “Company”) today announces fourth quarter (“Q4”) and full year 2022 production results and 2023 guidance. All figures are in Canadian dollars unless otherwise stated. 2022 Operating Performance Q4 2022Q4 2021FY 2022FY 2021 Ore milled (tonnes) Eagle River58,30656,159223,734228,759Mishi-6,21523,15336,508Kiena51,41938,000115,17168,470 109,725100,374362,058333,737 Head grade (grams per tonne, “g/t”) Eagle",CAD,WDO.TO,GlobeNewswire - Wesdome Announces Fourth Quarter and Full Year 2022 Production Results; Provides 2023 Guidance
fin_news_nlp/yahoo_cad_tickers_news,https://ca.finance.yahoo.com/news/yamana-gold-announces-preliminary-fourth-220000087.html,"TORONTO, Jan. 17, 2023 (GLOBE NEWSWIRE) -- YAMANA GOLD INC. (TSX:YRI; NYSE:AUY; LSE:AUY) (“Yamana” or “the Company”) herein announces fourth quarter and full year 2022 preliminary operating results. Production during the fourth quarter totaled 264,891 gold equivalent ounces (“GEO”)(1) with full year production of 1,005,770 GEO(1) exceeding annual guidance of 1,000,000 GEO(1). Full year all-in sustaining costs (“AISC”)(2) are expected to be below $1,125 per GEO(1), generally in line with guidance",CAD,YRI.TO,"GlobeNewswire - Yamana Gold Announces Preliminary Fourth Quarter and Full Year 2022 Operating Results, Exceeding Annual Production Guidance With Strong Performances Across Its Core Asset Portfolio"
fin_news_nlp/yahoo_cad_tickers_news,https://ca.finance.yahoo.com/news/01-communique-report-fourth-quarter-210000357.html,"01 Communique Laboratory Inc. (the ""Company"") (TSX-V:ONE)(OTCQB:OONEF) one of the first-to-market, enterprise level cybersecurity providers for the quantum computing era is scheduled to release financial results for its fourth quarter 2022 which ended October 31st before market opens on Thursday January 19, 2023.",CAD,ONE.V,"ACCESSWIRE - 01 Communique to Report Fourth Quarter 2022 Results and Host a Conference Call on Thursday January 19th, 2023"
fin_news_nlp/yahoo_cad_tickers_news,https://ca.finance.yahoo.com/news/atex-announces-completion-first-two-230800604.html,"Toronto, Ontario--(Newsfile Corp. - January 17, 2023) - ATEX Resources Inc. (TSXV: ATX) (""ATEX"" or ""Company"") is pleased to announce that it has completed the first two diamond drill holes of the Phase III drill campaign on its Valeriano Copper-Gold Project in the Atacama Region, Chile.HighlightsATXD-11A intersected chalcopyrite-bearing porphyry units and breccias starting at a depth of 1,092 metres and continuing to the end of the hole at 2,130 metres. ATXD-11A extended the ...",CAD,ATX.V,Newsfile - ATEX Announces Completion of First Two Drillholes in Phase III Program - Extends Strike Length of Mineralized Corridor to a Kilometre
fin_news_nlp/yahoo_cad_tickers_news,https://ca.finance.yahoo.com/news/drill-data-indicates-auriferous-saprolite-213000737.html,"Montreal, Quebec--(Newsfile Corp. - January 17, 2023) - Beauce Gold Fields (TSXV: BGF) (Champs D'Or en Beauce), (""BGF"" or the ""Company"") is pleased to announce it has completed an analysis of drill hole data comparing all historical overburden placer channel drill holes, overlaid with the Company's 2021 diamond drill program. The study revealed that the auriferous saprolite unit of the paleoplacer channel on the Beauce Gold property located in St-Simon les Mine, Quebec, is thicker and ...",CAD,BGF.V,Newsfile - Drill Data Indicates the Auriferous Saprolite Unit of the Beauce Gold Paleoplacer Channel Is Thicker and Broader than Estimated
fin_news_nlp/yahoo_cad_tickers_news,https://ca.finance.yahoo.com/news/canada-carbon-inc-announces-shares-220100898.html,"Toronto, ON, Jan. 17, 2023 (GLOBE NEWSWIRE) -- Canada Carbon Inc. (the ""Company"") announces that it has entered into a debt settlement agreement with former Chief Financial Officer and Chief Executive Officer, Olga Nikitovic, to settle an aggregate of $200,000 of accrued management fees in consideration for the issuance of an aggregate of 3,333,333 common shares in the capital of the Company (the “Common Shares”) at a deemed price of $0.06 per share (the “Debt Settlement”). Ms. Nikitovic’s tenur",CAD,CCB.V,GlobeNewswire - CANADA CARBON INC. ANNOUNCES SHARES FOR DEBT TRANSACTION
fin_news_nlp/yahoo_cad_tickers_news,https://ca.finance.yahoo.com/news/collective-mining-commences-phase-ii-113000636.html,"Collective Mining Ltd. (TSXV: CNL) (OTCQX: CNLMF) (""Collective"" or the ""Company"") is pleased to announce the commencement of a phase II diamond drill program at the Main Breccia discovery at the Apollo target (""Apollo""), which is part of the Guayabales project located in Caldas, Colombia. The Main Breccia discovery is a high-grade, bulk tonnage copper-silver-gold porphyry-related system, which owes its excellent metal endowment to multiple phases of mineralization which includes older copper-sil",CAD,CNL.V,CNW Group - Collective Mining Commences its Phase II Drilling Program at Apollo
fin_news_nlp/yahoo_cad_tickers_news,https://ca.finance.yahoo.com/news/correction-engine-gaming-media-inc-152000938.html,"Engine Gaming and Media, Inc. (""Engine"" or the ""Company"") (NASDAQ:GAME)(TSXV:GAME), a data-driven, gaming, media and influencer marketing platform company, today announced results for its fiscal first quarter 2023 ended November 30, 2022. All amounts are stated in U.S.",CAD,GAME.V,"ACCESSWIRE - CORRECTION: Engine Gaming & Media, Inc. Reports Fiscal First Quarter 2023 Financial Results"
fin_news_nlp/yahoo_cad_tickers_news,https://ca.finance.yahoo.com/news/erin-ventures-announces-proposed-private-232500323.html,"Erin Ventures Inc. (""Erin"") [TSXV:EV] announces that, subject to the approval of the TSX Venture Exchange (the ""TSXV""), it intends to complete a non-brokered private placement offering of up to 9,000,000 units (""Units"") at a price of $0.05 per Unit for gross proceeds of up to $450,000 (the ""Private Placement"").",CAD,EV.V,ACCESSWIRE - Erin Ventures Announces Proposed Private Placement
fin_news_nlp/yahoo_cad_tickers_news,https://ca.finance.yahoo.com/news/fpx-nickel-commences-preliminary-feasibility-120000207.html,"FPX Nickel Corp. (TSXV: FPX) (OTCQB: FPOCF) (""FPX"" or the ""Company"") is pleased to announce the commencement of a preliminary feasibility study (""PFS"") for the Baptiste Nickel Project (""Baptiste"" or ""the Project"") in central British Columbia. The PFS will mark the culmination of the extensive de-risking and optimization program that has been undertaken since the issuance of the 2020 preliminary economic assessment (""2020 PEA""). The PFS is expected to be completed in September 2023.",CAD,FPX.V,CNW Group - FPX Nickel Commences Preliminary Feasibility Study on the Baptiste Nickel Project
fin_news_nlp/yahoo_cad_tickers_news,https://ca.finance.yahoo.com/news/kingman-announces-non-brokered-private-002800677.html,"Vancouver, British Columbia--(Newsfile Corp. - January 17, 2023) - Kingman Minerals Ltd. (TSXV: KGS) (FSE: 47A) (OTCQB: KGSSF) (""Kingman"" or the ""Company"") is pleased to announce that it intends to complete a non-brokered private placement of up to $350,000 (the ""Offering"") and to settle $456,725 of debt with shares. The Company will use the net proceeds of the Offering for working capital purposes. Private PlacementSubject to the approval of the TSX Venture Exchange (the ...",CAD,KGS.V, - Kingman Announces Non-Brokered Private Placement and Shares for Debt
fin_news_nlp/yahoo_cad_tickers_news,https://ca.finance.yahoo.com/news/constellation-software-inc-announces-annual-045300803.html,"TORONTO, Jan. 17, 2023 (GLOBE NEWSWIRE) -- Constellation Software Inc. (TSX: CSU, TSX: CSU.DB) (the “Company”) announced today that the interest rate applicable to the unsecured subordinated floating rate debentures, Series 1 of the Company (the “Debentures”) will be reset to 13.3% per annum on March 31, 2023. This new interest rate is equal to the annual average percentage change in the “All-items Consumer Price Index” published by Statistics Canada during the 12 month period ending on December",CAD,CSU.TO,GlobeNewswire - Constellation Software Inc. Announces Annual Interest Rate for Series 1 Debentures
fin_news_nlp/yahoo_cad_tickers_news,https://ca.finance.yahoo.com/news/pan-american-silver-announces-preliminary-220800050.html,"Pan American Silver Corp. (NASDAQ: PAAS) (TSX: PAAS) (""Pan American"") is pleased to announce its preliminary production results for the fourth quarter (""Q4 2022"") and full year 2022 (""FY 2022""), with FY 2022 results in line with annual guidance.",CAD,PAAS.TO,CNW Group - Pan American Silver announces preliminary 2022 production results
fin_news_nlp/yahoo_cad_tickers_news,https://ca.finance.yahoo.com/news/production-operational-070000608.html,"(TSX: AOI) (Nasdaq-Stockholm: AOI) – Africa Oil Corp. (""Africa Oil"", ""AOC"" or the ""Company"") is pleased to announce its full-year 2022 production results and to provide an operational update. The Company's production is attributed to its fifty per cent shareholding in Prime Oil & Gas Coöperatief U.A. (""Prime""). View PDF version.",CAD,AOI.TO,CNW Group - PRODUCTION AND OPERATIONAL UPDATE
fin_news_nlp/yahoo_cad_tickers_news,https://ca.finance.yahoo.com/news/bnp-paribas-regulatory-approvals-reached-064014350.html,"BNP Paribas, France's biggest listed bank, said on Wednesday that it had received all the necessary regulatory approvals to complete its previously-announced sale of Bank of the West to Bank of Montreal.  BNP Paribas added that this transaction was expected to close on Feb 1.  Bank of Montreal had said in December 2021 that it would buy BNP Paribas' U.S. unit, Bank of the West, for $16.3 billion in its biggest deal ever, allowing the Canadian lender to double its footprint in the world's biggest economy, while giving France's largest bank a huge step up in firepower for deals.",CAD,BMO.TO, - BNP Paribas: regulatory approvals reached to complete sale of Bank of the West to BMO
fin_news_nlp/yahoo_cad_tickers_news,https://ca.finance.yahoo.com/news/1-bnp-paribas-wins-regulatory-084110347.html,"BNP Paribas, France's biggest listed bank, said on Wednesday that it had received all the necessary regulatory approvals to complete its previously announced sale of Bank of the West to Bank of Montreal.  BNP Paribas added that this transaction was expected to close on Feb 1.  Bank of Montreal agreed in December 2021 to buy BNP Paribas' U.S. unit, Bank of the West, for $16.3 billion in its biggest deal ever, allowing the Canadian lender to double its footprint in the world's biggest economy, while giving BNP a huge step up in financial firepower for deals.",CAD,BMO.TO, - UPDATE 1-BNP Paribas wins all regulatory approvals for sale of Bank of the West
fin_news_nlp/yahoo_cad_tickers_news,https://ca.finance.yahoo.com/news/cibt-education-group-first-quarter-100401286.html,CIBT Education Group ( TSE:MBA ) First Quarter 2023 Results Key Financial Results Revenue: CA$18.3m (up 7.4% from 1Q...,CAD,MBA.TO,Simply Wall St. - CIBT Education Group First Quarter 2023 Earnings: CA$0.02 loss per share (vs CA$0.003 profit in 1Q 2022)
fin_news_nlp/yahoo_cad_tickers_news,https://ca.finance.yahoo.com/news/firefox-gold-tests-drill-orientation-103000140.html,"FireFox Gold Corp. (TSXV:FFOX)(OTCQB:FFOXF)(""FireFox"" or the ""Company"") is pleased to report results from the first three drill holes of the fall 2022 core drilling campaign at the Company's 100%-held Mustajärvi Gold Project in Lapland, Finland. These three holes were part of a six-hole program (977.1 metres) that tested a new near-surface high-grade gold zone at the East Target (see Figure 1).",CAD,FFOX.V,"ACCESSWIRE - FireFox Gold Tests New Drill Orientation and Hits More High-Grade, including 13.09 g/t gold over 15.5m, at Mustajärvi Project, Finland"
fin_news_nlp/yahoo_cad_tickers_news,https://ca.finance.yahoo.com/news/spring-creek-egg-farm-picks-110000952.html,"Vancouver, British Columbia--(Newsfile Corp. - January 18, 2023) - good natured Products Inc. (TSXV: GDNP) (OTCQX: GDNPF) (the ""Company"" or ""good natured®""), a North American leader in plant-based products, is pleased to announce that Spring Creek Quail Farms (""Spring Creek""), has chosen good natured® Bio-PET packaging to safely deliver its naturally raised quail eggs to grocery stores in the US and Canada, including Kroger, Costco, Loblaws and Sobeys.Spring Creek Quail Farm chooses sustainable,",CAD,GDNP.V,Newsfile - Spring Creek Egg Farm Picks Clear Plant-Based Packaging over Fiber Alternatives
fin_news_nlp/yahoo_cad_tickers_news,https://ca.finance.yahoo.com/news/canadian-owned-irving-oil-selects-110000002.html,"SAINT JOHN, New Brunswick & BURLINGTON, Ontario, January 18, 2023--Irving Oil and global waste-to-renewable natural gas (RNG) industry leader Anaergia Inc. (""Anaergia"", TSX: ANRG) have announced a partnership that will supply Canada’s largest refinery with carbon-negative RNG, as well as Irving Oil’s other operations such as Delivered Natural Gas.",CAD,ANRG.TO,"Business Wire - Canadian-Owned Irving Oil Selects Anaergia Inc. as a Supplier of Carbon-Negative Renewable Natural Gas for its Operations, Including the Saint John Refinery"
fin_news_nlp/yahoo_cad_tickers_news,https://ca.finance.yahoo.com/news/ascendant-starts-drilling-anomaly-d-110000394.html,"Figure 1. Planned Drillholes & Geophysical context of Anomalies D & B Figure 2. Anomaly D Target location and estimated depth Ascendant commences first greenfield exploration drilling since acquiring the Lagoa Salgada option5,000m exploration program targeting two undrilled IP/EM anomalies with the potential for sizeable concentrations of mineralizationDrilling underway at “Anomaly D” a high impact target hoped to be a replica of the North Zone; Lagoa Salgada’s richest deposit TORONTO, Jan. 18,",CAD,ASND.TO,GlobeNewswire - Ascendant Starts Drilling “Anomaly D” Exploration Target With Analogous Signature to North Zone Massive Sulphide Deposit at Lagoa Salgada
fin_news_nlp/yahoo_cad_tickers_news,https://ca.finance.yahoo.com/news/bmo-receives-regulatory-approval-bank-123929484.html,"TORONTO — BMO Financial Group says it has received all of the regulatory approvals required to complete its agreement to buy California-based Bank of the West from BNP Paribas. BMO expects to close the deal for the U.S. bank on Feb. 1, subject to customary conditions. The Canadian bank announced its agreement to buy Bank of the West in December 2021 for US$16.3 billion. BMO says the deal gives it an expanded U.S. footprint. The acquisition will add nearly 1.8 million commercial, retail, wealth m",CAD,BMO.TO, - BMO receives regulatory approval for Bank of the West acquisition
fin_news_nlp/yahoo_cad_tickers_news,https://www.yahoo.com/news/leslie-jones-hilariously-mocks-mlk-023105545.html,"Comedy CentralA little more than a month after Trevor Noah officially said goodbye to The Daily Show, Comedy Central welcomed former Saturday Night Live cast member Leslie Jones as the first of several planned guest hosts on Tuesday night. And she had a hell of a story to start with in the inadvertently suggestive statue of Dr. Martin Luther King Jr. that was unveiled in Boston the day before.After staring for a few seconds at the sculpture, which is supposed to depict King and his wife, Coretta",CAD,?err=404&err_url=https%3A%2F%2Fca.finance.yahoo.com%2Fquote%2FACO.X.TO,Entertainment - 
fin_news_nlp/yahoo_cad_tickers_news,https://ca.finance.yahoo.com/news/bbtv-appoints-kb-brinkley-chief-120000686.html,"BBTV Holdings Inc. (TSX: BBTV) (OTCQX: BBTVF) (""BBTV"" or the ""Company""), a media tech company that uses technology enabled solutions to help content creators and influencers become more successful, today announces the appointment of Khamphiou (""KB"") Brinkley as Chief Financial Officer. Ben Groot will remain as a key member of the finance team with a focus on financial planning and analysis and special projects. BBTV also announces the appointment of Catherine Warren as an independent director, r",CAD,BBTV.TO,CNW Group - BBTV Appoints KB Brinkley as Chief Financial Officer and Catherine Warren as Board Director
fin_news_nlp/yahoo_cad_tickers_news,https://ca.finance.yahoo.com/news/public-companies-invested-canfor-pulp-112411583.html,"If you want to know who really controls Canfor Pulp Products Inc. ( TSE:CFX ), then you'll have to look at the makeup...",CAD,CFX.TO,Simply Wall St. - Public companies invested in Canfor Pulp Products Inc. (TSE:CFX) copped the brunt of last week's CA$42m market cap decline
fin_news_nlp/yahoo_cad_tickers_news,https://ca.finance.yahoo.com/news/currency-exchange-international-report-fourth-123000382.html,"TORONTO, Jan. 18, 2023 (GLOBE NEWSWIRE) -- Currency Exchange International, Corp. (the “Company”) (TSX: CXI; OTCBB: CURN), will report its financial results for the Fourth Quarter of 2022 (ended October 31, 2022) after-market close on Monday, January 23, 2023. Following the release, Currency Exchange International Corp. will host an earnings conference call with management on Tuesday, January 24, 2023 at 8:30 a.m. EST, in which they will discuss these recent financial and operational results. CX",CAD,CXI.TO,"GlobeNewswire - Currency Exchange International to Report its Fourth Quarter 2022 Results on January 23, 2023, and Host Earnings Conference Call on January 24, 2023 at 8:30 AM EST"
fin_news_nlp/yahoo_cad_tickers_news,https://ca.finance.yahoo.com/news/gogold-announces-more-strong-drilling-113000235.html,"GoGold Resources Inc. (TSX: GGD) (OTCQX: GLGDF) (""GoGold"", ""the Company"") is pleased to release the results of 8 drill holes from the El Favor East deposit within Los Ricos North property. Hole LRGF-22-147 intersected 1.2m of 4,209 g/t silver equivalent (""AgEq"") contained within 19.9m of 436 g/t AgEq.",CAD,GGD.TO,CNW Group - GoGold Announces More Strong Drilling Results at El Favor
fin_news_nlp/yahoo_cad_tickers_news,https://ca.finance.yahoo.com/news/magna-clearview-vision-system-comes-120000427.html,"Magna ClearView™ The ClearView™ displays a customizable live video feed from multiple rear-facing cameras (image by Stellantis) Complete vision system with first-to-market featuresCombines interior and exterior mirrors, cameras, electronics and softwareLaunched on Ram 2500 and 3500 Heavy Duty models AURORA, Ontario, Jan. 18, 2023 (GLOBE NEWSWIRE) -- Magna’s advanced ClearView™ vision technology designed to make vehicles smarter and safer has made its production debut on the Ram 2500 and 3500 Hea",CAD,MG.TO,GlobeNewswire - Magna’s ClearView™ Vision System Comes to Market on Ram Trucks
fin_news_nlp/yahoo_cad_tickers_news,https://ca.finance.yahoo.com/news/mty-increases-quarterly-dividend-19-120000826.html,"MTY Food Group Inc. (""MTY"" or the ""Company"") (TSX: MTY), franchisor and operator of multiple concepts of restaurants worldwide, announces its quarterly dividend payment will increase from 21.0¢ per share to 25.0¢ per share, a growth of 19%. The 25.0¢ dividend will be payable on February 15, 2023 to shareholders registered in the Company's records at the end of the business day on February 3, 2023.",CAD,MTY.TO,CNW Group - MTY INCREASES ITS QUARTERLY DIVIDEND BY 19%
fin_news_nlp/yahoo_cad_tickers_news,https://ca.finance.yahoo.com/news/mullen-group-ltd-tse-mtl-112046692.html,In this article we are going to estimate the intrinsic value of Mullen Group Ltd. ( TSE:MTL ) by taking the forecast...,CAD,MTL.TO,Simply Wall St. - Is Mullen Group Ltd. (TSE:MTL) Trading At A 41% Discount?
fin_news_nlp/yahoo_cad_tickers_news,https://ca.finance.yahoo.com/news/nfi-schedules-fourth-quarter-full-123000354.html,"WINNIPEG, Manitoba, Jan. 18, 2023 (GLOBE NEWSWIRE) -- (TSX: NFI, OTC: NFYEF, TSX: NFI.DB) NFI Group Inc. (“NFI” or the “Company”), a leading independent bus and coach manufacturer and a leader in electric mass mobility solutions, today announced that it will release its fourth quarter and full year 2022 financial results on Wednesday, March 1, 2023, prior to market open. A conference call for analysts and interested listeners will be held on March 1, 2023, from 8:30 a.m. Eastern Time (ET) until",CAD,NFI.TO,"GlobeNewswire - NFI schedules fourth quarter and full year 2022 financial results release and conference call for March 1, 2023"
