source,url,description,country,company,title
fin_news_nlp/yahoo_cad_tickers_news,https://ca.finance.yahoo.com/news/polaris-renewable-energy-announces-results-212000886.html,"Polaris Renewable Energy Inc. (TSX:PIF) (""Polaris"" or the ""Company""), is pleased to announce that all six director nominees proposed by management were elected as directors of the Company at its annual and special meeting of shareholders held via live video webcast today. Each director will hold office until the close of the next annual meeting of the Company's shareholders or until their successors are duly elected or appointed.",CAD,PIF.TO,ACCESSWIRE - Polaris Renewable Energy Announces Results of Director Elections at Annual and Special Meeting
fin_news_nlp/yahoo_cad_tickers_news,https://ca.finance.yahoo.com/news/glencore-buy-remaining-18-stake-160922789.html,"PolyMet's stock more than doubled on July 3 after Glencore offered $2.11 per share in cash for the remaining stake.  The acquisition is subject to shareholder approval at a meeting set for the end of the third quarter or early in the final quarter of the year, PolyMet added.  PolyMet is developing a copper-nickel mine in northeastern Minnesota with Canada's Teck Resources, another company which is on Glencore's radar.",CAD,POM.TO,Reuters - Glencore to buy remaining 18% stake in PolyMet Mining
fin_news_nlp/yahoo_cad_tickers_news,https://ca.finance.yahoo.com/news/658-month-passive-income-buy-131500363.html,"Are you looking to build a passive-income portfolio? Disciplined investment in this stock is enough to secure a $658 monthly dividend income. The post For $658/Month in Passive Income, Buy This Much of 1 Stock appeared first on The Motley Fool Canada.",CAD,POW.TO,"The Motley Fool - For $658/Month in Passive Income, Buy This Much of 1 Stock"
fin_news_nlp/yahoo_cad_tickers_news,https://ca.finance.yahoo.com/news/prairiesky-royalty-earns-48-million-215747967.html,"CALGARY — PrairieSky Royalty Ltd. says its net earnings for the second quarter were $48 million, down from $110.1 million a year earlier. The Calgary-based company says it saw record quarterly average oil royalty production of 12,607 barrels per day. PrairieSky's revenues for the quarter ended June 30 were $117.4 million, down almost 41 per centfrom $198.1 million during the same period last year. Diluted earnings per share were 20 cents, down from 46 cents a year ago. President and CEO Andrew P",CAD,PSK.TO,The Canadian Press - PrairieSky Royalty earns $48 million in second quarter
fin_news_nlp/yahoo_cad_tickers_news,https://ca.finance.yahoo.com/news/top-tsx-food-stocks-watch-214500006.html,The spike in food prices in recent years should spur investors to snatch up TSX food stocks like Maple Leaf Foods Inc. (TSX:MFI). The post Top TSX Food Stocks: What to Watch in July 2023 appeared first on The Motley Fool Canada.,CAD,PBH.TO,The Motley Fool - Top TSX Food Stocks: What to Watch in July 2023
fin_news_nlp/yahoo_cad_tickers_news,https://ca.finance.yahoo.com/news/prime-dividend-corp-monthly-dividend-130000802.html,"TORONTO, July 18, 2023 (GLOBE NEWSWIRE) -- Prime Dividend Corp. (The ""Company"") declares its monthly distribution of $0.04642 for each Class A share and $0.06667 for each Preferred share. Distributions are payable August 10, 2023 to shareholders on record as at July 31, 2023. Under the distribution policy announced on July 17, 2014, the monthly dividend payable on the Class A shares is determined by applying a 10.00% annualized rate on the volume weighted average market price (VWAP) of the Class",CAD,PDV.TO,GlobeNewswire - Prime Dividend Corp. Monthly Dividend Declaration for Class A & Preferred Share
fin_news_nlp/yahoo_cad_tickers_news,https://ca.finance.yahoo.com/news/primo-water-announces-date-second-103000835.html,"Primo Water Corporation (NYSE: PRMW) (TSX: PRMW) (the ""Company"" or ""Primo Water""), a leading provider of sustainable drinking water solutions direct to consumers in North America and Europe, today announced that the Company will release its second quarter ended July 1, 2023 financial results before the markets open on Thursday, August 10, 2023.",CAD,PRMW.TO,CNW Group - PRIMO WATER ANNOUNCES DATE FOR SECOND QUARTER 2023 EARNINGS RELEASE AND CONFERENCE CALL
fin_news_nlp/yahoo_cad_tickers_news,https://ca.finance.yahoo.com/news/profound-medical-announces-cpt-category-174000620.html,"TORONTO, June 02, 2023 (GLOBE NEWSWIRE) -- Profound Medical Corp. (NASDAQ:PROF; TSX:PRN) (“Profound” or the “Company”), a commercial-stage medical device company that develops and markets customizable, incision-free therapies for the ablation of diseased tissue, announced today that, with sponsorship and support from multiple physician specialty societies, the American Medical Association (“AMA”) has established three new Current Procedural Terminology (“CPT®’) Category 1 codes for MRI-Monitored",CAD,PRN.TO,GlobeNewswire - Profound Medical Announces New CPT® Category 1 Codes from the AMA for TULSA to Treat Prostate Diseases
fin_news_nlp/yahoo_cad_tickers_news,https://ca.finance.yahoo.com/news/promis-showcases-preclinical-data-alzheimer-110000896.html,"New findings highlight that PMN310 was able to target toxic amyloid-beta oligomers more selectively than other amyloid-beta-directed antibodies which were generated using synthetic oligomersRationally designed vaccine candidate for prevention of Alzheimer’s disease showed robust and sustained antibody response focused on pathogenic amyloid-beta oligomers TORONTO, Ontario and CAMBRIDGE, Massachusetts, July 17, 2023 (GLOBE NEWSWIRE) -- ProMIS Neurosciences Inc. (TSX: PMN) (Nasdaq: PMN), a biotechn",CAD,PMN.TO,GlobeNewswire - ProMIS Showcases Preclinical Data at the Alzheimer’s Association International Conference 2023 on Computationally-Derived Antibody and Vaccine from Alzheimer’s Pipeline
fin_news_nlp/yahoo_cad_tickers_news,https://ca.finance.yahoo.com/news/purpose-investments-appoints-coinbase-additional-213000580.html,"Global Digital Asset Management Leader Enhances Custodial Services to Provide Best-in-Class Structure for InvestorsTORONTO, May 16, 2023 (GLOBE NEWSWIRE) -- Purpose Investments Inc. (“Purpose Investments” or “Purpose”) today announced that Coinbase Custody Trust Company, LLC. (“Coinbase”), a New York State chartered limited purpose trust company, a subsidiary of Coinbase Global Inc. and one of the world’s largest and most-trusted institutional digital asset custodians, will act as an additional",CAD,BTCC.TO,GlobeNewswire - Purpose Investments Appoints Coinbase as Additional Sub-Custodian for Crypto Funds
fin_news_nlp/yahoo_cad_tickers_news,https://ca.finance.yahoo.com/news/wyloo-metals-files-notice-intention-114500870.html,"Hong Kong, Hong Kong--(Newsfile Corp. - July 17, 2023) - Queen's Road Capital Investment Ltd. (TSX: QRC) (the ""Company"" or ""QRC"") announces that on July 14, 2023, Wyloo Metals Pty Ltd. (""Wyloo""), filed a notice of intention to distribute up to 50,000,000 common shares of QRC (representing up to 11.1% of the issued and outstanding common shares). Wyloo's notice states that the common shares are expected to be sold through the facilities of the ...",CAD,QRC.TO,Newsfile - Wyloo Metals Files Notice of Intention to Distribute Shares of Queen's Road Capital
fin_news_nlp/yahoo_cad_tickers_news,https://ca.finance.yahoo.com/news/questerre-updates-status-legal-action-120000321.html,"THIS NEWS RELEASE IS NOT FOR DISSEMINATION OR DISTRIBUTION IN THE UNITED STATES OF AMERICA TO UNITED STATES NEWSWIRE SERVICES OR UNITED STATES PERSONS CALGARY, Alberta, June 23, 2023 (GLOBE NEWSWIRE) -- Questerre Energy Corporation (“Questerre” or the “Company”) (TSX,OSE:QEC) reported today on the case management conference held earlier this week in Quebec related to Bill 21, An Act mainly to end petroleum exploration and production and the public financing of those activities (“Bill 21”). The A",CAD,QEC.TO,GlobeNewswire - Questerre updates status of legal action in Quebec
fin_news_nlp/yahoo_cad_tickers_news,https://ca.finance.yahoo.com/news/quipt-home-medical-participate-43rd-113000380.html,"Fireside Chat to be Held Wednesday, August 9thCINCINNATI, July 24, 2023 (GLOBE NEWSWIRE) -- Quipt Home Medical Corp. (the “Company”) (NASDAQ:QIPT; TSX:QIPT), a U.S. based home medical equipment provider, focused on end-to-end respiratory care, today announced that members of its management team will host a webcasted fireside chat and participate in 1x1 meetings at the 43rd Annual Canaccord Growth Conference on August 9th - 10th, 2023. The conference will be held in person at the InterContinental",CAD,QIPT.TO, - Quipt Home Medical to Participate at the 43rd Annual Canaccord Growth Conference
fin_news_nlp/yahoo_cad_tickers_news,https://ca.finance.yahoo.com/news/rb-global-report-second-quarter-201000878.html,"RB Global, Inc. (NYSE: RBA) (TSX: RBA) announced today that it will release second quarter financial results after market close on Thursday, August 3, 2023.",CAD,RBA.TO,"CNW Group - RB Global to Report Second Quarter 2023 Financial Results and Host Conference Call on August 3, 2023"
fin_news_nlp/yahoo_cad_tickers_news,https://ca.finance.yahoo.com/news/rbc-global-asset-management-inc-130500837.html,"RBC Global Asset Management Inc. (""RBC GAM Inc."") today announced July 2023 cash distributions for unitholders of RBC ETFs, as follows:",CAD,RID.TO,CNW Group - RBC Global Asset Management Inc. announces RBC ETF cash distributions for July 2023
fin_news_nlp/yahoo_cad_tickers_news,https://ca.finance.yahoo.com/news/rbc-global-asset-management-inc-130500370.html,"RBC Global Asset Management Inc. (RBC GAM Inc.) today announced June 2023 cash distributions for unitholders of RBC ETFs, as follows:",CAD,RIE.TO,CNW Group - RBC Global Asset Management Inc. announces RBC ETF cash distributions for June 2023
fin_news_nlp/yahoo_cad_tickers_news,https://ca.finance.yahoo.com/news/real-estate-split-corp-class-160000722.html,"TORONTO, July 19, 2023 (GLOBE NEWSWIRE) -- Real Estate Split Corp. (TSX: RS) (the “Fund”), is pleased to announce that a distribution for July 2023 will be payable to Class A shareholders of Real Estate Split Corp. as follows: Record DatePayable DateDistribution PerEquity ShareJuly 31, 2023August 15, 2023$0.13 The equity shares trade on the Toronto Stock Exchange under the symbol RS. Middlefield Group Formed in 1979, Middlefield creates equity income mandates designed to balance risk and return",CAD,RS.TO,GlobeNewswire - Real Estate Split Corp. Class A Distribution
fin_news_nlp/yahoo_cad_tickers_news,https://ca.finance.yahoo.com/news/dividend-stocks-canadians-smart-way-133000273.html,Here are three of the top Canadian dividend stocks long-term investors ought to consider when building a balanced and diversified portfolio. The post Dividend Stocks for Canadians: A Smart Way to Invest for Retirement appeared first on The Motley Fool Canada.,CAD,QSR.TO,The Motley Fool - Dividend Stocks for Canadians: A Smart Way to Invest for Retirement
fin_news_nlp/yahoo_cad_tickers_news,https://ca.finance.yahoo.com/news/media-advisory-rf-capital-report-130000557.html,"RF Capital Group Inc. (the Company) (TSX: RCG) will report its second quarter 2023 financial results on Wednesday, August 2, 2023, after market close.",CAD,RCG.TO,CNW Group - MEDIA ADVISORY - RF Capital to Report Second Quarter 2023 Results
fin_news_nlp/yahoo_cad_tickers_news,https://ca.finance.yahoo.com/news/smart-moves-rising-rates-3-170000885.html,These thress stocks can strengthen your portfolio because the companies can weather rising interest rates better than others. The post Smart Moves for Rising Rates: 3 Stocks to Strengthen Your Portfolio appeared first on The Motley Fool Canada.,CAD,RSI.TO,The Motley Fool - Smart Moves for Rising Rates: 3 Stocks to Strengthen Your Portfolio
fin_news_nlp/yahoo_cad_tickers_news,https://ca.finance.yahoo.com/news/rubellite-energy-inc-announces-election-220400262.html,"(TSX: RBY) – Rubellite Energy Inc. (""Rubellite"" or the ""Corporation"") is pleased to announce that the nominees listed in the management proxy circular dated April 6, 2023, were elected as directors of Rubellite. The detailed results of the vote for the election of directors held at its annual meeting of shareholders earlier today in Calgary, Alberta are set out below.",CAD,RBY.TO,CNW Group - RUBELLITE ENERGY INC. ANNOUNCES ELECTION OF DIRECTORS
fin_news_nlp/yahoo_cad_tickers_news,https://ca.finance.yahoo.com/news/rupert-resources-reports-results-three-110000514.html,"TORONTO, July 10, 2023--Rupert Resources Ltd (""Rupert"" or the ""Company"") announces that it has published its financial results for the three months ending May 31, 2023 and accompanying Management’s Discussion and Analysis for the same period. The Company is also pleased to report that it has published its Sustainability Report covering 2022.",CAD,RUP.TO,"Business Wire - Rupert Resources Reports Results for the Three Months Ending May 31, 2023 and Publishes Sustainability Report for 2022"
fin_news_nlp/yahoo_cad_tickers_news,https://ca.finance.yahoo.com/news/sagicor-financial-company-ltd-renews-110000123.html,"Sagicor Financial Company Ltd. (TSX: SFC) (""Sagicor"" or ""Company"") today announced that the Toronto Stock Exchange (the ""TSX"") has accepted Sagicor's notice of intention to renew its normal course issuer bid (""NCIB"") through which Sagicor may purchase up to 8,840,727 of Sagicor's common shares (the ""NCIB Shares"") during the 12-month period commencing June 24, 2023 and ending June 23, 2024. The number of shares authorized for purchase represents 10 percent of the public float. Sagicor had 142,564",CAD,SFC.TO,CNW Group - Sagicor Financial Company Ltd. Renews its Normal Course Issuer Bid
fin_news_nlp/yahoo_cad_tickers_news,https://ca.finance.yahoo.com/news/sangoma-technologies-corporation-announces-planned-210000905.html,"Sale Being Undertaken to Fund Tax Obligations Arising From Recent Distribution of Final Tranche of Shares in Connection With 2021 StarBlue AcquisitionMARKHAM, Ontario, June 05, 2023 (GLOBE NEWSWIRE) -- Sangoma Technologies Corporation (TSX: STC; Nasdaq: SANG) (“Sangoma” or the “Company”), a trusted leader in delivering cloud-based Communications as a Service solutions for companies of all sizes, today announced that Star2Star Holdings, LLC (“Holdings”) has filed a notice of intention to distribu",CAD,STC.TO,"GlobeNewswire - Sangoma Technologies Corporation Announces Planned Share Sale by Star2Star Holdings, LLC"
fin_news_nlp/yahoo_cad_tickers_news,https://ca.finance.yahoo.com/news/3-top-canadian-food-stocks-144500030.html,"Of the top Canadian food stocks discussed, Saputo and Maple Leaf are cheaper, but Empire provides better defence. The post These 3 Top Canadian Food Stocks Are on Sale Today appeared first on The Motley Fool Canada.",CAD,SAP.TO,The Motley Fool - These 3 Top Canadian Food Stocks Are on Sale Today
fin_news_nlp/yahoo_cad_tickers_news,https://ca.finance.yahoo.com/news/only-getting-older-top-tsx-170000410.html,This TSX leader providing accessibility and mobility solutions should benefit greatly from an aging global population. The post We’re Only Getting Older: A Top TSX Stock That Benefits From an Aging Population appeared first on The Motley Fool Canada.,CAD,SIS.TO,The Motley Fool - We’re Only Getting Older: A Top TSX Stock That Benefits From an Aging Population
fin_news_nlp/yahoo_cad_tickers_news,https://ca.finance.yahoo.com/news/scandium-international-mining-discovers-mineralized-113000904.html,"Drillhole Location Map at Woodlong Drillhole Location Map at Woodlong Woodlong Laterite Assays by Sc ppm (other figure intercept length) Woodlong Laterite Assays by Sc ppm (other figure intercept length) Highlights: Scandium enriched laterite formation defined at Woodlong prospect within the Honeybugle Exploration Licence 7977 area, where 32 vertical air core holes were drilled during first quarter 2023 in an approximately 300m x 400m area.Notable laterite intercepts: 28 meters of 320 ppm Sc sta",CAD,SCY.TO,"GlobeNewswire - Scandium International Mining Discovers New Mineralized Laterite Formation at Honeybugle, EL7977, NSW"
fin_news_nlp/yahoo_cad_tickers_news,https://ca.finance.yahoo.com/news/seabridge-gold-begins-drilling-3-113000887.html,"Toronto, Ontario--(Newsfile Corp. - July 18, 2023) - Seabridge Gold (TSX: SEA) (NYSE: SA) announced today that drilling has commenced at its wholly owned 3 Aces project in Canada's Yukon to complete the testing of a comprehensive exploration model. The program is scheduled to complete 7,500 meters of core and reverse circulation drilling in the Central Core Area (CCA) of the 3 Aces project. Initial targets will focus on expanding mineralized zones on the ...",CAD,SEA.TO,Newsfile - Seabridge Gold Begins Drilling at the 3 Aces Project
fin_news_nlp/yahoo_cad_tickers_news,https://ca.finance.yahoo.com/news/mattr-host-investor-day-toronto-113000152.html,"TORONTO, July 18, 2023 (GLOBE NEWSWIRE) -- Shawcor Ltd., dba Mattr Infratech (“Mattr” or the “Company”) (TSX: MATR) announced today that it intends to host an investor day on Monday, December 11th, 2023 in downtown Toronto. In addition, the Company will offer an optional tour of its Rexdale facility on December 12th, 2023. The event will include presentations from Mike Reeves, President and CEO and Tom Holloway, CFO, as well as business leaders from Canada, the United States and Europe. More det",CAD,MATR.TO,GlobeNewswire - Mattr to Host Investor Day in Toronto on December 11th 2023
fin_news_nlp/yahoo_cad_tickers_news,https://ca.finance.yahoo.com/news/passive-income-seekers-turn-1-190000488.html,"Find a great side hustle and dividend stock and you could be making a killing in passive income each and every month! The post Passive Income Seekers: Turn 1 Side Hustle and 1 Stock Into $1,126/Month appeared first on The Motley Fool Canada.",CAD,SIA.TO,"The Motley Fool - Passive Income Seekers: Turn 1 Side Hustle and 1 Stock Into $1,126/Month"
fin_news_nlp/yahoo_cad_tickers_news,https://ca.finance.yahoo.com/news/sierra-metals-reports-another-strong-110000597.html,"TORONTO, July 25, 2023--Sierra Metals Inc. (TSX: SMT) (OTC: SMTSF) (""Sierra Metals"" or ""the Company"") announces second quarter 2023 production results from its three underground mines in Latin America: Yauricocha, a polymetallic mine in Peru and Bolivar a copper mine and Cusi a silver mine each in Mexico.",CAD,SMT.TO, - Sierra Metals Reports Another Strong Quarter of Production Including Record Copper Equivalent Production at Bolivar
fin_news_nlp/yahoo_cad_tickers_news,https://ca.finance.yahoo.com/news/signal-gold-consolidates-goldboro-gold-110000427.html,"Signal Gold Inc. (""Signal Gold"" or the ""Company"") (TSX:SGNL)(OTCQX:SGNLF) is pleased to announce that through staking and third-party transactions, the Company has now consolidated the majority of the Goldboro Gold District in Nova Scotia, nearly quintupling its exploration licence area to approximately 19,450 hectares (195 km2).",CAD,SGNL.TO,ACCESSWIRE - Signal Gold Consolidates the Goldboro Gold District and Provides a Goldboro Project Update
fin_news_nlp/yahoo_cad_tickers_news,https://ca.finance.yahoo.com/news/silver-elephant-announces-delay-financial-120200116.html,"Vancouver, British Columbia--(Newsfile Corp. - July 7, 2023) - Silver Elephant Mining Corp. (TSX: ELEF) (OTCQX: SILEF) (FSE: 1P2N) (""Silver Elephant"" or ""the Company"") advises that it is delayed in filing the Company's annual financial statements for the 15 months ended, March 31, 2023, the corresponding management's discussion and analysis, the annual information form, and the related officer certifications of the annual filings for the 15 months ended March 31, 2023 (collectively, the ""2023 An",CAD,ELEF.TO,"Newsfile - Silver Elephant Announces Delay In Financial Filings For the 15 months Ended March 31, 2023 and Cease Trade Order"
fin_news_nlp/yahoo_cad_tickers_news,https://ca.finance.yahoo.com/news/sleep-country-canada-holdings-inc-154148878.html,"Sleep Country Canada Holdings Inc. ( TSE:ZZZ ), is not the largest company out there, but it led the TSX gainers with a...",CAD,ZZZ.TO,Simply Wall St. - Is Sleep Country Canada Holdings Inc. (TSE:ZZZ) Potentially Undervalued?
fin_news_nlp/yahoo_cad_tickers_news,https://ca.finance.yahoo.com/news/snc-lavalin-awarded-85-million-114500862.html,"SNC-Lavalin (TSX: SNC), a fully integrated professional services and project management company with offices around the world, announces it has received a transportation development general engineering consultant (GEC) services contract from Florida's Turnpike Enterprise. The Company will continue assisting Florida's user-financed transportation system in carrying out its five-year work program. The $85 million contract is a continuation of a 35-year relationship with the Enterprise that began i",CAD,SNC.TO,CNW Group - SNC-Lavalin Awarded $85 Million US Florida's Turnpike Enterprise Engineering Services Contract
fin_news_nlp/yahoo_cad_tickers_news,https://ca.finance.yahoo.com/news/solaris-reports-105m-0-60-110000732.html,"Figure 1 – Plan View of Warintza East and Warintza Southeast Drilling Released to Date Figure 1 – Plan View of Warintza East and Warintza Southeast Drilling Released to Date VANCOUVER, British Columbia, July 24, 2023 (GLOBE NEWSWIRE) -- Solaris Resources Inc. (TSX: SLS; OTCQB: SLSSF) (“Solaris” or the “Company”) is pleased to report assay results from a series of holes aimed at growing mineral resources at the Warintza Project (“Warintza” or “the Project”) in southeastern Ecuador. Highlights are",CAD,SLS.TO,GlobeNewswire - Solaris Reports 105m of 0.60% CuEq and 132m of 0.60% CuEq from Near Surface; Continued Expansion of Warintza East and Warintza Southeast
fin_news_nlp/yahoo_cad_tickers_news,https://ca.finance.yahoo.com/news/solitario-updates-progress-florida-canyon-123000578.html,"Solitario Resources Corp. (""Solitario"") (NYSE American:XPL)(TSX:SLR) is pleased to announce the commencement of the 2023 work programs on its Florida Canyon zinc project in Peru and Lik zinc project in Alaska.",CAD,SLR.TO,ACCESSWIRE - Solitario Updates Progress on Its Florida Canyon And Lik Zinc Projects With Drilling on Both Projects
fin_news_nlp/yahoo_cad_tickers_news,https://ca.finance.yahoo.com/news/solution-financial-reports-q2-2023-230000364.html,"Calgary, Alberta and Vancouver, British Columbia--(Newsfile Corp. - June 13, 2023) - Solution Financial Inc. (TSX: SFI) (the ""Company"") a leading provider of luxury automotive and yacht leasing in Canada, today announced its financial results for the second quarter ending April 30, 2023. Earnings Highlights for the Quarter:Revenues were $3.5 million, down from the comparative quarter which was $5.6 million.Net income was $37,826 compared to net income of $203,054 during the comparative quarter.A",CAD,SFI.TO,Newsfile - Solution Financial Reports Q2 2023 Financial Results
fin_news_nlp/yahoo_cad_tickers_news,https://ca.finance.yahoo.com/news/spark-announces-results-voting-annual-170000602.html,"Spark Power Group Inc. (TSX:SPG), parent company to Spark Power Corp. (""Spark Power"" or the ""Company""), today announced the voting results at its Annual General Meeting (the ""Meeting"") of shareholders held earlier today.",CAD,SPG.TO,ACCESSWIRE - Spark Announces Results of Voting at Annual General Meeting of Shareholders
fin_news_nlp/yahoo_cad_tickers_news,https://ca.finance.yahoo.com/news/spectral-medical-announces-tigris-clinical-120000599.html,"Enrollment momentum continues as Tigris Trial reaches 69 patientsTORONTO, July 25, 2023 (GLOBE NEWSWIRE) -- Spectral Medical Inc. (“Spectral” or the “Company”) (TSX: EDT), a late-stage theranostic company advancing therapeutic options for sepsis and septic shock, today announced that it has enrolled a total of 69 patients for the Company’s Tigris trial, a Phase 3 follow-on study evaluating the use of Polymyxin B Hemoperfusion (“PMX”) in a randomized controlled trial of adults treated for endotox",CAD,EDT.TO,GlobeNewswire - Spectral Medical Announces Tigris Clinical Trial Update
fin_news_nlp/yahoo_cad_tickers_news,https://ca.finance.yahoo.com/news/2-top-value-stocks-d-134500728.html,Canadian Tire (TSX:CTC.A) stock and another retail play are getting way too cheap to count out going into a recession! The post 2 Top Value Stocks I’d Happily Scoop Up in July appeared first on The Motley Fool Canada.,CAD,TOY.TO,The Motley Fool - 2 Top Value Stocks I’d Happily Scoop Up in July
fin_news_nlp/yahoo_cad_tickers_news,https://ca.finance.yahoo.com/news/those-invested-sprott-tse-sii-172741695.html,"It hasn't been the best quarter for Sprott Inc. ( TSE:SII ) shareholders, since the share price has fallen 14% in that...",CAD,SII.TO,Simply Wall St. - Those who invested in Sprott (TSE:SII) five years ago are up 60%
fin_news_nlp/yahoo_cad_tickers_news,https://ca.finance.yahoo.com/news/g2-52-week-high-news-153300458.html,G2 Goldfields Inc. (V.GTWO) hit a new 52-week high of 92 cents Wednesday. G2 Goldfields announces further ...,CAD,CEF.TO, - G2 at 52-Week High on News
fin_news_nlp/yahoo_cad_tickers_news,https://ca.finance.yahoo.com/news/sprott-physical-silver-trust-updates-214200851.html,"TORONTO, April 06, 2023 (GLOBE NEWSWIRE) -- Sprott Asset Management LP (“Sprott Asset Management”), a subsidiary of Sprott Inc., on behalf of the Sprott Physical Silver Trust (NYSE: PSLV) (TSX: PSLV / PSLV.U) (the “Trust”), a closed-ended mutual fund trust created to invest and hold substantially all of its assets in physical silver bullion, today announced that it has updated its at-the-market equity program to issue up to US$1 billion of units of the Trust (“Units”) in the United States and Ca",CAD,PSLV.TO, - Sprott Physical Silver Trust Updates Its “At-the-Market” Equity Program
