source,url,description,country,company,title
fin_news_nlp/yahoo_cad_tickers_news,https://ca.finance.yahoo.com/news/fidelity-investments-canada-ulc-announces-213000283.html,"Fidelity Investments Canada ULC today announced the June 2023 cash distributions for Fidelity's suite of High Dividend Factor ETFs, Fixed Income ETFs, Monthly High Income ETFs, Low Volatility Factor ETFs, High Quality Factor ETFs and Value Factor ETFs.",CAD,FCIG.TO,"CNW Group - Fidelity Investments Canada ULC Announces Cash Distributions for Fidelity High Dividend Factor ETFs, Fixed Income ETFs, Monthly High Income ETFs, Low Volatility Factor ETFs, High Quality Factor ETFs and Value Factor ETFs"
fin_news_nlp/yahoo_cad_tickers_news,https://ca.finance.yahoo.com/news/fire-flower-announces-commencement-court-012800619.html,"Fire & Flower Holdings Corp. (""Fire & Flower"" or the ""Company"") (TSX: FAF) (OTCQX: FFLWF) and its subsidiaries, Fire & Flower Inc., 13318184 Canada Inc., 11180703 Canada Inc., 10926671 Canada Ltd., Friendly Stranger Holdings Corp., Pineapple Express Delivery Inc. and Hifyre Inc. (collectively, the ""Fire & Flower Group"") today announced that they have received approval from the Ontario Superior Court of Justice (Commercial List) (the ""Court"") under the Companies' Creditors Arrangement Act (the ""C",CAD,FAF.TO,CNW Group - FIRE & FLOWER ANNOUNCES COMMENCEMENT OF COURT-APPROVED SALE AND INVESTMENT SOLICITATION PROCESS
fin_news_nlp/yahoo_cad_tickers_news,https://ca.finance.yahoo.com/news/mercer-merc-boosts-production-capacity-151700906.html,Mercer International (MERC) completes the Structurlam acquisition to boost its production capacity for cross-laminated timber and glued laminated timber.,CAD,FNV.TO,Zacks - Mercer (MERC) Boosts Production Capacity With Structurlam Buy
fin_news_nlp/yahoo_cad_tickers_news,https://ca.finance.yahoo.com/news/goldgroup-announces-proposed-settlement-loan-210100287.html,"Vancouver, British Columbia--(Newsfile Corp. - June 15, 2023) - Goldgroup Mining Inc. (TSX: GGA) (OTC Pink: GGAZF) (BMV SIX: GGAN.MX) (""Goldgroup"" or the ""Company"") hereby announces that the Company will be seeking minority shareholder approval at the Company's Annual General and Special Meeting (the ""Shareholders Meeting"") to be held on June 28, 2023 in connection with the settlement of a loan obtained from Accendo Banco S.A., Multiple Banking Institution (""Accendo"") in 2020.Background to the .",CAD,GGA.TO, - Goldgroup Announces Proposed Settlement of Loan
fin_news_nlp/yahoo_cad_tickers_news,https://ca.finance.yahoo.com/news/greenlane-renewables-announces-results-2023-222800788.html,"Greenlane Renewables Inc. (""Greenlane"") (TSX: GRN) (FSE: 52G) is pleased to announce the results from its 2023 Annual General Meeting of Shareholders held on June 21, 2023 (the ""Meeting""). Shareholders approved all matters submitted to them for approval at the annual general meeting. The results of the voting are set forth below:",CAD,GRN.TO,CNW Group - Greenlane Renewables Announces Results From 2023 Annual General Meeting of Shareholders
fin_news_nlp/yahoo_cad_tickers_news,https://ca.finance.yahoo.com/news/guardian-capital-announces-june-2023-110000261.html,"TORONTO, June 16, 2023 (GLOBE NEWSWIRE) -- Guardian Capital LP announces the following regular cash distributions for the period ending June 30, 2023, in respect of the ETF series of the Guardian Capital funds listed below (the “Guardian Capital ETFs”). In each case, the distribution will be paid on June 30, 2023 to unitholders of record on June 26, 2023. The ex-dividend date in each case is June 23, 2023. Guardian Capital ETFsSeries of ETF UnitsDistributionFrequencyTSX TradingSymbolDistribution",CAD,GDEP.TO,GlobeNewswire - Guardian Capital Announces June 2023 Distributions for Guardian Capital ETFs
fin_news_nlp/yahoo_cad_tickers_news,https://ca.finance.yahoo.com/news/high-arctic-declares-monthly-dividend-000000736.html,"NOT FOR DISTRIBUTION TO U.S. NEWSWIRE SERVICES OR FOR DISSEMINATION IN THE UNITED STATES. ANY FAILURE TO COMPLY WITH THIS RESTRICTION MAY CONSTITUTE A VIOLATION OF U.S. SECURITIES LAW CALGARY, Alberta, June 21, 2023 (GLOBE NEWSWIRE) -- High Arctic Energy Services Inc. (TSX: HWO) ""High Arctic"" or the ""Corporation” is pleased to announce that its Board of Directors has approved a monthly dividend payment of $0.005 per share to holders of common shares. The dividend is payable on July 14, 2023, to",CAD,HWO.TO,GlobeNewswire - High Arctic Declares Monthly Dividend
fin_news_nlp/yahoo_cad_tickers_news,https://ca.finance.yahoo.com/news/ai-gold-rush-strike-rich-153000170.html,These three ETFs from Horizons provide exposure to AI-themed stocks. The post The AI Gold Rush: How to Strike it Rich With the Right Stocks appeared first on The Motley Fool Canada.,CAD,HBGD.TO,The Motley Fool - The AI Gold Rush: How to Strike it Rich With the Right Stocks
fin_news_nlp/yahoo_cad_tickers_news,https://ca.finance.yahoo.com/news/canadian-mining-stock-hidden-gem-201500441.html,"Ivanhoe Mines Ltd. (TSX:IVN) is a Canadian mining stock that looks underrated, as we kick off the 2023 summer season. The post This Canadian Mining Stock Is a Hidden Gem appeared first on The Motley Fool Canada.",CAD,IVN.TO,The Motley Fool - This Canadian Mining Stock Is a Hidden Gem
fin_news_nlp/yahoo_cad_tickers_news,https://ca.finance.yahoo.com/news/june-15th-otcqx-best-50-123500981.html,"Company Executives Share Vision and Answer Questions at VirtualInvestorConferences.comNEW YORK, June 16, 2023 (GLOBE NEWSWIRE) -- Virtual Investor Conferences, the leading proprietary investor conference series, today announced the presentations from the OTCQX Best 50 Virtual Investor Conference, held on June 15th are now available for online viewing. REGISTER NOW AT: https://bit.ly/3CDqMXz The company presentations will be available 24/7 for 90 days. Investors, advisors, and analysts may downlo",CAD,JOY.TO,GlobeNewswire - June 15th OTCQX Best 50 Virtual Investor Conference: Presentations Now Available for Online Viewing
fin_news_nlp/yahoo_cad_tickers_news,https://ca.finance.yahoo.com/news/medexus-generates-record-revenue-us-214000712.html,"Management to Host Conference Call at 8:00 Am Eastern Time on Thursday, June 22, 2023 Toronto, Ontario and Chicago, Illinois--(Newsfile Corp. - June 21, 2023) - Medexus Pharmaceuticals (TSX: MDP) (OTCQX: MEDXF) today announced its operating and financial results and provided a business update for the company's fourth fiscal quarter and fiscal year ended March 31, 2023 (the company's fiscal Q4 2023 and fiscal year 2023). All dollar amounts in this press release are in ...",CAD,MDP.TO,Newsfile - Medexus Generates Record Revenue of US$108.1 Million in Fiscal Year 2023
fin_news_nlp/yahoo_cad_tickers_news,https://ca.finance.yahoo.com/news/national-bank-investments-announces-june-123000809.html,"National Bank Investments Inc. (‟NBI"") announced today the June 2023 cash distribution amounts per unit for certain NBI exchange-traded funds (‟NBI ETFs"").",CAD,NUSA.TO,CNW Group - National Bank Investments Announces June 2023 Cash Distributions for Its Exchange-Traded Funds
fin_news_nlp/yahoo_cad_tickers_news,https://ca.finance.yahoo.com/news/nuvei-stock-fire-good-buy-194500218.html,"Nuvei Corporation (TSX:NVEI) has lost a lot of momentum in recent weeks, which may present a fantastic buy-low opportunity. The post Nuvei Stock Is on Fire This Year: Is it a Good Buy Today? appeared first on The Motley Fool Canada.",CAD,NVEI.TO,The Motley Fool - Nuvei Stock Is on Fire This Year: Is it a Good Buy Today?
fin_news_nlp/yahoo_cad_tickers_news,https://ca.finance.yahoo.com/news/pan-american-silver-paas-gains-221520046.html,"Pan American Silver (PAAS) closed at $15.11 in the latest trading session, marking a +0.33% move from the prior day.",CAD,PAAS.TO,Zacks - Pan American Silver (PAAS) Gains But Lags Market: What You Should Know
fin_news_nlp/yahoo_cad_tickers_news,https://ca.finance.yahoo.com/news/petrus-resources-announces-credit-facility-210500239.html,"CALGARY, Alberta, June 21, 2023 (GLOBE NEWSWIRE) -- Petrus Resources Ltd. (""Petrus"" or the ""Company"") (TSX: PRQ) is pleased to announce an increase to its Senior Secured Credit Facility (“Credit Facility”). Petrus’ lender, ATB Financial, has completed their semi-annual borrowing base redetermination and have agreed to increase the borrowing limit from $30.0 million to $45.0 million. The Credit Facility is payable on demand by the lender and the next semi-annual review is scheduled on or before N",CAD,PRQ.TO,GlobeNewswire - Petrus Resources Announces Credit Facility Increase and Approval For Normal Course Issuer Bid
fin_news_nlp/yahoo_cad_tickers_news,https://ca.finance.yahoo.com/news/peyto-exploration-development-corp-confirms-210000746.html,"CALGARY, Alberta, June 15, 2023 (GLOBE NEWSWIRE) -- Peyto Exploration & Development Corp. (TSX: PEY) (""Peyto"") confirms that the monthly dividend with respect to June 2023 of $0.11 per common share is to be paid on July 14, 2023, for shareholders of record on June 30, 2023. Dividends paid by Peyto to Canadian residents are eligible dividends for Canadian income tax purposes. Shareholders and interested investors are encouraged to visit the Peyto website at www.peyto.com to learn more about what",CAD,PEY.TO,"GlobeNewswire - Peyto Exploration & Development Corp. Confirms Monthly Dividend for July 14, 2023"
fin_news_nlp/yahoo_cad_tickers_news,https://ca.finance.yahoo.com/news/quarterhill-announces-sale-wi-lan-210700845.html,"Quarterhill Inc. (TSX: QTRH) (""Quarterhill"" or the ""Company"") announced that today it has completed the sale of all of the shares of Wi-LAN Inc. (""WiLAN"") to an arm's length purchaser for gross proceeds of up to approximately $71.4 million subject to certain adjustments, including working capital adjustments. As part of the consideration, after this transaction Quarterhill will own 10% of WiLAN and Owlpoint IP Opportunities JVF LP, a joint venture between Arena Investors, LP (""Arena Investors"")",CAD,QTRH.TO,CNW Group - Quarterhill Announces the Sale of Wi-LAN Inc.
fin_news_nlp/yahoo_cad_tickers_news,https://ca.finance.yahoo.com/news/rbc-global-asset-management-inc-130500370.html,"RBC Global Asset Management Inc. (RBC GAM Inc.) today announced June 2023 cash distributions for unitholders of RBC ETFs, as follows:",CAD,RID.TO,CNW Group - RBC Global Asset Management Inc. announces RBC ETF cash distributions for June 2023
fin_news_nlp/yahoo_cad_tickers_news,https://ca.finance.yahoo.com/news/sandstorm-gold-sand-provides-asset-121800878.html,Sandstorm Gold (SAND) completes the sale of its Antamina copper mine and provides an update on various assets.,CAD,SSL.TO,Zacks - Sandstorm Gold (SAND) Provides an Update on Its Asset Portfolio
fin_news_nlp/yahoo_cad_tickers_news,https://ca.finance.yahoo.com/news/silvercrest-reports-results-2023-agm-110000936.html,"SilverCrest Metals Inc. (""SilverCrest"" or the ""Company"") is pleased to announce the results of its Annual General Meeting of Shareholders (""AGM"") held in Vancouver, BC, on June 15, 2023.",CAD,SIL.TO,CNW Group - SilverCrest Reports Results of 2023 AGM and Provides Technical Report Update
fin_news_nlp/yahoo_cad_tickers_news,https://ca.finance.yahoo.com/news/suncor-energy-su-gains-market-220020429.html,"Suncor Energy (SU) closed the most recent trading day at $29.63, moving +1.86% from the previous trading session.",CAD,SU.TO,Zacks - Suncor Energy (SU) Gains As Market Dips: What You Should Know
fin_news_nlp/yahoo_cad_tickers_news,https://ca.finance.yahoo.com/news/2-emerging-tsx-tech-stocks-171500379.html,Emerging TSX tech stocks such Sylogist have the potential to deliver outsized gains to shareholders in the next 12 months. The post 2 Emerging TSX Tech Stocks: Revolutionizing Industries appeared first on The Motley Fool Canada.,CAD,SYZ.TO,The Motley Fool - 2 Emerging TSX Tech Stocks: Revolutionizing Industries
fin_news_nlp/yahoo_cad_tickers_news,https://ca.finance.yahoo.com/news/td-asset-management-inc-announces-130000662.html,"TD Asset Management Inc. (""TDAM"") today announced the June cash distributions for the TD Exchange-Traded Funds (each, a ""TD ETF"" and collectively, the ""TD ETFs"") listed below. Unitholders of record as at June 29, 2023 will receive a cash distribution per unit of the applicable TD ETF that will be payable on July 10, 2023, as indicated below:",CAD,TGED.TO,CNW Group - TD Asset Management Inc. Announces TD ETF Distributions
fin_news_nlp/yahoo_cad_tickers_news,https://ca.finance.yahoo.com/news/toronto-dominion-bank-receives-regulatory-214000820.html,"The Toronto-Dominion Bank (TD) (TSX: TD) announced today that the Toronto Stock Exchange (TSX) and the Office of the Superintendent of Financial Institutions Canada (OSFI) have approved TD's previously announced normal course issuer bid. As previously announced, TD intends to launch a new normal course issuer bid to repurchase for cancellation up to 30 million of its common shares. The new normal course issuer bid will commence on June 26, 2023 and end on June 25, 2024, or such earlier date as T",CAD,TD.TO,CNW Group - The Toronto-Dominion Bank Receives Regulatory Approval for Normal Course Issuer Bid
fin_news_nlp/yahoo_cad_tickers_news,https://ca.finance.yahoo.com/news/treasury-metals-announces-amendment-extension-210000395.html,"Treasury Metals Inc. (TSX: TML) (OTCQX: TSRMF) (""Treasury"" or the ""Company"") is pleased to announce that the Company and its lender's agent, Extract Advisors LLC (""Extract""), have completed an amendment (the ""Amendment"") to the existing convertible term loan (the ""Loan""). The Amendment amended, among other terms, the maturity date of the Loan (extending it to June 30, 2026 from June 30, 2023) and both fixes and reduces the interest rate to 9.75% from a floating rate of LIBOR + 6.5%.",CAD,TML.TO,CNW Group - Treasury Metals Announces Amendment and Extension of Convertible Debenture
fin_news_nlp/yahoo_cad_tickers_news,https://ca.finance.yahoo.com/news/tricon-announces-voting-results-annual-210100366.html,"TORONTO, June 21, 2023--Tricon Residential Inc. (NYSE: TCN, TSX: TCN) (""Tricon"" or the ""Company"") , an owner and operator of single-family rental homes in the U.S. Sun Belt and multi-family rental apartments in Canada, is pleased to announce that it has received shareholder approval for all resolutions voted upon at its annual meeting of shareholders held virtually on June 21, 2023 (the ""Meeting""). In particular, all nominees listed in the Company’s information circular dated May 9, 2023 (the ""C",CAD,TCN.TO,Business Wire - Tricon Announces Voting Results from Annual Meeting of Shareholders
fin_news_nlp/yahoo_cad_tickers_news,https://ca.finance.yahoo.com/news/vanguard-announces-cash-distributions-vanguard-183200321.html,"(VUN and VUS)TORONTO, June 16, 2023 (GLOBE NEWSWIRE) -- Vanguard Investments Canada Inc. today announced the final June 2023 cash distributions for certain Vanguard ETFs, listed below, that trade on Toronto Stock Exchange (TSX). Unitholders of record on June 26, 2023 will receive cash distributions payable on July 04, 2023. Details of the “per unit” distribution amounts are as follows: Vanguard ETF®TSX Ticker SymbolDistribution per Unit ($)CUSIPISINPayment FrequencyVanguard U.S. Total Market Ind",CAD,VUS.TO,GlobeNewswire - Vanguard Announces Cash Distributions for the Vanguard ETFs
fin_news_nlp/yahoo_cad_tickers_news,https://ca.finance.yahoo.com/news/versabank-vbnk-upgraded-strong-buy-160005389.html,"VersaBank (VBNK) has been upgraded to a Zacks Rank #1 (Strong Buy), reflecting growing optimism about the company's earnings prospects. This might drive the stock higher in the near term.",CAD,VBNK.TO,Zacks - VersaBank (VBNK) Upgraded to Strong Buy: What Does It Mean for the Stock?
fin_news_nlp/yahoo_cad_tickers_news,https://ca.finance.yahoo.com/news/annual-general-special-meeting-agm-060000182.html,"Amaroq Minerals Ltd. (AIM, TSXV, NASDAQ First North: AMRQ), an independent mine development company with a substantial land package of gold and strategic mineral assets covering an area of 7,866.85 km2 in Southern Greenland, announces the results of voting at its AGM held on June 15, 2023.",CAD,AMRQ.V,ACCESSWIRE - Annual General and Special Meeting ('AGM') Results
fin_news_nlp/yahoo_cad_tickers_news,https://ca.finance.yahoo.com/news/avricore-health-hosts-2023-annual-223800039.html,"VANCOUVER, British Columbia, June 21, 2023 (GLOBE NEWSWIRE) -- AVRICORE HEALTH INC. (TSXV: AVCR) (the ""Company"" or “AVCR”) held its annual general meeting to elect directors, appoint its auditor and accept a new stock option plan to support the company’s continued growth. “It’s been another amazing year of significant growth and accomplishments and everyone on the team is really excited to get to our next milestones,” said Hector Bremner, CEO of Avricore Health Inc. “We are invigorated by the po",CAD,AVCR.V,GlobeNewswire - Avricore Health Hosts 2023 Annual General Meeting and Welcomes New Board Members
fin_news_nlp/yahoo_cad_tickers_news,https://ca.finance.yahoo.com/news/banyan-gold-announces-results-annual-100000333.html,"Banyan Gold Corp. (the ""Company"" or ""Banyan"") (TSXV:BYN) (OTCQB:BYAGF) announces that all resolutions set out in the management proxy circular for Banyan's 2023 annual general and special meeting of shareholders held on June 15, 2023 (the ""Meeting"") were passed.",CAD,BYN.V,ACCESSWIRE - Banyan Gold Announces Results from Annual General and Special Meeting of Shareholders
fin_news_nlp/yahoo_cad_tickers_news,https://ca.finance.yahoo.com/news/bgf-initiates-quebec-phosphate-progress-125700516.html,"Montreal, Quebec--(Newsfile Corp. - June 16, 2023) - Beauce Gold Fields (TSXV: BGF) (Champs D'Or en Beauce), (""BGF"" or the ""Company"") is pleased to announce it will use the Quebec Phosphate banner to promote and advance its 21 prospective phosphates (P2O5) properties throughout Quebec and for the evaluation of new technologies for phosphoric acid production. Phosphate is used in agriculture and is a critical component in producing lithium iron phosphate (LFP) batteries, which are ...",CAD,BGF.V,Newsfile - BGF Initiates Quebec Phosphate for the Progress of Its Phosphate Projects for LFP Batteries
fin_news_nlp/yahoo_cad_tickers_news,https://ca.finance.yahoo.com/news/big-ridge-announces-extension-expiry-210000705.html,"Toronto, Ontario--(Newsfile Corp. - June 15, 2023) - Big Ridge Gold Corp. (TSXV: BRAU) (OTCQB: ALVLF) (""Big Ridge"" or the ""Company"") announces that it has received conditional acceptance from the TSX Venture Exchange to extend the expiry date of 22,175,533 outstanding, unlisted common share purchase warrants (the ""Warrants"") originally issued on June 30, 2021. For further information concerning the original issuance of the Warrants, please refer to the press release of the Company ...",CAD,BRAU.V, - Big Ridge Announces Extension of Expiry Date for Warrants
fin_news_nlp/yahoo_cad_tickers_news,https://ca.finance.yahoo.com/news/blue-moon-announces-closing-strategic-225400926.html,"VANCOUVER, British Columbia, June 15, 2023 (GLOBE NEWSWIRE) -- Blue Moon Metals Inc. (TSXV: MOON; OTCQB: BMOOF) (the “Company”) announces it has closed a non-brokered private placement offering of common shares for proceeds of $500,240. The financing was priced at $0.065 per common share. The proceeds of the financing will be used for the Company’s Blue Moon project, including an updated mineral resource report and other work to advance and maintain the project. The proceeds will also be used fo",CAD,MOON.V,GlobeNewswire - Blue Moon Announces Closing of Strategic Financing
fin_news_nlp/yahoo_cad_tickers_news,https://ca.finance.yahoo.com/news/cblt-dividend-ciscom-shares-194800695.html,"Burlington, Ontario--(Newsfile Corp. - June 16, 2023) - At the request of its regulatory body, CBLT Inc. (TSXV: CBLT) (""CBLT"" or ""the Company"") is re-setting the declaration, record and payment dates for the dividend of its securities in investee Ciscom Corp. (""Ciscom"").The declaration date is June 16, 2023. The record date shall be June 23, 2023 after market close. The payment date shall be June 28, 2023.For every CBLT share held, each CBLT shareholder ...",CAD,CBLT.V,Newsfile - CBLT Dividend of Ciscom Shares
fin_news_nlp/yahoo_cad_tickers_news,https://ca.finance.yahoo.com/news/copper-fox-announces-2023-second-225500046.html,"Calgary, Alberta--(Newsfile Corp. - June 21, 2023) - Copper Fox Metals Inc. (TSXV: CUU) (OTCQX: CPFXF) (""Copper Fox"" or the ""Company"") is pleased to announce that its unaudited interim consolidated April 30, 2023, financial statements have been filed on SEDAR. For the six months ended April 30, 2023, Copper Fox had a net loss of $533,608 (April 30, 2022 - $612,002) which equated to $0.00 loss per share (April 30, 2022 - $0.00 loss ...",CAD,CUU.V,Newsfile - Copper Fox Announces 2023 Second Quarter Operating and Financial Results
fin_news_nlp/yahoo_cad_tickers_news,https://ca.finance.yahoo.com/news/diamcor-mining-engages-investor-cubed-165500584.html,"Diamcor Mining Ltd (the ""Company"" or ""Diamcor"")(TSXV:DMI)(OTCQB:DMIFF)(FRA:DC3A) is pleased to announce that it has engaged Investor Cubed Inc. (""Investor Cubed"") to provide additional investor relations and shareholder communications services in Canada for the Company.",CAD,DMI.V,ACCESSWIRE - Diamcor Mining Engages Investor Cubed (I3) for Additional Investor Relations and Shareholder Communications
fin_news_nlp/yahoo_cad_tickers_news,https://ca.finance.yahoo.com/news/dore-copper-mining-corp-announces-130000582.html,"Featuring Critical Metals Day on June 20, 2023 Toronto, Ontario--(Newsfile Corp. - June 16, 2023) - Doré Copper Mining Corp (TSXV: DCMC), a junior exploration company focused on copper and gold, is pleased to announce that it will be participating in THE Mining Investment Event of the North, June 19-21, 2023, (“THE Event”) at the Fairmont Chateau Frontenac and Voltigeurs de Quebec Armoury in Quebec City, Canada. Ernest Mast, President and CEO, ...",CAD,DCMC.V," - Dore Copper Mining Corp Announces Participation in THE Mining Investment Event of the North, Canada's First Tier I Mining Conference, June 19-21 Quebec City"
fin_news_nlp/yahoo_cad_tickers_news,https://ca.finance.yahoo.com/news/falcon-oil-gas-ltd-investor-095000536.html,"Falcon Oil & Gas Ltd.(“Falcon”) Investor Q&A 16 June 2023 – Falcon Oil & Gas Ltd. (TSXV: FO, AIM: FOG) is pleased to announce that Philip O’Quigley, Falcon’s CEO, will conduct a Q&A via the Investor Meet Company platform on 22 June 2023 at 4:30pm (London time) following the Annual General and Special Shareholder meeting that will be held in the Conrad Hotel, Earlsfort Terrace, Dublin 2, Ireland on 22 June 2023 at 11:00am (London time). The event is open to all existing and potential shareholders",CAD,FO.V,GlobeNewswire - Falcon Oil & Gas Ltd. - Investor Q&A
fin_news_nlp/yahoo_cad_tickers_news,https://ca.finance.yahoo.com/news/genius-metals-inc-announces-private-173600224.html,"Genius Metals Inc. (TSXV: GENI) (""Genius Metals"" or the ""Corporation"") announces its intention to complete a non-brokered private placement offering (the ""Private Placement"") for gross proceeds of $1 million.",CAD,GENI.V,CNW Group - Genius Metals Inc. Announces Private Placement Offering of Common Share Units
fin_news_nlp/yahoo_cad_tickers_news,https://ca.finance.yahoo.com/news/good-natured-products-inc-issues-000400203.html,"Vancouver, British Columbia--(Newsfile Corp. - June 21, 2023) - good natured Products Inc. (TSXV: GDNP) (OTCQX: GDNPF) (the ""Company"" or ""good natured®""), a North American leader in plant-based products, made an announcement on June 5, 2023 regarding the appointment of Tami Kozikowski to the good natured® board of directors and as Chair of the Audit Committee. The Company indicated that Ms. Kozikowski holds an active Chartered Professional Accountant (""CPA"") designation. Ms. Kozikowski began her",CAD,GDNP.V,"Newsfile - Good Natured Products Inc. Issues Clarification to June 5, 2023 Press Release"
fin_news_nlp/yahoo_cad_tickers_news,https://ca.finance.yahoo.com/news/ivrnet-inc-announces-amendment-term-060000785.html,"IVRNET INC. (""IVRNET"" or the ""Company"") (TSXV:IVI), announces that the Company and R.C. Morris & Company Special Opportunities Fund III Limited Partnership (""RCM""), the lender of the Company's term loan and credit facility (the ""Loan""), have agreed to further amend the Loan to extend the expiry date from June 15, 2023, as previously announced on May 16, 2023, to the earlier of October 31, 2023 or as demanded by RCM.",CAD,IVI.V,ACCESSWIRE - Ivrnet Inc. Announces Amendment to Term Loan and Credit Facility
fin_news_nlp/yahoo_cad_tickers_news,https://ca.finance.yahoo.com/news/jack-nathan-health-announces-convertible-222300068.html,"TORONTO, June 15, 2023--Jack Nathan Medical Corp. (TSXV: JNH, OTCQB: JNHMF) (""Jack Nathan Health"", ""JNH"" or the ""Company"") is pleased to announce the signing of a secured convertible debenture (the ""Debenture"") in the principal amount of C$8,000,000 (the ""Transaction"") with Wal-Mart Canada Corp. (""Wal-Mart"").",CAD,JNH.V,Business Wire - Jack Nathan Health Announces Convertible Debenture Financing with Wal-Mart
