source,url,description,country,company,title
fin_news_nlp/yahoo_cad_tickers_news,https://ca.finance.yahoo.com/news/goliath-resources-signs-mou-five-121500204.html,"Figure 1 Location of Kitsault, Goliath Resources, Dolly Varden, Blackwolf Copper and Gold and Coast Copper projects. Figure 2 Figure 2 TORONTO, March 21, 2023 (GLOBE NEWSWIRE) -- Goliath Resources Limited (TSX-V: GOT) (OTCQB: GOTRF) (Frankfurt: B4IF) (the “Company” or “Goliath”) is pleased to announce that it has signed a Memorandum of Understanding (“MOU”) with BWCG Holding Ltd. (Formerly Blackwolf Copper and Gold Inc.), Blackwolf Copper and Gold (TSXV: BWCG, OTC: BWCGF), Coast Copper Corp. (TS",CAD,BWCG.V,"GlobeNewswire - Goliath Resources Signs MOU With Five Other Companies to Study the Viability of Hub and Spoke Mill Complex at a Permitted Site at Kitsault, B.C."
fin_news_nlp/yahoo_cad_tickers_news,https://ca.finance.yahoo.com/news/blackwolf-signs-mou-two-additional-121500541.html,"Blackwolf Copper and Gold (""Blackwolf"", or the ""Company"") (TSXV:BWCG)(OTC PINK:BWCGF) is pleased to announce that it has signed an updated Memorandum of Understanding (""MOU"") with Goliath Resources Limited (TSXV: GOT, OTCQB: GOTRF, Frankfurt: B41F) and Coast Copper Corp. (TSX-V: COCO), joining Dolly Varden Silver Corp. (TSXV: DV, OTC: DOLLF), and New Moly LLC (collectively, the ""Companies""), to jointly study the viability of using New Moly's Kitsault",CAD,BWCG.V,"ACCESSWIRE - Blackwolf Signs MOU with two Additional Companies to Study Viability of Hub and Spoke Mill Complex at a Permitted Site at Kitsault, BC"
fin_news_nlp/yahoo_cad_tickers_news,https://ca.finance.yahoo.com/news/c-com-reports-fiscal-2022-120000256.html,"Ottawa, Ontario--(Newsfile Corp. - March 21, 2023) - C-COM Satellite Systems Inc., (TSXV: CMI) (OTCQB: CYSNF) a leading global provider of commercial grade mobile auto-deploying satellite antenna systems, announced today its financial results for its fiscal year ended November 30, 2022.The Company generated revenues of $11,646,934, up 27% compared to 2021's revenues of $9,151,986. Net income was $1,139,655 (3 cents per share) in fiscal 2022, down 20% from 2021's profit due to reduced gross ...",CAD,CMI.V,Newsfile - C-COM Reports Fiscal Year 2022 Results
fin_news_nlp/yahoo_cad_tickers_news,https://ca.finance.yahoo.com/news/cabral-gold-announces-closing-oversubscribed-113000680.html,"Vancouver, British Columbia--(Newsfile Corp. - March 21, 2023) - Cabral Gold Inc. (TSXV: CBR) (OTC Pink: CBGZF) (""Cabral"" or the ""Company"") is pleased to announce the closing of its previously announced non-brokered private placement (the ""Private Placement""). The Private Placement was oversubscribed by $790,000 for gross proceeds of $2,790,000. As a result, the Company issued a total of 27,900,000 units (the ""Units"") at a price of $0.10 per unit.Each Unit consists of one common ...",CAD,CBR.V,Newsfile - Cabral Gold Announces Closing of Oversubscribed Private Placement
fin_news_nlp/yahoo_cad_tickers_news,https://ca.finance.yahoo.com/news/coast-copper-signs-mou-five-121500898.html,"Coast Copper Corp. (""Coast Copper"" or the ""Company"") (TSXV: COCO) is pleased to announce that it has signed a Memorandum of Understanding (""MOU"") with BWCG Holdings Ltd., Blackwolf Copper & Gold Ltd. (TSXV: BWCG), Dolly Varden Silver Corp. (TSXV: DV) (OTC: DOLLF), New Moly LLC. and Goliath Resources Ltd. (TSXV: GOT) (OTCQB: GOTRF) (Frankfurt: B41F) (collectively, the ""Companies""), to jointly study the viability of using New Moly LLC's Kitsault project (""Kitsault"" or the ""Project"") as the potenti",CAD,COCO.V,"CNW Group - Coast Copper Signs MOU with five other Companies to Study Viability of Hub and Spoke Mill Complex at a Permitted Site at Kitsault, BC"
fin_news_nlp/yahoo_cad_tickers_news,https://ca.finance.yahoo.com/news/drone-delivery-canada-corp-releases-110000678.html,"Drone Delivery Canada Corp. (TSXV: FLT) (OTC QX: TAKOF) (Frankfurt: A3DP5Y) (Frankfurt: ABBA.F) (the ""Company"" or ""DDC"") is pleased to announce its 2022 financial results, and to provide a general corporate update.",CAD,FLT.V,CNW Group - DRONE DELIVERY CANADA CORP. RELEASES 2022 FINANCIAL RESULTS AND PROVIDES GENERAL CORPORATE UPDATE
fin_news_nlp/yahoo_cad_tickers_news,https://ca.finance.yahoo.com/news/edgeti-adds-generative-ai-growing-112300573.html,"Unique Integration of ChatGPT Across Enterprise Solutions Improves User Interaction and Accelerates Business PerformanceARLINGTON, Va., March 21, 2023 (GLOBE NEWSWIRE) -- Edge Total Intelligence Inc. (“edgeTI”, “We”, or “Our”) (TSXV: CTRL, OTCQB: UNFYF, FSE: Q5i), the leader in real-time operations software, is pleased to announce the integration of ChatGPT with its edgeCore™ platform which in turn accelerates the use of Generative AI solutions in enterprise applications. The first among many ge",CAD,CTRL.V,GlobeNewswire - edgeTI Adds Generative AI to its Growing List of AI-Powered Solutions
fin_news_nlp/yahoo_cad_tickers_news,https://ca.finance.yahoo.com/news/everyday-people-financial-signs-share-113000495.html,"Acquisition will bolster Everyday People's revenue cycle management services Edmonton, Alberta--(Newsfile Corp. - March 21, 2023) - Everyday People Financial Corp. (TSXV: EPF) (""Everyday People"" or the ""Company""), a Canadian-based financial services company, is pleased to announce that its wholly-owned subsidiary, General Credit Services Inc. (""General Credit""), has entered, on March 20, 2023, into a share purchase agreement (the ""Purchase Agreement"") with the shareholders (the ""Shareholders"") o",CAD,EPF.V,Newsfile - Everyday People Financial Signs Share Purchase Agreement to Acquire Groupe Solution and Secures C$5.3 Million in Debt Financing from a Leading Canadian Bank
fin_news_nlp/yahoo_cad_tickers_news,https://ca.finance.yahoo.com/news/fobi-ai-granted-usa-patent-120000331.html,"Patent claims granted include crypto processing methods, digital receipt storage, and universal loyalty rewards programs.VANCOUVER, BC, March 21, 2023 (GLOBE NEWSWIRE) -- Fobi AI Inc. (FOBI:TSXV) (FOBIF:OTCQB) (the ""Company"" or ""Fobi""), an industry leader in harnessing AI and data intelligence to enable digital transformation, is pleased to announce that the company has been granted a USA patent for its IoT hardware. Rob Anson, CEO of Fobi, states: “We have developed extremely valuable tech and",CAD,FOBI.V,GlobeNewswire - Fobi AI Granted USA Patent for Its IoT Hardware
fin_news_nlp/yahoo_cad_tickers_news,https://ca.finance.yahoo.com/news/jourdan-intersects-0-82-li2o-120000201.html,"Mineralization Remains Open along Strike, Down-Dip and to the South Figure 1 The Vallée property is immediately east of the North American Lithium mine. This figure depicts the 2011, 2021 and 2022 completed drillholes with a total of 79 drillholes since 2011. Figure 2 The location of the Vallée property and recent Jourdan drill holes relative to Sayona’s North American Lithium mine near Amos, Quebec. TORONTO, March 21, 2023 (GLOBE NEWSWIRE) -- JOURDAN RESOURCES INC. (TSXV: JOR; OTCQB: JORFF; FRA",CAD,JOR.V,GlobeNewswire - Jourdan Intersects 0.82% Li2O over 8 m at Vallée
fin_news_nlp/yahoo_cad_tickers_news,https://ca.finance.yahoo.com/news/macdonald-mines-receives-5-5-120000210.html,"Demonstrates Additional Cu-Au Mineralisation along the McLaren Lake Fault Zone Figure 1 Location of Ashigami Cu-Au-Co occurrence relative to the historic Alwyn Mine and 2022 drilling. TORONTO, March 21, 2023 (GLOBE NEWSWIRE) -- MacDonald Mines Exploration Ltd. (TSX-V: BMK, OTC: MCDMF) (“MacDonald Mines” or the “Company”) is pleased to report new surface exploration results from the Ashigami Cu-Au occurrence (“Ashigami”), 4.5 Km SE of the historic Alwyn Mine (“Alwyn”), both located along/adjacent",CAD,BMK.V,GlobeNewswire - MacDonald Mines Receives up to 5.5 % Cu and 6.45 g/t Au in Surface Grab Samples from the Ashigami Cu-Au-Co showings
fin_news_nlp/yahoo_cad_tickers_news,https://ca.finance.yahoo.com/news/marvel-commences-final-study-required-130000038.html,"Calgary, Alberta--(Newsfile Corp. - March 21, 2023) - Marvel Biosciences Corp. (TSXV: MRVL) and its wholly owned subsidiary, Marvel Biotechnology Inc. (collectively the ""Company"" or ""Marvel""), is pleased to announce that it has initiated the 4-week good laboratory practice (GLP) FDA investigational new drug (IND) enabling dose-ranging dog studies for its lead drug candidate MB-204.""This dog study is the last of the two key primary animal studies we need to complete before entering phase ...",CAD,MRVL.V,Newsfile - Marvel Commences Final Study Required Prior to Initiating Human Trials
fin_news_nlp/yahoo_cad_tickers_news,https://ca.finance.yahoo.com/news/midland-begins-major-exploration-program-113000984.html,"Figure 1 Midland BHP Nunavik Alliance Ni-Cu-Co MONTREAL, March 21, 2023 (GLOBE NEWSWIRE) -- Midland Exploration Inc. (“Midland”) (TSX-V: MD) is pleased to announce the commencement of a major exploration program for nickel in Nunavik, following up on exploration work carried out from 2020 to 2022 during which new Ni-Cu-Co mineral occurrences were discovered. This new program totalling C$3,400,000 will be conducted under the strategic alliance (the “Alliance”) executed in August 2020 between Midl",CAD,MD.V,"GlobeNewswire - Midland Begins a Major Exploration Program for Nickel in Nunavik, Quebec Under Its Strategic Alliance With BHP"
fin_news_nlp/yahoo_cad_tickers_news,https://ca.finance.yahoo.com/news/millrock-announces-effective-date-name-123000956.html,"VANCOUVER, British Columbia, March 21, 2023 (GLOBE NEWSWIRE) -- Millrock Resources Inc. (TSX-V: MRO, OTCQB: MLRKF) (“Millrock” or the “Company”) is pleased to announce that it has received approval from the TSX Venture Exchange to change the Company’s name to “Alaska Energy Metals Corporation” (the “Name Change”) and to consolidate the Company’s outstanding common shares on the basis of one new common share for every ten common shares (the “Consolidation”). The Name Change and Consolidation will",CAD,MRO.V,GlobeNewswire - Millrock Announces Effective Date of Name Change to Alaska Energy Metals Corporation
fin_news_nlp/yahoo_cad_tickers_news,https://ca.finance.yahoo.com/news/pelham-investment-partners-lp-announces-120000292.html,"Pelham Investment Partners LP (""Pelham LP""), a value-oriented long-term investor in Nickel 28 Capital Corp. (formerly Conic Metals Corp.) (TSXV: NKL) (""Nickel 28"" or the ""Company""), today announced an offer to acquire up to 10,000,000 common shares in the capital of the Company (the ""Tender Offer""), at a price of $1.20 per common share, payable in cash (the ""Tender Price""). The Tender Price represents a significant premium of approximately 22% to the closing price of the Company's common shares",CAD,NKL.V,CNW Group - Pelham Investment Partners LP Announces Premium All-Cash Tender Offer to Acquire Common Shares of Nickel 28 Capital Corp. and Addresses Misleading Statements by Management
fin_news_nlp/yahoo_cad_tickers_news,https://ca.finance.yahoo.com/news/parkit-announces-normal-course-issuer-114600517.html,"Toronto, Ontario--(Newsfile Corp. - March 21, 2023) - Parkit Enterprise Inc. (TSXV: PKT) (""Parkit"" or the ""Corporation"") is pleased to announce that it has received conditional acceptance from the TSX Venture Exchange to renew its Normal Course Issuer Bid (""NCIB"") to purchase for cancellation, during the 12-month period starting March 24, 2023, up to ‎11,692,258‎ of the outstanding common shares of the Corporation (the ""Common Shares""), representing 5% of the Common Shares outstanding. The progr",CAD,PKT.V, - Parkit Announces Normal Course Issuer Bid
fin_news_nlp/yahoo_cad_tickers_news,https://ca.finance.yahoo.com/news/spirulina-highly-digestible-alternative-protein-120000706.html,"Pond Technologies Holdings Inc. (""Pond"") (TSX.V:POND)(OTCQB:PNDHF(FSE:4O0), an ESG company, is working on producing spirulina and other algae-based animal feed ingredients using CO2 emissions to address global sustainability challenges of protein shortages and climate change, offering sustainable options for animal feed, including aquaculture.",CAD,POND.V,ACCESSWIRE - Spirulina: a Highly Digestible Alternative Protein and Essential Amino Acid Source for Salmon Feeds
fin_news_nlp/yahoo_cad_tickers_news,https://ca.finance.yahoo.com/news/app-science-releases-2023-u-113000036.html,"Sabio Holdings Inc. (TSXV: SBIO)(OTCQX: SABOF) (the ""Company"" or ""Sabio""), a leading provider of connected TV (""CTV"")/over-the-top (""OTT"") advertising platforms validated by performance, today announced that its wholly-owned App Science™ (""App Science"") business has released its 2023 U.S. Audience Trends Report: Life of a Streamer.",CAD,SBIO.V,"CNW Group - App Science releases 2023 U.S Audience Trends Report Highlighting Diverse Audiences and CTV, Mobile Interests"
fin_news_nlp/yahoo_cad_tickers_news,https://ca.finance.yahoo.com/news/superbuzz-enters-distribution-agreement-appsumo-131200857.html,"Toronto, Ontario--(Newsfile Corp. - March 21, 2023) - SuperBuzz Inc. (TSXV: SPZ) (""SuperBuzz"" or the ""Company""), one of a select few GPT-oriented companies currently listed on the TSX Venture Exchange, has announced the entering of a new partnership with AppSumo on March 7, 2023, and integration with Shopify.SuperBuzz and AppSumo Partnership DetailsAs a leading software community for everyday entrepreneurs, AppSumo is known for its wide selection of software offerings, and SuperBuzz is honored t",CAD,SPZ.V,Newsfile - SuperBuzz Enters New Distribution Agreement with AppSumo and Announces Integration with Shopify
fin_news_nlp/yahoo_cad_tickers_news,https://ca.finance.yahoo.com/news/ibn-announces-latest-episode-bell2bell-121700289.html,"LOS ANGELES, March 21, 2023 (GLOBE NEWSWIRE) -- via InvestorWire – IBN, a multifaceted communications organization engaged in connecting public companies to the investment community, is pleased to announce the release of the latest episode of The Bell2Bell Podcast as part of its sustained effort to provide specialized content distribution via widespread syndication channels. The Bell2Bell Podcast delivers informative updates and exclusive interviews with executives operating in fast-moving indus",CAD,UCU.V,"GlobeNewswire - IBN Announces Latest Episode of The Bell2Bell Podcast featuring Pat Ryan, Chairman and CEO of Ucore Rare Metals Inc."
fin_news_nlp/yahoo_cad_tickers_news,https://ca.finance.yahoo.com/news/universal-copper-announces-non-brokered-113000674.html,"/ Universal Copper Ltd. (""Universal Copper"" or the ""Company"") (TSX Venture:UNV)(Frankfurt:3TA2) Considering current market conditions, the Company has terminated the non-brokered private placement of shares at a price of $0.035 per share (announced January 25, 2023) and announces a new private placement of up to 48,000,000 units of the Company (the ""Units"") at a price per Unit of CDN $0.025, for gross proceeds of up to $1,200,000 (the ""Private Placement"").",CAD,UNV.V,ACCESSWIRE - Universal Copper Announces New Non-brokered Private Placement of Units
fin_news_nlp/yahoo_cad_tickers_news,https://ca.finance.yahoo.com/news/vizsla-copper-identifies-targets-high-120000417.html,"Vizsla Copper Corp. (TSXV: VCU) (OTQB: VCUFF) (""Vizsla Copper"" or the ""Company"") is pleased to report results from an interpretation of a high-definition aeromagnetic geophysical survey recently completed at the Deerhorn copper-gold deposit on the Company's 65,252 ha Woodjam Copper Project (""Woodjam""). Woodjam is prospective for copper-gold porphyry style mineralization and is located 55 km east of Williams Lake, BC (Figure 1).",CAD,VCU.V,CNW Group - VIZSLA COPPER IDENTIFIES NEW TARGETS AT THE HIGH-GRADE DEERHORN COPPER-GOLD PORPHYRY DEPOSIT AT THE WOODJAM PROJECT
fin_news_nlp/yahoo_cad_tickers_news,https://ca.finance.yahoo.com/news/acme-lithium-expands-lithium-project-113000906.html,"Carson City, Nevada--(Newsfile Corp. - March 21, 2023) - ACME Lithium Inc. (CSE: ACME) (OTCQX: ACLHF) (the ""Company"", or ""ACME"") is pleased to report that the Company has acquired by staking 63 new claims (""FLV 3 Claims"") encompassing approximately 1295 acres contiguous to the south and east of the Company's FLV Project located in Fish Lake Valley, Esmeralda County Nevada. With the additional ground, ACME's total number of claims in the area have ...",CAD,ACME.CN,"Newsfile - ACME Lithium Expands Lithium Project at Fish Lake Valley, Nevada, Securing Key Land Position"
fin_news_nlp/yahoo_cad_tickers_news,https://ca.finance.yahoo.com/news/beyond-oil-ships-first-commercial-114500980.html,"/ Beyond Oil Ltd. (CSE:BOIL) (""Beyond Oil"" or the ""Company""), a food-tech innovation company extending the life of frying oil, reducing costs and waste, is pleased to announce that it has sent the first commercial shipment of its product from its headquarters and factory located in Israel.",CAD,BOIL.CN,ACCESSWIRE - Beyond Oil Ships First Commercial Shipment of Product to North American Distributor TEJA Food Group
fin_news_nlp/yahoo_cad_tickers_news,https://ca.finance.yahoo.com/news/brascan-reports-critical-minerals-discovery-123000732.html,"Vancouver, British Columbia--(Newsfile Corp. - March 21, 2023) - Brascan Gold Inc. (CSE: BRAS) (""Brascan"" or the ""Company"") is pleased to announce completion of an exploration program on the Iceberg Vanadium, Titanium and Magnetite Project (the ""Project"" or the ""Property"") in Newfoundland, Canada. The program included extensive prospecting, drone work, site selection and shallow backpack drilling. Brascan holds an indirect 25% interest in the Project through its 25% ownership interest in North A",CAD,BRAS.CN,Newsfile - Brascan Reports on New Critical Minerals Discovery in Newfoundland and Announces Private Placement
fin_news_nlp/yahoo_cad_tickers_news,https://ca.finance.yahoo.com/news/cerro-pasco-resources-signs-agreements-120800518.html,"Cerro De Pasco Resources Inc. (""CDPR"" or the ""Company"") (CSE: CDPR) (OTCMKTS: GPPRF) is pleased to announce that it has signed a Memorandum of Understanding (""MOU"") with Volcan Compania Minera S.A.A. (""Volcan""), setting out shared objectives and a framework for collaboration with regards to first phase of development and exploration of CDPR's Quiulacocha Tailings Project (""QT Project"").",CAD,CDPR.CN,CNW Group - CERRO DE PASCO RESOURCES SIGNS AGREEMENTS WITH VOLCAN AND GLENCORE TO SECURE DEVELOPMENT OF QUIULACOCHA TAILINGS
fin_news_nlp/yahoo_cad_tickers_news,https://ca.finance.yahoo.com/news/city-view-green-announces-second-120700073.html,"Toronto, Ontario--(Newsfile Corp. - March 21, 2023) - City View Green Holdings Inc. (CSE: CVGR) (OTCQB: CVGRF) (""City View"" or the ""Company""), an innovative Canadian-based cannabis-infused edibles manufacturing company, announces that further to its February 17, 2023, news release, it has now completed the second and final tranche (the ""Second Tranche"") of its non-brokered private placement (the ""Offering""). Under the Second Tranche, the Company has issued 3,166,667 common shares for gross proce",CAD,CVGR.CN,Newsfile - City View Green Announces Second and Final Tranche Closing of its Non-Brokered Private Placement
fin_news_nlp/yahoo_cad_tickers_news,https://ca.finance.yahoo.com/news/enertopia-corporation-powering-future-lithium-130000533.html,"Vancouver, British Columbia--(Newsfile Corp. - March 21, 2023) - Enertopia Corporation (CSE: ENRT) (OTCQB: ENRT) - Enertopia's West Tonopah Lithium project yields promising results for potential open pit mining scenario. With three prototypes and four pending patents, Enertopia is poised to make an impact in the lithium and clean tech markets. Sales for the battery management system are expected in Q2. Listen to CEO & President, Robert McAllister talk about it.If you cannot view ...",CAD,ENRT.CN," - Enertopia Corporation: Powering the Future with Lithium, CEO Clips Video"
fin_news_nlp/yahoo_cad_tickers_news,https://ca.finance.yahoo.com/news/gamelancer-media-surpasses-38-million-123000372.html,"Gamelancer Media Corp. (CSE:GMNG)(OTCQB:GAMGF)(FRA:P93) (""Gamelancer"" or the ""Company"") a leading media-production and entertainment company that creates curated video content for brands, is pleased to announce that its owned and operated 44 channel network spanning TikTok, Snapchat, and Instagram, has surpassed 38 million followers and continues to experience meteoric growth at a rate of over 1.5 million new followers every month.",CAD,GMNG.CN,"ACCESSWIRE - Gamelancer Media Surpasses 38 Million followers, a 42% YoY Increase"
fin_news_nlp/yahoo_cad_tickers_news,https://ca.finance.yahoo.com/news/high-fusion-files-management-information-120000755.html,"Neural Therapeutics Launches Concurrent Financing Toronto, Ontario--(Newsfile Corp. - March 21, 2023) - High Fusion Inc. (CSE: FUZN) (OTC Pink: SPLIF) (""High Fusion"") is pleased to announce that it has filed on www.sedar.com its management information circular (the ""Circular"") and related materials in connection with the annual and special meeting (the ""Meeting"") of High Fusion shareholders (the ""High Fusion Shareholders"") to be held at 10:00 a.m. (Eastern Time) on May 1, 2023 at High Fusion's .",CAD,FUZN.CN,Newsfile - High Fusion Files Management Information Circular for Proposed Arrangement with Neural Therapeutics
fin_news_nlp/yahoo_cad_tickers_news,https://ca.finance.yahoo.com/news/leaf-ventures-announces-genetics-supply-130000582.html,"VANCOUVER, British Columbia, March 21, 2023 (GLOBE NEWSWIRE) -- New Leaf Ventures Inc. (CSE: NLV) (OTC: NLVVF) (“New Leaf,” “NLV” or the “Company”), a management and investment organization dedicated to evaluating, investing, and accelerating advanced stage operations in the North American Cannabis sector, is pleased to announce that, it’s wholly-owned subsidiary High Profile Holdings Cannabis Corp. (“High Profile” or “Supplier”) has executed a genetics transfer and buyback agreement with CannaP",CAD,NLV.CN,GlobeNewswire - New Leaf Ventures Announces Genetics Supply Agreement
fin_news_nlp/yahoo_cad_tickers_news,https://ca.finance.yahoo.com/news/pampa-metals-launches-non-brokered-123000299.html,"Pampa Metals Corp.(""Pampa Metals"" or the ""Company"") (CSE:PM)(FSE:FIRA)(OTCQB:PMMCF) is pleased to launch a non-brokered private placement offering (the ""Offering"") of up to 5,333,334 units (""Units"") at a price of $0.15 per Unit for gross proceeds of up to $800,000. Proceeds will be used to support the previously announced ~2,100m diamond drill program of 3 deep holes at the Buenavista target and the Block 4 Project more broadly.",CAD,PM.CN,ACCESSWIRE - Pampa Metals Launches Non-Brokered Private Placement
fin_news_nlp/yahoo_cad_tickers_news,https://ca.finance.yahoo.com/news/planet-based-foods-confirms-expansion-113000873.html,"Planet Based Foods Global Inc. (CSE: PBF) (OTCQB: PBFFF) (FRA: AZ0) (""PBFG,"" ""Planet Based Foods"" or the ""Company"") is pleased to announce that the Company will commence distribution in the West and Midwest. Planet Based Foods will now be available to customers in Smith's and Mariano's.",CAD,PBF.CN,CNW Group - Planet Based Foods Confirms Expansion across U.S.
fin_news_nlp/yahoo_cad_tickers_news,https://ca.finance.yahoo.com/news/posabit-expects-fy-2023-revenue-125700814.html,"TORONTO & SEATTLE, March 21, 2023--POSaBIT Systems Corporation (CSE: PBIT, OTC: POSAF) (the ""Company"" or ""POSaBIT""), a premier point-of-sale and payments provider for the cannabis industry, today provided financial guidance for 2023.",CAD,PBIT.CN,"Business Wire - POSaBIT Expects FY 2023 Revenue of $60 to $63 Million, Gross Profit of $15 to $17 Million and to Resume Profitability on an Adjusted EBITDA Basis"
fin_news_nlp/yahoo_cad_tickers_news,https://ca.finance.yahoo.com/news/psyched-wellness-pleased-announce-calm-112900710.html,"Toronto, Ontario--(Newsfile Corp. - March 21, 2023) - Psyched Wellness Ltd. (CSE: PSYC) (OTCQB: PSYCF) (FSE: 5U9) (the ""Company"" or ""Psyched""), a life sciences company focused on the production and distribution of health and wellness products derived from the Amanita Muscaria mushroom, is excited to announce they have successfully delivered their first shipment of Calm to TruLife Distribution. 2722 units of Calm have been delivered and will be utilized for pipeline fills within health ...",CAD,PSYC.CN,Newsfile - Psyched Wellness Is Pleased to Announce That Calm Has Shipped to National Sales and Distribution Partner TruLife Distribution
fin_news_nlp/yahoo_cad_tickers_news,https://ca.finance.yahoo.com/news/red-light-holland-looking-forward-123300363.html,"Brad J Lamb, Red Light Holland's Chairman of the Board will Chair the AGSM, which takes place at 11 am EST on March 23, 2023CEO Todd Shapiro, CTIO Sarah Hashkes and CFO David Ascott of Red Light Holland will conduct a live Q&A immediately after the AGSMThe AGSM will take place in person at the offices of the Company located at 1 Adelaide Street East, Suite 801, Toronto, Ontario, M5C 2V9 The AGSM can ...",CAD,TRIP.CN,"Newsfile - Red Light Holland Looking Forward to AGSM, Including Corporate Update from Chairman Brad J Lamb and a Live Q&A With CEO Todd Shapiro on March 23rd at 11 AM"
