source,url,description,country,company,title
fin_news_nlp/yahoo_cad_tickers_news,https://ca.finance.yahoo.com/news/silver-elephant-prepares-12-hole-123100681.html,"Vancouver, British Columbia--(Newsfile Corp. - February 14, 2023) - Silver Elephant Mining Corp. (TSX: ELEF) (OTCQX: SILEF) (FSE: 1P2) (""Silver Elephant"" or ""the Company"") announces t is preparing a drilling program at the Paca silver oxide open-pit deposit, which is part of the Company's 100%-controlled Pulacayo silver-lead-zinc project in Bolivia.This drill program is a follow-up to the successful 2022 drill program (see March 29, 2022 news release) highlighted by PND 123 which was collared at",CAD,ELEF.TO,Newsfile - Silver Elephant Prepares 12-Hole Drill Program at Paca Silver Project in Bolivia
fin_news_nlp/yahoo_cad_tickers_news,https://ca.finance.yahoo.com/news/qcells-invests-2-5-billion-114500535.html,"The large-scale initiative will quadruple the company’s solar module production capacityEDMONTON, Alberta, Feb. 14, 2023 (GLOBE NEWSWIRE) -- TSX, NYSE: STN With a historic $2.5 billion investment, Qcells is building a solar power manufacturing facility in Georgia, United States. This is the largest solar investment in US history and will offer significant benefits to the state and national economies. Gray, a leading global builder in the manufacturing industry, and Stantec, a global leader in su",CAD,STN.TO,GlobeNewswire - Qcells invests $2.5 billion in solar power manufacturing facility from the Gray/Stantec design-build team
fin_news_nlp/yahoo_cad_tickers_news,https://ca.finance.yahoo.com/news/step-energy-services-ltd-tse-125729396.html,"STEP Energy Services (TSE:STEP) has had a rough three months with its share price down 23%. However, the company's...",CAD,STEP.TO,Simply Wall St. - STEP Energy Services Ltd.'s (TSE:STEP) Fundamentals Look Pretty Strong: Could The Market Be Wrong About The Stock?
fin_news_nlp/yahoo_cad_tickers_news,https://ca.finance.yahoo.com/news/tantalus-report-fourth-quarter-end-120000390.html,"Burnaby, British Columbia--(Newsfile Corp. - February 14, 2023) - Tantalus Systems (TSX: GRID) (""Tantalus"" or the ""Company""), a smart grid technology company focused on helping build sustainable utilities for the future, is pleased to announce that the Company will release its fourth quarter and year end 2022 audited financial results on Tuesday, March 14, 2023 after the market closes. The Company will hold a conference call and webcast to discuss the financial results on ...",CAD,GRID.TO,"Newsfile - Tantalus to Report Fourth Quarter & Year End 2022 Audited Financial Results on March 14, 2023"
fin_news_nlp/yahoo_cad_tickers_news,https://ca.finance.yahoo.com/news/tc-energy-files-2022-annual-125200757.html,"CALGARY, Alberta, Feb. 14, 2023 (GLOBE NEWSWIRE) -- TC Energy Corporation (TSX, NYSE: TRP) (TC Energy or the Company) has today filed with Canadian securities authorities: Audited Consolidated Financial Statements for the year ended Dec. 31, 2022 with related Management’s Discussion and Analysis (Annual Report); and The Company’s Annual Information Form for the year ended Dec. 31, 2022. In addition, TC Energy filed its Form 40-F for the year ended Dec. 31, 2022 with the United States Securities",CAD,TRP.TO,GlobeNewswire - TC Energy files 2022 annual disclosure documents
fin_news_nlp/yahoo_cad_tickers_news,https://ca.finance.yahoo.com/news/tc-energy-increases-dividend-reports-121552654.html,"CALGARY — TC Energy Corp. raised its dividend as it reported a nearly $1.45-billion loss in its fourth quarter due to rising cost of its Coastal GasLink project. The company says it will now pay a quarterly dividend of 93 cents per share, up from 90 cents per share. The increased payment to shareholders came as TC Energy says it lost $1.42 per share for the quarter ended Dec. 31 compared with a profit of nearly $1.12 billion or $1.14 per share a year earlier. The most recent quarter included a o",CAD,TRP.TO," - TC Energy increases dividend, reports Q4 loss due to rising costs of Coastal GasLink"
fin_news_nlp/yahoo_cad_tickers_news,https://ca.finance.yahoo.com/news/breckenridge-distillery-strikes-gold-2023-120000976.html,"The World's Highest Distillery Earns Three Top Prizes for This Year's World Whiskies Awards for Best American Blended Malt, Best American Blended Limited Release, and Best American Blended The 2023 World Whiskies Awards awarded to Breckenridge Two Clans, Collectors Art Series #2 and Breckenridge High Proof Breckenridge Distillery Whiskeys Earn Three Top Prizes for Best American Blended Malt, Best American Blended Limited Release, and Best American Blended Gold Awarded to Breckenridge Two Clans,",CAD,TLRY.TO,GlobeNewswire - Breckenridge Distillery Strikes Gold at 2023 World Whiskies Awards
fin_news_nlp/yahoo_cad_tickers_news,https://ca.finance.yahoo.com/news/titan-medical-announces-executive-leadership-123000197.html,"Toronto, Ontario, Feb. 14, 2023 (GLOBE NEWSWIRE) -- Titan Medical Inc. (the “Company” or “Titan”) (Nasdaq: TMDI; TSX: TMD) today announced senior leadership changes and the receipt of a notification from the Nasdaq Stock Market LLC Listing Qualifications Department stating that following the resignation of Heather Knight from the Company’s board of directors and audit committee, the Company no longer complies with Nasdaq’s audit committee requirement set forth in Nasdaq Rule 5605. Senior Leaders",CAD,TMD.TO,GlobeNewswire - Titan Medical Announces Executive Leadership Updates and Receipt of Nasdaq Notification Regarding Audit Committee Requirements
fin_news_nlp/yahoo_cad_tickers_news,https://ca.finance.yahoo.com/news/why-tsx-stock-always-better-100000727.html,"This TSX stock will always be a better buy, with the means to make you money in a consistent manner that's far easier to achieve than a growth stock. The post Why This TSX Stock Will Always Do Better Than a Growth Stock appeared first on The Motley Fool Canada.",CAD,TD.TO,The Motley Fool - Why This TSX Stock Will Always Do Better Than a Growth Stock
fin_news_nlp/yahoo_cad_tickers_news,https://ca.finance.yahoo.com/news/victoria-gold-response-atac-resources-110000955.html,"WHITEHORSE, Yukon, Feb. 14, 2023 (GLOBE NEWSWIRE) -- Victoria Gold Corp. (TSX-VGCX) (“Victoria” or the “Company”) has noted a response from ATAC Resources Ltd. (“ATAC”) regarding Victoria’s proposal to acquire ATAC for an 85% premium to ATAC’s closing share price on February 10, 2023 (the “Proposal”). Victoria wishes to clarify certain facts contained in ATAC’s press release related to the conditionality of its Proposal. ATAC has stated that Victoria’s Proposal “contained numerous deal condition",CAD,VGCX.TO,GlobeNewswire - Victoria Gold: Response to ATAC Resources
fin_news_nlp/yahoo_cad_tickers_news,https://ca.finance.yahoo.com/news/wesdome-expands-recently-discovered-hanging-120000691.html,"Figure 1 Kiena Deep A Zone Figure 2 3D Image of Kiena Deep Footwall Zone TORONTO, Feb. 14, 2023 (GLOBE NEWSWIRE) -- Wesdome Gold Mines Ltd. (TSX: WDO) (“Wesdome” or the “Company”) today announces underground exploration drilling results from the Kiena Deep A zone at the Company’s 100% owned Kiena Mine Complex in Val d'Or, Quebec. Over the past several years, underground drilling has focussed on testing areas proximal to the Kiena Deep A zones. As part of this exploration focus, early success dis",CAD,WDO.TO,GlobeNewswire - Wesdome Expands Recently Discovered Hanging and Footwall Zones and Extends Kiena Deep A Zone Over 125 Metres Down Plunge
fin_news_nlp/yahoo_cad_tickers_news,https://ca.finance.yahoo.com/news/acasti-pharma-reports-third-quarter-120000682.html,"Company to Host Conference Call Today at 1:00pm ET LAVAL, Québec, Feb. 14, 2023 (GLOBE NEWSWIRE) -- Acasti Pharma Inc. (“Acasti” or the “Company”) (Nasdaq: ACST and TSX-V: ACST), a late-stage, specialty pharma company advancing three clinical stage drug candidates addressing rare and orphan diseases, today announced financial and operational results for the third quarter ended December 31, 2022 Recent Highlights The Company anticipates receiving clarifying guidance from the Food and Drug Adminis",CAD,ACST.V,GlobeNewswire - Acasti Pharma Reports Third Quarter 2023 Operational Results
fin_news_nlp/yahoo_cad_tickers_news,https://ca.finance.yahoo.com/news/altima-secures-joint-venture-green-115900771.html,"Vancouver, British Columbia--(Newsfile Corp. - February 14, 2023) - Altima Resources Ltd. (TSXV: ARH) (""Altima"" or the ""Company"") announces it has reached an agreement through a binding term sheet (the ""Terms"") with St-George Eco-Mining Corp (CSE: SX) and its wholly owned subsidiary, H2SX Corp. (the ""H2SX"") with the intent to form an exclusive partnership, whereby Altima will use H2SX's technology partner's patented hydrogen production (ccH2™) and nano-carbon technology for the conversion of nat",CAD,ARH.V,Newsfile - Altima Secures Joint Venture for Green Hydrogen Technology
fin_news_nlp/yahoo_cad_tickers_news,https://ca.finance.yahoo.com/news/alx-resources-corp-stakes-crystal-123000548.html,"Vancouver, British Columbia--(Newsfile Corp. - February 14, 2023) - ALX Resources Corp. (TSXV: AL) (FSE: 6LLN) (OTC: ALXEF) (""ALX"" or the ""Company"") is pleased to announce that it has acquired by staking the Crystal Lithium Project (""Crystal"", or the ""Project"") in northern Saskatchewan. Crystal is 100%-owned by ALX with no applicable royalties and consists of 54 mineral claims in five claim blocks encompassing 44,587 hectares (110,174 acres), located close to the Saskatchewan-Northwest Territori",CAD,AL.V,"Newsfile - ALX Resources Corp. Stakes Crystal Lithium Project, Northern Saskatchewan, Canada"
fin_news_nlp/yahoo_cad_tickers_news,https://ca.finance.yahoo.com/news/angus-confirms-extensive-gold-system-120000339.html,"Figure 1 Figure 1: Surface Map – BIF new drilling, Golden Sky Airbone Magnetics Map Highlights: Drilling within the Banded Iron Formation (“BIF”) exploration area has successfully extended the gold mineralisation over 800 metres along strike, up to 104 metres wide and down to depths of 220 metres, suggesting an extensive gold systemResults confirm a robust gold system with thick intervals of up to: 104.3 metres of near-continuous mineralization grading 0.8 g/t Au, including 7.9 metres of 2.3 g/t",CAD,GUS.V,"GlobeNewswire - Angus Confirms Extensive Gold System, Intersects 104 metres of 0.8 g/t Au on its Golden Sky Project, Wawa"
fin_news_nlp/yahoo_cad_tickers_news,https://ca.finance.yahoo.com/news/apollo-defines-gold-mineralization-over-120000395.html,"Reports 91.0 m of 0.390 g/t Au from surface and 211 g/t Au from surface grab sample Figure 1 Drill hole collar locations for results reported February 14, 2023, for Phase 2 of the Calico Project 2022 Drill Program and select surface sampling. Figure 2 3D view across the southern half of the Waterloo property showing the relationship of the silver MRE with gold mineralization in drilling, as reported February 14, 2023 for the Calico Project. VANCOUVER, British Columbia, Feb. 14, 2023 (GLOBE NEWSW",CAD,APGO.V,"GlobeNewswire - Apollo Defines Gold Mineralization over 1,000 metre Strike Length at Calico"
fin_news_nlp/yahoo_cad_tickers_news,https://ca.finance.yahoo.com/news/astra-exploration-announces-1m-private-123000555.html,"Vancouver, British Columbia--(Newsfile Corp. - February 14, 2023) - Astra Exploration Inc. (TSXV: ASTR) (OTCQB: ATEPF) (""Astra Exploration"" or the ""Company"") is pleased to announce a non-brokered private placement (the ""Offering"") of up to 9,090,909 units (the ""Units"") for gross proceeds of up to CAD $1.0 million.The offering will consist of 9,090,909 Units priced at $0.11 per unit, with each unit consisting of one common share and one common share purchase warrant (a ""Warrant""). ...",CAD,ASTR.V,Newsfile - Astra Exploration Announces $1M Private Placement with Expected Participation from Michael Gentile and Peter Marrone; Marrone to Significantly Increase Ownership
fin_news_nlp/yahoo_cad_tickers_news,https://ca.finance.yahoo.com/news/drilling-expands-dimensions-gold-zones-123000680.html,"Chimo Mine Gold System Longitudinal Figure PR February 14th 2023 Chimo Mine Gold System Longitudinal Figure PR February 14th 2023 VAL-D’OR, Quebec, Feb. 14, 2023 (GLOBE NEWSWIRE) -- Cartier Resources Inc. (TSX-V: ECR) (“Cartier”) announces drill results in the East Chimo Mine Sector, located at the midpoint of 450 m between the Chimo Mine and West Nordeau sectors (FIGURE 1). The results are located on the Chimo Mine Property, 100% owned by Cartier, which is located 45 km east of the Val-d'Or min",CAD,ECR.V,GlobeNewswire - Drilling Expands Dimensions of Gold Zones of East Chimo Mine Sector
fin_news_nlp/yahoo_cad_tickers_news,https://ca.finance.yahoo.com/news/copper-road-announces-private-placement-120000122.html,"TORONTO, Feb. 14, 2023 (GLOBE NEWSWIRE) -- Copper Road Resources Inc. (TSXV: CRD) (“Copper Road” or the “Company”) is pleased to announce a non-brokered private placement of up to 5,000,000 units of the Company (each, a “Unit”) at a price of $0.08 per Unit for aggregate gross proceeds of up to $400,000 (the “Offering”). Each Unit will consist of one common share of the Company and one common share purchase warrant (each, a “Warrant”). Each Warrant will entitle the holder thereof to purchase one",CAD,CRD.V," - Copper Road Announces Private Placement of up to $400,000"
fin_news_nlp/yahoo_cad_tickers_news,https://ca.finance.yahoo.com/news/cordoba-minerals-provides-recent-activities-123000648.html,"Vancouver, British Columbia--(Newsfile Corp. - February 14, 2023) - Cordoba Minerals Corp. (TSXV: CDB) (OTCQB: CDBMF) (otherwise ""Cordoba"" or the ""Company""), today announces that it has temporarily suspended its Feasibility Study in-fill drilling program and other on-site work at the Company's San Matias Copper-Gold-Silver Project. The Company has been closely monitoring the impact of the ongoing public demonstrations on social reformation taking place across Colombia. Cordoba's primary focus re",CAD,CDB.V,Newsfile - Cordoba Minerals Provides an Update on Recent Activities
fin_news_nlp/yahoo_cad_tickers_news,https://ca.finance.yahoo.com/news/eloro-resources-outlines-extensive-ip-110000690.html,Figure 1: Plan map of Analytical Signal for Iska Iska and Casiterita showing likely extent of major magnetic intrusive body. Figure 1: Plan map of Analytical Signal for Iska Iska and Casiterita showing likely extent of major magnetic intrusive body. Figure 2: North-South Longitudinal Section showing Inverse Magnetic Susceptibility Model. Figure 2: North-South Longitudinal Section showing Inverse Magnetic Susceptibility Model. Figure 2: North-South Longitudinal Section showing Inverse Magnetic Su,CAD,ELO.V,"GlobeNewswire - Eloro Resources Outlines an Extensive IP Conductivity Anomaly on the Casiterita property adjacent to the Iska Iska Silver-Tin Polymetallic Project, Southern Bolivia"
fin_news_nlp/yahoo_cad_tickers_news,https://ca.finance.yahoo.com/news/qples-fobi-signs-reseller-agreement-130000102.html,"SMS PROMO works with some of the largest Tier 1 CPG Brands in the world to deliver traditional print-based promotions & couponsVANCOUVER, BC, Feb. 14, 2023 (GLOBE NEWSWIRE) -- Fobi AI Inc. (FOBI:TSXV) (FOBIF:OTCQB) (the ""Company"" or ""Fobi""), an industry leader in harnessing AI and data intelligence to enable digital transformation, is pleased to announce that Qples by Fobi has signed a reseller deal with SMS PROMO. SMS PROMO has been involved in the promotions industry for more than 30 years and",CAD,FOBI.V,GlobeNewswire - Qples by Fobi Signs Reseller Agreement with SMS PROMO
fin_news_nlp/yahoo_cad_tickers_news,https://ca.finance.yahoo.com/news/freeman-reports-final-drill-results-123000306.html,"Freeman Gold Corp. (TSXV: FMAN) (OTCQX: FMANF) (FSE: 3WU) (""Freeman"" or the ""Company"") is pleased to report results for the final 19 drill holes from the Company's 12,000 metre Phase 2 and 3 resource expansion and infill drill program at its 100% owned Lemhi Gold Deposit, Idaho, USA. Of the 19 new drill holes, 10 were designed to test mineralization to the west, east and south of the known deposit to expand mineralization and eight holes north of the known deposit. Also, one infill hole (FG22-01",CAD,FMAN.V,CNW Group - FREEMAN REPORTS ON FINAL DRILL RESULTS FROM 2021-2022 DRILL PROGRAM
fin_news_nlp/yahoo_cad_tickers_news,https://ca.finance.yahoo.com/news/khiron-closes-revolving-credit-facility-130000027.html,"Toronto, Ontario--(Newsfile Corp. - February 14, 2023) - Khiron Life Sciences Corp. (TSXV: KHRN) (OTCQB: KHRNF) (FSE: A2JMZC) (""Khiron"" or the ""Company""), announces that its wholly owned subsidiary ZereniaTM Colombia has closed an unsecured revolving credit facility of CAD 580,0001 with a private financing company in Colombia.The 12-month revolving credit facility became effective on February 10, 2023, and was provided by a Colombian private financing company. The Company was granted this workin",CAD,KHRN.V,Newsfile - Khiron Closes Revolving Credit Facility with Financing Company in Colombia
fin_news_nlp/yahoo_cad_tickers_news,https://ca.finance.yahoo.com/news/kutcho-copper-demonstrates-low-project-130000236.html,"Figure 1. Operational GHG Intensity Comparison for Copper Figure 2. GHG Intensity at Global Copper Mining Operations (Mine plus Concentrator) VANCOUVER, British Columbia, Feb. 14, 2023 (GLOBE NEWSWIRE) -- Kutcho Copper Corp. (TSXV: KC) (OTC: KCCFF) (“Kutcho Copper” or the “Company”) is pleased to provide results from a Greenhouse Gas (“GHG”) intensity study completed by Environmental Resource Management (ERM) based on the Company’s 2021 Feasibility Study on its high-grade copper – zinc developme",CAD,KC.V,GlobeNewswire - Kutcho Copper Demonstrates Low Project Life Green House Gas Emissions
fin_news_nlp/yahoo_cad_tickers_news,https://ca.finance.yahoo.com/news/legend-power-systems-continues-grow-120000365.html,"Vancouver, British Columbia--(Newsfile Corp. - February 14, 2023) - Legend Power® Systems (TSXV: LPS), a global leader in commercial Active Power Management solutions, confirms that SmartGATE bookings continue to grow, and new partnerships are expanding. This includes several smaller initial system purchases as well as follow-on, double digit SmartGATE orders. Additionally, Legend confirms that it is currently assessing a new pipeline representing over 75 million square feet of facilities - a to",CAD,LPS.V," - Legend Power Systems Continues to Grow Bookings, Pipeline and Partners"
fin_news_nlp/yahoo_cad_tickers_news,https://ca.finance.yahoo.com/news/magna-terra-announces-changes-board-130000245.html,"/ Magna Terra Minerals Inc. (the ""Company"" or ""Magna Terra"") (TSXV:MTT) announces that Mr. Denis Hall has resigned his seat on the Board of Directors and will be replaced by Mr. Gernot Wober.",CAD,MTT.V,ACCESSWIRE - Magna Terra Announces Changes to Its Board of Directors
fin_news_nlp/yahoo_cad_tickers_news,https://ca.finance.yahoo.com/news/nevgold-submits-exploration-plan-operations-130000959.html,"Vancouver, British Columbia, Feb. 14, 2023 (GLOBE NEWSWIRE) -- NevGold Corp. (“NevGold” or the “Company”) (TSXV:NAU) (OTCQX:NAUFF) (Frankfurt:5E50) is pleased to announce that on February 8, 2023, the Company submitted an Exploration Plan of Operations (“EPO”) to the Bureau of Land Management (the “BLM”) for its Limousine Butte Project in Nevada (the “Project""). The submission of the EPO is an important milestone for the Project as the process included many key de-risking activities critical to",CAD,NAU.V,"GlobeNewswire - NevGold Submits Exploration Plan of Operations For Limousine Butte, Nevada"
fin_news_nlp/yahoo_cad_tickers_news,https://ca.finance.yahoo.com/news/northstar-receives-notice-canadian-patent-130000192.html,"Northstar Clean Technologies Inc. (TSXV: ROOF) (OTCQB: ROOOF) (""Northstar"" or the ""Company"") is pleased to announce that it has received a Notice of Advanced Examination (the ""Notice"") from the Canadian Patent Office (""CPO"") dated February 1, 2023. The Notice confirms approval by CPO of Northstar's request for advance examination of its patent application for the Company's innovative technology for reprocessing asphalt shingles on the grounds that the application relates to green technology that",CAD,ROOF.V,CNW Group - Northstar Receives Notice from the Canadian Patent Office That Its Patent Application Has Been Approved for Fast Track Due to Northstar's Green Technology
fin_news_nlp/yahoo_cad_tickers_news,https://ca.finance.yahoo.com/news/plurilock-announces-multi-sale-order-120000689.html,"The new customer will license Plurilock's high-margin software solution, which includes single sign-on authentication and access control features Vancouver, British Columbia--(Newsfile Corp. - February 14, 2023) - Plurilock Security Inc. (TSXV: PLUR) (OTCQB: PLCKF) and related subsidiaries (""Plurilock"" or the ""Company""), an identity-centric cybersecurity solutions provider for workforces, is pleased to announce that the Company has received a three-year sale order for its flagship software platf",CAD,PLUR.V,Newsfile - Plurilock Announces Multi-Year Sale Order for Flagship Cybersecurity Software with Overseas IT Solutions Provider
fin_news_nlp/yahoo_cad_tickers_news,https://ca.finance.yahoo.com/news/poet-technologies-demonstrate-800g-optical-120000423.html,"Technology Demonstrations of Optical Engines for Pluggable Transceivers, Co-packaged Optics and AI-ML GPUsTORONTO, Feb. 14, 2023 (GLOBE NEWSWIRE) -- POET Technologies Inc. (“POET” or the “Company”) (TSX Venture: PTK; NASDAQ: POET), the designer and developer of the POET Optical Interposer™ and Photonic Integrated Circuits (PICs) for the data center, telecommunication and artificial intelligence markets, today announced that it will be hosting live demonstrations of its advanced optical engine an",CAD,PTK.V,GlobeNewswire - POET Technologies to Demonstrate 800G Optical Engines and Light Source Products at OFC 2023
fin_news_nlp/yahoo_cad_tickers_news,https://ca.finance.yahoo.com/news/quipt-home-medical-reports-record-123000564.html,"Posts Strong Adjusted EBITDA Margin of 22% and Sequential Organic Growth of 2%CINCINNATI, Feb. 14, 2023 (GLOBE NEWSWIRE) -- Quipt Home Medical Corp. (the “Company”) (NASDAQ:QIPT; TSXV:QIPT), a U.S. based home medical equipment provider, focused on end-to-end respiratory care, today announced its first quarter fiscal 2023 financial results and operational highlights. These results pertain to the three months ended December 31, 2022 and are reported in U.S. Dollars. Quipt will host its Earnings Co",CAD,QIPT.V," - Quipt Home Medical Reports Record First Quarter Fiscal 2023 Financial Results Posting Positive Net Income, Revenue Growth of 38% and Adjusted EBITDA Growth of 50%"
fin_news_nlp/yahoo_cad_tickers_news,https://ca.finance.yahoo.com/news/renoworks-costcertified-enter-strategic-technology-123000815.html,"Renoworks Software Inc. (TSXV:RW) (""Renoworks""), an industry leader in visualization and lead generation technology for the home renovation and new construction sector, and (""CostCertified""), the state-of-the-art construction estimating software-as-a-service (SaaS) company and Y-Combinator Alumni, announces a strategic partnership and mutual reseller agreement.",CAD,RW.V,ACCESSWIRE - Renoworks and CostCertified Enter Strategic Technology Partnership and Mutual Reseller Agreement
fin_news_nlp/yahoo_cad_tickers_news,https://ca.finance.yahoo.com/news/revolugroup-canada-inc-tsx-v-130000019.html,"Vancouver, BC, Feb. 14, 2023 (GLOBE NEWSWIRE) -- RevoluGROUP Canada Inc. (TSX-V: REVO), (Frankfurt: IJA2), (Munich: A2PU92), (the ""Company"") is pleased to announce that the TSX-V has approved the extension of the expiry dates of a total of 10,939,100 share purchase warrants (the ""Warrants""), by six months to August 18, 2023 (the ""Warrant Extension""). The Warrants were issued pursuant to a private placement which closed on February 18th, 2022. Each Warrant entitles the holder thereof to acquire o",CAD,REVO.V,GlobeNewswire - RevoluGROUP Canada Inc. TSX-V approves Warrant Extension
fin_news_nlp/yahoo_cad_tickers_news,https://ca.finance.yahoo.com/news/silver-mountain-reports-underground-channel-120000882.html,"Silver Mountain Resources Inc. (TSXV: AGMR) (OTCQB: AGMRF) (BVL: AGMR) (""Silver Mountain"", ""AGMR"" or the ""Company"") is pleased to announce new results from underground channel sampling at the Reliquias silver mine in Huancavelica, central Peru. To complement the drill campaigns and to facilitate the conversion of additional historic resources into a National Instrument 43-101 – Standards of Disclosure for Mineral Projects (""NI 43-101"") compliant mineral resource, an extensive underground mapping",CAD,AGMR.V,"CNW Group - SILVER MOUNTAIN REPORTS NEW UNDERGROUND CHANNEL SAMPLING RESULTS FROM THE METEYSACA VEIN, RELIQUIAS MINE"
fin_news_nlp/yahoo_cad_tickers_news,https://ca.finance.yahoo.com/news/stillwater-critical-minerals-partners-cornell-123000384.html,"Stillwater Critical Minerals (TSX.V:PGE)(OTCQB:PGEZF)(FSE:5D32)(the ""Company"" or ""SWCM"") is pleased to announce it has partnered with Cornell University under the MINER program, funded by the U.S. Department of Energy (""DOE"") via the Advanced Research Projects Agency program (""ARPA-E"").",CAD,PGE.V,"ACCESSWIRE - Stillwater Critical Minerals Partners with Cornell University on Hydrometallurgy and Carbon Sequestration Initiatives for its Stillwater West Ni-PGE-Cu-Co + Au Project in Montana, USA"
