source,url,description,country,company,title
fin_news_nlp/yahoo_cad_tickers_news,https://ca.finance.yahoo.com/news/silver-bull-provides-us-178-100000103.html,"VANCOUVER, British Columbia, June 06, 2023 (GLOBE NEWSWIRE) -- Silver Bull (“the Company”) announces today that it has taken significant steps in its pursuit of compensation regarding the Sierra Mojada Project. On March 2, 2023, the Company served a Notice of Intent with Mexico to initiate a legacy NAFTA claim, seeking damages resulting from the unlawful blockade of its project. In conformity with NAFTA’s dispute resolution provisions, Mexico extended an invitation for Company representatives to",CAD,SVB.TO,GlobeNewswire - Silver Bull Provides Update on Its US$178 Million Legacy NAFTA Claim Against Mexico
fin_news_nlp/yahoo_cad_tickers_news,https://ca.finance.yahoo.com/news/silver-elephant-assay-results-show-131100676.html,"Vancouver, British Columbia--(Newsfile Corp. - May 11, 2023) - Silver Elephant Mining Corp. (TSX: ELEF) (OTCQX: SILEF) (FSE:1P2) (""Silver Elephant"" or ""the Company"") is pleased to report chip and channel sampling assay results from the ongoing exploration at the Company's flagship Pulacayo-Paca silver project in Bolivia.A total of 120 samples were collected from three exploration priority target areas: Paca conglomerate zone, the Pulacayo San Leon tunnel, and the Rothschild zone (an area immedia",CAD,ELEF.TO,"Newsfile - Silver Elephant Assay Results Show Up To 2,790 g/t Silver, 20% Lead From 120 Samples At the Pulacayo-Paca Project in Bolivia"
fin_news_nlp/yahoo_cad_tickers_news,https://ca.finance.yahoo.com/news/silvercorp-declares-semi-annual-dividend-211500336.html,"Silvercorp Metals Inc. (""Silvercorp"" or the ""Company"") (TSX: SVM) (NYSE American: SVM) is pleased to announce that its Board of Directors declared a semi-annual dividend of US$0.0125 per share to be paid to all shareholders of record at the close of business on June 12, 2023, with a payment date of the dividend scheduled on or before June 29, 2023.",CAD,SVM.TO,CNW Group - SILVERCORP DECLARES SEMI-ANNUAL DIVIDEND OF US$0.0125 PER SHARE
fin_news_nlp/yahoo_cad_tickers_news,https://ca.finance.yahoo.com/news/stocks-play-solitario-zinc-corp-161400595.html,"Reported that the Black Hills National Forest, Northern Hills Ranger District has released the draft ...",CAD,SLR.TO, - Stocks in play: Solitario Zinc Corp
fin_news_nlp/yahoo_cad_tickers_news,https://ca.finance.yahoo.com/news/solution-financial-initiates-quarterly-dividend-173300424.html,"Vancouver, British Columbia--(Newsfile Corp. - May 4, 2023) - Solution Financial Inc. (TSX: SFI) (the ""Company"" or ""Solution""), a leading provider of luxury automotive and yacht leasing in British Columbia, is pleased to announce that the Company's Board of Directors has authorized the payment of a quarterly dividend of $0.001. The quarterly dividend is payable on June 15, 2023 to common shareholders of record as of the close of business on May 31, ...",CAD,SFI.TO,Newsfile - Solution Financial Initiates Quarterly Dividend
fin_news_nlp/yahoo_cad_tickers_news,https://ca.finance.yahoo.com/news/source-energy-services-first-quarter-121144233.html,Source Energy Services ( TSE:SHLE ) First Quarter 2023 Results Key Financial Results Revenue: CA$163.7m (up 69% from 1Q...,CAD,SHLE.TO,Simply Wall St. - Source Energy Services First Quarter 2023 Earnings: Beats Expectations
fin_news_nlp/yahoo_cad_tickers_news,https://ca.finance.yahoo.com/news/date-annual-general-meeting-extraordinary-021800389.html,"SouthGobi Resources Ltd. (TSXV:SGQ)(HK:1878) (""SouthGobi"" or the ""Company"") announces that the annual general meeting and extraordinary general meeting of the Company (the ""Annual and Special Meeting"") will convene on Tuesday, June 20, 2023, Vancouver time (i.e. Wednesday, June 21, 2023, Hong Kong time) in Vancouver, British Columbia, Canada.",CAD,SGQ.TO,ACCESSWIRE - Date of Annual General Meeting and Extraordinary General Meeting
fin_news_nlp/yahoo_cad_tickers_news,https://ca.finance.yahoo.com/news/spartan-delta-corp-announces-pro-110000820.html,"Spartan Delta Corp. (""Spartan"" or the ""Company"") (TSX: SDE) is pleased to announce that its Board of Directors (the ""Board"") has approved the pro forma capital expenditure budget and updated guidance for 2023, following the recent sale of the Company's Gold Creek and Karr Montney assets (the ""Asset Sale""). The Company also announces the voting results from its annual general and special meeting of shareholders held on May 16, 2023 (the ""Meeting"").",CAD,SDE.TO,"CNW Group - SPARTAN DELTA CORP. ANNOUNCES PRO FORMA BUDGET, UPDATED GUIDANCE FOR 2023 AND ANNUAL MEETING VOTING RESULTS"
fin_news_nlp/yahoo_cad_tickers_news,https://ca.finance.yahoo.com/news/while-institutions-own-30-sprott-145752221.html,Key Insights Sprott's significant individual investors ownership suggests that the key decisions are influenced by...,CAD,SII.TO,"Simply Wall St. - While institutions own 30% of Sprott Inc. (TSE:SII), individual investors are its largest shareholders with 50% ownership"
fin_news_nlp/yahoo_cad_tickers_news,https://ca.finance.yahoo.com/news/g2-52-week-high-news-153300458.html,G2 Goldfields Inc. (V.GTWO) hit a new 52-week high of 92 cents Wednesday. G2 Goldfields announces further ...,CAD,CEF.TO, - G2 at 52-Week High on News
fin_news_nlp/yahoo_cad_tickers_news,https://ca.finance.yahoo.com/news/sprott-physical-silver-trust-updates-214200851.html,"TORONTO, April 06, 2023 (GLOBE NEWSWIRE) -- Sprott Asset Management LP (“Sprott Asset Management”), a subsidiary of Sprott Inc., on behalf of the Sprott Physical Silver Trust (NYSE: PSLV) (TSX: PSLV / PSLV.U) (the “Trust”), a closed-ended mutual fund trust created to invest and hold substantially all of its assets in physical silver bullion, today announced that it has updated its at-the-market equity program to issue up to US$1 billion of units of the Trust (“Units”) in the United States and Ca",CAD,PSLV.TO, - Sprott Physical Silver Trust Updates Its “At-the-Market” Equity Program
fin_news_nlp/yahoo_cad_tickers_news,https://ca.finance.yahoo.com/news/standard-mercantile-acquisition-corp-announces-210000009.html,"Standard Mercantile Acquisition Corp. (TSX: SMA) (the ""Company"") today released its financial results for the three months ended March 31, 2023. The financial statements and MD&A can be found at of the Company can be found at www.sedar.com or www.standardmercantileacquisition.com.",CAD,SMA.TO,CNW Group - STANDARD MERCANTILE ACQUISITION CORP. ANNOUNCES FIRST QUARTER 2023 FINANCIAL RESULTS
fin_news_nlp/yahoo_cad_tickers_news,https://ca.finance.yahoo.com/news/starcore-announces-4th-quarter-production-063000057.html,"Vancouver, British Columbia--(Newsfile Corp. - May 15, 2023) - Starcore International Mines Ltd. (TSX: SAM) (""Starcore"" or ""the Company"") announces production results for the fourth fiscal quarter ended April 2023, at its San Martin Mine (""San Martin"") in Queretaro, Mexico. All of our efforts over the past year to improve the geological model by investing in new software and external consultants are beginning to give results. These tools have provided better geological interpretation ...",CAD,SAM.TO,Newsfile - Starcore Announces 4th Quarter Production Results
fin_news_nlp/yahoo_cad_tickers_news,https://ca.finance.yahoo.com/news/stelco-holdings-inc-reports-first-213500332.html,"HAMILTON, Ontario, May 10, 2023--Stelco Holdings Inc. (""Stelco Holdings"" or the ""Company""), (TSX: STLC), a low cost, integrated and independent steelmaker with one of the newest and most technologically advanced integrated steelmaking facilities in North America, today announced financial results of the Company for the three months ended March 31, 2023. Stelco Holdings is the 100% owner of Stelco Inc. (""Stelco""), the operating company.",CAD,STLC.TO,Business Wire - Stelco Holdings Inc. Reports First Quarter 2023 Results
fin_news_nlp/yahoo_cad_tickers_news,https://ca.finance.yahoo.com/news/step-energy-services-ltd-reports-220900855.html,"CALGARY, Alberta, May 10, 2023 (GLOBE NEWSWIRE) -- STEP Energy Services Ltd. (the “Company” or “STEP”) is pleased to announce its financial and operating results for the three months ended March 31, 2023. The following press release should be read in conjunction with the management’s discussion and analysis (“MD&A”) and unaudited condensed consolidated interim financial statements and notes thereto as at March 31, 2023 (the “Financial Statements”). Readers should also refer to the “Forward-looki",CAD,STEP.TO,GlobeNewswire - STEP Energy Services Ltd. Reports First Quarter 2023 Results
fin_news_nlp/yahoo_cad_tickers_news,https://ca.finance.yahoo.com/news/steppe-gold-announces-chairman-123000063.html,"Ulaanbaatar, Mongolia--(Newsfile Corp. - June 5, 2023) - Steppe Gold Ltd. (TSX: STGO) (OTCQX: STPGF) (FSE: 2J9) (""Steppe Gold"" or the ""Company"") is pleased to announce that the chief executive officer of the Company (the ""CEO""), Mr Bataa Tumur-Ochir will also assume the role of Chairman, effective immediately.Mr Bataa Tumur-Ochir is a founding Director of Steppe Gold and he has led the Company as CEO since December 2019. He is also now the largest ...",CAD,STGO.TO,Newsfile - Steppe Gold Announces New Chairman
fin_news_nlp/yahoo_cad_tickers_news,https://ca.finance.yahoo.com/news/sulliden-appoints-grant-sboros-member-220000477.html,"TORONTO, May 24, 2023 (GLOBE NEWSWIRE) -- Sulliden Mining Capital Inc. (TSX: SMC) (“Sulliden” or the “Company”) is pleased to announce the appointment of Grant Sboros as a member of the board of directors of the Company effective immediately. Mr. Sboros’ appointment will succeed Wen Ye’s resignation from the Company’s board of directors. Grant Sboros is the Chief Executive Officer of Euro Sun Mining Inc. He previously worked as the Chief Financial Officer of Katanga Mining Limited from 2017 to 2",CAD,SMC.TO,GlobeNewswire - Sulliden Appoints Grant Sboros as a Member of the Board of Directors
fin_news_nlp/yahoo_cad_tickers_news,https://ca.finance.yahoo.com/news/suncor-energy-su-outpaces-stock-220026394.html,"Suncor Energy (SU) closed the most recent trading day at $30.31, moving +0.17% from the previous trading session.",CAD,SU.TO,Zacks - Suncor Energy (SU) Outpaces Stock Market Gains: What You Should Know
fin_news_nlp/yahoo_cad_tickers_news,https://ca.finance.yahoo.com/news/intrinsic-calculation-surge-energy-inc-101820015.html,Key Insights The projected fair value for Surge Energy is CA$15.99 based on 2 Stage Free Cash Flow to Equity Surge...,CAD,SGY.TO,Simply Wall St. - An Intrinsic Calculation For Surge Energy Inc. (TSE:SGY) Suggests It's 49% Undervalued
fin_news_nlp/yahoo_cad_tickers_news,https://ca.finance.yahoo.com/news/swiss-water-reports-voting-results-230000346.html,"VANCOUVER, British Columbia, May 18, 2023 (GLOBE NEWSWIRE) -- Swiss Water Decaffeinated Coffee Inc. (TSX– SWP) (“Swiss Water” or “the Company”) is pleased to announce the following voting results of the Company’s Annual General Meeting of Shareholders, which was held on Thursday, May 18, 2023. Election of Directors The Director nominees listed in the Management Information Circular for its Annual General Meeting of Shareholders were elected as Directors of Swiss Water. Voting results for individ",CAD,SWP.TO,GlobeNewswire - Swiss Water Reports Voting Results From Annual General Meeting
fin_news_nlp/yahoo_cad_tickers_news,https://ca.finance.yahoo.com/news/sylogist-host-investor-day-engages-233500454.html,"CALGARY, Alberta, May 18, 2023 (GLOBE NEWSWIRE) -- Sylogist Ltd. (TSX:SYZ) Sylogist Ltd. (TSX: SYZ) (""Sylogist"" or the ""Company""), a leading public sector SaaS company, will host an Investor Day, for institutional investors and analysts, on Tuesday, June 13, 2023, at the St. Regis Hotel in Toronto, Ontario. Presentations will begin at 9:15 a.m. Eastern Time. During the event, Sylogist executive leadership will provide attendees with an update on the Company’s growth opportunities, in-flight init",CAD,SYZ.TO,"GlobeNewswire - Sylogist to Host Investor Day, Engages LodeRock Advisors"
fin_news_nlp/yahoo_cad_tickers_news,https://ca.finance.yahoo.com/news/taiga-partners-provider-deliver-award-130000577.html,"The industry-leading off-road electric vehicle (EV) manufacturer, Taiga Motors Corporation (TSX: TAIG) (""Taiga"" or the ""Company""), is thrilled to announce that Austin-based boat-rental company, Float On, is now an official Taiga Service Provider (TSP). Taiga is excited about bringing sustainable water exploration to the Lone Star State.",CAD,TAIG.TO,CNW Group - Taiga partners with a new Service Provider to deliver its award-winning 100% electric personal watercraft in Texas
fin_news_nlp/yahoo_cad_tickers_news,https://ca.finance.yahoo.com/news/btv-features-champion-iron-limited-130000116.html,"Vancouver, British Columbia--(Newsfile Corp. - May 4, 2023) - On FOX Business News broadcast on Sunday, May 7 at 5:30 ET - BTV - Business Television interviews emerging companies in the markets with the following companies: Cannot view this video? Visit:https://www.youtube.com/watch?v=1GTcEUiLUzUChampion Iron Limited (OTCQX: CIAFF) (TSX: CIA) (ASX: CIA) - BTV checks in with Champion Iron, a leading producer of high-purity iron ore contributing to decarbonize the steel industry. Its Québec-based",CAD,TSK.TO," - BTV Features: Champion Iron Limited, Defence Therapeutics, Nouveau Monde Graphite, Talisker Resources, Osisko Development & more on FOX Business News"
fin_news_nlp/yahoo_cad_tickers_news,https://ca.finance.yahoo.com/news/talon-metals-corp-tse-tlo-133728501.html,Key Insights Significant control over Talon Metals by retail investors implies that the general public has more power...,CAD,TLO.TO,"Simply Wall St. - Talon Metals Corp. (TSE:TLO) stock most popular amongst retail investors who own 54%, while private equity firms hold 33%"
fin_news_nlp/yahoo_cad_tickers_news,https://ca.finance.yahoo.com/news/tamarack-valley-energy-tse-tve-125941744.html,"While Tamarack Valley Energy Ltd. ( TSE:TVE ) shareholders are probably generally happy, the stock hasn't had...",CAD,TVE.TO,"Simply Wall St. - Tamarack Valley Energy (TSE:TVE) shareholder returns have been enviable, earning 370% in 3 years"
fin_news_nlp/yahoo_cad_tickers_news,https://ca.finance.yahoo.com/news/tantalus-enters-reseller-agreement-canadian-110000563.html,"Agreement will expand Tantalus' presence across the Canadian utility industry Burnaby, British Columbia--(Newsfile Corp. - May 30, 2023) - Tantalus Systems (TSX: GRID) (""Tantalus"" or the ""Company""), a smart grid technology company focused on helping build sustainable utilities for the future, is pleased to announce that the Company entered into a reseller agreement with Jesstec Industries Inc. (""Jesstec""). The agreement expands Tantalus' commitment to the Canadian utility industry while providin",CAD,GRID.TO,Newsfile - Tantalus Enters into Reseller Agreement with Canadian-Based Jesstec Industries
fin_news_nlp/yahoo_cad_tickers_news,https://ca.finance.yahoo.com/news/tfsa-investors-2-top-tsx-143000473.html,These stocks appear oversold and now offer high dividend yields. The post New TFSA Investors: 2 Top TSX Dividend Stocks With High Yields appeared first on The Motley Fool Canada.,CAD,TRP.TO,The Motley Fool - New TFSA Investors: 2 Top TSX Dividend Stocks With High Yields
fin_news_nlp/yahoo_cad_tickers_news,https://ca.finance.yahoo.com/news/td-asset-management-inc-announces-140000379.html,"TD Asset Management Inc. (""TDAM"") today announced the May cash distributions for the TD Exchange-Traded Funds (each, a ""TD ETF"" and collectively, the ""TD ETFs"") listed below. Unitholders of record as at May 30, 2023 will receive a cash distribution per unit of the applicable TD ETF that will be payable on June 6, 2023, as indicated below:",CAD,TGED.TO,CNW Group - TD Asset Management Inc. Announces TD ETF Distributions
fin_news_nlp/yahoo_cad_tickers_news,https://ca.finance.yahoo.com/news/tdb-split-corp-regular-monthly-130000928.html,"TORONTO, May 18, 2023 (GLOBE NEWSWIRE) -- TDb Split Corp. (""TDb Split"") declares its regular monthly distribution of $0.05000 for each Class A share ($0.60 annualized) and $0.04375 for each Priority Equity share ($0.525 annually). Distributions are payable June 9, 2023 to shareholders on record as at May 31, 2023. Since inception, Class A shareholders have received a total of $7.80 per share and Priority Equity shareholders have received a total of $8.30 per share inclusive of this distribution,",CAD,XTD.TO,GlobeNewswire - TDb Split Corp. Regular Monthly Dividend Declaration for Class A & Priority Equity Share
fin_news_nlp/yahoo_cad_tickers_news,https://ca.finance.yahoo.com/news/telus-esports-series-partners-samsung-130000823.html,"TELUS is calling upon Canadian gamers of all skill levels to join the biggest Canada-wide esport series featuring Apex Legends, Rocket League, and the mobile game Rocket League Sideswipe TELUS Esport Series gives Canadian gamers the chance to win more than $50,000 in prizes. VANCOUVER, British Columbia, June 05, 2023 (GLOBE NEWSWIRE) -- Today, TELUS announced the return of the TELUS Esports Series powered by TELUS Arena, a nationwide gaming platform that supports and empowers Canadian esport pla",CAD,TIXT.TO,"GlobeNewswire - TELUS Esports Series partners with Samsung for the biggest mobile gaming tournament in Canada, powered by the Samsung Galaxy S23 Ultra"
fin_news_nlp/yahoo_cad_tickers_news,https://ca.finance.yahoo.com/news/terago-participate-2023-td-securities-123000926.html,"TERAGO Inc. (""TERAGO"" or the ""Company"") (TSX: TGO) (www.terago.ca), has been invited to participate at the 2023 TD Securities Telecom & Media Conference, which is being held on Wednesday, May 24th, 2023 at the TD Tower, in Toronto, Ontario. The Company's CFO, Phil Jones, and other members of the management team will be holding 1x1 meetings with institutional investors.",CAD,TGO.TO,"CNW Group - TERAGO to Participate at the 2023 TD Securities Telecom & Media Conference on May 24, 2023"
fin_news_nlp/yahoo_cad_tickers_news,https://ca.finance.yahoo.com/news/real-brokerage-present-william-blair-203000017.html,"TORONTO & NEW YORK, May 31, 2023--The Real Brokerage Inc. (TSX: REAX) (NASDAQ: REAX), the fastest-growing publicly traded real estate brokerage, today announced that Chairman and Chief Executive Officer Tamir Poleg will be presenting at the William Blair 43rd Annual Growth Stock Conference at the Loews Chicago Hotel in Chicago, Illinois on Wednesday June 7, 2023 at 12:40 p.m. CT.",CAD,REAX.TO,Business Wire - The Real Brokerage to Present at the William Blair 43rd Annual Growth Stock Conference
fin_news_nlp/yahoo_cad_tickers_news,https://ca.finance.yahoo.com/news/thinkific-continues-advance-thinkific-plus-103000911.html,"Thinkific Labs Inc. (""Thinkific"" or the ""Company"") (TSX: THNC), a leading platform for creating, marketing, and selling online learning products, announced today that it has obtained SOC 2 Type 1 cybersecurity compliance certification through the successful completion of the Service Organization Control (SOC) 2 Type 1 audit with no findings.",CAD,THNC.TO,CNW Group - Thinkific Continues to Advance Thinkific Plus Offering Through Completion of SOC 2 Data Security and Privacy Certification
fin_news_nlp/yahoo_cad_tickers_news,https://ca.finance.yahoo.com/news/financial-stock-9-3-yield-221500307.html,Timbercreek Financial Corp. (TSX:TF) is a financial stock that offers value and a fantastic monthly dividend payout. The post This Financial Stock Has a 9.3% Yield and Pays Out Every Month appeared first on The Motley Fool Canada.,CAD,TF.TO,The Motley Fool - This Financial Stock Has a 9.3% Yield and Pays Out Every Month
fin_news_nlp/yahoo_cad_tickers_news,https://ca.finance.yahoo.com/news/titan-medical-reports-operating-financial-210000436.html,"TORONTO, Ontario, June 09, 2023 (GLOBE NEWSWIRE) -- Titan Medical Inc. (“Titan” or the “Company”) (TSX: TMD; OTC: TMDIF), announced today financial results for the three months ended March 31, 2023. Recent Activities: On May 26th and June 5th, respectively, the Company announced IP licensing transactions for total upfront payments of -$15.5 million.Subsequent to the quarter, the Company improved its working capital position further by settling multiple trade-related payables that cancelled appro",CAD,TMD.TO,GlobeNewswire - Titan Medical Reports Operating and Financial Results for the First Quarter 2023
fin_news_nlp/yahoo_cad_tickers_news,https://ca.finance.yahoo.com/news/titanium-transportation-group-declares-quarterly-215400224.html,"BOLTON, Ontario, May 23, 2023 (GLOBE NEWSWIRE) -- The Board of Directors of Titanium Transportation Group Inc. (“Titanium” or the “Company”) (TSX:TTNM, OTCQX:TTNMF) has declared a quarterly dividend of $0.02 per common share, payable on June 15, 2023 to shareholders of record at the close of business on May 31, 2023. The amount of the dividend is consistent with the Company’s previous dividend. About Titanium Titanium is a leading North American transportation company with asset-based trucking o",CAD,TTNM.TO,GlobeNewswire - Titanium Transportation Group Declares Quarterly Dividend
fin_news_nlp/yahoo_cad_tickers_news,https://ca.finance.yahoo.com/news/topaz-announces-first-quarter-2023-200200081.html,"Topaz Energy Corp. (TSX: TPZ) (""Topaz"" or the ""Company"") is pleased to provide first quarter 2023 financial results and confirm the Company's 2023 guidance estimates. Select financial information is outlined below and should be read in conjunction with Topaz's interim consolidated financial statements and related management's discussion and analysis (""MD&A"") as at and for the three months ended March 31, 2023, which are available on SEDAR at www.sedar.com and on Topaz's website at www.topazenerg",CAD,TPZ.TO,"CNW Group - TOPAZ ANNOUNCES FIRST QUARTER 2023 RESULTS, ACHIEVES RECORD ROYALTY PRODUCTION AND DECLARES QUARTERLY DIVIDEND"
fin_news_nlp/yahoo_cad_tickers_news,https://ca.finance.yahoo.com/news/torex-gold-releases-2022-responsible-100000686.html,"Report spotlights continued excellence in ESG performance and disclosure(All amounts expressed in U.S. Dollars unless otherwise stated) TORONTO, May 25, 2023 (GLOBE NEWSWIRE) -- Torex Gold Resources Inc. (the “Company” or “Torex”) (TSX: TXG) today released its 2022 Responsible Gold Mining Report (the “Report”), the Company’s eighth annual disclosure of its Environmental, Social and Governance (“ESG”) performance. The Report can be found on the Company’s website at www.torexgold.com. Jody Kuzenko",CAD,TXG.TO,GlobeNewswire - Torex Gold Releases 2022 Responsible Gold Mining Report
fin_news_nlp/yahoo_cad_tickers_news,https://ca.finance.yahoo.com/news/3-canadian-energy-stocks-insanely-134500790.html,Do you want insanely fast-growing dividends? These three Canadian energy stocks are growing their dividends rapidly. The post 3 Canadian Energy Stocks With Insanely Fast-Growing Dividends appeared first on The Motley Fool Canada.,CAD,TOU.TO,The Motley Fool - 3 Canadian Energy Stocks With Insanely Fast-Growing Dividends
fin_news_nlp/yahoo_cad_tickers_news,https://ca.finance.yahoo.com/news/value-investors-buy-pampa-energia-134012614.html,"Here at Zacks, our focus is on the proven Zacks Rank system, which emphasizes earnings estimates and estimate revisions to find great stocks. Nevertheless, we are always paying attention to the latest value, growth, and momentum trends to underscore strong picks.",CAD,TA.TO,Zacks - Should Value Investors Buy Pampa Energia (PAM) Stock?
fin_news_nlp/yahoo_cad_tickers_news,https://ca.finance.yahoo.com/news/3-canadian-dividend-stocks-offering-131500375.html,"These valuable dividend stocks offer solid deals right now, with ultra-high yields that will certainly last well beyond this downturn. The post 3 Canadian Dividend Stocks Offering High Yields and Reliable Income appeared first on The Motley Fool Canada.",CAD,RNW.TO,The Motley Fool - 3 Canadian Dividend Stocks Offering High Yields and Reliable Income
fin_news_nlp/yahoo_cad_tickers_news,https://ca.finance.yahoo.com/news/transat-t-inc-tse-trz-122307428.html,"Investors in Transat A.T. Inc. ( TSE:TRZ ) had a good week, as its shares rose 4.2% to close at CA$4.72 following the...",CAD,TRZ.TO,Simply Wall St. - Transat A.T. Inc. (TSE:TRZ) Analysts Are Pretty Bullish On The Stock After Recent Results
fin_news_nlp/yahoo_cad_tickers_news,https://ca.finance.yahoo.com/news/tree-island-completes-renewal-banking-120000398.html,"VANCOUVER, British Columbia, May 08, 2023 (GLOBE NEWSWIRE) -- Tree Island Steel Ltd. (the “Company” or “Tree Island”) (TSX:TSL) announced today, that it has successfully renewed its senior banking facility with current lender Wells Fargo Capital Finance Corporation Canada (“Wells Fargo”). With the proceeds of the sale of the Etiwanda facility applied to the banking facility and the expectation for minimal usage due to the Company’s positive cash flow, the overall limit of the three year Senior S",CAD,TSL.TO,GlobeNewswire - Tree Island Completes Renewal of its Banking Facility
