source,url,description,country,company,title
fin_news_nlp/yahoo_cad_tickers_news,https://ca.finance.yahoo.com/news/champion-gaming-files-financials-190900471.html,"Toronto, Ontario--(Newsfile Corp. - July 5, 2023) - Champion Gaming Group Inc. (TSXV: WAGR) (""Champion Gaming"" or the ""Company"") announces that, further to its press releases dated April 17, 2023, May 2, 2023, May 16, 2023, May 30, 2023, June 13, 2023 and June 27, 2023, it is providing a default status report in accordance with the alternative information guidelines set out in National Policy 12-203 - Cease Trade Orders for Continuous Disclosure Defaults ...",CAD,WAGR.V,Newsfile - Champion Gaming Files Financials
fin_news_nlp/yahoo_cad_tickers_news,https://ca.finance.yahoo.com/news/char-technologies-investor-fireside-chat-120000482.html,"TORONTO, July 18, 2023 (GLOBE NEWSWIRE) -- CHAR Technologies Ltd. (“CHAR” or the “Company”) (TSXV:YES), a leader in sustainable energy solutions, is pleased to invite investors and other interested parties to attend an upcoming webinar featuring Andrew White, CEO of CHAR Technologies and Irina Gorbounova, ArcelorMittal’s VP of Mergers & Acquisitions and Head of ArcelorMittal’s XCarb® Innovation Fund. The discussion will focus on ArcelorMittal's recent investment in CHAR and their strategic partn",CAD,YES.V,GlobeNewswire - CHAR Technologies Investor “Fireside Chat” with ArcelorMittal on July 19th: Strategic Partnership Discussion
fin_news_nlp/yahoo_cad_tickers_news,https://ca.finance.yahoo.com/news/chesapeake-gold-announces-agm-results-231800482.html,"Vancouver, British Columbia--(Newsfile Corp. - June 6, 2023) - Chesapeake Gold Corp. (TSXV: CKG) (OTCQX: CHPGF) (""Chesapeake"" or the ""Company"") is pleased to announce that at the 2023 Annual General Meeting (""AGM"") held on June 6, 2023 in Vancouver, British Columbia, Chesapeake's shareholders voted in favour of all items of business. All director nominees were elected.The Company's Stock Option Plan (the ""Option Plan"") was also approved by a majority of the shareholders. The ...",CAD,CKG.V, - Chesapeake Gold Announces AGM Results
fin_news_nlp/yahoo_cad_tickers_news,https://ca.finance.yahoo.com/news/chibougamau-independent-mont-sorcier-royalty-174100707.html,"ROUYN-NORANDA, Québec, July 06, 2023 (GLOBE NEWSWIRE) -- Chibougamau Independent Mines Inc. (CBG-TSX-V in Canada, CLL1-Frankfurt, Stuttgart, Berlin and Lang & Schwarz Stock Exchanges in Germany, CMAUF-OTC in the US), herein called Chibougamau, is pleased to inform shareholders that Cerrado Gold Inc. (CERT-TSXV) has announced acceptance of an Expression of Interest (EOI) from the UK Export Credit Agency (UKEF) to provide up to four hundred and twenty million dollars ($420,000,000) of support for",CAD,CBG.V,GlobeNewswire - Chibougamau Independent Mont Sorcier Royalty News
fin_news_nlp/yahoo_cad_tickers_news,https://ca.finance.yahoo.com/news/churchill-resources-announces-exercise-option-110000115.html,"TORONTO, July 11, 2023 (GLOBE NEWSWIRE) -- Churchill Resources Inc. (“Churchill” or the “Company”) (TSXV: CRI) is pleased to announce that it has exercised an existing option (the “Option”) to acquire a 100% interest in certain mineral properties with prospective nickel, copper and cobalt targets located approximately 150-180km north of the town of Happy Valley-Goose Bay in east-central Labrador (the ""Properties""). On July 22, 2021, the Company entered into an option agreement (the “Option Agree",CAD,CRI.V,GlobeNewswire - Churchill Resources Announces Exercise of Option and Acquisition of 100% Interest in Florence Lake Mineral Properties in Eastern-Central Labrador
fin_news_nlp/yahoo_cad_tickers_news,https://ca.finance.yahoo.com/news/power-play-market-herald-releases-191000430.html,"The Power Play by The Market Herald has announced the release of new interviews with Solar Alliance, Cleantek Industries, Voyageur Pharmaceuticals and Homerun Resources discussing their latest news.",CAD,CTEK.V,"ACCESSWIRE - The Power Play by The Market Herald Releases New Interviews with Solar Alliance, Cleantek Industries, Voyageur Pharmaceuticals and Homerun Resources Discussing Their Latest News"
fin_news_nlp/yahoo_cad_tickers_news,https://ca.finance.yahoo.com/news/clear-blue-technologies-receives-375k-093000762.html,"African Telco purchases 22 Esite-Micro power systems for shipment in Q3TORONTO, June 12, 2023 (GLOBE NEWSWIRE) -- Clear Blue Technologies International Inc. (“Clear Blue”) (TSXV: CBLU) (FRA:0YA) (OTCQB: CBUTF), announces a purchase agreement under which Clear Blue will provide its Esite-Micro power solution to 20 telecom sites in western Africa. The estimated total Lifetime Contract Value for this order, including recurring revenue, is $425,000 of which $360,000 is expected to ship in Q3 2023. T",CAD,CBLU.V,GlobeNewswire - Clear Blue Technologies Receives $375K Order For Esite-Micro Systems
fin_news_nlp/yahoo_cad_tickers_news,https://ca.finance.yahoo.com/news/cleghorn-minerals-closes-110-000-183900739.html,"Val-d'Or, Québec--(Newsfile Corp. - May 18, 2023) - Cleghorn Minerals Ltd. (TSXV: CZZ) (""Cleghorn"" or the ""Company"") is pleased to announce that it has completed the previously announced non-brokered private placement offering (the ""Offering"") for gross proceeds of $110,000. Cleghorn issued 2,095,236 Units under the Offering at a per Unit price of $0.0525, each Unit comprised of one common share in the capital of the Company and one non-transferable common share purchase warrant ...",CAD,CZZ.V,"Newsfile - Cleghorn Minerals Closes $110,000 Private Placement Financing"
fin_news_nlp/yahoo_cad_tickers_news,https://ca.finance.yahoo.com/news/cloud-dx-signs-record-breaking-141500294.html,"Cloud DX (TSXV:CDX)(OTC:CDXFF), a rapidly scaling North American provider of remote patient monitoring services is pleased to announce that it has been awarded a competitive contract by a leading network of 12 primary care clinics in Western Canada to provide its Connected Health™ Remote Patient Monitoring Platform in the region.",CAD,CDX.V,"ACCESSWIRE - Cloud DX Signs Record-Breaking 20th Contract, on Pace to Double Sales in 2023"
fin_news_nlp/yahoo_cad_tickers_news,https://ca.finance.yahoo.com/news/cloudmd-shares-results-ontario-therapist-103000370.html,"The new research validated the faster access to care and better health outcomes provided by the programVANCOUVER, British Columbia, July 06, 2023 (GLOBE NEWSWIRE) -- CloudMD Software & Services Inc. (TSXV: DOC, OTCQX: DOCRF, Frankfurt: 6PH) (the “Company” or “CloudMD”), an innovative health services company transforming the delivery of care, today released the findings of a research report on the health outcomes delivered by CloudMD Therapist-Assisted Internet-Delivered Cognitive Behavioural The",CAD,DOC.V,GlobeNewswire - CloudMD Shares Results of Ontario Therapist Assisted Internet Delivered Cognitive Behavioural Therapy Program
fin_news_nlp/yahoo_cad_tickers_news,https://ca.finance.yahoo.com/news/cmc-metals-ltd-contracts-gravity-133000476.html,"CMC Metals Ltd.(TSXV:CMB)(Frankfurt:ZM5P)(:OTCQB:CMCXF) (""CMC"" or the ""Company"") is pleased to announce that McKeown Exploration Services (""MES"") has initiated a second gravity survey on our Silverknife Property in northern British Columbia. MES is a specialist in gravity surveys. The design of the program was prepared in consultation with MES by Dr. Chris Hale and Mr. John Gilliatt of Intelligent Exploration who are the Company's geophysical contractor.",CAD,CMB.V,"ACCESSWIRE - CMC Metals Ltd. Contracts Gravity Geophysical Survey to Further Delineate CRD Targets at its Silverknife Property, Northern British Columbia"
fin_news_nlp/yahoo_cad_tickers_news,https://ca.finance.yahoo.com/news/co2-gro-signs-cad-1-120000106.html,CO2 GRO Inc. (TSXV:GROW)(OTCQB:BLONF)(Frankfurt:4021) Forum is excited to announce its largest sales contract to-date with El Salvador-based greenhouse pepper grower Hidroexpo S.A. de C.V. (Hidroexpo).,CAD,GROW.V,ACCESSWIRE - CO2 GRO Signs ~CAD $1 million Sales Contract with El Salvador-based Hidroexpo
fin_news_nlp/yahoo_cad_tickers_news,https://ca.finance.yahoo.com/news/coelacanth-energy-inc-announces-succession-100000436.html,"Calgary, Alberta--(Newsfile Corp. - July 19, 2023) - Coelacanth Energy Inc. (TSXV: CEI) (""Coelacanth"" or the ""Company"") announces that as part of a transition and succession plan outlined in a press release dated September 8, 2022, Terry Trudeau, has relinquished his role as Coelacanth's Chief Operating Officer. On behalf of the Board of Directors and Management, Rob Zakresky, President & CEO, stated that, ""Mr. Trudeau's expertise and operational leadership were key to shareholder ...",CAD,CEI.V,Newsfile - Coelacanth Energy Inc. Announces Succession of Chief Operating Officer
fin_news_nlp/yahoo_cad_tickers_news,https://ca.finance.yahoo.com/news/coho-announces-opening-purebreads-7th-184600412.html,"Vancouver, British Columbia--(Newsfile Corp. - June 30, 2023) - Coho Collective Kitchens Inc. (TSXV: COHO) (""Coho"" or the ""Company""), a commercial real estate and food technology company that provides private and shared kitchen and food production space to a variety of businesses, is excited to announce the opening of the 7th location of Purebread. Bakery Inc. (""Purebread"") at the Vancouver International Airport (""YVR"").Previously, on May 29, 2023, Coho announced the execution of a purchase ...",CAD,COHO.V,Newsfile - Coho Announces the Opening of Purebread's 7th Location at the Vancouver International Airport
fin_news_nlp/yahoo_cad_tickers_news,https://ca.finance.yahoo.com/news/collective-mining-drills-270-metres-103000876.html,"Collective Mining Ltd. (TSXV: CNL) (OTCQX: CNLMF) (""Collective"" or the ""Company"") is pleased to announce assay results for five drill holes. Two reconnaissance holes tested Target 1 to the southwest of the Apollo porphyry system (""Apollo""), while the remaining three holes were drilled into Apollo, which are all part of the Guayabales project located in Caldas, Colombia. The Apollo target area already hosts a high-grade, bulk tonnage copper-silver-gold porphyry system and six newly generated targ",CAD,CNL.V,CNW Group - Collective Mining Drills 270 Metres at 2.11 g/t Gold Equivalent from Surface at Apollo and Makes a New Discovery to the Southwest of Apollo at Target 1; Follow Up Drilling to Commence Immediately
fin_news_nlp/yahoo_cad_tickers_news,https://ca.finance.yahoo.com/news/colossus-resources-signs-letter-intent-203055311.html,"Vancouver, BC - TheNewswire - April 5, 2023 - Colossus Resources Corp. (“Colossus” or the “Company”) (TSX-V:CLUS) is pleased to announce it has entered into a Letter of Intent (the “LOI”) dated Apr...",CAD,CLUS.V,News Direct - Colossus Resources Signs Letter of Intent with Austral Gold Limited to Acquire the Calvario and Mirador Copper Porphyry Projects in Chile
fin_news_nlp/yahoo_cad_tickers_news,https://ca.finance.yahoo.com/news/commerce-resources-signs-loi-saskatchewan-070500952.html,"Commerce Resources Corp.(TSXv:CCE)(FSE:D7H0)(OTCQX:CMRZF) (the ""Company"" or ""Commerce"") is pleased to announce the signing of a Letter of Intent with the Saskatchewan Research Council (SRC) to deliver amounts of the Mixed Rare Earth Carbonate (""MREC"") produced from the Ashram Rare Earth and Fluorspar Deposit (""Ashram Deposit"") to their Rare Earth Processing Facility in Saskatoon, SK.",CAD,CCE.V,ACCESSWIRE - Commerce Resources Signs LOI with the Saskatchewan Research Council for Mixed Rare Earth Carbonate
fin_news_nlp/yahoo_cad_tickers_news,https://ca.finance.yahoo.com/news/composite-alliance-group-announces-appointment-211800500.html,"Calgary, Alberta--(Newsfile Corp. - July 6, 2023) - Composite Alliance Group Inc. (TSXV: CAG) (the ""Company"" or ""CAG"") announces that, further to its news release dated May 17, 2023, subject to regulatory approval, Vishwa Mootooveeren has been appointed as Chief Financial Officer of the Company.Vishwa Mootooveeren is a finance and operations professional with 25 plus years experience in different industries. He is currently a consultant in the financial and fintech industry. Mr. Mootooveeren ...",CAD,CAG.V,Newsfile - Composite Alliance Group Announces Appointment of Chief Financial Officer
fin_news_nlp/yahoo_cad_tickers_news,https://ca.finance.yahoo.com/news/comprehensive-healthcare-systems-inc-announces-040000416.html,"Comprehensive Healthcare Systems Inc. (TSXV: CHS) (the ""Company"" or ""CHS""), a leading provider of healthcare benefits administration software and services, announces the resignation of Mr Alex McAulay as the Chief Financial Officer, effective, May 2nd, 2023, and the appointment of Mr. Kevin Waters as the interim Chief Financial Officer, effective May 4th, 2023.",CAD,CHS.V,CNW Group - COMPREHENSIVE HEALTHCARE SYSTEMS INC. ANNOUNCES APPOINTMENT OF INTERIM CHIEF FINANCIAL OFFICER
fin_news_nlp/yahoo_cad_tickers_news,https://ca.finance.yahoo.com/news/condor-receives-us-1millon-payment-175500878.html,"Condor Resources Inc. - (""Condor"" or the ""Company"") (TSXV:CN) is pleased to advise that it has received the June 23, 2023 payment from Chakana Copper Corp. (""Chakana"") pursuant to Chakana's option to acquire a 100% interest in the Company's Soledad concessions in Peru.",CAD,CN.V,ACCESSWIRE - Condor Receives US$1millon Payment on Soledad Project
fin_news_nlp/yahoo_cad_tickers_news,https://ca.finance.yahoo.com/news/firstfund-holds-agm-grants-stock-235000910.html,"Consolidated Firstfund Capital Corp. (TSXV: FFP) (the ""Company"" or ""Firstfund"") is pleased to announce that shareholders re-elected Cheryl A. Grant, W. Douglas Grant, Bruce J. McDonald and Stuart E. Pennington as Directors of the Company for the ensuing year and approved all other items of business at the annual general meeting held earlier today.",CAD,FFP.V,CNW Group - FIRSTFUND HOLDS AGM AND GRANTS STOCK OPTIONS
fin_news_nlp/yahoo_cad_tickers_news,https://ca.finance.yahoo.com/news/consolidated-uranium-announces-private-placement-203900576.html,"Not for distribution to United States Newswire Services or for dissemination in the United States TORONTO, July 05, 2023 (GLOBE NEWSWIRE) -- Consolidated Uranium Inc. (“CUR”, the “Company” or “Consolidated Uranium”) (TSXV: CUR) (OTCQX: CURUF) is pleased to announce that further to its press release on May 24, 2023 regarding the creation and planned spin-out (the “Spin-Out”) of Premier American Uranium Inc. (“PUR”), CUR has entered into an agreement with Red Cloud Securities Inc. to act as lead a",CAD,CUR.V,GlobeNewswire - Consolidated Uranium Announces Private Placement by Premier American Uranium Inc. for Proceeds of at least C$10.35 Million
fin_news_nlp/yahoo_cad_tickers_news,https://ca.finance.yahoo.com/news/copaur-minerals-drilling-third-strategic-141700842.html,"Vancouver, British Columbia--(Newsfile Corp. - July 13, 2023) - CopAur Minerals Inc. (TSXV: CPAU) (OTCQX: COPAF) (""CopAur"" or the ""Company"") is pleased to announce that it has completed the first two core holes for a total of 607 metres of infill drilling (KMR23-01, and KMR23-02) targeting the high-grade Western Flank Zone (WFZ). Drilling is now underway on the third planned core hole KMR23-03 at the Kinsley Ridge IP geophysical target discovered in 2021, (Figure 1) The ...",CAD,CPAU.V,Newsfile - CopAur Minerals Drilling Third Strategic Hole and Mobilizing Second Drill at Kinsley Mountain Gold Project
fin_news_nlp/yahoo_cad_tickers_news,https://ca.finance.yahoo.com/news/copper-fox-announces-2-000-100000387.html,"Calgary, Alberta--(Newsfile Corp. - July 18, 2023) - Copper Fox Metals Inc. (TSXV: CUU) (OTCQX: CPFXF) (""Copper Fox"" or the ""Company"") is pleased to announce that it intends to complete, subject to the approval of the TSX Venture Exchange, a non-brokered private placement to raise up to $2,000,000 in gross proceeds (the ""Offering""). The Offering will consist of up to 8,000,000 units (each a ""Unit"") at a price of $0.25 per Unit. Each Unit will ...",CAD,CUU.V,"Newsfile - Copper Fox Announces $2,000,000 Non-Brokered Private Placement"
fin_news_nlp/yahoo_cad_tickers_news,https://ca.finance.yahoo.com/news/copper-lake-identifies-priority-targets-113000896.html,"PRIORITY 1: EAST-WEST BUILD-UP CONDUCTOR The East-West Build-up Conductor Comprises a High-Priority Exploration Target Area PRIORITY 2: MAGNETO-TELLURIC (MT) TARGET The MT survey delineated a strong conductor (magenta colors) that persists to depths of greater than one (1)kilometre VMS MODEL FOR MARSHALL LAKE VMS MODEL FOR MARSHALL LAKE TORONTO, July 19, 2023 (GLOBE NEWSWIRE) -- Copper Lake Resources Ltd. (TSX-V: CPL, Frankfurt: WOI, OTC:WTCZF) (“Copper Lake” or the “Company”) is pleased to prov",CAD,CPL.V,GlobeNewswire - Copper Lake Identifies New Priority Targets and Provides Exploration Update on the Marshall Lake Copper-Zinc-Silver VMS Property
fin_news_nlp/yahoo_cad_tickers_news,https://ca.finance.yahoo.com/news/coppercorp-awarded-razorback-ree-cu-120000594.html,"Vancouver, British Columbia--(Newsfile Corp. - June 6, 2023) - CopperCorp Resources Inc. (TSXV: CPER) (OTCQB: CPCPF) (""CopperCorp"" or the ""Company"") is pleased to announce that its wholly-owned subsidiary, Georgina Resource Pty Ltd, has been named as the successful recipient for exploration licence EL8/2023 (the ""Razorback Project""), located south of the Mt Lyell copper mine in western Tasmania, Australia (see Table 1 and Figure 1). The licence was awarded to the Company following its ...",CAD,CPER.V,"Newsfile - CopperCorp Awarded Razorback REE and Cu-Au Project in Tasmania, Australia with Historical Drilling Intercepts of 30.0m @ 2.1% TREO & 13.4m @ 1.6% Cu and 1.6 g/t Au"
fin_news_nlp/yahoo_cad_tickers_news,https://ca.finance.yahoo.com/news/cordoba-minerals-reports-additional-fill-113000676.html,"ACD174 Reports 140.9 Metres of 0.70% Copper Equivalent1 (0.42% Copper, 0.5 g/t Gold and 2.71 g/t Silver)ACD177* Reports 223.00 Metres of 0.60% Copper Equivalent1 (0.47% Copper, 0.25 g/t Gold and 3.85 g/t Silver)Vancouver, British Columbia--(Newsfile Corp. - May 9, 2023) - Sarah Armstrong-Montoya, President and Chief Executive Officer of Cordoba Minerals Corp. (TSXV: CDB) (OTCQB: CDBMF) (otherwise ""Cordoba"" or the ""Company""), is pleased to report the latest assay results received from the ongoing",CAD,CDB.V,Newsfile - Cordoba Minerals Reports Additional In-fill Drilling Results from the Alacran Copper-Gold-Silver Project in Colombia
fin_news_nlp/yahoo_cad_tickers_news,https://ca.finance.yahoo.com/news/corsa-coal-announces-results-annual-210000360.html,"Corsa Coal Corp. (TSXV: CSO) (OTCQX: CRSXF) (""Corsa"" or the ""Company"") today announced the results of its annual and special meeting of shareholders held earlier today (the ""Meeting"").",CAD,CSO.V,CNW Group - Corsa Coal Announces Results of Annual and Special Meeting
fin_news_nlp/yahoo_cad_tickers_news,https://ca.finance.yahoo.com/news/cotec-holdings-corp-engages-hybrid-110000088.html,"CoTec Holdings Corp. (TSXV:CTH)(OTCQB:CTHCF) (""CoTec"" or the ""Company"") is pleased to announce that it has retained Hybrid Financial Ltd. (""Hybrid""). The service provided by Hybrid to the Company is a database of Registered Financial Professionals in North America. Hybrid is not promoting the specific purchase or sale of securities.",CAD,CTH.V,ACCESSWIRE - CoTec Holdings Corp. Engages Hybrid Financial Ltd.
fin_news_nlp/yahoo_cad_tickers_news,https://ca.finance.yahoo.com/news/premier-medical-journal-spotlights-covalon-113000780.html,"MISSISSAUGA, Ontario, July 18, 2023--Journal of Association for Vascular Access article on sources of CVAD contamination as a major contributor to CLABSI highlights VALGuard as a solution",CAD,COV.V,Business Wire - Premier Medical Journal Spotlights Covalon’s VALGUARD: A Novel Solution to Long-Standing Problem of Protecting Vascular Access Sites
fin_news_nlp/yahoo_cad_tickers_news,https://ca.finance.yahoo.com/news/criterium-energy-announces-pricing-public-213100458.html,"Calgary, Alberta--(Newsfile Corp. - July 4, 2023) - Criterium Energy Ltd. (TSXV: CEQ) (""Criterium"" or the ""Company""), an independent upstream energy development and production company focused in Southeast Asia, is pleased to announce the pricing of its previously announced marketed public offering (the ""Offering"") of subscription receipts of the Company (the ""Subscription Receipts"") at a price of C$0.20 per Subscription Receipt, for aggregate gross proceeds of up to C$22 million (equivalent to U",CAD,CEQ.V,Newsfile - Criterium Energy Announces Pricing of Public Offering in Connection with Transformative Acquisition
fin_news_nlp/yahoo_cad_tickers_news,https://ca.finance.yahoo.com/news/crown-point-announces-issuance-us-201700037.html,"CALGARY, Alberta, July 19, 2023 (GLOBE NEWSWIRE) -- TSX-V: CWV: Crown Point Energy Inc. (""Crown Point"", the ""Company"" or ""we"") is pleased to announce that its wholly-owned Argentine subsidiary, Crown Point Energía S.A. (""CPE""), has issued a total of US$7,476,000 principal amount of Series IV unsecured fixed-rate notes (""Series IV Notes""), which are denominated in US$, payable in Pesos, and due 24 months after the issue date (the ""Offering""). The principal amount of the Series IV Notes will be re",CAD,CWV.V,"GlobeNewswire - Crown Point Announces Issuance of US$7,476,000 of Series IV Notes"
fin_news_nlp/yahoo_cad_tickers_news,https://ca.finance.yahoo.com/news/current-water-technologies-inc-signs-213000820.html,"GUELPH, Ontario, June 23, 2023 (GLOBE NEWSWIRE) -- Current Water Technologies Inc. (TSX-V: WATR) (""CWTI"" or ""the Company"" or ""the Corporation""), is pleased to announce the signing of the Definitive Sales and Marketing Joint-Venture Agreement with ecoX Global Pte. Ltd. (formerly Separtis Technologies Global Pte Ltd) of Singapore. The joint-venture company is being incorporated in Singapore under the name WATR-H2 Pte. Ltd. CWTI is an emerging technology leader in the production of “GREEN HYDROGEN”",CAD,WATR.V,GlobeNewswire - Current Water Technologies Inc. Signs Definitive Sales and Licensing Joint Venture Agreement With Singapore-Based ecoX Global Pte Ltd (Formerly Separtis Technologies Global Pte Ltd)
fin_news_nlp/yahoo_cad_tickers_news,https://ca.finance.yahoo.com/news/cybercatch-proficio-announce-strategic-partnership-123000462.html,"CyberCatch Holdings, Inc. (""CyberCatch'') (TSXV: CYBE), an innovative cybersecurity company offering an AI-enabled platform solution for continuous compliance and cyber risk mitigation and Proficio (""Proficio""), a global leading provider of Managed Detection and Response (MDR) services, are pleased to announce a strategic partnership to join forces to market and deliver a unique combined AI-enabled solution for organizations worldwide.",CAD,CYBE.V,CNW Group - CyberCatch and Proficio Announce Strategic Partnership That Provides Unique Combined AI-Enabled Continuous Cybersecurity Compliance and Managed Detection and Response (MDR) Solution Globally
fin_news_nlp/yahoo_cad_tickers_news,https://ca.finance.yahoo.com/news/cypress-hills-corp-provides-1-183900213.html,"Vancouver, British Columbia--(Newsfile Corp. - May 29, 2023) - Cypress Hills Resource Corp. (TSXV: CHY) (the ""Company"") announces that further to its press release of April 17, 2023, the non-brokered private placement (the ""Private Placement"") of up to 15,000,000 shares at a price of C$0.09 per share remains ongoing and, subject to TSX Venture Exchange (""Exchange"") approval, is expected to close at the end of June 2023.Proceeds of the Private Placement will be used ...",CAD,CHY.V, - Cypress Hills Resource Corp. Provides Update on $1.35 Million Non-Brokered Private Placement Financing
fin_news_nlp/yahoo_cad_tickers_news,https://ca.finance.yahoo.com/news/davidstea-expands-tea-bar-rollout-120000130.html,"DAVIDsTEA Inc. (TSXV: DTEA) (""DAVIDsTEA"" or the ""Company), a leading tea merchant in North America, is pleased to announce the opening of its first in-store Tea Bar outside of the Quebec market on June 16th with a location in their Toronto Eaton Centre store. Responding to consumer demand, the specialty tea retailer first soft launched the Tea Bar concept in its home province of Quebec within the existing store in CF Carrefour Laval in late 2022 and in the Les Galeries de la Capitale store in ea",CAD,DTEA.V,CNW Group - DAVIDsTEA Expands Tea Bar Rollout on a National Scale
fin_news_nlp/yahoo_cad_tickers_news,https://ca.finance.yahoo.com/news/decade-announces-non-brokered-private-203100701.html,"Stewart, British Columbia--(Newsfile Corp. - July 6, 2023) - Decade Resources Ltd (TSXV: DEC) (""Decade"" or the Company) is pleased to announce a non-brokered private placement of flow-through shares to raise aggregate gross proceeds of up to $273,400.The flow-through offering will comprise up to 2,485,455 flow-through units, at a price of $0.11 per flow-through unit, for gross proceeds of up to $273,400. Each unit will comprise one common share and one transferable common share ...",CAD,DEC.V,Newsfile - Decade Announces Non-Brokered Private Placement
fin_news_nlp/yahoo_cad_tickers_news,https://ca.finance.yahoo.com/news/decibel-announces-results-agm-120000929.html,"Decibel Cannabis Company Inc. (the ""Company"" or ""Decibel"") (TSXV: DB) (OTCQB: DBCCF), a market leader in premium cannabis and extract manufactured products, announces the results of its annual general meeting of shareholders (""Shareholders"") held on July 5, 2023 (the ""Meeting"").",CAD,DB.V,CNW Group - Decibel Announces Results of AGM
