source,url,description,country,company,title
fin_news_nlp/yahoo_cad_tickers_news,https://ca.finance.yahoo.com/news/aclara-secures-100-recycled-water-123000122.html,"/ Aclara Resources Inc. (""Aclara"" or the ""Company"") (TSX:ARA) is pleased to announce that it has successfully secured a recycled water source, which fulfills the full water requirement of the Penco Module (the ""Project"").",CAD,ARA.TO,ACCESSWIRE - Aclara Secures New 100% Recycled Water Source for the Penco Module as Part of Its Enhanced EIA Application
fin_news_nlp/yahoo_cad_tickers_news,https://ca.finance.yahoo.com/news/acuityads-confirms-monies-recovered-silicon-120500326.html,"TORONTO and NEW YORK, March 16, 2023 (GLOBE NEWSWIRE) -- AcuityAds Holdings Inc. (TSX:AT, Nasdaq: ATY) (“AcuityAds” or “Company”), a technology leader that provides targeted digital media solutions enabling advertisers to connect intelligently with audiences across advertising channels, today provided an update on its previously disclosed cash deposits with Silicon Valley Bank (SVB). The Company is pleased to report that all monies mentioned in its press release dated March 10, 2023, have been r",CAD,AT.TO,GlobeNewswire - AcuityAds Confirms All Monies Recovered from Silicon Valley Bank
fin_news_nlp/yahoo_cad_tickers_news,https://ca.finance.yahoo.com/news/pharmanovia-market-ghryvelin-macimorelin-european-120500654.html,"Pharmanovia to acquire license to GHRYVELIN™ from Aeterna Zentaris’ existing licensee, Consilient Health, effective immediately TORONTO, ONTARIO, March 16, 2023 (GLOBE NEWSWIRE) -- Aeterna Zentaris Inc. (NASDAQ: AEZS) (TSX: AEZS) (“Aeterna” or the “Company”), a specialty biopharmaceutical company developing and commercializing a diversified portfolio of pharmaceutical and diagnostic products, today announced that Pharmanovia, a global lifecycle management healthcare company, has acquired from th",CAD,AEZS.TO,GlobeNewswire - Pharmanovia to Market GHRYVELIN™ (Macimorelin) in the European Economic Area (EEA) and UK as Diagnostic Test for Growth Hormone Deficiency (GHD)
fin_news_nlp/yahoo_cad_tickers_news,https://ca.finance.yahoo.com/news/canacol-energy-ltd-announces-dividend-110000100.html,"CALGARY, Alberta, March 16, 2023 (GLOBE NEWSWIRE) -- Canacol Energy Ltd. (""Canacol"" or the ""Corporation"") (TSX:CNE) (OTCQX:CNNEF) (BVC:CNEC) announced that it has declared a dividend of CAD$.26 per share, payable on April 17, 2023, to shareholders of record at the close of business on March 31, 2023. This dividend qualifies as an 'eligible dividend' for Canadian income tax purposes. The declaration, timing, amount and payment of future dividends remain at the discretion of the Board of Directors",CAD,CNE.TO,GlobeNewswire - Canacol Energy Ltd. Announces Dividend
fin_news_nlp/yahoo_cad_tickers_news,https://ca.finance.yahoo.com/news/ci-global-asset-management-announces-110000562.html,"TORONTO, March 16, 2023--CI Global Asset Management announces the regular cash distributions for CI ETFs for the month or quarter ending March 31, 2023.",CAD,CIX.TO,Business Wire - CI Global Asset Management Announces March 2023 Distributions for CI ETFs
fin_news_nlp/yahoo_cad_tickers_news,https://ca.finance.yahoo.com/news/coveo-announces-industry-first-relevance-120000230.html,"New Relevance Generative Answering capability, powered by the Coveo AI platform and LLMs, solves the key challenges of applying GPT within the enterprise Coveo Announces Industry-first Relevance Generative Answering Capability Into its Coveo Relevance Cloud™ AI Platform Coveo Announces Industry-first Relevance Generative Answering Capability Into its Coveo Relevance Cloud™ AI Platform MONTREAL and SAN FRANCISCO, March 16, 2023 (GLOBE NEWSWIRE) -- Coveo (TSX:CVO), an AI platform that makes every",CAD,CVO.TO,GlobeNewswire - Coveo Announces Industry-first Relevance Generative Answering Capability Into its Coveo Relevance Cloud™ AI Platform
fin_news_nlp/yahoo_cad_tickers_news,https://ca.finance.yahoo.com/news/notice-crown-capital-q4-2022-120000012.html,"Crown Capital Partners Inc. (""Crown"" or the ""Corporation"") (TSX: CRWN), a capital partner to entrepreneurs and growth businesses, today announced it will host a conference call to discuss its 2022 fourth quarter and full year financial results on March 21, 2023 at 11:30 a.m. EST. The call will be hosted by Chris Johnson, President and Chief Executive Officer, and Michael Overvelde, Chief Financial Officer.",CAD,CRWN.TO,CNW Group - Notice of Crown Capital Q4 2022 Results Conference Call
fin_news_nlp/yahoo_cad_tickers_news,https://ca.finance.yahoo.com/news/enthusiast-gaming-announce-fourth-quarter-110000418.html,"LOS ANGELES, March 16, 2023 (GLOBE NEWSWIRE) -- Enthusiast Gaming Holdings Inc. (“Enthusiast Gaming” or the “Company”) (NASDAQ:EGLX; TSX:EGLX) will report financial and operating results for its fourth quarter and year ended December 31, 2022, on Monday, March 27, 2023, after the market closes. Management will host a conference call and webcast on March 27, 2023, at 5:00 p.m. ET to review and discuss the fourth quarter and year-end 2022 results. Conference call details: Toll Free: 1-855-239-1101",CAD,EGLX.TO,GlobeNewswire - Enthusiast Gaming to Announce Fourth Quarter and Year-End 2022 Results
fin_news_nlp/yahoo_cad_tickers_news,https://ca.finance.yahoo.com/news/fansunite-announces-closing-3-04-110000308.html,"Vancouver, British Columbia--(Newsfile Corp. - March 16, 2023) - FansUnite Entertainment Inc. (TSX: FANS) (""FansUnite"" or the ""Company"") is pleased to announce that the Company has completed its previously announced non-brokered private placement (the ""Offering""). Pursuant to the Offering, the Company issued an aggregate of 37,976,242 units of the Company (the ""Units"") at an issue price of $0.08 per Unit for aggregate gross proceeds of approximately $3.04 million. The Offering was led by Tekkorp",CAD,FANS.TO,Newsfile - FansUnite Announces Closing of $3.04 Million Private Placement Led by Strategic Investor Tekkorp Capital
fin_news_nlp/yahoo_cad_tickers_news,https://ca.finance.yahoo.com/news/guru-organic-energy-announces-first-110000949.html,"Continued consumer purchases (scanned retail sales) growth of 24% for the 52 weeks ended January 28, 20231 Q1 2023 net revenue decreased to $5.0 million, compared to $7.0 million in Q1 2022, mainly due to the remaining balance of an initial pipeline fill in Q1 2022 and a reduction in inventory on hand by the exclusive Canadian distributor in Q1 2023Sustained strong gross margin of 53.7% in Q1 2023, compared to 54.5% in Q1 2022 Adjusted EBITDA2 loss of $2.6 million in Q1 2023, versus a $3.0 milli",CAD,GURU.TO,GlobeNewswire - GURU Organic Energy Announces First Quarter 2023 Financial Results
fin_news_nlp/yahoo_cad_tickers_news,https://ca.finance.yahoo.com/news/imperial-vice-president-downstream-chemicals-115500501.html,"CALGARY, Alberta, March 16, 2023--Imperial (TSE: IMO, NYSE American: IMO) announced today that J.R. (Jon) Wetmore, currently Vice President, Downstream and Chemicals for Imperial will become the Americas Fuels Value Chain Planning & Business Development Manager for Exxon Mobil Corporation, effective May 1, 2023.",CAD,IMO.TO,"Business Wire - Imperial Vice President, Downstream and Chemicals to assume new role at Exxon Mobil Corporation"
fin_news_nlp/yahoo_cad_tickers_news,https://ca.finance.yahoo.com/news/imv-inc-announces-strategic-well-110500479.html,"DARTMOUTH, Nova Scotia & CAMBRIDGE, Mass., March 16, 2023--IMV Inc. (Nasdaq: IMV; TSX: IMV) (""IMV"" or ""the Company""), a clinical-stage company developing a portfolio of immune-educating therapies based on its novel DPX platform to treat solid and hematologic cancers, today announced alongside the release of its fourth quarter and annual results that it has engaged Stonegate Healthcare Partners, L.L.C (""Stonegate"") to explore strategic alternatives following a review of its business.",CAD,IMV.TO,Business Wire - IMV Inc. Announces Strategic Update as well as Fourth Quarter and Full Year 2022 Financial and Operational Results
fin_news_nlp/yahoo_cad_tickers_news,https://ca.finance.yahoo.com/news/time-consider-buying-information-services-124755957.html,"Information Services Group, Inc. ( NASDAQ:III ), might not be a large cap stock, but it saw a double-digit share price...",CAD,ISV.TO,"Simply Wall St. - Is It Time To Consider Buying Information Services Group, Inc. (NASDAQ:III)?"
fin_news_nlp/yahoo_cad_tickers_news,https://ca.finance.yahoo.com/news/ivanhoe-electric-identifies-visible-soluble-110000486.html,"Ivanhoe Electric (NYSE American:IE)(TSX:IE) Executive Chairman Robert Friedland and President and Chief Executive Officer Taylor Melvin are pleased to provide an update on drilling operations, including visual confirmation of the presence of soluble copper mineralization at the Typhoon™-identified Texaco Ridge Exploration Area, within the Santa Cruz Copper Project, located west of Casa Grande, Arizona.",CAD,IE.TO,ACCESSWIRE - Ivanhoe Electric Identifies Visible Soluble Copper Mineralization at Texaco Ridge Step-Out Exploration Drill Hole
fin_news_nlp/yahoo_cad_tickers_news,https://ca.finance.yahoo.com/news/notice-knight-therapeutics-fourth-quarter-113000385.html,"MONTREAL, March 16, 2023 (GLOBE NEWSWIRE) -- Knight Therapeutics Inc. (TSX: GUD) (“Knight”), a leading pan-American (ex-USA) specialty pharmaceutical company, will release its fourth quarter and year end 2022 financial results on Thursday, March 23, 2023 prior to market opening. Following the release, Knight will hold a conference call and audio webcast. Knight cordially invites all interested parties to participate in this call. Date: Thursday, March 23, 2023 Time: 8:30 a.m. ET Telephone: Toll",CAD,GUD.TO,GlobeNewswire - Notice of Knight Therapeutics' Fourth Quarter and Year End 2022 Results Conference Call
fin_news_nlp/yahoo_cad_tickers_news,https://ca.finance.yahoo.com/news/mineros-announces-positive-prefeasibility-study-110000311.html,"Mineros S.A. (TSX: MSA) (CB: MINEROS) (""Mineros"" or the ""Company"") is pleased to announce that a positive prefeasibility study (""PFS"") has been completed on the gold-silver-zinc Porvenir Project (the ""Porvenir Project"" or ""Porvenir"") on its Hemco Property (the ""Hemco Property""), in northeastern Nicaragua, significantly increasing the mine life of the Hemco Property Mineral Reserves from five to thirteen years. In addition to the Porvenir Project, the Hemco Property includes the Panama and Pionee",CAD,MSA.TO,"CNW Group - Mineros Announces Positive Prefeasibility Study Results for  its Porvenir Project, Hemco Property, Nicaragua"
fin_news_nlp/yahoo_cad_tickers_news,https://ca.finance.yahoo.com/news/nighthawk-gold-announces-2023-exploration-115800888.html,"TORONTO, March 16, 2023--Nighthawk Gold Corp. (""Nighthawk"" or the ""Company"") (TSX: NHK; OTCQX: MIMZF) announces its 2023 Exploration and environmental programs at its district-scale property in Northwest Territories, Canada. Furthermore, the Company is pleased to announce the filing of its Technical Report (defined below) for the previously announced updated Mineral Resource Estimate1 (""2023 MRE"") of the Colomac Gold Project (the ""Project"").",CAD,NHK.TO,Business Wire - Nighthawk Gold Announces 2023 Exploration and Environmental Programs and Files the Technical Report for the 2023 MRE
fin_news_nlp/yahoo_cad_tickers_news,https://ca.finance.yahoo.com/news/niocorp-gains-access-much-71-120700382.html,"NioCorp Developments Ltd. (""NioCorp"" or the ""Company"") (TSX: NB) (OTCQX: NIOBF) is pleased to announce that it expects to have access to as much as $71.9 million in net proceeds over the next three years following the completion of the transactions contemplated by the Business Combination Agreement, dated September 25, 2022 (the ""Business Combination Agreement""), among NioCorp, GX Acquisition Corp. II (Nasdaq: GXII) (""GX"") and Big Red Merger Sub Ltd (the ""Transaction""), and two separate financin",CAD,NB.TO,CNW Group - NioCorp Gains Access to as Much as $71.9 Million in Net Proceeds Over the Next Three Years from its SPAC Transaction and Two Additional Financings as it Prepares to Launch Trading on the Nasdaq Stock Market
fin_news_nlp/yahoo_cad_tickers_news,https://ca.finance.yahoo.com/news/osisko-announces-definitive-agreement-miyuukaa-120000798.html,"Hook-up expected Q1-2024TORONTO, March 16, 2023 (GLOBE NEWSWIRE) -- Osisko Mining Inc. (OSK:TSX. ""Osisko"" or the ""Corporation"") is pleased to announce that it has concluded the previously announced binding term sheet agreement and signed a definitive agreement with Miyuukaa Corp. (""Miyuukaa""), a wholly-owned corporation of the Cree First Nation of Waswanipi (""CFNW""), with respect to the construction of proposed transmission facilities and the transport of hydroelectric power to the Windfall Proj",CAD,OSK.TO,GlobeNewswire - Osisko Announces Definitive Agreement With Miyuukaa to Transport Hydroelectric Power to Windfall Project
fin_news_nlp/yahoo_cad_tickers_news,https://ca.finance.yahoo.com/news/gen3-purevap-qrr-pilot-plant-113000006.html,"MONTREAL, March 16, 2023 (GLOBE NEWSWIRE) -- HPQ Silicon Inc. (“HPQ” or the “Company”) (TSX-V: HPQ) (OTCQX: HPQFF) (FRA: O08), a technology company engaged in green engineering processes for producing silica and silicon material, would like to inform shareholders of the two (2) major milestones reached as we continue with series #1 (January 19, 2023 release) of the GEN3 PUREVAP™ Quartz Reduction Reactor (QRR) (“GEN3 QRR”) (“Pilot Plant”) testing and validation program. Technology provider PyroGe",CAD,PYR.TO,GlobeNewswire - GEN3 PUREVAP™ QRR Pilot Plant Validation: Purity and Process Milestones Reached Ahead of Schedule
fin_news_nlp/yahoo_cad_tickers_news,https://ca.finance.yahoo.com/news/real-matters-announces-cfo-transition-113000991.html,"TORONTO, March 16, 2023--Real Matters Inc. (""Real Matters"" or the ""Company""), a leading network management services platform for the mortgage and insurance industries, today announced the appointment of Rodrigo Pinto as Executive Vice President and Chief Financial Officer effective April 10, 2023. Mr. Pinto succeeds William (Bill) Herman who has notified the Company of his intention to pursue other opportunities. Mr. Herman will remain at the Company through May 5, 2023, to support a seamless tr",CAD,REAL.TO,Business Wire - Real Matters Announces CFO Transition
fin_news_nlp/yahoo_cad_tickers_news,https://ca.finance.yahoo.com/news/sylogist-discuss-performance-fiscal-2022-120000476.html,"Calgary, Alberta--(Newsfile Corp. - March 16, 2023) - Sylogist Ltd. (TSX: SYZ) (""Sylogist"" or the ""Company""), a leading public sector SaaS company, is pleased to announce that its financial statements for the final quarter of Fiscal 2022 will be released before markets open on March 23rd, 2023. The Company will host a conference call at 9:00 AM Eastern Time on March 23rd, 2023. Bill Wood, Sylogist's President and Chief Executive Officer, and Xavier Shorter, ...",CAD,SYZ.TO,Newsfile - Sylogist to Discuss Performance for Fiscal 2022
fin_news_nlp/yahoo_cad_tickers_news,https://ca.finance.yahoo.com/news/real-brokerage-inc-announces-fourth-113300947.html,"TORONTO & NEW YORK, March 16, 2023--The Real Brokerage Inc. (TSX: REAX) (NASDAQ: REAX), the fastest-growing publicly traded real estate brokerage, announced results for its fourth quarter and full year ended December 31, 2022.",CAD,REAX.TO,Business Wire - The Real Brokerage Inc. Announces Fourth Quarter and Full Year 2022 Financial Results
fin_news_nlp/yahoo_cad_tickers_news,https://ca.finance.yahoo.com/news/sweetwater-brewing-company-brings-back-110000633.html,"The Fruity, Refreshing Ale is The Perfect Beer for The Spring Season SweetWater's Most Requested Triple Tail IPA Returns for Spring 2023 Loaded with triple dry hop additions of Mosaic, Denali and Waimea hops, Triple Tail (5.5% alcohol by volume) delivers a fruity hop burst of tangerine, papaya, and pineapple notes with a clean bitterness and fluffy, fragrant head. ATLANTA, March 16, 2023 (GLOBE NEWSWIRE) -- SweetWater Brewing Company, Atlanta’s craft beer trailblazer and 10th largest craft brewe",CAD,TLRY.TO,GlobeNewswire - SweetWater Brewing Company Brings Back Popular Triple Tail Tropical India Pale Ale
fin_news_nlp/yahoo_cad_tickers_news,https://ca.finance.yahoo.com/news/td-announces-interim-financed-emissions-105000012.html,"Today TD Bank Group (TD or the Bank) reaffirmed its focus on helping drive progress towards an inclusive and sustainable future by releasing additional interim 2030 Scope 3 financed emission targets and sharing its newly established social framework, TD Pathways to Economic Inclusion. These new initiatives are included in the Bank's 2022 ESG Report, which was published today alongside its 2022 Climate Action Plan Report and 2022 TD Ready Commitment Report. As part of its ongoing efforts to suppo",CAD,TD.TO,CNW Group - TD announces new interim financed emissions targets and TD Pathways to Economic Inclusion as part of its continued efforts to advance a sustainable and inclusive future
fin_news_nlp/yahoo_cad_tickers_news,https://ca.finance.yahoo.com/news/arianne-phosphate-sells-james-bay-120000809.html,"Arianne Phosphate (the ""Company"" or ""Arianne"") (TSXV: DAN) (OTCQX: DRRSF) (FRANKFURT: JE9N), a development-stage phosphate mining company, advancing the Lac à Paul project in Quebec's Saguenay-Lac-Saint-Jean region, is pleased to announce that it has sold royalties covering 25 claims in the James Bay area to Lithium Royalty Corp. for $2,350,000. The royalty, retained by Arianne as part of an earn-in option agreement first entered into in 2009, provided for a 1.5% NSR on the property. These claim",CAD,DAN.V,"CNW Group - ARIANNE PHOSPHATE SELLS ITS JAMES BAY AREA ROYALTY FOR $2,350,000"
fin_news_nlp/yahoo_cad_tickers_news,https://ca.finance.yahoo.com/news/cloud-dx-continues-q1-growth-121000111.html,"Cloud DX (TSXV:CDX)(OTC:CDXFF),a leading health data platform, announces the expansion of 5 existing remote patient monitoring contracts, strengthening its reputation as a top provider of remote patient monitoring in North America.",CAD,CDX.V,ACCESSWIRE - Cloud DX Continues Q1 Growth with 5 New Contracts
fin_news_nlp/yahoo_cad_tickers_news,https://ca.finance.yahoo.com/news/crown-point-energy-full-2022-124201345.html,Crown Point Energy ( CVE:CWV ) Full Year 2022 Results Key Financial Results Revenue: US$26.5m (up 16% from FY 2021...,CAD,CWV.V,Simply Wall St. - Crown Point Energy Full Year 2022 Earnings: US$0.08 loss per share (vs US$0.13 profit in FY 2021)
fin_news_nlp/yahoo_cad_tickers_news,https://ca.finance.yahoo.com/news/correcting-replacing-eagle-plains-clarifies-110000429.html,"Further to its news release dated March 1, 2023 (""News Release""), Eagle Plains Resources Ltd. (TSXV:EPL) (""EPL"" or ""Eagle Plains"") wishes to clarify a statement made in the News Release relating to the record date for the proposed Spin-Out Transaction (as defined in the News Release).",CAD,EPL.V,ACCESSWIRE - CORRECTING AND REPLACING: Eagle Plains Clarifies Record Date Details for Proposed Spin-Out Transaction
fin_news_nlp/yahoo_cad_tickers_news,https://ca.finance.yahoo.com/news/edgeti-ceo-provides-2023-outlook-115800990.html,"Software Firm Positioned to Operationalize AI and Other Digital InnovationsARLINGTON, Va., March 16, 2023 (GLOBE NEWSWIRE) -- Edge Total Intelligence Inc. (“edgeTI”, “We”, “Our” or the “Company”) (TSXV: CTRL, OTCQB: UNFYF, FSE: Q5i), a leader in real-time digital operations software, provides the following 2023 outlook to shareholders, customers, and prospective investors. This interim update highlights market trends and progress as well as important initiatives edgeTI™ has underway and planned",CAD,CTRL.V,GlobeNewswire - edgeTI’s CEO Provides 2023 Outlook and Path Forward
fin_news_nlp/yahoo_cad_tickers_news,https://ca.finance.yahoo.com/news/elevation-gold-intersects-100-58-110000549.html,"Elevation Gold Mining Corporation (TSXV: ELVT) (OTCQX: EVGDF) (the ""Company"" or ""Elevation Gold"") is pleased to provide initial results from its recent reverse circulation (""RC"") resource definition and expansion drilling program at Moss Mine and provide an update on its recent greenfields exploration core drilling program. (See Figure 1: Map of Drill Project Locations)",CAD,ELVT.V,CNW Group - Elevation Gold Intersects 100.58-Meter-Thick Zone with Average Grade of 0.50 g/t Gold in the Reynolds Pit Area West of Active Mining and Provides Update on Greenfields Core Drilling Program
fin_news_nlp/yahoo_cad_tickers_news,https://ca.finance.yahoo.com/news/fobi-signs-120-000-pulseir-120000368.html,"VANCOUVER, BC, March 16, 2023 (GLOBE NEWSWIRE) -- Fobi AI Inc. (FOBI:TSXV) (FOBIF:OTCQB) (the ""Company"" or ""Fobi""), an industry leader in harnessing AI and data intelligence to enable digital transformation, is pleased to announce that the company’s wholly-owned subsidiary, PulseIR, has signed a new deal with courier and logistics company, ParcelPal Logistics Inc. ParcelPal specializes in providing last-mile delivery and logistics solutions across various industries, including pharmacy and healt",CAD,FOBI.V,"GlobeNewswire - Fobi Signs New $120,000 PulseIR Deal With ParcelPal Logistics Inc."
fin_news_nlp/yahoo_cad_tickers_news,https://ca.finance.yahoo.com/news/inx-announces-integration-polygon-131300108.html,"The INX Digital Company, Inc. (NEO: INXD, INXATS: INX, OTCQB: INXDF) (""INX""), a broker-dealer and inter-dealer broker, has announced today its full support of the Polygon Blockchain for secondary listings on INX.One - the world's first and only fully-regulated, end-to-end platform for listing and trading both SEC-registered security tokens and cryptocurrencies. The addition of Polygon to INX's ATS is another milestone in the shared vision to pioneer the new digital economy by bringing real world",CAD,INX.V,CNW Group - INX ANNOUNCES INTEGRATION WITH POLYGON
fin_news_nlp/yahoo_cad_tickers_news,https://ca.finance.yahoo.com/news/japan-gold-commences-drilling-barrick-123000314.html,"Vancouver, British Columbia--(Newsfile Corp. - March 16, 2023) - Japan Gold Corp. (TSXV: JG) (OTCQB: JGLDF) (""Japan Gold"" or the ""Company"") is pleased to announce commencement of drilling at the Barrick Alliance Mizobe Project in Southern Kyushu, Japan. Mizobe is one of six projects selected by Barrick to advance to the second evaluation phase under the Strategic Alliance Agreement. HighlightsThe Mizobe Project lies within the Hokusatsu Region of southern Kyushu, along the western ...",CAD,JG.V,Newsfile - Japan Gold Commences Drilling at the Barrick-Alliance Mizobe Project in Southern Kyushu
fin_news_nlp/yahoo_cad_tickers_news,https://ca.finance.yahoo.com/news/jourdan-drill-baillarg-extensively-120000970.html,"Figure 1 Showing soil sampling stations and anomalies in warm colours. The most interesting anomalies are south of Lac Baillargé with the known pegmatites, but additional anomalies have been identified in other places within our concessions. Figure 2 Historical lithium (and other metals) showing in and around our Baillargé concessions. Source (GM 66452). TORONTO, March 16, 2023 (GLOBE NEWSWIRE) -- JOURDAN RESOURCES INC. (TSXV: JOR; OTCQB: JORFF; FRA: 2JR1) (“Jourdan” or the “Company“) is pleased",CAD,JOR.V,GlobeNewswire - Jourdan To Drill Baillargé Extensively
fin_news_nlp/yahoo_cad_tickers_news,https://ca.finance.yahoo.com/news/lifeist-closes-non-brokered-private-112600952.html,"Provides Additional Capital to Fuel Expansion of Lifeist’s Cannabis and Nutraceuticals BusinessesTHIS NEWS RELEASE IS INTENDED FOR DISTRIBUTION IN CANADA ONLY AND IS NOT INTENDED FOR DISTRIBUTION TO UNITED STATES NEWSWIRE SERVICES OR FOR DISSEMINATION IN THE UNITED STATES. TORONTO, March 16, 2023 (GLOBE NEWSWIRE) -- Lifeist Wellness Inc. (“Lifeist” or the “Company”) (TSXV: LFST) (FRANKFURT: M5B) (OTCMKTS: NXTTF), a health-tech company that leverages advancements in science and technology to buil",CAD,LFST.V,GlobeNewswire - Lifeist Closes Non-Brokered Private Placement of Secured Convertible Debentures
fin_news_nlp/yahoo_cad_tickers_news,https://ca.finance.yahoo.com/news/maple-gold-provides-exploration-prepares-113000872.html,"Vancouver, British Columbia--(Newsfile Corp. - March 16, 2023) - Maple Gold Mines Ltd. (TSXV: MGM) (OTCQB: MGMLF) (FSE: M3G) (""Maple Gold"" or the ""Company"") is pleased to provide an update on ongoing exploration activities at its 100%-controlled Eagle Mine Property (""Eagle"") located in Québec, Canada. The Company is completing a compilation of current and historical drill data, new downhole electromagnetic (""EM"") conductor data, and the regional airborne geophysical survey data acquired by the C",CAD,MGM.V,Newsfile - Maple Gold Provides Exploration Update and Prepares for Next Phase of Drilling at Eagle
fin_news_nlp/yahoo_cad_tickers_news,https://ca.finance.yahoo.com/news/metal-energy-intersects-36-55-120000123.html,"Highlights Include: MNB040A: 36.55 metres of 1.13% NiEq, including 19.45 m of 1.69% NiEqMNB039: 36.2 metres of 0.69% NiEq including 12.15 m of 1.14% NiEqNew high-grade nickel zone demonstrates the discovery potential for multiple high-grade nickel shoots within the broader mineralized shell at Manibridge. Toronto, Ontario--(Newsfile Corp. - March 16, 2023) - Metal Energy Corp. (TSXV: MERG) (OTCQB: MEEEF) (the ""Company"" or ""Metal Energy"") is pleased to announce the final drill hole assays ...",CAD,MERG.V,"Newsfile - Metal Energy Intersects 36.55 m of 1.13% Nickel Equivalent, Including 19.45 m of 1.69% Nickel Equivalent in a New High-Grade Zone at Manibridge"
