source,url,description,country,company,title
fin_news_nlp/yahoo_cad_tickers_news,https://ca.finance.yahoo.com/news/goldsource-reports-positive-results-eagle-114500224.html,"Vancouver, British Columbia--(Newsfile Corp. - February 2, 2023) - Goldsource Mines Inc. (TSXV: GXS) (OTCQX: GXSFF) (FSE: G5MA) (""Goldsource"" or the ""Company"") is pleased to announce positive results from the 2022 metallurgical test program, and the 2023 work plans for the Company's 100%-owned Eagle Mountain Gold Project (""Project"") in Guyana, South America. 2022 Metallurgical HighlightsResults demonstrated high gold recoveries. Using conventional processing techniques, gold recoveries averaged",CAD,GXS.V, - Goldsource Reports Positive Results for Eagle Mountain Metallurgical Test Program and Announces 2023 Work Plans
fin_news_nlp/yahoo_cad_tickers_news,https://ca.finance.yahoo.com/news/gr-silver-mining-announces-director-111500965.html,"GR Silver Mining Ltd. (""GR Silver Mining"" or the ""Company"") (TSXV: GRSL) (OTCQB: GRSLF) (FRANKFURT: GPE) – announces today that it has accepted the resignation of Jonathan Rubenstein from the Board of Directors of the Company. Mr. Rubenstein was appointed to the Board of Directors in September 2020 after previously serving on the Company's Advisory Board.",CAD,GRSL.V,CNW Group - GR Silver Mining Announces Director Resignation
fin_news_nlp/yahoo_cad_tickers_news,https://ca.finance.yahoo.com/news/gratomic-announces-closing-first-tranche-123000053.html,"Gratomic Inc. (""Gratomic"", ""GRAT"" or the ""Company"") (TSXV:GRAT)(OTCQX:CBULF)(Frankfurt:CB82) announces that it has completed the first tranche of a non-brokered private placement offering of up to 20,000,000 working capital units (""WC Units"") at a price of $0.30 per WC Unit for gross proceeds of up to $6 million (the ""Offering"") with the placement of 4,348,984 WC Units for gross proceeds of $1,304,695.20.",CAD,GRAT.V,ACCESSWIRE - Gratomic Announces Closing of First Tranche of $6 million Non-Brokered Private Placement
fin_news_nlp/yahoo_cad_tickers_news,https://ca.finance.yahoo.com/news/grid-metals-corp-announces-strong-120000584.html,"Grid Metals Corp (TSXV:GRDM)(OTCQB:MSMGF) (the ""Company"") today reported results from an additional five (5) holes at its Donner Lake Lithium Property (the ""Property""), located in the Bird River Greenstone Belt of southeastern Manitoba. The holes are part of an ongoing resource delineation drilling program at the Main Dyke.",CAD,GRDM.V,ACCESSWIRE - Grid Metals Corp Announces Strong Second Wave of Results From the Main Dyke Lithium Drilling
fin_news_nlp/yahoo_cad_tickers_news,https://ca.finance.yahoo.com/news/mednow-launches-virtual-diabetes-management-120000525.html,"TORONTO, February 02, 2023--Mednow Inc. (""Mednow"" or the ""Company"") (TSXV: MNOW) (OTCQX: MDNWF) announced today the launch of its enhanced Virtual Diabetes Management program, an end-to-end digital diabetes management solution, to enable convenient on-demand access to Dexcom G6 (NASDAQ: DXCM) real-time continuous glucose monitoring (rtCGM) supplies and personalized diabetes care services.",CAD,MNOW.V, - Mednow Launches New Virtual Diabetes Management Program in Partnership With Dexcom
fin_news_nlp/yahoo_cad_tickers_news,https://ca.finance.yahoo.com/news/mineral-mountain-reports-high-grade-130000830.html,"Mineral Mountain Resources Ltd. (""Mineral Mountain"" or the ""Company"") (TSV: MMV) (OTCQB: MNRLF) (FRANKFURT: M8M) is pleased to announce the discovery of a major new zone of high-grade gold mineralization in iron formation around the Standard Mine Target in the northeastern portion of the Rochford Mining District (Figure 1). Sixteen grab samples averaging 64.9 g/t Au (2.01 opt Au) were collected from two new surface zones of mineralization during geologic field mapping. The first zone, known as B",CAD,MMV.V,"CNW Group - Mineral Mountain Reports New High-Grade Gold Discovery Rochford Project, Black Hills, South Dakota"
fin_news_nlp/yahoo_cad_tickers_news,https://ca.finance.yahoo.com/news/minto-metals-reports-multiple-high-114000196.html,"Minto Metals Corp. (""Minto"" or the ""Company"") is pleased to report the progress from its 2022 exploration drilling program at the Minto Mine located within the Selkirk First Nation's Territory in central Yukon, Canada.",CAD,MNTO.V,CNW Group - Minto Metals Reports Multiple High-Grade Copper Intersections From Follow-up Drilling at Minto North Including 1.91% Copper Over 34.59 Metres
fin_news_nlp/yahoo_cad_tickers_news,https://ca.finance.yahoo.com/news/nowvertical-group-completes-acquisition-a10-123000493.html,"TORONTO, Feb. 02, 2023 (GLOBE NEWSWIRE) -- NowVertical Group Inc. (TSXV: NOW) (""NOW"" or the ""Company""), the VI software and solutions company, is pleased to announce that it has completed its previously announced acquisition of Group Analytics 10 and Inteligencia de Negocios and its affiliate entities (collectively, “A10 Group”). “With the completion of the acquisition today NOW has significantly expanded its operations in the LATAM market in Brazil, Chile and Mexico,"" said Daren Trousdell, Chai",CAD,NOW.V,GlobeNewswire - NowVertical Group Completes the Acquisition of A10 Group
fin_news_nlp/yahoo_cad_tickers_news,https://ca.finance.yahoo.com/news/oroco-drills-187-9-m-131500836.html,"Vancouver, Canada, Feb. 02, 2023 (GLOBE NEWSWIRE) -- Oroco Resource Corp. (TSX-V: OCO, OTC: ORRCF) (“Oroco” or “the Company”) announces assay results from drill holes S004 through S018 (8,547 m of drilling) of its South Zone drilling program at its Santo Tomas property (the “Property”) located in northwestern Mexico (see Table 1, Figure 3 and the South Zone cross-sections, attached). To view an interactive 3D model that includes the South Zone results announced today, please use the following li",CAD,OCO.V,GlobeNewswire - OROCO DRILLS 187.9 M OF 0.58% CU EQUIVALENT AT SANTO TOMAS
fin_news_nlp/yahoo_cad_tickers_news,https://ca.finance.yahoo.com/news/osino-announces-progress-definitive-feasibility-120000563.html,"Figure 1: Design, Layout and Location of Process Plant, Pit and Waste Rock Dumps (Grid spacing = 1000m) Figure 1: Design, Layout and Location of Process Plant, Pit and Waste Rock Dumps (Grid spacing = 1000m) Highlights: The definitive feasibility study (“DFS”) scope is based on the results and scope of the 2022 pre-feasibility study (“PFS”) with minor adjustments to the process flow diagram and tailings filtration strategy expected to be completed around mid-2023. The DFS is based on an updated",CAD,OSI.V,"GlobeNewswire - Osino Announces Progress on Definitive Feasibility Study For Twin Hills Gold Project, Namibia"
fin_news_nlp/yahoo_cad_tickers_news,https://ca.finance.yahoo.com/news/pharmacielo-announces-continued-progress-efficiency-123000169.html,"PharmaCielo Ltd. (""PharmaCielo"" or the ""Company"") (TSXV: PCLO) (OTCQX: PCLOF), the Canadian parent of Colombia's premier cultivator and producer of dried flower and medicinal-grade cannabis extracts, PharmaCielo Colombia Holdings S.A.S. (""Holdings""), today provided a corporate update, regarding progress against the efficiency initiatives it began to implement in mid-2021, which are designed to accelerate the Company's path to profitability. The Company also announced its intention to amend exist",CAD,PCLO.V,CNW Group - PharmaCielo Announces Continued Progress on Efficiency Initiatives to Accelerate Profitability and Intention to Amend Warrant Terms
fin_news_nlp/yahoo_cad_tickers_news,https://ca.finance.yahoo.com/news/plurilock-receives-cross-sale-purchase-120000118.html,"This order was secured within 5 months following the Aurora Systems asset acquisition of Atrion, highlighting the Company's ability to accelerate cross-selling Vancouver, British Columbia--(Newsfile Corp. - February 2, 2023) - Plurilock Security Inc. (TSXV: PLUR) (OTCQB: PLCKF) and related subsidiaries (""Plurilock"" or the ""Company""), an identity-centric cybersecurity solutions provider for workforces, is pleased to announce that Plurilock received a purchase order for the Company's flagship soft",CAD,PLUR.V,Newsfile - Plurilock Receives Cross-Sale Purchase Order for Flagship Cybersecurity Platform from U.S. Credit Union
fin_news_nlp/yahoo_cad_tickers_news,https://ca.finance.yahoo.com/news/poet-technologies-partners-luxsharetech-announces-120000530.html,"TORONTO, Feb. 02, 2023 (GLOBE NEWSWIRE) -- POET Technologies Inc. (“POET” or the “Company”) (TSX Venture: PTK; NASDAQ: POET), the designer and developer of the POET Optical Interposer™ and Photonic Integrated Circuits (PICs) for the data center, telecommunication and artificial intelligence markets, today announced that it has started sampling 400G FR4 and 800G 2xFR4 receive optical engines (RXOEs). POET will partner with Luxshare Technology Co., Ltd. (“LuxshareTech”), a global technology provid",CAD,PTK.V,GlobeNewswire - POET Technologies Partners with LuxshareTech and Announces Availability of 400G and 800G Receive Optical Engines
fin_news_nlp/yahoo_cad_tickers_news,https://ca.finance.yahoo.com/news/soma-gold-announces-addition-vp-121500274.html,"Soma Gold Corp. (TSXV: SOMA) (WKN: A2P4DU) (OTC: SMAGF) (the ""Company"" or ""Soma"") is pleased to announce that Mark J. Bren has joined the Company in the role of Vice President – Operations, effective February 1, 2023. Mr. Bren brings an advanced level of technical mining and operating experience to Soma, and his appointment fills a gap in the Company's management structure.",CAD,SOMA.V,CNW Group - SOMA GOLD ANNOUNCES THE ADDITION OF A NEW VP OPERATIONS
fin_news_nlp/yahoo_cad_tickers_news,https://ca.finance.yahoo.com/news/theralase-phase-ii-nmibc-clinical-120000904.html,"TORONTO, Feb. 02, 2023 (GLOBE NEWSWIRE) -- Theralase® Technologies Inc. (“Theralase®” or the “Company”) (TSXV: TLT) (OTCQB: TLTFF), a clinical stage pharmaceutical company focused on the research and development of light activated Photo Dynamic Compounds (“PDCs”) and their associated drug formulations, used to safely and effectively destroy various cancers, bacteria and viruses, announced today that its Phase II Bacillus Calmette Guerin (“BCG”) Unresponsive Non-Muscle Invasive Bladder Cancer (“N",CAD,TLT.V,GlobeNewswire - Theralase® Phase II NMIBC Clinical Study (Interim) Data to be Presented at the AUA Annual Meeting
fin_news_nlp/yahoo_cad_tickers_news,https://ca.finance.yahoo.com/news/tinone-reports-completion-successful-phase-130000034.html,"TinOne Resources Inc. (TSXV: TORC) (OTCQB: TORCF) (""TinOne"" or the ""Company"") is pleased to announce it has completed its Phase 1 drill program at its Great Pyramid Tin (Sn) Project (""Great Pyramid"" or the ""Project"") located in the tier one mining jurisdiction of Tasmania, Australia.",CAD,TORC.V,"CNW Group - TINONE REPORTS COMPLETION OF SUCCESSFUL PHASE 1 DRILL PROGRAM AND DISCUSSES FUTURE PLANS FOR ITS GREAT PYRAMID TIN PROJECT, TASMANIA, AUSTRALIA"
fin_news_nlp/yahoo_cad_tickers_news,https://ca.finance.yahoo.com/news/tnr-gold-closes-partial-mariana-133000234.html,"Vancouver, British Columbia--(Newsfile Corp. - February 2, 2023) - TNR Gold Corp. (TSXV: TNR) (""TNR"", ""TNR Gold"" or the ""Company"") is pleased to announce that, further to the Company's news release dated November 23, 2022, it has successfully closed the July 2022 royalty purchase agreement with an Ontario limited partnership affiliated with Lithium Royalty Corp (""LRC"") for the sale of a portion of its net smelter returns (""NSR"") royalty involving the Mariana Lithium Project ...",CAD,TNR.V, - TNR Gold Closes Partial Mariana Lithium NSR Royalty Sale to Lithium Royalty Corp.
fin_news_nlp/yahoo_cad_tickers_news,https://ca.finance.yahoo.com/news/tower-prepares-start-2000-m-130000342.html,"Vancouver, British Columbia--(Newsfile Corp. - February 2, 2023) - Tower Resources Ltd. (TSXV: TWR) (""Tower"" or the ""Company"") is pleased to announce that it expects to resume diamond drilling early next week on the Company's Rabbit North property near Kamloops, British Columbia, between New Gold's New Afton underground Cu-Au mine and Teck's Highland Valley open pit Cu-Mo mine (see Fig. 1). Approximately 2000 m of drilling are planned - double the size of the ...",CAD,TWR.V,Newsfile - Tower Prepares to Start 2000 m Diamond Drilling Program on Three Key Gold Targets at Rabbit North
fin_news_nlp/yahoo_cad_tickers_news,https://ca.finance.yahoo.com/news/uscm-reports-cross-sections-suggesting-130000198.html,"Vancouver, British Columbia--(Newsfile Corp. - February 2, 2023) - US Critical Metals Corp. (TSXV: USCM) (OTCQB: USCMF) (FSE: 0IU0) (""USCM"" or the ""Company"") is pleased to announce that the detailed mapping, sampling and initial geologic cross sections completed over the Clayton Ridge Lithium Project (the ""Project"" or ""Clayton Ridge"") suggest robust thicknesses of lithium bearing units. The Project is located in Esmeralda County, Nevada and spans a total of approximately 3,600 acreages within th",CAD,USCM.V,Newsfile - USCM Reports Cross Sections Suggesting Substantial Thicknesses of Lithium-Bearing Units at Clayton Ridge Lithium Property
fin_news_nlp/yahoo_cad_tickers_news,https://ca.finance.yahoo.com/news/zoomd-technologies-selected-one-top-123000715.html,"Zoomd Technologies Ltd. (TSXV: ZOMD) (OTC: ZMDTF) and its wholly-owned subsidiary Zoomd Ltd. (collectively, ""Zoomd"" or the ""Company""), the marketing tech (MarTech) user-acquisition and engagement platform, is pleased to announce that was selected as one of the top two most interesting companies at the AlphaNorth Capital Conference. This recognition showcases the Company's innovative solutions and its commitment to driving growth in the industry. Zoomd is at the forefront of the digital advertisi",CAD,ZOMD.V,CNW Group - Zoomd Technologies selected as one of the top two most interesting companies at the AlphaNorth Capital Conference
fin_news_nlp/yahoo_cad_tickers_news,https://ca.finance.yahoo.com/news/aduro-clean-technologies-provides-joint-120000308.html,"Aduro Clean Technologies Provides Update on Joint Research Initiative with Western University Aduro Clean Technologies Provides Update on Joint Research Initiative with Western University SARNIA, Ontario, Feb. 02, 2023 (GLOBE NEWSWIRE) -- Aduro Clean Technologies Inc. (“Aduro” or the “Company”) (CSE: ACT) (OTCQB: ACTHF) (FSE: 9D50), a Canadian developer of patented water-based technologies to chemically recycle plastics and to transform heavy crude and renewable oils into new-era resources and h",CAD,ACT.CN,GlobeNewswire - Aduro Clean Technologies Provides Update on Joint Research Initiative with Western University
fin_news_nlp/yahoo_cad_tickers_news,https://ca.finance.yahoo.com/news/ai-ml-innovations-tech2heal-wins-123000610.html,"AI/ML Innovations Inc. (""AIML"") (CSE:AIML)(OTCQB:AIMLF)(FWB:42FB), a company committed to acquiring and advancing Artificial Intelligence/Machine Learning technologies that address urgent societal needs, is pleased to announce that its minority-owned subsidiary, Tech2Heal SAS, has been awarded the ""2023 Innovation Grand Prize"" at the prestigious L'Encéphale Medical Congress in Paris, for its recently released Alakin ARPC (Automatic Remote Patient",CAD,AIML.CN,ACCESSWIRE - AI/ML Innovations’ Tech2Heal Wins Prestigious Innovation Grand Prize Award
fin_news_nlp/yahoo_cad_tickers_news,https://ca.finance.yahoo.com/news/american-copper-development-commence-trading-133000542.html,"Vancouver, British Columbia--(Newsfile Corp. - February 2, 2023) - American Copper Development Corporation (CSE: ACDX) (OTCQB: ACDXF) (""ACDC"" or the ""‎‎Company"") is pleased to announce that effective February 2, 2023, the Company's common shares will commence trading on the OTCQB Venture Market (the ""OTCQB"") in the United States, under the symbol ""ACDXF"". The OTCQB is a U.S. trading platform that is operated by the OTC Markets Group in New York and is the premiere ...",CAD,ACDX.CN,"Newsfile - American Copper Development to Commence Trading on the OTCQB Venture Market Under Symbol ""ACDXF"""
fin_news_nlp/yahoo_cad_tickers_news,https://ca.finance.yahoo.com/news/body-mind-appoints-josh-rosen-133000023.html,"Body and Mind Inc. (CSE: BAMM) (OTCQB: BMMJ) (the ""Company"" or ""BaM""), an operations-driven multistate cannabis company, is pleased to announce the appointment of Josh Rosen to its board of directors.",CAD,BAMM.CN,CNW Group - Body and Mind Appoints Josh Rosen to Board of Directors
fin_news_nlp/yahoo_cad_tickers_news,https://ca.finance.yahoo.com/news/danavation-technologies-announces-two-contracts-120000497.html,"An active sales strategy across North America is delivering a steady stream of new contracts for Danavation's Digital Smart Labels™ into both new and existing retail brands and locationsDanavation continues to build on its robust sales pipeline of retailers, which represents a long runway of potential opportunities for ongoing growth in contracted installations Toronto, Ontario--(Newsfile Corp. - February 2, 2023) - Danavation Technologies Corp. (CSE: DVN) (OTCQB: DVNCF) (""Danavation"" or the ""Co",CAD,DVN.CN,Newsfile - Danavation Technologies Announces Two New Contracts for Digital Smart Label(TM) Installations
fin_news_nlp/yahoo_cad_tickers_news,https://ca.finance.yahoo.com/news/envirometal-receives-support-technology-research-133000217.html,"EnviroMetal Technologies Inc. (""EnviroMetal"" or the ""Company""), (CSE:ETI)(OTCQB:EVLLF)(7N2:FSE) is pleased to announce that it is receiving advisory services and research and development funding of up to $100,000 from the National Research Council of Canada Industrial Research Assistance Program (NRC IRAP).",CAD,ETI.CN,ACCESSWIRE - EnviroMetal Receives Support for Technology Research
fin_news_nlp/yahoo_cad_tickers_news,https://ca.finance.yahoo.com/news/james-bay-resources-limited-announces-130000774.html,"Toronto, Ontario--(Newsfile Corp. - February 2, 2023) - James Bay Resources Limited (CSE: JBR) (""James Bay"" or the ""Company"") is pleased to announce that, further to the Company's news release dated December 14, 2022, an aggregate of 4,733,333 common share purchase warrants, with a reduced exercised price of $0.05, were exercised on January 31, 2023 for gross proceeds of $236,666.65.About James Bay Resources LimitedJames Bay is a Canadian resource company with 58,747,401 shares outstanding ...",CAD,JBR.CN, - James Bay Resources Limited Announces Warrant Exercises
fin_news_nlp/yahoo_cad_tickers_news,https://ca.finance.yahoo.com/news/mindset-pharma-receives-another-allowance-120000794.html,"TORONTO, Feb. 02, 2023 (GLOBE NEWSWIRE) -- Mindset Pharma Inc. (CSE: MSET) (FSE: 9DF) (OTCQB: MSSTF) (""Mindset"" or the ""Company""), a drug discovery company developing novel, optimized, next-generation psychedelic and non-psychedelic medications to treat neuropsychiatric and neurological disorders with unmet medical needs, announced today that the United States Patent and Trademark Office (“USPTO”) has granted allowance for another of Mindset’s Family 1 patent applications, number 17/743,718, tit",CAD,MSET.CN,GlobeNewswire - Mindset Pharma Receives Another Allowance from USPTO for Patent Application Expanding Composition of Matter for Family 1 Psilocybin Analogs
fin_news_nlp/yahoo_cad_tickers_news,https://ca.finance.yahoo.com/news/pan-american-energy-approved-increase-130000129.html,"The Bureau of Land Management has approved the Notice of Amendment, increasing the program from 19 to 22 lithium prospecting core holes Figure 1 Drill Hole Locations Figure 2 Drill Hole Locations 2 CALGARY, Alberta, Feb. 02, 2023 (GLOBE NEWSWIRE) -- Pan American Energy Corp. (the “Company” or “Pan American”) (CSE: PNRG) (OTC PINK: PAANF) (FRA: SS6) is pleased to announce the Company has received approval to the previously submitted Notice of Amendment (“NOA”) to the Bureau of Land Management (“B",CAD,PNRG.CN,GlobeNewswire - Pan American Energy Approved to Increase Phase 1 Drill Program to 22 Lithium Prospecting Core Holes
fin_news_nlp/yahoo_cad_tickers_news,https://ca.finance.yahoo.com/news/pangenomic-health-subsidiary-signs-rental-123000854.html,"PanGenomic Health Inc. (""PanGenomic Health"" or the ""Company"") (CSE: NARA), is pleased to announce that, further to the announcement made on January 26, 2023, its subsidiary, MUJN Diagnostics Inc. (formerly named PlantGx Diagnostics Corp.)(""MUJN Diagnostics""), has signed an agreement to lease space at Psy Integrated Health, Inc.'s (""Psyi"") Empower Health Wellness Centre clinic facility located in Vancouver, BC. This rental agreement represents an important step in the development of a proposed jo",CAD,NARA.CN,"CNW Group - PanGenomic Health Subsidiary Signs Rental Agreement with Psy Integrated Health, Makes Progress Towards Development of Joint Testing Facility"
fin_news_nlp/yahoo_cad_tickers_news,https://ca.finance.yahoo.com/news/pharmather-holdings-announces-fda-grant-123000862.html,"PharmaTher’s 5th FDA orphan drug designation for KETARX™ (ketamine) Phase 2 clinical study results to support proposed Phase 3 development of KETARX™ (ketamine) to treat Rett Syndrome for FDA approval via the 505(b)(2) regulatory pathway TORONTO, Feb. 02, 2023 (GLOBE NEWSWIRE) -- PharmaTher Holdings Ltd. (the “Company” or “PharmaTher”) (OTCQB: PHRRF) (CSE: PHRM), a leader in specialty ketamine pharmaceuticals, today announced that the U.S. Food and Drug Administration (“FDA”) has granted orphan",CAD,PHRM.CN,GlobeNewswire - PharmaTher Holdings Announces FDA Grant of Orphan Drug Designation to KETARX™ (Ketamine) for the Treatment of Rett Syndrome
fin_news_nlp/yahoo_cad_tickers_news,https://ca.finance.yahoo.com/news/prudent-minerals-commences-drill-permitting-130000712.html,"Vancouver, British Columbia--(Newsfile Corp. - February 2, 2023) - PRUDENT MINERALS CORP. (CSE: PRUD) (""Prudent"" or the ""Company"") is pleased to announce it has initiated the Notice of Work process with BC Ministry of Energy, Mines and Low Carbon Innovation for a permit to drill on its SAT Copper Property located 10-km west of the town of Granisle in British Columbia, Canada (refer to Figure 1).Prudent has contracted Tripoint Geological Services Ltd. of Victoria, BC to initiate ...",CAD,PRUD.CN,Newsfile - Prudent Minerals Commences Drill Permitting on Its SAT Copper Property
fin_news_nlp/yahoo_cad_tickers_news,https://ca.finance.yahoo.com/news/shiftcarbon-becomes-authorized-patch-partner-123200597.html,"Vancouver, British Columbia--(Newsfile Corp. - February 2, 2023) - ShiftCarbon (CSE: SHFT) (OTC PINK: SHIFF) (formerly TraceSafe) (the ""Company""), a global leader in the Internet of Things (IoT) platforms and an innovator in end-to-end decarbonization solutions, is pleased to announce its partnership with Patch to expand access to ShiftCarbon credits.Patch is a platform scaling unified climate action by empowering companies of any size to help rebalance the planet while advancing their business",CAD,SHFT.CN,Newsfile - ShiftCarbon Becomes an Authorized Patch Partner
fin_news_nlp/yahoo_cad_tickers_news,https://ca.finance.yahoo.com/news/santander-not-interested-potential-acquisition-121921917.html,"Spain's Santander is not interested in the potential acquisition of Orange Bank, the mobile banking unit of Orange, chairman Ana Botin said on Thursday.  Les Echos reported on Wednesday that French banks BNP Paribas, Credit Agricole and Societe Generale were mulling a bid for Orange Bank.  The newspaper added that Spanish bank Santander and U.S. private equity fund Cerberus were also considering a bid.",CAD,ST.CN,Reuters - Santander is not interested in potential acquisition of Orange Bank
fin_news_nlp/yahoo_cad_tickers_news,https://ca.finance.yahoo.com/news/terra-balcanica-intersects-284-g-130000959.html,"Vancouver, British Columbia, Feb. 02, 2023 (GLOBE NEWSWIRE) -- Terra Balcanica Resources Corp. (“Terra” or the “Company”) (CSE:TERA; FRA:UB1) is pleased to announce additional, positive step-out drill results at the high-grade polymetallic Cumavici Ridge epithermal target within its flagship, 216 km2 Viogor-Zanik project, Bosnia and Herzegovina. Highlights High grade +50 m step out: Drillhole CMVDD005 returned 284 g/t AgEq over 10.0 m including 895.8 g/t AgEq over 2.0 m (see Figure 3) approximat",CAD,TERA.CN,GlobeNewswire - TERRA BALCANICA INTERSECTS 284 G/T AGEQ OVER 10 M INCLUDING 895 G/T AGEQ OVER 2 M AT VIOGOR-ZANIK PROJECT IN BOSNIA
fin_news_nlp/yahoo_cad_tickers_news,https://ca.finance.yahoo.com/news/good-flour-corp-product-developments-130000306.html,"The Good Flour Corp. (CSE: GFCO) (OTCQB: GFCOF) (FSE: 3KZ) (""GFCO"") is pleased to highlight the market opportunity for its recently announced high protein pancake and waffle mix that is under development. GFCO is developing both an adult version and a version targeted towards children under the brand name ""Patty Cakes™"". According to Facts and Factors, the Global Protein Supplements Market size was worth USD 20.19 billion in 2021 and is projected to reach USD 32.56 billion by 2028, at a CAGR of",CAD,GFCO.CN,CNW Group - The Good Flour Corp. New Product Developments Position it to Enter the USD 20.19 Billion Dollar Protein Supplements Market
fin_news_nlp/yahoo_cad_tickers_news,https://ca.finance.yahoo.com/news/wedgemount-commences-initial-permian-basin-133000558.html,"Vancouver, British Columbia--(Newsfile Corp. - February 2, 2023) - Wedgemount Resources Corp. (CSE: WDGY) (OTCQB: WDGRF) (""Wedgemount"" or the ""Company""), is pleased to announce that it has commenced its phase-one field program on its recently acquired Willowbend light oil project located in the Permian Basin of central Texas.The initial program includes chemical clean-outs of both operating wells and the producing Gardner formation, optimization of surface facilities, and a study of historic byp",CAD,WDGY.CN, - Wedgemount Commences Initial Permian Basin Program
