source,url,description,country,company,title
fin_news_nlp/yahoo_cad_tickers_news,https://ca.finance.yahoo.com/news/brp-reports-365-1m-q4-113202942.html,"VALCOURT, Que. — BRP Inc. reported a fourth-quarter profit of $365.1 million, up from $209.6 million a year earlier, as its revenue rose 31 per cent to a record high. The Ski-Doo and Sea-Doo maker says its profit amounted to $4.54 per diluted share for the quarter ended Jan. 31, up from $2.50 per diluted share a year earlier. Revenue for the fourth quarter of the company's 2023 financial year totalled $3.08 billion, up from $2.35 billion. BRP says its normalized profit for the quarter was $3.85",CAD,DOO.TO,"The Canadian Press - BRP reports $365.1M Q4 profit, revenue up 31% compared with year ago"
fin_news_nlp/yahoo_cad_tickers_news,https://ca.finance.yahoo.com/news/ci-global-asset-management-announces-110000199.html,"TORONTO, March 23, 2023--CI Global Asset Management announces that investors in CI Global Equity Income Private Pool Class have approved its merger into another fund.",CAD,CIX.TO,Business Wire - CI Global Asset Management Announces Securityholder Approval of Mutual Fund Merger
fin_news_nlp/yahoo_cad_tickers_news,https://ca.finance.yahoo.com/news/coveo-ai-search-recommendations-platform-120000862.html,"MONTREAL and SAN FRANCISCO, March 23, 2023 (GLOBE NEWSWIRE) -- Coveo Solutions Inc. (TSX:CVO), a leader in AI platforms that transform digital experiences with intelligent search, recommendations, 1:1 personalization, and merchandising, today announced that its Coveo AI Search and Recommendations platform for SAP® Commerce Cloud is now an SAP Endorsed App and is available on SAP Store. SAP Endorsed Apps are a select category of solutions from SAP’s partner ecosystem which are premium certified,",CAD,CVO.TO,GlobeNewswire - Coveo AI Search and Recommendations Platform for SAP® Commerce Cloud Now an SAP® Endorsed App
fin_news_nlp/yahoo_cad_tickers_news,https://ca.finance.yahoo.com/news/crew-energy-announces-early-redemption-123000031.html,"CALGARY, Alberta, March 23, 2023 (GLOBE NEWSWIRE) -- Crew Energy Inc. (TSX: CR; OTCQB: CWEGF) (""Crew"" or the ""Company""), a growth-oriented, liquids-rich natural gas producer operating in the world-class Montney play in northeast British Columbia (""NE BC""), is pleased to announce today the issuance of a notice of redemption for $172 million principal amount of 6.5% senior unsecured notes (the ""Notes"") due March 2024 (the ""Redeemed Notes""), which represent all the Company's remaining Notes outstan",CAD,CR.TO,GlobeNewswire - Crew Energy Announces Early Redemption of Remaining  Outstanding 6.5% Senior Unsecured Notes Due 2024
fin_news_nlp/yahoo_cad_tickers_news,https://ca.finance.yahoo.com/news/dentalcorp-reports-fourth-quarter-full-110000626.html,"TORONTO, March 23, 2023--dentalcorp Holdings Ltd. (""dentalcorp"" or the ""Company"") (TSX: DNTL), Canada’s largest, and one of North America’s fastest growing networks of dental practices, announced today its three and 12 month financial and operating results for the period ended December 31, 2022. All references to dollar values in this press release are in Canadian dollars, unless otherwise indicated.",CAD,DNTL.TO, - dentalcorp Reports Fourth Quarter and Full Year Fiscal 2022 Results
fin_news_nlp/yahoo_cad_tickers_news,https://ca.finance.yahoo.com/news/e-split-corp-class-preferred-123000208.html,"TORONTO, March 23, 2023 (GLOBE NEWSWIRE) -- E Split Corp. (TSX: ENS and ENS.PR.A) (the “Fund”) is pleased to announce that a distribution for March 2023 will be payable to Class A shareholders as follows: Record DatePayable DateDistribution Per Equity ShareMarch 31, 2023April 14, 2023$0.13 The Fund also announces the first quarter distribution of 2023 will be payable to preferred shareholders as follows: Record DatePayable DateDistribution Per Preferred ShareMarch 31, 2023April 14, 2023$0.13125",CAD,ENS.TO,GlobeNewswire - E Split Corp. Class A and Preferred Distributions
fin_news_nlp/yahoo_cad_tickers_news,https://ca.finance.yahoo.com/news/else-nutrition-report-fourth-quarter-110000616.html,"Conference call to be conducted on March 31, 2023, at 10 a.m. ETVANCOUVER, British Columbia, March 23, 2023 (GLOBE NEWSWIRE) -- ELSE NUTRITION HOLDINGS INC (BABY) (BABYF) (0YL.F) (""Else"" or the ""Company"") the Plant-Based baby, toddler and children nutrition company, announced today that it expects to report fourth quarter and fiscal year 2022 financial results for the period ending December 31, 2022 on March 31, 2023. The Company has scheduled a conference call on the same day, at 10:00 a.m. ET,",CAD,BABY.TO,"GlobeNewswire - Else Nutrition to Report Fourth Quarter and Fiscal Year 2022 Financial Results on March 31, 2023"
fin_news_nlp/yahoo_cad_tickers_news,https://ca.finance.yahoo.com/news/fansunite-report-fiscal-2022-financial-110000000.html,"Vancouver, British Columbia--(Newsfile Corp. - March 23, 2023) - FansUnite Entertainment Inc. (TSX: FANS) (""FansUnite"" or the ""Company"") is pleased to announce that it will file its audited consolidated financial statements and associated management's discussion and analysis (""MD&A"") for the year ended December 31, 2022 on Thursday, March 30, 2023. The management team of FansUnite will host an investor webinar to discuss the Company's Fiscal 2022 financial results and growth outlook at 10:00 AM",CAD,FANS.TO,Newsfile - FansUnite to Report Fiscal 2022 Financial Results and Host Investor Webinar
fin_news_nlp/yahoo_cad_tickers_news,https://ca.finance.yahoo.com/news/boasting-39-return-equity-gibson-123343830.html,"One of the best investments we can make is in our own knowledge and skill set. With that in mind, this article will...",CAD,GEI.TO,"Simply Wall St. - Boasting A 39% Return On Equity, Is Gibson Energy Inc. (TSE:GEI) A Top Quality Stock?"
fin_news_nlp/yahoo_cad_tickers_news,https://ca.finance.yahoo.com/news/knight-therapeutics-reports-fourth-quarter-113000064.html,"Achieves Record Annual Revenues and EBITDAMONTREAL, March 23, 2023 (GLOBE NEWSWIRE) -- Knight Therapeutics Inc. (TSX: GUD) (""Knight"" or “the Company”), a leading Pan-American (ex-US) specialty pharmaceutical company, today reported financial results for its fourth quarter and year ended December 31, 2022. All currency amounts are in thousands except for share and per share amounts. All currencies are Canadian unless otherwise specified. Financial information as at and for the year ended December",CAD,GUD.TO,GlobeNewswire - Knight Therapeutics Reports Fourth Quarter and Year-End 2022 Results
fin_news_nlp/yahoo_cad_tickers_news,https://ca.finance.yahoo.com/news/major-drilling-announces-normal-course-115900564.html,"MONCTON, New Brunswick, March 23, 2023 (GLOBE NEWSWIRE) -- Major Drilling Group International Inc. (TSX: MDI) (“Major Drilling” or the “Company”), one of the world’s largest drilling services companies primarily serving the mining industry, announced today that the Toronto Stock Exchange (""TSX"") has accepted its notice of intention to make a normal course issuer bid (the ""NCIB Program"") to purchase outstanding common shares of Major Drilling (the ""Common Shares"") on the open market in accordance",CAD,MDI.TO,GlobeNewswire - Major Drilling Announces Normal Course Issuer Bid
fin_news_nlp/yahoo_cad_tickers_news,https://ca.finance.yahoo.com/news/mineros-resumes-operations-nechi-alluvial-111500438.html,"Mineros S.A. (TSX: MSA) (CB: MINEROS) (""Mineros"" or the ""Company"") is pleased to announce that the Company has resumed full operations at its Nechi Alluvial Property.",CAD,MSA.TO,CNW Group - Mineros resumes operations at its Nechi Alluvial Property
fin_news_nlp/yahoo_cad_tickers_news,https://ca.finance.yahoo.com/news/mogo-reports-results-q4-fy-111600069.html,"VANCOUVER, British Columbia, March 23, 2023--Mogo Inc. (NASDAQ:MOGO) (TSX:MOGO) (""Mogo"" or the ""Company""), one of Canada’s leading financial technology companies, today announced its financial and operational results for the fourth quarter and fiscal year ended December 31, 2022.",CAD,MOGO.TO, - Mogo Reports Results for Q4 & FY 2022
fin_news_nlp/yahoo_cad_tickers_news,https://ca.finance.yahoo.com/news/sabina-gold-silver-corp-tse-104754932.html,Key Insights The considerable ownership by individual investors in Sabina Gold & Silver indicates that they...,CAD,SBB.TO,"Simply Wall St. - Sabina Gold & Silver Corp.'s (TSE:SBB) largest shareholders are individual investors with 53% ownership, institutions own 24%"
fin_news_nlp/yahoo_cad_tickers_news,https://ca.finance.yahoo.com/news/signal-gold-initiates-further-drilling-110000607.html,"Signal Gold Inc. (""Signal Gold"" or the ""Company"") (TSX:SGNL)(OTCQX:SGNLF) is pleased to announce further growth exploration drilling to the west of the Goldboro Deposit at its Goldboro Project in Nova Scotia, Canada (""Goldboro"", or the ""Project"").",CAD,SGNL.TO,ACCESSWIRE - Signal Gold Initiates Further Drilling to Follow-Up on Discovery West of the Goldboro Mineral Resource
fin_news_nlp/yahoo_cad_tickers_news,https://ca.finance.yahoo.com/news/silver-elephant-increases-private-placement-122800400.html,"Vancouver, British Columbia--(Newsfile Corp. - March 23, 2023) - Silver Elephant Mining Corp. (TSX: ELEF) (OTCQX: SILEF) (FSE: 1P2) (""Silver Elephant"" or ""the Company"") announces that, further to its news release dated March 13, 2023, it has successfully closed the first tranche of its previously announced private placement (the ""Placement"") and issued an aggregate of 1,500,000 Units for gross proceeds of $675,000. Each Unit consists of one common share of the Company and one share purchase ...",CAD,ELEF.TO,"Newsfile - Silver Elephant Increases Private Placement to $1,182,650 and Closes the First Tranche for $675,000"
fin_news_nlp/yahoo_cad_tickers_news,https://ca.finance.yahoo.com/news/sylogist-announces-22-organic-growth-120000362.html,"Calgary, Alberta--(Newsfile Corp. - March 23, 2023) - Sylogist Ltd. (TSX: SYZ) (""Sylogist"" or the ""Company""), a leading public sector SaaS company, is pleased to announce its audited financial results for the three and 15-month period ended on December 31, 2022. In November 2022, Sylogist announced a change in its fiscal year end from September 30 to December 31, and is now releasing financial results for a transitional 15-month fiscal year.""Sylogist produced record organic ...",CAD,SYZ.TO,"Newsfile - Sylogist Announces 22% Organic Growth and 32% EBITDA Margin for the Quarter, Releases Year-End Audited Financials"
fin_news_nlp/yahoo_cad_tickers_news,https://ca.finance.yahoo.com/news/tantalus-paygo-partner-help-utilities-110000796.html,"Burnaby, British Columbia--(Newsfile Corp. - March 23, 2023) - Tantalus Systems (TSX: GRID) (""Tantalus"" or the ""Company""), a smart grid technology company focused on helping build sustainable utilities for the future, is pleased to announce it has executed a partnership agreement with PayGo®, a payments technology company offering a fully integrated utility billing and payments system (""PayGo Cloud CIS"") as well as a comprehensive prepay solution (""PayGo Prepay""). The combined offering will enab",CAD,GRID.TO,Newsfile - Tantalus and PayGo Partner to Help Utilities Implement Flexible Payment Solutions to Manage Their Consumption and Budgeting
fin_news_nlp/yahoo_cad_tickers_news,https://ca.finance.yahoo.com/news/troilus-drills-2-72-g-110000934.html,"Figure 1 Plan View of Zone X22 Showing Current and Previously Reported Drill Holes Figure 2 Section 12,575N (C - C’ Figure 1) Facing North Showing Results for Hole X22-23-027 Figure 3 Section 13,350N (A - A’ Figure 1) Facing North Showing Results for X22-23-024 Figure 4 Section 13,025N (B - B’ Figure 1) Facing North Showing Results for Hole X22-23-014 MONTREAL, March 23, 2023 (GLOBE NEWSWIRE) -- Troilus Gold Corp. (“Troilus” or the “Company”, TSX: TLG; OTCQX: CHXMF; FSE: CM5R) reports assay resu",CAD,TLG.TO,"GlobeNewswire - Troilus Drills 2.72 g/t AuEq Over 34m, Incl. 10.83 g/t AuEq Over 6m and 1.49 g/t AuEq Over 35.5m, Incl. 2.55 g/t AuEq Over 4.5m in Zone X22; Extends Its Strike Length 150m to 1km"
fin_news_nlp/yahoo_cad_tickers_news,https://ca.finance.yahoo.com/news/look-fair-value-waste-connections-120017368.html,Key Insights Waste Connections' estimated fair value is US$111 based on 2 Stage Free Cash Flow to Equity With US$132...,CAD,WCN.TO,"Simply Wall St. - A Look At The Fair Value Of Waste Connections, Inc. (NYSE:WCN)"
fin_news_nlp/yahoo_cad_tickers_news,https://ca.finance.yahoo.com/news/aldebaran-announces-officer-appointments-110000219.html,"VANCOUVER, British Columbia, March 23, 2023 (GLOBE NEWSWIRE) -- Aldebaran Resources Inc. (""Aldebaran"" or the ""Company"", TSX-V: ALDE, OTCQX: ADBRF) is pleased to announce the promotion of two of its employees. Javier Roberto has been promoted from Country Manager, Argentina to Vice President and Country Manager, Argentina. Javier has worked with Aldebaran since its inception in 2019 and prior to working with Aldebaran, he worked with Regulus Resources and Antares Minerals, both companies run by s",CAD,ALDE.V,GlobeNewswire - Aldebaran Announces Officer Appointments
fin_news_nlp/yahoo_cad_tickers_news,https://ca.finance.yahoo.com/news/arch-biopartners-receives-funding-development-110000223.html,"TORONTO, March 23, 2023 (GLOBE NEWSWIRE) -- Today, Arch Biopartners Inc., (“Arch” or the “Company”) (TSX Venture: ARCH and OTCQB: ACHFF), a clinical stage company focused on the development of novel therapeutics targeting organ inflammation, announced that Arch is receiving advisory services and up to $4,000,000 in funding from the National Research Council of Canada Industrial Research Assistance Program (“NRC IRAP”) to support the research and development of the LSALT peptide (Metablok) progra",CAD,ARCH.V,GlobeNewswire - Arch Biopartners Receives Funding for Development of LSALT Peptide Drug Program
fin_news_nlp/yahoo_cad_tickers_news,https://ca.finance.yahoo.com/news/c3-metals-drilling-confirms-epithermal-110000216.html,"At Least 16 Porphyry and 40 Epithermal Prospects to Evaluate in Jamaica Toronto, Ontario--(Newsfile Corp. - March 23, 2023) - C3 Metals Inc. (TSXV: CCCM) (OTCQB: CUAUF) (""C3 Metals"" or the ""Company"") is pleased to announce results from its initial scout drilling program at the Company's 100% owned Arthurs Seat Project in Jamaica. The Arthurs Seat Project is contiguous with C3 Metals' 100% owned Bellas Gate and Main Ridge Projects to the southeast and ...",CAD,CCCM.V,Newsfile - C3 Metals Drilling Confirms Epithermal and Porphyry Targets at Arthurs Seat
fin_news_nlp/yahoo_cad_tickers_news,https://ca.finance.yahoo.com/news/ceapro-announces-data-research-collaboration-130500518.html,"Oral presentation to highlight unique results from pre-clinical studies demonstrating potential of Ceapro’s yeast beta glucan to reprogram macrophages involved in fibrotic lung diseasesEDMONTON, Alberta, March 23, 2023 (GLOBE NEWSWIRE) -- Ceapro Inc. (TSX-V: CZO; OTCQX: CRPOF) (“Ceapro” or the “Company”), a growth-stage biotechnology company focused on the development and commercialization of active ingredients for healthcare and cosmetic industries, announced today that the abstract titled, “Re",CAD,CZO.V,GlobeNewswire - Ceapro Announces Data from Research Collaboration with McMaster University to be Presented at the 2023 American Thoracic Society (ATS) International Conference
fin_news_nlp/yahoo_cad_tickers_news,https://ca.finance.yahoo.com/news/comprehensive-healthcare-systems-inc-expands-110000269.html,"Comprehensive Healthcare Systems Inc. (TSXV: CHS) (the ""Company"" or ""CHS""), a leading provider of healthcare benefits administration software and services, is pleased to announce the expansion of its client portfolio with a prominent Midwest union. This new client has the potential to expand over the next few years, and the Company will have the opportunity to bring value with additional solution offerings. With this new partnership, the client will be implementing the Company's innovative Novus",CAD,CHS.V,CNW Group - COMPREHENSIVE HEALTHCARE SYSTEMS INC. EXPANDS CLIENT PORTFOLIO WITH MIDWEST UNION ADDITION
fin_news_nlp/yahoo_cad_tickers_news,https://ca.finance.yahoo.com/news/currie-rose-enters-agreement-acquire-111000996.html,"Toronto, Ontario--(Newsfile Corp. - March 23, 2023) - Currie Rose Resources Inc. (TSXV: CUI) (""Currie Rose"" or the ""Company"") is pleased to announce that the Company has entered into a share exchange agreement (the ""Share Exchange Agreement"") on March 21, 2023 with WA Hydrogen Pty Ltd. (""Kotai Energy"") and the shareholders of Kotai Energy, pursuant to which the Company will acquire all of the issued and outstanding shares of Kotai Energy (the ""Kotai Shares""), ...",CAD,CUI.V,Newsfile - Currie Rose Enters into Agreement to Acquire Kotai Energy and its Hydrogen Project
fin_news_nlp/yahoo_cad_tickers_news,https://ca.finance.yahoo.com/news/drone-delivery-canada-corp-awarded-110000178.html,"Drone Delivery Canada Corp. (TSXV: FLT) (OTC QX: TAKOF) (Frankfurt: A3DP5Y or ABBA.F) (the ""Company"" or ""DDC"") is pleased to announce that, with the assistance of its sales agent Air Canada (TSX: AC), it has signed a contract (the ""Contract"") with the Canadian Government to work with Transport Canada in operating and evaluating DDC's proprietary drone delivery platform using DDC's heavy-lift Condor remote piloted aircraft, the largest drone currently being developed by DDC. The Contract, with a",CAD,FLT.V,CNW Group - DRONE DELIVERY CANADA CORP. AWARDED FIRST CONTRACT FOR ITS HEAVY-LIFT CONDOR DRONE FROM THE GOVERNMENT OF CANADA
fin_news_nlp/yahoo_cad_tickers_news,https://ca.finance.yahoo.com/news/fpx-nickel-announces-inclusion-sprott-110000768.html,"FPX Nickel Corp. (TSXV: FPX) (OTCQB: FPOCF) (""FPX"" or the ""Company"") is pleased to announce that it has been included in the newly launched Sprott Asset Management LP Nickel Miners ETF (""NIKL""), a U.S.-listed ETF focused on nickel companies that are providing a critical mineral necessary for the clean energy transition.",CAD,FPX.V,CNW Group - FPX Nickel Announces Inclusion in New Sprott Asset Management Nickel Miners ETF
fin_news_nlp/yahoo_cad_tickers_news,https://ca.finance.yahoo.com/news/gblt-continues-global-expansion-signing-120000092.html,"GBLT Corp. (TSXV: GBLT) (""GBLT"" or the ""Company"") is pleased to announce that the Company has signed a distribution agreement with a major consumer imaging distributor in the Nordic region for a minimum expected order volume of €4.5 million ($6.6 million CAD) to provide AFGAPHOTO portable energy solutions over 4 years and will cover locations in 8 countries including Sweden, Denmark, Finland and more.",CAD,GBLT.V,CNW Group - GBLT Continues Global Expansion by Signing a Distribution Agreement with an Expected Total Volume of €4.5 million ($6.6 Million CAD) with One of Nordic's Largest Consumer Imaging Distributor
fin_news_nlp/yahoo_cad_tickers_news,https://ca.finance.yahoo.com/news/granite-creek-copper-acquires-92-120000128.html,"Granite Creek Copper Ltd. (TSX.V:GCX)(OTCQB:GCXXF)(""Granite Creek"" or the ""Company"") is pleased to announce it has entered into an agreement to acquire a 100% interest in the Lucky Ship molybdenum property (""LS Molybdenum Project"" or the ""Project"") from two arms length vendors.",CAD,GCX.V,"ACCESSWIRE - Granite Creek Copper Acquires 92 million Pound Indicated Historical 43-101 Molybdenum Resource in British Columbia, Canada"
fin_news_nlp/yahoo_cad_tickers_news,https://ca.finance.yahoo.com/news/green-shift-signs-purchase-agreement-110000434.html,"TORONTO, March 23, 2023 (GLOBE NEWSWIRE) -- Green Shift Commodities Ltd. (TSXV: GCOM), (“Green Shift”, “GCOM” or the “Company”) is pleased to announce that it has signed a definitive agreement (the “Agreement”) with New Peak Metals Limited (“New Peak”) (ASX: NPM), to acquire (the “Acquisition”) a 25% interest in Pampa Litio S.A. (“Pampa Litio”). Pampa Litio is a private Argentinean company exploring for hard rock spodumene bearing pegmatites in the Pampean Ranges of Central Argentina. Pursuant t",CAD,GCOM.V,"GlobeNewswire - Green Shift Signs Purchase Agreement to Acquire 25% Interest in Pampa Litio S.A., a Private Hard Rock Lithium Exploration Company in Argentina"
fin_news_nlp/yahoo_cad_tickers_news,https://ca.finance.yahoo.com/news/hamilton-thorne-announce-q4-end-123000495.html,"BEVERLY, Mass. and TORONTO, March 23, 2023 (GLOBE NEWSWIRE) -- Hamilton Thorne Ltd. (TSX-V:HTL), a leading global provider of precision instruments, consumables, software and services to the Assisted Reproductive Technologies (ART), research, and cell biology markets, today announced that it will release its financial results for the three months and year-ended December 31, 2022 before market open on Thursday, March 30, 2023. The press release, with accompanying financial information, will be po",CAD,HTL.V,"GlobeNewswire - Hamilton Thorne to Announce Q4 and Year End 2022 Financial Results and Hold Conference Call on March 30, 2023"
fin_news_nlp/yahoo_cad_tickers_news,https://ca.finance.yahoo.com/news/honey-badger-silver-updates-results-120000852.html,"Toronto, Ontario--(Newsfile Corp. - March 23, 2023) - Honey Badger Silver Inc. (TSXV: TUF) (""Honey Badger"" or the ""Company"") is pleased to report on exploration results from its road accessible, 100%-owned Groundhog Project (""Groundhog"") in south-central Yukon. The Project is located 50 km south of Ross River (Figure 1) and approximately 25 km west of the former Ketza Mine, which produced over 57,500 ounces of gold and 33,400 ounces of silver1 from replacement-style ...",CAD,TUF.V,"Newsfile - Honey Badger Silver Updates Results from Its 100% Owned Groundhog Project, Yukon; Reports Assays over 2,400 g/t Ag"
fin_news_nlp/yahoo_cad_tickers_news,https://ca.finance.yahoo.com/news/identillect-partners-avit-soluciones-mexico-123000005.html,"Identillect Technologies Corp. (the ""Company"" or ""Identillect"") (TSX-V:ID) (Frankfurt:8ID), an industry pioneer in email security solutions, is continuing its expansion into Mexico. Ranked #2 in cyber-attacks among Latin American countries, Mexico is becoming a core market for Identillect's flagship Delivery Trust® encrypted email solution.",CAD,ID.V,ACCESSWIRE - Identillect Partners with Avit Soluciones in Mexico
fin_news_nlp/yahoo_cad_tickers_news,https://ca.finance.yahoo.com/news/ophir-gold-corp-closes-acquisition-120000439.html,"Vancouver, British Columbia--(Newsfile Corp. - March 23, 2023) - Ophir Gold Corp. (TSXV: OPHR) (OTCQB: KPZIF) (FSE: 80M) (the ""Company"" or ""Ophir"") is pleased to announce that further to its news releases of March 7th, 2023, it has closed the acquisition of three (3) mining claims located in James Bay, Quebec (the ""Claims"") from Troilus Gold Corporation (the ""Vendor""). The three (3) claims are contiguous to the Company's Radis Lithium Property.The Claims were acquired pursuant to a ...",CAD,OPHR.V," - Ophir Gold Corp. Closes the Acquisition of the Troilus Gold Corporation's Claims in James Bay, Quebec"
fin_news_nlp/yahoo_cad_tickers_news,https://ca.finance.yahoo.com/news/geologist-reagan-glazier-appointed-president-130000348.html,"Vancouver, British Columbia--(Newsfile Corp. - March 23, 2023) - Mr. David Brett, President & CEO, Pacific Bay Minerals Ltd. (TSXV: PBM) (""Pacific Bay"" or the ""Company"") reports that the Company has appointed BC geologist Reagan Glazier to its board of directors and as President and CEO of the Company. Former President & CEO David H. Brett will remain on the board as non-executive chair. Coincident with the forgoing changes, Pacific Bay director Bill Smith ...",CAD,PBM.V,"Newsfile - Geologist Reagan Glazier Appointed President, CEO & Director"
fin_news_nlp/yahoo_cad_tickers_news,https://ca.finance.yahoo.com/news/patriot-extends-strike-length-cv5-123000639.html,"Table 1: Geologically logged pegmatite intersections >2 m for drill holes completed in 2023 Figure 1: Drill hole locations completed through March 20, 2023, at the CV5 Pegmatite Figure 2: CV5 Corridor (i.e., CV5 through CV4 pegmatite clusters) Figure 3: Lake-ice pad preparation for drilling completed over newly defined 550 m strike length at CV5 Table 2: Drill hole attributes VANCOUVER, British Columbia and SYDNEY, Australia, March 23, 2023 (GLOBE NEWSWIRE) -- Highlights Extension of the CV5 spo",CAD,PMET.V,"GlobeNewswire - Patriot Extends Strike Length of the CV5 Pegmatite to 3.15 km, Corvette Property, Quebec, Canada"
fin_news_nlp/yahoo_cad_tickers_news,https://ca.finance.yahoo.com/news/revolve-provides-development-vernal-bess-071500584.html,"Revolve Renewable Power Corp. (TSXV: REVV) (""Revolve"" or the ""Company""), an owner, operator and developer of renewable energy projects is pleased to provide an update on the ongoing development activity of both its 80MWh/20MW Vernal Battery Storage project (the ""Vernal BESS Project"") and 50MW Primus Wind Energy project (the ""Primus Wind Project"").",CAD,REVV.V,CNW Group - Revolve Provides Development Update on its Vernal BESS & Primus Wind Projects
fin_news_nlp/yahoo_cad_tickers_news,https://ca.finance.yahoo.com/news/sirona-biochem-announces-debenture-financing-130000605.html,"VANCOUVER, British Columbia, March 23, 2023 (GLOBE NEWSWIRE) -- Sirona Biochem Corp. (TSX-V: SBM) (FSE: ZSB) (OTC: SRBCF) (“Sirona” or the “Company”) is pleased to announce a non-brokered private placement offering of unsecured, convertible debentures (the “Convertible Debentures”). The Company is offering Convertible Debentures units (the “Debenture Units”) at a price of $1,000 per Debenture Unit for aggregate gross proceeds of up to $1,500,000 (the “Offering”). Each Debenture Unit will have a",CAD,SBM.V,GlobeNewswire - Sirona Biochem Announces Debenture Financing
