source,url,description,country,company,title
fin_news_nlp/yahoo_cad_tickers_news,https://ca.finance.yahoo.com/news/azucar-reports-receipt-order-mexico-202200690.html,"VANCOUVER, British Columbia, June 02, 2023 (GLOBE NEWSWIRE) -- Azucar Minerals Ltd. (""Azucar"" or the ""Company"") (TSX-V: AMZ; OTCQB: AXDDF) reports that it has received a communication (“the “Communication”) from the Directorate General of Mining (“DGM”) within Mexico’s Ministry of the Economy (“Economia”) describing an injunction that has been placed on Economia by the First District Court of Veracruz (“First District Court”), in respect of twenty-four mineral concessions in Veracruz including m",CAD,AMZ.V,"GlobeNewswire - Azucar Reports Receipt of Order from Mexico’s Ministry of Economy regarding the El Cobre Project, Veracruz, Mexico"
fin_news_nlp/yahoo_cad_tickers_news,https://ca.finance.yahoo.com/news/bewhere-holdings-inc-announces-plans-223000302.html,"BeWhere Holdings Inc. (the ""Corporation"" or ""BeWhere"") announces that it has filed with the TSX Venture Exchange a Notice of Intention to Make a Normal Course Issuer Bid which is proposed to commence on June 7, 2023 and terminate on June 6, 2024 or the earlier of the date all shares which are subject to the Normal Course Issuer Bid are purchased.",CAD,BEW.V,ACCESSWIRE - BeWhere Holdings Inc. Announces Plans to Repurchase Common Shares
fin_news_nlp/yahoo_cad_tickers_news,https://ca.finance.yahoo.com/news/blockmate-ventures-announces-private-placement-202400528.html,"VANCOUVER, British Columbia, June 02, 2023 (GLOBE NEWSWIRE) -- Blockmate Ventures Inc. (TSX.V: MATE) (OTCQB: MATEF) (FSE: 8MH1) (""Blockmate"" or the ""Company"") is pleased to announce that it intends to issue, by way of a non-brokered private placement, common shares of the Company (“Common Shares”) at a purchase price of at a price of $0.05 per Unit (the “Offering Price”) for gross proceeds of up to $800,000 (representing 16,000,000 units). Each “Unit” consists of one common share, and one common",CAD,MATE.V,GlobeNewswire - Blockmate Ventures Announces Private Placement Capital Raising
fin_news_nlp/yahoo_cad_tickers_news,https://ca.finance.yahoo.com/news/bravo-announces-upsizing-previously-announced-224900970.html,"Bravo Mining Corp. (TSXV: BRVO) (OTCQX: BRVMF) (""Bravo"" or the ""Company"") is pleased to announce an increase in the size of its previously announced private placement offering (the ""Concurrent Private Placement"") of common shares of the Company (""Common Shares""). The size of the Concurrent Private Placement, which is being conducted in addition to the Offering (as defined below) and on a best efforts agency basis, has been increased to up to 1,504,992 Common Shares at a price of C$3.50 per Commo",CAD,BRVO.V,CNW Group - Bravo Announces Upsizing of Previously Announced Private Placement Offering
fin_news_nlp/yahoo_cad_tickers_news,https://ca.finance.yahoo.com/news/cathedra-bitcoin-announces-off-grid-110000264.html,"TORONTO, June 02, 2023--(Block Height: 792,455) – Cathedra Bitcoin Inc. (TSX-V: CBIT; OTCQX: CBTTF) (""Cathedra"" or the ""Company""), is pleased to announce a strategic partnership with 360 Mining, Inc (""360 Mining""), a Delaware incorporated off-grid bitcoin mining company.",CAD,CBIT.V, - Cathedra Bitcoin Announces Off-Grid Bitcoin Mining Partnership With 360 Mining
fin_news_nlp/yahoo_cad_tickers_news,https://ca.finance.yahoo.com/news/char-technologies-ltd-appoints-anton-120500446.html,"TORONTO, June 02, 2023 (GLOBE NEWSWIRE) -- CHAR Technologies Ltd. (“CHAR” or the “Company”) (TSXV:YES) is pleased to announce the appointment of Mr. Anton Szpitalak, to the Board of Directors. Anton is co-founder and president at Pan Asia Solar, a cleantech investment platform focused on disruptive decarbonisation technologies. Pan Asia and its investors have invested more than $100M in VC-stage companies globally. Sectors include photovoltaic manufacturing, energy generation, software developme",CAD,YES.V,GlobeNewswire - CHAR Technologies Ltd. Appoints Anton Szpitalak to the Board of Directors
fin_news_nlp/yahoo_cad_tickers_news,https://ca.finance.yahoo.com/news/clean-air-metals-announces-management-110000659.html,"Clean Air Metals Inc. (""Clean Air Metals"" or the ""Company"") (TSXV: AIR) (OTCQB: CLRMF) (FRA: CKU) announces that Mr. Abraham Drost will no longer be continuing as CEO and Director of the Company effective immediately.",CAD,AIR.V,CNW Group - Clean Air Metals Announces Management Changes
fin_news_nlp/yahoo_cad_tickers_news,https://ca.finance.yahoo.com/news/condor-endeavour-earthworks-52-week-150400466.html,Condor Resources Inc. (V.CN) hit a new 52-week high of 36 cents Friday. No news stories available today. ...,CAD,CN.V," - Condor, Endeavour, Earthworks at 52-Week Highs"
fin_news_nlp/yahoo_cad_tickers_news,https://ca.finance.yahoo.com/news/decibel-announces-stock-option-grant-012000509.html,"Decibel Cannabis Company Inc. (the ""Company"" or ""Decibel"") (TSXV: DB) (OTCQB: DBCCF), a premium cannabis producer, announces that it has granted, effective after market close on June 1, 2023, 4,500,000 stock options (each, an ""Option"") to the Chief Executive Officer of the Company in accordance with the Company's stock option plan.",CAD,DB.V,CNW Group - Decibel Announces Stock Option Grant
fin_news_nlp/yahoo_cad_tickers_news,https://ca.finance.yahoo.com/news/defiance-drills-widest-silver-intercept-035900648.html,"Vancouver, British Columbia--(Newsfile Corp. - June 7, 2023) - Defiance Silver Corp. (TSXV: DEF) (OTCQX: DNCVF) (FSE: D4E) (WKN: A1JQW5) (""Defiance"" or the ""Company"") is pleased to provide an update on the recently completed drill program. Results from drill holes DDSA-23-64, DDSA-23-65, DDSA-23-66 and 66A are reported in this release. The Company is awaiting assay results from DDSA-23-67 through DDSA-23-72, an additional six drill holes.Drilling encountered the highest-grade and widest-width mi",CAD,DEF.V,Newsfile - Defiance Drills Widest Silver Intercept to Date in the Veta Grande
fin_news_nlp/yahoo_cad_tickers_news,https://ca.finance.yahoo.com/news/denarius-metals-announces-voting-results-210000598.html,"Toronto, Ontario--(Newsfile Corp. - June 7, 2023) - Denarius Metals Corp. (TSXV: DSLV) (OTCQX: DNRSF) (""Denarius Metals"" or ""the Company"") is pleased to announce the voting results of the Annual General and Special Meeting of Shareholders held today. The detailed results of the votes for each matter acted upon are set out below:ItemDescription of MatterOutcomeVotedVoted (%)1.Fixing the number of directors at fiveApproved For 24,777,159Against 27,73299.89%0.11%2.The election of the following indi",CAD,DSLV.V,Newsfile - Denarius Metals Announces Voting Results of the Annual General and Special Meeting of Shareholders Held Today
fin_news_nlp/yahoo_cad_tickers_news,https://ca.finance.yahoo.com/news/discovery-harbour-announces-approval-share-110000439.html,"Vancouver, British Columbia--(Newsfile Corp. - June 2, 2023) - Discovery Harbour Resources Corp. (TSXV: DHR) (OTC Pink: DCHRF) (FSE: 4GW) (the ""Company"" or ""Discovery Harbour"") announces that, further to its news release of May 16, 2023, the TSX Venture Exchange (the ""Exchange"") has approved the consolidation of the issued and outstanding common shares of the Company (the ""Shares"") on the basis of one new Share (a ""Post-Consolidated Share"") for every ten currently-outstanding Shares (the ...",CAD,DHR.V,Newsfile - Discovery Harbour Announces Approval of Share Consolidation
fin_news_nlp/yahoo_cad_tickers_news,https://ca.finance.yahoo.com/news/dmg-blockchain-solutions-present-ld-233000208.html,"Vancouver, British Columbia--(Newsfile Corp. - June 1, 2023) - DMG Blockchain Solutions Inc. (TSXV: DMGI) (OTCQB: DMGGF) (FSE: 6AX) (""DMG""), a vertically integrated blockchain and cryptocurrency technology company, announces today that Sheldon Bennett, Chief Executive Officer and Steven Eliscu, Chief Operating Officer will present a corporate overview at the LD Micro Invitational XIII 2023 Conference. The conference is being held on June 6 - 8, 2023 at the Luxe Sunset Boulevard Hotel in ...",CAD,DMGI.V, - DMG Blockchain Solutions to Present at the LD Micro Invitational XIII 2023 Conference
fin_news_nlp/yahoo_cad_tickers_news,https://ca.finance.yahoo.com/news/finlay-minerals-announces-application-amend-234600182.html,"Finlay Minerals Ltd. (TSXV: FYL) (""Finlay"" or the ""Company"") reports that it is applying to the TSX Venture Exchange (the ""Exchange"") to amend the price of 26,444,748 warrants with an exercise price of $0.135 and expiring on July 9, 2023 issued under its private placement completed on July 9, 2021 (the ""Warrants""). See the Company's press release dated July 12, 2021 (available on SEDAR) for more information regarding the private placement.",CAD,FYL.V,CNW Group - FINLAY MINERALS ANNOUNCES AN APPLICATION TO AMEND WARRANT PRICE
fin_news_nlp/yahoo_cad_tickers_news,https://ca.finance.yahoo.com/news/gold79-amends-terms-private-placement-110000748.html,"Ottawa, Ontario--(Newsfile Corp. - June 2, 2023) - Gold79 Mines Ltd. (TSXV: AUU) (OTCQB: AUSVF) (""Gold79"" or the ""Company"") announces that it is amending the terms of its non-brokered private placement originally announced on May 10, 2023. The private placement will now raise gross proceeds of up to $1,000,000, comprising 33,333,333 units (each a ""Unit""), at $0.03 per Unit (the ""Offering""). Each Unit consists of one common share of the Company ...",CAD,AUU.V,Newsfile - Gold79 Amends Terms of Private Placement Financing
fin_news_nlp/yahoo_cad_tickers_news,https://ca.finance.yahoo.com/news/hemlo-explorers-extends-private-placement-200000943.html,"TORONTO, June 02, 2023 (GLOBE NEWSWIRE) -- Hemlo Explorers Inc. (the “Company”) (TSXV: HMLO) announces it is extending the closing of its non-brokered private placement (the ""Offering""), as announced on April 20, 2023, for an additional 30 days. All terms of the Offering remain unchanged, and the Offering remains subject to the approval of the TSX Venture Exchange. This news release does not constitute an offer to sell or a solicitation of an offer to sell any of the securities in the United Sta",CAD,HMLO.V,GlobeNewswire - Hemlo Explorers Extends Private Placement Offering
fin_news_nlp/yahoo_cad_tickers_news,https://ca.finance.yahoo.com/news/hemostemix-announces-unit-private-placement-005800704.html,"Calgary, Alberta--(Newsfile Corp. - June 1, 2023) - Hemostemix Inc. (TSXV: HEM) (OTCQB: HMTXF) (FSE: 2VF0) is pleased to announce a non-brokered private placement of up to 10 Million Units priced at $0.12 each, closing in tranches. Each Unit consists of one common share in the capital of the Company (""Common Share"") and one half of one common share purchase warrant (""Warrant""), with each full Warrant entitling the holder to acquire one ...",CAD,HEM.V,Newsfile - Hemostemix Announces Unit Private Placement
fin_news_nlp/yahoo_cad_tickers_news,https://ca.finance.yahoo.com/news/jericho-energy-ventures-ramp-equity-141500191.html,"Jericho Energy Ventures Inc. (TSXV:JEV)(OTC:JROOF)(FRA:JLM) (""Jericho"", ""JEV"" or the ""Company"") is pleased to announce that it has executed a Memorandum of Understanding (the ""MOU""), dated May 10, 2023, with Ramp Equity Capital Partners (""Ramp""), a private equity advisory fund focused on renewable energy globally, to bring the novel DCC™ zero-emission hydrogen boiler, developed by JEV's wholly owned subsidiary, Hydrogen Technologies (""HT""), to the",CAD,JEV.V,ACCESSWIRE - Jericho Energy Ventures and Ramp Equity Capital Partners Team Up to Bring Innovative Zero-Emission Hydrogen Boiler Technology to South Korea
fin_news_nlp/yahoo_cad_tickers_news,https://ca.finance.yahoo.com/news/dye-durham-announces-osc-relief-213000165.html,"Dye & Durham Limited (""Dye & Durham"" or the ""Company"") (TSX: DND) announced today that, in connection with the Company's ongoing substantial issuer bid (the ""Offer""), the Ontario Securities Commission (the ""OSC"") has granted an exemptive relief order permitting Dye & Durham to extend the Offer, if it determines to do so, without first taking up any common shares (the ""Common Shares"") previously deposited.",CAD,DND.TO,CNW Group - Dye & Durham Announces OSC Relief in Substantial Issuer Bid
fin_news_nlp/yahoo_cad_tickers_news,https://ca.finance.yahoo.com/news/inplay-oil-corp-announces-annual-050000026.html,"InPlay Oil Corp. (TSX: IPO) (OTCQX: IPOOF) (""InPlay"" or the ""Company"") announced today the voting results for the election of directors at its annual meeting of shareholders held on June 7, 2023 (the ""Meeting""). The following six nominees were elected as directors of InPlay to serve until the next annual meeting of shareholders or until their successors are elected or appointed, with common shares represented at the Meeting voting in favour of individual nominees as follows:",CAD,IPO.TO,CNW Group - InPlay Oil Corp. Announces Annual Meeting Voting Results for Election of Directors
fin_news_nlp/yahoo_cad_tickers_news,https://ca.finance.yahoo.com/news/petrotal-announces-aidecobap-illegal-river-060000825.html,"PetroTal urges a peaceful and immediate end to demonstrationsField production slowdown coincides with planned infrastructure tie-insCalgary, Alberta and Houston, Texas--(Newsfile Corp. - June 8, 2023) - PetroTal Corp. (TSX: TAL) (AIM: PTAL) (OTCQX: PTALF) (""PetroTal"" or the ""Company"") announces an illegal and violent river blockade against vessels that provide services to PetroTal.Illegal River BlockadeAs of June 3, 2023, The Indigenous Association for Development and Conservation of Bajo Puinah",CAD,TAL.TO,Newsfile - PetroTal Announces AIDECOBAP Illegal River Blockade
fin_news_nlp/yahoo_cad_tickers_news,https://ca.finance.yahoo.com/news/arrow-exploration-announces-cn-1-060000985.html,"Calgary, Alberta--(Newsfile Corp. - June 8, 2023) - Arrow Exploration Corp. (AIM: AXL) (TSXV: AXL) (""Arrow"" or the ""Company""), the high-growth operator with a portfolio of assets across key Colombian hydrocarbon basins, is pleased to provide an update on the Carrizales Norte-1 well (""CN-1""), an exploration well on the Tapir Block in the Llanos Basin of Colombia where Arrow holds a 50 per cent beneficial interest.CN-1Further to the Company's announcement on 30 May 2023, ...",CAD,AXL.V,Newsfile - Arrow Exploration Announces CN-1 Well Update
fin_news_nlp/yahoo_cad_tickers_news,https://ca.finance.yahoo.com/news/kiboko-gold-announces-results-2023-053900820.html,"VANCOUVER, British Columbia, June 08, 2023--Kiboko Gold Inc. (TSXV: KIB) (""Kiboko"" or the ""Company"") reported that at today’s annual general meeting of shareholders all resolutions detailed in the management information circular dated May 3, 2023, were approved, namely:",CAD,KIB.V,Business Wire - Kiboko Gold Announces Results of 2023 Annual General Meeting
fin_news_nlp/yahoo_cad_tickers_news,https://ca.finance.yahoo.com/news/diversified-royalty-tse-div-paying-100739815.html,"The board of Diversified Royalty Corp. ( TSE:DIV ) has announced that it will pay a dividend on the 30th of June, with...",CAD,DIV.TO,Simply Wall St. - Diversified Royalty (TSE:DIV) Is Paying Out A Dividend Of CA$0.02
fin_news_nlp/yahoo_cad_tickers_news,https://ca.finance.yahoo.com/news/hls-therapeutics-announces-agreement-polar-103000956.html,"HLS Therapeutics Inc. (""HLS"" or the ""Company"") (TSX: HLS) announces today that J. Spencer Lanthier and Don DeGolyer will not be standing for re-election to the HLS board of directors (the ""Board"") at HLS' upcoming annual meeting of shareholders to be held on June 16, 2023 (the ""AGM""). Mr. Lanthier's and Mr. DeGolyer's terms as directors will expire at the conclusion of the AGM. The number of directors to be elected at the AGM will be reduced from ten to eight.",CAD,HLS.TO,CNW Group - HLS Therapeutics Announces Agreement with Polar Asset Management Partners and Retirement of Two Directors from the Board of Directors
fin_news_nlp/yahoo_cad_tickers_news,https://ca.finance.yahoo.com/news/lacklustre-performance-driving-optiva-inc-103618484.html,"Unfortunately for some shareholders, the Optiva Inc. ( TSE:OPT ) share price has dived 43% in the last thirty days...",CAD,OPT.TO,Simply Wall St. - Lacklustre Performance Is Driving Optiva Inc.'s (TSE:OPT) 43% Price Drop
fin_news_nlp/yahoo_cad_tickers_news,https://ca.finance.yahoo.com/news/pet-valu-holdings-ltd-announces-132200573.html,"Pet Valu Holdings Ltd. (""Pet Valu"" or the ""Company"") (TSX: PET), the leading Canadian specialty retailer of pet food and pet-related supplies, announced today that the previously announced secondary bought deal offering (the ""Offering"") of 4,690,000 common shares of the Company (the ""Common Shares"") by PV Holdings S.à r.l., Roark Capital Partners II AIV AG, L.P., RCPS Equity Cayman LP and Roark Capital Partners Parallel II AIV AG, L.P. (collectively, the ""Selling Shareholders"") at a price of $32",CAD,PET.TO,CNW Group - Pet Valu Holdings Ltd. Announces Closing of C$150.3 Million Secondary Bought Deal Offering
fin_news_nlp/yahoo_cad_tickers_news,https://ca.finance.yahoo.com/news/stantec-acquire-environmental-systems-design-104500722.html,"EDMONTON, Alberta and NEW YORK and CHICAGO, June 08, 2023 (GLOBE NEWSWIRE) -- TSX, NYSE: STN Stantec, a global leader in sustainable design and engineering, has signed an agreement to acquire Environmental Systems Design, Inc. (ESD), a 270-person engineering firm headquartered in Chicago. Founded in 1967, ESD has built a reputation for excellence and innovation in high-performance design with a roster of industry-leading clients. The terms of the transaction are not disclosed. The acquisition of",CAD,STN.TO,"GlobeNewswire - Stantec to acquire Environmental Systems Design, Inc., a leading building engineering design firm specializing in mission critical and data center expertise"
fin_news_nlp/yahoo_cad_tickers_news,https://ca.finance.yahoo.com/news/integra-announces-additional-oxide-drill-104500876.html,"VANCOUVER, British Columbia, June 08, 2023 (GLOBE NEWSWIRE) -- Integra Resources Corp. (“Integra” or the “Company”) (TSXV: ITR; NYSE American: ITRG) is pleased to announce drill results from 20 additional drill holes, representing 4,960 meters (“m”), from the recently completed stockpile drill program at the DeLamar Project (“DeLamar” or the “Project”) located in southwestern Idaho. The Company is also pleased to provide a corporate update regarding several of its properties located in western N",CAD,ITR.V,"GlobeNewswire - Integra Announces Additional Oxide Drill Results From Stockpile Drill Program at DeLamar, Including 0.70 g/t AuEq Over 85 m and 0.60 g/t AuEq Over 44 m"
fin_news_nlp/yahoo_cad_tickers_news,https://ca.finance.yahoo.com/news/lifeists-cannmart-successfully-launches-multi-110000462.html,"CannMart’s In-house brand Roilty sells-out all stock from initial purchase order of multi-pack cannabis concentrate in British ColumbiaTORONTO, June 08, 2023 (GLOBE NEWSWIRE) -- Lifeist Wellness Inc. (“Lifeist” or the “Company”) (TSXV: LFST) (FRANKFURT: M5B) (OTCMKTS: LFSWF), a health-tech company that leverages advancements in science and technology to build breakthrough companies that transform human wellness, is pleased to announce the highly successful launch of its premium multi-pack cannab",CAD,LFST.V,GlobeNewswire - Lifeist's CannMart Successfully Launches Multi-Pack Concentrates in British Columbia
fin_news_nlp/yahoo_cad_tickers_news,https://ca.finance.yahoo.com/news/luca-mining-set-benefit-additions-100000805.html,Luca Mining Corp. (“Luca” or the “Company” (TSX-V: LUCA; OTCQX: LUCMF; Frankfurt: TSGA) is pleased to announce the addition of two new members to its Board of Directors.,CAD,LUCA.V,"News Direct - Luca Mining Set to Benefit from New Additions to Board of Directors, and Announces Grant of Stock Options, Appointment of Investors Relations Advisors, and Extension of the Private Placement"
fin_news_nlp/yahoo_cad_tickers_news,https://ca.finance.yahoo.com/news/estimating-intrinsic-value-acadian-timber-114845386.html,"Key Insights Using the 2 Stage Free Cash Flow to Equity, Acadian Timber fair value estimate is CA$14.80 Current share...",CAD,ADN.TO,Simply Wall St. - Estimating The Intrinsic Value Of Acadian Timber Corp. (TSE:ADN)
fin_news_nlp/yahoo_cad_tickers_news,https://ca.finance.yahoo.com/news/alithya-reports-strong-revenue-growth-111000868.html,"Alithya Group inc. (TSX: ALYA) (NASDAQ: ALYA) (""Alithya"" or the ""Company"") reported today its results for the fourth quarter and fiscal 2023 ended March 31, 2023. All amounts are in Canadian dollars unless otherwise stated.",CAD,ALYA.TO,CNW Group - Alithya Reports Strong Revenue Growth and Financial Performance for Fourth Quarter and Fiscal 2023
fin_news_nlp/yahoo_cad_tickers_news,https://ca.finance.yahoo.com/news/bmo-ranks-first-customer-satisfaction-103000498.html,BMO has received the highest score in the J.D. Power 2023 Canada Online Banking Satisfaction Study. The study analyzes feedback from thousands of online banking customers across Canada and awarded BMO top marks in four key categories:,CAD,BMO.TO,CNW Group - BMO Ranks First in Customer Satisfaction with Online Banking in the J.D. Power 2023 Canada Online Banking Satisfaction Study
fin_news_nlp/yahoo_cad_tickers_news,https://ca.finance.yahoo.com/news/bitfarms-participate-2023-cantor-fitzgerald-110000502.html,"This news release constitutes a “designated news release” for purposes of the Company’s prospectus supplement dated August 16, 2021, to its short form base shelf prospectus dated August 12, 2021.TORONTO, Ontario and BROSSARD, Québec, June 08, 2023 (GLOBE NEWSWIRE) -- Bitfarms Ltd. (NASDAQ: BITF//TSX: BITF), a global vertically integrated Bitcoin mining company, announced that management will be participating in the 2023 Cantor Fitzgerald Technology Conference held on June 14 - 15 in New York Cit",CAD,BITF.TO,GlobeNewswire - Bitfarms to Participate in the 2023 Cantor Fitzgerald Technology Conference on June 14 - 15
fin_news_nlp/yahoo_cad_tickers_news,https://ca.finance.yahoo.com/news/canopy-growth-launches-expanded-product-113000846.html,"Canopy Growth Corporation (""Canopy Growth"" or the ""Company"") (TSX: WEED) (NASDAQ: CGC), a world-leading cannabis company, today announced the expansion of the Company's commitment to delivering high quality Quebec sourced cannabis for consumers across la belle province.",CAD,WEED.TO,CNW Group - CANOPY GROWTH LAUNCHES EXPANDED PRODUCT PORTFOLIO FOR THE QUEBEC MARKET
fin_news_nlp/yahoo_cad_tickers_news,https://ca.finance.yahoo.com/news/coveo-unleashes-groundbreaking-genai-enterprise-123000324.html,"Coveo moves beyond the hype - removing the enterprise risk out of Generative AIMONTREAL and SAN FRANCISCO, June 08, 2023 (GLOBE NEWSWIRE) -- Coveo (TSX:CVO), a leader in AI platforms that transform digital experiences with intelligent search, recommendations, 1:1 personalization, and merchandising, announced today the official field launch of the Coveo Relevance Generative AnsweringTM Design Partner Program with 18 large global customers, giving them access to the beta solution for testing at en",CAD,CVO.TO,GlobeNewswire - Coveo Unleashes Groundbreaking GenAI Enterprise Product with Customer Design Partners and Exclusive Pricing Offer for Early Adopters
fin_news_nlp/yahoo_cad_tickers_news,https://ca.finance.yahoo.com/m/dba90586-26ba-3691-ae9c-5e79e575426e/these-2-dividend-stocks-yield.html,"Viatris (NASDAQ: VTRS) and Enbridge (NYSE: ENB) are two stocks with high yields that look fairly safe right now.  Viatris makes branded and generic drugs, including the cholesterol medicine Lipitor.  Not only did Viatris' business not grow last year, but sales of $16.3 billion were also down 9% from the previous year.",CAD,ENB.TO,Motley Fool - These 2 Dividend Stocks Yield 5% -- and They Aren't Risky Buys
fin_news_nlp/yahoo_cad_tickers_news,https://ca.finance.yahoo.com/news/ero-copper-announces-nickel-sulphide-112200259.html,Figure 1 Rougher stage nickel recovery versus grind size. Figure 2 Drill core from the VB Zone (hole VB-41 at 392.4 meters) highlighting loop textured pentlandite. Figure 3 Drill core from the VB Zone (hole VB-41) highlighting high-grade massive sulphide within the zone from 385.0 to 396.5 meters. Figure 4 Brecciated and patchy net-textured sulphides shown in detail for hole LZ-32 (~300 meters downhole) showing both pentlandite and pyrrhotite Figure 5 Umburana System - Plan Map Figure 6 VB Zone,CAD,ERO.TO,"GlobeNewswire - Ero Copper Announces Update on Nickel Sulphide Exploration Program — Intercepts 11.2 Meters Grading 1.86% Nickel, including 5.0 Meters Grading 3.71% Nickel"
fin_news_nlp/yahoo_cad_tickers_news,https://ca.finance.yahoo.com/news/eupraxia-pharmaceuticals-doses-first-patient-110000496.html,"Eupraxia Pharmaceuticals Inc. (""Eupraxia"" or the ""Company"") (TSX: EPRX), a Phase 2 clinical-stage biotechnology company with an innovative drug delivery technology platform, today announced that it has commenced dosing patients in its phase 1b/2a trial that is evaluating EP-104GI's safety, tolerability and efficacy as a treatment for eosinophilic esophagitis (""EoE"").",CAD,EPRX.TO,CNW Group - Eupraxia Pharmaceuticals Doses First Patient in Phase 1b/2a Eosinophilic Esophagitis Trial
