source,url,description,country,company,title
fin_news_nlp/yahoo_cad_tickers_news,https://ca.finance.yahoo.com/news/gmg-receives-regulatory-approval-enable-130000595.html,"Brisbane, Queensland, Australia--(Newsfile Corp. - February 13, 2023) - Graphene Manufacturing Group Ltd. (TSXV: GMG) (""GMG"" or the ""Company"") is pleased to announce the full and final approval of all GMG's Graphene products from the Australian Industrial Chemicals Introduction Scheme (AICIS) of the Australian Government Department of Health and Aged Care under Assessment statement CA09624. AICIS approval allows GMG to significantly increase the production and sale of GMG graphene-enhanced produ",CAD,GMG.V,Newsfile - GMG Receives Regulatory Approval to Enable Significant Commercial Sales
fin_news_nlp/yahoo_cad_tickers_news,https://ca.finance.yahoo.com/news/grizzly-adds-greenwood-bc-project-140000881.html,"Edmonton, Alberta--(Newsfile Corp. - February 13, 2023) - Grizzly Discoveries Inc. (TSXV: GZD) (FSE: G6H) (OTCQB: GZDIF) (""Grizzly"" or the ""Company"") is pleased to announce that it has entered into an agreement with Zimtu Capital Corp. (""Zimtu"") to acquire ten mineral claims in the Beaverdell area in the Greenwood Mining District of Southeast British Columbia (BC) for a deemed price of $15,000. The Company has also engaged Integrous Capital Partners (""ICP"") to provide capital ...",CAD,GZD.V,"Newsfile - Grizzly Adds to Greenwood, BC Project with Nearby Beaverdell Properties and Engages Integrous Capital Partners"
fin_news_nlp/yahoo_cad_tickers_news,https://ca.finance.yahoo.com/news/japan-gold-announces-2023-exploration-133000724.html,"Vancouver, British Columbia--(Newsfile Corp. - February 13, 2023) - Japan Gold Corp. (TSXV: JG) (OTCQB: JGLDF) (the ""Company"") is pleased to announce the 2023 exploration program over its 2,920 sq km Japanese portfolio of mineral rights.HighlightsBarrick selected six projects for further advancement with drilling planned to commence in Kyushu in Q1 2023.Barrick have also selected 1 new project and 3 project areas for further evaluation during 2023. Barrick solely funds the Barrick Alliance proje",CAD,JG.V,Newsfile - Japan Gold Announces 2023 Exploration Plan
fin_news_nlp/yahoo_cad_tickers_news,https://ca.finance.yahoo.com/news/mako-mining-intersects-33-91g-120000826.html,"Mako Mining Corp. (TSXV: MKO) (OTCQX: MAKOF) (""Mako"" or the ""Company"") has received additional high-grade results from its recent definition and expansion drilling program at the Las Conchitas area on its wholly owned San Albino-Murra property. The Las Conchitas area is located immediately south of the San Albino Mine which is currently in commercial production. The geology at Las Conchitas is very similar to San Albino consisting of gently dipping, stacked, 1-3 meter (m) wide, high grade gold q",CAD,MKO.V,"CNW Group - Mako Mining Intersects 33.91g/t Gold over 1.7m Estimated True Width (ETW) at Las Conchitas Central, 12.73 g/t Au over 4.2m ETW at Las Conchitas South and Multiple High Grade Silver Intercepts up to 3,792.0 g/t Silver over 1.0m across Las Conchitas"
fin_news_nlp/yahoo_cad_tickers_news,https://ca.finance.yahoo.com/news/neo-battery-materials-signs-collaboration-140000039.html,"VANCOUVER, British Columbia, Feb. 13, 2023 (GLOBE NEWSWIRE) -- (TSXV: NBM) (OTCQB: NBMFF) Signed Collaboration Agreement with NanoRial Technologies Ltd., a Developer of Well-Dispersed Carbon Nanotubes (CNT) for Lithium-Ion Battery Performance ImprovementPurpose to Optimize Performance of NEO’s Silicon Anode Materials with CNT as Effective Nanocoating MaterialsIntend to Jointly Apply to Canadian Governmental, Non-Dilutive Funding Programs NEO Battery Materials Ltd. (“NEO” or the “Company”), a low",CAD,NBM.V,GlobeNewswire - NEO Battery Materials Signs Collaboration Agreement with High-Performance Carbon Nanotube Developer for Silicon Anode Optimization
fin_news_nlp/yahoo_cad_tickers_news,https://ca.finance.yahoo.com/news/rockhaven-appoints-loralee-johnstone-director-134000962.html,"Rockhaven Resources Ltd.(TSXV:RK) (""Rockhaven"") is pleased to announce that Ms. Loralee Johnstone has been appointed to the Rockhaven Board of Directors.",CAD,RK.V, - Rockhaven Appoints Loralee Johnstone as a Director and Grants Incentive Stock Option
fin_news_nlp/yahoo_cad_tickers_news,https://ca.finance.yahoo.com/news/scottie-resources-announces-6-5-000900752.html,"Scottie Resources Corp. (TSXV: SCOT) (OTCQB: SCTSF) (the ""Company"") is pleased to announce that it has entered into an agreement pursuant to which Cormark Securities Inc., as sole underwriter (the ""Underwriter""), in connection with a ""bought deal"" private placement of: (i) 11,429,000 common shares of the Company that qualify as ""flow-through shares"" (within the meaning of subsection 66(15) of the Income Tax Act (Canada) (the ""FT Shares"") at a price of $0.35 per FT Share for gross proceeds of $4,",CAD,SCOT.V,CNW Group - Scottie Resources Announces $6.5 Million Private Placement of Flow-Through Shares and Common Shares
fin_news_nlp/yahoo_cad_tickers_news,https://ca.finance.yahoo.com/news/tag-oil-provides-corporate-140000220.html,"TAG Oil Ltd. (TSXV: TAO) (OTCQX: TAOIF) (""TAG Oil"" or the ""Company"") is pleased to confirm that the Company's Phase 1 re-completion and evaluation operations of the BED 1-7 vertical well are progressing according to plan. TAG Oil continues to prepare the well for the hydraulic fracture stimulation that is expected to occur around the end of February. The Company anticipates providing well flow results from these operations in March 2023.",CAD,TAO.V,CNW Group - TAG Oil Provides Corporate Update
fin_news_nlp/yahoo_cad_tickers_news,https://ca.finance.yahoo.com/news/vision-lithium-inc-webcast-live-133500236.html,"Company invites individual and institutional investors, as well as advisors and analysts, to attend real-time, interactive presentations on VirtualInvestorConferences.comVAL-D’OR, Québec, Feb. 13, 2023 (GLOBE NEWSWIRE) -- Vision Lithium Inc. (TSXV: VLI) (OTCQB: ABEPF) (FSE: 1AJ2) (the “Company” or “Vision Lithium”) is pleased to announce Yves Rougerie, President and CEO will present live at VirtualInvestorConferences.com on February 2023. DATE: February 15th, 2023TIME: 10:00 AM ETLINK: https://b",CAD,VLI.V,GlobeNewswire - Vision Lithium Inc. to Webcast Live at VirtualInvestorConferences.com February 15th
fin_news_nlp/yahoo_cad_tickers_news,https://ca.finance.yahoo.com/news/argo-near-term-oil-production-142300482.html,"Toronto, Ontario--(Newsfile Corp. - February 13, 2023) - Argo Gold Inc. (CSE: ARQ) (OTCQB: ARBTF) (XFRA, XSTU, XBER: A2ASDS) (""Argo"") is pleased to announce that the near-term oil production at the Sparky oil wells is on track for before Spring break-up at Lindbergh and post Spring break-up at Lloyd.Surface installations at Lindbergh are in progress for drilling to commence and be completed prior to Spring break-up. Argo's 37.5% participation in the Lindbergh oil well is expected to yield 55 to",CAD,ARQ.CN,Newsfile - Argo Update on Near-Term Oil Production
fin_news_nlp/yahoo_cad_tickers_news,https://ca.finance.yahoo.com/news/asante-gold-announces-amended-terms-134100575.html,"VANCOUVER, British Columbia, Feb. 13, 2023 (GLOBE NEWSWIRE) -- Asante Gold Corporation (CSE:ASE | GSE:ASG | FRANKFURT:1A9 | U.S.OTC:ASGOF) (""Asante"" or the ""Company"") today announced that it has amended the terms of a share purchase and sale agreement dated April 24, 2022, as amended (the ""Purchase Agreement""), among the Company, KG Africa B.V. (the ""Vendor""), an indirect subsidiary of Kinross Gold Corporation (""Kinross""), and Kinross, pursuant to which, among other things, the Company acquired",CAD,ASE.CN, - Asante Gold Announces Amended Terms for Second Tranche Payment for Chirano Gold Mine
fin_news_nlp/yahoo_cad_tickers_news,https://ca.finance.yahoo.com/news/cannabix-technologies-test-contactless-alcohol-134500888.html,"Cannabix has developed a contactless alcohol breathalyzer for employers and vehicles Cannabix Contactless Alcohol Breathalyzer Contactless Alcohol Breathalyzer for workplace and vehicles (Cannabix Technologies Inc) VANCOUVER, British Columbia, Feb. 13, 2023 (GLOBE NEWSWIRE) -- Cannabix Technologies Inc. (CSE: BLO) (OTC PINK: BLOZF) (the “Company or Cannabix”) developer of breath testing devices for law enforcement and the workplace reports that Friedel, LLC (“Friedel Clinic”) based in Montana wi",CAD,BLO.CN,GlobeNewswire - Cannabix Technologies to Test Contactless Alcohol Breathalyzer (CAB) in Montana
fin_news_nlp/yahoo_cad_tickers_news,https://ca.finance.yahoo.com/news/global-crypto-based-exchange-traded-130000579.html,"Fineqia International Inc.'s (the ""Company"" or ""Fineqia"") (CSE: FNQ) (OTC: FNQQF) (Frankfurt: FNQA) analysis of global Exchange Traded Products (ETPs) with cryptocurrencies as underlying assets, revealed a 39% increase in the Assets Under Management (AUM) value during the month of Jan, while the cryptocurrency market value increased by 33% during the same period, reflecting an 18% premium in ETP values due to investment inflows and asset value increase relative to overall crypto asset valuations",CAD,FNQ.CN,CNW Group - Global Crypto Based Exchange Traded Products AUM Increased 39% in Jan. as Crypto Markets Top $1 Trillion
fin_news_nlp/yahoo_cad_tickers_news,https://www.yahoo.com/news/rep-lauren-boebert-raged-against-122535340.html,"Lauren Boebert railed against wokeness at the Super Bowl after Sheryl Lee Ralph performed ""Lift Every Voice and Sing.""",CAD,?err=404&err_url=https%3A%2F%2Fca.finance.yahoo.com%2Fquote%2FGDN.CN,Celebrity - 
fin_news_nlp/yahoo_cad_tickers_news,https://ca.finance.yahoo.com/news/im-cannabis-provides-panaxia-transaction-140000725.html,"IM Cannabis Corp. (the ""Company"" or ""IMC"") (NASDAQ: IMCC) (CSE: IMCC), an international medical cannabis company, provides an update on its previously announced transaction with Panaxia Pharmaceutical Industries Israel Ltd. and Panaxia Logistics Ltd., part of the Panaxia Labs Israel, Ltd. group of companies, (collectively, ""Panaxia""). Under the transaction terms, the Company purchased the home-delivery services and an online retail footprint operating under the name ""Panaxia-to-the-Home"" in Isra",CAD,IMCC.CN,CNW Group - IM Cannabis Provides an Update on Panaxia Transaction
fin_news_nlp/yahoo_cad_tickers_news,https://ca.finance.yahoo.com/news/green-organic-dutchman-announces-name-133000664.html,"The Green Organic Dutchman Holdings Ltd. (the ""Company"" or ""TGOD"") (CSE: TGOD) (US-OTC: TGODF), a sustainable global cannabis company and leading producer of premium cannabis brands, is pleased to announce that its board of directors (the ""Board"") has authorized a change in the Company's name from ""The Green Organic Dutchman Holdings Ltd."" to ""BZAM Ltd."" (the ""Name Change""), subject to regulatory approval including that of the Canadian Securities Exchange (the ""CSE"").",CAD,TGOD.CN,CNW Group - The Green Organic Dutchman Announces Name Change and New Chairman
fin_news_nlp/yahoo_cad_tickers_news,https://ca.finance.yahoo.com/news/ubique-provides-nlzm-project-announces-143500273.html,"/ Ubique Minerals Limited (""Ubique"" or the ""Company"") (CSE:UBQ) announces updates on its Namib Lead and Zinc Mining Proprietary Ltd. project (the ""NLZM Project""). The Company has signed Non-Disclosure Agreements (""NDAs"") with 6 potential strategic partners towards securing offtake contracts for the production output from the NLZM Project.",CAD,UBQ.CN,ACCESSWIRE - Ubique Provides NLZM Project Update and Announces Private Placement
fin_news_nlp/yahoo_cad_tickers_news,https://ca.finance.yahoo.com/news/cargojet-announces-timing-fourth-quarter-163000657.html,"Cargojet Inc (TSX: CJT.UN) in conjunction with the release of its Fourth Quarter and Year End 2022 Financial Results, will host a conference call at 8:30 a.m. Eastern Standard Time (5:30a.m. Pacific Daylight Time) on Monday March 6, 2023. Fourth quarter and Year End 2022 results will be released, prior to the market opening on Monday, March 6, 2023. The financial results will be released by newswire as well as filed with SEDAR. The results will also be available on our website.",CAD,CJT.TO,CNW Group - CARGOJET ANNOUNCES TIMING OF FOURTH QUARTER & YEAR END RESULTS & CONFERENCE CALL
fin_news_nlp/yahoo_cad_tickers_news,https://ca.finance.yahoo.com/news/kinross-gold-kgc-stock-undervalued-144002341.html,"Here at Zacks, our focus is on the proven Zacks Rank system, which emphasizes earnings estimates and estimate revisions to find great stocks. Nevertheless, we are always paying attention to the latest value, growth, and momentum trends to underscore strong picks.",CAD,K.TO,Zacks - Is Kinross Gold (KGC) Stock Undervalued Right Now?
fin_news_nlp/yahoo_cad_tickers_news,https://ca.finance.yahoo.com/news/wall-street-analysts-think-lightspeed-145502570.html,"The consensus price target hints at a 79.7% upside potential for Lightspeed Commerce Inc. (LSPD). While empirical research shows that this sought-after metric is hardly effective, an upward trend in earnings estimate revisions could mean that the stock will witness an upside in the near term.",CAD,LSPD.TO,Zacks - Wall Street Analysts Think Lightspeed Commerce Inc. (LSPD) Could Surge 79.71%: Read This Before Placing a Bet
fin_news_nlp/yahoo_cad_tickers_news,https://ca.finance.yahoo.com/news/company-news-feb-13-2023-143702848.html,"Companies in The News Are: NWL,MGA,ESNT,SPB",CAD,MG.TO,"Zacks - Company News for Feb 13, 2023"
fin_news_nlp/yahoo_cad_tickers_news,https://ca.finance.yahoo.com/news/allied-fsd-magnet-52-week-154200540.html,Allied Copper Corp. (V.CPR) hit a new 52-week high of 32 cents Monday. No news stories available today. FSD ...,CAD,MAGT.TO," - Allied, FSD, Magnet at 52-Week Highs"
fin_news_nlp/yahoo_cad_tickers_news,https://ca.finance.yahoo.com/news/3-insurers-set-outperform-estimates-135601602.html,"Better pricing, exposure growth, accelerated digitization and sturdy capital are expected to help AIG, MFC and PRI outperform Q4 earnings estimates.",CAD,MFC.TO,Zacks - 3 Insurers Set to Outperform Estimates This Earnings Season
fin_news_nlp/yahoo_cad_tickers_news,https://ca.finance.yahoo.com/news/wall-street-analysts-think-nutrien-143002680.html,"Based on the average brokerage recommendation (ABR), Nutrien (NTR) should be added to one's portfolio. Wall Street analysts' overly optimistic recommendations cast doubt on the effectiveness of this highly sought-after metric. So, is the stock worth buying?",CAD,NTR.TO,Zacks - Wall Street Analysts Think Nutrien (NTR) Is a Good Investment: Is It?
fin_news_nlp/yahoo_cad_tickers_news,https://ca.finance.yahoo.com/news/why-earnings-season-could-great-133401518.html,Restaurant Brands (QSR) is seeing favorable earnings estimate revision activity and has a positive Zacks Earnings ESP heading into earnings season.,CAD,QSR.TO,Zacks - Why Earnings Season Could Be Great for Restaurant Brands (QSR)
fin_news_nlp/yahoo_cad_tickers_news,https://ca.finance.yahoo.com/news/ritchie-ceo-promotes-magical-iaa-115800677.html,"(Bloomberg) -- Ritchie Bros Auctioneers Inc. has the potential to double its share price if it takes over IAA Inc., its chief executive officer said as she launches a final push to fend off opposition from some shareholders to the deal.Most Read from BloombergChina Ready to Down Object Flying Near Naval Base: PaperChina Says US Balloons Trespassed Over 10 Times Since Early 2022US Fighter Jet Downs Fourth Aerial Object Over North AmericaObject Shot Down Over Canada in Escalating Aerial DramaMajor",CAD,RBA.TO,Bloomberg - Ritchie CEO Promotes ‘Magical’ IAA Deal Ahead of Vote Showdown
fin_news_nlp/yahoo_cad_tickers_news,https://ca.finance.yahoo.com/news/1-b2gold-buy-sabina-gold-115722930.html,"B2Gold Corp will acquire Sabina Gold & Silver Corp in a deal valued at C$1.1 billion ($823.66 million), the company said on Monday, in a move that is likely to boost the Canadian gold miner's portfolio.  Shares of B2Gold were down 3.45% at C$3.50, while Sabina shares rose 11.4% at C$1.76.  This is the Vancouver-based company's second acquisition within a year, after it took Oklo Resources Ltd into its fold to gain access to the Australia-based firm's prospective mining assets in Mali, West Africa.",CAD,SBB.TO, - UPDATE 2-B2Gold to buy Sabina Gold & Silver in $824 mln deal
fin_news_nlp/yahoo_cad_tickers_news,https://ca.finance.yahoo.com/news/zacks-analyst-blog-highlights-sap-134101995.html,"SAP, Northrop Grumman, TC Energy, Extra Space Storage and MGM Resorts International are part of the Zacks top Analyst Blog.",CAD,TRP.TO,"Zacks - The Zacks Analyst Blog Highlights SAP, Northrop Grumman, TC Energy, Extra Space Storage and MGM Resorts International"
fin_news_nlp/yahoo_cad_tickers_news,https://ca.finance.yahoo.com/news/brunswick-exploration-announces-increase-bought-154400791.html,"NOT FOR DISTRIBUTION TO UNITED STATES NEWSWIRE SERVICES OR FOR DISSEMINATION IN THE UNITED STATES MONTREAL,, Feb. 13, 2023 (GLOBE NEWSWIRE) -- Brunswick Exploration Inc. (“BRW” or the ""Company"") is pleased to announce that due to significant investor demand, the Company has amended its agreement with Red Cloud Securities Inc. (“Red Cloud”) to increase the gross proceeds from the underwritten portion of its previously announced bought deal private placement (the “Brokered Offering”) from C$5.0 mi",CAD,BRW.V,GlobeNewswire - Brunswick Exploration Announces Increase of Bought Deal Private Placement to C$6.0 Million
fin_news_nlp/yahoo_cad_tickers_news,https://ca.finance.yahoo.com/news/clip-money-inc-announces-closing-145600033.html,"TORONTO, Feb. 13, 2023 (GLOBE NEWSWIRE) -- Clip Money Inc. (TSX-V: CLIP) (OTCQB: CLPMF) (“Clip Money” or the “Company”), a company that operates a multi-bank self-service deposit system for businesses, is pleased to announce that it has closed the second tranche (the “Second Tranche”) of a non-brokered private placement (the “Private Placement”) of 3,883,760 units of the Company (each a “Unit”) at a price of CAD$0.45 per Unit for gross proceeds of US$1,307,956.89 (the U.S. dollar equivalent of C",CAD,CLIP.V,GlobeNewswire - Clip Money Inc. Announces Closing of Final Tranche of Non-Brokered Private Placement
fin_news_nlp/yahoo_cad_tickers_news,https://ca.finance.yahoo.com/news/dfr-gold-inc-announces-10-154200413.html,"DFR Gold Inc. (TSXV: DFR) (""DFR"" or the ""Company"") is pleased to announce the start of a 10,000 metre drilling program (the ""Drilling Program"") on the Cascades Project in Burkina Faso, West Africa. The Drilling Program represents the first part of a longer-term plan to systematically test exploration targets that have now been identified within the mineralised corridor at the Cascades Project.",CAD,DFR.V,"CNW Group - DFR Gold Inc. Announces 10,000 metre Resource Expansion Drilling programme at Cascades Project"
fin_news_nlp/yahoo_cad_tickers_news,https://ca.finance.yahoo.com/news/stocks-play-discovery-silver-corp-152800962.html,Has filed on SEDAR its National Instrument 43-101 technical report titled Cordero Silver Project – NI ...,CAD,DSV.V, - Stocks in play: Discovery Silver Corp.
fin_news_nlp/yahoo_cad_tickers_news,https://ca.finance.yahoo.com/news/gladiator-metals-corp-announces-tsx-170200419.html,"Vancouver, British Columbia--(Newsfile Corp. - February 13, 2023) - Gladiator Metals Corp. (TSXV: GLAD) (""Gladiator"" or the ""Company"") is pleased to announce that, further to its news release on November 14, 2022, it has received final approval from the TSX Venture Exchange (the ""TSX-V"") for the Mineral Property Option Agreement (the ""Option Agreement"") dated November 8, 2022 with H. Coyne & Sons Ltd. (the ""Optionor"") whereby the Optionor has granted the Company the right ...",CAD,GLAD.V, - Gladiator Metals Corp. Announces TSX-V Final Approval for Option Agreement and Officer Changes
fin_news_nlp/yahoo_cad_tickers_news,https://ca.finance.yahoo.com/news/reyna-silver-announces-closing-first-155600846.html,"NOT FOR DISTRIBUTION TO UNITED STATES NEWSWIRE SERVICES OR FOR DISSEMINATION IN THE UNITED STATES VANCOUVER, British Columbia and HONG KONG, Feb. 13, 2023 (GLOBE NEWSWIRE) -- Reyna Silver Corp. (TSXV: RSLV; OTCQB: RSNVF; FRA: 4ZC) (“Reyna” or the ""Company"") is pleased to announce the closing of the first tranche of its previously announced “bought deal” private placement (the “Offering”) of units for gross proceeds of C$4,999,800 (the “LIFE Tranche”). Under the LIFE Tranche, the Company sold 16,",CAD,RSLV.V, - Reyna Silver Announces Closing of First Tranche of Bought Deal Financing for C$4.9 Million
fin_news_nlp/yahoo_cad_tickers_news,https://ca.finance.yahoo.com/news/snipp-gambit-launches-scuti-leading-160000748.html,"Gambit Rewards, Inc. (Gambit), Loyalty Gaming pioneer and a division of Snipp Interactive (TSX-V:SPN; OTCPK:SNIPF), announced today the commercial launch of their integration with Scuti, a partnership previously announced in July of 2022. The partnership provides an exchange where players can purchase items from the Scuti marketplace and use their brand-fueled rewards to place free bets on Gambit's free sports and iGaming platform.",CAD,SPN.V,"ACCESSWIRE - Snipp’s Gambit Launches With Scuti, a Leading Brand-Fueled Rewards Platform"
fin_news_nlp/yahoo_cad_tickers_news,https://ca.finance.yahoo.com/news/transition-metals-options-homathko-property-170011420.html,Transition Metals Corp CEO Scott McLean joined Steve Darling from Proactive to share news the company is moving along its 100% interest in the Homathko Gold Project located in British Columbia to A...,CAD,XTM.V,News Direct - Transition Metals options Homathko Property to Aurum Lake Mining
fin_news_nlp/yahoo_cad_tickers_news,https://ca.finance.yahoo.com/news/adamant-holding-complements-terms-closing-172000975.html,"Vancouver, British Columbia--(Newsfile Corp. - February 13, 2023) - Adamant Holding Inc. (CSE: ADMT) (FSE: U060) (OTC Pink: UCCPF) (""ADMT"" or the ""Company"") today announced its 51% acquisition of Europronet d.o.o., located in Bosnia-Herzegovina. Europronet d.o.o. is worth US$2,900,000 (two million nine hundred thousand US dollars). The transaction of 51% of the outstanding shares of Europronet will be paid in cash in different installments during next three years; It will not be any ...",CAD,ADMT.CN,Newsfile - Adamant Holding Complements the Terms for the Closing of Share Purchase Agreement with Europronet d.o.o.
fin_news_nlp/yahoo_cad_tickers_news,https://ca.finance.yahoo.com/news/2023-stock-losers-could-still-153000073.html,"The rebound of three stock losers in 2023 are almost certain, because the businesses are thriving. The post 2023’s Stock Losers That Could Still Turn the Corner (and They’re on Sale Now) appeared first on The Motley Fool Canada.",CAD,ATZ.TO,The Motley Fool - 2023’s Stock Losers That Could Still Turn the Corner (and They’re on Sale Now)
fin_news_nlp/yahoo_cad_tickers_news,https://ca.finance.yahoo.com/news/b2gold-buy-sabina-gold-silver-143546963.html,(Bloomberg) -- B2Gold Corp. has agreed to buy Sabina Gold & Silver Corp. in a C$1.1 billion ($820 million) stock deal that will give the miner ownership of several gold developments in northern Canada.Most Read from BloombergChina Ready to Down Object Flying Near Naval Base: PaperChina Says US Balloons Trespassed Over 10 Times Since Early 2022US Fighter Jet Downs Fourth Aerial Object Over North AmericaObject Shot Down Over Canada in Escalating Aerial DramaUS Fighters Down More Objects as Tension,CAD,BTO.TO,Bloomberg - B2Gold to Buy Sabina Gold & Silver in $820 Million Deal
fin_news_nlp/yahoo_cad_tickers_news,https://ca.finance.yahoo.com/news/hydrogen-stocks-lithium-stocks-better-163000538.html,"Hydrogen and lithium stocks are excellent options in for long-term plays but remain speculative investments, according to some market analysts. The post Are Hydrogen Stocks or Lithium Stocks Better for Long-Term Investors? appeared first on The Motley Fool Canada.",CAD,BLDP.TO,The Motley Fool - Are Hydrogen Stocks or Lithium Stocks Better for Long-Term Investors?
fin_news_nlp/yahoo_cad_tickers_news,https://ca.finance.yahoo.com/news/passive-income-stocks-soaring-too-150000864.html,Passive-income stocks like Cenovus Energy (TSX:CVE) have gotten a lot more expensive over the last 12 months. Is the party over? The post Passive-Income Stocks Have Been Soaring: Is it Too Late to Buy? appeared first on The Motley Fool Canada.,CAD,CVE.TO,The Motley Fool - Passive-Income Stocks Have Been Soaring: Is it Too Late to Buy?
fin_news_nlp/yahoo_cad_tickers_news,https://ca.finance.yahoo.com/news/ceres-global-ag-corp-names-170000404.html,"Ceres Global Ag Corp. (TSX: CRP) (""Ceres"" or the ""Corporation"") has announced that Glen Goldman has stepped down as Vice President, General Counsel and Corporate Secretary, effective December 31, 2022. Mr. Goldman has supported the Corporation on a consultative basis since his departure. The Corporation also announced the appointment of Jennifer Henderson to the role, effective February 13, 2023.",CAD,CRP.TO,"CNW Group - CERES GLOBAL AG CORP. NAMES NEW VICE PRESIDENT, GENERAL COUNSEL AND CORPORATE SECRETARY"
fin_news_nlp/yahoo_cad_tickers_news,https://ca.finance.yahoo.com/news/3-best-dividend-stocks-tfsa-150000652.html,The right dividend stock may offer more than generous and sustainable payouts. It may also keep your capital growing ahead of inflation. The post The 3 Best Dividend Stocks for Your TFSA appeared first on The Motley Fool Canada.,CAD,EIF.TO,The Motley Fool - The 3 Best Dividend Stocks for Your TFSA
