source,url,description,country,company,title
fin_news_nlp/yahoo_cad_tickers_news,https://ca.finance.yahoo.com/news/trisura-group-reports-first-quarter-202600494.html,"TORONTO, May 11, 2023 (GLOBE NEWSWIRE) -- Trisura Group Ltd. (“Trisura” or “Trisura Group”) (TSX: TSU), a leading specialty insurance provider, today announced financial results for the first quarter of 2023. David Clare, President and CEO of Trisura, stated, “Trisura reported strong performance in the quarter with operating net income of $28.6 million, or $0.61 per share. Quarterly net income of $14.0 million, or $0.30 per share, was impacted both by the implementation of new IFRS standards and",CAD,TSU.TO,GlobeNewswire - Trisura Group Reports First Quarter 2023 Results and Announces Inaugural Investor Day
fin_news_nlp/yahoo_cad_tickers_news,https://ca.finance.yahoo.com/news/wsp-global-doubles-down-green-140917887.html,"MONTREAL — WSP Global continued its years-long expansion this year, acquiring companies and securing contracts with an eye to the growing market for green projects. Since late January, the engineering firm completed three more acquisitions in Australia, Switzerland and Quebec, adding 900-plus employees to the payroll — most of them at Swiss firm BG Consulting Engineers. A fourth pending purchase of Australian engineering outfit Calibre will boost its headcount by another 800 and entrench WSP's p",CAD,WSP.TO,The Canadian Press - WSP Global doubles down on green-tinted expansion
fin_news_nlp/yahoo_cad_tickers_news,https://ca.finance.yahoo.com/news/abcourt-completes-acquisition-pershimex-merger-201400638.html,"VAL D’OR, Quebec, May 11, 2023 (GLOBE NEWSWIRE) -- Abcourt Mines Inc. (TSX-V: ABI) (“Abcourt” or the “Corporation”) and Pershimex Resources Corporation (TSX-V: PRO) (“Pershimex”) are pleased to announce that Abcourt has completed the previously announced acquisition of all of the issued and outstanding common shares of Pershimex (the “Pershimex Shares”) by way of a three-cornered amalgamation (the “Amalgamation”) under the Canada Business Corporations Act. Pursuant to the Amalgamation, Abcourt a",CAD,ABI.V,GlobeNewswire - Abcourt Completes Acquisition of Pershimex by Merger
fin_news_nlp/yahoo_cad_tickers_news,https://ca.finance.yahoo.com/news/athabasca-minerals-announces-cease-trade-203100707.html,"Edmonton, Alberta--(Newsfile Corp. - May 11, 2023) - Athabasca Minerals Inc. (TSXV: AMI) (""AMI"" or the ""Corporation"") announces that the Alberta and Ontario Securities Commissions have issued a Failure-to-File Cease Trade Order (""FFCTO"") with respect to the Corporation's securities due to the Corporation's inability to file its audited annual financial statements and corresponding management's discussion and analysis (collectively, the ""Financial Documents"") for the year ended December 31, 2022,",CAD,AMI.V,Newsfile - Athabasca Minerals Announces Cease Trade Order
fin_news_nlp/yahoo_cad_tickers_news,https://ca.finance.yahoo.com/news/power-play-market-herald-releases-203500963.html,"The Power Play by The Market Herald has announced the release of new interviews with Etruscus Resources, Pan Global Resources, POET Technologies, Odd Burger Corp, Barsele Minerals, Beacn Wizardry & Magic, Avrupa Minerals, Nextech3D.ai and ARway discussing their latest news.",CAD,AVU.V,"ACCESSWIRE - The Power Play by The Market Herald Releases New Interviews with Etruscus Resources, Pan Global Resources, POET Technologies, Odd Burger Corp, Barsele Minerals, Beacn Wizardry & Magic, Avrupa Minerals, Nextech3D.ai and ARway Discussing Their Latest News"
fin_news_nlp/yahoo_cad_tickers_news,https://ca.finance.yahoo.com/news/axmin-inc-applies-extension-price-194100132.html,"Vancouver, British Columbia--(Newsfile Corp. - May 11, 2023) - AXMIN Inc. (TSXV: AXM) (""AXMIN"" or the ""Company"") announces that in connection with the non-brokered private placement of up to 10,000,000 common shares at C$0.05 per share (the ""Offering"") originally announced in the Company's press release of March 28, 2023, the Company has applied to the TSX Venture Exchange for a 30-day extension of price protection in order to complete the Offering.Closing of the Offering ...",CAD,AXM.V,Newsfile - AXMIN INC. Applies for Extension of Price Protection for Private Placement
fin_news_nlp/yahoo_cad_tickers_news,https://ca.finance.yahoo.com/news/eguana-receives-5-million-energy-203200437.html,"CALGARY, Alberta, May 11, 2023 (GLOBE NEWSWIRE) -- Eguana Technologies (TSX.V: EGT) (OTCQB: EGTYF) announces it has received a $5 million initial order for its 10kW/28kWh whole home energy storage systems. Shipments have commenced with completed installations in Florida, San Jose, and Calgary. “Renewable energy markets, and in particular the energy storage segment, are very dynamic with a multitude of applications from solar self-consumption to virtual power plants and power grid infrastructure,",CAD,EGT.V,GlobeNewswire - Eguana Receives $5 Million Energy Storage Order
fin_news_nlp/yahoo_cad_tickers_news,https://ca.finance.yahoo.com/news/gratomic-announces-extension-6-million-203000723.html,"Gratomic Inc. (""Gratomic"", ""GRAT"" or the ""Company"") (TSXV:GRAT)(OTCQX:CBULF)(Frankfurt:CB82) announces that it will be extending the closing of its non-brokered private placement offering of up to 20,000,000 working capital units (""WC Units"") at a price of $0.30 per WC Unit for gross proceeds of up to $6 million (the ""Offering"") for a further fifteen (15) days. The Company has raised $3,050,980.50 to date.",CAD,GRAT.V,ACCESSWIRE - Gratomic Announces Extension of $6 million Non-Brokered Private Placement
fin_news_nlp/yahoo_cad_tickers_news,https://ca.finance.yahoo.com/news/adentra-announces-first-quarter-2023-225800563.html,"ADENTRA Inc. (""ADENTRA"" or the ""Company"") today announced financial results for the three months ended March 31, 2023. ADENTRA is one of North America's largest distributors of architectural building products to the residential, repair and remodel, and commercial construction markets. We currently operate a network of 86 facilities in the United States and Canada. All amounts are shown in United States dollars (""U.S. $"" or ""$""), unless otherwise noted.",CAD,ADEN.TO,CNW Group - ADENTRA Announces First Quarter 2023 Results
fin_news_nlp/yahoo_cad_tickers_news,https://ca.finance.yahoo.com/news/agi-announces-approval-resolutions-annual-202500718.html,"WINNIPEG, Manitoba, May 11, 2023--Ag Growth International Inc. (TSX: AFN) (""AGI"" or the ""Company"") is pleased to announce the voting results from its annual meeting of shareholders held on May 10, 2023. A total of 11,809,646 common shares, representing approximately 62.35% of AGI's outstanding shares, were represented in person or by proxy at the meeting.",CAD,AFN.TO,Business Wire - AGI Announces Approval of All Resolutions at Annual Meeting of Shareholders
fin_news_nlp/yahoo_cad_tickers_news,https://ca.finance.yahoo.com/news/aris-mining-announces-results-annual-210000039.html,Aris Mining Corporation (Aris Mining or the Company) (TSX: ARIS) (OTCQX: TPRFF) reports voting results from its Annual General and Special Meeting of shareholders (the Meeting) held earlier today.,CAD,ARIS.TO,CNW Group - ARIS MINING ANNOUNCES RESULTS OF ANNUAL GENERAL AND SPECIAL MEETING
fin_news_nlp/yahoo_cad_tickers_news,https://ca.finance.yahoo.com/news/atrium-mortgage-investment-corporation-announces-210000941.html,"Toronto, Ontario--(Newsfile Corp. - May 11, 2023) - Atrium Mortgage Investment Corporation (TSX: AI) (TSX: AI.DB.C) (TSX: AI.DB.D) (TSX: AI.DB.E) (TSX: AI.DB.F) (TSX: AI.DB.G) today announced that at its annual meeting of shareholders, held in Toronto earlier today, each of the eight director nominees listed in its management information circular dated March 24, 2023 was elected as a director. Directors have been elected to serve until the close of the next annual meeting of ...",CAD,AI.TO,Newsfile - Atrium Mortgage Investment Corporation Announces Election of Directors
fin_news_nlp/yahoo_cad_tickers_news,https://ca.finance.yahoo.com/news/most-actively-traded-companies-toronto-204931007.html,"TORONTO — Some of the most active companies traded Thursday on the Toronto Stock Exchange: Toronto Stock Exchange (81.70, down 20,417.61): PetroTal Corp. (TSX:TAL). Energy. Up three cents, or 4.11 per cent, to 76 cents on 21.3 million shares. Suncor Energy Inc. (TSX:SU). Energy. Down 31 cents, or 0.79 per cent, to $38.87 on 10.6 million shares. Enbridge Inc. (TSX:ENB). Energy. Up 14 cents, or 0.26 per cent, to $53.28 on 7.5 million shares. CI Financial Corp. (TSX:CIX). Finance. Up $2.90, or 23.2",CAD,BNS.TO, - Most actively traded companies on the Toronto Stock Exchange
fin_news_nlp/yahoo_cad_tickers_news,https://ca.finance.yahoo.com/news/baytex-energy-stock-buy-q1-221500512.html,"In the last 12 months, Baytex Energy stock has lost 25% but has returned a stellar 1,035% in the last three years. The post Is Baytex Energy Stock a Buy After its Q1 2023 Earnings? appeared first on The Motley Fool Canada.",CAD,BTE.TO,The Motley Fool - Is Baytex Energy Stock a Buy After its Q1 2023 Earnings?
fin_news_nlp/yahoo_cad_tickers_news,https://ca.finance.yahoo.com/news/better-dividend-buy-bce-stock-191500906.html,BCE stock's 6% dividend yield towers above Rogers Communications stock's offering. The post Better Dividend Buy: BCE Stock vs. Rogers Communications Stock appeared first on The Motley Fool Canada.,CAD,BCE.TO,The Motley Fool - Better Dividend Buy: BCE Stock vs. Rogers Communications Stock
fin_news_nlp/yahoo_cad_tickers_news,https://ca.finance.yahoo.com/news/bonterra-energy-corp-announces-first-210000476.html,"Bonterra Energy Corp. (www.bonterraenergy.com) (TSX: BNE) (""Bonterra"" or the ""Company"") is pleased to announce its operating and financial results for the three month period ended March 31, 2022. The related unaudited condensed financial statements and notes, as well as management's discussion and analysis (""MD&A""), are available on SEDAR at www.sedar.com and on Bonterra's website at www.bonterraenergy.com.",CAD,BNE.TO,CNW Group - Bonterra Energy Corp. Announces First Quarter 2023 Results
fin_news_nlp/yahoo_cad_tickers_news,https://ca.finance.yahoo.com/news/bridgemarq-real-estate-services-announces-212000822.html,"Bridgemarq Real Estate Services Inc. (""Bridgemarq"" or the ""Company"") (TSX: BRE) today announced the voting results for the directors elected at the Company's annual meeting of shareholders held virtually on May 11, 2023.",CAD,BRE.TO,CNW Group - Bridgemarq Real Estate Services Announces Voting Results from Annual Meeting of Shareholders
fin_news_nlp/yahoo_cad_tickers_news,https://ca.finance.yahoo.com/news/canacol-energy-ltd-reports-12-220000097.html,"CALGARY, Alberta, May 11, 2023 (GLOBE NEWSWIRE) -- Canacol Energy Ltd. (“Canacol” or the “Corporation”) (TSX:CNE; OTCQX:CNNEF; BVC:CNEC) is pleased to report its financial and operating results for the three months ended March 31, 2023. Dollar amounts are expressed in United States dollars, with the exception of Canadian dollar unit prices (“C$”) where indicated and otherwise noted. Highlights for the three months ended March 31, 2023 Adjusted EBITDAX increased 23% to $60.9 million for the three",CAD,CNE.TO,GlobeNewswire - Canacol Energy Ltd. Reports a 12% Increase in Netback and an Adjusted EBITDAX of $61 million in Q1 2023
fin_news_nlp/yahoo_cad_tickers_news,https://ca.finance.yahoo.com/news/storz-bickel-exhibit-cannatrade-expo-204500433.html,"STORZ & BICKEL GmbH (""STORZ & BICKEL""), a world-leading manufacturer of high-end and medically certified cannabis vaporizers and subsidiary of Canopy Growth Corporation (TSX: WEED) (NASDAQ: CGC), will participate in the upcoming CannaTrade 2023 in Zurich May 12-14. At the trade show, STORZ & BICKEL will exhibit its industry-leading vaporizers, including the CRAFTY+, MIGHTY+, PLENTY and the iconic VOLCANO, in Hall 622.",CAD,WEED.TO,CNW Group - STORZ & BICKEL TO EXHIBIT AT CANNATRADE EXPO IN ZURICH
fin_news_nlp/yahoo_cad_tickers_news,https://ca.finance.yahoo.com/news/cardinal-energy-ltd-announces-first-210000864.html,"CALGARY, Alberta, May 11, 2023 (GLOBE NEWSWIRE) -- Cardinal Energy Ltd. (""Cardinal"" or the ""Company"") (TSX: CJ) is pleased to announce its operating and financial results for the first quarter ended March 31, 2023. FINANCIAL AND OPERATING HIGHLIGHTS FROM THE FIRST QUARTER OF 2023 Production increased 5% over the same period in 2022 due to ongoing strong base performance and excellent 2022 drilling results across our asset base; Adjusted funds flow(1) was $52.3 million which was allocated to capi",CAD,CJ.TO,GlobeNewswire - Cardinal Energy Ltd. Announces First Quarter 2023 Operating and Financial Results
fin_news_nlp/yahoo_cad_tickers_news,https://ca.finance.yahoo.com/news/cathedral-energy-services-ltd-company-213000034.html,"This news release contains ""forward-looking statements"" within the meaning of applicable Canadian securities laws. For a full disclosure of forward-looking statements and the risks to which they are subject, see the ""Forward-Looking Statements"" section in this news release. This news release contains references to Adjusted gross margin, Adjusted gross margin %, Adjusted EBITDAS, Adjusted EBITDAS margin % and Free cash flow. These terms do not have standardized meanings prescribed under Internati",CAD,CET.TO,"CNW Group - Cathedral Energy Services Ltd. (the ""Company"" or ""Cathedral"" / TSX: CET) announces its consolidated financial results for the three months ended March 31, 2023 and 2022"
fin_news_nlp/yahoo_cad_tickers_news,https://ca.finance.yahoo.com/news/ces-energy-solutions-corp-announces-210000288.html,"CES Energy Solutions Corp. (""CES"" or the ""Company"") (TSX: CEU) (OTC: CESDF) announced today the Company's results for the three months ended March 31, 2023, along with a 25% increase to its quarterly dividend from $0.020 per share to $0.025 per share, which will take effect and be paid on the Company's next scheduled dividend payment of July 14, 2023 to the shareholders of record at the close of business on June 30, 2023.",CAD,CEU.TO,CNW Group - CES ENERGY SOLUTIONS CORP. ANNOUNCES STRONG Q1 2023 RESULTS AND AN INCREASED DIVIDEND
fin_news_nlp/yahoo_cad_tickers_news,https://ca.finance.yahoo.com/news/cipher-pharmaceuticals-reports-first-quarter-210000292.html,"Cipher Pharmaceuticals Inc. (TSX: CPH) (""Cipher"" or ""the Company"") today announced its financial and operating results for the three month period ended March 31, 2023.",CAD,CPH.TO,"CNW Group - Cipher Pharmaceuticals Reports First Quarter Results, Highlighted by Record Cash Per Share and Strong Financial Flexibility"
fin_news_nlp/yahoo_cad_tickers_news,https://ca.finance.yahoo.com/news/condor-announces-2023-first-quarter-211500258.html,"CALGARY, Alberta, May 11, 2023 (GLOBE NEWSWIRE) -- Condor Energies Inc. (“Condor” or the “Company”) (TSX: CDR), a Canadian based energy transition company with activities in Turkiye and Kazakhstan, is pleased to announce the release of its unaudited interim condensed consolidated financial statements for the three months ended March 31, 2023 together with the related management’s discussion and analysis. These documents will be made available under Condor’s profile on SEDAR at www.sedar.com and",CAD,CDR.TO,GlobeNewswire - Condor Announces 2023 First Quarter Results
fin_news_nlp/yahoo_cad_tickers_news,https://ca.finance.yahoo.com/news/invest-canadian-companies-fhsa-save-214500870.html,Are you thinking of buying your first home? Here are two picks that could help you save up! The post <strong>Invest in These Canadian Companies Through Your FHSA and Save for Your Dream Home</strong> appeared first on The Motley Fool Canada.,CAD,CSU.TO,The Motley Fool - Invest in These Canadian Companies Through Your FHSA and Save for Your Dream Home
fin_news_nlp/yahoo_cad_tickers_news,https://ca.finance.yahoo.com/news/crew-energy-announces-annual-meeting-225400972.html,"CALGARY, Alberta, May 11, 2023 (GLOBE NEWSWIRE) -- Crew Energy Inc. (TSX: CR; OTCQB: CWEGF) (“Crew” or the “Company”), a growth-oriented, liquids rich natural gas producer operating in the world-class Montney play in northeast British Columbia (“NE BC”), is pleased to announce the voting results for the election of directors at our annual general meeting of shareholders held on May 11, 2023 (the ""Meeting""). Each of the seven nominees proposed by Crew and as set forth in the Information Circular",CAD,CR.TO,GlobeNewswire - Crew Energy Announces Annual Meeting Results  for Election of Directors
fin_news_nlp/yahoo_cad_tickers_news,https://ca.finance.yahoo.com/news/fairfax-financial-more-doubles-first-223534392.html,"TORONTO — Fairfax Financial Holdings Ltd. says it earned US$1.3 billion in the first quarter of 2023, more than double earnings of US$588.7 million a year earlier. The Toronto-based company, which reports in U.S. dollars, says net earnings per diluted share were US$49.38, compared with US$22.67 the same quarter a year earlier. Net gains on investments were US$771.2 million, compared with a loss of US$195.2 million a year ago. Fairfax says gross premiums written totalled US$7.1 billion in the qua",CAD,FFH.TO,The Canadian Press - Fairfax Financial more than doubles first-quarter earnings at US$1.3 billion
fin_news_nlp/yahoo_cad_tickers_news,https://ca.finance.yahoo.com/news/farmers-edge-reports-first-quarter-230000848.html,"WINNIPEG, Manitoba, May 11, 2023--Farmers Edge Inc. (""Farmers Edge"" or the ""Company"") (TSX: FDGE), a pure-play digital agriculture company, reports its results for the three months ended March 31, 2023. All amounts are expressed in Canadian dollars. Certain key performance indicators and non-GAAP and other financial measures used in this news release do not have a standardized meaning as presented by IFRS. See ""Key Performance Indicators and Non-GAAP and Other Financial Measures"" section below.",CAD,FDGE.TO,Business Wire - Farmers Edge Reports First Quarter 2023 Results
fin_news_nlp/yahoo_cad_tickers_news,https://ca.finance.yahoo.com/news/finning-announces-pricing-350-million-232500656.html,"VANCOUVER, British Columbia, May 11, 2023 (GLOBE NEWSWIRE) -- Finning International Inc. (TSX: FTT) (“Finning” or “we”) announced today that it has priced an offering of $350 million principal amount of 4.445% Senior Unsecured Notes due May 16, 2028 (the “Notes”), which will rank pari passu with existing senior unsecured obligations of Finning. Interest on the Notes is payable semi-annually, commencing on November 16, 2023. Closing of the offering of the Notes is expected to occur on or about Ma",CAD,FTT.TO,GlobeNewswire - Finning Announces Pricing of $350 Million of 4.445% Senior Unsecured Notes
fin_news_nlp/yahoo_cad_tickers_news,https://ca.finance.yahoo.com/news/galaxy-asset-management-april-2023-210000920.html,"Galaxy Digital Holdings Ltd. (TSX: GLXY) (""Galaxy"") announced that its affiliate, Galaxy Asset Management, (""GAM""), reported preliminary assets under management of $2,460.5 million as of April 30, 2023. The 1.1% increase in preliminary AUM compared to the prior month was primarily driven by market appreciation and net inflows.",CAD,GLXY.TO,CNW Group - Galaxy Asset Management: April 2023 Month End AUM
fin_news_nlp/yahoo_cad_tickers_news,https://ca.finance.yahoo.com/news/gdi-integrated-facility-services-inc-215200820.html,"GDI Integrated Facility Services Inc. (""GDI"" or the ""Company"") (TSX: GDI) is pleased to announce its financial results for the first quarter ended March 31, 2023.",CAD,GDI.TO,"CNW Group - GDI Integrated Facility Services Inc. Releases its Financial Results for the First Quarter Ended March 31, 2023"
fin_news_nlp/yahoo_cad_tickers_news,https://ca.finance.yahoo.com/news/goeasy-ltd-announces-election-directors-210000189.html,"MISSISSAUGA, Ontario, May 11, 2023 (GLOBE NEWSWIRE) -- goeasy Ltd. (TSX: GSY), (“goeasy” or the “Company”), one of Canada’s leading non-prime consumer lenders, announced that all of the nominee directors listed in the management proxy circular dated March 21, 2023 were elected as directors of goeasy. The vote was conducted at the Company’s Annual General and Special Meeting of Shareholders, which took place on May 10, 2023. The results of the vote are set out below: Director NomineeVotes ForVote",CAD,GSY.TO,GlobeNewswire - goeasy Ltd. Announces Election of Directors
fin_news_nlp/yahoo_cad_tickers_news,https://ca.finance.yahoo.com/news/gold-springs-corp-files-q1-234500286.html,"Gold Springs Resource Corp.(TSX:GRC), (OTCQB:GRCAF) (the ""Company""), reports the release of its unaudited consolidated financial statements for the three months ended March 31, 2023 and the related management's discussion and analysis of financial position and results of operations (""MD&A""). In this press release, all amounts are expressed in U.S.",CAD,GRC.TO,ACCESSWIRE - Gold Springs Resource Corp. Files Q1 2023 Financial Statements and MD&A
fin_news_nlp/yahoo_cad_tickers_news,https://ca.finance.yahoo.com/news/hammerhead-energy-inc-announces-record-212100552.html,"CALGARY, Alberta, May 11, 2023 (GLOBE NEWSWIRE) -- Hammerhead Energy Inc. (“Hammerhead” or the “Company”) (TSX: HHRS, HHRS.WT; NASDAQ: HHRS, HHRSW) is pleased to announce record financial and operating results for the first quarter of 2023. The Company continued to progress critical investments in infrastructure expansions that should allow for continuing record performance, achievement of half-cycle economics from new wells and material free cash flow generation going forward. The Company expec",CAD,HHRS.TO,GlobeNewswire - Hammerhead Energy Inc. Announces Record First Quarter 2023 Financial and Operating Results
fin_news_nlp/yahoo_cad_tickers_news,https://ca.finance.yahoo.com/news/headwater-exploration-inc-announces-results-235700996.html,"Headwater Exploration Inc. (""Headwater"") (TSX: HWX) is pleased to announce that the nominees listed in the Corporation's management information circular dated March 27, 2023 were elected as directors of Headwater at its annual meeting of shareholders (the ""Meeting"") held today, May 11, 2023. In addition, all other matters considered at the Meeting were approved by Headwater's shareholders.",CAD,HWX.TO,CNW Group - HEADWATER EXPLORATION INC. ANNOUNCES RESULTS OF ANNUAL SHAREHOLDER MEETING
fin_news_nlp/yahoo_cad_tickers_news,https://ca.finance.yahoo.com/news/high-arctic-announces-2023-first-210100630.html,"NOT FOR DISTRIBUTION TO U.S. NEWSWIRE SERVICES OR FOR DISSEMINATION IN THE UNITED STATES. ANY FAILURE TO COMPLY WITH THIS RESTRICTION MAY CONSTITUTE A VIOLATION OF U.S. SECURITIES LAW CALGARY, Alberta, May 11, 2023 (GLOBE NEWSWIRE) -- High Arctic Energy Services Inc. (TSX: HWO) (the “Corporation” or “High Arctic”) released its’ first quarter financial and operating results. The unaudited interim consolidated financial statements, and management discussion & analysis (“MD&A”), for the quarter end",CAD,HWO.TO,"GlobeNewswire - High Arctic Announces 2023 First Quarter Results, an Intention to Return Capital and Reorganize"
fin_news_nlp/yahoo_cad_tickers_news,https://ca.finance.yahoo.com/news/kinross-announces-annual-shareholder-meeting-210000310.html,"TORONTO, May 11, 2023 (GLOBE NEWSWIRE) -- Kinross Gold Corporation (TSX: K, NYSE: KGC) has announced the detailed voting results of the election of its Board of Directors, which took place at the Company’s virtual Annual Meeting of Shareholders on May 10, 2023. The nominees listed in the Management Information Circular dated March 14, 2023, were elected as directors of Kinross at the meeting (see detailed voting results below). Board of Directors voting results NomineeVotes for% forVotes withhel",CAD,K.TO,GlobeNewswire - Kinross announces Annual Shareholder Meeting voting results
fin_news_nlp/yahoo_cad_tickers_news,https://ca.finance.yahoo.com/news/liberty-gold-reports-q1-2023-213200613.html,"VANCOUVER, British Columbia, May 11, 2023 (GLOBE NEWSWIRE) -- Liberty Gold Corp. (TSX:LGD; OTCQX:LGDTF) (""Liberty Gold"" or the “Company”), is pleased to announce its financial and operating results for the three months ended March 31, 2023. All amounts are presented in United States dollars unless otherwise stated. FIRST QUARTER OF 2023 AND RECENT HIGHLIGHTS At the Black Pine project (“Black Pine”), we: Reported weighted average 86.9% gold extraction1 from 24 metallurgical column leach tests on",CAD,LGD.TO,GlobeNewswire - Liberty Gold Reports Q1 2023 Financial and Operating Results
fin_news_nlp/yahoo_cad_tickers_news,https://ca.finance.yahoo.com/news/3-canadian-value-stocks-strong-231500615.html,Canadian value stocks like Alimentation Couche-Tard (TSX:ATD) should be on your list. The post 3 Canadian Value Stocks With Strong Growth Potential appeared first on The Motley Fool Canada.,CAD,L.TO,The Motley Fool - 3 Canadian Value Stocks With Strong Growth Potential
fin_news_nlp/yahoo_cad_tickers_news,https://ca.finance.yahoo.com/news/loop-energy-reports-first-quarter-210000986.html,"VANCOUVER, British Columbia, May 11, 2023--Loop Energy™ (TSX: LPEN) today reported consolidated financial results for the first quarter ending March 31, 2023.",CAD,LPEN.TO,Business Wire - Loop Energy Reports First Quarter 2023 Results
