source,url,description,country,company,title
fin_news_nlp/yahoo_cad_tickers_news,https://ca.finance.yahoo.com/news/lightspeed-commerce-streamlines-operations-continued-123000337.html,"Lightspeed Commerce Inc. (NYSE: LSPD) (TSX: LSPD), the one-stop commerce platform for merchants around the world to simplify, scale, and create exceptional customer experiences, today announced a reorganization to streamline the Company's operating model while continuing to focus on profitable growth.",CAD,LSPD.TO,CNW Group - Lightspeed Commerce Streamlines Operations with a Continued Focus on Profitable Growth
fin_news_nlp/yahoo_cad_tickers_news,https://ca.finance.yahoo.com/news/mag-silver-discovers-carissa-zone-115000390.html,"DT22-09: 273.8 m of progressively zoned alteration with multiple sulphide intervals grading 59-266 g/t Silver, 0.2-5.5% Copper, 0.1-14.8% Lead plus Zinc Figure 1 Figure 1 Figure 2 Figure 2: A) Unaltered Redwall Limestone. B) Pervasively dolomitized and marbled Redwall. C) and D) Sulfide lacing within Redwall Limestone. E) Mineralized Gamet-Pyroxene Skarn. F) Mineralized Magnetite Skarn VANCOUVER, British Columbia, Jan. 17, 2023 (GLOBE NEWSWIRE) -- MAG Silver Corp. (TSX / NYSE American: MAG) (“MA",CAD,MAG.TO,GlobeNewswire - MAG Silver Discovers “Carissa” Zone at Deer Trail
fin_news_nlp/yahoo_cad_tickers_news,https://ca.finance.yahoo.com/news/shockwave-medical-announces-agreement-acquire-130000074.html,"Neovasc’s Innovative Reducer System Will Target the Estimated $5 Billion Refractory Angina Market Shockwave Medical Announces Preliminary Fourth Quarter and Full Year 2022 Revenues and Full Year 2023 Revenue Guidance SANTA CLARA, Calif., Jan. 17, 2023 (GLOBE NEWSWIRE) -- Shockwave Medical, Inc. (NASDAQ: SWAV), a pioneer in the development of Intravascular Lithotripsy (IVL) to treat severely calcified cardiovascular disease, today announced it has entered into a definitive agreement to acquire Ne",CAD,NVCN.TO,GlobeNewswire - Shockwave Medical Announces Agreement to Acquire Neovasc
fin_news_nlp/yahoo_cad_tickers_news,https://ca.finance.yahoo.com/news/nfi-announces-additional-order-ohio-123000999.html,"NFI New Flyer Xcelsior electric bus COTA 2023 NFI New Flyer Xcelsior electric bus COTA 2023 ST. CLOUD, Minn., Jan. 17, 2023 (GLOBE NEWSWIRE) -- (TSX: NFI, OTC: NFYEF, TSX: NFI.DB) NFI Group Inc. (“NFI”), a leading independent bus and coach manufacturer and a leader in electric mass mobility solutions, today announced that its subsidiary New Flyer of America Inc. (“New Flyer”) received a new order from Central Ohio Transit Authority (“COTA”) for 14 zero-emission, battery-electric Xcelsior CHARGE",CAD,NFI.TO,"GlobeNewswire - NFI announces additional order from Ohio’s COTA for 14 New Flyer zero-emission, long-range electric buses, and associated charging infrastructure"
fin_news_nlp/yahoo_cad_tickers_news,https://ca.finance.yahoo.com/news/northcliff-settles-loan-124500636.html,"Northcliff Resources Ltd. (""Northcliff"" or the ""Company"") (TSX: NCF) announces, further to its June 23, 2022, August 18, 2022, August 24, 2022 and September 14, 2022 news releases, that it has settled the second tranche of $500,000 plus accrued interest of the $1,000,000 2021 loan by issuing 23,655,914 shares to Todd Sisson (NZ) Limited (""Todd""), a subsidiary of the Todd Corporation, the Company's largest shareholder.",CAD,NCF.TO,CNW Group - NORTHCLIFF SETTLES LOAN
fin_news_nlp/yahoo_cad_tickers_news,https://ca.finance.yahoo.com/news/pyrogenesis-signs-emissions-reduction-contract-123000046.html,"MONTREAL, Jan. 17, 2023 (GLOBE NEWSWIRE) -- PyroGenesis Canada Inc. (http://pyrogenesis.com) (TSX: PYR) (NASDAQ: PYR) (FRA: 8PY), a high-tech company, a TSX30® and a Deloitte Technology Fast 50™ high-tech company (hereinafter referred to as the “Company” or “PyroGenesis”), that designs, develops, manufactures and commercializes advanced plasma processes and sustainable solutions which are geared to reduce greenhouse gases (GHG), is pleased to announce that the Company, through Pyro Green-Gas, a",CAD,PYR.TO,GlobeNewswire - PyroGenesis Signs Emissions Reduction Contract with North American Lithium-Ion Battery Recycler
fin_news_nlp/yahoo_cad_tickers_news,https://ca.finance.yahoo.com/news/reunion-neuroscience-tse-reun-investors-104926787.html,Reunion Neuroscience Inc. ( TSE:REUN ) shareholders should be happy to see the share price up 22% in the last month...,CAD,REUN.TO,Simply Wall St. - Reunion Neuroscience (TSE:REUN) investors are sitting on a loss of 74% if they invested a year ago
fin_news_nlp/yahoo_cad_tickers_news,https://ca.finance.yahoo.com/news/better-buy-royal-bank-stock-090000669.html,Royal Bank and Canadian National Railway should be solid long-term picks for a retirement fund. The post Better Buy: Royal Bank Stock vs. CNR Stock appeared first on The Motley Fool Canada.,CAD,RY.TO,The Motley Fool - Better Buy: Royal Bank Stock vs. CNR Stock
fin_news_nlp/yahoo_cad_tickers_news,https://ca.finance.yahoo.com/news/rubellite-energy-inc-announces-achievement-124500847.html,"(TSX:RBY) – Rubellite Energy Inc. (""Rubellite"" or the ""Company""), a pure play Clearwater oil exploration and development company, is pleased to release its preliminary fourth quarter 2022 and current production results, announce a material expansion in Rubellite's land base and prospect inventory at Figure Lake, and provide an operational update, all of which highlight successful advancement of Rubellite's growth focused business plan centered around the attractive Clearwater play. Highlights in",CAD,RBY.TO,"CNW Group - RUBELLITE ENERGY INC. ANNOUNCES ACHIEVEMENT OF FOURTH QUARTER 2022 PRODUCTION GUIDANCE, SUCCESSFUL LAND ACQUISITIONS AND PROVIDES STRONG OPERATIONAL UPDATE"
fin_news_nlp/yahoo_cad_tickers_news,https://ca.finance.yahoo.com/news/seabridge-gold-completes-initial-drill-123000800.html,"Target parameters established for major drill program in 2023 Toronto, Ontario--(Newsfile Corp. - January 17, 2023) - Seabridge Gold (TSX: SEA) (NYSE: SA) announced today that drilling has been completed and assay results received from its limited 2022 drill program. The program commenced in mid-September after receiving a Class 4 Quartz Exploration Permit from the Yukon Government Department of Energy, Mines, and Resources for its 100% owned 3 Aces project. As one of the ...",CAD,SEA.TO,Newsfile - Seabridge Gold Completes Initial Drill Program at 3 Aces Project
fin_news_nlp/yahoo_cad_tickers_news,https://ca.finance.yahoo.com/news/solaris-significantly-expands-warintza-east-120000307.html,"Figure 1 – Plan View of Warintza East Drilling Released to Date Figure 1 – Plan View of Warintza East Drilling Released to Date VANCOUVER, British Columbia, Jan. 17, 2023 (GLOBE NEWSWIRE) -- Solaris Resources Inc. (TSX: SLS; OTCQB: SLSSF) (“Solaris” or “the Company”) is pleased to report assay results from a series of holes aimed at growing mineral resources at the Warintza East discovery within its Warintza Project (“Warintza” or “the Project”) in southeastern Ecuador. Highlights are listed bel",CAD,SLS.TO,GlobeNewswire - Solaris Significantly Expands Warintza East Discovery in Continued Extensional Drilling
fin_news_nlp/yahoo_cad_tickers_news,https://ca.finance.yahoo.com/news/torex-gold-provides-2023-operational-110000338.html,"Well positioned to deliver consistent, reliable and profitable production through to 2027(All amounts expressed in U.S. Dollars unless otherwise stated) TORONTO, Jan. 17, 2023 (GLOBE NEWSWIRE) -- Torex Gold Resources Inc. (the “Company” or “Torex”) (TSX: TXG) provides 2023 operational guidance as well as a 5-year production outlook for the Morelos Complex, which includes production from the ELG Mine Complex (“ELG”) and from the Media Luna Project (“Media Luna”). TABLE 1: 2023 OPERATIONAL GUIDANC",CAD,TXG.TO,GlobeNewswire - Torex Gold Provides 2023 Operational Guidance and Five-Year Production Outlook
fin_news_nlp/yahoo_cad_tickers_news,https://ca.finance.yahoo.com/news/troilus-presents-2022-review-outlook-120000427.html,"MONTREAL, Jan. 17, 2023 (GLOBE NEWSWIRE) -- Troilus Gold Corp. (TSX: TLG; OTCQX: CHXMF; FRA: CM5R) (“Troilus” or the “Company”), is pleased to provide a summary of its key accomplishments in 2022 as well as an outlook of 2023, in this open letter to shareholders from Chief Executive Officer, Justin Reid. A copy of the letter is presented below, while the original document can be found on our website HERE. Dear Shareholders, 2022 was a year of incredible accomplishments for Troilus; our efforts i",CAD,TLG.TO,GlobeNewswire - Troilus Presents Its 2022 Year-In-Review & Outlook for 2023; an Open Letter to Shareholders From the CEO
fin_news_nlp/yahoo_cad_tickers_news,https://ca.finance.yahoo.com/news/willow-announces-engagement-next-phase-120000165.html,"Willow Biosciences Inc. (""Willow"") (TSX: WLLW) (OTCQB: CANSF), a leading biotechnology company focused on revolutionizing industrial manufacturing of pure, consistent and sustainable functional ingredients announced today a follow-on engagement with Sandhill One, LLC (www.sandhillone.com) (""Sandhill"") for the next phase in optimizing a proprietary enzyme vital to the development of a large volume Active Pharmaceutical Ingredient (""API"") used in nutraceutical and pharmaceutical products. This rep",CAD,WLLW.TO,CNW Group - WILLOW ANNOUNCES FOLLOW-ON ENGAGEMENT FOR NEXT PHASE OF PARTNERED PHARMACEUTICAL PROJECT
fin_news_nlp/yahoo_cad_tickers_news,https://ca.finance.yahoo.com/news/incorporating-post-quantum-cryptography-thales-130000550.html,"01 Communique Laboratory Inc. (TSXV:ONE)(OTCQB:OONEF) an enterprise level cybersecurity provider has partnered with Thales Group a Paris based trusted global technology leader to integrate IronCAP™ post-quantum cryptography (""PQC"") with Thales Luna HSMs (""Hardware Security Modules"") - providing military grade protection for users' data and critical applications.",CAD,ONE.V,ACCESSWIRE - Incorporating Post-Quantum Cryptography for Thales Luna HSMs
fin_news_nlp/yahoo_cad_tickers_news,https://ca.finance.yahoo.com/news/yorbeau-resources-intersects-6-6-130000639.html,"Figure 1 Figure 1 Figure 2 Figure 2 Figure 3 Figure 3 MONTREAL, Jan. 17, 2023 (GLOBE NEWSWIRE) -- Yorbeau Resources Inc. (TSX: YRB), (< > or the Company) The Company announces drilling results on its new discovery west of the Gwillim fault on its Scott Lake property in Chibougamau, Quebec. Five holes west of the fault all intersected copper, zinc, and silver mineralization over widths ranging from 0.75 meters to 6.6 meters. One of the intersections yielded 0.98% copper, 6.35% zinc and 1.",CAD,YRB.TO,GlobeNewswire - Yorbeau Resources Intersects 6.6-Metres Grading 6.35% Zinc and 0.98% Copper at Scott Lake and Explores Options to Maximize Value From Scott Lake and Rouyn Projects
fin_news_nlp/yahoo_cad_tickers_news,https://ca.finance.yahoo.com/news/amarc-2022-transformative-corporate-outlook-124500037.html,"/ Amarc Resources Ltd. (""Amarc"" or the ""Company"") (TSXV:AHR)(OTCQB:AXREF)) is pleased to provide this summary of its major achievements and milestones over the last twelve months, as we look towards another highly active exploration year progressing our JOY, DUKE and IKE Districts.",CAD,AHR.V,ACCESSWIRE - Amarc 2022 a Transformative Year and Corporate Outlook
fin_news_nlp/yahoo_cad_tickers_news,https://ca.finance.yahoo.com/news/andean-precious-metals-achieves-2022-113000854.html,"Toronto, Ontario--(Newsfile Corp. - January 17, 2023) - Andean Precious Metals Corp. (TSXV: APM) (OTCQX: ANPMF) (""Andean"" or the ""Company"") is pleased to announce that the Company has met its production guidance for 2022 with 5.0 million ounces (Moz) of silver equivalent (Ag Eq)[1] from its San Bartolomé mine in Bolivia. The Company's 2022 full year production guidance was revised in November to between 5.0Moz and 5.3Moz Ag Eq1. Q4 & FY2022 Highlights ...",CAD,APM.V,Newsfile - Andean Precious Metals Achieves 2022 Production Guidance with 5.0 Million Ounces of Silver Equivalent
fin_news_nlp/yahoo_cad_tickers_news,https://ca.finance.yahoo.com/news/aurion-intersects-significant-gold-mineralization-120000337.html,"Aurion Resources Ltd. (TSX VENTURE: AU) (OTCQX: AIRRF) (""Aurion"" or the ""Company"") announces an update on the current drilling program at its wholly owned Risti property located in the Central Lapland Greenstone Belt in northern Finland.",CAD,AU.V,"CNW Group - Aurion Intersects Significant Gold Mineralization at Wholly Owned Risti Property; Multiple Zones, Including 17.12 g/t Gold Over 5.90 m"
fin_news_nlp/yahoo_cad_tickers_news,https://ca.finance.yahoo.com/news/azimut-reports-15-mineralized-holes-123200702.html,"Azimut Exploration Inc. (""Azimut"" or the ""Company"") (TSXV: AZM) (OTCQX: AZMTF) is pleased to report the results from 15 additional mineralized holes from the Patwon Gold Zone on the Company's 100% owned Elmer Property (the ""Property"") in the Eeyou Istchee James Bay region of Quebec (see Figures 1 to 4).",CAD,AZM.V,CNW Group - Azimut Reports 15 Mineralized Holes from the Patwon Gold Zone at Elmer
fin_news_nlp/yahoo_cad_tickers_news,https://ca.finance.yahoo.com/news/brunswick-exploration-stakes-multiple-highly-120000715.html,"MONTREAL, Jan. 17, 2023 (GLOBE NEWSWIRE) -- Brunswick Exploration Inc. (“BRW” or the “Company”) is pleased to announce that it has map-staked 135 outcropping, untested S-type pegmatites, measuring between 500 and 14,500 meters in strike length, in Saskatchewan and Manitoba over a surface area of 81,288 hectares. The newly claimed pegmatites were identified following compilation work by BRW and all are within approximately 50 kilometers from existing road or power infrastructure. Mr. Killian Char",CAD,BRW.V,GlobeNewswire - Brunswick Exploration Stakes Multiple Highly Prospective Regional Lithium Projects in Saskatchewan and Manitoba
fin_news_nlp/yahoo_cad_tickers_news,https://ca.finance.yahoo.com/news/capitan-drills-1-5m-1-120000918.html,"Vancouver, British Columbia--(Newsfile Corp. - January 17, 2023) - Capitan Mining Inc. (TSXV: CAPT) (""Capitan"" or the ""Company"") is pleased to announce final drill assays for five (5) drillholes, from the summer 2022 drill program at the Jesus Maria high-grade silver zone, located at the Cruz de Plata project in Durango, Mexico.Highlights:Hole 22-JMRC-22: Intersected 16.8m of 224.3 g/t AgEq, including 3.0m of 978.7 g/t AgEq, which includes 1.5m of 1,532.8 g/t AgEq, at the Gully Fault ...",CAD,CAPT.V,"Newsfile - Capitan Drills 1.5m of 1,532.8 g/t AgEq Within 16.8m of 224.3 g/t AgEq at Cruz De Plata Project; Expands Jesus María Vein."
fin_news_nlp/yahoo_cad_tickers_news,https://ca.finance.yahoo.com/news/cassiar-gold-expands-mineralization-taurus-120000349.html,"Calgary, Alberta--(Newsfile Corp. - January 17, 2023) - Cassiar Gold Corp. (TSXV: GLDC) (OTCQX: CGLCF) (the ""Company"") is pleased to announce assay results from an additional seven diamond drill holes from the 2022 exploration program completed at the Taurus Deposit, located in the Cassiar North area of the Company's flagship Cassiar Gold Property in Northern British Columbia, Canada. The Company's 2022 program included 70 drill holes and over 23,000 m of diamond drilling that ...",CAD,GLDC.V,Newsfile - Cassiar Gold Expands Mineralization at the Taurus Deposit Near-Surface and at Depth Intersecting 98.0m of 1.28 g/t Au and 70.7m of 0.76 g/t Au
fin_news_nlp/yahoo_cad_tickers_news,https://ca.finance.yahoo.com/news/collective-mining-commences-phase-ii-113000322.html,"Collective Mining Ltd. (TSXV: CNL) (OTCQX: CNLMF) (""Collective"" or the ""Company"") is pleased to announce the commencement of a phase II diamond drill program at the Main Breccia discovery at the Apollo target (""Apollo""), which is part of the Guayabales project located in Caldas, Colombia. The Main Breccia discovery is a high-grade, bulk tonnage copper-silver-gold porphyry-related system, which owes its excellent metal endowment to multiple phases of mineralization which includes older copper-sil",CAD,CNL.V,CNW Group - Collective Mining Commences its Phase II Drilling Program at Apollo
fin_news_nlp/yahoo_cad_tickers_news,https://ca.finance.yahoo.com/news/dgtl-holdings-inc-signs-f500-130000481.html,"New F500 Social Media Brand Client Engages Patented TotalSocial(R) Data-Analytics Methodologies for Pilot Advertiser Correlation Study New York, New York--(Newsfile Corp. - January 17, 2023) - DGTL Holdings Inc. (TSXV: DGTL) (""DGTL"" or the ""Company"") is pleased to announce the signing of one of the largest microblogging and social networking application brands in the world to its flagship data analytics platform, TotalSocial®. This new F500 client is a global leader in the social media space ...",CAD,DGTL.V,Newsfile - DGTL Holdings Inc. Signs F500 Social Technology Brand as New Client Account
fin_news_nlp/yahoo_cad_tickers_news,https://ca.finance.yahoo.com/news/elevation-gold-reports-q4-2022-120000760.html,"Elevation Gold Mining Corporation (TSXV: ELVT) (OTCQX: EVGDF) (the ""Company"" or ""Elevation Gold"") is pleased to announce the production results for the three and twelve months ended December 31, 2022 (""Q4 2022""). The Company expects to file its yearend financial statements and management discussion and analysis by late April 2023.",CAD,ELVT.V,CNW Group - Elevation Gold Reports Q4 2022 Production Results
fin_news_nlp/yahoo_cad_tickers_news,https://ca.finance.yahoo.com/news/emerita-resources-2022-review-successful-120000376.html,"TORONTO, Jan. 17, 2023 (GLOBE NEWSWIRE) -- Emerita Resources Corp. (TSX – V: EMO; OTCQB: EMOTF; FSE: LLJA) (the “Company” or “Emerita”) is pleased to provide the following summary of the Company’s progress in 2022 and lay out priorities and objectives for 2023. Emerita has been running an accelerated diamond drill campaign on its wholly owned Iberia Belt West Project (“IBW” or the “Project”) since June 2022 when it received permits to drill the large La Romanera deposit. David Gower, P.Geo., CEO",CAD,EMO.V,"GlobeNewswire - Emerita Resources 2022 Year-In-Review: Successful Major Drill Campaign Expands Deposits In Advance Of Initial NI 43-101 Resource Estimate, Permitting Process Commenced, and Strengthening Management Team"
fin_news_nlp/yahoo_cad_tickers_news,https://ca.finance.yahoo.com/news/engine-gaming-media-inc-reports-120000919.html,"Engine Gaming and Media, Inc. (""Engine"" or the ""Company"") (NASDAQ:GAME)(TSXV:GAME), a data-driven, gaming, media and influencer marketing platform company, today announced results for its fiscal first quarter 2023 ended November 30, 2022. All amounts are stated in U.S.",CAD,GAME.V,"ACCESSWIRE - Engine Gaming & Media, Inc. Reports Fiscal First Quarter 2023 Financial Results"
fin_news_nlp/yahoo_cad_tickers_news,https://ca.finance.yahoo.com/news/everyday-people-financial-announces-expansion-124500562.html,"Edmonton, Alberta--(Newsfile Corp. - January 17, 2023) - Everyday People Financial Corp. (TSXV: EPF) (""Everyday People"" or the ""Company""), a Canadian-based financial technology and consumer financing company, is pleased to announce that EP Care Inc. (""EP Care""), a wholly-owned subsidiary of the Company, has now partnered with 50 dental clinics across Canada to offer the EP Care Program (""EP Care Program"").The EP Care Program is a new and innovative approach to traditional health and ...",CAD,EPF.V,Newsfile - Everyday People Financial Announces Expansion of EP Care to 50 Dental Clinics Across Canada
fin_news_nlp/yahoo_cad_tickers_news,https://ca.finance.yahoo.com/news/fission-3-0-announces-appointment-120000096.html,"Kelowna, British Columbia--(Newsfile Corp. - January 17, 2023) - Fission 3.0 Corp. (TSV: FUU) (OTCQB: FISOF) (""Fission 3"" or ""the Company"") is pleased to welcome Sprott Capital Partners (""SCP""), Peter Grosskopf, David Wargo, and Leslie Yang, as financial advisors on strategic matters, including the procurement of potential strategic investors. SCP will assist Fission 3.0 with the advancement of its 100% owned Patterson Lake North (""PLN"") project.Dev Randhawa, Chairman & CEO of Fission 3, comment",CAD,FUU.V, - Fission 3.0 Announces Appointment of Sprott Capital Partners
fin_news_nlp/yahoo_cad_tickers_news,https://ca.finance.yahoo.com/news/fpx-nickel-commences-preliminary-feasibility-120000677.html,"FPX Nickel Corp. (TSXV: FPX) (OTCQB: FPOCF) (""FPX"" or the ""Company"") is pleased to announce the commencement of a preliminary feasibility study (""PFS"") for the Baptiste Nickel Project (""Baptiste"" or ""the Project"") in central British Columbia. The PFS will mark the culmination of the extensive de-risking and optimization program that has been undertaken since the issuance of the 2020 preliminary economic assessment (""2020 PEA""). The PFS is expected to be completed in September 2023.",CAD,FPX.V,CNW Group - FPX Nickel Commences Preliminary Feasibility Study on the Baptiste Nickel Project
fin_news_nlp/yahoo_cad_tickers_news,https://ca.finance.yahoo.com/news/freeman-extends-lemhi-shallow-oxide-123000732.html,"Freeman Gold Corp. (TSXV: FMAN) (OTCQX: FMANF) (FSE: 3WU) (""Freeman"" or the ""Company"") is pleased to report results for an additional 15 diamond drill holes from the Company's 12,000m Phase II resource expansion and infill drill program at its 100% owned Lemhi Gold Deposit (""Lemhi""), Idaho, USA. These drill holes were designed to test mineralization on strike to the south and southwest of the known deposit (expansion and infill holes) to improve the resource confidence in zones with historical d",CAD,FMAN.V,CNW Group - FREEMAN EXTENDS LEMHI SHALLOW OXIDE GOLD MINERALIZATION TO THE SOUTH
fin_news_nlp/yahoo_cad_tickers_news,https://ca.finance.yahoo.com/news/genius-metals-provides-preliminary-assessment-130000328.html,"Genius Metals Inc. (TSXV: GENI) (""Genius Metals"" or the ""Corporation"") is pleased to disclose a preliminary assessment of the IP survey recently completed by Lithium381 property's optionee, Clarity Metals.",CAD,GENI.V,CNW Group - Genius Metals Provides a Preliminary Assessment of the IP Survey on Lithium381
fin_news_nlp/yahoo_cad_tickers_news,https://ca.finance.yahoo.com/news/goldshore-continues-intersect-multiple-100m-120000546.html,"Vancouver, British Columbia--(Newsfile Corp. - January 17, 2023) - Goldshore Resources Inc. (TSXV: GSHR) (OTCQB: GSHRF) (FSE: 8X00) (""Goldshore"" or the ""Company"") is pleased to announce assay results from its ongoing 100,000-meter drill program at the Moss Lake Project in Northwest Ontario, Canada (the ""Moss Lake Gold Project"").Highlights:Results for seven holes, drilled to infill the western part of the QES Zone, have confirmed and extended closely spaced higher-grade gold mineralized structure",CAD,GSHR.V,Newsfile - Goldshore Continues to Intersect Multiple +100m Wide Mineralized Zones at QES Zone Including 1.03 g/t Au over 152.0m in MQD-22-072
fin_news_nlp/yahoo_cad_tickers_news,https://ca.finance.yahoo.com/news/grid-metals-corp-announces-initial-120000868.html,"Grid Metals Corp (TSXV:GRDM)(OTCQB:MSMGF) (the ""Company"") is pleased to announce the results for the initial six holes of an ongoing exploration and resource delineation drilling program at its Donner Lake Lithium Property (the ""Property""), located in the Bird River Greenstone Belt of southeastern Manitoba, 150 kilometers from Winnipeg.",CAD,GRDM.V,"ACCESSWIRE - Grid Metals Corp Announces Initial Drill Results at Donner Lake Lithium Property, Se Manitoba"
fin_news_nlp/yahoo_cad_tickers_news,https://ca.finance.yahoo.com/news/heliostar-announces-us-12-500-113000512.html,"Vancouver, British Columbia--(Newsfile Corp. - January 17, 2023) - Heliostar Metals Limited (TSXV: HSTR) (OTCQX: HSTXF) (FSE: RGG1) (""Heliostar"" or the ""Company"") is pleased to announce a non-brokered private placement of up to 74,000,000 units (the ""Units"") of the Company at a price of C$0.22 per Unit for gross aggregate proceeds of up to approximately C$16,280,000 (US$12,500,000) (the ""Offering"").Each Unit will consist of one common share in the capital of the Company (each, a ...",CAD,HSTR.V,"Newsfile - Heliostar Announces US$12,500,000 Non-Brokered Private Placement"
fin_news_nlp/yahoo_cad_tickers_news,https://ca.finance.yahoo.com/news/retransmission-hive-blockchain-announces-appointment-110000551.html,"This news release constitutes a ""designated news release"" for the purposes of the Company's prospectus supplement dated September 2, 2022 to its amended and restated short form base shelf prospectus dated January 4, 2022. Vancouver, British Columbia--(Newsfile Corp. - January 17, 2023) - HIVE Blockchain Technologies Ltd. (TSXV: HIVE) (NASDAQ: HIVE) (FSE: HBFA) (the ""Company"" or ""HIVE"") is pleased to announce today that the Board of Directors of the Company has appointed Mr. Aydin Kilic ...",CAD,HIVE.V,Newsfile - RETRANSMISSION: HIVE Blockchain Announces Appointment of Aydin Kilic as Chief Executive Officer
fin_news_nlp/yahoo_cad_tickers_news,https://ca.finance.yahoo.com/news/imetal-resources-discovers-gold-trend-110000789.html,"iMetal Resources, Inc. (TSXV:IMR)(OTC PINK:ADTFF)(FRANKFURT:A7V) (""iMetal"" or the ""Company"") is pleased to announce the assay results of the fall 2022 drill campaign at Gowganda West (""GW"").",CAD,IMR.V,ACCESSWIRE - iMetal Resources Discovers New Gold Trend as Part of Multiple Gold Zones Intersected at Gowganda West During Fall 2022 Drill Program
