source,url,description,country,company,title
fin_news_nlp/yahoo_cad_tickers_news,https://ca.finance.yahoo.com/news/argentina-lithium-present-emerging-growth-210000235.html,"Argentina Lithium & Energy Corp. (TSXV: LIT) (FSE: OAY3) (OTC: PNXLF), (""Argentina Lithium"" or the ""Company"") is pleased to announce that it has been invited to present at the Emerging Growth Conference on February 8, 2023.",CAD,LIT.V,"CNW Group - Argentina Lithium to Present at the Emerging Growth Conference and Invites Individual and Institutional Investors as well as Advisors and Analysts, to Attend Its Real-Time, Interactive Presentation"
fin_news_nlp/yahoo_cad_tickers_news,https://ca.finance.yahoo.com/news/blackrock-files-technical-report-silver-222000821.html,"Vancouver, British Columbia--(Newsfile Corp. - February 7, 2023) - Blackrock Silver Corp. (TSXV: BRC) (the ""Company"" or ""Blackrock"") is pleased to announce the filing of a technical report titled, ""Technical Report on the Silver Cloud Property, Elko County, Nevada, USA"" (the ""Technical Report"") with an effective date of January 27, 2023. The Technical Report was independently completed for the Company by Nancy J. Wolverson, CPG, Consulting Geologist, of Reno, Nevada, in accordance with National",CAD,BRC.V, - Blackrock Files Technical Report on Silver Cloud Property
fin_news_nlp/yahoo_cad_tickers_news,https://ca.finance.yahoo.com/news/correction-clear-blue-technologies-announces-213000351.html,"NOT FOR DISTRIBUTION TO UNITED STATES NEWS WIRE SERVICES OR FOR DISSEMINATION IN THE UNITED STATES TORONTO, Feb. 07, 2023 (GLOBE NEWSWIRE) -- Clear Blue Technologies International Inc. (“Clear Blue” or the “Company”) (TSXV: CBLU), the Smart Off-Grid™ Company, announced via press release on January 27, 2023, that it has closed a second and final tranche of a non-brokered private placement (the “Offering”) on January 24, 2023. The second tranche raised CAD$1,304,420 in proceeds, following a CAD$1,",CAD,CBLU.V,GlobeNewswire - Correction: Clear Blue Technologies Announces Correction to News Releases Announcing Closing of Private Placement Financing
fin_news_nlp/yahoo_cad_tickers_news,https://ca.finance.yahoo.com/news/forward-water-technologies-corp-announces-212000727.html,"Forward Water Technologies Corp. (""Forward Water"" or the ""Company"") (TSXV:FWTC) wishes to announce that it has renewed its agreement (the ""Renewal Agreement"") with Agora Internet Relations Corp. (""AGORA"") to provide online advertising, marketing and branding services (""Advertising Services"") as of January 1, 2023.",CAD,FWTC.V,ACCESSWIRE - Forward Water Technologies Corp. Announces Renewal of Contract with Agora Internet Relations Corp.
fin_news_nlp/yahoo_cad_tickers_news,https://ca.finance.yahoo.com/news/magna-terra-announces-results-annual-213000170.html,"Magna Terra Minerals Inc. (the ""Company"" or ""Magna Terra"") (TSX-V:MTT) is pleased to announce that all resolutions proposed to shareholders at the annual and special meeting held today were duly passed.",CAD,MTT.V,ACCESSWIRE - Magna Terra Announces Results of Annual and Special Meeting
fin_news_nlp/yahoo_cad_tickers_news,https://ca.finance.yahoo.com/news/pierre-lassonde-decreases-ownership-rubicon-043400847.html,"Mr. Pierre Lassonde announced today that as a result of a series of transactions sale made between February 2, 2023 and February 7, 2023 he now indirectly owns or exercises control and direction over less than 10.0% of the current issued and outstanding common shares of Rubicon Organics (TSXV-ROMJ) and is no longer a reporting insider.",CAD,ROMJ.V,CNW Group - Pierre Lassonde Decreases Ownership in Rubicon Organics Inc.
fin_news_nlp/yahoo_cad_tickers_news,https://ca.finance.yahoo.com/news/scottie-resources-announces-6-5-000900141.html,"Scottie Resources Corp. (TSXV: SCOT) (OTCQB: SCTSF) (the ""Company"") is pleased to announce that it has entered into an agreement pursuant to which Cormark Securities Inc., as sole underwriter (the ""Underwriter""), in connection with a ""bought deal"" private placement of: (i) 11,429,000 common shares of the Company that qualify as ""flow-through shares"" (within the meaning of subsection 66(15) of the Income Tax Act (Canada) (the ""FT Shares"") at a price of $0.35 per FT Share for gross proceeds of $4,",CAD,SCOT.V,CNW Group - Scottie Resources Announces $6.5 Million Private Placement of Flow-Through Shares and Common Shares
fin_news_nlp/yahoo_cad_tickers_news,https://ca.finance.yahoo.com/news/signature-resources-ltd-announces-upsize-220100074.html,"Toronto, Ontario--(Newsfile Corp. - February 7, 2023) - Signature Resources Ltd. (TSXV: SGU) (OTCQB: SGGTF) (""Signature"" or the ""Company"") announces that it has updated the previously announced non-brokered private placement to C$900,000 (the ""Offering"") at a price of C$0.04 per common share. The Company has received commitments for over half of the Offering, to be subscribed for by members of the Company's board of directors.Completion of the Offering remains subject to the approval of ...",CAD,SGU.V,"Newsfile - Signature Resources Ltd. Announces Upsize to Private Placement Financing to C$900,000"
fin_news_nlp/yahoo_cad_tickers_news,https://ca.finance.yahoo.com/news/silver-tiger-announces-c-18-212800474.html,"Not for distribution to U.S. news wire services or dissemination in the United States. HALIFAX, Nova Scotia, Feb. 07, 2023 (GLOBE NEWSWIRE) -- Silver Tiger Metals Inc. (TSXV:SLVR and OTCQX:SLVTF) (“Silver Tiger” or the “Corporation”) has announced today that it has entered into an agreement with a syndicate of underwriters led by BMO Capital Markets, under which the underwriters have agreed to buy on a bought deal basis 58,100,000 common shares (the “Common Shares”), at a price of $0.31 per Comm",CAD,SLVR.V,GlobeNewswire - Silver Tiger Announces C$18 Million Bought Deal Financing
fin_news_nlp/yahoo_cad_tickers_news,https://ca.finance.yahoo.com/news/simply-better-brands-corp-upsizes-211100302.html,"VANCOUVER, British Columbia, Feb. 07, 2023 (GLOBE NEWSWIRE) -- Simply Better Brands Corp. (""SBBC"" or the ""Company"") (TSX Venture: SBBC) (OTCQB: PKANF) is pleased to announce that, in response to investor demand, the Company has increased the size of the non-brokered private placement announced on January 26, 2023. The revised terms of the non-brokered private placement is for up to 28,000,000 units (“Units”) at a price of $0.25 per Unit for ‎aggregate gross proceeds of up to $7,000,000 (the “Off",CAD,SBBC.V,GlobeNewswire - Simply Better Brands Corp. Upsizes Non-Brokered Private Placement Up to $7 Million
fin_news_nlp/yahoo_cad_tickers_news,https://ca.finance.yahoo.com/news/sparta-capital-announces-closing-private-001500839.html,"Further to a previous extension announcement on January 30, 2023, Sparta Group (TSXV:SAY) (the ""Corporation"", the ""Company"", ""Sparta Group"", ""Sparta Capital"", ""SAY.V"" or ""Sparta"") is pleased to announce that it has closed the non-brokered private placement (the ""Offering"") previously announced on December 9, 2022 and is also announcing that further to its February 1, 2023 news release (""Default Announcement"") it has received the order from the Alberta",CAD,SAY.V,ACCESSWIRE - Sparta Capital Announces Closing of Private Placement and Issuing of Management Cease Trade Order
fin_news_nlp/yahoo_cad_tickers_news,https://ca.finance.yahoo.com/news/uranium-royalty-corp-completes-acquisition-213000626.html,"Uranium Royalty Corp. (NASDAQ: UROY) (TSXV: URC) (""URC"" or the ""Company"") is pleased to announce the completion of its previously announced acquisition from Anfield Energy Inc. (""Anfield"") of a portfolio of royalties on U.S. projects consisting of:",CAD,URC.V,CNW Group - Uranium Royalty Corp. Completes Acquisition of U.S. Uranium Royalty Portfolio from Anfield Energy Inc. and Expands Physical Uranium Holdings
fin_news_nlp/yahoo_cad_tickers_news,https://ca.finance.yahoo.com/news/usha-resources-completes-first-scoping-120000983.html,"Usha Resources Ltd. (""USHA"" or the ""Company"") (TSXV: USHA) (OTCQB: USHAF) (FSE: JO0), a North American mineral acquisition and exploration company focused on the development of drill-ready lithium and other battery and precious metal projects, is pleased to announce that it has successfully completed hole JP22-1 at the Jackpot Lake Lithium Brine Property (""Project""). The Company will now proceed with drilling its second hole and sampling JP22–1.",CAD,USHA.V,CNW Group - Usha Resources Completes First Scoping Drill Hole at the Jackpot Lake Lithium Brine Project; Supports Clayton Valley Style Model and Lithium-Bearing Brine Potential
fin_news_nlp/yahoo_cad_tickers_news,https://ca.finance.yahoo.com/news/high-fusion-inc-extension-debentures-213000652.html,"Toronto, Ontario--(Newsfile Corp. - February 7, 2023) - High Fusion Inc. (CSE: FUZN) (""High Fusion"" or the ""Company"") is pleased to announce an extension of the term of the August 2018 senior secured debentures (""Debentures"") from February 3, 2023 to March 3, 2023.The extension of the Debentures has been approved by the majority of the holders of the Debentures. The Company expects that the maturity of the Debentures to be extended further in ...",CAD,FUZN.CN, - High Fusion Inc. Extension of Debentures
fin_news_nlp/yahoo_cad_tickers_news,https://ca.finance.yahoo.com/news/im-cannabis-closes-additional-tranches-210100122.html,"IM Cannabis Corp. (the ""Company"" or ""IMC"") (NASDAQ: IMCC) (CSE: IMCC), an international medical cannabis company, is pleased to announce that it has closed a fourth tranche of its previously announced non-brokered private placement offering of units of the Company (each a ""Unit"") pursuant to the listed issuer financing exemption under Part 5A of National Instrument 45-106 – Prospectus Exemptions (the ""LIFE Offering""). An aggregate of 760,450 Units at a price of US$1.25 per Unit for aggregate pro",CAD,IMCC.CN,CNW Group - IM Cannabis Closes Additional Tranches of Private Placement Offerings
fin_news_nlp/yahoo_cad_tickers_news,https://ca.finance.yahoo.com/news/planet-13-exercises-closes-option-220000700.html,"Planet 13 Holdings Inc. (CSE:PLTH)(OTCQB:PLNHF)(""Planet 13"" or the ""Company""), a leading vertically-integrated multi-state cannabis company, announced today that Planet 13 has exercised and closed its option to purchase the remaining 51% in Planet 13 Illinois, LLC (""Planet 13 Illinois"") from Frank Cowan for US$866,250 in cash and 1,063,377 common shares of Planet 13 (the ""Planet 13 Shares"") pursuant to an option purchase agreement entered into on",CAD,PLTH.CN,ACCESSWIRE - Planet 13 Exercises and Closes Option to Buy Remaining 51% in Illinois Dispensary
fin_news_nlp/yahoo_cad_tickers_news,https://ca.finance.yahoo.com/news/prospect-park-announces-cease-trade-222100550.html,"VANCOUVER, British Columbia, Feb. 07, 2023 (GLOBE NEWSWIRE) -- Prospect Park Capital Corp. (CSE:PPK) (the “Company”) announces further to its press release of January 27, 2023, that the Ontario Securities Commission (the “OSC”) has issued a Failure-to-File Cease Trade Order (“FFCTO”) pursuant to National Policy 11-207 – Failure to File Cease Trade Orders and Revocations in Multiple Jurisdictions dated February 3, 2023 in respect of the securities of the Company as a result of the Company’s inabi",CAD,PPK.CN, - Prospect Park Announces Cease Trade Order
fin_news_nlp/yahoo_cad_tickers_news,https://ca.finance.yahoo.com/news/prospect-park-provides-announces-cease-222100145.html,"VANCOUVER, British Columbia, Feb. 07, 2023 (GLOBE NEWSWIRE) -- Prospect Park Capital Corp. (CSE:PPK) (the “Company”) announces further to its press release of January 27, 2023, that the Ontario Securities Commission (the “OSC”) has issued a Failure-to-File Cease Trade Order (“FFCTO”) pursuant to National Policy 11-207 – Failure to File Cease Trade Orders and Revocations in Multiple Jurisdictions dated February 3, 2023 in respect of the securities of the Company as a result of the Company’s inabi",CAD,PPK.CN, - Prospect Park Provides Announces Cease Trade Order
fin_news_nlp/yahoo_cad_tickers_news,https://ca.finance.yahoo.com/news/3iq-expands-middle-east-initiative-050000263.html,"3iQ Digital Asset Management (3iQ), a global trusted leader in digital asset investments, announces its expansion into the Middle East with the appointment of two new strategic advisors, Rachel Pether, CFA and Vinay Kapoor. The company has already established a strong presence in the region, launching the Middle East's first exchange-listed Bitcoin Fund on Nasdaq Dubai.",CAD,BTCQ.TO,CNW Group - 3iQ Expands Middle East Initiative and Strengthens Leadership Team with Strategic Advisor Hires
fin_news_nlp/yahoo_cad_tickers_news,https://ca.finance.yahoo.com/news/vox-provides-development-exploration-updates-120000706.html,"Vox Royalty Corp.(TSXV:VOX)(NASDAQ:VOXR) (""Vox"" or the ""Company""), a returns focused mining royalty company, is pleased to provide recent development and exploration updates from royalty operating partners Silver Mines Limited (ASX: SVL) (""Silver Mines""), Develop Global Limited (ASX: DVP) (""Develop""), Genesis Minerals Ltd. (ASX: GMD) (""Genesis""), and Black Cat Syndicate Limited (ASX: BC8) (""Black Cat"").",CAD,VOX.V,ACCESSWIRE - Vox Provides Development and Exploration Updates
fin_news_nlp/yahoo_cad_tickers_news,https://ca.finance.yahoo.com/news/first-hydrogen-encouraged-eu-250-080500865.html,"Vancouver, British Columbia--(Newsfile Corp. - February 8, 2023) - First Hydrogen Corp. (TSXV: FHYD) (OTC Pink: FHYDF) (FSE: FIT) (""FIRST HYDROGEN"" or the ""Company"") is anticipating the approval of the proposed €250 billion green subsidies announced by European Commission President Ursula von der Leyen which will enhance the competitiveness of Europe's net-zero industry and support the fast transition to climate neutrality. Subsidies would include tax breaks to businesses investing in net-zero t",CAD,FHYD.V,Newsfile - First Hydrogen Encouraged by EU 250 Billion Euro Green Subsidies
fin_news_nlp/yahoo_cad_tickers_news,https://ca.finance.yahoo.com/news/f3-uranium-hits-65535-cps-080100240.html,"Kelowna, British Columbia--(Newsfile Corp. - February 8, 2023) - F3 Uranium Corp (TSXV: FUU) (OTCQB: FUUFF) (""F3"" or ""the Company"") is pleased to announce results from the first eight drill holes of the 20-hole winter drill program at the JR Zone on the Patterson Lake North (""PLN"") Property. Most significantly, continuity of high grade mineralization has been established along strike towards the south with hole PLN23-048 on line 030S, which hit 14.0m total composite ...",CAD,FUU.V,Newsfile - F3 Uranium Hits >65535 CPS in 30m Stepout and Expands JR Zone North and South
fin_news_nlp/yahoo_cad_tickers_news,https://ca.finance.yahoo.com/news/recharge-resources-announces-addition-mr-080100176.html,"Vancouver, BC, Feb. 08, 2023 (GLOBE NEWSWIRE) -- Recharge Resources Ltd. (“Recharge” or the “Company”) (RR: CSE) (RECHF: OTC) (SL5: Frankfurt) is pleased to announce the appointment of Mr. Bill Macdonald to the Company's Advisory Board. William (Bill) Macdonald is a successful securities and corporate finance lawyer operating in North Vancouver, Canada. Mr. Macdonald has been, and continues to be, a director and/or officer of numerous publicly traded companies listed on Canadian stock exchanges",CAD,RR.CN,"GlobeNewswire - RECHARGE RESOURCES ANNOUNCES ADDITION OF MR. BILL MACDONALD, AN EXPERIENCED SECURITIES AND CORPORATE FINANCE LAWYER TO ITS BOARD OF ADVISORS"
fin_news_nlp/yahoo_cad_tickers_news,https://ca.finance.yahoo.com/news/finning-international-full-2022-earnings-103119150.html,Finning International ( TSE:FTT ) Full Year 2022 Results Key Financial Results Revenue: CA$9.28b (up 27% from FY 2021...,CAD,FTT.TO,Simply Wall St. - Finning International Full Year 2022 Earnings: Beats Expectations
fin_news_nlp/yahoo_cad_tickers_news,https://ca.finance.yahoo.com/news/gibson-energy-maintains-industry-leading-220000157.html,"Gibson Energy Inc. is pleased to announce another successful year of industry-leading safety performance, achieving top quartile safety performance among North American peers for the second consecutive year. In 2022, the Company also maintained and enhanced its position as an industry sustainability leader, as identified by globally recognized ESG rating agencies, due to its continued environmental, social and governance (""ESG"") achievements. Gibson will continue to build off its solid foundatio",CAD,GEI.TO,CNW Group - Gibson Energy Maintains Industry-Leading Safety Performance and Sustainability Leadership Position for 2022
fin_news_nlp/yahoo_cad_tickers_news,https://ca.finance.yahoo.com/news/international-petroleum-full-2022-earnings-101238680.html,International Petroleum ( TSE:IPCO ) Full Year 2022 Results Key Financial Results Revenue: US$1.14b (up 71% from FY...,CAD,IPCO.TO,Simply Wall St. - International Petroleum Full Year 2022 Earnings: Misses Expectations
fin_news_nlp/yahoo_cad_tickers_news,https://ca.finance.yahoo.com/news/2-top-tsx-energy-stocks-083000489.html,Top TSX energy stocks now appear oversold. The post 2 Top TSX Energy Stocks to Buy in February 2023 appeared first on The Motley Fool Canada.,CAD,SU.TO,The Motley Fool - 2 Top TSX Energy Stocks to Buy in February 2023
fin_news_nlp/yahoo_cad_tickers_news,https://ca.finance.yahoo.com/news/good-natured-plant-based-packaging-110000164.html,"Vancouver, British Columbia--(Newsfile Corp. - February 8, 2023) - good natured Products Inc. (TSXV: GDNP) (OTCQX: GDNPF) (the ""Company"" or ""good natured®""), a North American leader in plant-based products, today announced its distribution through Sustainable Island Products, the primary distributor of compostable packaging products in Hawaii.Plant-based, BPI-certified compostable1 products from good natured® are up to 99% plant-based and comply with single use packaging regulations that started",CAD,GDNP.V,Newsfile - good natured Plant-Based Packaging Makes Eco-Impact in Hawaii with New Distributor
fin_news_nlp/yahoo_cad_tickers_news,https://ca.finance.yahoo.com/news/grounded-lithium-announces-development-plan-110000666.html,"(TSXV: GRD) (OTCQB: GRDAF) - Grounded Lithium Corp. (""GLC"" or the ""Company"") is pleased to announce our intended field development plan for our first 10,000 metric ton/yr phase at the Kindersley Lithium Project (""KLP"") located in Western Saskatchewan. The development plan relies on and considers such factors as production testing, extensive dynamic fluid modeling, present land configuration, land tenure, topography, best practices in reservoir development and infrastructure availability. This en",CAD,GRD.V,CNW Group - Grounded Lithium Announces Development Plan to Support Upcoming Preliminary Economic Assessment
fin_news_nlp/yahoo_cad_tickers_news,https://ca.finance.yahoo.com/news/investmentpitch-media-video-discusses-lucky-110000102.html,"VANCOUVER, British Columbia, Feb. 08, 2023 (GLOBE NEWSWIRE) -- Lucky Minerals (TSXV:LKY) (OTCPink:LKMNF) (FSE:LKY) has discovered large intersections of gold mineralization in the initial stage of its ongoing drill program at its Wayka Project in Ecuador. The 100% owned Fortuna property covers 550 square kilometers or approximately 55,000 hectares of exploration concessions in a highly prospective, yet underexplored, gold belt in southern Ecuador. A Media Snippet accompanying this announcement i",CAD,LKY.V,GlobeNewswire - InvestmentPitch Media Video Discusses Lucky Minerals’ Discovery of Large Intersections of Gold Mineralization in the Initial Stage of its Ongoing Drill Program at its Wayka Project in Ecuador
fin_news_nlp/yahoo_cad_tickers_news,https://ca.finance.yahoo.com/news/p2-gold-bam-geophysics-identifies-100000490.html,"Figure 1 Figure 1 Figure 2 Figure 2 Figure 3 Figure 3 Figure 4 Figure 4 VANCOUVER, British Columbia, Feb. 08, 2023 (GLOBE NEWSWIRE) -- P2 Gold Inc. (“P2” or the “Company”) (TSX-V:PGLD) (OTCQB:PGLDF) reports the completion of a three-dimensional geophysical interpretation of the BAM Project, incorporating the results of the natural source magneto-telluric (NSMT) geophysical survey and the Z-Tipper Axis Electromagnetic (ZTEM) airborne geophysical survey conducted in 2022 at its BAM Project. The go",CAD,PGLD.V,GlobeNewswire - P2 Gold: BAM Geophysics Identifies Porphyry Exploration Targets
fin_news_nlp/yahoo_cad_tickers_news,https://ca.finance.yahoo.com/news/investmentpitch-media-video-discusses-york-110000882.html,"VANCOUVER, British Columbia, Feb. 08, 2023 (GLOBE NEWSWIRE) -- York Harbour Metals (TSXV:YORK) (OTCPink:YORKF) (FSE:5DE0), an exploration and development company focused on its 100%-owned York Harbour Copper-Zinc-Silver project in Newfoundland is featured in InvestmentPitch Media video. A Media Snippet accompanying this announcement is available by clicking on the image or link below: For more information about this news along with comments from Michael Williams, Chairman of York Harbour Metals,",CAD,YORK.V,GlobeNewswire - InvestmentPitch Media Video Discusses York Harbour Metals and its 100%-Owned York Harbour Copper-Zinc-Silver Project in Newfoundland
fin_news_nlp/yahoo_cad_tickers_news,https://ca.finance.yahoo.com/news/appili-therapeutics-announces-fda-accepts-121800521.html,"HALIFAX, Nova Scotia, February 08, 2023--Appili Therapeutics Inc. (TSX: APLI) (the ""Company"" or ""Appili""), a biopharmaceutical company focused on drug development for infectious diseases and biodefense, today, with its partner Saptalis Pharmaceuticals LLC (""Saptalis""), announced that the Food and Drug Administration (""FDA"") accepted the ATI-1501 New Drug Application (""NDA""). ATI-1501 is Appili’s liquid oral reformulation of the antibiotic metronidazole, which has been licensed to Saptalis. The F",CAD,APLI.TO, - Appili Therapeutics Announces that FDA accepts the ATI-1501 NDA
fin_news_nlp/yahoo_cad_tickers_news,https://ca.finance.yahoo.com/m/76a28ede-9fca-3527-8be4-aa3df2a01955/this-high-yield-bank-stock-is.html,"Bank of Nova Scotia isn't your typical North American bank, but don't let that scare you away from its monster yield.",CAD,BNS.TO,Motley Fool - This High-Yield Bank Stock Is Safer Than You Think
fin_news_nlp/yahoo_cad_tickers_news,https://ca.finance.yahoo.com/m/c78ebfb0-2896-38aa-a738-ee0a6e254560/1-indicator-showing-why-these.html,"Shares of leading alternative asset managers Blackstone (NYSE: BX), Brookfield (NYSE: BN)(NYSE: BAM), and KKR (NYSE: KKR) have gotten hammered over the past year.  A big factor weighing on their shares has been the potential impact of rising interest rates on institutional investors' appetite for the alternative investments they manage.",CAD,BAM.TO,Motley Fool - 1 Indicator Showing Why These Beaten-Down Dividend Stocks Are Great Buys
fin_news_nlp/yahoo_cad_tickers_news,https://ca.finance.yahoo.com/news/brookfield-asset-management-announces-strong-114500265.html,"Distributable Earnings of $2.1 billion for the Year Raised a Record $93 billion of Capital in 2022 BROOKFIELD, NEWS, Feb. 08, 2023 (GLOBE NEWSWIRE) -- Brookfield Asset Management Ltd. (NYSE: BAM, TSX: BAM) today announced financial results for the quarter ended December 31, 2022. Connor Teskey, President, stated, “We are pleased to announce our first quarterly results as a public company. Our asset management business delivered strong performance in the fourth quarter, finishing the year with re",CAD,BAM.TO,GlobeNewswire - Brookfield Asset Management Announces Strong Fourth Quarter Results
fin_news_nlp/yahoo_cad_tickers_news,https://ca.finance.yahoo.com/news/spinach-becomes-number-one-edible-123000664.html,"Spinach® gummies, known for incredible flavors and quality, are winning with adult consumers in the Canadian market TORONTO, Feb. 08, 2023 (GLOBE NEWSWIRE) -- Cronos Group Inc. (NASDAQ: CRON) (TSX: CRON) (“Cronos”), an innovative global cannabinoid company, today announced that its award-winning gummies portfolio under the Spinach® brand has become the top-selling edible brand in Canada, capturing 15.8%1 market share of the total edibles category in January 2023. Since launching in 2021, Spinach",CAD,CRON.TO,GlobeNewswire - Spinach® Becomes the Number One Edible Brand in January¹
fin_news_nlp/yahoo_cad_tickers_news,https://ca.finance.yahoo.com/news/crown-capital-announces-c-43-120000565.html,"Crown Capital Partners Inc. (""Crown"" or the ""Corporation"") (TSX: CRWN), a capital partner to entrepreneurs and growth businesses, today announced that it has entered an agreement for a new senior secured corporate credit facility of up to $43.5 million (""Credit Facility"") with Canadian Western Bank. This Credit Facility replaces Crown's previous $23.5 million corporate credit facility.",CAD,CRWN.TO,CNW Group - Crown Capital Announces New C$43.5 million Credit Facility with Canadian Western Bank
fin_news_nlp/yahoo_cad_tickers_news,https://ca.finance.yahoo.com/news/else-nutrition-receives-irb-approval-120000092.html,"The approval represents a critical step in the clinical trials process, on Else’s pathway to launching a new infant formula in the US based on Else’s patented plant-based formula Update - FDA Clinical Trials Update - FDA Clinical Trials VANCOUVER, British Columbia, Feb. 08, 2023 (GLOBE NEWSWIRE) -- ELSE NUTRITION HOLDINGS INC. (BABY) (BABYF) (0YL.F) (“Else” or the “Company”), announces that the Institutional Review Board (IRB) has approved the infant growth study protocol for the testing of the",CAD,BABY.TO,GlobeNewswire - Else Nutrition Receives IRB Approval for Infant Growth Clinical Study Protocol
