source,url,description,country,company,title
fin_news_nlp/yahoo_cad_tickers_news,https://ca.finance.yahoo.com/news/railtown-ai-technologies-inc-announces-123000551.html,"Burnaby, British Columbia--(Newsfile Corp. - March 20, 2023) - Railtown AI Technologies Inc. (CSE: RAIL) (""Railtown"" or the ""Company"") is pleased to announce that the first of its AI powered Co-Pilot solutions is now available for purchase in Microsoft's Azure Marketplace. Railtown's AI powered Release Notes Co-Pilot is now available by paid subscription to the more than 400,000 Microsoft Partners worldwide. In conjunction with the Azure Marketplace offering Railtown is also pleased to announce",CAD,RAIL.CN,Newsfile - Railtown AI Technologies Inc. Announces Release Notes Co-Pilot Released on Microsoft's Azure Marketplace
fin_news_nlp/yahoo_cad_tickers_news,https://ca.finance.yahoo.com/news/revive-therapeutics-provides-phase-3-122800259.html,"TORONTO, March 20, 2023 (GLOBE NEWSWIRE) -- Revive Therapeutics Ltd. (“Revive” or the “Company”) (OTCQB: RVVTF) (CSE: RVV) (FRANKFURT:31R), a specialty life sciences company focused on the research and development of therapeutics for medical needs and rare disorders, announced today an update on the Company’s U.S. Food & Drug Administration (“FDA”) Phase 3 clinical trial (the “Study”) (NCT04504734) to evaluate the safety and efficacy of Bucillamine, an oral drug with anti-inflammatory and antivi",CAD,RVV.CN,GlobeNewswire - Revive Therapeutics Provides Update of Phase 3 Clinical Study for Bucillamine in the Treatment of COVID-19
fin_news_nlp/yahoo_cad_tickers_news,https://ca.finance.yahoo.com/news/rock-edge-resources-signs-loi-130000046.html,"Rock Edge Resources (""Rock Edge"", or the ""Company"") is pleased to announce that is has entered into an arm's length letter of intent (""the LOI"") to acquire all of the issued and outstanding securities or all or substantially all of the assets of 1403437 BC LTD, including but not limited to the Val-d'Or East Mineral Claims (the ""Property"") in the Province of Quebec, Canada.",CAD,REDG.CN,ACCESSWIRE - Rock Edge Resources Signs LOI to Acquire the Val-D’or East Lithium Project
fin_news_nlp/yahoo_cad_tickers_news,https://ca.finance.yahoo.com/news/sixty-north-gold-announces-changes-130000285.html,"Vancouver, British Columbia--(Newsfile Corp. - March 20, 2023) - Sixty North Gold Mining Ltd. (CSE: SXTY) (FSE: 2F40) (OTC Pink: SXNTF) (the ""Company"" or ""Sixty North Gold"") provides notice of changes to its Board of Directors.Sixty North announces the appointment of Mr. Tom MacNeill, CPA, CGA, CFA to the board of directors of the Company. Mr. MacNeill is an experienced financer and manager of various mining and resource ventures having held positions ...",CAD,SXTY.CN,"Newsfile - Sixty North Gold Announces Changes to Its Board of Directors, as It Prepares for Mining to Commence"
fin_news_nlp/yahoo_cad_tickers_news,https://ca.finance.yahoo.com/news/sponsorsone-focuses-direct-consumer-ecommerce-120603196.html,"“Smithville Premium Texas Whiskey will be offered DTC Only.""",CAD,SPO.CN, - SponsorsOne Focuses on Direct-to-Consumer eCommerce Sales in 31 States
fin_news_nlp/yahoo_cad_tickers_news,https://ca.finance.yahoo.com/news/auto-roundup-lad-expands-uk-125312052.html,"While Lithia's (LAD) buyout of Jardine bolsters its opportunities in the U.K. market, Westport (WPRT) posts disappointing Q4 results with a wider-than-expected loss.",CAD,WPRT.TO,"Zacks - Auto Roundup: LAD Expands UK Presence, WPRT Incurs Q4 Loss & More"
fin_news_nlp/yahoo_cad_tickers_news,https://ca.finance.yahoo.com/news/global-battery-metals-announces-positive-132000353.html,"Vancouver, British Columbia--(Newsfile Corp. - March 20, 2023) - Global Battery Metals Ltd. (TSXV: GBML) (OTCQB: REZZF) (FSE: REZ) (the ""Company"" or ""GBML""), a critical mineral exploration company focused on growth-oriented lithium and other battery metal projects, announces multiple drill targets and the potential discovery of up to six LCT (lithium-cesium-tantalum) pegmatite dikes extending across a prospective lithium trend at Prospecting Licence Area 1597 (""PLA 1597""), have now been identifi",CAD,GBML.V,Newsfile - Global Battery Metals Announces Positive Geochemical Survey Results and Plans for Expanded Leinster Lithium Project Drill Program
fin_news_nlp/yahoo_cad_tickers_news,https://ca.finance.yahoo.com/news/jaxon-acquires-claims-rocher-deboule-143000587.html,"Vancouver, British Columbia--(Newsfile Corp. - March 20, 2023) - Jaxon Mining Inc. (TSXV: JAX) (FSE: 0U31) (OTC Pink: JXMNF) (""Jaxon"" or the ""Company"") is pleased to announce it has expanded its 100% controlled Hazelton property by staking and acquiring four additional mineral tenures, increasing the total area to 73,079.05 hectares or 730.79 km2, comprising 75 contiguous claims, at NTS 93M centered at -127° 10' 46"" Longitude, 55° 11' 5"" Latitude. The Hazelton Property hosts ...",CAD,JAX.V,Newsfile - Jaxon Acquires Claims at Rocher Deboule Mountain Project to Expand 100% Owned Hazelton Property
fin_news_nlp/yahoo_cad_tickers_news,https://ca.finance.yahoo.com/news/lahontan-gold-building-value-drill-150000083.html,"Vancouver, British Columbia--(Newsfile Corp. - March 20, 2023) - Lahontan Gold Corp. (TSXV: LG) - Lahontan Gold has three gold and silver exploration properties in Nevada, including the Santa Fe Project, a past producing mine with significant potential. With an aggressive drilling program underway, the company plans to publish a compliant mineral resource estimate in 2022 and expand existing resources with 20,000 meters of additional drilling, including multiple shallow targets.If you cannot vie",CAD,LG.V," - Lahontan Gold: Building Value Through the Drill Bit, CEO Clips Video"
fin_news_nlp/yahoo_cad_tickers_news,https://ca.finance.yahoo.com/news/mcf-energy-updates-austrian-operations-141600729.html,"MCF Energy Ltd. (TSXV: MCF) (FRA: DC6) (OTCPK: MCFNF) (""MCF Energy"" or the ""Company"") is pleased to provide an update on its Austrian operations, specifically regarding its well permitting and planned spudding at the Giant Welchau anticline. Permitting is progressing ahead of schedule with Spudding anticipated during the first half of September 2023.",CAD,MCF.V,CNW Group - MCF Energy Updates on Austrian Operations
fin_news_nlp/yahoo_cad_tickers_news,https://ca.finance.yahoo.com/news/mountain-boy-announces-participation-channelchek-133000494.html,"Vancouver, British Columbia--(Newsfile Corp. - March 20, 2023) - Mountain Boy Minerals Ltd. (TSXV: MTB) (OTCQB: MBYMF) (FSE: M9UA), today announced their participation in the Channelchek Takeaway Series from the PDAC 2023 Convention, to be broadcast Tuesday, March 21, starting at 9:45 ET.The Prospectors & Developers Association of Canada (PDAC) is the leading voice of the mineral exploration and development community. Representing over 6,000 members around the world, PDAC's work centers on suppo",CAD,MTB.V,Newsfile - Mountain Boy Announces Participation in the Channelchek Takeaway Series
fin_news_nlp/yahoo_cad_tickers_news,https://ca.finance.yahoo.com/news/westhaven-provides-final-drill-results-140000394.html,"Image 1 Skoonka: JJ-Zone Plan Map Image 2 Shovelnose: FMN Plan Map VANCOUVER, British Columbia, March 20, 2023 (GLOBE NEWSWIRE) -- Westhaven Gold Corp. (TSX-V:WHN) is pleased to announce final drill results from its 100% owned Shovelnose gold property and its 100% owned Skoonka gold property, both located within the prospective Spences Bridge Gold Belt (SBGB), British Columbia. Westhaven is reporting final assays for 15 holes from its 2022 drill campaigns at both Shovelnose and Skoonka gold prop",CAD,WHN.V,"GlobeNewswire - Westhaven Provides Final Drill Results From 2022; Drills 15.85 Metres of 0.93 g/t Gold, Including 0.72 Metres of 11.90 g/t Gold at Skoonka Gold Property"
fin_news_nlp/yahoo_cad_tickers_news,https://ca.finance.yahoo.com/news/canadian-securities-exchange-reports-february-135600931.html,"- Five new IPOs completed during the month, and 10 total new listings - Toronto, Ontario--(Newsfile Corp. - March 20, 2023) - The Canadian Securities Exchange (""CSE"" or ""the Exchange"") today announced market statistics for February 2023.February 2023 Operating StatisticsTrading volume of CSE-listed securities totaled 1.4 billion shares;Trading value of CSE-listed securities was $336 million;CSE issuers completed 78 financings that raised an aggregate $80 million; andThe CSE welcomed listings fro",CAD,TRIP.CN, - Canadian Securities Exchange Reports February 2023 Performance Figures
fin_news_nlp/yahoo_cad_tickers_news,https://ca.finance.yahoo.com/news/dividend-investors-top-canadian-utility-143000879.html,The TSX utility sector can be a great place to find lower-volatility or high-yielding stocks. The post Dividend Investors: Top Canadian Utility Stocks for March 2023 appeared first on The Motley Fool Canada.,CAD,AQN.TO,The Motley Fool - Dividend Investors: Top Canadian Utility Stocks for March 2023
fin_news_nlp/yahoo_cad_tickers_news,https://ca.finance.yahoo.com/news/vp-technology-joins-canlan-ice-155900920.html,"Burnaby, British Columbia--(Newsfile Corp. - March 20, 2023) - Canlan Ice Sports Corp. (TSX: ICE) (""Canlan"" or ""the Company"") is pleased to announce the appointment of Chad Mahabir as the Company's new Vice President of Technology.Chad's most recent experience was with Freshbooks where he served as the Director of Global IT Services and previously, he worked with IMAX and Royal Bank of Canada.Chad has a proven track record of delivering technical innovation and transformation, with more ...",CAD,ICE.TO,Newsfile - New VP Technology Joins Canlan Ice Sports Corp
fin_news_nlp/yahoo_cad_tickers_news,https://ca.finance.yahoo.com/news/cascades-inc-tse-cas-intrinsic-151251475.html,Key Insights Cascades' estimated fair value is CA$14.04 based on 2 Stage Free Cash Flow to Equity Current share price...,CAD,CAS.TO,Simply Wall St. - Cascades Inc.'s (TSE:CAS) Intrinsic Value Is Potentially 29% Above Its Share Price
fin_news_nlp/yahoo_cad_tickers_news,https://ca.finance.yahoo.com/news/cogeco-cogeco-communications-schedule-release-152500405.html,"Cogeco Inc. (TSX: CGO) and Cogeco Communications Inc. (TSX: CCA) plan to release their financial results for the second quarter of fiscal 2023, which ended February 28, 2023, on Thursday, April 13, 2023, after market closing.",CAD,CGO.TO,CNW Group - Cogeco and Cogeco Communications Schedule the Release of Their Financial Results for the Second Quarter of Fiscal 2023 and Related Conference Call
fin_news_nlp/yahoo_cad_tickers_news,https://ca.finance.yahoo.com/news/strategic-merger-between-dcm-rrd-141700712.html,"Equity Research firm, eResearch Corp. (www.eresearch.com), recently published a 10-page update Equity ...",CAD,DCM.TO, - Strategic Merger Between DCM and RRD Canada Sparks Industry Consolidation with Beneficial Synergies
fin_news_nlp/yahoo_cad_tickers_news,https://ca.finance.yahoo.com/news/descartes-gladiator-52-week-highs-150500197.html,Descartes Systems Group Inc. (T.DSG) hit a new 52-week high of $106.66 Monday. Descartes Systems released ...,CAD,DSG.TO," - Descartes, Gladiator at 52-Week Highs on News"
fin_news_nlp/yahoo_cad_tickers_news,https://ca.finance.yahoo.com/news/investing-firm-capital-mortgage-investment-154606471.html,Low-cost index funds make it easy to achieve average market returns. But across the board there are plenty of stocks...,CAD,FC.TO,Simply Wall St. - Investing in Firm Capital Mortgage Investment (TSE:FC) three years ago would have delivered you a 79% gain
fin_news_nlp/yahoo_cad_tickers_news,https://ca.finance.yahoo.com/news/while-insiders-own-21-knight-141125795.html,Key Insights Significant control over Knight Therapeutics by retail investors implies that the general public has more...,CAD,GUD.TO,"Simply Wall St. - While insiders own 21% of Knight Therapeutics Inc. (TSE:GUD), retail investors are its largest shareholders with 56% ownership"
fin_news_nlp/yahoo_cad_tickers_news,https://ca.finance.yahoo.com/news/value-investors-buy-north-american-134001652.html,"Here at Zacks, our focus is on the proven Zacks Rank system, which emphasizes earnings estimates and estimate revisions to find great stocks. Nevertheless, we are always paying attention to the latest value, growth, and momentum trends to underscore strong picks.",CAD,NOA.TO,Zacks - Should Value Investors Buy North American Construction Group (NOA) Stock?
fin_news_nlp/yahoo_cad_tickers_news,https://ca.finance.yahoo.com/news/sabina-gold-silver-mails-special-163400859.html,"VANCOUVER, British Columbia, March 20, 2023 (GLOBE NEWSWIRE) -- Sabina Gold & Silver Corp. (“Sabina”) or (the “Company”) (SBB – TSX/ SGSVF - OTCQX) is pleased to announce that the management information circular and related materials associated with the upcoming special meeting (the “Special Meeting”) of shareholders of the Company (the “Shareholders”) to be held on April 12, 2023 are being mailed today to Shareholders and have been filed under the Company’s profile on SEDAR. The Special Meeting",CAD,SBB.TO,GlobeNewswire - Sabina Gold & Silver Mails Special Meeting Materials for B2Gold Transaction to Shareholders
fin_news_nlp/yahoo_cad_tickers_news,https://ca.finance.yahoo.com/news/td-asset-management-inc-announces-151100282.html,"TD Asset Management Inc. (""TDAM"") today announced the March cash distributions for the TD Exchange-Traded Funds (each, a ""TD ETF"" and collectively, the ""TD ETFs"") listed below. Unitholders of record as at March 30, 2023 will receive a cash distribution per unit of the applicable TD ETF that will be payable on April 6, 2023, as indicated below:",CAD,TGED.TO,CNW Group - TD Asset Management Inc. Announces TD ETF Distributions
fin_news_nlp/yahoo_cad_tickers_news,https://ca.finance.yahoo.com/news/td-asset-management-inc-announces-151100494.html,"TD Asset Management Inc. (""TDAM"") today announced the March cash distributions for the TD Exchange-Traded Funds (each, a ""TD ETF"" and collectively, the ""TD ETFs"") listed below. Unitholders of record as at March 30, 2023 will receive a cash distribution per unit of the applicable TD ETF that will be payable on April 6, 2023, as indicated below:",CAD,TUHY.TO,CNW Group - TD Asset Management Inc. Announces TD ETF Distributions
fin_news_nlp/yahoo_cad_tickers_news,https://ca.finance.yahoo.com/news/stocks-play-tecsys-inc-161600862.html,"Launched an innovative Digital Twin 3D Heat Map, the industry's first no-code, out-of-the-box 3D representation ...",CAD,TCS.TO, - Stocks in play: Tecsys Inc
fin_news_nlp/yahoo_cad_tickers_news,https://ca.finance.yahoo.com/news/tecsys-democratizes-digital-twins-warehouse-145500439.html,"PROMAT -- Tecsys Inc. (TSX: TCS), an industry-leading supply chain management software company, today launched an innovative Digital Twin 3D Heat Map, the industry's first no-code, out-of-the-box 3D representation of the warehouse. This highly customizable analytics solution allows end users to visualize and optimize key warehouse operations. Unlike other warehouse digital twin solutions in the market, Tecsys' Digital Twin 3D Heat Map does not require custom code or lengthy services engagements;",CAD,TCS.TO,CNW Group - Tecsys Democratizes Digital Twins in the Warehouse with Click-of-a-Button Functionality
fin_news_nlp/yahoo_cad_tickers_news,https://ca.finance.yahoo.com/news/eagle-plains-options-hanson-north-170000291.html,"Eagle Plains Resources Ltd. (TSX-V:EPL) (""EPL"" or ""Eagle Plains"") and Brunswick Exploration Inc. (""Brunswick"") have executed a formal option agreement whereby Brunswick has the exclusive right to acquire a 100-per-cent interest in the Hanson North lithium project located in Saskatchewan for total consideration of $70,000 in cash, shares or combination of both, and exploration expenditures of $100,000 over a two-year period.",CAD,EPL.V,ACCESSWIRE - Eagle Plains Options Hanson North Lithium Project to Brunswick Exploration
fin_news_nlp/yahoo_cad_tickers_news,https://ca.finance.yahoo.com/news/sitka-gold-north-american-exploration-170000189.html,"Vancouver, British Columbia--(Newsfile Corp. - March 20, 2023) - Sitka Gold Corp. (CSE: SIG) (OTCQB: SITKF) (FSE: 1RF) - a Canadian mineral exploration company, has projects in the Yukon, Nevada, Arizona and Nunavut focused on discovering gold, silver, and copper deposits. Sitka has discovered a gold deposit in the Yukon which has an initial resource estimate of 1.34 million ounces of gold, while the Alpha Gold Project in Nevada's Cortez Gold Trend has intersected ...",CAD,SIG.CN, - Sitka Gold: North American Exploration Projects
fin_news_nlp/yahoo_cad_tickers_news,https://ca.finance.yahoo.com/news/aecon-group-inc-tse-share-171830817.html,"Aecon Group Inc. ( TSE:ARE ), might not be a large cap stock, but it led the TSX gainers with a relatively large price...",CAD,ARE.TO,Simply Wall St. - What Is Aecon Group Inc.'s (TSE:ARE) Share Price Doing?
fin_news_nlp/yahoo_cad_tickers_news,https://ca.finance.yahoo.com/news/constellation-software-inc-tse-csu-175846254.html,Key Insights Constellation Software's significant retail investors ownership suggests that the key decisions are...,CAD,CSU.TO,"Simply Wall St. - Constellation Software Inc.'s (TSE:CSU) top owners are retail investors with 53% stake, while 40% is held by institutions"
fin_news_nlp/yahoo_cad_tickers_news,https://ca.finance.yahoo.com/news/3-stocks-add-tfsa-asap-160000665.html,"With plenty of deals to be found on the TSX, now would be a wise time for long-term investors to be funding their TFSAs with top Canadian stocks. The post 3 Stocks to Add to Your TFSA ASAP appeared first on The Motley Fool Canada.",CAD,NPI.TO,The Motley Fool - 3 Stocks to Add to Your TFSA ASAP
fin_news_nlp/yahoo_cad_tickers_news,https://ca.finance.yahoo.com/news/3-stocks-add-tfsa-week-150000580.html,TFSA investors can consider buying shares of companies such as Etsy and Shawcor right now to benefit from outsized gains over time. The post 3 Stocks to Add to Your TFSA This Week appeared first on The Motley Fool Canada.,CAD,SCL.TO,The Motley Fool - 3 Stocks to Add to Your TFSA This Week
fin_news_nlp/yahoo_cad_tickers_news,https://ca.finance.yahoo.com/news/3-hidden-stocks-could-fortune-163000831.html,Canadians navigating this turbulent market may want to target under-the-radar stocks like TMX Group Ltd. (TSX:X) and others. The post 3 Hidden Stocks That Could Make You a Fortune appeared first on The Motley Fool Canada.,CAD,X.TO,The Motley Fool - 3 Hidden Stocks That Could Make You a Fortune
fin_news_nlp/yahoo_cad_tickers_news,https://ca.finance.yahoo.com/news/u-bank-crisis-unlikely-spill-173150310.html,"TORONTO (Reuters) -Canada's top six lenders have ample liquidity and manageable credit risks which will help them to emerge largely unscathed from the crisis of confidence that has rocked the global banks over the last two weeks, analysts said on Monday.  The collapse of two the U.S. regional banks- the Silicon Valley Bank and Signature Bank this month --and the Swiss government-brokered deal for UBS to buy Credit Suisse has raised concerns about the health of global banking sector.  ""The U.S. contagion is unlikely to spill over to Canadian banks as the issues in U.S. are unique and specific to certain business models or lending activities,"" said James Shanahan, banking analyst with Edward Jones to Reuters.",CAD,TD.TO,"Reuters - U.S. bank crisis 'unlikely' to spill over to Canada, analysts say"
fin_news_nlp/yahoo_cad_tickers_news,https://ca.finance.yahoo.com/news/u-bank-crisis-unlikely-spill-172527391.html,"Canada's top six lenders have ample liquidity and manageable credit risks which will help them to emerge largely unscathed from the crisis of confidence that has rocked the global banks over the last two weeks, analysts said on Monday.  The collapse of two the U.S. regional banks- the Silicon Valley Bank and Signature Bank this month --and the Swiss government-brokered deal for UBS to buy Credit Suisse has raised concerns about the health of global banking sector.  ""The U.S. contagion is unlikely to spill over to Canadian banks as the issues in U.S. are unique and specific to certain business models or lending activities,"" said James Shanahan, banking analyst with Edward Jones to Reuters.",CAD,TD.TO," - U.S. bank crisis 'unlikely' to spill over to Canada, analyst says"
fin_news_nlp/yahoo_cad_tickers_news,https://ca.finance.yahoo.com/news/aftermath-silver-appoints-jeff-sundar-180000490.html,"Vancouver, British Columbia--(Newsfile Corp. - March 20, 2023) - Aftermath Silver Ltd. (TSXV: AAG) (OTCQX: AAGFF) (the ""Company"" or ""Aftermath Silver"") is pleased to announce that Jeff Sundar has been appointed as an Investor Relations Consultant of the Company, effective immediately.Mr. Sundar has over twenty years of experience in the capital markets and mineral exploration sector and is knowledgeable in corporate development, marketing, and financing.Mr. Sundar was a Director of Northern Empi",CAD,AAG.V,"Newsfile - Aftermath Silver Appoints Jeff Sundar as Investor Relations Consultant, Grants Stock Options"
fin_news_nlp/yahoo_cad_tickers_news,https://ca.finance.yahoo.com/news/power-play-market-herald-releases-181000608.html,"The Power Play by The Market Herald has announced the release of new interviews with Global Battery Metals, Silver Bullet Mines, RevoluGROUP, Sun Summit Minerals and Rover Metals discussing their latest news.",CAD,GBML.V,"ACCESSWIRE - The Power Play by The Market Herald Releases New Interviews with Global Battery Metals, Silver Bullet Mines, RevoluGROUP, Sun Summit Minerals and Rover Metals Discussing Their Latest News"
fin_news_nlp/yahoo_cad_tickers_news,https://ca.finance.yahoo.com/news/omineca-mining-metals-upsizes-financing-184403036.html,Omineca Mining and Metals president and CEO Tom MacNeill joined Proactive's Steve Darling to share news the company has seen strong demand for an upsized financing which is expected to close soon.,CAD,OMM.V, - Omineca Mining and Metals upsizes financing as company looks to move Wingdam gold project forward
fin_news_nlp/yahoo_cad_tickers_news,https://ca.finance.yahoo.com/news/silver-bullet-mines-provides-positive-181033681.html,Silver Bullet Mines vice president of capital markets Peter Clausi joined Steve Darling from Proactive with an update on processing that is ongoing at its Buckeye Mine pilot plant.,CAD,SBMI.V,News Direct - Silver Bullet Mines provides positive update on processing at Buckeye Mine pilot plant
fin_news_nlp/yahoo_cad_tickers_news,https://ca.finance.yahoo.com/news/stuhini-exploration-ltd-closes-upsized-183700966.html,"Stuhini Exploration Ltd. (the ""Company"" or ""Stuhini"") (TSXV: STU) (OTCPK: STXPF) is pleased to announce that it has closed its non-brokered private placement (the ""Private Placement"") previously announced on February 23, 2023 and upsized on March 2, 2023 and March 6, 2023 for gross proceeds to the Company of $2,400,000. Mr. Eric Sprott, the Company's strategic investor, subscribed for 2,500,000 units of the Company for gross proceeds of $1,000,000.",CAD,STU.V,CNW Group - Stuhini Exploration Ltd. Closes Upsized Private Placement
fin_news_nlp/yahoo_cad_tickers_news,https://ca.finance.yahoo.com/news/starrex-international-announces-acquisition-american-174500789.html,"Starrex International, Ltd (""Starrex"" or the ""Company"") (CSE:STX)(OTCQB:STXMF) is pleased to announce that pursuant to a number of agreements dated March 17, 2023 (the ""Purchase Agreements"") it acquired several arm's length U.S. entities which operate a real estate title business in Minnesota and Wisconsin (collectively, the ""Title Business"").",CAD,STX.CN,ACCESSWIRE - Starrex International Announces Acquisition of All American Title Group of Companies
fin_news_nlp/yahoo_cad_tickers_news,https://ca.finance.yahoo.com/news/algonquin-power-utilities-buy-fourth-180000292.html,"Given its improving financials, healthy outlook, and attractive valuation, I am bullish on Algonquin Power & Utilities. The post Is Algonquin Power & Utilities a Buy After Its Fourth-Quarter Earnings? appeared first on The Motley Fool Canada.",CAD,AQN.TO,The Motley Fool - Is Algonquin Power & Utilities a Buy After Its Fourth-Quarter Earnings?
fin_news_nlp/yahoo_cad_tickers_news,https://ca.finance.yahoo.com/news/2-canadian-bank-stocks-watch-180000796.html,Scotiabank (TSX:BNS) and Royal Bank of Canada (TSX:RY) are two quality bank stocks that are getting too cheap amid banking sector fears. The post 2 Canadian Bank Stocks to Watch After Last Week’s Selloff appeared first on The Motley Fool Canada.,CAD,BNS.TO,The Motley Fool - 2 Canadian Bank Stocks to Watch After Last Week’s Selloff
fin_news_nlp/yahoo_cad_tickers_news,https://ca.finance.yahoo.com/news/passive-income-3-bank-stocks-173000562.html,Bank stocks are still the top options for Canadians seeking repeated passive income and building wealth through a TFSA. The post Passive Income: 3 Bank Stocks for TFSA Wealth appeared first on The Motley Fool Canada.,CAD,CM.TO,The Motley Fool - Passive Income: 3 Bank Stocks for TFSA Wealth
fin_news_nlp/yahoo_cad_tickers_news,https://ca.finance.yahoo.com/news/3-reasons-why-growth-investors-164504393.html,"Descartes Systems (DSGX) possesses solid growth attributes, which could help it handily outperform the market.",CAD,DSG.TO,Zacks - 3 Reasons Why Growth Investors Shouldn't Overlook Descartes Systems (DSGX)
fin_news_nlp/yahoo_cad_tickers_news,https://ca.finance.yahoo.com/news/dividend-star-d-buy-over-173000802.html,"Enbridge stock had its time, but I would slowly push it aside and buy up this other dividend stock in bulk while you can. The post A Dividend All Star I’d Buy Over Enbridge Stock Any Day appeared first on The Motley Fool Canada.",CAD,ENB.TO,The Motley Fool - A Dividend All Star I’d Buy Over Enbridge Stock Any Day
