source,url,description,country,company,title
fin_news_nlp/yahoo_cad_tickers_news,https://ca.finance.yahoo.com/news/bravo-trenches-over-140m-continuous-103000032.html,"Bravo Mining Corp. (TSXV: BRVO) (OTCQX: BRVMF) (""Bravo"" or the ""Company"") announced that it has received assay results from five trenches and four previously unsampled large diameter (""ZW"") historical metallurgical drill holes, all located in the Southwest sector of its 100% owned Luanga palladium + platinum + rhodium + gold + nickel project (""Luanga"" or ""Luanga PGM+Au+Ni Project""), located in the Carajás Mineral Province, state of Pará, Brazil.",CAD,BRVO.V,CNW Group - Bravo Trenches Over 140m of Continuous Oxide PGM+Au at Luanga; Receives Positive Results from Assaying Metallurgical Drill Core
fin_news_nlp/yahoo_cad_tickers_news,https://ca.finance.yahoo.com/news/builders-capital-mortgage-corp-releases-225000111.html,"Increasing market activity creates full capital utilization and drives higher profits. Calgary, Alberta--(Newsfile Corp. - April 18, 2023) - Builders Capital Mortgage Corp. (TSXV: BCF) (""Builders Capital"" or ""the Company"") announced today the release of its annual report and financial results for the year ending December 31, 2022. Highlights include:Fourth quarter 2022 results were underpinned by strong utilization across our assets, reflecting ...",CAD,BCF.V,Newsfile - Builders Capital Mortgage Corp. Releases Annual Financial Statements; Reports Strong Results for 2022
fin_news_nlp/yahoo_cad_tickers_news,https://ca.finance.yahoo.com/news/bullion-gold-announces-sale-turgeon-122500079.html,"MONTREAL, April 14, 2023 (GLOBE NEWSWIRE) -- Bullion Gold Resources Corp. (TSX-V: BGD) (“Bullion Gold” or “the Company”) is pleased to announce that it has executed a purchase and sale agreement (the “Agreement”) dated as of April 12, 2023, with Xcite Resources Inc. (“Xcite”) pursuant to which Xcite will acquire a 100% interest in the Turgeon Lake Property (the “Property”). The Property is comprised of 39 mining cells covering approximately 2,067 hectares in the Province of Quebec. Xcite previou",CAD,BGD.V,GlobeNewswire - Bullion Gold Announces the Sale of Turgeon Lake Property to Xcite Resources Inc.
fin_news_nlp/yahoo_cad_tickers_news,https://ca.finance.yahoo.com/news/c-com-satellite-systems-cve-122703171.html,C-Com Satellite Systems Inc. ( CVE:CMI ) will pay a dividend of CA$0.0125 on the 16th of May. This means the annual...,CAD,CMI.V,Simply Wall St. - C-Com Satellite Systems (CVE:CMI) Is Paying Out A Dividend Of CA$0.0125
fin_news_nlp/yahoo_cad_tickers_news,https://ca.finance.yahoo.com/news/cabral-commences-pre-feasibility-study-113000113.html,"Vancouver, British Columbia--(Newsfile Corp. - April 5, 2023) - Cabral Gold Inc. (TSXV: CBR) (OTC PINK: CBGZF) (""Cabral"" or the ""Company"") is pleased to announce that its Brazilian subsidiary has engaged Ausenco do Brasil Engenharia Ltda. (""Ausenco"") to commence work on a Pre-Feasibility study on trial mining and heap leach processing of the near-surface gold-in-oxide saprolitic material at the Cuiú Cuiú project in northern Brazil.Following the completion of several months of internal scoping wo",CAD,CBR.V,"Newsfile - Cabral Commences Pre-Feasibility Study on Trial Mining of Near- Surface Gold-in-Oxide Material at Cuiú Cuiú Gold Project, Brazil"
fin_news_nlp/yahoo_cad_tickers_news,https://ca.finance.yahoo.com/news/california-nanotechnologies-fritsch-partner-advanced-120000776.html,"Los Angeles, California--(Newsfile Corp. - April 25, 2023) - California Nanotechnologies Corp. (TSXV: CNO) (OTC Pink: CANOF) (""Cal Nano"" or the ""Company"") would like to announce it has signed a Memorandum of Understanding (""MOU"") with Fritsch Milling & Sizing, Inc (""Fritsch"") to collaborate on new business development opportunities. The agreement intends to complement and support each party's technologies and capabilities to bring wide range solutions for client industries and access markets tha",CAD,CNO.V, - California Nanotechnologies and Fritsch Partner to Provide Advanced Material Processing Services
fin_news_nlp/yahoo_cad_tickers_news,https://ca.finance.yahoo.com/news/canada-nickel-expands-high-grade-110000544.html,"Canada Nickel Company Inc. (""Canada Nickel"" or the ""Company"") (TSXV: CNC) (OTCQX: CNIKF) today announced assay results that indicate an expansion of high grade, near-surface nickel mineralization at the Texmont property located 36 kilometres south of Timmins, Ontario.",CAD,CNC.V,"CNW Group - Canada Nickel Expands High Grade, Near Surface Mineralization at Texmont"
fin_news_nlp/yahoo_cad_tickers_news,https://ca.finance.yahoo.com/news/canada-silver-cobalt-begins-stripping-130000388.html,"Coquitlam, British Columbia--(Newsfile Corp. - May 8, 2023) - Canada Silver Cobalt Works Inc. (TSXV: CCW) (OTCQB: CCWOF) (FSE: 4T9B) (the ""Company"" or ""Canada Silver Cobalt"") announces that the Company has begun work at Castle East with a new, first stage stripping plan to follow up on shallow gold and silver mineralization.""Stripping and trenching have historically been very important in the Cobalt Mining camp. We are getting back to the basics to see what ...",CAD,CCW.V,Newsfile - Canada Silver Cobalt Begins Stripping at Castle East to Follow up on Silver and Gold Intercepts
fin_news_nlp/yahoo_cad_tickers_news,https://ca.finance.yahoo.com/news/canadian-critical-minerals-announces-conclusion-172200329.html,"Calgary, Alberta--(Newsfile Corp. - May 9, 2023) - Canadian Critical Minerals Inc. (TSXV: CCMI) (OTCQB: RIINF) (""CCMI"" or the ""Company"") is pleased to announce the successful conclusion of the Preliminary Application Phase of the Joint Mines Act and Environmental Management Act Permit Amendments for the restart the Bull River Mine Project (""BRM"") near Cranbrook, BC. The Company has received written confirmation of the information that is required for our Final Permit Application to ...",CAD,CCMI.V,Newsfile - Canadian Critical Minerals Announces Conclusion of the Pre-Application Permitting Phase for the Restart of the Bull River Mine
fin_news_nlp/yahoo_cad_tickers_news,https://ca.finance.yahoo.com/news/canadian-spirit-resources-inc-announces-023300869.html,"CALGARY, Alberta, May 01, 2023 (GLOBE NEWSWIRE) -- Canadian Spirit Resources Inc. (""CSRI"" or the ""Corporation"") (TSXV:SPI) (OTCBB:CSPUF) announces the release of its financial results for the three and twelve months ended December 31, 2022 including the filing of its 2022 annual audited Financial Statements, Management Discussion and Analysis (“MD&A”), and Forms 51- 101F1, F2 and F3. This news release summarizes information contained in the audited Financial Statements and MD&A for the year ende",CAD,SPI.V,GlobeNewswire - Canadian Spirit Resources Inc. Announces Year End 2022 Financial Results
fin_news_nlp/yahoo_cad_tickers_news,https://ca.finance.yahoo.com/news/canex-makes-drill-discovery-westgold-113000962.html,"CANEX Metals Inc. (""CANEX"" or the ""Company"") is pleased to announce results from 5 reverse circulation drill holes from the maiden drill test of the WestGold Target at the Gold Range Project, Arizona.",CAD,CANX.V,ACCESSWIRE - Canex Makes New Drill Discovery at Westgold Intersecting 35 Metres of 0.7 g/t Gold Including 7.6 Metres of 2.5 g/t Gold
fin_news_nlp/yahoo_cad_tickers_news,https://ca.finance.yahoo.com/news/cantex-closes-first-tranche-private-013800285.html,"Cantex Mine Development Corp. (TSXV: CD) (the ""Company"") announces that, further to its news release of April 17, 2023 announcing a private placement (the ""Offering""), the Company has closed the first tranche of the Offering (""the Tranche"") and has received $1,268,500 by the issuance of 1,601,351 flow through units (the ""FT Units"") and 2,112,500 non flow-through units (the ""Units""). FT Units were issued at $0.37 per FT Unit and Units were issued at $0.32 per Unit; each FT Unit is comprised of a",CAD,CD.V,CNW Group - CANTEX CLOSES FIRST TRANCHE OF PRIVATE PLACEMENT
fin_news_nlp/yahoo_cad_tickers_news,https://ca.finance.yahoo.com/news/canxgold-mining-corp-updates-negotiations-130000896.html,"CanXGold Mining corp (TSXV:CXG)(OTC PINK:GDMRF)(FRANKFURT:3G8B), reports that (""Golden Dawn Mining Inc."" or the ""Company"") its senior secured creditor, RIVI Opportunity Fund LP (""RIVI"") has commenced a court action to enforce its debt claims against the Company (the ""RIVI Credit""), including seeking the appointment of a receiver or receiver-manager of all of the Company's assets, undertakings and properties (the ""Enforcement Action"").",CAD,CXG.V, - CanXGold Mining Corp Updates on Negotiations with Senior Secured Creditor
fin_news_nlp/yahoo_cad_tickers_news,https://ca.finance.yahoo.com/news/carbeeza-inc-announces-private-placement-211600476.html,"CALGARY, Alberta, April 28, 2023--Carbeeza Inc. (formerly HIT Technologies Inc.) (""Carbeeza"" or the ""Company"") (TSX.V:AUTO). The TSX Venture Exchange (the ""Exchange"") has approved an extension to close the non-brokered private placement (the ""Private Placement""), announced on March 20, 2023, of up to 12,500,000 units of the Company (""Units"") at a price of $0.20 per Unit for gross proceeds of up to $2,500,000 (the ""Offering""). The net proceeds of the Offering will be used by the Company to scale",CAD,AUTO.V,Business Wire - Carbeeza Inc. Announces Private Placement Extension
fin_news_nlp/yahoo_cad_tickers_news,https://ca.finance.yahoo.com/news/carebook-announces-fiscal-2022-results-120000523.html,"Carebook Technologies Inc. (""Carebook"" or the ""Company"") (TSXV: CRBK) (OTCPK: CRBKF) (XFRA: PMM1), a leading Canadian provider of innovative digital health solutions today announced its results for the year ended December 31, 2022.",CAD,CRBK.V,CNW Group - Carebook Announces Fiscal 2022 Results
fin_news_nlp/yahoo_cad_tickers_news,https://ca.finance.yahoo.com/news/cathedra-bitcoin-announces-fourth-quarter-110000552.html,"TORONTO, May 01, 2023--(Block Height: 787,600) – Cathedra Bitcoin Inc. (TSX-V: CBIT; OTCQX: CBTTF) (""Cathedra"" or the ""Company""), a Bitcoin company that develops and operates world-class bitcoin mining infrastructure, today announces its fourth quarter and full-year audited financial results for 2022:",CAD,CBIT.V, - Cathedra Bitcoin Announces Fourth Quarter and Full-Year 2022 Financial Results
fin_news_nlp/yahoo_cad_tickers_news,https://ca.finance.yahoo.com/news/cblt-provides-clarification-news-release-145200979.html,"Burlington, Ontario--(Newsfile Corp. - April 19, 2023) - CBLT Inc. (TSXV: CBLT) (""CBLT"") wishes to provide clarification to its news release of April 13, 2023 wherein CBLT announced the sale of 3,315,084 common shares of Ciscom Corporation (""Ciscom"").CBLT wishes to clarify that the news release of April 13, 2023 did not intend to imply additional risk with respect to Ciscom's receipt for its final prospectus from the Ontario Securities Commission (""OSC"").As a result of ...",CAD,CBLT.V, - CBLT Provides Clarification of News Release
fin_news_nlp/yahoo_cad_tickers_news,https://ca.finance.yahoo.com/news/ceapro-announces-positive-findings-demonstrating-120500008.html,"– Data presented at 2023 Annual Meeting of the Wound Healing Society showed statistically significant results characterizing the in vivo bioactivity of Ceapro’s oat-derived bioactive products on wound healing and tissue regeneration – Tissue treated with Avenanthramides (“AVE”) and oat beta glucan (“BG”) bioactives healed to become more normal skin as compared to untreated scar tissue EDMONTON, Alberta, May 03, 2023 (GLOBE NEWSWIRE) -- Ceapro Inc. (TSX-V: CZO; OTCQX: CRPOF) (“Ceapro” or the “Com",CAD,CZO.V,GlobeNewswire - Ceapro Announces Positive Findings Demonstrating Oat Derived Beta Glucan and Avenanthramides Promote Wound Healing and Tissue Regeneration
fin_news_nlp/yahoo_cad_tickers_news,https://ca.finance.yahoo.com/news/centaurus-energy-inc-announces-2022-030000055.html,"(All dollar figures are expressed in United States Dollars)Calgary, Alberta--(Newsfile Corp. - May 1, 2023) - Centaurus Energy Inc. (TSXV: CTA) (OTC Pink: CTARF) (""Centaurus"" or the ""Company"") is pleased to announce its financial and operating results for the twelve months ended December 31, 2022.Centaurus' CEO, David Tawil, commented: ""With the closing of the Gasener transaction, Centaurus Energy is focused on managing the future proceeds from the PAE ORRI, totaling US$16 million, which may ...",CAD,CTA.V,Newsfile - Centaurus Energy Inc. Announces 2022 Fourth Quarter Financial Results and Operational Update
fin_news_nlp/yahoo_cad_tickers_news,https://ca.finance.yahoo.com/news/centurion-provides-casa-berardi-gold-200000429.html,"Vancouver, British Columbia--(Newsfile Corp. - May 8, 2023) - Centurion Minerals Ltd. (TSXV: CTN) (""Centurion"", or the ""Company"") wishes to provide an update of the Casa Berardi West gold project, and financing as follows:Casa Berardi West Gold Project Acquisition: Proceeding with its original focus of acquiring and advancing gold exploration projects, the Company executed a previously announced Option Agreement to acquire a 100% interest in the Casa Berardi West Gold Project (the ""Project""). Th",CAD,CTN.V,Newsfile - Centurion Provides Casa Berardi Gold Project Review and Updates Private Placement Status
fin_news_nlp/yahoo_cad_tickers_news,https://ca.finance.yahoo.com/news/cerrado-gold-commences-heap-leach-100000139.html,"Cerrado Gold Inc. (TSXV:CERT)(OTCQX:CRDOF) (""Cerrado"" or the ""Company"")is pleased to announce that it has commenced loading ore onto the heap leaching pad at its inaugural heap leach project in Las Calandrias, Santa Cruz Province, Argentina.",CAD,CERT.V,"ACCESSWIRE - Cerrado Gold Commences Heap Leach Operations at Its Las Calandrias Project in Santa Cruz, Argentina"
fin_news_nlp/yahoo_cad_tickers_news,https://ca.finance.yahoo.com/news/cf-energy-announces-financial-results-210000152.html,"TORONTO, April 28, 2023 (GLOBE NEWSWIRE) -- CF Energy Corp., (TSX-V: CFY) (“CF Energy” or the “Company”, together with its subsidiaries, the “Group”), an energy provider in the People’s Republic of China (the ”PRC” or “China”), announces that the Company has filed its audited consolidated financial results for the year ended December 31, 2022. Results for the year ended December 31, 2022 In millions20222021Change%20222021Change(except for % figures)RMBRMBRMB CADCADCADContinuing Operations Revenu",CAD,CFY.V,"GlobeNewswire - CF Energy Announces Financial Results For The Year ended December 31, 2022"
fin_news_nlp/yahoo_cad_tickers_news,https://ca.finance.yahoo.com/news/champion-gaming-granted-management-cease-220000722.html,"Toronto, Ontario--(Newsfile Corp. - May 2, 2023) - Champion Gaming Group Inc. (TSXV: WAGR) (""Champion Gaming"" or the ""Company"") announces that, further to its press release dated April 17, 2023, the Company has been granted a management cease trade order (the ""MCTO"") by the Ontario Securities Commission (the ""OSC""), pursuant to the Company's application made under National Policy 12-203 - Management Cease Trade Orders (""NP 12-203""). The MCTO as issued is in connection ...",CAD,WAGR.V,Newsfile - Champion Gaming Granted Management Cease Trade Order
fin_news_nlp/yahoo_cad_tickers_news,https://ca.finance.yahoo.com/news/char-technologies-signs-mou-first-123000203.html,"TORONTO, May 01, 2023 (GLOBE NEWSWIRE) -- CHAR Technologies Ltd. (“CHAR” or the “Company”) (TSXV:YES) is pleased to announce the April 27th, 2023, signing of a memorandum of understanding (“MOU”) with the First Nations co-operative Lake Nipigon Forest Management Inc. (“LNFMI”) to collaboratively develop, build, own and operate a wood waste and residues to renewable natural gas (RNG) and biocarbon facility in the Lake Nipigon Region of Northern Ontario. The MOU is a productive step forward for th",CAD,YES.V,GlobeNewswire - CHAR Technologies Signs MOU with First Nations Co-op LNFMI to Build Lake Nipigon RNG and Biocarbon Facility
fin_news_nlp/yahoo_cad_tickers_news,https://ca.finance.yahoo.com/news/cielo-announces-binding-letter-intent-110000770.html,"And Provides Update on Timing of Debt FinancingCALGARY, Alberta, May 01, 2023 (GLOBE NEWSWIRE) -- Cielo Waste Solutions Corp. (TSXV:CMC; OTCQB:CWSFF) (“Cielo” or the “Company”), a waste-to-fuel environmental technology company, is pleased to announce that it has entered into a binding letter of intent (the “LOI”) with Renewable U Energy Inc., on its own behalf and on behalf of its affiliates (jointly, severally and collectively “Renewable U”), regarding the memorandums of understanding (each an",CAD,CMC.V,"GlobeNewswire - Cielo Announces Binding Letter of Intent Regarding Memorandums of Understanding and Purchase of Land in Dunmore, Alberta for First Commercial Facility"
fin_news_nlp/yahoo_cad_tickers_news,https://ca.finance.yahoo.com/news/clear-blue-technologies-announces-fiscal-210000293.html,"Strong Q1 Order Intake Positions Company For 2023 Revenue Growth ResumptionTORONTO, April 26, 2023 (GLOBE NEWSWIRE) -- Clear Blue Technologies International Inc. (TSXV: CBLU) (FRANKFURT: OYA) (OTCQB: CBUTF), announces its financial results for the full year (“F2022”) and quarter ended December 31, 2022 (“Q4 2022”). A complete set of Financial Statements and Management’s Discussion & Analysis (“MD&A”) has been filed at www.sedar.com. All dollar amounts are denominated in Canadian dollars. F2022 F",CAD,CBLU.V,GlobeNewswire - Clear Blue Technologies Announces Fiscal 2022 Financial Results
fin_news_nlp/yahoo_cad_tickers_news,https://ca.finance.yahoo.com/news/cleghorn-minerals-announces-110-000-113700685.html,"Val-d'Or, Québec--(Newsfile Corp. - May 2, 2023) - Cleghorn Minerals Ltd. (TSXV: CZZ) (""Cleghorn"" or the ""Company"") announces that it will conduct a non-brokered private placement offering pursuant to which it will issue up to 2,095,239 Units at a per Unit price of $0.0525 for gross proceeds of $110,000.05. Each Unit will consist of one common share in the capital of the Company and one non-transferable share purchase warrant, each warrant entitling the ...",CAD,CZZ.V,"Newsfile - Cleghorn Minerals Announces $110,000 Private Placement Financing"
fin_news_nlp/yahoo_cad_tickers_news,https://ca.finance.yahoo.com/news/cloud-dx-report-fiscal-2022-210200139.html,"Cloud DX(TSXV:CDX)(OTCQB:CDXFF), will post its FY2022 financial results after market open on Monday May 15, 2023.",CAD,CDX.V,"ACCESSWIRE - Cloud DX Will Report Fiscal 2022 Results and Hold Earnings Call on May 15, 2023"
fin_news_nlp/yahoo_cad_tickers_news,https://ca.finance.yahoo.com/news/cmc-metals-ltd-announces-positive-133000523.html,"CMC Metals Ltd. (TSXV:CMB)(Frankfurt:ZM5P)(CMCXF:OTCQB) (""CMC"" or the ""Company"")announces positive results from its drill program conducted at its flagship Silver Hart Project in the 2022 exploration season. Approximately 4,404 meters of diamond drilling was completed in 25 holes (see Figure 1 and Table 1).",CAD,CMB.V,"ACCESSWIRE - CMC Metals Ltd. Announces Positive Drill Results at Silver Hart, Yukon"
fin_news_nlp/yahoo_cad_tickers_news,https://ca.finance.yahoo.com/news/co2-gro-inc-proudly-releases-120000937.html,"CO2 GRO Inc. (TSXV:GROW)(OTCQB:BLONF)(FRA:4O21), a leader in innovative CO2 Delivery Solutions™ for the global protected agricultural sector, is pleased to announce the release of its 2023 Environmental, Social, and Governance (ESG) Report. This reflects its ongoing commitment to sustainability, transparency, and responsible corporate practices. The 2023 report is available on the company's website at https://co2gro.ca/wp-content/uploads/2023/04/2023-ESG-Report-CO2-GRO_April-12-2023-compressed.p",CAD,GROW.V,"ACCESSWIRE - CO2 GRO Inc. Proudly Releases its 2023 ESG Report Highlighting Significant Environmental, Social, and Governance Opportunity Updates"
fin_news_nlp/yahoo_cad_tickers_news,https://ca.finance.yahoo.com/news/coelacanth-announces-2022-end-reserves-100000179.html,"Calgary, Alberta--(Newsfile Corp. - April 20, 2023) - COELACANTH ENERGY INC. (TSXV: CEI) (""Coelacanth"" or the ""Company"") is pleased to announce its 2022 year-end reserves as independently evaluated by GLJ Ltd. (""GLJ"") effective December 31, 2022 (the ""GLJ Report""), in accordance with National Instrument 51-101 (""NI 51-101"") and the Canadian Oil and Gas Evaluation (""COGE"") Handbook. All dollar figures are Canadian dollars unless otherwise noted.IntroductionDuring 2022, Coelacanth was formed as a",CAD,CEI.V,Newsfile - Coelacanth Announces 2022 Year-End Reserves
fin_news_nlp/yahoo_cad_tickers_news,https://ca.finance.yahoo.com/news/colossus-resources-signs-letter-intent-203055311.html,"Vancouver, BC - TheNewswire - April 5, 2023 - Colossus Resources Corp. (“Colossus” or the “Company”) (TSX-V:CLUS) is pleased to announce it has entered into a Letter of Intent (the “LOI”) dated Apr...",CAD,CLUS.V,News Direct - Colossus Resources Signs Letter of Intent with Austral Gold Limited to Acquire the Calvario and Mirador Copper Porphyry Projects in Chile
fin_news_nlp/yahoo_cad_tickers_news,https://ca.finance.yahoo.com/news/teako-minerals-launches-alliance-113000596.html,"Joining forces with other exploration, technology and finance companies in a collaborative effort to increase the chances of success Vancouver, British Columbia--(Newsfile Corp. - May 1, 2023) - TEAKO MINERALS CORP. (CSE: TMIN) (the ""Company"" or ""Teako""), is pleased to announce the creation of The Service Alliance. Valence Mining Services (""Valence""), established by Teako Minerals Corp. (See April 25, 2023 news release), will play a pivotal role in hosting The Service Alliance. The Service Allia",CAD,CMD.V,Newsfile - Teako Minerals Launches the Service Alliance
fin_news_nlp/yahoo_cad_tickers_news,https://ca.finance.yahoo.com/news/composite-alliance-group-reports-full-121448663.html,Composite Alliance Group ( CVE:CAG ) Full Year 2022 Results Key Financial Results Revenue: CA$6.87m (up 17% from FY...,CAD,CAG.V,Simply Wall St. - Composite Alliance Group Reports Full Year 2022 Earnings
fin_news_nlp/yahoo_cad_tickers_news,https://ca.finance.yahoo.com/news/consolidated-uranium-graduates-otcqx-best-110600580.html,"TORONTO, April 24, 2023 (GLOBE NEWSWIRE) -- Consolidated Uranium Inc. (“CUR”, the “Company”, “Consolidated Uranium”) (TSXV: CUR) (OTCQX: CURUF) is pleased to announce that its common shares are now trading on the OTCQX® Best Market (the “OTCQX”) under the symbol “CURUF”, having graduated from the OTCQB® Venture Market. The OTCQX is the highest market tier of OTC Markets on which more than 10,000 U.S. and international securities trade. Trading on OTCQX enhances visibility and accessibility to U.",CAD,CUR.V,GlobeNewswire - Consolidated Uranium Graduates to OTCQX Best Market
fin_news_nlp/yahoo_cad_tickers_news,https://ca.finance.yahoo.com/news/copaur-announces-closing-non-brokered-180600758.html,"Vancouver, British Columbia--(Newsfile Corp. - April 26, 2023) - CopAur Minerals Inc. (TSXV: CPAU) (the ""Company"") The TSX Venture Exchange requires clarification to the news release sent April 25, 2023. The final tranche did not raise gross proceeds of $2,610,500, the entire placement raised this amount.Jeremy Yaseniuk, CEO, of the Company noted: ""The financing was initially for $2,000,000 as stated in the news release dated March 22, 2023, and we substantially over subscribed the offering by o",CAD,CPAU.V," - CopAur Announces Closing of Non-Brokered Private Placement of $2,610,500"
fin_news_nlp/yahoo_cad_tickers_news,https://ca.finance.yahoo.com/news/copper-lake-resources-provides-exploration-120000607.html,"Map 1 Location of 2023 drill holes in relation to the conductive centre and deep IP anomaly Map 2 Preliminary results of the large-loop electromagnetic survey (B-field channel 10) TORONTO, April 19, 2023 (GLOBE NEWSWIRE) -- Copper Lake Resources Ltd. (TSX-V: CPL, Frankfurt: WOI, OTC: WTCZF) (“Copper Lake” or the “Company”) is pleased to provide the following update on its recently completed winter exploration program, involving diamond drilling as well as ground and bore-hole electromagnetic (EM",CAD,CPL.V,GlobeNewswire - Copper Lake Resources Provides Exploration Update on Marshall Lake Copper-Zinc-Silver VMS Property
fin_news_nlp/yahoo_cad_tickers_news,https://ca.finance.yahoo.com/news/copper-road-resources-significantly-expands-110000975.html,"Figure 1: Copper Road Project LONG SECTION FROM RICHARDS BRECCIA TO JOGRAN PORPHYRY LONG SECTION FROM RICHARDS BRECCIA TO JOGRAN PORPHYRY JR ZONE COPPER MMI LINES JR ZONE COPPER MMI LINES JR ZONE MOLYBDENUM MMI LINES JR ZONE MOLYBDENUM MMI LINES JR ZONE GRADIENT IP - 1997 CHARGEABILITY JR ZONE GRADIENT IP - 1997 CHARGEABILITY TORONTO, April 17, 2023 (GLOBE NEWSWIRE) -- Copper Road Resources Inc. (TSXV: CRD) (“Copper Road” or the “Company”) announces the validation and expansion of the JR Zone (“",CAD,CRD.V,GlobeNewswire - Copper Road Resources Significantly Expands the “JR Zone” of near-surface Cu-Mo Porphyry and Cu-Au Breccia Mineralization
fin_news_nlp/yahoo_cad_tickers_news,https://ca.finance.yahoo.com/news/rock-chip-sampling-returns-16-120000717.html,"Vancouver, British Columbia--(Newsfile Corp. - April 26, 2023) - CopperCorp Resources Inc. (TSXV: CPER) (OTCQB: CPCPF) (""CopperCorp"" or the ""Company"") is pleased to report that high-grade polymetallic assays have been returned from reconnaissance rock chip sampling at the Jasper Hills prospect. The prospect is one of multiple new exploration target areas recognized within the Company's AMC Project located in the 100% renewable energy state of Tasmania, Australia.HIGHLIGHTSRock chip sampling prog",CAD,CPER.V,"Newsfile - Rock Chip Sampling Returns up to 16.45% Cu, 10.1 g/t Au, 37.9% Zn+Pb, 612 g/t Ag, and 1.05% Sn at Jasper Hills Prospect"
