source,url,description,country,company,title
fin_news_nlp/yahoo_cad_tickers_news,https://ca.finance.yahoo.com/news/equitable-bank-releases-esg-performance-214200869.html,"Equitable Bank (Canada's Challenger Bank™) today released two comprehensive reports on the strategies and actions it is taking to reduce its carbon footprint, invest in Canadian society, advance its place as one of Canada's best places to work and leverage its industry-leading digital capabilities to give underbanked communities better service.",CAD,EQB.TO,CNW Group - Equitable Bank releases ESG Performance Report and Public Accountability Statement
fin_news_nlp/yahoo_cad_tickers_news,https://ca.finance.yahoo.com/news/ero-copper-files-technical-report-004100748.html,"VANCOUVER, British Columbia, May 12, 2023 (GLOBE NEWSWIRE) -- Ero Copper Corp. (TSX: ERO, NYSE: ERO) (""Ero"" or the “Company”) is pleased to announce the filing of its Technical Report for the Xavantina Operations related to the increase in mineral reserves and mineral resources and extension of mine life as previously announced on March 28, 2023. The Technical Report was prepared in accordance with the Canadian Securities Administrator’s National Instrument 43-101 – Standards of Disclosure for M",CAD,ERO.TO,GlobeNewswire - Ero Copper Files Technical Report for the Xavantina Operations
fin_news_nlp/yahoo_cad_tickers_news,https://ca.finance.yahoo.com/news/euro-sun-closes-previously-announced-210000372.html,"NOT FOR DISTRIBUTION TO U.S. NEWSWIRE SERVICES OR FOR DISSEMINATION IN THE UNITED STATES TORONTO, April 28, 2023 (GLOBE NEWSWIRE) -- Euro Sun Mining Inc., (TSX: ESM) (“Euro Sun” or the “Company”) is pleased to announce that it has closed its previously announced non-brokered private placement financing of units of the Company (the “Offering”). Pursuant to the closing of the Offering, the Company issued 19,750,000 units of the Company (each a “Unit” and collectively, the “Units”) at a price of C$",CAD,ESM.TO,GlobeNewswire - Euro Sun Closes Previously Announced Private Placement Financing
fin_news_nlp/yahoo_cad_tickers_news,https://ca.finance.yahoo.com/news/evolve-announces-april-2023-distributions-210000315.html,"Evolve Funds Group Inc. (""Evolve"") is pleased to announce the distribution amounts per unit (the ""Distributions"") for certain funds (the ""Evolve Funds""), for the period ending April 28, 2023, as indicated in the table below.",CAD,CARS.TO,CNW Group - Evolve Announces April 2023 Distributions for Certain Evolve Funds
fin_news_nlp/yahoo_cad_tickers_news,https://ca.finance.yahoo.com/news/evolve-announces-changes-risk-rating-210000595.html,"Evolve Funds Group Inc. (""Evolve"") announces the following changes to the risk rating of certain funds (the ""Evolve Funds""), as indicated in the table below.",CAD,DATA.TO,CNW Group - Evolve Announces Changes to Risk Rating for Certain Evolve Funds
fin_news_nlp/yahoo_cad_tickers_news,https://ca.finance.yahoo.com/news/excellon-announces-c-10-million-100000755.html,"Excellon Resources Inc. (TSX: EXN) (OTCQB: EXNRF) (FRA: E4X2) (""Excellon"" or the ""Company"") is pleased to announce a non-brokered private placement of up to 28,571,428 subscription receipts of the Company (the ""Subscription Receipts"") at a price of C$0.35 per Subscription Receipt (the ""Offering Price"") for aggregate gross proceeds to the Company of up to approximately C$10,000,000 (the ""Offering"").",CAD,EXN.TO,CNW Group - EXCELLON ANNOUNCES UP TO C$10 MILLION NON-BROKERED PRIVATE PLACEMENT OF SUBSCRIPTION RECEIPTS
fin_news_nlp/yahoo_cad_tickers_news,https://ca.finance.yahoo.com/news/excelsior-mining-announces-receipt-permit-113000537.html,"Phoenix, Arizona--(Newsfile Corp. - April 24, 2023) - Excelsior Mining Corp. (TSX: MIN) (FSE: 3XS) (OTCQB: EXMGF) (""Excelsior"" or the ""Company"") is pleased to announce that the United States Environmental Protection Agency has issued an amendment to the Class III Underground Injection Control (""UIC"") Area Permit, that will allow for well stimulation to occur at the Gunnison Copper Project, located in Cochise County, southeastern Arizona.Well stimulation has the potential to fundamentally change",CAD,MIN.TO,Newsfile - Excelsior Mining Announces Receipt of Permit Amendment for Well Stimulation at the Gunnison Copper Mine
fin_news_nlp/yahoo_cad_tickers_news,https://ca.finance.yahoo.com/news/tfsa-investors-invest-45-000-133000754.html,"TFSA investors can invest $45,000 to churn out over $3,500 in annual income with stocks like Extendicare Inc. (TSX:EXE) in 2023. The post TFSA Investors: Invest $45,000 for $3,504 in Annual Income appeared first on The Motley Fool Canada.",CAD,EXE.TO,"The Motley Fool - TFSA Investors: Invest $45,000 for $3,504 in Annual Income"
fin_news_nlp/yahoo_cad_tickers_news,https://ca.finance.yahoo.com/news/faraday-copper-reports-q1-2023-220000883.html,"Faraday Copper Corp. (""Faraday"" or the ""Company"") (TSX:FDY) announces its financial results for the three months ended March 31, 2023.",CAD,FDY.TO,ACCESSWIRE - Faraday Copper Reports Q1 2023 Financial Results
fin_news_nlp/yahoo_cad_tickers_news,https://ca.finance.yahoo.com/news/fidelity-investments-canada-ulc-announces-213000845.html,"Fidelity Investments Canada ULC today announced the April 2023 cash distributions for Fidelity's suite of High Dividend Factor ETFs, Fixed Income ETFs and Monthly High Income ETFs.",CAD,FCIG.TO,"CNW Group - Fidelity Investments Canada ULC Announces Cash Distributions for Fidelity High Dividend Factor ETFs, Fixed Income ETFs and Monthly High Income ETFs"
fin_news_nlp/yahoo_cad_tickers_news,https://ca.finance.yahoo.com/news/financial-15-split-corp-monthly-130000385.html,"TORONTO, April 19, 2023 (GLOBE NEWSWIRE) -- Financial 15 Split Corp. (""Financial 15"") declares its regular monthly distribution of $0.12570 for each Class A share ($1.51 annualized) and $0.06250 for each Preferred share ($0.750 annually). Distributions are payable May 10, 2023 to shareholders on record as at April 28, 2023. Since inception Class A shareholders have received a total of $24.05 per share and Preferred shareholders have received a total of $10.69 per share inclusive of this distribu",CAD,FTN.TO,GlobeNewswire - Financial 15 Split Corp. Monthly Dividend Declaration for Class A & Preferred Share
fin_news_nlp/yahoo_cad_tickers_news,https://ca.finance.yahoo.com/news/firan-technology-group-corporation-ftg-210000783.html,"TORONTO, April 28, 2023 (GLOBE NEWSWIRE) -- Firan Technology Group Corporation (TSX: FTG) today announced it has acquired 100% of Minnesota based Holaday Circuits and 100% of Massachusetts based IMI Inc. Further to the previous announcements made by FTG regarding these acquisitions, FTG has now attained the approval from the Committee on Foreign Investment in the United States (CFIUS) and all closing conditions have been met and both acquisitions are now closed. The IMI acquisition bolsters FTG",CAD,FTG.TO,GlobeNewswire - Firan Technology Group Corporation (FTG) Completes the Acquisitions of Holaday Circuits and IMI Inc.
fin_news_nlp/yahoo_cad_tickers_news,https://ca.finance.yahoo.com/news/mining-investment-event-north-quebec-120000628.html,"Sponsored by Maple Gold Mines & JDS Group of Companies Special Sponsor: Government of Québec Premier Sponsor: Laurentian Bank Securities Critical Metals Day Platinum Sponsor: National Bank Financial Markets Gold Sponsors: BMO, IBK Capital, O3 Mining, Troilus Gold, Maple Gold Mines, JDS Group of Companies Silver Sponsors: PearTree Financial, Stifel GMP, TMX Group, Invest Yukon, Mi3 Financial Copper Sponsors: Cassels, Crux Investor, CDPQ, Amex Exploration, North Equities, Amvest Capital INFOR ...",CAD,FF.TO,"Newsfile - THE Mining Investment Event of the North - Quebec City, June 2023 Announces THE Student Sponsorship"
fin_news_nlp/yahoo_cad_tickers_news,https://ca.finance.yahoo.com/news/firstservice-declares-quarterly-cash-dividend-151500602.html,"TORONTO, May 09, 2023 (GLOBE NEWSWIRE) -- FirstService Corporation (TSX: FSV; NASDAQ: FSV) (""FirstService"") announced today that its Board of Directors has declared a quarterly cash dividend on the outstanding Common Shares of US$0.225 per Common Share. The dividend is payable on July 7, 2023 to holders of Common Shares of record at the close of business on June 30, 2023. The dividend on Common Shares is an ""eligible dividend"" for Canadian income tax purposes. About FirstService CorporationFirst",CAD,FSV.TO,GlobeNewswire - FirstService Declares Quarterly Cash Dividend on Common Shares
fin_news_nlp/yahoo_cad_tickers_news,https://ca.finance.yahoo.com/news/fission-submits-application-license-construct-070000401.html,"FISSION URANIUM CORP. (""Fission"" or ""the Company"") is pleased to announce a new, major milestone with an application to the Canadian Nuclear Safety Commission (""CNSC"") for a license to construct a uranium mine and mill facility at the PLS high-grade uranium project in Canada's Athabasca Basin, Saskatchewan. Additionally, Fission has commenced the Front End Engineering Design (""FEED"") and continues to advance the PLS Project on schedule, including the completion of the geotechnical drilling, hydr",CAD,FCU.TO,"CNW Group - Fission Submits Application for License to Construct Uranium Mine and Mill Facility at the PLS Project, Saskatchewan"
fin_news_nlp/yahoo_cad_tickers_news,https://ca.finance.yahoo.com/news/forsys-provides-norasa-project-namibia-110000463.html,"Figure-1 Overview map Norasa 2023 drill campaign Table-1 Planned Drilling TORONTO, April 19, 2023 (GLOBE NEWSWIRE) -- Forsys Metals Corp. (TSX: FSY) (FSE: F2T) (NSX: FSY) (“Forsys” or the “Company”) is pleased to announce that it has commenced an updated drilling program at the Company’s Norasa Uranium Project sites (“Norasa Project” or “Norasa”) located in Namibia, Africa. The Norasa Project is wholly-owned by the Company’s subsidiary Valencia Uranium (Pty) Ltd. (“Valencia Uranium”) and compris",CAD,FSY.TO,"GlobeNewswire - Forsys Provides Update for the Norasa Project, Namibia, Commencement of Drill Program"
fin_news_nlp/yahoo_cad_tickers_news,https://ca.finance.yahoo.com/news/young-investors-why-own-dividend-134500450.html,Dividend stocks like Fortis can offer young investors all the benefits of a reliable and growing dividend income stream. The post Young Investors: Why You Should Own Dividend Stocks appeared first on The Motley Fool Canada.,CAD,FTS.TO,The Motley Fool - Young Investors: Why You Should Own Dividend Stocks
fin_news_nlp/yahoo_cad_tickers_news,https://ca.finance.yahoo.com/news/franco-nevada-reports-q1-2023-213000637.html,"Our diversified portfolio continues to generate strong cash flows and high margins. The first quarter was impacted by production disruptions at Cobre Panama and Antapaccay as well as lower energy prices. Stronger precious metal deliveries are anticipated in Q2 with both assets having returned to normal operations. ""Cobre Panama's CP 100 Expansion is on-track for year-end and we look forward to initial contributions from Magino, Séguéla and Salares Norte during the year"", commented Paul Brink, CE",CAD,FNV.TO,CNW Group - Franco-Nevada Reports Q1 2023 Results
fin_news_nlp/yahoo_cad_tickers_news,https://ca.finance.yahoo.com/news/george-westons-tse-wn-upcoming-120930718.html,"George Weston Limited's ( TSE:WN ) periodic dividend will be increasing on the 1st of July to CA$0.713, with investors...",CAD,WN.TO,Simply Wall St. - George Weston's (TSE:WN) Upcoming Dividend Will Be Larger Than Last Year's
fin_news_nlp/yahoo_cad_tickers_news,https://ca.finance.yahoo.com/news/givex-annual-survey-almost-canadians-104200914.html,"Givex Corp. (""Givex"") (TSX: GIVX) (OTCQX: GIVXF), a customer engagement platform, has today released results from the annual 2023 Consumer Survey, a national survey that measures Canadians' sentiments on dining motivations, loyalty programs, and comfort level with restaurant technology. The survey polled more than 1,500 Canadians in April 2023.",CAD,GIVX.TO,CNW Group - Givex Annual Survey: Almost all Canadians use Loyalty Rewards Programs
fin_news_nlp/yahoo_cad_tickers_news,https://ca.finance.yahoo.com/news/build-generational-wealth-sturdy-stocks-141500161.html,These Canadian stocks have the potential to deliver multi-fold returns and create significant wealth for their shareholders. The post Build Generational Wealth With These Sturdy Stocks appeared first on The Motley Fool Canada.,CAD,GSY.TO,The Motley Fool - Build Generational Wealth With These Sturdy Stocks
fin_news_nlp/yahoo_cad_tickers_news,https://ca.finance.yahoo.com/news/u-goldmining-announces-closing-initial-152500220.html,"U.S. GoldMining Inc. (NASDAQ: USGO) (""U.S. GoldMining"") and GoldMining Inc. (TSX: GOLD) (NYSE AMERICAN: GLDG) (""GoldMining"") are pleased to announce the closing of U.S. GoldMining's initial public offering (the ""IPO"") today of 2,000,000 units of U.S. GoldMining (the ""Units"") at an initial public offering price of US$10.00 per Unit.",CAD,GOLD.TO,CNW Group - U.S. GOLDMINING ANNOUNCES CLOSING OF INITIAL PUBLIC OFFERING
fin_news_nlp/yahoo_cad_tickers_news,https://ca.finance.yahoo.com/news/goodfellow-reports-results-first-quarter-201100389.html,"DELSON, Quebec, April 13, 2023 (GLOBE NEWSWIRE) -- Goodfellow Inc. (TSX: GDL) (the “Company” or “Goodfellow”) announced today its financial results for the first quarter ended February 28, 2023. The Company reported a net loss of $211 thousand or $0.02 per share compared to net earnings of $5.1 million or $0.60 per share a year ago. Consolidated sales for the three months ended February 28, 2023 were $105.9 million compared to $129.4 million last year. Consumer demand in the first quarter of 202",CAD,GDL.TO,"GlobeNewswire - Goodfellow Reports Its Results for the First Quarter Ended February 28, 2023"
fin_news_nlp/yahoo_cad_tickers_news,https://ca.finance.yahoo.com/news/goodfood-customers-now-enjoy-planet-110000096.html,"TORONTO and MONTREAL, April 17, 2023 (GLOBE NEWSWIRE) -- Goodfood Market Corp. (“Goodfood” or “the Company”) (TSX: FOOD) has made every day Earth Day through recent operational improvements that will have an important positive impact on our planet. The Company announced today that customers can now feel even better about their Goodfood meals knowing that delivery carbon emissions are permanently being offset going forward. In addition, the team has released next generation packaging to reduce pl",CAD,FOOD.TO,GlobeNewswire - Goodfood Customers Now Enjoy Planet-Friendly Deliveries
fin_news_nlp/yahoo_cad_tickers_news,https://ca.finance.yahoo.com/news/guardian-capital-group-limited-announces-213000520.html,"TORONTO, May 12, 2023 (GLOBE NEWSWIRE) -- Guardian Capital Group Limited (Guardian) (TSX:GCG) (TSX:GCG.A) announces the results of the director elections held at its annual meeting of shareholders earlier today. Each of the director nominees listed in Guardian’s management information circular dated March 31, 2023 was elected as a director of Guardian, to hold office until the next annual meeting of shareholders or until their successor is duly elected. The detailed results of the vote for the e",CAD,GCG.TO,GlobeNewswire - Guardian Capital Group Limited Announces Results of Annual Meeting of Shareholders
fin_news_nlp/yahoo_cad_tickers_news,https://ca.finance.yahoo.com/news/guru-organic-energy-becomes-official-113000833.html,"GURU Organic Energy GURU Organic Energy becomes the Official Energy Drink Partner of the Canadian Elite Basketball League (CEBL) and the CEBL Championship Weekend for the 2023 season Basketball is the #1 sport that GURU target audience watch, play or follow, the #1 participatory team sport in Canada, and the 2nd fastest growing sport in the world with over 2.4 billion fansCEBL viewership growing at a rapid pace, totalling 4.2 million viewers and media reach of 95 million+ in 2022, while recently",CAD,GURU.TO,GlobeNewswire - GURU Organic Energy Becomes the Official Energy Drink Partner of the Canadian Elite Basketball League
fin_news_nlp/yahoo_cad_tickers_news,https://ca.finance.yahoo.com/news/haivision-rejects-revised-non-binding-000000825.html,"Haivision Systems Inc. (""Haivision"" or the ""Company"") (TSX: HAI) announces that its board of directors (the ""Board"") has unanimously determined that the unsolicited, revised non-binding expression of interest received from Evertz Technologies Limited on April 14, 2023 is not in the best interests of Haivision and its stakeholders, and that Haivision should remain focused on executing its business plan and growth strategy.",CAD,HAI.TO,CNW Group - Haivision Rejects Revised Non-Binding Expression of Interest
fin_news_nlp/yahoo_cad_tickers_news,https://ca.finance.yahoo.com/news/media-advisory-h-roux-devtek-110000752.html,"Héroux-Devtek Inc. (TSX: HRX) (""Héroux-Devtek"" or the ""Corporation""), a leading international manufacturer of aerospace products and the world's third-largest landing gear manufacturer, will report its financial results for the fourth quarter and fiscal year ended March 31, 2023, before market opens on Thursday, May 18, 2023. The Corporation will hold a conference call to discuss these results on the same day, at 8:30 AM (Eastern Time).",CAD,HRX.TO,CNW Group - MEDIA ADVISORY - HÉROUX-DEVTEK WILL HOLD A CONFERENCE CALL TO DISCUSS ITS FISCAL 2023 ANNUAL AND FOURTH QUARTER RESULTS
fin_news_nlp/yahoo_cad_tickers_news,https://ca.finance.yahoo.com/news/ifabric-corp-announces-breakthrough-epa-103000518.html,"iFabric Corp. (""iFabric"" or the ""Company"") (TSX:IFA)(OTCQX:IFABF), today announced that its wholly-owned subsidiary company, Intelligent Fabric Technologies (North America) Inc. (""IFTNA""), has received a United States Environmental Agency (""EPA"") registration for PROTX2® as a ""Continually Self-Sanitizing Textile"".",CAD,IFA.TO,ACCESSWIRE - iFabric Corp Announces Breakthrough in EPA Public Health Claims Approval Process With Initial Registration of PROTX2 for Use in Non-Apparel Products
fin_news_nlp/yahoo_cad_tickers_news,https://ca.finance.yahoo.com/news/ig-wealth-management-mortgage-study-120000766.html,"According to a new study from IG Wealth Management (IG), most Canadians believe home ownership should be a central part of their financial plan. However, less than a third of Canadians with a mortgage say their financial advisor provided a great deal of advice on how their mortgage fits into their financial plan. This despite the fact that their mortgage loan is often among their largest debts and their mortgage payments are likely their largest monthly expense.",CAD,IGM.TO,CNW Group - IG Wealth Management Mortgage Study: Most Canadians Are Not Receiving the Financial Advice They Need When Getting a Mortgage
fin_news_nlp/yahoo_cad_tickers_news,https://ca.finance.yahoo.com/news/imv-receives-nasdaq-delisting-notice-203000189.html,"DARTMOUTH, Nova Scotia & CAMBRIDGE, Mass., May 08, 2023--IMV Inc. (the ""Company"" or ""IMV"") (Nasdaq: IMV; TSX: IMV), a clinical-stage biopharmaceutical company developing a portfolio of immune-educating therapies based on its novel DPX® platform to treat solid and hematologic cancers, today announced that it was notified by the Listing Qualifications Department of The Nasdaq Stock Market LLC (""Nasdaq"") that Nasdaq, in accordance with Nasdaq Listing Rules 5101, 5110(b) and IM-5101-1, has in exerci",CAD,IMV.TO,Business Wire - IMV Receives NASDAQ Delisting Notice
fin_news_nlp/yahoo_cad_tickers_news,https://ca.finance.yahoo.com/news/international-petroleum-corporation-announces-results-090000514.html,"TORONTO, May 08, 2023 (GLOBE NEWSWIRE) -- International Petroleum Corporation (IPC or the Corporation) (TSX, Nasdaq Stockholm: IPCO) is pleased to announce that IPC repurchased a total of 139,400 IPC common shares (ISIN: CA46016U1084) during the period of May 1 to 5, 2023 under IPC’s normal course issuer bid / share repurchase program (NCIB). IPC’s NCIB, announced on December 1, 2022, is being implemented in accordance with the Market Abuse Regulation (EU) No 596/2014 (MAR) and Commission Delega",CAD,IPCO.TO,GlobeNewswire - International Petroleum Corporation Announces Results of Normal Course Issuer Bid
fin_news_nlp/yahoo_cad_tickers_news,https://ca.finance.yahoo.com/news/invesco-canada-announces-cash-distributions-200000054.html,"Invesco Canada Ltd. (""Invesco"") today announced the April 2023 distributions for its exchange-traded funds (ETFs). Unitholders of record on April 27, 2023 will receive cash distributions payable on May 5, 2023.",CAD,IIAE.TO,CNW Group - Invesco Canada announces cash distributions for its ETFs
fin_news_nlp/yahoo_cad_tickers_news,https://ca.finance.yahoo.com/news/invesco-canada-announces-cash-distributions-200000744.html,"Invesco Canada Ltd. (""Invesco"") today announced the April 2023 distributions for its exchange-traded funds (ETFs). Unitholders of record on April 27, 2023 will receive cash distributions payable on May 5, 2023.",CAD,IUAE.TO,CNW Group - Invesco Canada announces cash distributions for its ETFs
fin_news_nlp/yahoo_cad_tickers_news,https://ca.finance.yahoo.com/news/invesque-announces-first-quarter-2023-220000793.html,"Invesque Inc. (the ""Company"") (TSX: IVQ.U) (TSX: IVQ) will release its first quarter 2023 results on Wednesday, May 10, 2023, after markets close. A conference call to discuss those results will be held on Thursday, May 11, 2023, at 10:00 a.m. Eastern Time.",CAD,IVQ.TO,CNW Group - Invesque Announces First Quarter 2023 Earnings Release Date and Conference Call
fin_news_nlp/yahoo_cad_tickers_news,https://ca.finance.yahoo.com/news/karora-announces-agreement-kalamazoo-resources-112800014.html,"Karora Resources Inc. (TSX: KRR) (""Karora"" or the ""Corporation"") is pleased to announce it has entered into an agreement with Kalamazoo Resources Limited (ASX: KZR) (""Kalamazoo"") to create a lithium and critical metals exploration company to be called Kali Metals Limited (""Kali""). Karora and Kalamazoo will vend their lithium exploration projects into Kali with a goal of creating a new, jointly owned but separately run lithium-focused ASX listed exploration company to be led by an experienced boa",CAD,KRR.TO,CNW Group - Karora Announces Agreement with Kalamazoo Resources to Unlock Lithium Exploration Value Through Creation of Kali Metals Limited
fin_news_nlp/yahoo_cad_tickers_news,https://ca.finance.yahoo.com/news/institutions-own-40-keyera-corp-141051115.html,Key Insights Keyera's significant individual investors ownership suggests that the key decisions are influenced by...,CAD,KEY.TO,Simply Wall St. - Institutions own 40% of Keyera Corp. (TSE:KEY) shares but individual investors control 60% of the company
fin_news_nlp/yahoo_cad_tickers_news,https://ca.finance.yahoo.com/news/laramide-resources-ltd-long-pocket-113000224.html,"Laramide Resources Ltd. (""Laramide"" or the ""Company"") (TSX: LAM; ASX: LAM; OTCQX: LMRXF) is pleased to announce results from the Long Pocket and Amphitheatre drill programs at its Westmoreland Uranium Project in Queensland, Australia (""Westmoreland"").",CAD,LAM.TO,"CNW Group - Laramide Resources Ltd. Long Pocket and Amphitheatre Drilling Results Outline Growth Potential of Westmoreland Uranium Project, Queensland, Australia; Plans Further Drilling in 2023"
fin_news_nlp/yahoo_cad_tickers_news,https://ca.finance.yahoo.com/news/know-analysts-just-made-substantial-120852431.html,"The analysts covering Largo Inc. ( TSE:LGO ) delivered a dose of negativity to shareholders today, by making a...",CAD,LGO.TO,Simply Wall St. - Need To Know: Analysts Just Made A Substantial Cut To Their Largo Inc. (TSE:LGO) Estimates
fin_news_nlp/yahoo_cad_tickers_news,https://ca.finance.yahoo.com/news/lightspeed-commerce-stock-hitting-52-193000964.html,"Lightspeed stock is down 38% this year, yet analysts believe shares could potentially double in the next year. So what should investors do? The post Lightspeed Commerce Stock Is Hitting 52-Week Lows: Bargain or Beware? appeared first on The Motley Fool Canada.",CAD,LSPD.TO,The Motley Fool - Lightspeed Commerce Stock Is Hitting 52-Week Lows: Bargain or Beware?
fin_news_nlp/yahoo_cad_tickers_news,https://ca.finance.yahoo.com/news/future-transportation-investing-canadian-ev-221500285.html,Canadian EV stocks like Lithium Americas (TSX:LAC) should be on your list. The post The Future of Transportation: Investing in Canadian EV Stocks appeared first on The Motley Fool Canada.,CAD,LAC.TO,The Motley Fool - The Future of Transportation: Investing in Canadian EV Stocks
fin_news_nlp/yahoo_cad_tickers_news,https://ca.finance.yahoo.com/news/loncor-gold-closes-private-placement-234000655.html,"Loncor Gold Inc. (""Loncor"" or the ""Company"") (TSX: LN) (OTCQX: LONCF) (FSE: LO51) is pleased to announce that, further to its May 4, 2023 and April 5, 2023 press releases, it has closed the balance of its Cdn$2,160,000 non-brokered private placement financing (the ""Financing""), such balance involving the issue of 3,465,000 units of the Company (the ""Units"") at a price of Cdn$0.40 per Unit for gross proceeds of Cdn$1,386,000. Each Unit consists of one common share of the Company and one common sh",CAD,LN.TO,CNW Group - Loncor Gold Closes Private Placement Financing
fin_news_nlp/yahoo_cad_tickers_news,https://ca.finance.yahoo.com/news/mackenzie-investments-announces-april-2023-130000449.html,"Mackenzie Investments today announced the April 2023 monthly cash distributions for its Exchange Traded Funds (""ETFs"") listed below that trade on the Toronto Stock Exchange (TSX) and Aequitas NEO Exchange. Unitholders of record on May 2, 2023 will receive cash distributions payable on May 9, 2023.",CAD,QUB.TO,CNW Group - Mackenzie Investments Announces April 2023 Distributions for its Exchange Traded Funds
