source,url,description,country,company,title
fin_news_nlp/yahoo_cad_tickers_news,https://ca.finance.yahoo.com/news/5n-plus-announces-election-directors-204000867.html,"5N Plus Inc. (TSX: VNP) (""5N Plus or the ""Company""), a leading global producer of specialty semiconductors and performance materials, announced that the nominees listed in its Management Information Circular dated April 4, 2023 were elected as directors of 5N Plus at its Annual General Meeting of Shareholders (the ""Meeting"") held earlier today. Subsequent to the Meeting, the directors re-appointed Mr. Luc Bertrand as Chairman of the Board of Directors of the Company.",CAD,VNP.TO,CNW Group - 5N Plus Announces Election of Directors
fin_news_nlp/yahoo_cad_tickers_news,https://ca.finance.yahoo.com/news/acadian-timber-corp-announces-election-160000648.html,"EDMUNDSTON, New Brunswick, May 05, 2023 (GLOBE NEWSWIRE) -- Acadian Timber Corp. (TSX:ADN) (the “Company”) announced that the nominees listed in the management proxy circular for the 2023 Annual Meeting of Shareholders were elected as directors of the Company. Detailed results of the votes for the election of directors held at the virtual Annual Meeting of Shareholders on May 4, 2023 are set out below. NomineeVotes For% ForVotes Withheld% WithheldMalcolm Cockwell10,958,02297.74% 252,8212.26%Heat",CAD,ADN.TO,GlobeNewswire - Acadian Timber Corp. Announces Election of Directors
fin_news_nlp/yahoo_cad_tickers_news,https://ca.finance.yahoo.com/news/adcore-reports-strong-first-quarter-211500999.html,"Adcore Inc. (the ""Company"" or ""Adcore"") (TSX:ADCO)(OTCQX:ADCOF)(FSE:ADQ)(TSX:ADCO-WT), a leading e-commerce advertising management and automation platform to leverage digital marketing in an effortless and accessible way (""Effortless Marketing""), today announced its financial results for the three months ended March 31, 2023.",CAD,ADCO.TO,ACCESSWIRE - Adcore Reports Strong First Quarter 2023 Financial Results
fin_news_nlp/yahoo_cad_tickers_news,https://ca.finance.yahoo.com/news/1-best-tsx-value-stocks-171500029.html,"Alimentation Couche-Tard (TSX:ATD) stock is still too cheap for its own good, even after its impressive rally to new heights. The post 1 of the Best TSX Value Stocks With Serious Room to Run appeared first on The Motley Fool Canada.",CAD,ATD.TO,The Motley Fool - 1 of the Best TSX Value Stocks With Serious Room to Run
fin_news_nlp/yahoo_cad_tickers_news,https://ca.finance.yahoo.com/news/aris-mining-reports-q1-2023-002100189.html,"Aris Mining Corporation (Aris Mining or the Company) (TSX: ARIS) (OTCQX: TPRFF) announces financial and operating results for the three months ended March 31, 2023 (Q1 2023). All amounts are in US dollars unless otherwise indicated.",CAD,ARIS.TO,CNW Group - ARIS MINING REPORTS Q1 2023 FINANCIAL AND OPERATING HIGHLIGHTS
fin_news_nlp/yahoo_cad_tickers_news,https://ca.finance.yahoo.com/news/battery-precious-metals-virtual-investor-123500132.html,"Company Executives Share Vision and Answer Questions at VirtualInvestorConferences.comNEW YORK, May 05, 2023 (GLOBE NEWSWIRE) -- Virtual Investor Conferences, the leading proprietary investor conference series, today announced the presentations from Battery & Precious Metals Virtual Investor Conference held May 2nd-4th are now available for online viewing. REGISTER NOW AT: https://bit.ly/3B1N9Fj The company presentations will be available 24/7 for 90 days. Investors, advisors, and analysts may d",CAD,ASCU.TO,GlobeNewswire - Battery & Precious Metals Virtual Investor Conference: Presentations Now Available for Online Viewing
fin_news_nlp/yahoo_cad_tickers_news,https://ca.finance.yahoo.com/news/atrium-mortgage-investment-corporation-announces-211500932.html,"Toronto, Ontario--(Newsfile Corp. - May 10, 2023) - Atrium Mortgage Investment Corporation (TSX: AI) (TSX: AI.DB.C) (TSX: AI.DB.D) (TSX: AI.DB.E) (TSX: AI.DB.F) (TSX: AI.DB.G) today released its financial results for the three month period ended March 31, 2023.HighlightsRecord quarterly basic and diluted earnings per share since going public of $0.33 and $0.31, respectively, compared to $0.25 basic and diluted per share in the comparative periodRecord quarterly net income of $14.2 million, up 34",CAD,AI.TO,Newsfile - Atrium Mortgage Investment Corporation Announces First Quarter Results with Record Quarterly Net Income
fin_news_nlp/yahoo_cad_tickers_news,https://ca.finance.yahoo.com/news/aura-announces-q1-2023-financial-220100082.html,"ROAD TOWN, British Virgin Islands, May 04, 2023 (GLOBE NEWSWIRE) -- Aura Minerals Inc. (TSX: ORA) (B3: AURA33) (OTCQX: ORAAF) (“Aura” or the “Company”) announces that it has filed its unaudited consolidated financial statements and management discussion and analysis (together, “Financial and Operational Results”) for the period ended March 31, 2023 (“Q1 2023”). The full version of the Financial and Operational Results can be viewed on the Company’s website at www.auraminerals.com or on SEDAR at",CAD,ORA.TO,GlobeNewswire - Aura Announces Q1 2023 Financial and Operational Results
fin_news_nlp/yahoo_cad_tickers_news,https://ca.finance.yahoo.com/news/avant-brands-strengthens-leadership-team-200500805.html,"Avant Brands Inc (TSX:AVNT)(OTCQX:AVTBF)(FRA:1BU0)(""Avant"" or the ""Company""), a leading producer of innovative and award-winning cannabis products, is pleased to announce that it has appointed industry finance veteran, Miguel Martinez, as Chief Financial Officer of Avant.",CAD,AVNT.TO,ACCESSWIRE - Avant Brands Strengthens its Leadership Team with the Appointment of Industry Executive Miguel Martinez as CFO and Sylvia Lee as Board Member
fin_news_nlp/yahoo_cad_tickers_news,https://ca.finance.yahoo.com/news/avino-reports-q1-2023-financial-214800715.html,"Avino Silver & Gold Mines Ltd. (TSX; ASM) (NYSE American: ASM) (FSE: GV6) (""Avino"" or ""the Company"") a growing silver producer in Mexico, released today its consolidated financial results for the Company's first quarter of 2023. The earnings should be read in conjunction with the Company's Financial Statements and Management's Discussion and Analysis (MD&A) for the corresponding period, which can be viewed on the Company's website at www.avino.com, or on SEDAR at www.sedar.com or on EDGAR at www",CAD,ASM.TO,CNW Group - Avino Reports Q1 2023 Financial Results; Realizes Numerous Operational Achievements
fin_news_nlp/yahoo_cad_tickers_news,https://ca.finance.yahoo.com/news/badger-announces-voting-results-2023-002000184.html,"CALGARY, Alberta, May 04, 2023 (GLOBE NEWSWIRE) -- Badger Infrastructure Solutions Ltd. (“Badger”, the “Company”, “we”, “our” or “us”) is pleased to announce that all of the motions put forward at its annual meeting of shareholders held on May 4, 2023 (the “Meeting”) were approved by its shareholders. A total of 29,181,797 common shares in the capital of the Company, representing approximately 84.65% of the issued and outstanding common shares, were represented in person or by proxy at the Meeti",CAD,BDGI.TO,GlobeNewswire - Badger Announces Voting Results of 2023 Annual Meeting of Shareholders
fin_news_nlp/yahoo_cad_tickers_news,https://ca.finance.yahoo.com/news/time-buy-tsx-trio-6-214500951.html,Investors looking to create a passive-income stream can consider investing in blue-chip TSX stocks such as TC Energy right now. The post It’s Time to Buy This TSX Trio of 6%-Yielding Stocks appeared first on The Motley Fool Canada.,CAD,BNS.TO,The Motley Fool - It’s Time to Buy This TSX Trio of 6%-Yielding Stocks
fin_news_nlp/yahoo_cad_tickers_news,https://ca.finance.yahoo.com/news/tsx-stocks-healthcare-industry-ones-201500856.html,"These healthcare stocks all offer different investment opportunities for investors, but which are the best buys on the TSX today? The post TSX Stocks in the Healthcare Industry: Which Ones Are Worth Your Money? appeared first on The Motley Fool Canada.",CAD,BHC.TO,The Motley Fool - TSX Stocks in the Healthcare Industry: Which Ones Are Worth Your Money?
fin_news_nlp/yahoo_cad_tickers_news,https://ca.finance.yahoo.com/news/baylin-announces-financial-results-first-210000174.html,"Baylin Technologies Inc. (TSX: BYL) (the ""Company"" or ""Baylin""), a diversified global wireless technology company focused on the research, design, development, manufacture, and sale of passive and active radio frequency products, satellite communications products, and supporting services, today announced its financial results for the three months ended March 31, 2023. All amounts are stated in Canadian dollars unless otherwise indicated.",CAD,BYL.TO,CNW Group - Baylin Announces Financial Results for the First Quarter of 2023 and its Sixth Consecutive Quarter of Positive Adjusted EBITDA
fin_news_nlp/yahoo_cad_tickers_news,https://ca.finance.yahoo.com/news/baytex-files-q1-2023-pro-021700020.html,"Calgary, Alberta--(Newsfile Corp. - May 10, 2023) - Baytex Energy Corp. (TSX: BTE) (NYSE: BTE) (""Baytex"") announces the filing of unaudited pro forma consolidated financial information of Baytex and Ranger Oil Corporation (""Ranger"") as at and for the three-month period ended March 31, 2023 (""Q1 Pro Forma Financial Information""). The Q1 Pro Forma Financial Information was included in the most recent draft of Baytex's Registration Statement on Form F-4 filed May 10, 2023 with ...",CAD,BTE.TO,Newsfile - Baytex Files Q1 2023 Pro Forma Financial Information in Connection with the Ranger Acquisition
fin_news_nlp/yahoo_cad_tickers_news,https://ca.finance.yahoo.com/news/maximize-retirement-income-top-dividend-231500572.html,Canada's top dividend stocks like Fortis (TSX:FTS) offer attractive returns. The post Maximize Your Retirement Income With These Top Dividend Stocks in Canada appeared first on The Motley Fool Canada.,CAD,BCE.TO,The Motley Fool - Maximize Your Retirement Income With These Top Dividend Stocks in Canada
fin_news_nlp/yahoo_cad_tickers_news,https://ca.finance.yahoo.com/news/more-tfsa-invest-popular-canadian-203000463.html,High-yield stocks like Enbridge and high-growth potential stocks like Blackberry are ideal candidates for your TFSA. The post Get More Out of Your TFSA: Invest in These Popular Canadian Companies appeared first on The Motley Fool Canada.,CAD,BB.TO,The Motley Fool - Get More Out of Your TFSA: Invest in These Popular Canadian Companies
fin_news_nlp/yahoo_cad_tickers_news,https://ca.finance.yahoo.com/news/most-actively-traded-companies-toronto-205000163.html,"TORONTO — Some of the most active companies traded Wednesday on the Toronto Stock Exchange: Toronto Stock Exchange (20,499.31, down 86.42): Enbridge Inc. (TSX:ENB). Energy. Down 21 cents, or 0.39 per cent, to $53.14 on 13.8 million shares. Suncor Energy Inc. (TSX:SU). Energy. Down 50 cents, or 1.26 per cent, to $39.18 on 11.3 million shares. Converge Technology Solutions Corp. (TSX:CTS). Technology. Down 80 cents, or 22.79 per cent, to $2.71 on 6.6 million shares. Manulife Financial Corp. (TSX:M",CAD,BAM.TO, - Most actively traded companies on the Toronto Stock Exchange
fin_news_nlp/yahoo_cad_tickers_news,https://ca.finance.yahoo.com/news/wake-cae-inc-tse-cae-141225687.html,Key Insights Institutions' substantial holdings in CAE implies that they have significant influence over the company's...,CAD,CAE.TO,"Simply Wall St. - In the wake of CAE Inc.'s (TSE:CAE) latest CA$420m market cap drop, institutional owners may be forced to take severe actions"
fin_news_nlp/yahoo_cad_tickers_news,https://ca.finance.yahoo.com/news/calibre-announces-initial-high-grade-210000024.html,"VANCOUVER, British Columbia, May 10, 2023 (GLOBE NEWSWIRE) -- Calibre Mining Corp. (TSX: CXB; OTCQX: CXBMF) (the ""Company"" or ""Calibre"") is pleased to announce drill results from the resource conversion and expansion program within its 100% owned, Eastern Borosi Mine Complex (“Eastern Borosi” or “EBM”) located in northeastern Nicaragua. Highlights of the Eastern Borosi infill drill program: 12.9 g/t Au over 8.5 metres Estimated True Width (“ETW”) including 23.30 g/t Au over 1.6 metres ETW and 35",CAD,CXB.TO,GlobeNewswire - Calibre Announces Initial High-Grade Drill Results at its Eastern Borosi Mine Complex; Drilling Intersects 12.9 g/t Gold over 8.5 metres Including 23.30 g/t Gold over 1.6 metres
fin_news_nlp/yahoo_cad_tickers_news,https://ca.finance.yahoo.com/news/bank-stock-could-turn-182-210000286.html,"While the next four months might be rough, I would still invest in this bank stock to easily turn your cash into huge returns in 2023. The post This Bank Stock Could Turn 182 Shares Into $13,490 in 2023 appeared first on The Motley Fool Canada.",CAD,CM.TO,"The Motley Fool - This Bank Stock Could Turn 182 Shares Into $13,490 in 2023"
fin_news_nlp/yahoo_cad_tickers_news,https://ca.finance.yahoo.com/news/canadian-tire-gains-traction-retail-001500532.html,"Canadian Tire Corporation Ltd (TSX:CTC) remains a great target in the retail space, as it prepares to release its next batch of earnings. The post Canadian Tire Gains Traction: Retail Resilience in a Digital World appeared first on The Motley Fool Canada.",CAD,CTC.TO,The Motley Fool - Canadian Tire Gains Traction: Retail Resilience in a Digital World
fin_news_nlp/yahoo_cad_tickers_news,https://ca.finance.yahoo.com/news/cipher-pharmaceuticals-schedules-q1-2023-210000683.html,"Cipher Pharmaceuticals Inc. (TSX: CPH) (""Cipher"" or ""the Company"") today announced that it will release its financial results for the first quarter of 2023 on Thursday, May 11, 2023. The Company will also host a conference call on Friday, May 12, 2023 at 8:30am ET to discuss the results and corporate developments.",CAD,CPH.TO,CNW Group - Cipher Pharmaceuticals Schedules Q1 2023 Earnings Release and Conference Call
fin_news_nlp/yahoo_cad_tickers_news,https://ca.finance.yahoo.com/news/colabor-group-releases-results-shareholder-220600808.html,"BOUCHERVILLE, Quebec, May 04, 2023 (GLOBE NEWSWIRE) -- Colabor Group Inc. (TSX: GCL) (“Colabor” or the “Corporation”) held its annual and special meeting of shareholders (the “Meeting”) on May 4, 2023. A total of 74,217,761 common shares representing 72.79% of the issued and outstanding shares of the Corporation were represented in person and by proxy at the Meeting. At this Meeting, the following resolutions were approved: Election of Directors The seven candidates proposed as Directors were du",CAD,GCL.TO,GlobeNewswire - Colabor Group Releases Results of Shareholder Votes
fin_news_nlp/yahoo_cad_tickers_news,https://ca.finance.yahoo.com/news/looking-big-returns-2-tsx-004500721.html,These three TSX stocks have big potential over the long term for aggressive investors. The post Looking for Big Returns? 2 TSX Stocks With Tons of Potential appeared first on The Motley Fool Canada.,CAD,CSU.TO,The Motley Fool - Looking for Big Returns? 2 TSX Stocks With Tons of Potential
fin_news_nlp/yahoo_cad_tickers_news,https://ca.finance.yahoo.com/news/crown-capital-partners-announces-q1-213000403.html,"Crown Capital Partners Inc. (""Crown"" or the ""Corporation"") (TSX: CRWN) today announced its financial results for the three months ended March 31, 2023. Crown's complete financial statements and management's discussion and analysis are available on SEDAR at www.sedar.com.",CAD,CRWN.TO,CNW Group - Crown Capital Partners Announces Q1 2023 Financial Results
fin_news_nlp/yahoo_cad_tickers_news,https://ca.finance.yahoo.com/news/bastien-boire-lavigne-appointed-chief-210100917.html,"D-BOX Continues its Commitment to Drive Innovation and Growth Sébastien Boire-Lavigne Sébastien Boire-Lavigne MONTREAL, May 10, 2023 (GLOBE NEWSWIRE) -- D-BOX Technologies Inc. (“D-BOX” (TSX: DBO), a world leader in haptic and immersive entertainment experiences, is pleased to announce the nomination of Sébastien Boire-Lavigne as Chief Technology Officer. As an integral part of the management team and reporting to the President and Chief Executive Officer, he will be responsible for the organiza",CAD,DBO.TO,GlobeNewswire - Sébastien Boire-Lavigne is appointed Chief Technology Officer at D-BOX
fin_news_nlp/yahoo_cad_tickers_news,https://ca.finance.yahoo.com/news/delta-9-awarded-grow-pod-220000655.html,"WINNIPEG, Manitoba, May 10, 2023 (GLOBE NEWSWIRE) -- DELTA 9 CANNABIS INC. (TSX:DN) (OTCQX:DLTNF) (“Delta 9” or the “Company”) is pleased to announce that it has secured a purchase order from 1356089 BC Ltd. for up to 12 of its modular Grow Pods for a cultivation facility in British Columbia. 1356089 BC Ltd. has also entered into a Strategic Cooperation Agreement with the Company whereby Delta 9 will provide services relating to 1356089 BC Ltd.’s cannabis production facility, development of stan",CAD,DN.TO,GlobeNewswire - Delta 9 Awarded Grow Pod Contract for Cultivation Facility in British Columbia
fin_news_nlp/yahoo_cad_tickers_news,https://ca.finance.yahoo.com/news/denison-reports-financial-operational-results-223300059.html,"Denison Mines Corp. ('Denison' or the 'Company') (TSX: DML) (NYSE American: DNN) today filed its Condensed Consolidated Financial Statements and Management's Discussion & Analysis ('MD&A') for the quarter ended March 31, 2023. Both documents will be available on the Company's website at www.denisonmines.com, SEDAR (at www.sedar.com) and EDGAR (at www.sec.gov/edgar.shtml). The highlights provided below are derived from these documents and should be read in conjunction with them. All amounts in th",CAD,DML.TO,CNW Group - Denison Reports Financial and Operational Results for Q1 2023
fin_news_nlp/yahoo_cad_tickers_news,https://ca.finance.yahoo.com/news/dexterra-report-voting-results-annual-210000600.html,"Toronto, Ontario--(Newsfile Corp. - May 10, 2023) - Dexterra Group Inc. (TSX: DXT) (""Dexterra"" or the ""Corporation"") is pleased to report that each of its nine director nominees listed in the Corporation's management information circular dated March 23, 2023 (the ""Circular""), was elected as a director at its May 10, 2023 annual and special meeting of shareholders (the ""Meeting"").The director election voting results are provided in the table below:Nominee# Votes For% Votes For# Votes Withheld% ..",CAD,DXT.TO,Newsfile - Dexterra Report Voting Results from Annual and Special Meeting of Shareholders
fin_news_nlp/yahoo_cad_tickers_news,https://ca.finance.yahoo.com/news/diversified-royalty-corp-announces-q1-210000980.html,"VANCOUVER, British Columbia, May 10, 2023 (GLOBE NEWSWIRE) -- Diversified Royalty Corp. (TSX: DIV and DIV.DB.A) (the “Corporation” or “DIV”) is pleased to announce its financial results for the three months ended March 31, 2023 (“Q1 2023”). Q1 2023 Highlights Revenue of $12.3 million, up 26.7% compared to the three months ended March 31, 2022 (“Q1 2022”).Adjusted revenue1 of $13.6 million, up 23.9% compared to Q1 2022.Distributable cash1 of $8.8 million, up 22.6% compared to Q1 2022.Payout ratio",CAD,DIV.TO,GlobeNewswire - Diversified Royalty Corp. Announces Q1 2023 Results
fin_news_nlp/yahoo_cad_tickers_news,https://ca.finance.yahoo.com/news/dynacor-groups-tse-dng-dividend-102231973.html,The board of Dynacor Group Inc. ( TSE:DNG ) has announced that it will pay a dividend of $0.01 per share on the 17th of...,CAD,DNG.TO,Simply Wall St. - Dynacor Group's (TSE:DNG) Dividend Will Be $0.01
fin_news_nlp/yahoo_cad_tickers_news,https://ca.finance.yahoo.com/news/ecn-capital-schedules-q1-2022-211000868.html,"TORONTO, May 04, 2023 (GLOBE NEWSWIRE) -- ECN Capital Corp. (TSX: ECN) (“ECN Capital” or “the Company”) announced today that it intends to file its financial statements and management discussion and analysis for the three-month period ended March 31, 2023 after markets close on Monday, May 15, 2023. About ECN Capital Corp. With managed assets of more than US$4 billion, ECN Capital Corp. (TSX: ECN) is a leading provider of business services to North American based banks, credit unions, life insur",CAD,ECN.TO,GlobeNewswire - ECN Capital Schedules Q1-2022 Earnings Release Date
fin_news_nlp/yahoo_cad_tickers_news,https://ca.finance.yahoo.com/news/ecosynthetix-announces-normal-course-issuer-210000237.html,"EcoSynthetix Inc. (TSX: ECO) (""EcoSynthetix"" or the ""Company""), a renewable chemicals company that produces a portfolio of commercially proven bio-based products, announced today that it intends to make a normal course issuer bid (the ""Bid"") to repurchase, on the open market through the facilities of the Toronto Stock Exchange (""TSX""), other designated exchanges and/or alternative Canadian trading systems or by such other means as may be permitted by applicable Canadian securities laws, certain",CAD,ECO.TO,CNW Group - EcoSynthetix Announces Normal Course Issuer Bid
fin_news_nlp/yahoo_cad_tickers_news,https://ca.finance.yahoo.com/news/better-dividend-buy-transcanada-stock-234500043.html,Are you looking to add more to your Enbridge and TransCanada stocks but can't decide? Look at this comparison to make an informed decision. The post Better Dividend Buy: TransCanada Stock or Enbridge Stock? appeared first on The Motley Fool Canada.,CAD,ENB.TO,The Motley Fool - Better Dividend Buy: TransCanada Stock or Enbridge Stock?
fin_news_nlp/yahoo_cad_tickers_news,https://ca.finance.yahoo.com/news/one-canadas-fastest-growing-etf-135500698.html,"Founded in 2017, Evolve has quickly become one of Canada's fastest-growing ETF issuers. In the past year alone, the company grew from $2 billion in assets under management (AUM) at the start of 2022 to $5.6 billion today. Raj Lala, the President and CEO of Evolve, is incredibly proud of that growth.",CAD,ETC.TO,ACCESSWIRE - One Of Canada's Fastest Growing ETF Issuers More Than Doubled Its AUM Amid A Market Downturn - Evolve CEO Shares The Secret To Its Success
fin_news_nlp/yahoo_cad_tickers_news,https://ca.finance.yahoo.com/news/exro-technologies-announces-first-quarter-235100232.html,"Exro Technologies Inc. (TSX: EXRO) (OTCQB: EXROF) (the ""Company"" or ""Exro""), a leading clean technology company developing new generation power control electronics that expand the capabilities of electric motors and batteries, announced today its financial results for the quarter ended March 31, 2023.",CAD,EXRO.TO,CNW Group - Exro Technologies Announces First Quarter 2023 Financial Results
fin_news_nlp/yahoo_cad_tickers_news,https://ca.finance.yahoo.com/news/filo-mining-reports-q1-2023-213000989.html,"Filo Mining Corp. (TSX: FIL) (Nasdaq First North Growth Market: FIL) (OTCQX: FLMMF) (""Filo Mining"" or the ""Company"") announces its results for the three months ended March 31, 2023. View PDF",CAD,FIL.TO,CNW Group - Filo Mining Reports Q1 2023 Results
fin_news_nlp/yahoo_cad_tickers_news,https://ca.finance.yahoo.com/news/finning-reports-voting-results-annual-213700331.html,"VANCOUVER, British Columbia, May 10, 2023 (GLOBE NEWSWIRE) -- Finning International Inc. (TSX: FTT) (“Finning” or the “Company”) announces the voting results from its Annual Meeting of Shareholders held on Tuesday, May 9, 2023 in Vancouver, British Columbia. A total of 116,651,396 common shares were represented at the Meeting, representing 77.49% of the Company’s outstanding shares as at the record date. Shareholders voted in favor of all items of business before the Meeting, including the appoi",CAD,FTT.TO,GlobeNewswire - Finning Reports on Voting Results from its Annual Meeting of Shareholders
fin_news_nlp/yahoo_cad_tickers_news,https://ca.finance.yahoo.com/news/firm-capital-mortgage-investment-corporation-215400386.html,"TORONTO, May 04, 2023 (GLOBE NEWSWIRE) -- Firm Capital Mortgage Investment Corporation (the “Corporation”) (TSX FC, FC.DB.G, FC.DB,H, FC.DB.I, FC.DB.J ,FC.DB. K and FC.DB.L) released its financial statements for the three months ended March 31, 2023. NET INCOMEFor the three months ended March 31, 2023, net income increased by 10.8% to $8,711,897 as compared to $7,861,540 reported for the same period in 2022. The increase is primarily a result of a higher average interest rate on the Corporation’",CAD,FC.TO,"GlobeNewswire - Firm Capital Mortgage Investment Corporation Announces Q1/2023 Results, as Well as the Declaration of July, August, and September Monthly Cash Dividends"
fin_news_nlp/yahoo_cad_tickers_news,https://ca.finance.yahoo.com/news/freehold-royalties-ltd-announces-results-003500819.html,"CALGARY, Alberta, May 10, 2023 (GLOBE NEWSWIRE) -- Freehold Royalties Ltd. (TSX: FRU) (Freehold) announced today that all nominees listed in its notice of meeting and information circular dated March 22, 2023, were elected as directors of Freehold at its Annual Meeting of Shareholders (the Meeting) held today. In addition, all other matters considered at the Meeting were approved by Freehold's shareholders. The results of the votes on the director nominees are as follows: NomineeVotes ForVotes W",CAD,FRU.TO,GlobeNewswire - Freehold Royalties Ltd. Announces Results from Annual Meeting of Shareholders
fin_news_nlp/yahoo_cad_tickers_news,https://ca.finance.yahoo.com/news/galiano-gold-reports-q1-2023-210000451.html,"Galiano Gold Inc. (""Galiano"" or the ""Company"") (TSX: GAU) (NYSE American: GAU) reports first quarter (""Q1"") operating and financial results for the Company and the Asanko Gold Mine (""AGM""), located in Ghana, West Africa. The AGM is a 50:50 joint venture (""JV"") with Gold Fields Limited (""Gold Fields"") (JSE, NYSE: GFI) which is managed and operated by Galiano. All financial information contained in this news release is unaudited and reported in US$.",CAD,GAU.TO,CNW Group - GALIANO GOLD REPORTS Q1 2023 OPERATING AND FINANCIAL RESULTS
