source,url,description,country,company,title
fin_news_nlp/yahoo_cad_tickers_news,https://ca.finance.yahoo.com/news/lavras-gold-announces-results-shareholder-212900918.html,"TORONTO, July 18, 2023 (GLOBE NEWSWIRE) -- Lavras Gold Corp. (TSXV: LGC, OTCQB: LGCFF) reports the voting results of its annual and special meeting held on July 18, 2023 (the “Meeting”). At the Meeting, shareholders approved the appointment of Davidson & Company LLP as auditor of Lavras Gold and an omnibus long-term incentive plan. Seven directors were also elected at the Meeting: David Birkett, Michael Durose, Jonathan Hill, Lawrence Lepard, Michael Mutchler, Rostislav Raykov, and Rowland Uloth",CAD,LGC.V,GlobeNewswire - Lavras Gold announces results of shareholder meeting
fin_news_nlp/yahoo_cad_tickers_news,https://ca.finance.yahoo.com/news/leading-edge-materials-reports-quarterly-170000321.html,"LEADING EDGE MATERIALS REPORTS QUARTERLY RESULTS TO APRIL 30, 2023 Vancouver, June 21, 2023 – Leading Edge Materials Corp. (“Leading Edge Materials” or the “Company”) (TSXV: LEM) (Nasdaq First North: LEMSE) (OTCQB: LEMIF) (FRA: 7FL) second quarter results for the period ending April 30, 2023. All references to dollar amounts in this release are in Canadian dollars. Highlights During and After the Quarter During the three months ended April 30, 2023: On March 1, 2023, the Company announced it ide",CAD,LEM.V,"GlobeNewswire - LEADING EDGE MATERIALS REPORTS QUARTERLY RESULTS TO APRIL 30, 2023"
fin_news_nlp/yahoo_cad_tickers_news,https://ca.finance.yahoo.com/news/legend-power-systems-announces-non-110000966.html,"Vancouver, British Columbia--(Newsfile Corp. - July 18, 2023) - Legend Power® Systems Inc. (TSXV: LPS) (OTCQB: LPSIF) (""Legend Power"" or the ""Company""), a global leader in commercial electrical system solutions, is pleased to announce a non-brokered private placement of a minimum of 11,111,111 units and up to a maximum of 16,666,667 units of the Company (each, a ""Unit"") at a price of $0.18 per Unit for aggregate gross proceeds of a minimum of $2,000,000 ...",CAD,LPS.V, - Legend Power Systems Announces Non-Brokered Private Placement Pursuant to the Listed Issuer Exemption
fin_news_nlp/yahoo_cad_tickers_news,https://ca.finance.yahoo.com/news/lincoln-gold-debt-settlement-approved-181500502.html,"Lincoln Gold Mining Inc.(""Lincoln"" or the ""Company"") (TSXV:LMG) is pleased to announce that following its previous news release on May 3, 2023, it has received approval to issue 9,886,364 units (""Debt Units"") to settle $1,680,681.88 of debt to various creditors (the ""Debt Settlement"").",CAD,LMG.V,ACCESSWIRE - Lincoln Gold Debt Settlement Approved
fin_news_nlp/yahoo_cad_tickers_news,https://ca.finance.yahoo.com/news/lion-rock-secures-fleuron-lithium-112000186.html,"Vancouver, British Columbia--(Newsfile Corp. - June 14, 2023) - Lion Rock Resources Inc. (TSXV: ROAR) (FSE: KGB) (the ""Company"") is pleased to announce that it has entered into an option agreement (the ""Option Agreement"") to acquire the Fleuron Lithium Project, strategically located 35 km south of Val d'Or, Québec (Figure 1). The Fleuron Lithium Project is comprised of 205 claims spanning 11,380 ha and lies within a highly prospective region with limited lithium exploration ...",CAD,ROAR.V,Newsfile - Lion Rock Secures Fleuron Lithium Project in Strategic Acquisition
fin_news_nlp/yahoo_cad_tickers_news,https://ca.finance.yahoo.com/news/lions-bay-capital-inc-enters-130000167.html,"Vancouver, British Columbia--(Newsfile Corp. - June 16, 2023) - Lions Bay Capital Inc. (TSXV: LBI) (""Lions Bay"" or the ""Company"") has entered into an agreement to purchase a USD $2.1 million loan note (""Loan Note"") from Salamander Mining International Limited (""Salamander""). The Loan Note is owed by GnT Mining Propriety Limited (""GnT"") and its subsidiary Bosveld Mines Propriety Limited (""Bosveld""). The Loan Note has priority ranking over shareholder and other debt and is secured by ...",CAD,LBI.V, - Lions Bay Capital Inc. Enters into Agreement to Purchase USD $2.1 Million Loan Note
fin_news_nlp/yahoo_cad_tickers_news,https://ca.finance.yahoo.com/news/lithium-chile-begins-drilling-first-120043473.html,"CALGARY, ALBERTA, TheNewswire, July 10, 2023 – Lithium Chile Inc. (“Lithium Chile” or the “Company”) (TSXV:LITH) (OTC:LTMCF) is pleased to announce that drilling has commenced on the Salar de Llama...",CAD,LITH.V,"News Direct - Lithium Chile Begins Drilling the First Exploration Hole on its Salar de Llamara, Chile Project and Reports Increased Grades after Resampling Wells on Arizaro, Argentina"
fin_news_nlp/yahoo_cad_tickers_news,https://ca.finance.yahoo.com/news/lithium-ionic-reports-initial-drill-110000603.html,"Figure 1 Salinas Lithium Project Location & Drill Intercept Highlights TORONTO, July 25, 2023 (GLOBE NEWSWIRE) -- Lithium Ionic Corp. (TSXV: LTH; OTCQB: LTHCF; FSE: H3N) (“Lithium Ionic” or the “Company”) reports initial results from a planned 20,000-metre drill program at the Salinas Lithium Project (“Salinas”). Drilling commenced in May 2023, following the acquisition of Salinas in March (see press release dated March 13, 2023). Salinas is located approximately 100 kilometres north of its Itin",CAD,LTH.V,"GlobeNewswire - Lithium Ionic reports initial drill results from the Salinas Project; intersects 1.38% Li2O over 16m and 1.60% Li2O over 12m, Minas Gerais, Brazil"
fin_news_nlp/yahoo_cad_tickers_news,https://ca.finance.yahoo.com/news/lithium-one-arranges-2-000-203700839.html,"Vancouver, British Columbia--(Newsfile Corp. - July 29, 2023) - Lithium One Metals Inc. (TSXV: LONE) (FSE: H490) (OTCQB: LOMEF) (the ""Company"" or ""LONE"") announces that it has arranged a private placement of up to 6,250,000 common shares (the ""Shares"") at $0.25 per Share for total gross proceeds of up to $2,000,000 (the ""Placement""). Finders' fees may be payable in whole or on part of the Placement, subject to the policies of the TSX ...",CAD,LONE.V,"Newsfile - Lithium One Arranges $2,000,000 Private Placement"
fin_news_nlp/yahoo_cad_tickers_news,https://ca.finance.yahoo.com/news/stocks-play-lithiumbank-resources-corp-133400057.html,Announced the filing of the Boardwalk Lithium Brine Project Preliminary Economic Assessment Technical ...,CAD,LBNK.V, - Stocks in play: LithiumBank Resources Corp.
fin_news_nlp/yahoo_cad_tickers_news,https://ca.finance.yahoo.com/news/lomiko-announces-closing-flow-unit-130500362.html,"MONTREAL, July 24, 2023--Lomiko Metals Inc. (TSX.V: LMR) (""Lomiko Metals"" or the ""Company"") is pleased to announce that it will apply to the TSX Venture Exchange to close its previously announced flow-through unit offering pursuant to which the Company will issue 17,700,000 flow-through units (the ""FT Units"") at a price of $0.03 per FT Unit for a total of $531,000. Each FT Unit consists of one common share that will qualify as a ""flow-through share"" within the meaning of the Income Tax Act (Cana",CAD,LMR.V,Business Wire - Lomiko announces an update on the closing of the Flow-Through unit offering
fin_news_nlp/yahoo_cad_tickers_news,https://ca.finance.yahoo.com/news/lorne-park-capital-partners-inc-201000511.html,"Toronto, Ontario--(Newsfile Corp. - July 25, 2023) - Lorne Park Capital Partners Inc. (TSXV: LPC) (""LPCP"" or the ""Company"") today announced its results for the six month and three month periods ended June 30, 2023.Revenue for the six month period ended June 30, 2023 (""YTD 2023"") was $14.5 million, an increase of $1.2 million or 9.4%, compared to $13.3 million for the six month period ended June 30, 2022 (""YTD 2022""). Revenue ...",CAD,LPC.V,"Newsfile - Lorne Park Capital Partners Inc. Announces Results for the Six Month and Three Month Periods Ended June 30, 2023"
fin_news_nlp/yahoo_cad_tickers_news,https://ca.finance.yahoo.com/news/los-andes-copper-agrees-20-162617175.html,Los Andes Copper Interim CEO Santiago Montt and Chairman Eduardo Covarrubias joined Steve Darling from Proactive to share significant news about the company's royalty agreement with Ecora Resources.,CAD,LA.V,News Direct - Los Andes Copper agrees to $20 million royalty agreement with Ecora Resources
fin_news_nlp/yahoo_cad_tickers_news,https://ca.finance.yahoo.com/news/groupe-lsl-pharma-increased-production-215400441.html,"BOUCHERVILLE, Quebec, June 20, 2023 (GLOBE NEWSWIRE) -- GROUPE LSL PHARMA INC (TSXV: LSL) - Groupe LSL Pharma Inc. (""the Company"" or "" LSL Pharma Group ""), a Canadian integrated pharmaceutical company, is pleased to announce that its total annual production capacity will be increased by approximately 35% to 40% as early as 2023, and further for 2024 and 2025, with its new facility in La Pocatière and a series of manufacturing optimizations in Upton. The Company would also like to point out that",CAD,LSL.V,GlobeNewswire - Groupe LSL Pharma Update on Increased Production Capacity and Anticipated Sales Growth
fin_news_nlp/yahoo_cad_tickers_news,https://ca.finance.yahoo.com/news/lucky-minerals-closes-non-brokered-010000137.html,"Lucky Minerals Inc. (TSXV:LKY)(OTC PINK:LKMNF)(FRA:LKY) (""Lucky"" or the ""Company"") announces the closing of the non-brokered private placement (the ""Offering"") announced on May 2, 2023, pursuant to which the Company issued an aggregate of 1,080,000 units (the ""Units"") at a price of $0.05 per Unit for total gross proceeds of $54,000.",CAD,LKY.V,ACCESSWIRE - Lucky Minerals Closes Non-Brokered Private Placement and Announces Resignation of Chief Financial Officer
fin_news_nlp/yahoo_cad_tickers_news,https://ca.finance.yahoo.com/news/lumina-gold-hires-ron-halas-110000629.html,"Lumina Gold Corp. (TSXV: LUM) (OTCQB: LMGDF) (the ""Company"" or ""Lumina"") is pleased to announce that it has hired Ron Halas, P.Eng. as Chief Operating Officer. Mr. Halas has over 30 years of diverse experience including open pit and underground mining in both base and precious metals. He has worked with major mining companies including Kinross, IAMGOLD, Vale, PT Freeport Indonesia, Placer Dome, and Cominco. His extensive experience in mine feasibility, development, and operations has been gained",CAD,LUM.V,CNW Group - Lumina Gold Hires Ron Halas as Chief Operating Officer
fin_news_nlp/yahoo_cad_tickers_news,https://ca.finance.yahoo.com/news/lumine-group-inc-announces-results-213000631.html,"TORONTO, May 15, 2023 (GLOBE NEWSWIRE) -- Lumine Group Inc. (“Lumine Group” or “the Company”) (TSXV:LMN) announces financial results for the three months ended March 31, 2023. All amounts referred to in this press release are in US dollars unless otherwise stated. The following press release should be read in conjunction with the Company’s unaudited condensed consolidated interim financial statements for the three months ended March 31, 2023, management’s discussion and analysis (“MD&A”) for the",CAD,LMN.V,"GlobeNewswire - Lumine Group Inc. Announces Results for the Three Months Ended March 31, 2023"
fin_news_nlp/yahoo_cad_tickers_news,https://ca.finance.yahoo.com/news/luminex-resources-extends-cuyes-west-203000395.html,"Luminex Resources Corp. (TSXV: LR) (OTCQX: LUMIF) (the ""Company"" or ""Luminex"") is pleased to announce drill results from three holes that targeted the Cuyes West structure (CU23-27 to CU23-29), while simultaneously targeting the adjacent Breccia Pipe target. Luminex is also announcing the results from its initial seven-hole campaign at Prometedor.",CAD,LR.V,CNW Group - Luminex Resources Extends Cuyes West Over 200 Metres at Depth
fin_news_nlp/yahoo_cad_tickers_news,https://ca.finance.yahoo.com/news/lycos-energy-inc-announces-appointment-211900365.html,"Calgary, Alberta--(Newsfile Corp. - June 14, 2023) - Lycos Energy Inc. (TSXV: LCX) (""Lycos"" or the ""Company"") is pleased to announce that Geri Greenall was elected to the Company's board of directors at the annual general and special meeting (the ""Annual Meeting"") of shareholders of Lycos held earlier today.Ms. Greenall is currently a director of Kelt Exploration Ltd. and the Chief Financial Officer of Spartan Delta Corp. She has over 22 years of experience ...",CAD,LCX.V,Newsfile - Lycos Energy Inc. Announces Appointment of New Director
fin_news_nlp/yahoo_cad_tickers_news,https://ca.finance.yahoo.com/news/magna-mining-drill-results-continues-203109689.html,Magna Mining senior vice president David King joined Steve Darling from Proactive to share exciting news about the company's ongoing 2023 diamond drilling program at the Crean Hill project. With tw...,CAD,NICU.V,News Direct - Magna Mining drill results continues to intersect nickel mineralization at Crean Hill
fin_news_nlp/yahoo_cad_tickers_news,https://ca.finance.yahoo.com/news/magna-terra-provides-recent-exploration-120000354.html,"Magna Terra Minerals Inc. (the ""Company"" or ""Magna Terra"") (TSXV:MTT) is pleased to announce that Opus One Resources Inc. (""Opus One"") (TSXV:OOR) have provided a detailed summary report of its exploration program undertaken to date on the Noyell Project (""Noyell""), located in the province of Quebec.",CAD,MTT.V,"ACCESSWIRE - Magna Terra Provides Update on Recent Exploration Results by Partner Opus One at Noyell Project, Quebec"
fin_news_nlp/yahoo_cad_tickers_news,https://ca.finance.yahoo.com/news/magnetic-north-acquisition-corp-confirms-151800083.html,"Magnetic North Acquisition Corp. (TSXV: MNC) (TSXV: MNC.PR.A) (""Magnetic North"" or the ""Company"") announces that, further to its news release of July 4, 2023, the TSX Venture Exchange (the ""TSXV"") suspended trading in the Company's securities on July 5, 2023 as a result of a Cease Trade Order (the ""CTO"") issued by the Alberta Securities Commission. The CTO was issued as a result of a delay in the filing of the Company's audited annual financial statements, accompanying management discussion and",CAD,MNC.V,CNW Group - MAGNETIC NORTH ACQUISITION CORP. CONFIRMS SUSPENSION OF TRADING
fin_news_nlp/yahoo_cad_tickers_news,https://ca.finance.yahoo.com/news/magnum-goldcorp-inc-closes-non-175600700.html,"West Vancouver, British Columbia--(Newsfile Corp. - June 13, 2023) - Magnum Goldcorp Inc. (TSXV: MGI) (the ""Company"" or ""Magnum"") announces that further to its news release of May 1, 2023, the Company has now closed its private placement. The Company has raised a total of $60,000 through the issuance of 2,000,000 units (the ""Units"") at $0.03 per Unit. Each Unit consists of one common share and one share purchase warrant, with each warrant ...",CAD,MGI.V,Newsfile - Magnum Goldcorp Inc. Closes Non-Brokered Private Placement
fin_news_nlp/yahoo_cad_tickers_news,https://ca.finance.yahoo.com/news/manganese-x-progresses-battery-hill-041500736.html,"Montreal, Quebec--(Newsfile Corp. - June 6, 2023) - Manganese X Energy Corp. (TSXV: MN) (FSE: 9SC2) (OTCQB: MNXXF) (""Manganese X"" or the ""Company"") proudly announces significant advancements at its 100% owned Battery Hill Manganese Deposit, marking a crucial step towards the pre-feasibility stage. The completion of the Company's pre-feasibility diamond drilling program, focused on expanding measured and indicated resources, has yielded exceptional results. Furthermore, the Company has initiated",CAD,MN.V,Newsfile - Manganese X Progresses Battery Hill to Pre-Feasibility Stage with Successful Drill Program and Environmental Studies Commencement
fin_news_nlp/yahoo_cad_tickers_news,https://ca.finance.yahoo.com/news/maple-gold-intersects-5-8-110000697.html,"Vancouver, British Columbia--(Newsfile Corp. - June 6, 2023) - Maple Gold Mines Ltd. (TSXV: MGM) (OTCQB: MGMLF) (FSE: M3G) (""Maple Gold"" or the ""Company"") is pleased to report complete gold (""Au"") assay results (multi-element assay results remain pending) from the first phase of deep drilling at the Telbel Mine area (""Telbel"") of the Joutel Gold Project (""Joutel"") located in Québec, Canada, which is held by a 50/50 joint venture (the ""JV"") between the Company ...",CAD,MGM.V,"Newsfile - Maple Gold Intersects 5.8 g/t Gold over 2 Metres Within 3.9 g/t Gold over 4.5 Metres, and up to 11.1 g/t Gold More than 500 Metres Beneath Historical Telbel Mine at Joutel"
fin_news_nlp/yahoo_cad_tickers_news,https://ca.finance.yahoo.com/news/marksmen-announces-proposed-private-placement-213800068.html,"CALGARY, ALBERTA, July 12, 2023 (GLOBE NEWSWIRE) -- Marksmen Energy Inc. (“Marksmen” or the “Company”) (TSXV: MAH) is pleased to announce that it plans to complete a non-brokered private placement of up to 7,000,000 units (the “Units”) of Marksmen at a price of $0.05 per Unit for aggregate gross proceeds of up to a maximum of $350,000 (the “Offering”). There is no minimum Offering. The Units will be comprised of one (1) common share (“Common Share”) and one (1) share purchase warrant (“Warrant”)",CAD,MAH.V,GlobeNewswire - MARKSMEN ANNOUNCES PROPOSED PRIVATE PLACEMENT
fin_news_nlp/yahoo_cad_tickers_news,https://ca.finance.yahoo.com/news/marvel-highlights-key-asset-2023-203000310.html,"Calgary, Alberta--(Newsfile Corp. - July 10, 2023) - Marvel Biosciences Corp. (TSXV: MRVL) and its wholly owned subsidiary, Marvel Biotechnology Inc. (collectively the ""Company"" or ""Marvel""), is pleased to announce that it has been selected to present the Company's scientific advancement of its key asset MB-204 titled MB-204: A Novel Adenosine A2a Antagonist for AD, ADHD and Depression at the Alzheimer's Association International Conference (AAIC) Sunday, July 16, 2023: 7:00 AM – 11:55 ...",CAD,MRVL.V,Newsfile - Marvel Highlights Key Asset at the 2023 Alzheimer's Association International Conference
fin_news_nlp/yahoo_cad_tickers_news,https://ca.finance.yahoo.com/news/marvel-jv-partner-files-drill-070500126.html,"Marvel Discovery Corp. (TSXV:MARV), (FRA:O4T), (OTCQB:MARVF); and Falcon Gold Corp. (TSXV:FG), (FRA:3FA), (OTCQB:FGLDF) together (the Alliance) are pleased to announce that Falcon Gold has applied for drill permits to carry out activities on their Golden Brook prospects within the Hope Brook Property in southern Newfoundland.",CAD,MARV.V,ACCESSWIRE - Marvel JV Partner Files Drill Permits at Hope Brook Near Kraken Pegmatite Field
fin_news_nlp/yahoo_cad_tickers_news,https://ca.finance.yahoo.com/news/mas-gold-announces-director-resignation-210100236.html,"MAS Gold Corp. (""MAS"" or the ""Company"") (TSXV: MAS) announces that Steven Goldman has resigned as a director of the Company effective June 27, 2023, and the board has accepted his resignation. The Company thanks Mr. Goldman for his valuable contributions and wishes him every success in his future endeavours.",CAD,MAS.V,CNW Group - MAS Gold Announces Director Resignation
fin_news_nlp/yahoo_cad_tickers_news,https://ca.finance.yahoo.com/news/masivo-resume-drilling-upsized-program-133000662.html,"Vancouver, British Columbia--(Newsfile Corp. - May 15, 2023) - Masivo Silver Corp. (TSXV: MASS) (OTC Pink: GNYPF) (""Masivo"" or the ""Company"") is pleased to announce it will resume drilling operations at the Boston Mine Project in the State of Nevada where the company has successfully completed its first hole targeting and encountering two projected parallel mineralized zones where significant copper-gold-silver values related to skarn mineralization with strong calc-silicate alteration along wit",CAD,MASS.V, - Masivo to Resume Drilling with Upsized Program
fin_news_nlp/yahoo_cad_tickers_news,https://ca.finance.yahoo.com/news/paramount-warner-bros-discovery-face-122130072.html,"Advertising pressures are seen as a risk to both Paramount Global (NASDAQ:PARA) and Warner Bros Discovery Inc (NASDAQ:WBD) stocks, which Wolfe Research downgraded on Friday.  Wolfe Research cut its rating on Paramount to Underperform from Peer Perform with a $14 price target.  Advertising is an issue for both media companies, Wolfe said in its research notes.",CAD,MCF.V," - Paramount, Warner Bros. Discovery face advertising headwinds: Wolfe Research"
fin_news_nlp/yahoo_cad_tickers_news,https://ca.finance.yahoo.com/news/medallion-resources-announces-private-placement-213000435.html,"THIS PRESS RELEASE, REQUIRED BY APPLICABLE CANADIAN LAWS, IS NOT FOR DISTRIBUTION TO U.S. NEWS SERVICES OR FOR DISSEMINATION IN THE UNITED STATES VANCOUVER, British Columbia, June 06, 2023 (GLOBE NEWSWIRE) -- Medallion Resources Ltd. (TSX-V: MDL; OTCQB: MLLOF; Frankfurt: MRDN) – “Medallion” or the “Company”), is pleased to announce a non-brokered private placement offering (the “Offering”) consisting of up to 40,000,000 units (the “Units”) at a price of Cdn$0.05 per Unit, for gross proceeds of u",CAD,MDL.V,"GlobeNewswire - Medallion Resources Announces Private Placement of Up to CDN$2,000,000 and Debt Settlement of US$650,000"
fin_news_nlp/yahoo_cad_tickers_news,https://ca.finance.yahoo.com/news/medicure-reports-financial-results-quarter-000000919.html,"Medicure Inc. (""Medicure"" or the ""Company"") (TSXV:MPH)(OTC PINK:MCUJF), a company focused on the development and commercialization of pharmaceuticals and healthcare products for patients and prescribers in the United States market, today reported its results from operations for the quarter ended June 30, 2023.",CAD,MPH.V," - Medicure Reports Financial Results For Quarter Ended June 30, 2023"
fin_news_nlp/yahoo_cad_tickers_news,https://ca.finance.yahoo.com/news/medmira-reports-third-quarter-results-020000775.html,"MedMira Inc. (MedMira) (TSXV:MIR), reported today on its financial results for the quarter ended April 30, 2023.",CAD,MIR.V, - MedMira Reports Third Quarter Results FY2023
fin_news_nlp/yahoo_cad_tickers_news,https://ca.finance.yahoo.com/news/memex-inc-reports-q2-2023-210000178.html,"/ Memex Inc. (""Memex"" or the ""Company"") (TSX-V:OEE), a leader in Industrial Internet of Things (IIoT) manufacturing productivity software, today released financial and operational highlights for its second quarter ending March 31, 2023. All results are reported in Canadian dollars.",CAD,OEE.V,ACCESSWIRE - Memex Inc. Reports Q2-2023 Results
fin_news_nlp/yahoo_cad_tickers_news,https://ca.finance.yahoo.com/news/metalla-sells-cortez-mineral-claims-110000088.html,"Metalla Royalty & Streaming Ltd. (""Metalla"" or the ""Company"") (NYSE American: MTA) (TSXV: MTA) is pleased to announce that it has closed on a purchase and sale agreement with Nevada Gold Mines, LLC (""Nevada Gold Mines""), an entity formed by Barrick Gold Corporation and Newmont Corporation (NYSE: NEM), for the sale by Metalla of the JR mineral claims that make up the Pine Valley property (""Property"") which is part of the Cortez complex in Eureka County, Nevada, for $5 million in cash and Metalla",CAD,MTA.V,CNW Group - METALLA SELLS CORTEZ MINERAL CLAIMS TO NEVADA GOLD MINES FOR $5 MILLION AND DECLARES A SPECIAL DIVIDEND
fin_news_nlp/yahoo_cad_tickers_news,https://ca.finance.yahoo.com/news/metallic-minerals-launches-first-phase-113000989.html,"Metallic Minerals Corp. (TSX.V:MMG)(OTCQB:MMNGF)(""Metallic Minerals"" or the ""Company"") is pleased to announce the start of the 2023 exploration and drill campaign at the La Plata copper-silver-gold-PGE project, located in southwest Colorado.",CAD,MMG.V,"ACCESSWIRE - Metallic Minerals Launches First Phase Drill Program at the La Plata Copper-Silver-Gold-PGE Project in Southwest Colorado, USA"
fin_news_nlp/yahoo_cad_tickers_news,https://ca.finance.yahoo.com/news/midland-probe-gold-resume-drilling-103000776.html,"Figure 1 Abitibi Geology-La Peltrie Discovery Location Figure 2 MD-Probe La Peltrie 2023 Phase 1 Drilling Figure 3 MD-Probe La Peltrie New Cu-Au-Ag-Mo Discovery MONTREAL, July 25, 2023 (GLOBE NEWSWIRE) -- Midland Exploration Inc. (“Midland”) (TSX-V: MD) is pleased to announce that drilling has resumed on the large copper-gold-silver-molybdenum (“Cu-Au-Ag-Mo”) discovery made in 2022 on the La Peltrie Option (the “Property”) in partnership with Probe Gold Inc. (“Probe”). This significant mineraliz",CAD,MD.V,GlobeNewswire - Midland and Probe Gold Resume Drilling on the Copper-Gold-Silver-Molybdenum Discovery on the La Peltrie Option
fin_news_nlp/yahoo_cad_tickers_news,https://ca.finance.yahoo.com/news/midnight-sun-confirms-high-grade-100000470.html,"Copper mineralisation style and grade similar to Sentinel Mine Vancouver, British Columbia--(Newsfile Corp. - July 25, 2023) - Midnight Sun Mining Corp. (TSXV: MMA) (OTCQB: MDNGF) (the ""Company"" or ""Midnight Sun"") is pleased to provide the remaining drill results from holes MTDD047 and MTDD048, and a summary of results from the 2022 drilling campaign on the Mitu Trend, one of four key prospects which comprise the Company's Solwezi Project in Zambia. Initial laboratory results were received short",CAD,MMA.V,Newsfile - Midnight Sun Confirms High Grade Drill Intercepts at Mitu
fin_news_nlp/yahoo_cad_tickers_news,https://ca.finance.yahoo.com/news/mimedia-announces-appointment-santiago-fontan-121500273.html,MiMedia Holdings Inc. (TSXV: MIM) is pleased to announce the addition of Santiago Fontan Balestra as Senior Director of Business Development at MiMedia.,CAD,MIM.V,"CNW Group - MiMedia Announces Appointment of Santiago Fontan Balestra, former Qualcomm LATAM Sales & Business Development Director, as Senior Director of Business Development at MiMedia"
fin_news_nlp/yahoo_cad_tickers_news,https://ca.finance.yahoo.com/news/minco-capital-announces-cancellation-insider-183100785.html,"Minco Capital Corp. (the ""Company"" or ""Minco Capital"") (TSXV: MMM) (OTCQX: MGHCF) (FSE: MI5) announced that it has cancelled a portion of stock options granted to insiders in accordance with its Stock Option Plan. This move aligns the interests of management with those of shareholders.",CAD,MMM.V,CNW Group - MINCO CAPITAL ANNOUNCES CANCELLATION OF INSIDER STOCK OPTIONS
