source,url,description,country,company,title
fin_news_nlp/yahoo_cad_tickers_news,https://ca.finance.yahoo.com/news/abasca-resources-engages-red-cloud-120000443.html,"Abasca Resources Inc. (""Abasca"" or the ""Company"") (TSXV:ABA) announces that subject to regulatory approval, it has engaged Red Cloud Securities Inc. (""Red Cloud"") to provide market making services to the Company (the ""Agreement"") in compliance with the policies of the TSX Venture Exchange (""TSX-V"") and applicable securities legislation.",CAD,ABA.V,ACCESSWIRE - Abasca Resources Engages Red Cloud Securities and Closes the Non-Brokered Flow-Through Private Placement
fin_news_nlp/yahoo_cad_tickers_news,https://ca.finance.yahoo.com/news/aston-bay-american-west-metals-110000767.html,"Aston Bay Holdings Ltd. (TSXV:BAY) (OTCQB:ATBHF) (""Aston Bay"" or the ""Company"") reports significant new drill results from the spring reverse circulation (RC) drilling program at the Storm Copper Project (""Storm"" or the ""Project"") on Somerset Island, Nunavut, Canada.",CAD,BAY.V,"ACCESSWIRE - Aston Bay and American West Metals Announce 8% Copper Intersected at the Storm Copper Project, Nunavut"
fin_news_nlp/yahoo_cad_tickers_news,https://ca.finance.yahoo.com/news/aurora-solar-technologies-corporate-120000435.html,"North Vancouver, British Columbia--(Newsfile Corp. - June 22, 2023) - Aurora Solar Technologies Inc. (TSXV: ACU) (""Aurora"") is pleased to provide an update regarding the integration of the acquisition of BT Imaging Pty Ltd. (""BTI""), the strategic direction for the combined business (""Company"") and to remind shareholders of the upcoming AGM. Aurora has been focused on the integration of BTI resulting in efficiencies and business focus together with a comprehensive market survey to better ...",CAD,ACU.V,Newsfile - Aurora Solar Technologies Corporate Update
fin_news_nlp/yahoo_cad_tickers_news,https://ca.finance.yahoo.com/news/aztec-outlines-expansion-drill-targets-110000542.html,"Aztec Minerals Corp. (AZT:TSX-V)(OTCQB:AZZTF)announces it has received permits for a planned two -stage reverse circulation ""RC"" drilling program at its 100% owned Cervantes porphyry gold-copper project in Sonora, Mexico.",CAD,AZT.V,"ACCESSWIRE - Aztec Outlines Expansion Drill Targets and Receives Drill Permit for Planned RC Drill Program at Cervantes Gold-Copper Project, Sonora, Mexico"
fin_news_nlp/yahoo_cad_tickers_news,https://ca.finance.yahoo.com/news/canada-nickel-reports-encouraging-initial-122600616.html,"Canada Nickel Company Inc. (""Canada Nickel"" or the ""Company"") (TSXV: CNC) (OTCQX: CNIKF) is pleased to announce the initial results from preliminary metallurgical test work on the first set of samples from the Texmont Nickel Sulphide Project, which demonstrates a range of grades could be processed using a simple process flowsheet and recoveries that meet or exceed historical results.",CAD,CNC.V,"CNW Group - Canada Nickel Reports Encouraging Initial Metallurgical Results from its Texmont Project, Announces Consolidation of Texmont Region"
fin_news_nlp/yahoo_cad_tickers_news,https://ca.finance.yahoo.com/news/cathedra-bitcoin-provides-operations-110000661.html,"TORONTO, June 22, 2023--(Block Height: 795,400) – Cathedra Bitcoin Inc. (TSX-V: CBIT; OTCQB: CBTTF) (""Cathedra"" or the ""Company""), a diversified bitcoin mining company, is pleased to announce the following updates on its bitcoin mining operations.",CAD,CBIT.V,Business Wire - Cathedra Bitcoin Provides Operations Update
fin_news_nlp/yahoo_cad_tickers_news,https://ca.finance.yahoo.com/news/copper-road-identifies-priority-jr-110000458.html,"Figure 1 JR Zone Long Section Figure 2 JR Zone MMI Lines and Proposed DDHs Figure 3 JR Zone Gradient IP TORONTO, June 22, 2023 (GLOBE NEWSWIRE) -- Copper Road Resources Inc. (TSXV: CRD) (“Copper Road” or the “Company”) is pleased to announce the proposed 2023 drill program at the highly-prospective JR Zone at its Copper Road Project in Batchewana Bay, Ontario. The Company plans to test the following priority targets at the JR Zone: J-P-23-01: the hole will test the Jogran porphyry at depth proxi",CAD,CRD.V,"GlobeNewswire - Copper Road Identifies Priority JR Zone Targets for Upcoming Drill Program at Its Project in Batchewana Bay, Ontario"
fin_news_nlp/yahoo_cad_tickers_news,https://ca.finance.yahoo.com/news/decibel-introduces-vox-brand-launch-120000228.html,"Decibel Cannabis Company Inc. (the ""Company"" or ""Decibel"") (TSXV: DB) (OTCQB: DBCCF), a market leader in premium cannabis and extract manufactured products, is pleased to announce the launch of its new brand, Vox, and the introduction of its first product line, Vox Popz crushable extract pre-rolls.",CAD,DB.V,CNW Group - Decibel Introduces Vox Brand with Launch of Vox Popz Crushable Pre-Rolls
fin_news_nlp/yahoo_cad_tickers_news,https://ca.finance.yahoo.com/news/district-receives-approval-ardnasvarre-mineral-120000632.html,"Vancouver, British Columbia--(Newsfile Corp. - June 22, 2023) - District Metals Corp. (TSXV: DMX) (FSE: DFPP); (""District"" or the ""Company"") is pleased to report that Bergslagen Metals AB (a 100% owned Swedish subsidiary of District) has received approval from the Bergsstaten (Mining Inspectorate) for the Ardnasvarre nr 1 mineral license application to explore for copper, molybdenum, zirconium, and rare earth elements (REE) over a 9,708 hectare (ha) area located in Norrbottens County, northern S",CAD,DMX.V,Newsfile - District Receives Approval of the Ardnasvarre Mineral License Application in Northern Sweden and Notes Recent Media Report Regarding Support for Uranium Mining and Exploration in Sweden
fin_news_nlp/yahoo_cad_tickers_news,https://ca.finance.yahoo.com/news/qples-fobi-announces-annual-contract-120000159.html,"Renewal agreement enables Qples to continue expanding its scale and impact as momentum for new 8112 Universal Digital Coupons accelerates.VANCOUVER, BC, June 22, 2023 (GLOBE NEWSWIRE) -- Fobi AI Inc. (FOBI:TSXV) (FOBIF:OTCQB) (the ""Company"" or ""Fobi""), an industry leader in harnessing AI and data intelligence to enable digital transformation, is pleased to announce that the Company’s subsidiary, Qples by Fobi, has renewed its annual contract agreement with leading marketing solutions provider, V",CAD,FOBI.V,GlobeNewswire - Qples by Fobi Announces Annual Contract Renewal with Marketing Solutions Leader Vericast
fin_news_nlp/yahoo_cad_tickers_news,https://ca.finance.yahoo.com/news/oil-holds-advance-signs-demand-032058328.html,"(Bloomberg) -- Oil prices tumbled as a raft of hawkish views on interest rates hurt risk sentiment.Most Read from BloombergTitanic Sub Search Chases Mystery Noises as Air Runs LowModi Meets With Elon Musk and Ray Dalio as Global Money Flocks to IndiaChina Says Biden Calling Xi a Dictator Is ‘Provocation’Short Bets on US Stocks Hit $1 Trillion, Most Since April 2022Modi’s Yoga Mastery Shows Indian Democracy Is Just a PoseBoth benchmarks fell more than 3%, with US West Texas Intermediate futures t",CAD,CM.TO,Bloomberg - Oil Falls as Hawkish Fed Dampens Investor Appretite For Risk
fin_news_nlp/yahoo_cad_tickers_news,https://ca.finance.yahoo.com/news/stocks-play-else-nutrition-holdings-131700336.html,"Announces that four of its products, Else Kids Vanilla, Else Kids Cocoa, and Else Toddler Organic & ...",CAD,BABY.TO, - Stocks in play: Else Nutrition Holdings Inc
fin_news_nlp/yahoo_cad_tickers_news,https://ca.finance.yahoo.com/news/mackenzie-investments-fund-offers-canadians-142100924.html,"Mackenzie Investments (""Mackenzie"") today announced the launch of the Mackenzie USD Global Dividend Fund (""the Fund""). This new offering provides investors with a new way to maintain their US dollar exposure, while taking advantage of investment opportunities in a range of global companies.",CAD,IGM.TO,CNW Group - New Mackenzie Investments Fund Offers Canadians True US Dollar Access to Global Dividend Opportunities
fin_news_nlp/yahoo_cad_tickers_news,https://ca.finance.yahoo.com/news/oceanagold-reports-voting-results-annual-170000891.html,"OceanaGold Corporation (TSX: OGC) (""OceanaGold"" or the ""Company"") is pleased to report the voting results from the Company's 2023 Annual General and Special Meeting of Shareholders (""Annual Meeting"") held virtually today.",CAD,OGC.TO,CNW Group - OceanaGold Reports Voting Results of Annual General Meeting
fin_news_nlp/yahoo_cad_tickers_news,https://ca.finance.yahoo.com/news/real-estate-split-corp-announces-133100886.html,"TORONTO, June 22, 2023 (GLOBE NEWSWIRE) -- Middlefield Group, on behalf of Real Estate Split Corp. (TSX: RS and RS.PR.A) (the “Company”), is pleased to announce a successful overnight treasury offering of class A and preferred shares (the “Class A Shares” and “Preferred Shares”, respectively). Gross proceeds of the offering are expected to be approximately $10.3 million. The offering is expected to close on or about Thursday, June 29, 2023 and is subject to certain closing conditions including a",CAD,RS.TO,GlobeNewswire - Real Estate Split Corp. Announces Successful Overnight Offering
fin_news_nlp/yahoo_cad_tickers_news,https://ca.finance.yahoo.com/news/shopify-inc-shop-attracting-investor-130012426.html,"Zacks.com users have recently been watching Shopify (SHOP) quite a bit. Thus, it is worth knowing the facts that could determine the stock's prospects.",CAD,SHOP.TO,Zacks - Shopify Inc. (SHOP) is Attracting Investor Attention: Here is What You Should Know
fin_news_nlp/yahoo_cad_tickers_news,https://ca.finance.yahoo.com/news/arcelormittal-mt-invests-eaf-drive-115300877.html,"The new electric furnace by ArcelorMittal (MT) in Belval will be installed this year, with commissioning in 2025.",CAD,SVM.TO,Zacks - ArcelorMittal (MT) Invests in New EAF to Drive Decarbonization
fin_news_nlp/yahoo_cad_tickers_news,https://ca.finance.yahoo.com/news/nia-sun-life-embark-research-130200363.html,The National Institute on Ageing (NIA) is proud to announce a new research partnership with Sun Life that will seek to identify barriers to financial security for older Canadians and find solutions that can help overcome them.,CAD,SLF.TO,CNW Group - NIA and Sun Life Embark on New Research Partnership to Improve Financial Security for Older Canadians
fin_news_nlp/yahoo_cad_tickers_news,https://ca.finance.yahoo.com/news/arht-media-closes-2-million-133300907.html,"TORONTO, June 22, 2023 (GLOBE NEWSWIRE) -- ARHT Media Inc. (""ARHT"" or ""the Company"") (TSXV:ART), (OTCQB:ARHTF) the global leader in the development, production and distribution of high-quality, low latency hologram and digital content, today announced that it has entered into an accounts receivable facility with Sallyport Commercial Finance (""Sallyport"") for up to C$2 million. Under the terms of the agreements signed with Sallyport, the Company can draw down up to $2 million CAD based on its acc",CAD,ART.V,GlobeNewswire - ARHT Media Closes $2 Million Operating Debt Facility with Sallyport Commercial Finance
fin_news_nlp/yahoo_cad_tickers_news,https://ca.finance.yahoo.com/news/fremont-raise-3-million-drilling-132900325.html,"Vancouver, British Columbia--(Newsfile Corp. - June 22, 2023) - Fremont Gold Ltd. (TSXV: FRE) (FSE: FR2) (OTCQB: FRERF) (""Fremont"" or the ""Company"") is pleased to announce the terms of a non-brokered private placement of up to 25,000,000 units (""Unit"") at a price of $0.12 per Unit for gross proceeds of up to $3,000,000 (the ""Private Placement""). Net proceeds of the Private Placement will be used to undertake an initial drill campaign at Fremont's Vardenis ...",CAD,FRE.V,Newsfile - Fremont to Raise $3 Million for Drilling Vardenis and Advancing Nevada Assets
fin_news_nlp/yahoo_cad_tickers_news,https://ca.finance.yahoo.com/news/galleon-gold-present-live-webinar-143000208.html,"Toronto, Ontario--(Newsfile Corp. - June 22, 2023) - Galleon Gold Corp. (TSXV: GGO) (the ""Company"" or ""Galleon Gold"") is pleased to announce that the Company will be presenting a live webinar event, hosted by Red Cloud Financial Services, on June 27, 2023 at 2:00 pm ET/11:00 am PT. The Company's CEO will outline progress on its plans for an underground bulk sample at the West Cache Gold Project, Timmins, Ontario.We invite our shareholders, and all interested ...",CAD,GGO.V, - Galleon Gold to Present in Live Webinar Hosted by Red Cloud
fin_news_nlp/yahoo_cad_tickers_news,https://ca.finance.yahoo.com/news/international-metals-oncolytics-52-week-145900605.html,International Metals Mining Corp. (V.IMM) hit a new 52-week high of 36 cents Thursday. International ...,CAD,IMM.V," - International Metals, Oncolytics at 52-Week Highs on News"
fin_news_nlp/yahoo_cad_tickers_news,https://ca.finance.yahoo.com/news/maximize-retirement-income-top-dividend-143000563.html,These three dividend stocks are perfect choices for a passive-income investment portfolio. The post Maximize Your Retirement Income With These Top Dividend Stocks in Canada appeared first on The Motley Fool Canada.,CAD,BNS.TO,The Motley Fool - Maximize Your Retirement Income With These Top Dividend Stocks in Canada
fin_news_nlp/yahoo_cad_tickers_news,https://ca.finance.yahoo.com/news/canlan-reports-voting-results-2023-162100195.html,"Burnaby, British Columbia--(Newsfile Corp. - June 22, 2023) - The Annual General Meeting of Shareholders (the ""Meeting"") of Canlan Ice Sports Corp. (TSX: ICE) (the ""Company"") was held on June 21, 2023, at ScotiaBarn in Burnaby, BC. Each of the matters voted upon at the Meeting is discussed in detail in the Company's Management Information Circular dated May 17, 2023, which can be found on the website www.sedar.com.The total number of shares represented by ...",CAD,ICE.TO,Newsfile - Canlan Reports Voting Results From The 2023 Annual General Meeting of Shareholders
fin_news_nlp/yahoo_cad_tickers_news,https://ca.finance.yahoo.com/news/better-buy-fortis-stock-emera-140000553.html,Fortis and Emera are plan to raise their dividends in the next few years. Is one stock oversold today? The post Better Buy: Fortis Stock or Emera? appeared first on The Motley Fool Canada.,CAD,EMA.TO,The Motley Fool - Better Buy: Fortis Stock or Emera?
fin_news_nlp/yahoo_cad_tickers_news,https://ca.finance.yahoo.com/news/pembina-pipeline-corporation-announces-closing-145200154.html,"CALGARY, Alberta, June 22, 2023--Pembina Pipeline Corporation (""Pembina"" or the ""Company"") (TSX: PPL; NYSE: PBA) is pleased to announce that it has closed its previously announced offering of $500 million of senior unsecured medium-term notes (the ""Offering""). The Offering was conducted in three tranches consisting of $300 million principal amount of senior unsecured medium-term notes, series 19 (the ""Series 19 Notes"") having a fixed coupon of 5.72% per annum, paid semi-annually, and maturing on",CAD,PPL.TO,Business Wire - Pembina Pipeline Corporation Announces Closing of $500 Million Public Note Offering
fin_news_nlp/yahoo_cad_tickers_news,https://ca.finance.yahoo.com/news/talon-metals-announces-results-agm-151000005.html,"Road Town, Tortola, British Virgin Islands--(Newsfile Corp. - June 22, 2023) - Talon Metals Corp. (TSX: TLO) (""Talon"" or the ""Company"") is pleased to announce the results of its annual and special meeting of shareholders (""AGM"") held today.All of the nominee directors listed in Talon's management information circular dated May 23, 2023 were elected as directors. The results of the shares voted in respect of the election of each director were as follows:Name ...",CAD,TLO.TO,Newsfile - Talon Metals Announces Results of AGM
fin_news_nlp/yahoo_cad_tickers_news,https://ca.finance.yahoo.com/news/uni-select-inc-reports-director-155600902.html,"Uni-Select Inc. (TSX: UNS) (""Uni-Select"") held its annual general meeting of shareholders earlier today by live webcast. All seven nominees listed in Uni-Select's management information circular dated May 17, 2023, filed on Uni-Select's SEDAR profile at www.sedar.com, were elected. The detailed results of the vote for the election of directors are set out below.",CAD,UNS.TO,CNW Group - Uni-Select Inc. Reports Director Election Results
fin_news_nlp/yahoo_cad_tickers_news,https://ca.finance.yahoo.com/news/vanguard-announces-cash-distributions-vanguard-152000818.html,"(VGG, VGH, VFV and VSP)TORONTO, June 22, 2023 (GLOBE NEWSWIRE) -- Vanguard Investments Canada Inc. today announced the final June 2023 cash distributions for certain Vanguard ETFs, listed below, that trade on Toronto Stock Exchange (TSX). Unitholders of record on June 30, 2023 will receive cash distributions payable on July 10, 2023. Details of the “per unit” distribution amounts are as follows: Vanguard ETF®TSX Ticker SymbolDistribution per Unit ($)CUSIPISINPayment FrequencyVanguard U.S. Divide",CAD,VGG.TO,GlobeNewswire - Vanguard Announces Cash Distributions for the Vanguard ETFs
fin_news_nlp/yahoo_cad_tickers_news,https://ca.finance.yahoo.com/news/greenbriar-capital-announces-convertible-debenture-161900046.html,"Coquitlam, British Columbia--(Newsfile Corp. - June 22, 2023) - Greenbriar Capital Corp. (TSXV: GRB) (OTC Pink: GEBRF) (""Greenbriar or ""the Company"") announces that it intends to issue a CDN $1.0 million unsecured convertible debenture (the ""Debenture"") to an investor (the ""Debenture Holder""). The Debenture will bear interest at 12% per annum, calculated and paid quarterly commencing on the date of issuance and will mature thirty-six (36) months from the date of issuance (the ""Maturity ...",CAD,GRB.V, - Greenbriar Capital Announces Convertible Debenture and Update on the Sage Ranch Option and Joint Venture Agreement with Captiva Verde Wellness Corp
fin_news_nlp/yahoo_cad_tickers_news,https://ca.finance.yahoo.com/news/aleafia-health-announces-kind-payment-172000184.html,"TORONTO, June 22, 2023 (GLOBE NEWSWIRE) -- Aleafia Health Inc. (TSX: AH, OTCQB: ALEAF) (“Aleafia Health” or the “Company”) announces that it is electing to pay interest in-kind on its (a) 8.50% Series A Secured Debentures Due June 30, 2024 (the “Series A Debentures”), (b) 8.50% Series B Secured Debentures Due June 30, 2026 (the “Series B Debentures”), and (c) 8.50% Series C Secured Convertible Debentures Due June 30, 2028 (the “Series C Debentures” and, collectively with the Series A Debentures",CAD,AH.TO,GlobeNewswire - Aleafia Health Announces In-Kind Payment of Interest on Secured Convertible Debentures
fin_news_nlp/yahoo_cad_tickers_news,https://ca.finance.yahoo.com/news/better-buy-bank-montreal-stock-153000910.html,Both Bank of Montreal and Canadian Imperial Bank of Commerce are trading at a lower valuation. Let's see which TSX bank stock is a better buy. The post Better Buy: Bank of Montreal Stock or Canadian Imperial Bank of Commerce? appeared first on The Motley Fool Canada.,CAD,BMO.TO,The Motley Fool - Better Buy: Bank of Montreal Stock or Canadian Imperial Bank of Commerce?
fin_news_nlp/yahoo_cad_tickers_news,https://ca.finance.yahoo.com/news/retirement-made-easier-tfsa-stocks-150000682.html,"TD Bank stock is one of three top TFSA stocks that have strong financial positions, growing cash flow, and growing dividends. The post Retirement Made Easier: TFSA Stocks for a Stress-Free Future appeared first on The Motley Fool Canada.",CAD,BCE.TO,The Motley Fool - Retirement Made Easier: TFSA Stocks for a Stress-Free Future
fin_news_nlp/yahoo_cad_tickers_news,https://ca.finance.yahoo.com/news/enbridge-climate-change-energy-transition-181000018.html,"NORTHAMPTON, MA / ACCESSWIRE / June 22, 2023 / Enbridge Originally published in Enbridge's 2022 Sustainability Report The world faces an urgent imperative to reduce greenhouse gas emissions and transition to a lower-carbon economy. As one of the ...",CAD,ENB.TO,ACCESSWIRE - Enbridge: Climate Change and the Energy Transition
fin_news_nlp/yahoo_cad_tickers_news,https://ca.finance.yahoo.com/news/mullen-group-ltd-announces-declaration-170900182.html,"(TSX: MTL) The Board of Directors of Mullen Group Ltd. (""Mullen Group"", ""We"", ""Our"" and/or the ""Corporation"") announced today that it has declared a monthly dividend of $0.06 per Common Share payable to the holders of record of Common Shares at the close of business on June 30, 2023. The dividend will be paid on July 17, 2023.",CAD,MTL.TO,CNW Group - Mullen Group Ltd. Announces Declaration of Monthly Dividend
fin_news_nlp/yahoo_cad_tickers_news,https://ca.finance.yahoo.com/news/ryan-reynolds-made-300-million-180055589.html,"A-list actor Ryan Reynolds, known for his role in the self-titled ""Deadpool"" films and many more blockbusters, claims he's not an investment wizard. See: 10 Richest Actors in the WorldFind: 3 Things...",CAD,NVEI.TO,GOBankingRates - Ryan Reynolds Made $300 Million on Mint Mobile — Should You Go All In on His Latest Fintech Investment?
fin_news_nlp/yahoo_cad_tickers_news,https://ca.finance.yahoo.com/news/bqe-water-reports-2023-agm-170000260.html,"BQE Water Inc. (TSXV: BQE), a leader in the treatment and management of mine impacted waters, reports the results of its Annual General and Special Meeting of shareholders held on June 21, 2023 in Vancouver, Canada.",CAD,BQE.V,CNW Group - BQE Water Reports 2023 AGM Results
fin_news_nlp/yahoo_cad_tickers_news,https://ca.finance.yahoo.com/news/dfr-gold-announces-resolutions-passed-180300344.html,"Vancouver, British Columbia--(Newsfile Corp. - June 22, 2023) - DFR Gold Inc. (TSXV: DFR) (""DFR"" or the ""Company"") is pleased to announce that the Company's shareholders have voted in favor of all resolutions proposed by management at the Annual General Meeting of shareholders (the ""Meeting"") held on June 22, 2023. DFR GOLD INC.John McGloin, CEO and PresidentContact: enquire@dfrgold.comAbout DFR Gold Inc.DFR Gold is a TSX Venture Exchange listed exploration and mine development company focused .",CAD,DFR.V,Newsfile - DFR Gold Announces Resolutions Passed at the Annual General Meeting
fin_news_nlp/yahoo_cad_tickers_news,https://ca.finance.yahoo.com/news/btv-showcases-northstar-gaming-goldshore-190000398.html,"Vancouver, British Columbia--(Newsfile Corp. - June 22, 2023) - On BNN Bloomberg broadcast on June 24 & 25, 2023 - BTV-Business Television interviews emerging companies in the markets including:Cannot view this video? Visit:https://www.b-tv.com/post/btv-showcases-northstar-gaming-goldshore-resources-nighthawk-gold-baselode-energy-marimaca-copper-btv-episode-383NorthStar Gaming Holdings Inc. (TSXV: BET) - BTV highlights NorthStar's rapid rise in the iGaming market after a successful IPO, raising",CAD,GSHR.V," - BTV Showcases: Northstar Gaming, Goldshore Resources, Nighthawk Gold, Baselode Energy & Marimaca Copper"
fin_news_nlp/yahoo_cad_tickers_news,https://ca.finance.yahoo.com/news/ascot-resources-announces-results-annual-190000843.html,"VANCOUVER, British Columbia, June 22, 2023 (GLOBE NEWSWIRE) -- Ascot Resources Ltd. (TSX: AOT; OTCQX: AOTVF) (“Ascot” or the “Company”) reports that at its annual general meeting (the ""AGM"") held today, June 22, 2023, Ascot's Shareholders approved by majority: to elect all seven directors standing for election; to re-appoint PricewaterhouseCoopers LLP as the Company's auditor; and the philosophy and design of the Company’s executive compensation. Detailed results of the votes held by ballot at t",CAD,AOT.TO,"GlobeNewswire - Ascot Resources Announces Results of Annual General Meeting Held June 22, 2023"
fin_news_nlp/yahoo_cad_tickers_news,https://ca.finance.yahoo.com/news/tfsa-investors-2-tsx-dividend-180000604.html,"Choosing the right stock for your TFSA at any given time requires more than a focus on temporary perks like a discount, boosted yield, or undervaluation. The post TFSA Investors: 2 TSX Dividend Stocks to Buy in June 2023 appeared first on The Motley Fool Canada.",CAD,BNS.TO,The Motley Fool - TFSA Investors: 2 TSX Dividend Stocks to Buy in June 2023
fin_news_nlp/yahoo_cad_tickers_news,https://ca.finance.yahoo.com/news/growth-stock-no-brainer-buy-164500861.html,"This top Canadian stock has tonnes of growth potential and is highly defensive, making it a no-brainer buy for investors today. The post This Growth Stock Is a No-Brainer Buy for Investors appeared first on The Motley Fool Canada.",CAD,GFL.TO,The Motley Fool - This Growth Stock Is a No-Brainer Buy for Investors
fin_news_nlp/yahoo_cad_tickers_news,https://ca.finance.yahoo.com/news/givex-extends-term-outstanding-warrants-203000865.html,"Givex Corp. (""Givex"" or the ""Company"") (TSX: GIVX) (OTCQX: GIVXF) announces that it has applied to the Toronto Stock Exchange (the ""TSX"") to extend the term of an aggregate of 11,000,000 common share purchase warrants (the ""Warrants""), which were issued by the Company on November 25, 2021 in connection with a private placement concurrent with the Company's listing on the TSX (the ""Go-Public Financing""). The current expiry date of the Warrants is November 25, 2023 and the new expiry date will be",CAD,GIVX.TO,CNW Group - Givex Extends Term of Outstanding Warrants
fin_news_nlp/yahoo_cad_tickers_news,https://ca.finance.yahoo.com/news/globex-mining-enterprises-announces-results-202300831.html,"ROUYN-NORANDA, Quebec, June 22, 2023 (GLOBE NEWSWIRE) -- GLOBEX MINING ENTERPRISES INC. (GMX – Toronto Stock Exchange, G1MN – Frankfurt, Stuttgart, Berlin, Munich, Tradegate, Lang & Schwarz, LS Exchange, TTMzero, Düsseldorf and Quotrix Düsseldorf Stock Exchanges and GLBXF – OTCQX International in the US) is pleased to announce that all five nominees listed in its 2023 management information circular were re-elected as directors at Globex’s annual meeting of shareholders held today in Toronto, On",CAD,GMX.TO,GlobeNewswire - Globex Mining Enterprises Announces Results of Annual Meeting
