source,url,description,country,company,title
fin_news_nlp/yahoo_cad_tickers_news,https://ca.finance.yahoo.com/news/collective-mining-hosts-vice-minister-120000717.html,"Collective Mining Ltd. (TSXV: CNL) (OTCQX: CNLMF) (""Collective"" or the ""Company"") is pleased to announce the Company had a recent opportunity to host the new Vice Minister of Mines of Colombia, Giovanni Franco, at its operation facilities in Supia, Colombia. The Vice Minister was visiting the region as part of the Ministry of Mines and Energy's Social Mining Forum, which is a communication-based platform to discuss mining between the Ministry and municipalities.",CAD,CNL.V,"CNW Group - Collective Mining Hosts the Vice Minister of Mines of Colombia to its Project Facilities in Supia, Colombia"
fin_news_nlp/yahoo_cad_tickers_news,https://ca.finance.yahoo.com/news/elemental-altus-acquire-gold-royalty-120100574.html,"Vancouver, British Columbia--(Newsfile Corp. - February 6, 2023) - Elemental Altus Royalties Corp. (TSXV: ELE) (OTCQX: ELEMF) (""Elemental Altus"" or ""the Company"") announces that it has entered into a binding agreement (the ""Agreement"") to acquire a portfolio of 19 royalties (the ""Royalties"") from a wholly owned subsidiary of First Mining Gold Corp. (TSX: FF) (OTCQX: FFMGF) (""First Mining"") for consideration of US$5,000,000 in cash and common shares (the ""Acquisition"").Acquisition Highlights19 un",CAD,ELE.V,Newsfile - Elemental Altus to Acquire Gold Royalty Portfolio from First Mining
fin_news_nlp/yahoo_cad_tickers_news,https://ca.finance.yahoo.com/news/ev-nickel-final-assays-carlang-120000731.html,"EV NICKEL INC. (TSX-V: EVNI)(""EVNi"" or the ""Company"") is excited to announce the assay results, from the final 5 drill holes of the Phase 3 Drilling program (see tables 1 and 2), completed over the Large-Scale nickel target in the northeast of its Shaw Dome Project, referred to as the Carman-Langmuir or, ""CarLang Area"" (see figure 1).",CAD,EVNI.V,ACCESSWIRE - EV Nickel - Final Assays for CarLang A Zone- Reports 297.5 metres of 0.28% Ni. The A Zone Represents 20% of the Prosepective Trend
fin_news_nlp/yahoo_cad_tickers_news,https://ca.finance.yahoo.com/news/hemlo-explorers-announces-2022-recap-120000850.html,"Figure 1: Modelled VTEM Plates Figure 1: Modelled VTEM Plates TORONTO, Feb. 06, 2023 (GLOBE NEWSWIRE) -- Hemlo Explorers Inc. (the “Company”) (TSXV: HMLO) is pleased to deliver to shareholders a summary of the key accomplishments of 2022 and the Company’s outlook and exploration plans for 2023. 2022 marked a year of achievements for Hemlo Explorers. On the corporate side, the Company completed the following: In January 2022, the Company announced an option agreement with First Energy Metals Ltd.",CAD,HMLO.V,GlobeNewswire - Hemlo Explorers Announces 2022 Recap and 2023 Outlook
fin_news_nlp/yahoo_cad_tickers_news,https://ca.finance.yahoo.com/news/weekly-roundup-cannabis-sector-psychedelic-121933701.html,"Key Takeaways; Cannabis Sector Green Thumb will have a conference call to discuss its Q4 and full 2022 earnings on February 28, 2023. High Tide Q4 revenue rose 14% to C$108 million. SNDL completed the acquisition of The Valens Company. Columbia Care opened new Cannabist dispensary in Hampton, Virginia. Key Takeaways; Psychedelic Sector Awakn’s lead […] The post Weekly Roundup on the Cannabis Sector & Psychedelic Sector appeared first on Market Exclusive.",CAD,HITI.V, - Weekly Roundup on the Cannabis Sector & Psychedelic Sector
fin_news_nlp/yahoo_cad_tickers_news,https://ca.finance.yahoo.com/news/kane-biotech-announces-extension-term-123100188.html,"Not for distribution to U.S. news wire services or dissemination in the United States WINNIPEG, Manitoba, Feb. 06, 2023 (GLOBE NEWSWIRE) -- Kane Biotech Inc. (TSX-V:KNE) (the “Company” or “Kane Biotech”) announces today that it has entered into an amending agreement with Pivot Financial I Limited Partnership (“Pivot”) to the amended and restated credit agreement between the Company and Pivot dated August 31, 2021, extending the maturity date of its credit facility from January 31, 2023 to Februa",CAD,KNE.V,GlobeNewswire - Kane Biotech Announces Extension of Term of Credit Facility
fin_news_nlp/yahoo_cad_tickers_news,https://ca.finance.yahoo.com/news/lithium-one-acquires-bugatti-lithium-122000436.html,"Vancouver, British Columbia--(Newsfile Corp. - February 6, 2023) - Lithium One Metals Inc. (TSXV: LONE) (FSE: H490) (the ""Company"" or ""LONE"") is pleased to announce it has entered into an option agreement (the ""Option Agreement"") to acquire the Bugatti Lithium Property in the James Bay region of Quebec, subject to the acceptance of the TSX Venture Exchange. The 7,363 ha property is located 30 km southwest of the Pontois-Corvette Lithium Projects owned by Patriot ...",CAD,LONE.V,Newsfile - Lithium One Acquires Bugatti Lithium Property in the James Bay District
fin_news_nlp/yahoo_cad_tickers_news,https://ca.finance.yahoo.com/news/maritime-resources-provides-exploration-120000243.html,"Toronto, Ontario--(Newsfile Corp. - February 6, 2023) - Maritime Resources Corp. (TSXV: MAE) (""Maritime"" or the ""Company"") is pleased to provide an update on exploration activities near the Company's 100% owned Hammerdown Gold Project (""Hammerdown"" or the ""Project"") in the Baie Verte mining district of Newfoundland and Labrador, Canada near the Towns of King's Point and Springdale. Maritime is currently conducting a 5,000-metre diamond drill program near Hammerdown, focusing on near-mine explora",CAD,MAE.V,Newsfile - Maritime Resources Provides Exploration Update
fin_news_nlp/yahoo_cad_tickers_news,https://ca.finance.yahoo.com/news/nortec-announces-vtem-survey-commencement-123000204.html,"Toronto, Ontario--(Newsfile Corp. - February 6, 2023) - NORTEC MINERALS CORP. (TSXV: NVT) (""Nortec"" or the ""Company"") is pleased to announce a Versatile Time Electromagnetic (""VTEM"") geophysical survey at the Sturgeon Lake VMS Project in Ontario has started and is expected to conclude later this month. ""An ongoing GIS targeting compilation has identified eleven (11) exploration target areas at the Sturgeon Lake VMS Project. The current VTEM survey is the first modern survey ...",CAD,NVT.V,"Newsfile - Nortec Announces VTEM Survey Commencement at the Sturgeon Lake VMS Project, Ontario, Canada"
fin_news_nlp/yahoo_cad_tickers_news,https://ca.finance.yahoo.com/news/palladium-one-expands-west-pickle-113000622.html,"HighlightsWest Pickle mineralized strike length increased to over 600 meters, remains open to the east and west.New West Pickle Zone assay results include:3.9% Ni, 2.5% Cu, 0.05% Co, 0.55 g/t Total Precious Metals (""TPM"") (Pt+Pd+Au) over 2.0 meters of massive and semi-massive sulphides in hole TK-22-074Including 8.1% Ni, 2.8% Cu, 0.11% Co, 1.05 g/t TPM over 0.9 metersProperty Wide Feeder Dyke / Chonolith geological model Successful first test returns wide interval of anomalous nickel, ...",CAD,PDM.V,"Newsfile - Palladium One Expands West Pickle High-Grade Nickel Zone to 600 Meters, Tyko Nickel - Copper Project, Canada"
fin_news_nlp/yahoo_cad_tickers_news,https://ca.finance.yahoo.com/news/compete-gg-reveals-artificial-intelligence-123000421.html,"React Gaming Group Compete.gg mobile application mockup React Gaming’s esports tournament subsidiary to target new markets and mobile applications to fuel long-term growth Growth initiatives to include new artificial intelligence (AI) and machine learning (ML) capabilities aimed at increasing future revenue MONTREAL, Feb. 06, 2023 (GLOBE NEWSWIRE) -- React Gaming Group Inc. (“React Gaming” or the “Corporation”) (TSXV: RGG, OTCQB: ITMZF) is pleased to announce Compete.gg’s growth strategy for 202",CAD,RGG.V,GlobeNewswire - Compete.gg reveals artificial intelligence roadmap and 2023 growth initiatives
fin_news_nlp/yahoo_cad_tickers_news,https://ca.finance.yahoo.com/news/renoworks-launches-next-generation-ai-120000813.html,"Renoworks Software Inc. (TSXV: RW) (""Renoworks""), an industry leader in visualization and lead generation technology for the home renovation and new construction sector, announces the launch of its next generation artificial intelligence (AI) image recognition and visualization technology - Renoworks AI Gen 2. AI Gen 2 is faster, more accurate and more scalable, which should lead to better outcomes for all stakeholders utilizing the Renoworks platform.",CAD,RW.V,CNW Group - Renoworks Launches Next Generation AI Image Recognition and Visualization Technology
fin_news_nlp/yahoo_cad_tickers_news,https://ca.finance.yahoo.com/news/royal-helium-announces-steveville-helium-123000265.html,"Royal Helium Ltd. (TSXV: RHC) (TSXV: RHC.WT) (OTCQB: RHCCF) (""Royal"" or the ""Company"") is pleased to announce that binding commitment letters have been received and signed with the Business Development Bank of Canada (""BDC"") and Canadian Western Bank (""CWB"") acting pari passu for a non-revolving credit facility (""Credit Facility"") in the amount of CAD $15 million (see news release December 21, 2022). Proceeds of the Credit Facility will be used for the development and construction of production",CAD,RHC.V,CNW Group - Royal Helium Announces the Steveville Helium Plant is Fully Funded with the Execution of Binding Commitment Letters for $17.5 Million in Credit Facilities and the Release from Escrow of the Convertible Debentures
fin_news_nlp/yahoo_cad_tickers_news,https://ca.finance.yahoo.com/news/satellos-bioscience-announces-significant-increase-120000434.html,"- 40% increase in muscle size compared to control mice - 25% increase in muscle force, approaching levels seen in normal miceToronto, Ontario--(Newsfile Corp. - February 6, 2023) - Satellos Bioscience Inc. (TSXV: MSCL) (OTCQB: MSCLF) (""Satellos"" or the ""Company""), a drug discovery company developing small molecule therapeutics to regenerate muscle as a new approach to treating disease conditions from muscular dystrophy to aging, is pleased to announce results from multiple preclinical studies in",CAD,MSCL.V,Newsfile - Satellos Bioscience Announces Significant Increase in Muscle Size and Function in Duchenne Muscular Dystrophy Disease Model
fin_news_nlp/yahoo_cad_tickers_news,https://ca.finance.yahoo.com/news/rob-mcewen-acquire-37-6-123000148.html,"Toronto, Ontario--(Newsfile Corp. - February 6, 2023) - Satori Resources Inc. (TSXV: BUD) (""Satori"" or the ""Company"") is pleased to announce that the founder and former Goldcorp Inc. Chairman and CEO, Rob McEwen, will become Satori's largest shareholder owning 37.6% of the Company with the objective of expanding the high-grade gold zones at the past producing Tartan Lake Gold Mine in Flin Flon, Manitoba. Satori is proposing to acquire Rob McEwen's 100% owned ...",CAD,BUD.V,Newsfile - Rob McEwen to Acquire 37.6% of Satori Resources - Focused on Growing High-Grade Gold Discovery at Tartan Lake Mine & New Projects Surrounding Canada's Largest Mines & Development Projects
fin_news_nlp/yahoo_cad_tickers_news,https://ca.finance.yahoo.com/news/silver-x-mining-announces-appointment-120000960.html,"Silver X Mining Corp. (TSXV:AGX)(OTCQB:AGXPF)(FRA:WPZ)(""Silver X"" or the ""Company"") announces the appointment of Fiona Grant Leydier as Vice President, Investor Relations and Corporate Marketing.",CAD,AGX.V,ACCESSWIRE - Silver X Mining Announces Appointment of Vice President Investor Relations
fin_news_nlp/yahoo_cad_tickers_news,https://ca.finance.yahoo.com/news/sqi-diagnostics-extends-maturity-date-131700125.html,"SQI Diagnostics Inc. (""SQI"" or the ""Company"") (TSXV: SQD) (OTCQB: SQIDF), a leader in the science of lung health that develops and manufactures respiratory health and precision medicine tests, announces that SQI and Pivot Financial (""Pivot"") have agreed to extend the maturity date of SQI's $7.5 million credit facility (the ""Credit Facility"") with Pivot from January 31, 2023 to February 28, 2023 (the ""Pivot Amendment""). SQI paid Pivot an administrative amendment fee of $50,000 in connection with",CAD,SQD.V,CNW Group - SQI DIAGNOSTICS EXTENDS MATURITY DATE OF PIVOT CREDIT FACILITY AND DEFERRAL OF CERTAIN INTEREST PAYMENTS
fin_news_nlp/yahoo_cad_tickers_news,https://ca.finance.yahoo.com/news/turmalina-announces-sizing-financing-5-130000889.html,"NOT FOR DISTRIBUTION TO U.S. NEWSWIRE SERVICES OR FOR DISSEMINATION IN THE UNITED STATES VANCOUVER, British Columbia, Feb. 06, 2023 (GLOBE NEWSWIRE) -- Turmalina Metals Corp. (“Turmalina”, or the “Company”; TBX-TSXV, TBXXF-OTCQX, 3RI-FSE) is pleased to announce that it is increasing the maximum number of units of the Company (the “Units”) in connection with its previously disclosed non-brokered private placement (the “Offering”) to 11,111,111 Units at a price of $0.45 per Unit for aggregate gros",CAD,TBX.V,"GlobeNewswire - Turmalina Announces Up-Sizing of Financing to $5,000,000 and Closes Book"
fin_news_nlp/yahoo_cad_tickers_news,https://ca.finance.yahoo.com/news/uge-reaches-commercial-operation-newly-120000029.html,"First Project in Texas Adds 1.4MW to UGE's Operating Portfolio Toronto, Ontario--(Newsfile Corp. - February 6, 2023) - UGE International Ltd. (TSXV: UGE) (OTCQB: UGEIF) (the ""Company"" or ""UGE""), a leader in commercial and community solar, has acquired two solar projects and one battery energy storage system (""BESS"") in Texas. The first project reached commercial operation this week, shortly after closing the acquisition. The acquisition marks UGE's entrance into the Texas market. The acquisition",CAD,UGE.V,Newsfile - UGE Reaches Commercial Operation on Newly-Acquired Project in Texas
fin_news_nlp/yahoo_cad_tickers_news,https://ca.finance.yahoo.com/news/zentek-announces-final-results-hvac-123000958.html,"Zentek Ltd.(""Zentek"" or the ""Company"") (Nasdaq:ZTEK)(TSX-V:ZEN), an intellectual property development and commercialization company, is pleased to announce, further to its press releases dated April 11 2022 and December 15, 2022, that it has received the final report for Phase 2 testing of ZenGUARD™ for use in Heating, Ventilation and Air Conditioning (""HVAC"") filtration from the National Research Council of Canada (""NRC"").",CAD,ZEN.V,ACCESSWIRE - Zentek Announces Final Results of HVAC Phase 2 Testing
fin_news_nlp/yahoo_cad_tickers_news,https://ca.finance.yahoo.com/news/ammpower-announces-appointment-greg-barranger-123000939.html,"Greg Barranger, Vice President of Operations Greg Barranger, newly appointed Vice President of AmmPower’s IAMM Division standing inside the company’s demonstration, green ammonia synthesis machine. TORONTO, Feb. 06, 2023 (GLOBE NEWSWIRE) -- AmmPower Corp. (CSE: AMMP) (OTCQB: AMMPF) (FSE: 601A) (the “Company” of “AmmPower”) is pleased to announce the appointment of Greg Barranger to the position of Vice President of its Independent Ammonia Making Machine™ (“IAMM™”) Division, effective February 2,",CAD,AMMP.CN,"GlobeNewswire - AmmPower Announces the Appointment of Greg Barranger to the Position of Vice President, Operations of its IAMM™ Division"
fin_news_nlp/yahoo_cad_tickers_news,https://ca.finance.yahoo.com/news/columbia-care-celebrates-launch-adult-130500946.html,"NEW YORK, February 06, 2023--Columbia Care Inc. (NEO: CCHW) (CSE: CCHW) (OTCQX: CCHWF) (FSE: 3LP) (""Columbia Care"" or the ""Company""), one of the largest and most experienced cultivators, manufacturers and retailers of cannabis products in the U.S., announced it began adult-use sales on February 4 at its Cannabisti dispensary, located in Hermann, Missouri. The dispensary has been serving the medical patient community since 2021.",CAD,CCHW.CN,Business Wire - Columbia Care Celebrates Launch of Adult Use Cannabis Sales in Missouri
fin_news_nlp/yahoo_cad_tickers_news,https://ca.finance.yahoo.com/news/gamelancer-media-welcomes-head-global-123000839.html,"Gamelancer Media Corp. (CSE: GMNG) (OTCQB: GAMGF) (FRA: P93) (""Gamelancer"" or the ""Company"") a media & entertainment company producing short-form video content for brands, is pleased to welcome Kristopher Mychasiw to the Company as Head of Global Partnerships & Sales. Formerly a Partnership Executive for the Montreal Canadiens, Mychasiw will oversee partnerships and sales at Gamelancer Media.",CAD,GMNG.CN,CNW Group - Gamelancer Media Welcomes New Head of Global Partnerships & Sales
fin_news_nlp/yahoo_cad_tickers_news,https://ca.finance.yahoo.com/news/green-river-gold-corp-encounters-114500223.html,"Edmonton, Alberta--(Newsfile Corp. - February 6, 2023) - Green River Gold Corp. (CSE: CCR) (OTC Pink: CCRRF) (the ""Company"" or ""Green River"") is pleased to provide the following assay results for Zone 2 of the Quesnel Nickel Project.The Company has received assay results for hole WK-22-07 drilled to a depth of 93.3 meters in Zone 2 of the Deep Purple target. The drill hole is the 42nd hole drilled on the project to date ...",CAD,CCR.CN,"Newsfile - Green River Gold Corp. Encounters 19.77% Magnesium, 0.178% Nickel Along with Cobalt and Chromium over 93.3 Meters, with Mineralization Consistent from the Bedrock Surface for the 42nd Consecutive Drill Hole"
fin_news_nlp/yahoo_cad_tickers_news,https://ca.finance.yahoo.com/news/lobe-sciences-congratulates-australia-becoming-130000630.html,"Vancouver, British Columbia--(Newsfile Corp. - February 6, 2023) - Lobe Sciences Ltd. (CSE: LOBE) (OTCQB: LOBEF) (""Lobe"" or the ""Company""), a North American Biopharmaceutical company committed to discovering and developing psychedelic derived medicines for neurologic and brain disease today congratulated the people of Australia for the decision by the TGA (Therapeutic Goods Administration) to reschedule Psilocybin and MDMA so that trained physicians may prescribe the psychedelics for patients ac",CAD,LOBE.CN,Newsfile - Lobe Sciences Congratulates Australia for Becoming the First Nation to Approve the Medicinal Use of Psilocybin and MDMA
fin_news_nlp/yahoo_cad_tickers_news,https://ca.finance.yahoo.com/news/revive-therapeutics-secures-mdma-supply-130000043.html,"TORONTO, Feb. 06, 2023 (GLOBE NEWSWIRE) -- Revive Therapeutics Ltd. (“Revive” or the “Company”) (OTCQB: RVVTF) (CSE: RVV) (FRANKFURT: 31R), a specialty life sciences company focused on the research and development of therapeutics for medical needs and rare disorders, is pleased to announce it has entered into a supply agreement with PharmAla Biotech Holdings Inc. (“PharmAla”) (CSE: MDMA) to obtain PharmAla’s LaNeo, GMP source of 3,4-Methylenedioxy​methamphetamine (“MDMA”), for the development of",CAD,MDMA.CN,GlobeNewswire - Revive Therapeutics Secures MDMA Supply from PharmAla Biotech for MDMA Transdermal Patch Development
fin_news_nlp/yahoo_cad_tickers_news,https://ca.finance.yahoo.com/news/pharmala-named-exclusive-mdma-supplier-130000461.html,"PharmAla Biotech will provide MDMA to Revive Therapeutics in their development of an MDMA Microneedle PatchVANCOUVER, British Columbia, Feb. 06, 2023 (GLOBE NEWSWIRE) -- PharmAla Biotech Holdings Inc. (“PharmAla”)(CSE: MDMA) is pleased to announce that it has signed on to act as exclusive supplier of both GMP LaNeo MDMA and Engineering MDMA to Revive Therapeutics (CSE:RVV) (OTCQB: RVVTF). On Friday, February 3, Revive Therapeutics announced a licensing agreement with Pharmather Holdings to licen",CAD,MDMA.CN,GlobeNewswire - PharmAla Named Exclusive MDMA Supplier to Revive Therapeutics
fin_news_nlp/yahoo_cad_tickers_news,https://ca.finance.yahoo.com/news/provenance-gold-announces-appointment-jeffrey-113000054.html,"Vancouver, British Columbia--(Newsfile Corp. - February 6, 2023) - Provenance Gold Corp. (CSE: PAU) (OTCQB: PVGDF) (the ""Company"" or ""Provenance"") is pleased to announce that Jeffrey Alam has joined the Company as a senior strategic business advisor, to assist with building awareness of the Company, strategy and execution, and securing new investment. Based in Hong Kong, Mr. Alam has over 30 years of experience with AIG, Morgan Stanley and Noble Group (where he ...",CAD,PAU.CN,Newsfile - Provenance Gold Announces the Appointment of Jeffrey Alam as Senior Strategic Business Advisor
fin_news_nlp/yahoo_cad_tickers_news,https://ca.finance.yahoo.com/news/relevant-gold-intersects-83-8-120000004.html,"Relevant Gold Corp. (CSE:RGC)(the ""Company"" or ""Relevant Gold"") is pleased to announce the results of its initial 3,500m drilling exploration program on its Golden Buffalo Project, located in the Company's 15,095 hectare land package in the South Pass Gold Field, Wyoming, USA. Highlights of the program include 1 metre (core length) of 83.8 g/ton Au in Hole 22GB-012 and 14 of 26 holes reporting anomalous gold (>0.1 g/ton Au).",CAD,RGC.CN,ACCESSWIRE - Relevant Gold Intersects 83.8 g/ton Gold over 1 metre at Golden Buffalo
fin_news_nlp/yahoo_cad_tickers_news,https://ca.finance.yahoo.com/news/madrid-court-reduces-compensation-awarded-102339419.html,"MADRID (Reuters) -A Madrid court has cut the compensation Santander has to pay Italian banker Andrea Orcel by 8 million euros ($8.6 million) to 43.4 million euros in a dispute over the Spanish bank's withdrawal of an offer to make him CEO, a court document showed on Monday.  The court has, however, reiterated in its ruling dated Jan. 20 that the offer letter from Santander to Orcel represented a binding contract.  In one of the banking industry' biggest rows over pay, Orcel and Santander ended up in court after Spain's largest bank dropped plans to make the former UBS investment banker its CEO in January 2019.",CAD,ST.CN,Reuters - Madrid court cuts Santander's compensation to Andrea Orcel by $8.6 million
fin_news_nlp/yahoo_cad_tickers_news,https://ca.finance.yahoo.com/news/vpn-technologies-corp-announces-ai-131500904.html,"Vancouver, British Columbia--(Newsfile Corp. - February 6, 2023) - VPN Technologies Inc. (CSE: VPN) (OTCQB: DVPNF) (FSE: 6GQ1) (""VPN Technologies"", or the ""Company""), a provider of network privacy software, and privacy networking solutions, is pleased to announce the introduction of cutting-edge artificial intelligence (AI) and machine learning capabilities, complementing its existing suite of software development activities. This new business division of VPN will focus on AI enhanced software d",CAD,VPN.CN, - VPN Technologies Corp. Announces New AI Business Division
fin_news_nlp/yahoo_cad_tickers_news,https://ca.finance.yahoo.com/news/ahead-brookfield-asset-management-stock-093000642.html,"Brookfield Asset Management (TSX:BAM) stock is a good long-term core holding, especially now that it offers a decent dividend yield. The post What’s Ahead for Brookfield Asset Management Stock? appeared first on The Motley Fool Canada.",CAD,BAM.TO,The Motley Fool - What’s Ahead for Brookfield Asset Management Stock?
fin_news_nlp/yahoo_cad_tickers_news,https://ca.finance.yahoo.com/news/galiano-gold-reports-double-fatality-140000681.html,"Galiano Gold Inc. (""Galiano"" or the ""Company"") (TSX: GAU) (NYSE American: GAU) deeply regrets to report that two contractors have been fatally injured yesterday following an incident at the Asanko Gold Mine (""AGM"") located in Ghana, West Africa. The AGM is a 50:50 joint venture (""JV"") with Gold Fields Ltd (JSE: GFI) (NYSE: GFI), which is managed and operated by Galiano.",CAD,GAU.TO,CNW Group - GALIANO GOLD REPORTS DOUBLE FATALITY AT ITS ASANKO GOLD MINE
fin_news_nlp/yahoo_cad_tickers_news,https://ca.finance.yahoo.com/news/lithium-americas-corp-tse-lac-130207637.html,"If you want to know who really controls Lithium Americas Corp. ( TSE:LAC ), then you'll have to look at the makeup of...",CAD,LAC.TO,"Simply Wall St. - Lithium Americas Corp.'s (TSE:LAC) market cap touched CA$4.4b last week, benefiting both individual investors who own 54% as well as institutions"
fin_news_nlp/yahoo_cad_tickers_news,https://ca.finance.yahoo.com/news/2-canadian-stocks-could-soar-113000470.html,Magna International (TSX:MG) and TFI International (TSX:TFII) are value plays that recently picked up traction in January! The post 2 Canadian Stocks That Could Soar After a Recession appeared first on The Motley Fool Canada.,CAD,MG.TO,The Motley Fool - 2 Canadian Stocks That Could Soar After a Recession
fin_news_nlp/yahoo_cad_tickers_news,https://ca.finance.yahoo.com/news/metro-inc-announces-closing-aggregate-140100102.html,"METRO INC. (""Metro"") today announced the closing of the previously announced private placement offering of C$300 million aggregate principal amount of 4.657% Series K Senior Unsecured Notes due February 7, 2033 (the ""Series K Notes"").",CAD,MRU.TO,CNW Group - Metro Inc. Announces Closing of Aggregate C$300 Million Senior Unsecured Notes Offering
fin_news_nlp/yahoo_cad_tickers_news,https://ca.finance.yahoo.com/news/avanti-helium-announces-closing-overnight-140100380.html,"Avanti Helium Corp. (TSXV: AVN) (OTC: ARGYF) (""Avanti"" or the ""Company"") is pleased to announce the closing of its previously announced overnight marketed best efforts public offering (the ""Offering"") of units of the Company (""Units"") at a price of $0.70 per Unit, for aggregate gross proceeds of $6,324,965. Each Unit consists of one common share (a ""Common Share"") in the capital of the Company and one half of one transferable Common Share purchase warrant (each whole warrant, a ""Warrant""). Each",CAD,AVN.V,CNW Group - Avanti Helium Announces Closing of Overnight Marketed Best Efforts Public Offering of Units
