source,url,description,country,company,title
fin_news_nlp/yahoo_cad_tickers_news,https://ca.finance.yahoo.com/news/greencastle-announces-cancellation-stock-options-211500209.html,"Toronto, Ontario--(Newsfile Corp. - June 8, 2023) - Greencastle Resources Ltd. (TSXV: VGN) (""Greencastle"" or the ""Company"") announces that the Company has cancelled an aggregate of 378,933 stock options (the ""Options"") issued pursuant to its stock option plan on August 25, 2021. The Options were cancelled to ensure compliance with the limits set forth by Company's Stock Option Plan considering the decrease in the Company's capitalization from its normal course issuer bid.The Options were ...",CAD,VGN.V,Newsfile - Greencastle Announces Cancellation of Stock Options
fin_news_nlp/yahoo_cad_tickers_news,https://ca.finance.yahoo.com/news/hank-payments-completes-additional-private-200500699.html,"Toronto, Ontario--(Newsfile Corp. - June 15, 2023) - Hank Payments Corp. (TSXV: HANK) (""Hank"" or the ""Company"") is a North American leader in consumer Fintech Software-as-a-Service (""SaaS"") in the Banking-as-a-Service (""BaaS"") market segment. Hank platforms manage consumer cash flow and budgets on an automated basis using proprietary algorithms that collect, store and disburse cash as required to discharge obligations in a timely fashion. Hank vertical market technology brings to bear enhanced f",CAD,HANK.V,Newsfile - Hank Payments Completes Additional Private Placement Offering
fin_news_nlp/yahoo_cad_tickers_news,https://ca.finance.yahoo.com/news/heliostar-provides-technical-disclosure-210700139.html,"Vancouver, British Columbia--(Newsfile Corp. - June 14, 2023) - Heliostar Metals Ltd. (TSXV: HSTR) (OTCQX: HSTXF) (FSE: RGG1) (""Heliostar"" or the ""Company"") is issuing this press release to clarify certain of its previous disclosure regarding the Ana Paula Project.The Company previously disclosed statements which could constitute an economic analysis of its intended re-scoping of the Ana Paula Project (the ""Disclosure""). The Company wishes to retract the Disclosure. The Company has not completed",CAD,HSTR.V,Newsfile - Heliostar Provides Update on Technical Disclosure
fin_news_nlp/yahoo_cad_tickers_news,https://ca.finance.yahoo.com/news/ibex-technologies-inc-cve-ibt-140915216.html,IBEX Technologies (CVE:IBT) has had a great run on the share market with its stock up by a significant 26% over the...,CAD,IBT.V,Simply Wall St. - Is IBEX Technologies Inc.'s (CVE:IBT) Recent Stock Performance Tethered To Its Strong Fundamentals?
fin_news_nlp/yahoo_cad_tickers_news,https://ca.finance.yahoo.com/news/international-zeolite-awarded-contribution-government-221700082.html,"Vancouver, British Columbia--(Newsfile Corp. - June 14, 2023) - International Zeolite Corp. (TSXV: IZ) (OTC Pink: IZCFF) (FSE: ZEON) (IZ), an international supplier of sustainable zeolite-infused products for use in agriculture, is pleased to announce it has been chosen as one of the recipients of the Government of Canada-funded i.d.e.a. Fund™.As reported by Innovate Niagara: ""Today, 22 companies received non-repayable contributions of $660,000 from Innovate Niagara, in partnership with Innovati",CAD,IZ.V,Newsfile - International Zeolite Awarded Contribution from Government of Canada-Funded i.d.e.a. Fund(TM)
fin_news_nlp/yahoo_cad_tickers_news,https://ca.finance.yahoo.com/news/ion-energy-ltd-announces-participation-145400354.html,"Featuring Critical Metals Day on June 20, 2023 Toronto, Ontario--(Newsfile Corp. - June 15, 2023) - ION Energy Ltd (TSXV: ION) committed to building a diversified global portfolio of exploration and growth-stage battery mineral assets, is pleased to announce that it will be participating in THE Mining Investment Event of the North, June 19-21, 2023, (“THE Event”) at the Fairmont Chateau Frontenac and Voltigeurs de Quebec Armoury in Quebec City, Canada. Management ...",CAD,ION.V," - ION Energy Ltd Announces Participation in THE Mining Investment Event of the North, Canada's First Tier I Mining Conference, June 19-21 Quebec City"
fin_news_nlp/yahoo_cad_tickers_news,https://ca.finance.yahoo.com/news/klimat-x-finalizes-commercial-terms-110900834.html,"Klimat X Developments Inc. (""Klimat X"" or the ""Company"") (TSXV: KLX) a company that carries on the business of developing validated and verified carbon credits from afforestation and reforestation of degraded land areas and marine ecosystems, including mangroves, for sale into international voluntary carbon markets, is pleased to announce it has finalized binding commercial terms with a Fortune 100 (the ""Buyer"") company to pre-purchase carbon credits from the Company's Sierra Leone Rewilding Pro",CAD,KLX.V,CNW Group - Klimat X Finalizes Commercial Terms for Sierra Leone Pre-Purchase Agreement
fin_news_nlp/yahoo_cad_tickers_news,https://ca.finance.yahoo.com/news/power-play-market-herald-releases-181500548.html,The Power Play by The Market Herald has announced the release of a new interview with Leading Edge Materials discussing their latest news.,CAD,LEM.V,ACCESSWIRE - The Power Play by The Market Herald Releases a New Interview with Leading Edge Materials Discussing Their Latest News
fin_news_nlp/yahoo_cad_tickers_news,https://ca.finance.yahoo.com/news/leveljump-closes-900-000-private-145800834.html,"Toronto, Ontario--(Newsfile Corp. - June 15, 2023) - LevelJump Healthcare Corp. (TSXV: JUMP) (OTCQB: JMPHF) (FSE: 75J) (""LevelJump"" or the ""Company""), a Canadian leader in B2B telehealth solutions, is pleased to announce that, following receipt of TSXV approval, it has sold and closed the sale of 7,200,000 Units (each a ""Unit"") to an accredited investor at a subscription price of $0.125 per Unit for gross proceeds of $900,000. Each Unit consists of one common ...",CAD,JUMP.V,"Newsfile - LevelJump Closes $900,000 Private Placement"
fin_news_nlp/yahoo_cad_tickers_news,https://ca.finance.yahoo.com/news/groupe-lsl-pharma-increased-production-215400441.html,"BOUCHERVILLE, Quebec, June 20, 2023 (GLOBE NEWSWIRE) -- GROUPE LSL PHARMA INC (TSXV: LSL) - Groupe LSL Pharma Inc. (""the Company"" or "" LSL Pharma Group ""), a Canadian integrated pharmaceutical company, is pleased to announce that its total annual production capacity will be increased by approximately 35% to 40% as early as 2023, and further for 2024 and 2025, with its new facility in La Pocatière and a series of manufacturing optimizations in Upton. The Company would also like to point out that",CAD,LSL.V,GlobeNewswire - Groupe LSL Pharma Update on Increased Production Capacity and Anticipated Sales Growth
fin_news_nlp/yahoo_cad_tickers_news,https://ca.finance.yahoo.com/news/jameson-cell-technology-shows-promise-133000839.html,"Luca Mining Corporation (the “Company” or “Luca”, formerly Altaley Mining Corporation) is pleased to provide the following update on metallurgical test work to improve precious metals recoveries at...",CAD,LUCA.V,News Direct - Jameson Cell Technology Shows Promise in Improving Base and Precious Metals Recoveries at Luca’s Campo Morado Mine
fin_news_nlp/yahoo_cad_tickers_news,https://ca.finance.yahoo.com/news/lucero-energy-corp-announces-us-210000275.html,"Lucero Energy Corp. (""Lucero"" or the ""Company"") (TSXV: LOU) (OTCQB: PSHIF) is pleased to announce the Company has executed and closed a definitive purchase and sale agreement with an arm's length purchaser, to divest of certain non-strategic, non-operated assets within Lucero's North Dakota Bakken/Three Forks play (the ""Disposition"" and ""Disposed Assets"") for cash consideration of C$140.2 million1 (US$104.6 million) before customary closing adjustments2. The effective date of the Disposition is",CAD,LOU.V,"CNW Group - LUCERO ENERGY CORP. ANNOUNCES US$104.6 MILLION ASSET DISPOSITION, REVISED 2023 GUIDANCE AND NORMAL COURSE ISSUER BID"
fin_news_nlp/yahoo_cad_tickers_news,https://ca.finance.yahoo.com/news/lycos-energy-inc-announces-appointment-211900365.html,"Calgary, Alberta--(Newsfile Corp. - June 14, 2023) - Lycos Energy Inc. (TSXV: LCX) (""Lycos"" or the ""Company"") is pleased to announce that Geri Greenall was elected to the Company's board of directors at the annual general and special meeting (the ""Annual Meeting"") of shareholders of Lycos held earlier today.Ms. Greenall is currently a director of Kelt Exploration Ltd. and the Chief Financial Officer of Spartan Delta Corp. She has over 22 years of experience ...",CAD,LCX.V,Newsfile - Lycos Energy Inc. Announces Appointment of New Director
fin_news_nlp/yahoo_cad_tickers_news,https://ca.finance.yahoo.com/news/greenlane-renewables-announces-appointments-executive-203000069.html,"Greenlane Renewables Inc. (""Greenlane"") (TSX: GRN) (FSE: 52G) today announces the appointment of Brad Douville, current Chief Executive Officer (""CEO""), to the newly created role of Vice Chair of the Board of Directors, and a continuing full time executive role as ""Executive Vice Chair"" with a mandate to support management in advancing key strategic initiatives, and the appointment of Ian Kane as President and CEO to lead the Company's profitable execution of its new strategic plan. Both appoint",CAD,GRN.TO,CNW Group - Greenlane Renewables Announces Appointments of Executive Vice Chair and President and Chief Executive Officer as part of Strategic Growth Plan
fin_news_nlp/yahoo_cad_tickers_news,https://ca.finance.yahoo.com/news/pet-valu-holdings-ltd-announces-132200573.html,"Pet Valu Holdings Ltd. (""Pet Valu"" or the ""Company"") (TSX: PET), the leading Canadian specialty retailer of pet food and pet-related supplies, announced today that the previously announced secondary bought deal offering (the ""Offering"") of 4,690,000 common shares of the Company (the ""Common Shares"") by PV Holdings S.à r.l., Roark Capital Partners II AIV AG, L.P., RCPS Equity Cayman LP and Roark Capital Partners Parallel II AIV AG, L.P. (collectively, the ""Selling Shareholders"") at a price of $32",CAD,PET.TO,CNW Group - Pet Valu Holdings Ltd. Announces Closing of C$150.3 Million Secondary Bought Deal Offering
fin_news_nlp/yahoo_cad_tickers_news,https://ca.finance.yahoo.com/news/valeura-energy-inc-announces-result-064500254.html,"Valeura Energy Inc. (TSX:VLE) (""Valeura"" or the ""Corporation""), an upstream oil and gas company with assets in the Gulf of Thailand and the Thrace Basin of Turkey, is pleased to provide the voting results from its annual and special meeting of shareholders held on June 20, 2023.",CAD,VLE.TO,ACCESSWIRE - Valeura Energy Inc. Announces Result of AGM
fin_news_nlp/yahoo_cad_tickers_news,https://ca.finance.yahoo.com/news/arbor-metals-provides-lithium-market-060000922.html,"Map of Arbor Metal Corp.'s Jarnet Lithium Claims Arbor's Jarnet Lithium Mine is located in the James Bay region of Quebec and is comprised of 47 map-designated claims that cover an approximate area of 3,759 hectares. VANCOUVER, British Columbia, June 21, 2023 (GLOBE NEWSWIRE) -- Arbor Metals Corp. (“Arbor” or the “Company”) (TSXV: ABR, FWB: 432) is pleased to provide stakeholders with its overview of the lithium market's key developments thus far in 2023. As the demand for lithium continues to s",CAD,ABR.V,GlobeNewswire - Arbor Metals Provides a Lithium Market 2023 Year-To-Date Review
fin_news_nlp/yahoo_cad_tickers_news,https://ca.finance.yahoo.com/news/early-warning-report-issued-pursuant-120000316.html,"Intercap Equity Inc. (""Intercap"") has acquired 5,714,285 common shares in E Automotive Inc. d/b/a E INC. (""E INC."") (TSX: EINC). This press release is being disseminated as required by National Instrument 62–103 – The Early Warning System and Related Take Over Bids and Insider Reporting Issuers in connection with the filing of an early warning report.",CAD,EINC.TO,CNW Group - Early Warning Report Issued Pursuant to National Instrument 62-103 Intercap Acquires Shares of E INC. (TSX: EINC)
fin_news_nlp/yahoo_cad_tickers_news,https://ca.finance.yahoo.com/news/givex-announces-named-omnichannel-gift-150000245.html,"Givex Corp. (TSX: GIVX) (OTCQX: GIVXF) announced today that Givex has been named the omni-channel gift card provider for Finland's wine, beer and spirits distributor Alko.",CAD,GIVX.TO,"CNW Group - Givex Announces it Has Been Named Omnichannel Gift Card Provider for 400-Unit Finnish Wine, Beer and Spirits Distributor Alko"
fin_news_nlp/yahoo_cad_tickers_news,https://ca.finance.yahoo.com/news/platinum-group-metals-ltd-engages-070000004.html,"Vancouver, British Columbia and Johannesburg, South Africa--(Newsfile Corp. - June 21, 2023) - Platinum Group Metals Ltd. (TSX: PTM) (NYSE American: PLG) (""Platinum Group"", ""PTM"" or the ""Company"") reports that Lion Battery Technologies Inc. (""Lion"") has engaged The Battery Innovation Center (""BIC"") in Newberry, Indiana to help drive commercialization of its next generation platinum and palladium based battery chemistries. Lion is advancing both proprietary lithium-sulfur and enhanced lithium-ion",CAD,PTM.TO,Newsfile - Platinum Group Metals Ltd. Engages The Battery Innovation Center (BIC) for Testing and Scale-Up of PGM Based Lithium-Sulfur and Lithium-Ion Battery Chemistries Developed by Subsidiary Lion Battery Technologies Inc.
fin_news_nlp/yahoo_cad_tickers_news,https://ca.finance.yahoo.com/news/aya-gold-silver-announces-election-184100628.html,"Aya Gold & Silver Inc. (TSX: AYA) (OTCQX: AYASF) (""Aya"" or the ""Corporation"") is pleased to announce that all nominees listed in the management proxy circular were elected as directors of Aya at its annual general meeting of shareholders (""AGM"") held today.",CAD,AYA.TO,CNW Group - Aya Gold & Silver Announces Election of Directors
fin_news_nlp/yahoo_cad_tickers_news,https://ca.finance.yahoo.com/news/calibre-reports-positive-higher-grade-100000531.html,"VANCOUVER, British Columbia, June 21, 2023 (GLOBE NEWSWIRE) -- Calibre Mining Corp. (TSX: CXB; OTCQX: CXBMF) (the ""Company"" or ""Calibre"") is pleased to announce assay results from the 2023, near-mine discovery, delineation, and resource expansion drill program at its 100% owned Pan Mine (“Pan”), located on the prolific Battle Mountain – Eureka gold trend, Nevada. Results at the Palomino target located immediately south of the open pit operation indicate higher grades than demonstrated at the Pan",CAD,CXB.TO,"GlobeNewswire - Calibre Reports Positive Higher-Grade Near Surface Drilling at Its Pan Gold Mine, Nevada; Initial Results Include 3.84 g/t Gold over 15.2 metres and 2.08 g/t Gold Over 27.4 Metres"
fin_news_nlp/yahoo_cad_tickers_news,https://ca.finance.yahoo.com/news/centamin-plc-announces-standard-form-091500779.html,"TR-1: Standard form for notification of major holdings PERTH, AUSTRALIA / ACCESSWIRE / June 21, 2023 / Issuer DetailsISIN JE00B5TT1872 Issuer Name Centamin PLC UK or Non-UK Issuer UK 2. Reason for Notification An acquisition or disposal ...",CAD,CEE.TO,ACCESSWIRE - Centamin PLC Announces Standard form for Notification of Major Holdings
fin_news_nlp/yahoo_cad_tickers_news,https://ca.finance.yahoo.com/news/cipher-neutron-dynacert-partner-signs-090000503.html,"TORONTO, June 21, 2023--(TSX: DYA) (OTCQX: DYFSF) (FRA: DMJ) dynaCERT Inc. (""dynaCERT"" or the ""Company"") and its AEM Green Electrolyser partner, Cipher Neutron Inc. (""Cipher Neutron"", ""CN"") are pleased to jointly announce that Cipher Neutron has concluded a significant Memorandum of Understanding (the ""MOU"") with Technomak Process Systems FZC (""Technomak’). The MOU provides that Cipher Neutron will manufacture state-of-the-art AEM Green Electrolysers to produce Green Hydrogen for Technomak’s own",CAD,DYA.TO,"Business Wire - Cipher Neutron, dynaCERT’s Partner, Signs MOU Agreement with Technomak to Market AEM Green Hydrogen Electrolysers"
fin_news_nlp/yahoo_cad_tickers_news,https://ca.finance.yahoo.com/m/c429d057-72f0-337c-ab69-02637a8d4696/is-shopify-stock-a-buy-now%3F.html,"Shopify (NYSE: SHOP) recently found itself in a hole with its shipping logistics business and made the grown-up decision to sell it instead of continuing to dig.  On June 6, Shopify said it completed the sale of its shipping divisions to Flexport.  Shopify was already an investor in Flexport, and it believes that Flexport is a ""mission-aligned partner.""",CAD,SHOP.TO,Motley Fool - Is Shopify Stock a Buy Now?
fin_news_nlp/yahoo_cad_tickers_news,https://ca.finance.yahoo.com/news/graphite-one-closes-buyback-net-110000964.html,"Graphite One Inc. (TSXV: GPH) (OTCQX: GPHOF) (""Graphite One"" or the ""Company""), planning a complete domestic U.S. supply chain for advanced graphite materials, announces the Company has reached a definitive agreement to buy back the 1% Net Smelter Production Royalty (""NSR"") from Ronald C. Sheardown (""Sheardown""), which was retained by Sheardown following the June 11, 2015 sale of mining claims to the Company. The buyback cancels the Sheardown NSR which was attached to 133 Alaska state claims own",CAD,GPH.V,CNW Group - Graphite One Closes the Buyback of Net Smelter Production Royalty
fin_news_nlp/yahoo_cad_tickers_news,https://ca.finance.yahoo.com/news/group-eleven-further-expands-mineralized-100000294.html,"Group Eleven Resources Corp. (TSXV: ZNG) (OTC: GRLVF) (FRA: 3GE) (""Group Eleven"" or the ""Company"") is pleased to announce assay results from three (3) latest step-out holes at its Ballywire Zn-Pb-Ag discovery (""Ballywire""), PG West Project (""PG West"", 100%-interest), Ireland. Each hole returned significant mineralization (including massive sulphides), expanding the footprint of known mineralization and demonstrating potential for further growth.",CAD,ZNG.V,"CNW Group - Group Eleven Further Expands Mineralized Footprint, and Intersects Elevated Cobalt and Nickel, at Ballywire Zinc-Lead-Silver Discovery, Ireland"
fin_news_nlp/yahoo_cad_tickers_news,https://ca.finance.yahoo.com/news/halcones-precious-metals-announces-private-110000187.html,"THIS NEWS RELEASE IS INTENDED FOR DISTRIBUTION IN CANADA ONLY AND IS NOT AUTHORIZED FOR DISTRIBUTION TO UNITED STATES NEWSWIRE SERVICES OR FOR DISSEMINATION IN THE UNITED STATES. TORONTO, June 21, 2023 (GLOBE NEWSWIRE) -- Halcones Precious Metals Corp. (TSXV: HPM) (the “Company” or “Halcones”) announces a non-brokered private placement financing of up to 40,000,000 Units to be priced at $0.05 per Unit for gross proceeds of up to $2,000,000 (the “Offering”). Each Unit will be comprised of one com",CAD,HPM.V,GlobeNewswire - Halcones Precious Metals Announces Private Placement Offering
fin_news_nlp/yahoo_cad_tickers_news,https://ca.finance.yahoo.com/news/integra-provides-corporate-nevada-projects-104500017.html,"VANCOUVER, British Columbia, June 21, 2023 (GLOBE NEWSWIRE) -- Integra Resources Corp. (“Integra” or the “Company”) (TSXV: ITR; NYSE American: ITRG) is pleased to provide a corporate update regarding several of the Company’s projects located in western Nevada including the Wildcat Project, the Mountain View Project, the Ocelot Project, the Dune Project, the Eden Project, and the Marr Project (together, the “Nevada Projects”). The Company was provided notice by Royalty Consolidation Company, LLC,",CAD,ITR.V,GlobeNewswire - Integra Provides Corporate Update for Nevada Projects
fin_news_nlp/yahoo_cad_tickers_news,https://ca.finance.yahoo.com/news/b2gold-announces-updated-significantly-increased-120000809.html,"Figure 1 Fekola Complex Overview VANCOUVER, British Columbia, June 21, 2023 (GLOBE NEWSWIRE) -- B2Gold Corp. (TSX: BTO, NYSE AMERICAN: BTG, NSX: B2G) (“B2Gold” or the “Company”) is pleased to announce an updated and significantly increased Mineral Resource estimate for the Anaconda Area (the “June 2023 Mineral Resource estimate”), comprised of the Menankoto permit, the Bantako North permit, and the Bakolobi permit, located approximately 20 kilometers (“km”) from the Fekola Mine. The updated Mine",CAD,BTO.TO,"GlobeNewswire - B2Gold Announces Updated and Significantly Increased Mineral Resource Estimate for the Anaconda Area, Located Near the Fekola Mine, Mali"
fin_news_nlp/yahoo_cad_tickers_news,https://ca.finance.yahoo.com/news/bmo-announces-cash-reinvested-distributions-123000833.html,"BMO Asset Management Inc., as manager of the BMO ETFs, and BMO Investments Inc., as manager of the BMO Mutual Funds, today announced the June 2023 cash and reinvested distributions for unitholders of BMO ETFs and unitholders of ETF Series units of the BMO Mutual Funds (ETF Series) that distribute monthly and quarterly, as set out in the tables below. Unitholders of record of the BMO ETFs and ETF Series at the close of business on June 29, 2023 will receive cash or reinvested distributions payabl",CAD,BMO.TO,CNW Group - BMO Announces Cash and Reinvested Distributions for Certain BMO ETFs and ETF Series of BMO Mutual Funds for June 2023
fin_news_nlp/yahoo_cad_tickers_news,https://ca.finance.yahoo.com/news/crescita-therapeutics-announces-results-annual-113000479.html,"LAVAL, Quebec, June 21, 2023--2023 AGM voting Results",CAD,CTX.TO,Business Wire - Crescita Therapeutics Announces the Results of its Annual General and Special Meeting of Shareholders
fin_news_nlp/yahoo_cad_tickers_news,https://ca.finance.yahoo.com/news/dye-durham-announces-completion-substantial-110000459.html,"Dye & Durham Limited (""Dye & Durham"") (TSX: DND) announced today that it will take up and purchase for cancellation 882,352 of its common shares (the ""Common Shares"") at a purchase price of $17.00 per Common Share under Dye & Durham's substantial issuer bid (the ""Offer""), for aggregate consideration of approximately $15.0 million.",CAD,DND.TO,CNW Group - Dye & Durham Announces Completion of Substantial Issuer Bid
fin_news_nlp/yahoo_cad_tickers_news,https://ca.finance.yahoo.com/news/else-nutrition-products-approved-us-120000429.html,"Else Toddler and Else Kids Products Now Billing Under New Healthcare Common Procedure Coding System (HCPCS) Codes Broadening Accessibility for consumers nationwide. HCPCS Codes HCPCS Codes VANCOUVER, British Columbia, June 21, 2023 (GLOBE NEWSWIRE) -- ELSE NUTRITION HOLDINGS INC. (BABY) (BABYF) (0YL.F) (""Else"" or the ""Company""), proudly announces that four of its products, Else Kids Vanilla, Else Kids Cocoa, and Else Toddler Organic & Else Toddler Omega, have been officially approved for US fede",CAD,BABY.TO,GlobeNewswire - Else Nutrition Products Approved for US Federal Insurance Covered Under the Center for Medicare & Medicaid Services
fin_news_nlp/yahoo_cad_tickers_news,https://ca.finance.yahoo.com/m/465e8814-6939-3eb2-8977-4b96526ee202/3-top-high-yield-dividend.html,"Energy infrastructure companies Enbridge (NYSE: ENB), TC Energy (NYSE: TRP), and Pembina Pipeline (NYSE: PBA) all pay attractive dividends that have steadily grown over the years.  Enbridge currently offers a dividend yield right around 7%.  While its payout fluctuates a bit with foreign exchange rates, the company has an elite track record of growing its dividend.",CAD,ENB.TO,Motley Fool - 3 Top High-Yield Dividend Stocks You Won't Want to Miss
fin_news_nlp/yahoo_cad_tickers_news,https://ca.finance.yahoo.com/news/enthusiast-gaming-hosts-pocket-gamer-110000060.html,"Expansion into Dubai Increases Global Footprint, Enhancing Thought Leadership in Growing MENA MarketLOS ANGELES, June 21, 2023 (GLOBE NEWSWIRE) -- Enthusiast Gaming Holdings Inc. (“Enthusiast Gaming” or the “Company”) (NASDAQ: EGLX; TSX: EGLX), an independent gaming media and entertainment company, today announced that its most recent event, Pocket Gamer Connects (“PGC”) Seattle, drew record attendance as it looks to host its first-ever event in Dubai and its second annual PGC Toronto event over",CAD,EGLX.TO,"GlobeNewswire - Enthusiast Gaming Hosts Pocket Gamer Connects Seattle with Record Attendance, Dubai and Toronto Events to Follow"
fin_news_nlp/yahoo_cad_tickers_news,https://ca.finance.yahoo.com/news/first-mining-advances-exploration-identifies-110000578.html,"First Mining Gold Corp. (""First Mining"" or the ""Company"") (TSX: FF) (OTCQX: FFMGF) (FRANKFURT: FMG) is pleased to report exploration results from the Swain and Sol d'Or properties in the Birch-Uchi Greenstone Belt Project (""BUGB Project"" or the ""Project"") located in northwestern Ontario, Canada, near the Company's Springpole Gold Project (the ""Springpole Project""). Results from field and drilling programs on these two properties have identified new gold mineralization in favourable geologic sett",CAD,FF.TO,CNW Group - First Mining Advances Exploration and Identifies New Targets at the Birch-Uchi Greenstone Belt Project
fin_news_nlp/yahoo_cad_tickers_news,https://ca.finance.yahoo.com/news/forsys-obtains-environmental-clearance-certificate-110000821.html,"TORONTO, June 21, 2023 (GLOBE NEWSWIRE) -- Forsys Metals Corp. (TSX: FSY) (FSE: F2T) (NSX: FSY) (“Forsys” or the “Company”) is pleased to announce that it has obtained the renewal of the Environmental Clearance Certificate (ECC) from the Ministry of Environment, Forestry and Tourism for the Company’s Norasa Uranium Project (“Norasa Project” or “Norasa”) located in Namibia, Africa. The Norasa Project is wholly-owned by the Company’s subsidiary Valencia Uranium (Pty) Ltd. (“Valencia Uranium”) and",CAD,FSY.TO,"GlobeNewswire - Forsys Obtains Environmental Clearance Certificate Renewal for the Norasa Project, Namibia"
