source,url,description,country,company,title
fin_news_nlp/yahoo_cad_tickers_news,https://ca.finance.yahoo.com/news/drilling-commences-high-grade-gold-130000756.html,"Image 1 Reverse Circulation drilling at the Catia prospect at the Bellary Dome Project, March 2023 Figure 1 Novo’s Pilbara tenure, showing the Bellary Dome Project in the South Pilbara Figure 2: Examples of high-grade gold mineralised quartz veins from surface mapping at Catia R00471 - quartz vein with malachite - 556 ppm Au Figure 2: Examples of high-grade gold mineralised quartz veins from surface mapping at Catia R00468 - gossanous quartz vein - 117 ppm Au Figure 3 The Bellary Dome Project sh",CAD,NVO.TO,GlobeNewswire - Drilling Commences at High-Grade Gold Catia Prospect at Bellary Dome
fin_news_nlp/yahoo_cad_tickers_news,https://ca.finance.yahoo.com/news/discoveries-equinor-eni-lead-oil-122512308.html,"Apart from Equinor (EQNR) and Eni (E), ConocoPhillips (COP), Pembina Pipeline (PBA) and Petrobras (PBR) hogged attention during the week.",CAD,PPL.TO,Zacks - Discoveries by Equinor and Eni Lead Oil & Gas Stock Roundup
fin_news_nlp/yahoo_cad_tickers_news,https://ca.finance.yahoo.com/m/c37bc2d7-7035-368d-b709-1131c0f99783/here's-when-i-see-cannabis.html,"Since 2021, shares of Tilray Brands (NASDAQ: TLRY) and Canopy Growth (NASDAQ: CGC) are down 70% and 92%, respectively.  One thing that can and often does get investors bullish about pot stocks is when there's the hope that legalization in the U.S. might be on the horizon.  A classic example of that is what happened when Joe Biden was elected president in 2020 and there was optimism in the industry that with a Democrat in power, it might lead to some progress on marijuana reform.",CAD,TLRY.TO,Motley Fool - Here's When I See Cannabis Stocks Being Hot Buys Again
fin_news_nlp/yahoo_cad_tickers_news,https://ca.finance.yahoo.com/news/stonegate-capital-partners-initiates-coverage-134200429.html,"Dallas, Texas--(Newsfile Corp. - March 22, 2023) - Los Andes Copper, LTD (TSXV: LA): Stonegate Capital Partners initiates their coverage on Los Andes Copper, LTD. The full report can be accessed by clicking on the following link: https://stonegateinc.com/reports/LA_V_Initiation.pdf. To view the full announcement, including downloadable images, bios, and more, click here. ...",CAD,LA.V,"Newsfile - Stonegate Capital Partners Initiates Coverage on Los Andes Copper, LTD. (LA)"
fin_news_nlp/yahoo_cad_tickers_news,https://ca.finance.yahoo.com/news/nubeva-announces-strong-financial-results-134300625.html,"SAN JOSE, Calif., March 22, 2023 (GLOBE NEWSWIRE) -- Nubeva Technologies (TSX-V: NBVA, OTCQB: NBVAF)(“Nubeva” or the “Company”), today reported strong year over year results in Revenue, Gross Margins, Net Earnings and Expenses for the first 9 months of its fiscal year as well as its most recent 3-month period. ""We are thrilled to report such outstanding results,"" said Randy Chou, CEO of Nubeva. ""This success is a testament to the value of our breakthrough Ransomware Reversal product, our team’s",CAD,NBVA.V,GlobeNewswire - Nubeva Announces Strong Financial Results for Fiscal Q3 2023
fin_news_nlp/yahoo_cad_tickers_news,https://ca.finance.yahoo.com/news/li-ft-closes-35-million-140600347.html,"Vancouver, British Columbia--(Newsfile Corp. - March 22, 2023) - Li-FT Power Ltd. (CSE: LIFT) (FSE: WS0) (""Li-FT"" or the ""Company"") is pleased to announce that it has closed the previously announced brokered private placement of 2,602,500 common shares of the Company issued on a ""flow-through"" basis (each a ""Flow-Through Share"") at a price of $13.45 per Flow-Through Share for aggregate gross proceeds of $35,003,625, which includes the full exercise of the option granted to the ...",CAD,LIFT.CN,Newsfile - Li-FT Closes $35 Million Private Placement of Flow-Through Shares
fin_news_nlp/yahoo_cad_tickers_news,https://ca.finance.yahoo.com/news/parcelpal-provides-initial-2023-corporate-131500078.html,"Vancouver, British Columbia--(Newsfile Corp. - March 22, 2023) - ParcelPal Logistics Inc. (OTCQB: PTNYF) (CSE: PKG) (FSE: PT0A) (the ""Company"" or ""ParcelPal"") is pleased to provide shareholders with the following initial corporate update, with more updates to follow in the coming days and weeks.The Company has continued to make solid improvements in regard to its operational performance. The Company has sustained year over year revenue growth and, most importantly, 95% of our reported revenues a",CAD,PKG.CN,Newsfile - ParcelPal Provides Initial 2023 Corporate Update and Highlights Milestones
fin_news_nlp/yahoo_cad_tickers_news,https://ca.finance.yahoo.com/news/manhattan-da-bragg-targets-trump-152432818.html,"(Bloomberg) -- As Manhattan District Attorney Alvin Bragg appears poised to indict former President Donald Trump, some of the prosecutor’s most prominent New York critics have gathered under one roof.Most Read from BloombergBomb Threat Called In to New York Court Where Trump Hearing HeldFed Caught Between Inflation and Bank CrisisA New Chapter of Capitalism Emerges From the Banking CrisisXi Aligns With Putin Against US, But Hesitates on Gas DealFirst Republic Rescue May Rely on US Backing to Rea",CAD,BRAG.TO,"Bloomberg - As Manhattan DA Bragg Targets Trump, His Rivals Are Teaming Up"
fin_news_nlp/yahoo_cad_tickers_news,https://ca.finance.yahoo.com/news/ovintiv-inc-tse-ovv-stock-150530867.html,"Ovintiv (TSE:OVV) has had a rough three months with its share price down 27%. However, stock prices are usually driven...",CAD,OVV.TO,Simply Wall St. - Ovintiv Inc.'s (TSE:OVV) Stock Has Been Sliding But Fundamentals Look Strong: Is The Market Wrong?
fin_news_nlp/yahoo_cad_tickers_news,https://ca.finance.yahoo.com/news/companies-platinum-group-metals-tse-145647310.html,"We can readily understand why investors are attracted to unprofitable companies. For example, biotech and mining...",CAD,PTM.TO,Simply Wall St. - Companies Like Platinum Group Metals (TSE:PTM) Are In A Position To Invest In Growth
fin_news_nlp/yahoo_cad_tickers_news,https://ca.finance.yahoo.com/news/primo-board-responds-legions-submission-154400637.html,"Primo Water Corporation (NYSE: PRMW) (TSX: PRMW) (the ""Company"" or ""Primo""), a leading provider of sustainable drinking water solutions in North America and Europe, today announced that the Primo Board of Directors (the ""Board"") has exercised its discretion under Primo's Bylaws to waive some of the deficiencies in the invalid nomination notice (the ""Notice"") submitted by Legion Partners Holdings, LLC (together with its affiliates, ""Legion"") with respect to the election of directors at the Compan",CAD,PRMW.TO,"CNW Group - Primo Board Responds to Legion's Late Submission of 43-Page ""Supplemental"" Disclosure that Attempts to Correct Deficiencies in Legion's Director Nomination Notice"
fin_news_nlp/yahoo_cad_tickers_news,https://ca.finance.yahoo.com/news/ritchie-bros-rba-loses-13-133501868.html,"Ritchie Bros. (RBA) has become technically an oversold stock now, which implies exhaustion of the heavy selling pressure on it. This, combined with strong agreement among Wall Street analysts in revising earnings estimates higher, indicates a potential trend reversal for the stock in the near term.",CAD,RBA.TO,"Zacks - Ritchie Bros. (RBA) Loses -13.38% in 4 Weeks, Here's Why a Trend Reversal May be Around the Corner"
fin_news_nlp/yahoo_cad_tickers_news,https://ca.finance.yahoo.com/news/know-beyond-why-tilray-brands-130001840.html,"Zacks.com users have recently been watching Tilray Brands, Inc. (TLRY) quite a bit. Thus, it is worth knowing the facts that could determine the stock's prospects.",CAD,TLRY.TO,"Zacks - Here is What to Know Beyond Why Tilray Brands, Inc. (TLRY) is a Trending Stock"
fin_news_nlp/yahoo_cad_tickers_news,https://ca.finance.yahoo.com/news/builders-capital-mortgage-corp-announces-164200611.html,"Calgary, Alberta--(Newsfile Corp. - March 22, 2023) - Builders Capital Mortgage Corp. (TSXV: BCF) (the ""Company"") announced today that its board of directors has declared a distribution of $0.1972 per Class A Non-Voting share of the Company. The distribution will be paid on April 28, 2023 to holders of Class A Non-voting shares of record on March 31, 2023.The amount of the distribution is equivalent to approximately $0.80 per Class A Non-Voting share, ...",CAD,BCF.V,Newsfile - Builders Capital Mortgage Corp. Announces Class a Non-Voting Share Distribution
fin_news_nlp/yahoo_cad_tickers_news,https://ca.finance.yahoo.com/news/gold-basin-52-week-high-145100934.html,Gold Basin Resources Corporation (V.GXX) hit a new 52-week high of 30 cents Wednesday. Gold Basin today ...,CAD,DLP.V, - Gold Basin at 52-Week High on News
fin_news_nlp/yahoo_cad_tickers_news,https://ca.finance.yahoo.com/news/playmaker-capital-inc-brand-futbol-150800673.html,"TORONTO, March 22, 2023--Playmaker Capital Inc.'s Futbol Sites Named Official Digital Agency & Commercial Partner for the Argentine Football Association",CAD,PMKR.V,Business Wire - Playmaker Capital Inc. Brand Futbol Sites Named Official Digital Agency and Commercial Partner for the Argentine Football Association in North America
fin_news_nlp/yahoo_cad_tickers_news,https://ca.finance.yahoo.com/news/southern-silver-provides-mineral-includes-170300737.html,"Mineral Resource Update:Indicated 140Mozs AgEq or 2.3Blbs ZnEq: 42.7Mozs Ag, 364Mlbs Pb, and 903Mlbs Zn; andInferred 210Mozs AgEq or 3.5Blbs ZnEq: 80.0Mozs Ag, 571Mlbs Pb, and 1,029Mlbs ZnVancouver, British Columbia--(Newsfile Corp. - March 22, 2023) - Southern Silver Exploration Corp. (TSXV: SSV) (""Southern"") reports that Kirkham Geosystems Ltd. has completed an update of its independent Mineral Resource Estimate (""MRE"") on the Cerro Las Minitas project in Durango State, Mexico. The updated MRE",CAD,SSV.V,Newsfile - Southern Silver Provides Mineral Resource Update That Includes Newly Identified Shallow High-Grade Deposit at the Cerro Las Minitas Project
fin_news_nlp/yahoo_cad_tickers_news,https://ca.finance.yahoo.com/news/archer-exploration-creating-leading-canadian-150000386.html,"Vancouver, British Columbia--(Newsfile Corp. - March 22, 2023) - Archer Exploration Corp. (CSE: RCHR) is an exploration and development company focused on nickel sulphides with the objective of identifying and developing Tier 1 sources of nickel units to supply expanding global green-energy initiatives.The company's flagship core asset is the Grasset Project, located within the Abitibi greenstone belt about 55 kilometres west-northwest of Matagami, Quebec and with an initial mineral resource of",CAD,RCHR.CN," - Archer Exploration: Creating a Leading Canadian Nickel Exploration & Development Company, CEO Clips Video"
fin_news_nlp/yahoo_cad_tickers_news,https://ca.finance.yahoo.com/news/fineqia-announces-partnership-paris-blockchain-123000325.html,"Fineqia International Inc. (the ""Company"" or ""Fineqia"") (CSE: FNQ) (OTC: FNQQF) (Frankfurt: FNQA), a digital asset business that builds and targets investments in early and growth stage technology companies participating in the next generation of the Internet, is excited to announce its partnership with Paris Blockchain Week, an international event that brings together leading blockchain experts and innovators from around the world.",CAD,FNQ.CN,CNW Group - Fineqia Announces Partnership with Paris Blockchain Week to Accelerate Digital Asset Innovation
fin_news_nlp/yahoo_cad_tickers_news,https://ca.finance.yahoo.com/news/drilling-resumes-manicouagan-critical-strategic-155500830.html,"St-Georges Eco-Mining Corp. (CSE:SX)(OTCQB:SXOOF)(FSE:85G1)is pleased to provide an update on recent work accomplished and ongoing activities, including the resumption of drilling, at the Manicouagan Critical and Strategic Minerals Project.",CAD,SX.CN,ACCESSWIRE - Drilling Resumes at Manicouagan Critical & Strategic Minerals Project
fin_news_nlp/yahoo_cad_tickers_news,https://ca.finance.yahoo.com/news/adcore-wins-microsoft-advertising-2022-170500683.html,"Adcore Inc. (the ""Company"" or ""Adcore"") (TSX:ADCO)(OTCQX:ADCOF)(FSE:ADQ)(TSX:ADCO-WT), a leading e-commerce advertising management and automation platform that leverages digital marketing in an effortless and accessible way (""Effortless Marketing""), is pleased to announce that Adcore has been named as the winner of Microsoft's Advertising 2022 Channel Partner of the Year Award for Europe.",CAD,ADCO.TO,ACCESSWIRE - Adcore Wins Microsoft’s Advertising 2022 Channel Partner of the Year Award for EMEA
fin_news_nlp/yahoo_cad_tickers_news,https://ca.finance.yahoo.com/news/dollarama-stock-buy-q4-earnings-163000591.html,Dollarama stock has stayed resilient and notably outperformed markets in this bear market. The post Is Dollarama Stock a Buy Before its Q4 Earnings? appeared first on The Motley Fool Canada.,CAD,DOL.TO,The Motley Fool - Is Dollarama Stock a Buy Before its Q4 Earnings?
fin_news_nlp/yahoo_cad_tickers_news,https://ca.finance.yahoo.com/news/2-best-tsx-stocks-invest-160000263.html,"These two TSX stocks are a defensive addition to your portfolio in this volatile environment. The post 2 of the Best TSX Stocks to Invest $1,000 in Right Now appeared first on The Motley Fool Canada.",CAD,DOL.TO,"The Motley Fool - 2 of the Best TSX Stocks to Invest $1,000 in Right Now"
fin_news_nlp/yahoo_cad_tickers_news,https://ca.finance.yahoo.com/news/ugp-pba-better-value-stock-154003096.html,UGP vs. PBA: Which Stock Is the Better Value Option?,CAD,PPL.TO,Zacks - UGP or PBA: Which Is the Better Value Stock Right Now?
fin_news_nlp/yahoo_cad_tickers_news,https://ca.finance.yahoo.com/news/8-8-percent-dividend-stock-150000395.html,Here’s a top Canadian monthly dividend stock that can help your high passive income for years to come. The post This 8.8 Percent Dividend Stock Pays Cash Every Month appeared first on The Motley Fool Canada.,CAD,SIA.TO,The Motley Fool - This 8.8 Percent Dividend Stock Pays Cash Every Month
fin_news_nlp/yahoo_cad_tickers_news,https://ca.finance.yahoo.com/news/snc-lavalin-providing-emergency-management-114500615.html,"SNC-Lavalin (TSX: SNC), a fully integrated professional services and project management company with offices around the world, was awarded a Public Assistance Grant Management Services contract by the State of Florida's Division of Emergency Management (FDEM) to aid response to Hurricane Ian. The Company is managing disaster relief funding to help the community respond, recover and mitigate against future hazards.",CAD,SNC.TO,CNW Group - SNC-Lavalin Providing Emergency Management Assistance to communities in Florida in response to Hurricane Ian
fin_news_nlp/yahoo_cad_tickers_news,https://ca.finance.yahoo.com/news/want-1-000-per-quarter-163000783.html,"Are you looking to earn $1,000 in passive income each quarter? These two TSX dividend stocks can help you achieve your goal. The post Want $1,000 Per Quarter in Passive Income? 2 TSX Stocks That Do the Job appeared first on The Motley Fool Canada.",CAD,TRP.TO,"The Motley Fool - Want $1,000 Per Quarter in Passive Income? 2 TSX Stocks That Do the Job"
fin_news_nlp/yahoo_cad_tickers_news,https://ca.finance.yahoo.com/news/canyon-creek-licensing-agreement-182800590.html,"Canyon Creek Food Company Ltd., (""Canyon Creek"" or ""the Company"") (TSXV: CYF), a North American food processor, focused on the preparation, sale and distribution of high quality, natural, preservative-free, fresh soups, and other food products.",CAD,CYF.V,CNW Group - CANYON CREEK NEW LICENSING AGREEMENT
fin_news_nlp/yahoo_cad_tickers_news,https://ca.finance.yahoo.com/news/field-trip-health-wellness-obtains-181300860.html,"TORONTO, March 22, 2023 (GLOBE NEWSWIRE) -- Field Trip Health & Wellness Ltd. (TSX-V: FTHW) (“Field Trip” or the “Company”) today announced that it has obtained an Order (the “Initial Order”) for creditor protection from the Ontario Superior Court of Justice (Commercial List) (the “Court”) under the Companies’ Creditors Arrangement Act (the “CCAA”). PricewaterhouseCoopers Inc. has been appointed as the CCAA monitor (the “Monitor”). After careful consideration of the Company’s cash position and a",CAD,FTHW.V,GlobeNewswire - Field Trip Health & Wellness Obtains CCAA Protection
fin_news_nlp/yahoo_cad_tickers_news,https://ca.finance.yahoo.com/news/giga-metals-partners-mitsubishi-develop-170000205.html,"Vancouver, British Columbia--(Newsfile Corp. - March 22, 2023) - Giga Metals Corp. (TSXV: GIGA) (OTCQX: HNCKF) - Giga Metals has partnered with Mitsubishi Corp to develop a giant nickel and cobalt deposit. Mitsubishi chose Giga Metals after evaluating 26 nickel projects, and has the capability to build the mine, which is estimated to cost $1.5-$2 billion.If you cannot view the video above, please visit:https://www.b-tv.com/post/tsxv-giga-ceo-clips-giga-metals-partners-with-mitsubishi-to-develop-",CAD,GIGA.V," - Giga Metals: Partners with Mitsubishi to Develop Nickel & Cobalt, CEO Clips Video"
fin_news_nlp/yahoo_cad_tickers_news,https://ca.finance.yahoo.com/news/leading-edge-materials-reports-quarterly-180000405.html,"LEADING EDGE MATERIALS REPORTS QUARTERLY RESULTS TO JANUARY 31, 2023 Vancouver, March 22, 2023 – Leading Edge Materials Corp. (“Leading Edge Materials” or the “Company”) (TSXV: LEM) (Nasdaq First North: LEMSE) (OTCQB: LEMIF) (FRA: 7FL) first quarter results for the period ending January 31, 2023. All references to dollar amounts in this release are in Canadian dollars. Highlights During and After the Quarter During the three months ended January 31, 2023: On November 3, 2022, the Company also gr",CAD,LEM.V,"GlobeNewswire - Leading Edge Materials Reports Quarterly Results to January 31, 2023"
fin_news_nlp/yahoo_cad_tickers_news,https://ca.finance.yahoo.com/news/tru-precious-metals-announces-2q-191018881.html,TRU Precious Metals CEO Joel Freudman joins Proactive's Natalie Stoberman to share more details of the company's second-quarter exploration plans.,CAD,TRU.V, - TRU Precious Metals announces 2Q exploration plans for Golden Rose Project
fin_news_nlp/yahoo_cad_tickers_news,https://ca.finance.yahoo.com/news/trustbix-inc-announces-tsx-venture-182900725.html,"Edmonton, Alberta--(Newsfile Corp. - March 22, 2023) - TrustBIX Inc. (TSXV: TBIX) (OTCQB: TBIXF) (""TrustBIX"" or the ""Company"") is pleased to announce receipt from the TSX Venture Exchange for the fourth and final tranche (the ""Fourth Tranche"") of the non-brokered private placement financing (""Private Placement"") announced on January 31, 2023 for up to 14,285,714 common shares and upsized on March 1, 2023 to 28,571,428 common shares in the capital of the Company (""Common Shares"") at ...",CAD,TBIX.V,Newsfile - TrustBIX Inc. Announces TSX Venture Exchange Approval for Fourth and Final Tranche of Previously Announced Private Placement
fin_news_nlp/yahoo_cad_tickers_news,https://ca.finance.yahoo.com/news/ucore-rare-metals-commissioning-process-184923836.html,"Ucore Rare Metals CEO Pat Ryan joined Proactive's Steve Darling to share news the company is currently commissioning a Demonstration Plant in Kingston, Ontario designed to show the advantages of it...",CAD,UCU.V," - Ucore Rare Metals commissioning process continues for Kingston, Ontario RapidSX Demonstration Plant"
fin_news_nlp/yahoo_cad_tickers_news,https://ca.finance.yahoo.com/news/bank-canada-didn-t-debate-175309797.html,"(Bloomberg) -- Bank of Canada officials didn’t actively consider raising interest rates in early March and were “comfortable” that inflation would slow further despite some stronger-than-expected economic data, according to a summary of their discussions. Most Read from BloombergBomb Threat Called In to New York Court Where Trump Hearing HeldFed Caught Between Inflation and Bank CrisisA New Chapter of Capitalism Emerges From the Banking CrisisFinally, a Serious Offer to Take Putin Off Russia’s H",CAD,BMO.TO,Bloomberg - Bank of Canada Didn’t Debate Hiking Interest Rates in March
fin_news_nlp/yahoo_cad_tickers_news,https://ca.finance.yahoo.com/news/3-bank-stocks-d-buy-180000047.html,Bank stocks like Bank of Montreal can add some much needed dividend income to your portfolio. The post 3 Bank Stocks I’d Buy on the Dip appeared first on The Motley Fool Canada.,CAD,BMO.TO,The Motley Fool - 3 Bank Stocks I’d Buy on the Dip
fin_news_nlp/yahoo_cad_tickers_news,https://ca.finance.yahoo.com/news/oil-holds-onto-gains-federal-183527025.html,"(Bloomberg) -- Oil rose to settle above $70 a barrel for the first time in a week, bolstered by bullish export data and a lack of surprises from the Federal Reserve.Most Read from BloombergBomb Threat Called In to New York Court Where Trump Hearing HeldFed Caught Between Inflation and Bank CrisisA New Chapter of Capitalism Emerges From the Banking CrisisFinally, a Serious Offer to Take Putin Off Russia’s HandsXi Aligns With Putin Against US, But Hesitates on Gas DealExports of crude and refined",CAD,CM.TO,"Bloomberg - Oil Rises as Export Data Shows Solid Demand, Fed Stays on Script"
fin_news_nlp/yahoo_cad_tickers_news,https://ca.finance.yahoo.com/news/2-under-radar-canadian-banks-180000953.html,I’m looking to snatch up undervalued and underrated bank stocks like Laurentian Bank (TSX:LB) in the final weeks of March. The post 2 Under-the-Radar Canadian Banks I’m Buying While the Buying Is This Good appeared first on The Motley Fool Canada.,CAD,CWB.TO,The Motley Fool - 2 Under-the-Radar Canadian Banks I’m Buying While the Buying Is This Good
fin_news_nlp/yahoo_cad_tickers_news,https://ca.finance.yahoo.com/news/3-value-stocks-smart-investors-180000867.html,"You get it all with these stable stocks. They may have less growth now, but will have incredibly high growth in 2023 and beyond. The post 3 Value Stocks That Smart Investors Should Seriously Consider appeared first on The Motley Fool Canada.",CAD,CSU.TO,The Motley Fool - 3 Value Stocks That Smart Investors Should Seriously Consider
fin_news_nlp/yahoo_cad_tickers_news,https://ca.finance.yahoo.com/news/5-best-stocks-buy-now-170000423.html,"While the market is facing headwinds and many companies are trading at steep discounts, here are five of the best stocks to buy now. The post 5 Best Stocks to Buy Now for Long-Term Investors appeared first on The Motley Fool Canada.",CAD,DOL.TO,The Motley Fool - 5 Best Stocks to Buy Now for Long-Term Investors
fin_news_nlp/yahoo_cad_tickers_news,https://ca.finance.yahoo.com/news/2-tsx-stocks-benefit-weak-173000775.html,Nutrien (TSX:NTR) and CN Rail (TSX:CNR) stocks are well equipped to capitalize on recent loonie headwinds. The post 2 TSX Stocks That Benefit From a Weak Canadian Dollar appeared first on The Motley Fool Canada.,CAD,NTR.TO,The Motley Fool - 2 TSX Stocks That Benefit From a Weak Canadian Dollar
fin_news_nlp/yahoo_cad_tickers_news,https://ca.finance.yahoo.com/news/2-best-canadian-dividend-stocks-183000817.html,Here are two of the best Canadian dividend stocks you can buy on a dip in March 2023 to hold for the long term. The post 2 of the Best Canadian Dividend Stocks I’d Buy Before March 2023 Ends appeared first on The Motley Fool Canada.,CAD,TRP.TO,The Motley Fool - 2 of the Best Canadian Dividend Stocks I’d Buy Before March 2023 Ends
fin_news_nlp/yahoo_cad_tickers_news,https://ca.finance.yahoo.com/news/argentina-lithium-engages-investor-relations-195400712.html,"Argentina Lithium & Energy Corp. (TSXV: LIT) (FSE: OAY3) (OTC: PNXLF), (""Argentina Lithium"" or the ""Company"") wishes to announce that it has engaged Michael Baybak and Company, Inc. (the ""Consultant"") to assist with marketing services. The services consist primarily of writing services, but may include additional marketing services that constitute ""investor relations activities"". Pursuant to the terms of the consulting agreement between the Company and the Consultant dated November 23, 2022, in",CAD,LIT.V,CNW Group - Argentina Lithium Engages Investor Relations Consultant
fin_news_nlp/yahoo_cad_tickers_news,https://ca.finance.yahoo.com/news/canyon-creek-licensing-agreement-182800702.html,"Canyon Creek Food Company Ltd., (""Canyon Creek"" or ""the Company"") (TSXV: CYF), a North American food processor, focused on the preparation, sale and distribution of high quality, natural, preservative-free, fresh soups, and other food products.",CAD,CYF.V,CNW Group - CANYON CREEK NEW LICENSING AGREEMENT
fin_news_nlp/yahoo_cad_tickers_news,https://ca.finance.yahoo.com/news/cassiar-gold-announces-results-annual-203600258.html,"Calgary, Alberta--(Newsfile Corp. - March 22, 2023) - Cassiar Gold Corp. (TSXV: GLDC) (OTCQX: CGLCF) (the ""Company"") is pleased to announce the results of its Annual General Meeting of shareholders held on Wednesday, March 22, 2023 (the ""Meeting""). A total of 10,333,427 common shares were represented in person or by proxy at the Meeting, representing 12.57% of the Company's issued and outstanding common shares. All directors nominated as listed in the Management Information Circular ...",CAD,GLDC.V,Newsfile - Cassiar Gold Announces Results of Annual General Meeting of Shareholders
fin_news_nlp/yahoo_cad_tickers_news,https://ca.finance.yahoo.com/news/pool-safe-announces-stock-options-201500318.html,"Toronto, Ontario--(Newsfile Corp. - March 22, 2023) - Pool Safe Inc. (TSXV: POOL) (""Pool Safe"" or the ""Company"") announces that it has granted up to an aggregate amount of 3,400,000 stock options (the ""Options"") to certain directors, officers, employees, and consultants of the Company pursuant to its amended omnibus incentive plan which was approved by the shareholders of the Company on February 28, 2023. This issuance of Options has two separate vesting terms, one ...",CAD,POOL.V,Newsfile - Pool Safe Announces Stock Options and RSU Grants
