source,url,description,country,company,title
fin_news_nlp/yahoo_cad_tickers_news,https://ca.finance.yahoo.com/news/well-health-announces-support-ontario-120000373.html,"WELL Health Technologies Corp. (TSX: WELL) (OTCQX: WHTCF) (""WELL"" or the ""Company""), is pleased to announce its support for the Government of Ontario's recent plan to expand the delivery of OHIP-covered healthcare services through existing healthcare clinics in Ontario.",CAD,WELL.TO,CNW Group - WELL Health Announces Support of Ontario Government Initiatives to Reduce Wait Times
fin_news_nlp/yahoo_cad_tickers_news,https://ca.finance.yahoo.com/news/01-communique-releases-worlds-first-130000026.html,"01 Communique Laboratory Inc. (the ""Company"") (TSXV:ONE)(OTCQB:OONEF), a first-to-market, enterprise level cybersecurity provider just upgraded its I'm InTouch remote access service - I'm InTouch v11.",CAD,ONE.V,ACCESSWIRE - 01 Communique Releases World's First Quantum-Safe  Secure Remote Access
fin_news_nlp/yahoo_cad_tickers_news,https://ca.finance.yahoo.com/news/alx-resources-corp-provides-quebec-123000629.html,"Vancouver, British Columbia--(Newsfile Corp. - February 7, 2023) - ALX Resources Corp. (TSXV: AL) (FSE: 6LLN) (OTC: ALXEF) (""ALX"" or the ""Company"") is pleased to provide an update on its recent lithium exploration activities in the James Bay Region of the Province of Quebec, Canada.On January 31, 2023, the Company received a report from its geological contractor, Dahrouge Geological Consulting of Montreal, QC, on the results of a reconnaissance prospecting program completed in October 2022 at th",CAD,AL.V,Newsfile - ALX Resources Corp. Provides Quebec Lithium Projects Exploration Update and Reports Acquisition by Staking of Python Lithium Showing
fin_news_nlp/yahoo_cad_tickers_news,https://ca.finance.yahoo.com/news/arch-scientist-awarded-cihr-grant-120500801.html,"TORONTO, Feb. 07, 2023 (GLOBE NEWSWIRE) -- Today, Arch Biopartners Inc., (“Arch” or the “Company”) (TSX Venture: ARCH and OTCQB: ACHFF), a clinical stage company focused on the development of innovative technologies and novel therapeutics targeting organ inflammation, announced that an Arch scientist at the University of Calgary was awarded a Canadian Institute of Health Resources (CIHR) Project Grant worth $1,109,250 to further study the role of dipeptidase-1 (DPEP-1) in renal inflammation and",CAD,ARCH.V,GlobeNewswire - Arch Scientist Awarded CIHR Grant to Study the Role of Dipeptidase-1 in Chronic Kidney Disease
fin_news_nlp/yahoo_cad_tickers_news,https://ca.finance.yahoo.com/news/presenting-emerging-growth-conference-february-120000393.html,"MIAMI, Feb. 07, 2023 (GLOBE NEWSWIRE) -- EmergingGrowth.com a leading independent small cap media portal announces the schedule of the 49th Emerging Growth Conference on February 8, 2022. The Emerging Growth Conference identifies companies in a wide range of growth sectors, with strong management teams, innovative products & services, focused strategy, execution, and the overall potential for long-term growth. Register for the conference here. Submit Questions for any of the presenting companies",CAD,LIT.V,GlobeNewswire - Presenting on the Emerging Growth Conference on February 8 Register Now
fin_news_nlp/yahoo_cad_tickers_news,https://ca.finance.yahoo.com/news/atex-intersects-0-63-cueq-120000791.html,"Toronto, Ontario--(Newsfile Corp. - February 7, 2023) - ATEX Resources Inc. (TSXV: ATX) (""ATEX"" or the ""Company"") is pleased to announce results from drill hole ATXD-11A during Phase III of its drill campaign at the Valeriano Copper-Gold Project (""Valeriano"" or the ""Project"") located in Atacama Region, Chile. Highlights include:ATXD-11A returned 1,270 metres grading 0.63% Copper Equivalent ""CuEq"" (0.43% Cu, 0.21 g/t Au, 52 ppm Mo) ending in mineralization at 2,130 metres ...",CAD,ATX.V,"Newsfile - ATEX Intersects 0.63% CuEq over 1,270m Extending the High-Grade Porphyry Trend 200 Metres to the Northeast"
fin_news_nlp/yahoo_cad_tickers_news,https://ca.finance.yahoo.com/news/strong-financial-prospects-force-driving-105203151.html,Almadex Minerals' (CVE:DEX) stock is up by a considerable 27% over the past three months. Given the company's...,CAD,AMZ.V,Simply Wall St. - Are Strong Financial Prospects The Force That Is Driving The Momentum In Almadex Minerals Ltd.'s CVE:DEX) Stock?
fin_news_nlp/yahoo_cad_tickers_news,https://ca.finance.yahoo.com/news/blue-star-gold-provides-positive-130000374.html,"Vancouver, British Columbia--(Newsfile Corp. - February 7, 2023) - Blue Star Gold Corp. (TSXV: BAU) (OTCQB: BAUFF) (FSE: 5WP0) (""Blue Star"" or the ""Company"") announces the results of preliminary metallurgical testing conducted on the Gnu (Nutaaq) Zone on the Ulu Gold Project (the ""Project""), located in the west Kitikmeot Region of Nunavut, Canada. HighlightsPreliminary testing indicates 92-94% gold extraction with conventional methodologyMore than 30% of the gold is expected to occur as gravity",CAD,BAU.V,Newsfile - Blue Star Gold Provides Positive Results of Preliminary Metallurgy Study on the Gnu (Nutaaq) Zone Mineralisation
fin_news_nlp/yahoo_cad_tickers_news,https://ca.finance.yahoo.com/news/builddirect-subsidiary-signs-us-500-130000379.html,"BuildDirect.com Technologies Inc. (TSXV: BILD) (""BuildDirect"" or the ""Company""), a leading omnichannel building material retailer, is pleased to announce that the Company's wholly-owned U.S. subsidiary, FloorSource Wholesale & Supply (""FloorSource"") has signed an approximately US$500,000 contract (the ""Contract"") with a U.S. real estate investment firm (the ""Customer"") in connection with a luxury multi-family real estate project in Michigan, United States, that is currently in development (the """,CAD,BILD.V,"CNW Group - BuildDirect Subsidiary Signs US$500,000 Contract with U.S. Real Estate Investment Firm"
fin_news_nlp/yahoo_cad_tickers_news,https://ca.finance.yahoo.com/news/ce-brands-announces-management-changes-123000026.html,"CALGARY, Alberta, Feb. 07, 2023 (GLOBE NEWSWIRE) -- CE Brands Inc. (TSXV: CEBI; CEBI.WT) (“CE Brands”, “we”, “our”, or the “Company”), a data-driven consumer-electronics company, today announced the departure of Craig Smith, as Chief Executive Officer, effective immediately. In light of Mr. Smith’s departure, the Board has appointed Kalvie Legat, presently the Executive Vice President, Head of Business Development of the Company, as interim Chief Executive Officer. Mr. Smith remains a director a",CAD,CEBI.V,"GlobeNewswire - CE Brands Announces Management Changes and Appointment of Interim CEO, Chief Product Officer and Chief Operating Officer"
fin_news_nlp/yahoo_cad_tickers_news,https://ca.finance.yahoo.com/news/ceylon-graphite-announces-amended-restated-123000192.html,"Vancouver, BC, Feb. 07, 2023 (GLOBE NEWSWIRE) -- Ceylon Graphite Corp. (“Ceylon Graphite” or the “Company”) (TSX-V: CYL) (OTC: CYLYF) (FSE: CCY) today announced that it has entered into an amended and restated agreement dated February 4, 2023 (the “Restated Agreement”) with a private vendor (the “Vendor”) based in Sri Lanka to amend and restate the terms of a purchase agreement dated September 12, 2012 , as amended (the “Initial Agreement”), whereby the Company’s wholly owned subsidiary incorpor",CAD,CYL.V,GlobeNewswire - Ceylon Graphite Announces Amended and Restated Agreement For Acquisition of Sarcon Development
fin_news_nlp/yahoo_cad_tickers_news,https://ca.finance.yahoo.com/news/char-appoints-chief-operating-officer-123000849.html,"TORONTO, Feb. 07, 2023 (GLOBE NEWSWIRE) -- CHAR Technologies Ltd. (“CHAR” or the “Company”) (TSX Venture Exchange: YES) is pleased to announce that Robert Sinyard has been appointed Chief Operating Officer of the Company, effective February 7th, 2023. In his new role, Sinyard will oversee corporate operations and sales, and will take responsibility for spearheading profitable growth and business objectives for the Company. His unique strategic and tactical experience in the energy, materials tes",CAD,YES.V,GlobeNewswire - CHAR Appoints Chief Operating Officer
fin_news_nlp/yahoo_cad_tickers_news,https://ca.finance.yahoo.com/news/global-leader-human-capital-management-125800937.html,"Near Decade Customer Renews for 3 YearsARLINGTON, Va., Feb. 07, 2023 (GLOBE NEWSWIRE) -- Edge Total Intelligence Inc. (“edgeTI”, “Edge Technologies”) (TSXV:CTRL; OTC: UNFYF; FSE:Q5i), a leader in real-time digital operations solutions, is pleased to announce a three-year renewal in the HCM Services and Outsourcing Segment. “Our connection with this global Human Capital Management Leader began almost a decade ago with our first products,” said Nicholas Brigman, edgeTI’s VP of Products. “Three pro",CAD,CTRL.V,GlobeNewswire - Global Leader in Human Capital Management (HCM) Renews and Modernizes its IT Observability with edgeTI
fin_news_nlp/yahoo_cad_tickers_news,https://ca.finance.yahoo.com/news/fobi-signs-260-000-annual-130000418.html,"VANCOUVER, B.C., Feb. 07, 2023 (GLOBE NEWSWIRE) -- Fobi AI Inc. (FOBI:TSXV) (FOBIF: OTCQB) (the “Company” or “FOBI”), an industry leader in harnessing AI and data intelligence to enable digital transformation, is pleased to announce that the company’s annual contract with one of the world's leading insurance providers has automatically renewed. Fobi will earn $260,000 in revenue as per the contract’s annual renewable terms. Revenue will be recognized throughout the 12-month term in accordance wi",CAD,FOBI.V,"GlobeNewswire - Fobi Signs $260,000 Annual License Renewal With Leading Global Insurance Provider To Deliver Digital Proof Of Insurance For Europe"
fin_news_nlp/yahoo_cad_tickers_news,https://ca.finance.yahoo.com/news/forum-energy-metals-traction-uranium-130000164.html,"10,528 Hectares situated along the east-northeast trending Grease River Structure south of Lake Athabasca near the Fond Du Lac Uranium Deposit Vancouver, British Columbia--(Newsfile Corp. - February 7, 2023) - Forum Energy Metals Corp. (TSXV: FMC) (OTCQB: FDCFF) (the ""Company"" or ""Forum"") is pleased to announce that it has entered into a property option agreement with Traction Uranium Corp. (""Traction""), pursuant to which Traction has the right, at its option, to acquire up to a ...",CAD,FMC.V,Newsfile - Forum Energy Metals and Traction Uranium Enter into an Option Agreement for the Grease River Property in the Athabasca Basin
fin_news_nlp/yahoo_cad_tickers_news,https://ca.finance.yahoo.com/news/gfi-announces-launch-sprouts-farmers-130000263.html,"Global Food and Ingredients Ltd. (TSXV: PEAS) (OTCQX: PEASF) (""GFI"" or the ""Company""), is pleased to announce its national retail launch into Sprouts Farmers Market in the United States for the Company's Yofiit brand. Sprouts is one of the largest and fastest growing specialty retailers of fresh, natural and organic food in the United States, with roughly 380 stores across 23 states.",CAD,PEAS.V,CNW Group - GFI ANNOUNCES LAUNCH AT SPROUTS FARMERS MARKET
fin_news_nlp/yahoo_cad_tickers_news,https://ca.finance.yahoo.com/news/goldshore-hosts-townhall-summit-2023-120000909.html,"Vancouver, British Columbia--(Newsfile Corp. - February 7, 2023) - Goldshore Resources Inc. (TSXV: GSHR) (OTCQB: GSHRF) (FSE: 8X00) (""Goldshore"" or the ""Company""), is pleased to announce that it is hosting a townhall summit on Tuesday February 14, 2023 at 10:00 AM EST.Participants are able to register for the summit here: Goldshore Townhall Summit RegistrationBrett Richards will be your host at the summit, and he will be highlighting the 2023 activities at the Moss Lake ...",CAD,GSHR.V,Newsfile - Goldshore Hosts Townhall Summit On 2023 Moss Lake Gold Project Activities and Catalysts
fin_news_nlp/yahoo_cad_tickers_news,https://ca.finance.yahoo.com/news/graphite-one-confirms-significant-graphite-120000825.html,"Graphite One Inc. (TSXV: GPH) (OTCQX: GPHOF) (""Graphite One"", ""G1"" or the ""Company""), planning a complete domestic U.S. supply chain for advanced graphite materials, is pleased to announce drill results from its 2022 Field Program at its Graphite Creek Property (""Graphite Creek"" or the ""Property""), located in the Kigluaik Mountains on the Seward Peninsula approximately 60 kilometers (37 miles) north of Nome, Alaska. Graphite Creek is living up to its designation by the US Geological Survey as th",CAD,GPH.V,CNW Group - Graphite One Confirms that Significant Graphite Grade Continues 4 Kilometers from PFS Pit Boundary
fin_news_nlp/yahoo_cad_tickers_news,https://ca.finance.yahoo.com/news/kutcho-copper-progress-2022-plans-130000351.html,"VANCOUVER, British Columbia, Feb. 07, 2023 (GLOBE NEWSWIRE) -- Kutcho Copper Corp. (TSXV: KC) (OTC: KCCFF) (“Kutcho Copper” or the “Company”) is pleased to provide a review of its accomplishments in 2022 and look forward to the next steps planned for 2023 at its feasibility stage, high-grade copper-zinc development project located in north-western British Columbia. “Kutcho Copper finished 2022 with several fundamental accomplishments, most notably the debt restructuring with Wheaton Precious Met",CAD,KC.V,GlobeNewswire - Kutcho Copper Update on Progress in 2022 and Plans for 2023
fin_news_nlp/yahoo_cad_tickers_news,https://ca.finance.yahoo.com/news/leveljump-healthcare-corp-establishes-day-130000902.html,"Toronto, Ontario--(Newsfile Corp. - February 7, 2023) - LevelJump Healthcare Corp. (TSXV: JUMP) (OTCQB: JMPHF) (FSE: 75J) (""LevelJump"" or the ""Company""), a Canadian leader in B2B telehealth solutions, is pleased to announce that its wholly owned subsidiary Canadian Teleradiology Services, Inc. (""CTS"") has established a new daytime radiology reading group.CTS has established a new daytime teleradiology reading group to provide radiologist reporting for clinical work. This service provides radiolo",CAD,JUMP.V,Newsfile - LevelJump Healthcare Corp. Establishes New Day Clinic Teleradiology Group: Revenue Growth
fin_news_nlp/yahoo_cad_tickers_news,https://ca.finance.yahoo.com/news/lucky-minerals-discovers-gold-initial-123000526.html,"Lucky Minerals Inc. (TSXV:LKY)(OTC PINK:LKMNF)(FRA:LKY)(""Lucky"" or the ""Company"") is pleased to announce that it has discovered large intersections of gold mineralization in the initial stage of its ongoing drill program at the Wayka Project.",CAD,LKY.V,ACCESSWIRE - Lucky Minerals Discovers Gold in the Initial 384 Metres of Drilling at Wayka
fin_news_nlp/yahoo_cad_tickers_news,https://ca.finance.yahoo.com/news/mako-mining-announces-director-resignation-120000945.html,"Mako Mining Corp. (TSXV:MKO)(OTCQX:MAKOF) (""Mako"" or the ""Company"") announces that, further to the Company's announcement of the appointment of Mr. Brian Szeto to the board of directors (""BoD"") on January 23, 2023, Mr. Szeto has resigned as a director of the Company as a result of a recent change to his current employer's compliance policies.",CAD,MKO.V, - Mako Mining Announces Director Resignation
fin_news_nlp/yahoo_cad_tickers_news,https://ca.finance.yahoo.com/news/maple-gold-appoints-paul-harbidge-123000214.html,"Vancouver, British Columbia--(Newsfile Corp. - February 7, 2023) - Maple Gold Mines Ltd. (TSXV: MGM) (OTCQB: MGMLF) (FSE: M3G) (""Maple Gold"" or the ""Company"") is pleased to announce the appointment of Paul Harbidge to its technical committee (the ""Technical Committee""), which helps guide exploration, drilling and project management at the Company's projects located in Québec, Canada, and to provide an update on the ongoing deep drilling programs at the Douay Gold Project (""Douay"") and ...",CAD,MGM.V,Newsfile - Maple Gold Appoints Paul Harbidge to Its Technical Committee and Provides Deep Drilling Update
fin_news_nlp/yahoo_cad_tickers_news,https://ca.finance.yahoo.com/news/midland-completes-magnetic-survey-mythril-123000711.html,"Figure 1 JB Lithium Prospects and MD Projects Figure 2 Mythril Regional Project Lithium Potential Figure 3 MD- Patriot New Lithium Discovery Figure 4 Mythril - East Mag HR with Potential Favorable Area MONTREAL, Feb. 07, 2023 (GLOBE NEWSWIRE) -- Midland Exploration Inc. (“Midland” or the “Corporation”) (TSX-V:MD) is pleased to report the completion of high-resolution magnetic surveys (“HR Mag”) on its wholly owned properties grouped under the Mythril Regional project. These properties include th",CAD,MD.V,GlobeNewswire - Midland Completes a Magnetic Survey on Mythril-East and Targets a New Area East of Patriot Battery Metals Discovery
fin_news_nlp/yahoo_cad_tickers_news,https://ca.finance.yahoo.com/news/montfort-capital-sees-significant-growth-130000192.html,"Montfort Capital Corporation (""Montfort"" or the ""Company"") (TSXV: MONT) (OTCQB: MONTF), a leading alternative lender utilizing focused strategies, experienced management teams and advanced technology, is providing selected preliminary unaudited results for its fiscal year ended December 31, 2022. Montfort is pleased to report that its Assets Under Management and Administration (""AUMA"") have grown to $492 million as at December 31, 2022 from $149 million in AUMA and $125 million in total assets a",CAD,MONT.V,CNW Group - Montfort Capital Sees Significant Growth in 2022 in its Assets Under Management and Administration
fin_news_nlp/yahoo_cad_tickers_news,https://ca.finance.yahoo.com/news/moovly-integrates-chatgpt-functionality-enabling-120000076.html,"Vancouver, British Columbia--(Newsfile Corp. - February 7, 2023) - Moovly Media Inc. (TSXV: MVY) (OTCQB: MVVYF) (FSE: 0PV2) (""Moovly"" or the ""Company"") is pleased to announce a major breakthrough in video creation technology, integrating the Moovly platform with OpenAI GPT-3 to bring customers next generation AI (Artificial Intelligence) capabilities. As ChatGPT uses natural language processing and GPT-3 technology to generate texts from user input, it can also create scripts for video content w",CAD,MVY.V,Newsfile - Moovly Integrates ChatGPT Functionality Enabling AI-Based Video Content Creation
fin_news_nlp/yahoo_cad_tickers_news,https://ca.finance.yahoo.com/news/murchison-minerals-intersects-277-3-130000292.html,"Murchison Minerals Ltd. (""Murchison"" or the ""Company"") (TSXV:MUR)(OTCQB:MURMF) is pleased to announce assay results from the diamond drillholes completed at the Syrah Target as part of the 2022 Summer Exploration Program on the 100% - owned HPM (Haut-Plateau de la Manicouagan) Project, located in Quebec.",CAD,MUR.V,ACCESSWIRE - Murchison Minerals Intersects 277.3 Metres of Nickel-Bearing Sulphide Mineralization at the Syrah Target and Confirms Grades of 5.01% NiEq or 16.25% CuEq at the Lac Paradis Prospect
fin_news_nlp/yahoo_cad_tickers_news,https://ca.finance.yahoo.com/news/nevada-king-initiates-phase-metallurgical-123000397.html,"Nevada King Gold Corp. (TSXV: NKG) (OTCQX: NKGFF) (""Nevada King"" or the ""Company"") is pleased to announce that it is initiating Phase I metallurgical testing on bulk samples and diamond drill core drilled in 2022 at its Atlanta Gold Mine Project located 264km northeast of Las Vegas, Nevada, in the prolific Battle Mountain Trend.",CAD,NKG.V,CNW Group - NEVADA KING INITIATES PHASE I METALLURGICAL TESTWORK PROGRAM AT ITS 100%-OWNED ATLANTA OXIDE GOLD MINE PROJECT
fin_news_nlp/yahoo_cad_tickers_news,https://ca.finance.yahoo.com/news/plurilock-receives-cross-sale-purchase-120000375.html,"The cross-sale order for the company's high margin software offering was secured through the existing client network of Plurilock's Aurora Systems Vancouver, British Columbia--(Newsfile Corp. - February 7, 2023) - Plurilock Security Inc. (TSXV: PLUR) (OTCQB: PLCKF) and related subsidiaries (""Plurilock"" or the ""Company""), an identity-centric cybersecurity solutions provider for workforces, is pleased to announce that Plurilock received a purchase order for the Company's flagship software platform",CAD,PLUR.V,Newsfile - Plurilock Receives Cross-Sale Purchase Order for Flagship Cybersecurity Platform from U.S. Financial Institution
fin_news_nlp/yahoo_cad_tickers_news,https://ca.finance.yahoo.com/news/2023-drill-program-progress-120000416.html,"Drilling to focus on continued resource expansion, and a renewed focus on known early-stage exploration targets Figure 1 Los Reyes Main Deposits and Generative exploration targets VANCOUVER, British Columbia, Feb. 07, 2023 (GLOBE NEWSWIRE) -- Prime Mining Corp. (“Prime Mining” or the “Company”) (TSX-V: PRYM, OTCQX: PRMNF, Frankfurt: 04V3) is pleased to announce the details of its 2023 work program objectives and strategy at its Los Reyes high-grade oxide gold-silver deposit in Mexico. Chief Exec",CAD,PRYM.V,GlobeNewswire - 2023 Drill Program and Progress Update
fin_news_nlp/yahoo_cad_tickers_news,https://ca.finance.yahoo.com/news/quipt-home-medical-announces-date-123000842.html,"CINCINNATI, Feb. 07, 2023 (GLOBE NEWSWIRE) -- Quipt Home Medical Corp. (the “Company”) (NASDAQ: QIPT) (TSXV: QIPT), a U.S. based home medical equipment provider, focused on end-to-end respiratory care, today announced that it will host its Fiscal Q1 2023 earnings conference call and audio webcast on Tuesday, February 14, 2023 at 10:00 a.m. (EST). Conference Call Details: Tuesday, February 14, 2023 at 10:00 a.m. (EST). Canada/US Toll Free:1 (800) 319 4610International:1 (604) 638 5340 Audio Webca",CAD,QIPT.V, - Quipt Home Medical Announces Date and Time for Fiscal Q1 2023 Conference Call and Audio Webcast
fin_news_nlp/yahoo_cad_tickers_news,https://ca.finance.yahoo.com/news/snipp-gaming-platform-gambit-rewards-120000233.html,"Loyalty Gaming pioneer, Gambit Rewards, Inc. (Gambit), announced a partnership with an emerging leader in combat sports, Bare Knuckle Fighting Club, Inc. (BKFC). Founded in 2018, BKFC is the first regulator-approved bare knuckle fighting league in history. The company hosts over 40 events annually and has more than 25 million followers across 60 countries.",CAD,SPN.V,"ACCESSWIRE - Snipp Gaming Platform, Gambit Rewards, Partners with Emerging Leader in Combat Sporting Events, the BKFC"
fin_news_nlp/yahoo_cad_tickers_news,https://ca.finance.yahoo.com/news/soma-achieves-record-gold-production-121500865.html,"Soma Gold Corp. (TSXV: SOMA) (WKN: A2P4DU) (OTC: SMAGF) (the ""Company"" or ""Soma"") is pleased to announce that gold production in January 2023, at its 100% owned, El Bagre, Colombia, gold mine, set a new monthly record of 2,680 AuEq ounces. Production was 24% ahead of the January 2023 budget of 2,166 AuEq ounces and 47% ahead of the production for the same period last year. Full-year production for 2023 is planned to be 35,500 ounces.",CAD,SOMA.V,"CNW Group - SOMA ACHIEVES RECORD GOLD PRODUCTION OF 2,680 AuEq OUNCES IN JANUARY 2023"
fin_news_nlp/yahoo_cad_tickers_news,https://ca.finance.yahoo.com/news/sonoro-gold-reports-updated-mineral-123000297.html,"VANCOUVER, BC, Feb. 07, 2023 (GLOBE NEWSWIRE) -- Sonoro Gold Corp. (TSXV: SGO | OTCQB: SMOFF | FRA: 23SP) (“Sonoro” or the “Company”) is pleased to announce an updated Mineral Resource Estimate (“MRE”) for the Cerro Caliche gold project in Sonora, Mexico. The MRE has been prepared by SRK Consulting (U.S.) Inc. (SRK) in accordance with the requirements of National Instrument 43-101 and is based on a total 59,500 meters of drilled data including 544 drill holes, 17 trenches and assays for 57,500 m",CAD,SGO.V,GlobeNewswire - SONORO GOLD REPORTS UPDATED MINERAL RESOURCE ESTIMATE AT CERRO CALICHE GOLD PROJECT
fin_news_nlp/yahoo_cad_tickers_news,https://ca.finance.yahoo.com/news/surge-copper-confirms-large-zinc-130000094.html,"Vancouver, British Columbia, Feb. 07, 2023 (GLOBE NEWSWIRE) -- Surge Copper Corp. (TSXV: SURG) (OTCQX: SRGXF) (Frankfurt: G6D2) (“Surge” or the “Company”) is pleased to announce complete assay results for 17 holes from the Company’s 100% owned Ootsa Property in British Columbia. Included are results from 2 holes testing exploration targets and 15 holes from the Seel Breccia East zone where the Company is expanding high-grade copper-silver breccia style mineralization and has identified a large a",CAD,SURG.V,GlobeNewswire - Surge Copper Confirms Large New Zinc-Silver-Gold-Lead Discovery at Ootsa Intersecting 138 metres of greater than 1% Zinc + Lead Mineralization with 8.1 g/t Silver
fin_news_nlp/yahoo_cad_tickers_news,https://ca.finance.yahoo.com/news/planting-hope-achieves-distribution-4-124500263.html,"/ The Planting Hope Company Inc. (TSXV:MYLK)(OTCQB:MYLKF)(FRA:J94) (""Planting Hope"" or the ""Company""), a plant-based food and beverage company focused on producing the world's most nutritious and planet-friendly products, is pleased to announce that RightRice® is being added to the assortments at 4,581 retail locations of a leading US pharmacy.",CAD,MYLK.V,"ACCESSWIRE - Planting Hope Achieves New Distribution in 4,581 Retail Locations Across the United States with RightRice(R) Veggie Rice"
fin_news_nlp/yahoo_cad_tickers_news,https://ca.finance.yahoo.com/news/trillium-gold-historical-core-sampling-120000614.html,"Figure 1 Map showing Trillium Gold's Confederation Belt project and all currently known gold occurrences. Blue colour represents gold values previously known, purple colour represents new information sourced from old reports and drill logs and red colour represents sampling done by Trillium. Green and light blue areas indicate areas of focus for upcoming work. Figure 2 Map showing location of historical drilling, CB22-001, and significant gold results in the Fly Lake area of the Confederation Be",CAD,TGM.V,GlobeNewswire - Trillium Gold’s Historical Core Sampling Highlights Potential for Confederation Belt’s Gold Endowment
